sd888_log/ww50/resnet50_v2.texture.float32.acc32.autotvm.log.tmp
{"input": ["opencl -keys=adreno,opencl,gpu -device=adreno -max_num_threads=256", "conv2d_nchwc_acc32.image2d", [["TENSOR", [1, 256, 14, 14, 4], "float32"], ["TENSOR", [512, 1024, 1, 1, 4], "float32"], [2, 2], [0, 0, 0, 0], [1, 1], "float32"], {}], "config": {"index": 60008, "code_hash": null, "entity": [["tile_fc", "sp", [-1, 4, 2]], ["tile_y", "sp", [-1, 1, 4]], ["tile_x", "sp", [-1, 1, 4]], ["tile_rcc", "sp", [-1, 64]], ["tile_ry", "sp", [-1, 1]], ["tile_rx", "sp", [-1, 1]], ["auto_unroll_max_step", "ot", 0], ["unroll_explicit", "ot", 1]]}, "result": [[0.006232809379999999], 0, 7.854983568191528, 1639249617.6349943], "version": 0.2, "tvm_version": "0.8.dev0"}
{"input": ["opencl -keys=adreno,opencl,gpu -device=adreno -max_num_threads=256", "conv2d_nchwc_acc32.image2d", [["TENSOR", [1, 256, 14, 14, 4], "float32"], ["TENSOR", [512, 1024, 1, 1, 4], "float32"], [2, 2], [0, 0, 0, 0], [1, 1], "float32"], {}], "config": {"index": 64664, "code_hash": null, "entity": [["tile_fc", "sp", [-1, 1, 64]], ["tile_y", "sp", [-1, 2, 1]], ["tile_x", "sp", [-1, 1, 2]], ["tile_rcc", "sp", [-1, 1]], ["tile_ry", "sp", [-1, 1]], ["tile_rx", "sp", [-1, 1]], ["auto_unroll_max_step", "ot", 512], ["unroll_explicit", "ot", 1]]}, "result": [[0.0031381604], 0, 11.064494371414185, 1639249620.8910987], "version": 0.2, "tvm_version": "0.8.dev0"}
{"input": ["opencl -keys=adreno,opencl,gpu -device=adreno -max_num_threads=256", "conv2d_nchwc_acc32.image2d", [["TENSOR", [1, 256, 14, 14, 4], "float32"], ["TENSOR", [512, 1024, 1, 1, 4], "float32"], [2, 2], [0, 0, 0, 0], [1, 1], "float32"], {}], "config": {"index": 33844, "code_hash": null, "entity": [["tile_fc", "sp", [-1, 2, 64]], ["tile_y", "sp", [-1, 4, 1]], ["tile_x", "sp", [-1, 1, 1]], ["tile_rcc", "sp", [-1, 2]], ["tile_ry", "sp", [-1, 1]], ["tile_rx", "sp", [-1, 1]], ["auto_unroll_max_step", "ot", 1500], ["unroll_explicit", "ot", 0]]}, "result": [[0.0026493583199999997], 0, 3.653538703918457, 1639249625.084049], "version": 0.2, "tvm_version": "0.8.dev0"}
{"input": ["opencl -keys=adreno,opencl,gpu -device=adreno -max_num_threads=256", "conv2d_nchwc_acc32.image2d", [["TENSOR", [1, 256, 14, 14, 4], "float32"], ["TENSOR", [512, 1024, 1, 1, 4], "float32"], [2, 2], [0, 0, 0, 0], [1, 1], "float32"], {}], "config": {"index": 19835, "code_hash": null, "entity": [["tile_fc", "sp", [-1, 8, 64]], ["tile_y", "sp", [-1, 2, 4]], ["tile_x", "sp", [-1, 2, 1]], ["tile_rcc", "sp", [-1, 4]], ["tile_ry", "sp", [-1, 1]], ["tile_rx", "sp", [-1, 1]], ["auto_unroll_max_step", "ot", 512], ["unroll_explicit", "ot", 0]]}, "result": [[0.010602272900000001], 0, 5.335145950317383, 1639249647.5982838], "version": 0.2, "tvm_version": "0.8.dev0"}
{"input": ["opencl -keys=adreno,opencl,gpu -device=adreno -max_num_threads=256", "conv2d_nchwc_acc32.image2d", [["TENSOR", [1, 256, 14, 14, 4], "float32"], ["TENSOR", [512, 1024, 1, 1, 4], "float32"], [2, 2], [0, 0, 0, 0], [1, 1], "float32"], {}], "config": {"index": 65107, "code_hash": null, "entity": [["tile_fc", "sp", [-1, 2, 8]], ["tile_y", "sp", [-1, 4, 2]], ["tile_x", "sp", [-1, 4, 2]], ["tile_rcc", "sp", [-1, 1]], ["tile_ry", "sp", [-1, 1]], ["tile_rx", "sp", [-1, 1]], ["auto_unroll_max_step", "ot", 512], ["unroll_explicit", "ot", 1]]}, "result": [[0.01862525], 0, 6.671521425247192, 1639249670.7210414], "version": 0.2, "tvm_version": "0.8.dev0"}
{"input": ["opencl -keys=adreno,opencl,gpu -device=adreno -max_num_threads=256", "conv2d_nchwc_acc32.image2d", [["TENSOR", [1, 256, 14, 14, 4], "float32"], ["TENSOR", [512, 1024, 1, 1, 4], "float32"], [2, 2], [0, 0, 0, 0], [1, 1], "float32"], {}], "config": {"index": 94906, "code_hash": null, "entity": [["tile_fc", "sp", [-1, 2, 32]], ["tile_y", "sp", [-1, 1, 1]], ["tile_x", "sp", [-1, 1, 2]], ["tile_rcc", "sp", [-1, 256]], ["tile_ry", "sp", [-1, 1]], ["tile_rx", "sp", [-1, 1]], ["auto_unroll_max_step", "ot", 1500], ["unroll_explicit", "ot", 1]]}, "result": [[0.004618275], 0, 11.390143394470215, 1639249675.5780885], "version": 0.2, "tvm_version": "0.8.dev0"}
{"input": ["opencl -keys=adreno,opencl,gpu -device=adreno -max_num_threads=256", "conv2d_nchwc_acc32.image2d", [["TENSOR", [1, 256, 14, 14, 4], "float32"], ["TENSOR", [512, 1024, 1, 1, 4], "float32"], [2, 2], [0, 0, 0, 0], [1, 1], "float32"], {}], "config": {"index": 23206, "code_hash": null, "entity": [["tile_fc", "sp", [-1, 4, 16]], ["tile_y", "sp", [-1, 4, 2]], ["tile_x", "sp", [-1, 1, 1]], ["tile_rcc", "sp", [-1, 16]], ["tile_ry", "sp", [-1, 1]], ["tile_rx", "sp", [-1, 1]], ["auto_unroll_max_step", "ot", 512], ["unroll_explicit", "ot", 0]]}, "result": [[0.00367620208], 0, 4.770655870437622, 1639249680.7404008], "version": 0.2, "tvm_version": "0.8.dev0"}
{"input": ["opencl -keys=adreno,opencl,gpu -device=adreno -max_num_threads=256", "conv2d_nchwc_acc32.image2d", [["TENSOR", [1, 256, 14, 14, 4], "float32"], ["TENSOR", [512, 1024, 1, 1, 4], "float32"], [2, 2], [0, 0, 0, 0], [1, 1], "float32"], {}], "config": {"index": 20194, "code_hash": null, "entity": [["tile_fc", "sp", [-1, 4, 64]], ["tile_y", "sp", [-1, 8, 1]], ["tile_x", "sp", [-1, 1, 2]], ["tile_rcc", "sp", [-1, 4]], ["tile_ry", "sp", [-1, 1]], ["tile_rx", "sp", [-1, 1]], ["auto_unroll_max_step", "ot", 512], ["unroll_explicit", "ot", 0]]}, "result": [[0.00401620208], 0, 8.083663702011108, 1639249684.0172997], "version": 0.2, "tvm_version": "0.8.dev0"}
{"input": ["opencl -keys=adreno,opencl,gpu -device=adreno -max_num_threads=256", "conv2d_nchwc_acc32.image2d", [["TENSOR", [1, 256, 14, 14, 4], "float32"], ["TENSOR", [512, 1024, 1, 1, 4], "float32"], [2, 2], [0, 0, 0, 0], [1, 1], "float32"], {}], "config": {"index": 60938, "code_hash": null, "entity": [["tile_fc", "sp", [-1, 4, 64]], ["tile_y", "sp", [-1, 1, 8]], ["tile_x", "sp", [-1, 4, 1]], ["tile_rcc", "sp", [-1, 128]], ["tile_ry", "sp", [-1, 1]], ["tile_rx", "sp", [-1, 1]], ["auto_unroll_max_step", "ot", 0], ["unroll_explicit", "ot", 1]]}, "result": [[0.00278325936], 0, 35.71180701255798, 1639249720.4080706], "version": 0.2, "tvm_version": "0.8.dev0"}
{"input": ["opencl -keys=adreno,opencl,gpu -device=adreno -max_num_threads=256", "conv2d_nchwc_acc32.image2d", [["TENSOR", [1, 256, 14, 14, 4], "float32"], ["TENSOR", [512, 1024, 1, 1, 4], "float32"], [2, 2], [0, 0, 0, 0], [1, 1], "float32"], {}], "config": {"index": 28605, "code_hash": null, "entity": [["tile_fc", "sp", [-1, 16, 8]], ["tile_y", "sp", [-1, 1, 8]], ["tile_x", "sp", [-1, 1, 1]], ["tile_rcc", "sp", [-1, 128]], ["tile_ry", "sp", [-1, 1]], ["tile_rx", "sp", [-1, 1]], ["auto_unroll_max_step", "ot", 512], ["unroll_explicit", "ot", 0]]}, "result": [[0.00588174792], 0, 4.095484733581543, 1639249725.197949], "version": 0.2, "tvm_version": "0.8.dev0"}
{"input": ["opencl -keys=adreno,opencl,gpu -device=adreno -max_num_threads=256", "conv2d_nchwc_acc32.image2d", [["TENSOR", [1, 256, 14, 14, 4], "float32"], ["TENSOR", [512, 1024, 1, 1, 4], "float32"], [2, 2], [0, 0, 0, 0], [1, 1], "float32"], {}], "config": {"index": 78504, "code_hash": null, "entity": [["tile_fc", "sp", [-1, 8, 32]], ["tile_y", "sp", [-1, 1, 2]], ["tile_x", "sp", [-1, 2, 1]], ["tile_rcc", "sp", [-1, 256]], ["tile_ry", "sp", [-1, 1]], ["tile_rx", "sp", [-1, 1]], ["auto_unroll_max_step", "ot", 512], ["unroll_explicit", "ot", 1]]}, "result": [[0.00486767814], 0, 4.023279190063477, 1639249748.7577922], "version": 0.2, "tvm_version": "0.8.dev0"}
{"input": ["opencl -keys=adreno,opencl,gpu -device=adreno -max_num_threads=256", "conv2d_nchwc_acc32.image2d", [["TENSOR", [1, 256, 14, 14, 4], "float32"], ["TENSOR", [512, 1024, 1, 1, 4], "float32"], [2, 2], [0, 0, 0, 0], [1, 1], "float32"], {}], "config": {"index": 62207, "code_hash": null, "entity": [["tile_fc", "sp", [-1, 4, 8]], ["tile_y", "sp", [-1, 2, 2]], ["tile_x", "sp", [-1, 1, 8]], ["tile_rcc", "sp", [-1, 128]], ["tile_ry", "sp", [-1, 1]], ["tile_rx", "sp", [-1, 1]], ["auto_unroll_max_step", "ot", 0], ["unroll_explicit", "ot", 1]]}, "result": [[0.00361322186], 0, 4.167948961257935, 1639249770.0580146], "version": 0.2, "tvm_version": "0.8.dev0"}
{"input": ["opencl -keys=adreno,opencl,gpu -device=adreno -max_num_threads=256", "conv2d_nchwc_acc32.image2d", [["TENSOR", [1, 256, 14, 14, 4], "float32"], ["TENSOR", [512, 1024, 1, 1, 4], "float32"], [2, 2], [0, 0, 0, 0], [1, 1], "float32"], {}], "config": {"index": 33376, "code_hash": null, "entity": [["tile_fc", "sp", [-1, 1, 8]], ["tile_y", "sp", [-1, 1, 1]], ["tile_x", "sp", [-1, 2, 4]], ["tile_rcc", "sp", [-1, 1]], ["tile_ry", "sp", [-1, 1]], ["tile_rx", "sp", [-1, 1]], ["auto_unroll_max_step", "ot", 1500], ["unroll_explicit", "ot", 0]]}, "result": [[0.00378935728], 0, 7.539031028747559, 1639249773.4597447], "version": 0.2, "tvm_version": "0.8.dev0"}
{"input": ["opencl -keys=adreno,opencl,gpu -device=adreno -max_num_threads=256", "conv2d_nchwc_acc32.image2d", [["TENSOR", [1, 256, 14, 14, 4], "float32"], ["TENSOR", [512, 1024, 1, 1, 4], "float32"], [2, 2], [0, 0, 0, 0], [1, 1], "float32"], {}], "config": {"index": 77238, "code_hash": null, "entity": [["tile_fc", "sp", [-1, 2, 4]], ["tile_y", "sp", [-1, 2, 4]], ["tile_x", "sp", [-1, 1, 2]], ["tile_rcc", "sp", [-1, 128]], ["tile_ry", "sp", [-1, 1]], ["tile_rx", "sp", [-1, 1]], ["auto_unroll_max_step", "ot", 512], ["unroll_explicit", "ot", 1]]}, "result": [[0.0034387322999999996], 0, 3.6629605293273926, 1639249778.3447099], "version": 0.2, "tvm_version": "0.8.dev0"}
{"input": ["opencl -keys=adreno,opencl,gpu -device=adreno -max_num_threads=256", "conv2d_nchwc_acc32.image2d", [["TENSOR", [1, 256, 14, 14, 4], "float32"], ["TENSOR", [512, 1024, 1, 1, 4], "float32"], [2, 2], [0, 0, 0, 0], [1, 1], "float32"], {}], "config": {"index": 38131, "code_hash": null, "entity": [["tile_fc", "sp", [-1, 1, 32]], ["tile_y", "sp", [-1, 1, 1]], ["tile_x", "sp", [-1, 2, 2]], ["tile_rcc", "sp", [-1, 8]], ["tile_ry", "sp", [-1, 1]], ["tile_rx", "sp", [-1, 1]], ["auto_unroll_max_step", "ot", 1500], ["unroll_explicit", "ot", 0]]}, "result": [[0.00292077188], 0, 4.201033353805542, 1639249823.5414479], "version": 0.2, "tvm_version": "0.8.dev0"}
{"input": ["opencl -keys=adreno,opencl,gpu -device=adreno -max_num_threads=256", "conv2d_nchwc_acc32.image2d", [["TENSOR", [1, 256, 14, 14, 4], "float32"], ["TENSOR", [512, 1024, 1, 1, 4], "float32"], [2, 2], [0, 0, 0, 0], [1, 1], "float32"], {}], "config": {"index": 53952, "code_hash": null, "entity": [["tile_fc", "sp", [-1, 2, 32]], ["tile_y", "sp", [-1, 1, 8]], ["tile_x", "sp", [-1, 8, 1]], ["tile_rcc", "sp", [-1, 8]], ["tile_ry", "sp", [-1, 1]], ["tile_rx", "sp", [-1, 1]], ["auto_unroll_max_step", "ot", 0], ["unroll_explicit", "ot", 1]]}, "result": [[0.0031461104000000003], 0, 7.594210863113403, 1639249826.9033484], "version": 0.2, "tvm_version": "0.8.dev0"}
{"input": ["opencl -keys=adreno,opencl,gpu -device=adreno -max_num_threads=256", "conv2d_nchwc_acc32.image2d", [["TENSOR", [1, 256, 14, 14, 4], "float32"], ["TENSOR", [512, 1024, 1, 1, 4], "float32"], [2, 2], [0, 0, 0, 0], [1, 1], "float32"], {}], "config": {"index": 91361, "code_hash": null, "entity": [["tile_fc", "sp", [-1, 4, 32]], ["tile_y", "sp", [-1, 2, 1]], ["tile_x", "sp", [-1, 1, 2]], ["tile_rcc", "sp", [-1, 64]], ["tile_ry", "sp", [-1, 1]], ["tile_rx", "sp", [-1, 1]], ["auto_unroll_max_step", "ot", 1500], ["unroll_explicit", "ot", 1]]}, "result": [[0.00432425936], 0, 3.6527674198150635, 1639249830.9906166], "version": 0.2, "tvm_version": "0.8.dev0"}
{"input": ["opencl -keys=adreno,opencl,gpu -device=adreno -max_num_threads=256", "conv2d_nchwc_acc32.image2d", [["TENSOR", [1, 256, 14, 14, 4], "float32"], ["TENSOR", [512, 1024, 1, 1, 4], "float32"], [2, 2], [0, 0, 0, 0], [1, 1], "float32"], {}], "config": {"index": 26204, "code_hash": null, "entity": [["tile_fc", "sp", [-1, 8, 16]], ["tile_y", "sp", [-1, 1, 4]], ["tile_x", "sp", [-1, 1, 4]], ["tile_rcc", "sp", [-1, 32]], ["tile_ry", "sp", [-1, 1]], ["tile_rx", "sp", [-1, 1]], ["auto_unroll_max_step", "ot", 512], ["unroll_explicit", "ot", 0]]}, "result": [[0.00649842708], 0, 7.192994117736816, 1639249834.5421724], "version": 0.2, "tvm_version": "0.8.dev0"}
{"input": ["opencl -keys=adreno,opencl,gpu -device=adreno -max_num_threads=256", "conv2d_nchwc_acc32.image2d", [["TENSOR", [1, 256, 14, 14, 4], "float32"], ["TENSOR", [512, 1024, 1, 1, 4], "float32"], [2, 2], [0, 0, 0, 0], [1, 1], "float32"], {}], "config": {"index": 87191, "code_hash": null, "entity": [["tile_fc", "sp", [-1, 2, 4]], ["tile_y", "sp", [-1, 2, 4]], ["tile_x", "sp", [-1, 1, 8]], ["tile_rcc", "sp", [-1, 8]], ["tile_ry", "sp", [-1, 1]], ["tile_rx", "sp", [-1, 1]], ["auto_unroll_max_step", "ot", 1500], ["unroll_explicit", "ot", 1]]}, "result": [[0.006851659380000001], 0, 4.655914545059204, 1639249839.5768447], "version": 0.2, "tvm_version": "0.8.dev0"}
{"input": ["opencl -keys=adreno,opencl,gpu -device=adreno -max_num_threads=256", "conv2d_nchwc_acc32.image2d", [["TENSOR", [1, 256, 14, 14, 4], "float32"], ["TENSOR", [512, 1024, 1, 1, 4], "float32"], [2, 2], [0, 0, 0, 0], [1, 1], "float32"], {}], "config": {"index": 34432, "code_hash": null, "entity": [["tile_fc", "sp", [-1, 1, 64]], ["tile_y", "sp", [-1, 8, 1]], ["tile_x", "sp", [-1, 1, 2]], ["tile_rcc", "sp", [-1, 2]], ["tile_ry", "sp", [-1, 1]], ["tile_rx", "sp", [-1, 1]], ["auto_unroll_max_step", "ot", 1500], ["unroll_explicit", "ot", 0]]}, "result": [[0.0018720229199999999], 0, 7.8731184005737305, 1639249842.8894336], "version": 0.2, "tvm_version": "0.8.dev0"}
{"input": ["opencl -keys=adreno,opencl,gpu -device=adreno -max_num_threads=256", "conv2d_nchwc_acc32.image2d", [["TENSOR", [1, 256, 14, 14, 4], "float32"], ["TENSOR", [512, 1024, 1, 1, 4], "float32"], [2, 2], [0, 0, 0, 0], [1, 1], "float32"], {}], "config": {"index": 22673, "code_hash": null, "entity": [["tile_fc", "sp", [-1, 4, 32]], ["tile_y", "sp", [-1, 2, 4]], ["tile_x", "sp", [-1, 1, 4]], ["tile_rcc", "sp", [-1, 8]], ["tile_ry", "sp", [-1, 1]], ["tile_rx", "sp", [-1, 1]], ["auto_unroll_max_step", "ot", 512], ["unroll_explicit", "ot", 0]]}, "result": [[0.0043714625], 0, 4.300113201141357, 1639249847.6057942], "version": 0.2, "tvm_version": "0.8.dev0"}
{"input": ["opencl -keys=adreno,opencl,gpu -device=adreno -max_num_threads=256", "conv2d_nchwc_acc32.image2d", [["TENSOR", [1, 256, 14, 14, 4], "float32"], ["TENSOR", [512, 1024, 1, 1, 4], "float32"], [2, 2], [0, 0, 0, 0], [1, 1], "float32"], {}], "config": {"index": 29713, "code_hash": null, "entity": [["tile_fc", "sp", [-1, 1, 32]], ["tile_y", "sp", [-1, 2, 2]], ["tile_x", "sp", [-1, 1, 4]], ["tile_rcc", "sp", [-1, 128]], ["tile_ry", "sp", [-1, 1]], ["tile_rx", "sp", [-1, 1]], ["auto_unroll_max_step", "ot", 512], ["unroll_explicit", "ot", 0]]}, "result": [[0.00282217394], 0, 7.4939258098602295, 1639249850.8039067], "version": 0.2, "tvm_version": "0.8.dev0"}
{"input": ["opencl -keys=adreno,opencl,gpu -device=adreno -max_num_threads=256", "conv2d_nchwc_acc32.image2d", [["TENSOR", [1, 256, 14, 14, 4], "float32"], ["TENSOR", [512, 1024, 1, 1, 4], "float32"], [2, 2], [0, 0, 0, 0], [1, 1], "float32"], {}], "config": {"index": 76275, "code_hash": null, "entity": [["tile_fc", "sp", [-1, 2, 4]], ["tile_y", "sp", [-1, 2, 4]], ["tile_x", "sp", [-1, 2, 4]], ["tile_rcc", "sp", [-1, 64]], ["tile_ry", "sp", [-1, 1]], ["tile_rx", "sp", [-1, 1]], ["auto_unroll_max_step", "ot", 512], ["unroll_explicit", "ot", 1]]}, "result": [[0.00206161562], 0, 4.182098865509033, 1639249855.3157096], "version": 0.2, "tvm_version": "0.8.dev0"}
{"input": ["opencl -keys=adreno,opencl,gpu -device=adreno -max_num_threads=256", "conv2d_nchwc_acc32.image2d", [["TENSOR", [1, 256, 14, 14, 4], "float32"], ["TENSOR", [512, 1024, 1, 1, 4], "float32"], [2, 2], [0, 0, 0, 0], [1, 1], "float32"], {}], "config": {"index": 77824, "code_hash": null, "entity": [["tile_fc", "sp", [-1, 8, 16]], ["tile_y", "sp", [-1, 1, 4]], ["tile_x", "sp", [-1, 1, 4]], ["tile_rcc", "sp", [-1, 128]], ["tile_ry", "sp", [-1, 1]], ["tile_rx", "sp", [-1, 1]], ["auto_unroll_max_step", "ot", 512], ["unroll_explicit", "ot", 1]]}, "result": [[0.00649374272], 0, 8.031350374221802, 1639249859.270057], "version": 0.2, "tvm_version": "0.8.dev0"}
{"input": ["opencl -keys=adreno,opencl,gpu -device=adreno -max_num_threads=256", "conv2d_nchwc_acc32.image2d", [["TENSOR", [1, 256, 14, 14, 4], "float32"], ["TENSOR", [512, 1024, 1, 1, 4], "float32"], [2, 2], [0, 0, 0, 0], [1, 1], "float32"], {}], "config": {"index": 86059, "code_hash": null, "entity": [["tile_fc", "sp", [-1, 8, 8]], ["tile_y", "sp", [-1, 1, 2]], ["tile_x", "sp", [-1, 1, 2]], ["tile_rcc", "sp", [-1, 8]], ["tile_ry", "sp", [-1, 1]], ["tile_rx", "sp", [-1, 1]], ["auto_unroll_max_step", "ot", 1500], ["unroll_explicit", "ot", 1]]}, "result": [[0.03628001874], 0, 8.971465826034546, 1639249868.699545], "version": 0.2, "tvm_version": "0.8.dev0"}
{"input": ["opencl -keys=adreno,opencl,gpu -device=adreno -max_num_threads=256", "conv2d_nchwc_acc32.image2d", [["TENSOR", [1, 256, 14, 14, 4], "float32"], ["TENSOR", [512, 1024, 1, 1, 4], "float32"], [2, 2], [0, 0, 0, 0], [1, 1], "float32"], {}], "config": {"index": 71125, "code_hash": null, "entity": [["tile_fc", "sp", [-1, 1, 4]], ["tile_y", "sp", [-1, 4, 2]], ["tile_x", "sp", [-1, 1, 8]], ["tile_rcc", "sp", [-1, 8]], ["tile_ry", "sp", [-1, 1]], ["tile_rx", "sp", [-1, 1]], ["auto_unroll_max_step", "ot", 512], ["unroll_explicit", "ot", 1]]}, "result": [[0.00759571146], 0, 31.714898347854614, 1639249916.0968902], "version": 0.2, "tvm_version": "0.8.dev0"}
{"input": ["opencl -keys=adreno,opencl,gpu -device=adreno -max_num_threads=256", "conv2d_nchwc_acc32.image2d", [["TENSOR", [1, 256, 14, 14, 4], "float32"], ["TENSOR", [512, 1024, 1, 1, 4], "float32"], [2, 2], [0, 0, 0, 0], [1, 1], "float32"], {}], "config": {"index": 72374, "code_hash": null, "entity": [["tile_fc", "sp", [-1, 8, 64]], ["tile_y", "sp", [-1, 4, 1]], ["tile_x", "sp", [-1, 1, 4]], ["tile_rcc", "sp", [-1, 16]], ["tile_ry", "sp", [-1, 1]], ["tile_rx", "sp", [-1, 1]], ["auto_unroll_max_step", "ot", 512], ["unroll_explicit", "ot", 1]]}, "result": [[0.01278835936], 0, 6.253594398498535, 1639249922.6485045], "version": 0.2, "tvm_version": "0.8.dev0"}
{"input": ["opencl -keys=adreno,opencl,gpu -device=adreno -max_num_threads=256", "conv2d_nchwc_acc32.image2d", [["TENSOR", [1, 256, 14, 14, 4], "float32"], ["TENSOR", [512, 1024, 1, 1, 4], "float32"], [2, 2], [0, 0, 0, 0], [1, 1], "float32"], {}], "config": {"index": 62031, "code_hash": null, "entity": [["tile_fc", "sp", [-1, 4, 2]], ["tile_y", "sp", [-1, 2, 4]], ["tile_x", "sp", [-1, 2, 4]], ["tile_rcc", "sp", [-1, 128]], ["tile_ry", "sp", [-1, 1]], ["tile_rx", "sp", [-1, 1]], ["auto_unroll_max_step", "ot", 0], ["unroll_explicit", "ot", 1]]}, "result": [[0.00309458124], 0, 3.594670057296753, 1639250258.585539], "version": 0.2, "tvm_version": "0.8.dev0"}
{"input": ["opencl -keys=adreno,opencl,gpu -device=adreno -max_num_threads=256", "conv2d_nchwc_acc32.image2d", [["TENSOR", [1, 256, 14, 14, 4], "float32"], ["TENSOR", [512, 1024, 1, 1, 4], "float32"], [2, 2], [0, 0, 0, 0], [1, 1], "float32"], {}], "config": {"index": 64753, "code_hash": null, "entity": [["tile_fc", "sp", [-1, 1, 4]], ["tile_y", "sp", [-1, 1, 4]], ["tile_x", "sp", [-1, 1, 2]], ["tile_rcc", "sp", [-1, 1]], ["tile_ry", "sp", [-1, 1]], ["tile_rx", "sp", [-1, 1]], ["auto_unroll_max_step", "ot", 512], ["unroll_explicit", "ot", 1]]}, "result": [[0.00588863542], 0, 10.471971988677979, 1639250284.7936938], "version": 0.2, "tvm_version": "0.8.dev0"}
{"input": ["opencl -keys=adreno,opencl,gpu -device=adreno -max_num_threads=256", "conv2d_nchwc_acc32.image2d", [["TENSOR", [1, 256, 14, 14, 4], "float32"], ["TENSOR", [512, 1024, 1, 1, 4], "float32"], [2, 2], [0, 0, 0, 0], [1, 1], "float32"], {}], "config": {"index": 43872, "code_hash": null, "entity": [["tile_fc", "sp", [-1, 1, 64]], ["tile_y", "sp", [-1, 2, 1]], ["tile_x", "sp", [-1, 1, 4]], ["tile_rcc", "sp", [-1, 64]], ["tile_ry", "sp", [-1, 1]], ["tile_rx", "sp", [-1, 1]], ["auto_unroll_max_step", "ot", 1500], ["unroll_explicit", "ot", 0]]}, "result": [[0.0023904989399999997], 0, 27.78391933441162, 1639250328.2381895], "version": 0.2, "tvm_version": "0.8.dev0"}
{"input": ["opencl -keys=adreno,opencl,gpu -device=adreno -max_num_threads=256", "conv2d_nchwc_acc32.image2d", [["TENSOR", [1, 256, 14, 14, 4], "float32"], ["TENSOR", [512, 1024, 1, 1, 4], "float32"], [2, 2], [0, 0, 0, 0], [1, 1], "float32"], {}], "config": {"index": 10843, "code_hash": null, "entity": [["tile_fc", "sp", [-1, 1, 64]], ["tile_y", "sp", [-1, 4, 1]], ["tile_x", "sp", [-1, 2, 1]], ["tile_rcc", "sp", [-1, 64]], ["tile_ry", "sp", [-1, 1]], ["tile_rx", "sp", [-1, 1]], ["auto_unroll_max_step", "ot", 0], ["unroll_explicit", "ot", 0]]}, "result": [[0.00219860104], 0, 3.1044628620147705, 1639250331.6532977], "version": 0.2, "tvm_version": "0.8.dev0"}
{"input": ["opencl -keys=adreno,opencl,gpu -device=adreno -max_num_threads=256", "conv2d_nchwc_acc32.image2d", [["TENSOR", [1, 256, 14, 14, 4], "float32"], ["TENSOR", [512, 1024, 1, 1, 4], "float32"], [2, 2], [0, 0, 0, 0], [1, 1], "float32"], {}], "config": {"index": 28700, "code_hash": null, "entity": [["tile_fc", "sp", [-1, 4, 8]], ["tile_y", "sp", [-1, 1, 4]], ["tile_x", "sp", [-1, 2, 1]], ["tile_rcc", "sp", [-1, 128]], ["tile_ry", "sp", [-1, 1]], ["tile_rx", "sp", [-1, 1]], ["auto_unroll_max_step", "ot", 512], ["unroll_explicit", "ot", 0]]}, "result": [[0.0057003604], 0, 10.81265902519226, 1639250339.3979824], "version": 0.2, "tvm_version": "0.8.dev0"}
{"input": ["opencl -keys=adreno,opencl,gpu -device=adreno -max_num_threads=256", "conv2d_nchwc_acc32.image2d", [["TENSOR", [1, 256, 14, 14, 4], "float32"], ["TENSOR", [512, 1024, 1, 1, 4], "float32"], [2, 2], [0, 0, 0, 0], [1, 1], "float32"], {}], "config": {"index": 16039, "code_hash": null, "entity": [["tile_fc", "sp", [-1, 2, 32]], ["tile_y", "sp", [-1, 4, 1]], ["tile_x", "sp", [-1, 1, 1]], ["tile_rcc", "sp", [-1, 1]], ["tile_ry", "sp", [-1, 1]], ["tile_rx", "sp", [-1, 1]], ["auto_unroll_max_step", "ot", 512], ["unroll_explicit", "ot", 0]]}, "result": [[0.00293002186], 0, 3.523277997970581, 1639250343.4071937], "version": 0.2, "tvm_version": "0.8.dev0"}
{"input": ["opencl -keys=adreno,opencl,gpu -device=adreno -max_num_threads=256", "conv2d_nchwc_acc32.image2d", [["TENSOR", [1, 256, 14, 14, 4], "float32"], ["TENSOR", [512, 1024, 1, 1, 4], "float32"], [2, 2], [0, 0, 0, 0], [1, 1], "float32"], {}], "config": {"index": 60899, "code_hash": null, "entity": [["tile_fc", "sp", [-1, 4, 8]], ["tile_y", "sp", [-1, 2, 4]], ["tile_x", "sp", [-1, 4, 1]], ["tile_rcc", "sp", [-1, 128]], ["tile_ry", "sp", [-1, 1]], ["tile_rx", "sp", [-1, 1]], ["auto_unroll_max_step", "ot", 0], ["unroll_explicit", "ot", 1]]}, "result": [[0.01038725312], 0, 7.931156158447266, 1639250347.6888487], "version": 0.2, "tvm_version": "0.8.dev0"}
{"input": ["opencl -keys=adreno,opencl,gpu -device=adreno -max_num_threads=256", "conv2d_nchwc_acc32.image2d", [["TENSOR", [1, 256, 14, 14, 4], "float32"], ["TENSOR", [512, 1024, 1, 1, 4], "float32"], [2, 2], [0, 0, 0, 0], [1, 1], "float32"], {}], "config": {"index": 55212, "code_hash": null, "entity": [["tile_fc", "sp", [-1, 1, 64]], ["tile_y", "sp", [-1, 8, 1]], ["tile_x", "sp", [-1, 1, 1]], ["tile_rcc", "sp", [-1, 16]], ["tile_ry", "sp", [-1, 1]], ["tile_rx", "sp", [-1, 1]], ["auto_unroll_max_step", "ot", 0], ["unroll_explicit", "ot", 1]]}, "result": [[0.0030298875], 0, 10.724510192871094, 1639250567.0602155], "version": 0.2, "tvm_version": "0.8.dev0"}
{"input": ["opencl -keys=adreno,opencl,gpu -device=adreno -max_num_threads=256", "conv2d_nchwc_acc32.image2d", [["TENSOR", [1, 256, 14, 14, 4], "float32"], ["TENSOR", [512, 1024, 1, 1, 4], "float32"], [2, 2], [0, 0, 0, 0], [1, 1], "float32"], {}], "config": {"index": 56992, "code_hash": null, "entity": [["tile_fc", "sp", [-1, 1, 64]], ["tile_y", "sp", [-1, 8, 1]], ["tile_x", "sp", [-1, 1, 1]], ["tile_rcc", "sp", [-1, 32]], ["tile_ry", "sp", [-1, 1]], ["tile_rx", "sp", [-1, 1]], ["auto_unroll_max_step", "ot", 0], ["unroll_explicit", "ot", 1]]}, "result": [[0.0030064197799999997], 0, 15.102123737335205, 1639250571.442245], "version": 0.2, "tvm_version": "0.8.dev0"}
{"input": ["opencl -keys=adreno,opencl,gpu -device=adreno -max_num_threads=256", "conv2d_nchwc_acc32.image2d", [["TENSOR", [1, 256, 14, 14, 4], "float32"], ["TENSOR", [512, 1024, 1, 1, 4], "float32"], [2, 2], [0, 0, 0, 0], [1, 1], "float32"], {}], "config": {"index": 85472, "code_hash": null, "entity": [["tile_fc", "sp", [-1, 1, 64]], ["tile_y", "sp", [-1, 8, 1]], ["tile_x", "sp", [-1, 1, 1]], ["tile_rcc", "sp", [-1, 8]], ["tile_ry", "sp", [-1, 1]], ["tile_rx", "sp", [-1, 1]], ["auto_unroll_max_step", "ot", 1500], ["unroll_explicit", "ot", 1]]}, "result": [[0.00507414688], 0, 34.087401390075684, 1639250642.0821452], "version": 0.2, "tvm_version": "0.8.dev0"}
{"input": ["opencl -keys=adreno,opencl,gpu -device=adreno -max_num_threads=256", "conv2d_nchwc_acc32.image2d", [["TENSOR", [1, 256, 14, 14, 4], "float32"], ["TENSOR", [512, 1024, 1, 1, 4], "float32"], [2, 2], [0, 0, 0, 0], [1, 1], "float32"], {}], "config": {"index": 90812, "code_hash": null, "entity": [["tile_fc", "sp", [-1, 1, 64]], ["tile_y", "sp", [-1, 8, 1]], ["tile_x", "sp", [-1, 1, 1]], ["tile_rcc", "sp", [-1, 64]], ["tile_ry", "sp", [-1, 1]], ["tile_rx", "sp", [-1, 1]], ["auto_unroll_max_step", "ot", 1500], ["unroll_explicit", "ot", 1]]}, "result": [[0.00302614792], 0, 36.30802607536316, 1639250829.1479366], "version": 0.2, "tvm_version": "0.8.dev0"}
{"input": ["opencl -keys=adreno,opencl,gpu -device=adreno -max_num_threads=256", "conv2d_nchwc_acc32.image2d", [["TENSOR", [1, 256, 14, 14, 4], "float32"], ["TENSOR", [512, 1024, 1, 1, 4], "float32"], [2, 2], [0, 0, 0, 0], [1, 1], "float32"], {}], "config": {"index": 49872, "code_hash": null, "entity": [["tile_fc", "sp", [-1, 1, 64]], ["tile_y", "sp", [-1, 8, 1]], ["tile_x", "sp", [-1, 1, 1]], ["tile_rcc", "sp", [-1, 2]], ["tile_ry", "sp", [-1, 1]], ["tile_rx", "sp", [-1, 1]], ["auto_unroll_max_step", "ot", 0], ["unroll_explicit", "ot", 1]]}, "result": [[0.00394424792], 0, 4.1397788524627686, 1639250833.804354], "version": 0.2, "tvm_version": "0.8.dev0"}
{"input": ["opencl -keys=adreno,opencl,gpu -device=adreno -max_num_threads=256", "conv2d_nchwc_acc32.image2d", [["TENSOR", [1, 256, 14, 14, 4], "float32"], ["TENSOR", [512, 1024, 1, 1, 4], "float32"], [2, 2], [0, 0, 0, 0], [1, 1], "float32"], {}], "config": {"index": 74792, "code_hash": null, "entity": [["tile_fc", "sp", [-1, 1, 64]], ["tile_y", "sp", [-1, 8, 1]], ["tile_x", "sp", [-1, 1, 1]], ["tile_rcc", "sp", [-1, 64]], ["tile_ry", "sp", [-1, 1]], ["tile_rx", "sp", [-1, 1]], ["auto_unroll_max_step", "ot", 512], ["unroll_explicit", "ot", 1]]}, "result": [[0.0030068854], 0, 24.18812108039856, 1639251034.7319143], "version": 0.2, "tvm_version": "0.8.dev0"}
{"input": ["opencl -keys=adreno,opencl,gpu -device=adreno -max_num_threads=256", "conv2d_nchwc_acc32.image2d", [["TENSOR", [1, 256, 14, 14, 4], "float32"], ["TENSOR", [512, 1024, 1, 1, 4], "float32"], [2, 2], [0, 0, 0, 0], [1, 1], "float32"], {}], "config": {"index": 57029, "code_hash": null, "entity": [["tile_fc", "sp", [-1, 1, 32]], ["tile_y", "sp", [-1, 4, 2]], ["tile_x", "sp", [-1, 1, 1]], ["tile_rcc", "sp", [-1, 32]], ["tile_ry", "sp", [-1, 1]], ["tile_rx", "sp", [-1, 1]], ["auto_unroll_max_step", "ot", 0], ["unroll_explicit", "ot", 1]]}, "result": [[0.00258822084], 0, 18.495218753814697, 1639251053.6511486], "version": 0.2, "tvm_version": "0.8.dev0"}
{"input": ["opencl -keys=adreno,opencl,gpu -device=adreno -max_num_threads=256", "conv2d_nchwc_acc32.image2d", [["TENSOR", [1, 256, 14, 14, 4], "float32"], ["TENSOR", [512, 1024, 1, 1, 4], "float32"], [2, 2], [0, 0, 0, 0], [1, 1], "float32"], {}], "config": {"index": 10712, "code_hash": null, "entity": [["tile_fc", "sp", [-1, 1, 64]], ["tile_y", "sp", [-1, 8, 1]], ["tile_x", "sp", [-1, 1, 1]], ["tile_rcc", "sp", [-1, 64]], ["tile_ry", "sp", [-1, 1]], ["tile_rx", "sp", [-1, 1]], ["auto_unroll_max_step", "ot", 0], ["unroll_explicit", "ot", 0]]}, "result": [[0.00212696978], 0, 13.855671644210815, 1639251067.860451], "version": 0.2, "tvm_version": "0.8.dev0"}
{"input": ["opencl -keys=adreno,opencl,gpu -device=adreno -max_num_threads=256", "conv2d_nchwc_acc32.image2d", [["TENSOR", [1, 256, 14, 14, 4], "float32"], ["TENSOR", [512, 1024, 1, 1, 4], "float32"], [2, 2], [0, 0, 0, 0], [1, 1], "float32"], {}], "config": {"index": 32, "code_hash": null, "entity": [["tile_fc", "sp", [-1, 1, 64]], ["tile_y", "sp", [-1, 8, 1]], ["tile_x", "sp", [-1, 1, 1]], ["tile_rcc", "sp", [-1, 1]], ["tile_ry", "sp", [-1, 1]], ["tile_rx", "sp", [-1, 1]], ["auto_unroll_max_step", "ot", 0], ["unroll_explicit", "ot", 0]]}, "result": [[0.00185289688], 0, 14.268811702728271, 1639251097.887976], "version": 0.2, "tvm_version": "0.8.dev0"}
{"input": ["opencl -keys=adreno,opencl,gpu -device=adreno -max_num_threads=256", "conv2d_nchwc_acc32.image2d", [["TENSOR", [1, 256, 14, 14, 4], "float32"], ["TENSOR", [512, 1024, 1, 1, 4], "float32"], [2, 2], [0, 0, 0, 0], [1, 1], "float32"], {}], "config": {"index": 23172, "code_hash": null, "entity": [["tile_fc", "sp", [-1, 1, 64]], ["tile_y", "sp", [-1, 8, 1]], ["tile_x", "sp", [-1, 1, 1]], ["tile_rcc", "sp", [-1, 16]], ["tile_ry", "sp", [-1, 1]], ["tile_rx", "sp", [-1, 1]], ["auto_unroll_max_step", "ot", 512], ["unroll_explicit", "ot", 0]]}, "result": [[0.00212169478], 0, 21.63485360145569, 1639251105.3052266], "version": 0.2, "tvm_version": "0.8.dev0"}
{"input": ["opencl -keys=adreno,opencl,gpu -device=adreno -max_num_threads=256", "conv2d_nchwc_acc32.image2d", [["TENSOR", [1, 256, 14, 14, 4], "float32"], ["TENSOR", [512, 1024, 1, 1, 4], "float32"], [2, 2], [0, 0, 0, 0], [1, 1], "float32"], {}], "config": {"index": 3592, "code_hash": null, "entity": [["tile_fc", "sp", [-1, 1, 64]], ["tile_y", "sp", [-1, 8, 1]], ["tile_x", "sp", [-1, 1, 1]], ["tile_rcc", "sp", [-1, 4]], ["tile_ry", "sp", [-1, 1]], ["tile_rx", "sp", [-1, 1]], ["auto_unroll_max_step", "ot", 0], ["unroll_explicit", "ot", 0]]}, "result": [[0.00213456666], 0, 18.700591802597046, 1639251158.210182], "version": 0.2, "tvm_version": "0.8.dev0"}
{"input": ["opencl -keys=adreno,opencl,gpu -device=adreno -max_num_threads=256", "conv2d_nchwc_acc32.image2d", [["TENSOR", [1, 256, 14, 14, 4], "float32"], ["TENSOR", [512, 1024, 1, 1, 4], "float32"], [2, 2], [0, 0, 0, 0], [1, 1], "float32"], {}], "config": {"index": 64112, "code_hash": null, "entity": [["tile_fc", "sp", [-1, 1, 64]], ["tile_y", "sp", [-1, 8, 1]], ["tile_x", "sp", [-1, 1, 1]], ["tile_rcc", "sp", [-1, 1]], ["tile_ry", "sp", [-1, 1]], ["tile_rx", "sp", [-1, 1]], ["auto_unroll_max_step", "ot", 512], ["unroll_explicit", "ot", 1]]}, "result": [[0.00304584166], 0, 20.17579960823059, 1639251194.1561017], "version": 0.2, "tvm_version": "0.8.dev0"}
{"input": ["opencl -keys=adreno,opencl,gpu -device=adreno -max_num_threads=256", "conv2d_nchwc_acc32.image2d", [["TENSOR", [1, 256, 14, 14, 4], "float32"], ["TENSOR", [512, 1024, 1, 1, 4], "float32"], [2, 2], [0, 0, 0, 0], [1, 1], "float32"], {}], "config": {"index": 57034, "code_hash": null, "entity": [["tile_fc", "sp", [-1, 1, 64]], ["tile_y", "sp", [-1, 4, 2]], ["tile_x", "sp", [-1, 1, 1]], ["tile_rcc", "sp", [-1, 32]], ["tile_ry", "sp", [-1, 1]], ["tile_rx", "sp", [-1, 1]], ["auto_unroll_max_step", "ot", 0], ["unroll_explicit", "ot", 1]]}, "result": [[0.00264140208], 0, 19.21806764602661, 1639251213.7774713], "version": 0.2, "tvm_version": "0.8.dev0"}
{"input": ["opencl -keys=adreno,opencl,gpu -device=adreno -max_num_threads=256", "conv2d_nchwc_acc32.image2d", [["TENSOR", [1, 256, 14, 14, 4], "float32"], ["TENSOR", [512, 1024, 1, 1, 4], "float32"], [2, 2], [0, 0, 0, 0], [1, 1], "float32"], {}], "config": {"index": 57572, "code_hash": null, "entity": [["tile_fc", "sp", [-1, 1, 64]], ["tile_y", "sp", [-1, 8, 1]], ["tile_x", "sp", [-1, 1, 2]], ["tile_rcc", "sp", [-1, 32]], ["tile_ry", "sp", [-1, 1]], ["tile_rx", "sp", [-1, 1]], ["auto_unroll_max_step", "ot", 0], ["unroll_explicit", "ot", 1]]}, "result": [[0.0026986958399999998], 0, 3.349585771560669, 1639251217.5177681], "version": 0.2, "tvm_version": "0.8.dev0"}
{"input": ["opencl -keys=adreno,opencl,gpu -device=adreno -max_num_threads=256", "conv2d_nchwc_acc32.image2d", [["TENSOR", [1, 256, 14, 14, 4], "float32"], ["TENSOR", [512, 1024, 1, 1, 4], "float32"], [2, 2], [0, 0, 0, 0], [1, 1], "float32"], {}], "config": {"index": 67672, "code_hash": null, "entity": [["tile_fc", "sp", [-1, 1, 64]], ["tile_y", "sp", [-1, 8, 1]], ["tile_x", "sp", [-1, 1, 1]], ["tile_rcc", "sp", [-1, 4]], ["tile_ry", "sp", [-1, 1]], ["tile_rx", "sp", [-1, 1]], ["auto_unroll_max_step", "ot", 512], ["unroll_explicit", "ot", 1]]}, "result": [[0.00393584896], 0, 25.220133781433105, 1639251491.4441888], "version": 0.2, "tvm_version": "0.8.dev0"}
{"input": ["opencl -keys=adreno,opencl,gpu -device=adreno -max_num_threads=256", "conv2d_nchwc_acc32.image2d", [["TENSOR", [1, 256, 14, 14, 4], "float32"], ["TENSOR", [512, 1024, 1, 1, 4], "float32"], [2, 2], [0, 0, 0, 0], [1, 1], "float32"], {}], "config": {"index": 57072, "code_hash": null, "entity": [["tile_fc", "sp", [-1, 1, 64]], ["tile_y", "sp", [-1, 2, 4]], ["tile_x", "sp", [-1, 1, 1]], ["tile_rcc", "sp", [-1, 32]], ["tile_ry", "sp", [-1, 1]], ["tile_rx", "sp", [-1, 1]], ["auto_unroll_max_step", "ot", 0], ["unroll_explicit", "ot", 1]]}, "result": [[0.00263813958], 0, 3.4607088565826416, 1639251495.3579502], "version": 0.2, "tvm_version": "0.8.dev0"}
{"input": ["opencl -keys=adreno,opencl,gpu -device=adreno -max_num_threads=256", "conv2d_nchwc_acc32.image2d", [["TENSOR", [1, 256, 14, 14, 4], "float32"], ["TENSOR", [512, 1024, 1, 1, 4], "float32"], [2, 2], [0, 0, 0, 0], [1, 1], "float32"], {}], "config": {"index": 55292, "code_hash": null, "entity": [["tile_fc", "sp", [-1, 1, 64]], ["tile_y", "sp", [-1, 2, 4]], ["tile_x", "sp", [-1, 1, 1]], ["tile_rcc", "sp", [-1, 16]], ["tile_ry", "sp", [-1, 1]], ["tile_rx", "sp", [-1, 1]], ["auto_unroll_max_step", "ot", 0], ["unroll_explicit", "ot", 1]]}, "result": [[0.0026519687599999998], 0, 6.777772903442383, 1639251498.6572034], "version": 0.2, "tvm_version": "0.8.dev0"}
{"input": ["opencl -keys=adreno,opencl,gpu -device=adreno -max_num_threads=256", "conv2d_nchwc_acc32.image2d", [["TENSOR", [1, 256, 14, 14, 4], "float32"], ["TENSOR", [512, 1024, 1, 1, 4], "float32"], [2, 2], [0, 0, 0, 0], [1, 1], "float32"], {}], "config": {"index": 71812, "code_hash": null, "entity": [["tile_fc", "sp", [-1, 1, 64]], ["tile_y", "sp", [-1, 8, 1]], ["tile_x", "sp", [-1, 1, 2]], ["tile_rcc", "sp", [-1, 16]], ["tile_ry", "sp", [-1, 1]], ["tile_rx", "sp", [-1, 1]], ["auto_unroll_max_step", "ot", 512], ["unroll_explicit", "ot", 1]]}, "result": [[0.00908254168], 0, 11.243391513824463, 1639251510.2033865], "version": 0.2, "tvm_version": "0.8.dev0"}
{"input": ["opencl -keys=adreno,opencl,gpu -device=adreno -max_num_threads=256", "conv2d_nchwc_acc32.image2d", [["TENSOR", [1, 256, 14, 14, 4], "float32"], ["TENSOR", [512, 1024, 1, 1, 4], "float32"], [2, 2], [0, 0, 0, 0], [1, 1], "float32"], {}], "config": {"index": 42259, "code_hash": null, "entity": [["tile_fc", "sp", [-1, 8, 2]], ["tile_y", "sp", [-1, 1, 8]], ["tile_x", "sp", [-1, 1, 4]], ["tile_rcc", "sp", [-1, 32]], ["tile_ry", "sp", [-1, 1]], ["tile_rx", "sp", [-1, 1]], ["auto_unroll_max_step", "ot", 1500], ["unroll_explicit", "ot", 0]]}, "result": [[0.0067635625], 0, 6.097029447555542, 1639251505.420653], "version": 0.2, "tvm_version": "0.8.dev0"}
{"input": ["opencl -keys=adreno,opencl,gpu -device=adreno -max_num_threads=256", "conv2d_nchwc_acc32.image2d", [["TENSOR", [1, 256, 14, 14, 4], "float32"], ["TENSOR", [512, 1024, 1, 1, 4], "float32"], [2, 2], [0, 0, 0, 0], [1, 1], "float32"], {}], "config": {"index": 52047, "code_hash": null, "entity": [["tile_fc", "sp", [-1, 4, 64]], ["tile_y", "sp", [-1, 1, 1]], ["tile_x", "sp", [-1, 8, 1]], ["tile_rcc", "sp", [-1, 4]], ["tile_ry", "sp", [-1, 1]], ["tile_rx", "sp", [-1, 1]], ["auto_unroll_max_step", "ot", 0], ["unroll_explicit", "ot", 1]]}, "result": [[0.0072582677], 0, 4.2723424434661865, 1639251514.7594893], "version": 0.2, "tvm_version": "0.8.dev0"}
{"input": ["opencl -keys=adreno,opencl,gpu -device=adreno -max_num_threads=256", "conv2d_nchwc_acc32.image2d", [["TENSOR", [1, 256, 14, 14, 4], "float32"], ["TENSOR", [512, 1024, 1, 1, 4], "float32"], [2, 2], [0, 0, 0, 0], [1, 1], "float32"], {}], "config": {"index": 36957, "code_hash": null, "entity": [["tile_fc", "sp", [-1, 4, 8]], ["tile_y", "sp", [-1, 2, 1]], ["tile_x", "sp", [-1, 2, 4]], ["tile_rcc", "sp", [-1, 4]], ["tile_ry", "sp", [-1, 1]], ["tile_rx", "sp", [-1, 1]], ["auto_unroll_max_step", "ot", 1500], ["unroll_explicit", "ot", 0]]}, "result": [[0.0032079552], 0, 7.450369119644165, 1639251518.0193825], "version": 0.2, "tvm_version": "0.8.dev0"}
{"input": ["opencl -keys=adreno,opencl,gpu -device=adreno -max_num_threads=256", "conv2d_nchwc_acc32.image2d", [["TENSOR", [1, 256, 14, 14, 4], "float32"], ["TENSOR", [512, 1024, 1, 1, 4], "float32"], [2, 2], [0, 0, 0, 0], [1, 1], "float32"], {}], "config": {"index": 78055, "code_hash": null, "entity": [["tile_fc", "sp", [-1, 2, 4]], ["tile_y", "sp", [-1, 2, 4]], ["tile_x", "sp", [-1, 2, 4]], ["tile_rcc", "sp", [-1, 128]], ["tile_ry", "sp", [-1, 1]], ["tile_rx", "sp", [-1, 1]], ["auto_unroll_max_step", "ot", 512], ["unroll_explicit", "ot", 1]]}, "result": [[0.00204854896], 0, 4.69425630569458, 1639251673.2490551], "version": 0.2, "tvm_version": "0.8.dev0"}
{"input": ["opencl -keys=adreno,opencl,gpu -device=adreno -max_num_threads=256", "conv2d_nchwc_acc32.image2d", [["TENSOR", [1, 256, 14, 14, 4], "float32"], ["TENSOR", [512, 1024, 1, 1, 4], "float32"], [2, 2], [0, 0, 0, 0], [1, 1], "float32"], {}], "config": {"index": 29995, "code_hash": null, "entity": [["tile_fc", "sp", [-1, 2, 4]], ["tile_y", "sp", [-1, 2, 4]], ["tile_x", "sp", [-1, 2, 4]], ["tile_rcc", "sp", [-1, 128]], ["tile_ry", "sp", [-1, 1]], ["tile_rx", "sp", [-1, 1]], ["auto_unroll_max_step", "ot", 512], ["unroll_explicit", "ot", 0]]}, "result": [[0.00190856042], 0, 8.044225931167603, 1639251676.7052581], "version": 0.2, "tvm_version": "0.8.dev0"}
{"input": ["opencl -keys=adreno,opencl,gpu -device=adreno -max_num_threads=256", "conv2d_nchwc_acc32.image2d", [["TENSOR", [1, 256, 14, 14, 4], "float32"], ["TENSOR", [512, 1024, 1, 1, 4], "float32"], [2, 2], [0, 0, 0, 0], [1, 1], "float32"], {}], "config": {"index": 78291, "code_hash": null, "entity": [["tile_fc", "sp", [-1, 2, 4]], ["tile_y", "sp", [-1, 2, 4]], ["tile_x", "sp", [-1, 1, 8]], ["tile_rcc", "sp", [-1, 128]], ["tile_ry", "sp", [-1, 1]], ["tile_rx", "sp", [-1, 1]], ["auto_unroll_max_step", "ot", 512], ["unroll_explicit", "ot", 1]]}, "result": [[0.0024836375], 0, 3.2370688915252686, 1639251680.2901404], "version": 0.2, "tvm_version": "0.8.dev0"}
{"input": ["opencl -keys=adreno,opencl,gpu -device=adreno -max_num_threads=256", "conv2d_nchwc_acc32.image2d", [["TENSOR", [1, 256, 14, 14, 4], "float32"], ["TENSOR", [512, 1024, 1, 1, 4], "float32"], [2, 2], [0, 0, 0, 0], [1, 1], "float32"], {}], "config": {"index": 77958, "code_hash": null, "entity": [["tile_fc", "sp", [-1, 2, 8]], ["tile_y", "sp", [-1, 1, 2]], ["tile_x", "sp", [-1, 2, 4]], ["tile_rcc", "sp", [-1, 128]], ["tile_ry", "sp", [-1, 1]], ["tile_rx", "sp", [-1, 1]], ["auto_unroll_max_step", "ot", 512], ["unroll_explicit", "ot", 1]]}, "result": [[0.00226180938], 0, 6.853355646133423, 1639251683.9458096], "version": 0.2, "tvm_version": "0.8.dev0"}
{"input": ["opencl -keys=adreno,opencl,gpu -device=adreno -max_num_threads=256", "conv2d_nchwc_acc32.image2d", [["TENSOR", [1, 256, 14, 14, 4], "float32"], ["TENSOR", [512, 1024, 1, 1, 4], "float32"], [2, 2], [0, 0, 0, 0], [1, 1], "float32"], {}], "config": {"index": 30231, "code_hash": null, "entity": [["tile_fc", "sp", [-1, 2, 4]], ["tile_y", "sp", [-1, 2, 4]], ["tile_x", "sp", [-1, 1, 8]], ["tile_rcc", "sp", [-1, 128]], ["tile_ry", "sp", [-1, 1]], ["tile_rx", "sp", [-1, 1]], ["auto_unroll_max_step", "ot", 512], ["unroll_explicit", "ot", 0]]}, "result": [[0.00235430832], 0, 3.521260976791382, 1639251688.0548115], "version": 0.2, "tvm_version": "0.8.dev0"}
{"input": ["opencl -keys=adreno,opencl,gpu -device=adreno -max_num_threads=256", "conv2d_nchwc_acc32.image2d", [["TENSOR", [1, 256, 14, 14, 4], "float32"], ["TENSOR", [512, 1024, 1, 1, 4], "float32"], [2, 2], [0, 0, 0, 0], [1, 1], "float32"], {}], "config": {"index": 76178, "code_hash": null, "entity": [["tile_fc", "sp", [-1, 2, 8]], ["tile_y", "sp", [-1, 1, 2]], ["tile_x", "sp", [-1, 2, 4]], ["tile_rcc", "sp", [-1, 64]], ["tile_ry", "sp", [-1, 1]], ["tile_rx", "sp", [-1, 1]], ["auto_unroll_max_step", "ot", 512], ["unroll_explicit", "ot", 1]]}, "result": [[0.0022536583400000003], 0, 6.586989879608154, 1639251691.1018765], "version": 0.2, "tvm_version": "0.8.dev0"}
{"input": ["opencl -keys=adreno,opencl,gpu -device=adreno -max_num_threads=256", "conv2d_nchwc_acc32.image2d", [["TENSOR", [1, 256, 14, 14, 4], "float32"], ["TENSOR", [512, 1024, 1, 1, 4], "float32"], [2, 2], [0, 0, 0, 0], [1, 1], "float32"], {}], "config": {"index": 78201, "code_hash": null, "entity": [["tile_fc", "sp", [-1, 2, 8]], ["tile_y", "sp", [-1, 1, 2]], ["tile_x", "sp", [-1, 1, 8]], ["tile_rcc", "sp", [-1, 128]], ["tile_ry", "sp", [-1, 1]], ["tile_rx", "sp", [-1, 1]], ["auto_unroll_max_step", "ot", 512], ["unroll_explicit", "ot", 1]]}, "result": [[0.00327071666], 0, 3.277329444885254, 1639251694.7802951], "version": 0.2, "tvm_version": "0.8.dev0"}
{"input": ["opencl -keys=adreno,opencl,gpu -device=adreno -max_num_threads=256", "conv2d_nchwc_acc32.image2d", [["TENSOR", [1, 256, 14, 14, 4], "float32"], ["TENSOR", [512, 1024, 1, 1, 4], "float32"], [2, 2], [0, 0, 0, 0], [1, 1], "float32"], {}], "config": {"index": 76511, "code_hash": null, "entity": [["tile_fc", "sp", [-1, 2, 4]], ["tile_y", "sp", [-1, 2, 4]], ["tile_x", "sp", [-1, 1, 8]], ["tile_rcc", "sp", [-1, 64]], ["tile_ry", "sp", [-1, 1]], ["tile_rx", "sp", [-1, 1]], ["auto_unroll_max_step", "ot", 512], ["unroll_explicit", "ot", 1]]}, "result": [[0.00247706146], 0, 6.450752258300781, 1639251697.9470267], "version": 0.2, "tvm_version": "0.8.dev0"}
{"input": ["opencl -keys=adreno,opencl,gpu -device=adreno -max_num_threads=256", "conv2d_nchwc_acc32.image2d", [["TENSOR", [1, 256, 14, 14, 4], "float32"], ["TENSOR", [512, 1024, 1, 1, 4], "float32"], [2, 2], [0, 0, 0, 0], [1, 1], "float32"], {}], "config": {"index": 77862, "code_hash": null, "entity": [["tile_fc", "sp", [-1, 2, 4]], ["tile_y", "sp", [-1, 1, 8]], ["tile_x", "sp", [-1, 1, 4]], ["tile_rcc", "sp", [-1, 128]], ["tile_ry", "sp", [-1, 1]], ["tile_rx", "sp", [-1, 1]], ["auto_unroll_max_step", "ot", 512], ["unroll_explicit", "ot", 1]]}, "result": [[0.0032548697800000004], 0, 3.2397420406341553, 1639251701.503683], "version": 0.2, "tvm_version": "0.8.dev0"}
{"input": ["opencl -keys=adreno,opencl,gpu -device=adreno -max_num_threads=256", "conv2d_nchwc_acc32.image2d", [["TENSOR", [1, 256, 14, 14, 4], "float32"], ["TENSOR", [512, 1024, 1, 1, 4], "float32"], [2, 2], [0, 0, 0, 0], [1, 1], "float32"], {}], "config": {"index": 78030, "code_hash": null, "entity": [["tile_fc", "sp", [-1, 2, 4]], ["tile_y", "sp", [-1, 1, 4]], ["tile_x", "sp", [-1, 2, 4]], ["tile_rcc", "sp", [-1, 128]], ["tile_ry", "sp", [-1, 1]], ["tile_rx", "sp", [-1, 1]], ["auto_unroll_max_step", "ot", 512], ["unroll_explicit", "ot", 1]]}, "result": [[0.0022761916600000003], 0, 9.615944862365723, 1639251707.9301023], "version": 0.2, "tvm_version": "0.8.dev0"}
{"input": ["opencl -keys=adreno,opencl,gpu -device=adreno -max_num_threads=256", "conv2d_nchwc_acc32.image2d", [["TENSOR", [1, 256, 14, 14, 4], "float32"], ["TENSOR", [512, 1024, 1, 1, 4], "float32"], [2, 2], [0, 0, 0, 0], [1, 1], "float32"], {}], "config": {"index": 28451, "code_hash": null, "entity": [["tile_fc", "sp", [-1, 2, 4]], ["tile_y", "sp", [-1, 2, 4]], ["tile_x", "sp", [-1, 1, 8]], ["tile_rcc", "sp", [-1, 64]], ["tile_ry", "sp", [-1, 1]], ["tile_rx", "sp", [-1, 1]], ["auto_unroll_max_step", "ot", 512], ["unroll_explicit", "ot", 0]]}, "result": [[0.0023639333400000003], 0, 2.9953012466430664, 1639251711.2779756], "version": 0.2, "tvm_version": "0.8.dev0"}
{"input": ["opencl -keys=adreno,opencl,gpu -device=adreno -max_num_threads=256", "conv2d_nchwc_acc32.image2d", [["TENSOR", [1, 256, 14, 14, 4], "float32"], ["TENSOR", [512, 1024, 1, 1, 4], "float32"], [2, 2], [0, 0, 0, 0], [1, 1], "float32"], {}], "config": {"index": 28215, "code_hash": null, "entity": [["tile_fc", "sp", [-1, 2, 4]], ["tile_y", "sp", [-1, 2, 4]], ["tile_x", "sp", [-1, 2, 4]], ["tile_rcc", "sp", [-1, 64]], ["tile_ry", "sp", [-1, 1]], ["tile_rx", "sp", [-1, 1]], ["auto_unroll_max_step", "ot", 512], ["unroll_explicit", "ot", 0]]}, "result": [[0.0019033333200000001], 0, 6.317259311676025, 1639251714.642241], "version": 0.2, "tvm_version": "0.8.dev0"}
{"input": ["opencl -keys=adreno,opencl,gpu -device=adreno -max_num_threads=256", "conv2d_nchwc_acc32.image2d", [["TENSOR", [1, 256, 14, 14, 4], "float32"], ["TENSOR", [512, 1024, 1, 1, 4], "float32"], [2, 2], [0, 0, 0, 0], [1, 1], "float32"], {}], "config": {"index": 76421, "code_hash": null, "entity": [["tile_fc", "sp", [-1, 2, 8]], ["tile_y", "sp", [-1, 1, 2]], ["tile_x", "sp", [-1, 1, 8]], ["tile_rcc", "sp", [-1, 64]], ["tile_ry", "sp", [-1, 1]], ["tile_rx", "sp", [-1, 1]], ["auto_unroll_max_step", "ot", 512], ["unroll_explicit", "ot", 1]]}, "result": [[0.0378980854], 0, 10.397266149520874, 1639251725.3576577], "version": 0.2, "tvm_version": "0.8.dev0"}
{"input": ["opencl -keys=adreno,opencl,gpu -device=adreno -max_num_threads=256", "conv2d_nchwc_acc32.image2d", [["TENSOR", [1, 256, 14, 14, 4], "float32"], ["TENSOR", [512, 1024, 1, 1, 4], "float32"], [2, 2], [0, 0, 0, 0], [1, 1], "float32"], {}], "config": {"index": 77982, "code_hash": null, "entity": [["tile_fc", "sp", [-1, 2, 8]], ["tile_y", "sp", [-1, 2, 2]], ["tile_x", "sp", [-1, 2, 4]], ["tile_rcc", "sp", [-1, 128]], ["tile_ry", "sp", [-1, 1]], ["tile_rx", "sp", [-1, 1]], ["auto_unroll_max_step", "ot", 512], ["unroll_explicit", "ot", 1]]}, "result": [[0.0020161510399999997], 0, 12.851508855819702, 1639251728.1875372], "version": 0.2, "tvm_version": "0.8.dev0"}
{"input": ["opencl -keys=adreno,opencl,gpu -device=adreno -max_num_threads=256", "conv2d_nchwc_acc32.image2d", [["TENSOR", [1, 256, 14, 14, 4], "float32"], ["TENSOR", [512, 1024, 1, 1, 4], "float32"], [2, 2], [0, 0, 0, 0], [1, 1], "float32"], {}], "config": {"index": 93978, "code_hash": null, "entity": [["tile_fc", "sp", [-1, 2, 8]], ["tile_y", "sp", [-1, 1, 2]], ["tile_x", "sp", [-1, 2, 4]], ["tile_rcc", "sp", [-1, 128]], ["tile_ry", "sp", [-1, 1]], ["tile_rx", "sp", [-1, 1]], ["auto_unroll_max_step", "ot", 1500], ["unroll_explicit", "ot", 1]]}, "result": [[0.0022545625], 0, 3.5423080921173096, 1639251732.0720394], "version": 0.2, "tvm_version": "0.8.dev0"}
{"input": ["opencl -keys=adreno,opencl,gpu -device=adreno -max_num_threads=256", "conv2d_nchwc_acc32.image2d", [["TENSOR", [1, 256, 14, 14, 4], "float32"], ["TENSOR", [512, 1024, 1, 1, 4], "float32"], [2, 2], [0, 0, 0, 0], [1, 1], "float32"], {}], "config": {"index": 29782, "code_hash": null, "entity": [["tile_fc", "sp", [-1, 2, 8]], ["tile_y", "sp", [-1, 2, 4]], ["tile_x", "sp", [-1, 1, 4]], ["tile_rcc", "sp", [-1, 128]], ["tile_ry", "sp", [-1, 1]], ["tile_rx", "sp", [-1, 1]], ["auto_unroll_max_step", "ot", 512], ["unroll_explicit", "ot", 0]]}, "result": [[0.00214109688], 0, 6.571312189102173, 1639251735.163708], "version": 0.2, "tvm_version": "0.8.dev0"}
{"input": ["opencl -keys=adreno,opencl,gpu -device=adreno -max_num_threads=256", "conv2d_nchwc_acc32.image2d", [["TENSOR", [1, 256, 14, 14, 4], "float32"], ["TENSOR", [512, 1024, 1, 1, 4], "float32"], [2, 2], [0, 0, 0, 0], [1, 1], "float32"], {}], "config": {"index": 77817, "code_hash": null, "entity": [["tile_fc", "sp", [-1, 2, 8]], ["tile_y", "sp", [-1, 1, 4]], ["tile_x", "sp", [-1, 1, 4]], ["tile_rcc", "sp", [-1, 128]], ["tile_ry", "sp", [-1, 1]], ["tile_rx", "sp", [-1, 1]], ["auto_unroll_max_step", "ot", 512], ["unroll_explicit", "ot", 1]]}, "result": [[0.00398327916], 0, 3.815434455871582, 1639251739.3536007], "version": 0.2, "tvm_version": "0.8.dev0"}
{"input": ["opencl -keys=adreno,opencl,gpu -device=adreno -max_num_threads=256", "conv2d_nchwc_acc32.image2d", [["TENSOR", [1, 256, 14, 14, 4], "float32"], ["TENSOR", [512, 1024, 1, 1, 4], "float32"], [2, 2], [0, 0, 0, 0], [1, 1], "float32"], {}], "config": {"index": 77453, "code_hash": null, "entity": [["tile_fc", "sp", [-1, 2, 4]], ["tile_y", "sp", [-1, 1, 8]], ["tile_x", "sp", [-1, 2, 2]], ["tile_rcc", "sp", [-1, 128]], ["tile_ry", "sp", [-1, 1]], ["tile_rx", "sp", [-1, 1]], ["auto_unroll_max_step", "ot", 512], ["unroll_explicit", "ot", 1]]}, "result": [[0.00224132396], 0, 6.7533910274505615, 1639251742.3323638], "version": 0.2, "tvm_version": "0.8.dev0"}
{"input": ["opencl -keys=adreno,opencl,gpu -device=adreno -max_num_threads=256", "conv2d_nchwc_acc32.image2d", [["TENSOR", [1, 256, 14, 14, 4], "float32"], ["TENSOR", [512, 1024, 1, 1, 4], "float32"], [2, 2], [0, 0, 0, 0], [1, 1], "float32"], {}], "config": {"index": 74731, "code_hash": null, "entity": [["tile_fc", "sp", [-1, 2, 4]], ["tile_y", "sp", [-1, 2, 4]], ["tile_x", "sp", [-1, 1, 8]], ["tile_rcc", "sp", [-1, 32]], ["tile_ry", "sp", [-1, 1]], ["tile_rx", "sp", [-1, 1]], ["auto_unroll_max_step", "ot", 512], ["unroll_explicit", "ot", 1]]}, "result": [[0.016298304160000002], 0, 6.04704475402832, 1639251748.727651], "version": 0.2, "tvm_version": "0.8.dev0"}
{"input": ["opencl -keys=adreno,opencl,gpu -device=adreno -max_num_threads=256", "conv2d_nchwc_acc32.image2d", [["TENSOR", [1, 256, 14, 14, 4], "float32"], ["TENSOR", [512, 1024, 1, 1, 4], "float32"], [2, 2], [0, 0, 0, 0], [1, 1], "float32"], {}], "config": {"index": 78290, "code_hash": null, "entity": [["tile_fc", "sp", [-1, 1, 4]], ["tile_y", "sp", [-1, 2, 4]], ["tile_x", "sp", [-1, 1, 8]], ["tile_rcc", "sp", [-1, 128]], ["tile_ry", "sp", [-1, 1]], ["tile_rx", "sp", [-1, 1]], ["auto_unroll_max_step", "ot", 512], ["unroll_explicit", "ot", 1]]}, "result": [[0.00258245834], 0, 8.801713466644287, 1639251751.880254], "version": 0.2, "tvm_version": "0.8.dev0"}
{"input": ["opencl -keys=adreno,opencl,gpu -device=adreno -max_num_threads=256", "conv2d_nchwc_acc32.image2d", [["TENSOR", [1, 256, 14, 14, 4], "float32"], ["TENSOR", [512, 1024, 1, 1, 4], "float32"], [2, 2], [0, 0, 0, 0], [1, 1], "float32"], {}], "config": {"index": 29898, "code_hash": null, "entity": [["tile_fc", "sp", [-1, 2, 8]], ["tile_y", "sp", [-1, 1, 2]], ["tile_x", "sp", [-1, 2, 4]], ["tile_rcc", "sp", [-1, 128]], ["tile_ry", "sp", [-1, 1]], ["tile_rx", "sp", [-1, 1]], ["auto_unroll_max_step", "ot", 512], ["unroll_explicit", "ot", 0]]}, "result": [[0.00214434894], 0, 3.1068813800811768, 1639251755.3178155], "version": 0.2, "tvm_version": "0.8.dev0"}
{"input": ["opencl -keys=adreno,opencl,gpu -device=adreno -max_num_threads=256", "conv2d_nchwc_acc32.image2d", [["TENSOR", [1, 256, 14, 14, 4], "float32"], ["TENSOR", [512, 1024, 1, 1, 4], "float32"], [2, 2], [0, 0, 0, 0], [1, 1], "float32"], {}], "config": {"index": 77842, "code_hash": null, "entity": [["tile_fc", "sp", [-1, 2, 8]], ["tile_y", "sp", [-1, 2, 4]], ["tile_x", "sp", [-1, 1, 4]], ["tile_rcc", "sp", [-1, 128]], ["tile_ry", "sp", [-1, 1]], ["tile_rx", "sp", [-1, 1]], ["auto_unroll_max_step", "ot", 512], ["unroll_explicit", "ot", 1]]}, "result": [[0.0022231948], 0, 6.2136969566345215, 1639251758.4454417], "version": 0.2, "tvm_version": "0.8.dev0"}
{"input": ["opencl -keys=adreno,opencl,gpu -device=adreno -max_num_threads=256", "conv2d_nchwc_acc32.image2d", [["TENSOR", [1, 256, 14, 14, 4], "float32"], ["TENSOR", [512, 1024, 1, 1, 4], "float32"], [2, 2], [0, 0, 0, 0], [1, 1], "float32"], {}], "config": {"index": 78054, "code_hash": null, "entity": [["tile_fc", "sp", [-1, 1, 4]], ["tile_y", "sp", [-1, 2, 4]], ["tile_x", "sp", [-1, 2, 4]], ["tile_rcc", "sp", [-1, 128]], ["tile_ry", "sp", [-1, 1]], ["tile_rx", "sp", [-1, 1]], ["auto_unroll_max_step", "ot", 512], ["unroll_explicit", "ot", 1]]}, "result": [[0.00248787292], 0, 3.1577165126800537, 1639251761.9916832], "version": 0.2, "tvm_version": "0.8.dev0"}
{"input": ["opencl -keys=adreno,opencl,gpu -device=adreno -max_num_threads=256", "conv2d_nchwc_acc32.image2d", [["TENSOR", [1, 256, 14, 14, 4], "float32"], ["TENSOR", [512, 1024, 1, 1, 4], "float32"], [2, 2], [0, 0, 0, 0], [1, 1], "float32"], {}], "config": {"index": 26671, "code_hash": null, "entity": [["tile_fc", "sp", [-1, 2, 4]], ["tile_y", "sp", [-1, 2, 4]], ["tile_x", "sp", [-1, 1, 8]], ["tile_rcc", "sp", [-1, 32]], ["tile_ry", "sp", [-1, 1]], ["tile_rx", "sp", [-1, 1]], ["auto_unroll_max_step", "ot", 512], ["unroll_explicit", "ot", 0]]}, "result": [[0.00234462084], 0, 6.150353908538818, 1639251765.0340555], "version": 0.2, "tvm_version": "0.8.dev0"}
{"input": ["opencl -keys=adreno,opencl,gpu -device=adreno -max_num_threads=256", "conv2d_nchwc_acc32.image2d", [["TENSOR", [1, 256, 14, 14, 4], "float32"], ["TENSOR", [512, 1024, 1, 1, 4], "float32"], [2, 2], [0, 0, 0, 0], [1, 1], "float32"], {}], "config": {"index": 30230, "code_hash": null, "entity": [["tile_fc", "sp", [-1, 1, 4]], ["tile_y", "sp", [-1, 2, 4]], ["tile_x", "sp", [-1, 1, 8]], ["tile_rcc", "sp", [-1, 128]], ["tile_ry", "sp", [-1, 1]], ["tile_rx", "sp", [-1, 1]], ["auto_unroll_max_step", "ot", 512], ["unroll_explicit", "ot", 0]]}, "result": [[0.00254064792], 0, 3.376732587814331, 1639251769.6978183], "version": 0.2, "tvm_version": "0.8.dev0"}
{"input": ["opencl -keys=adreno,opencl,gpu -device=adreno -max_num_threads=256", "conv2d_nchwc_acc32.image2d", [["TENSOR", [1, 256, 14, 14, 4], "float32"], ["TENSOR", [512, 1024, 1, 1, 4], "float32"], [2, 2], [0, 0, 0, 0], [1, 1], "float32"], {}], "config": {"index": 92198, "code_hash": null, "entity": [["tile_fc", "sp", [-1, 2, 8]], ["tile_y", "sp", [-1, 1, 2]], ["tile_x", "sp", [-1, 2, 4]], ["tile_rcc", "sp", [-1, 64]], ["tile_ry", "sp", [-1, 1]], ["tile_rx", "sp", [-1, 1]], ["auto_unroll_max_step", "ot", 1500], ["unroll_explicit", "ot", 1]]}, "result": [[0.02651546458], 0, 12.00291132926941, 1639251777.4063106], "version": 0.2, "tvm_version": "0.8.dev0"}
{"input": ["opencl -keys=adreno,opencl,gpu -device=adreno -max_num_threads=256", "conv2d_nchwc_acc32.image2d", [["TENSOR", [1, 256, 14, 14, 4], "float32"], ["TENSOR", [512, 1024, 1, 1, 4], "float32"], [2, 2], [0, 0, 0, 0], [1, 1], "float32"], {}], "config": {"index": 29802, "code_hash": null, "entity": [["tile_fc", "sp", [-1, 2, 4]], ["tile_y", "sp", [-1, 1, 8]], ["tile_x", "sp", [-1, 1, 4]], ["tile_rcc", "sp", [-1, 128]], ["tile_ry", "sp", [-1, 1]], ["tile_rx", "sp", [-1, 1]], ["auto_unroll_max_step", "ot", 512], ["unroll_explicit", "ot", 0]]}, "result": [[0.00324535312], 0, 3.4043850898742676, 1639251781.3119373], "version": 0.2, "tvm_version": "0.8.dev0"}
{"input": ["opencl -keys=adreno,opencl,gpu -device=adreno -max_num_threads=256", "conv2d_nchwc_acc32.image2d", [["TENSOR", [1, 256, 14, 14, 4], "float32"], ["TENSOR", [512, 1024, 1, 1, 4], "float32"], [2, 2], [0, 0, 0, 0], [1, 1], "float32"], {}], "config": {"index": 29970, "code_hash": null, "entity": [["tile_fc", "sp", [-1, 2, 4]], ["tile_y", "sp", [-1, 1, 4]], ["tile_x", "sp", [-1, 2, 4]], ["tile_rcc", "sp", [-1, 128]], ["tile_ry", "sp", [-1, 1]], ["tile_rx", "sp", [-1, 1]], ["auto_unroll_max_step", "ot", 512], ["unroll_explicit", "ot", 0]]}, "result": [[0.00213315624], 0, 6.378898859024048, 1639251784.2671146], "version": 0.2, "tvm_version": "0.8.dev0"}
{"input": ["opencl -keys=adreno,opencl,gpu -device=adreno -max_num_threads=256", "conv2d_nchwc_acc32.image2d", [["TENSOR", [1, 256, 14, 14, 4], "float32"], ["TENSOR", [512, 1024, 1, 1, 4], "float32"], [2, 2], [0, 0, 0, 0], [1, 1], "float32"], {}], "config": {"index": 75888, "code_hash": null, "entity": [["tile_fc", "sp", [-1, 1, 32]], ["tile_y", "sp", [-1, 1, 1]], ["tile_x", "sp", [-1, 1, 4]], ["tile_rcc", "sp", [-1, 64]], ["tile_ry", "sp", [-1, 1]], ["tile_rx", "sp", [-1, 1]], ["auto_unroll_max_step", "ot", 512], ["unroll_explicit", "ot", 1]]}, "result": [[0.02770734478], 0, 7.37524938583374, 1639251791.9516222], "version": 0.2, "tvm_version": "0.8.dev0"}
{"input": ["opencl -keys=adreno,opencl,gpu -device=adreno -max_num_threads=256", "conv2d_nchwc_acc32.image2d", [["TENSOR", [1, 256, 14, 14, 4], "float32"], ["TENSOR", [512, 1024, 1, 1, 4], "float32"], [2, 2], [0, 0, 0, 0], [1, 1], "float32"], {}], "config": {"index": 78226, "code_hash": null, "entity": [["tile_fc", "sp", [-1, 2, 8]], ["tile_y", "sp", [-1, 2, 2]], ["tile_x", "sp", [-1, 1, 8]], ["tile_rcc", "sp", [-1, 128]], ["tile_ry", "sp", [-1, 1]], ["tile_rx", "sp", [-1, 1]], ["auto_unroll_max_step", "ot", 512], ["unroll_explicit", "ot", 1]]}, "result": [[0.00224843542], 0, 10.388742208480835, 1639251795.1388314], "version": 0.2, "tvm_version": "0.8.dev0"}
{"input": ["opencl -keys=adreno,opencl,gpu -device=adreno -max_num_threads=256", "conv2d_nchwc_acc32.image2d", [["TENSOR", [1, 256, 14, 14, 4], "float32"], ["TENSOR", [512, 1024, 1, 1, 4], "float32"], [2, 2], [0, 0, 0, 0], [1, 1], "float32"], {}], "config": {"index": 29994, "code_hash": null, "entity": [["tile_fc", "sp", [-1, 1, 4]], ["tile_y", "sp", [-1, 2, 4]], ["tile_x", "sp", [-1, 2, 4]], ["tile_rcc", "sp", [-1, 128]], ["tile_ry", "sp", [-1, 1]], ["tile_rx", "sp", [-1, 1]], ["auto_unroll_max_step", "ot", 512], ["unroll_explicit", "ot", 0]]}, "result": [[0.00194289478], 0, 3.33648419380188, 1639251798.8487327], "version": 0.2, "tvm_version": "0.8.dev0"}
{"input": ["opencl -keys=adreno,opencl,gpu -device=adreno -max_num_threads=256", "conv2d_nchwc_acc32.image2d", [["TENSOR", [1, 256, 14, 14, 4], "float32"], ["TENSOR", [512, 1024, 1, 1, 4], "float32"], [2, 2], [0, 0, 0, 0], [1, 1], "float32"], {}], "config": {"index": 77822, "code_hash": null, "entity": [["tile_fc", "sp", [-1, 2, 16]], ["tile_y", "sp", [-1, 1, 4]], ["tile_x", "sp", [-1, 1, 4]], ["tile_rcc", "sp", [-1, 128]], ["tile_ry", "sp", [-1, 1]], ["tile_rx", "sp", [-1, 1]], ["auto_unroll_max_step", "ot", 512], ["unroll_explicit", "ot", 1]]}, "result": [[0.00394387708], 0, 6.782595634460449, 1639251802.3321657], "version": 0.2, "tvm_version": "0.8.dev0"}
{"input": ["opencl -keys=adreno,opencl,gpu -device=adreno -max_num_threads=256", "conv2d_nchwc_acc32.image2d", [["TENSOR", [1, 256, 14, 14, 4], "float32"], ["TENSOR", [512, 1024, 1, 1, 4], "float32"], [2, 2], [0, 0, 0, 0], [1, 1], "float32"], {}], "config": {"index": 75907, "code_hash": null, "entity": [["tile_fc", "sp", [-1, 1, 32]], ["tile_y", "sp", [-1, 2, 1]], ["tile_x", "sp", [-1, 1, 4]], ["tile_rcc", "sp", [-1, 64]], ["tile_ry", "sp", [-1, 1]], ["tile_rx", "sp", [-1, 1]], ["auto_unroll_max_step", "ot", 512], ["unroll_explicit", "ot", 1]]}, "result": [[0.02278322394], 0, 7.066111326217651, 1639251809.739725], "version": 0.2, "tvm_version": "0.8.dev0"}
{"input": ["opencl -keys=adreno,opencl,gpu -device=adreno -max_num_threads=256", "conv2d_nchwc_acc32.image2d", [["TENSOR", [1, 256, 14, 14, 4], "float32"], ["TENSOR", [512, 1024, 1, 1, 4], "float32"], [2, 2], [0, 0, 0, 0], [1, 1], "float32"], {}], "config": {"index": 74862, "code_hash": null, "entity": [["tile_fc", "sp", [-1, 1, 16]], ["tile_y", "sp", [-1, 2, 4]], ["tile_x", "sp", [-1, 1, 1]], ["tile_rcc", "sp", [-1, 64]], ["tile_ry", "sp", [-1, 1]], ["tile_rx", "sp", [-1, 1]], ["auto_unroll_max_step", "ot", 512], ["unroll_explicit", "ot", 1]]}, "result": [[0.018820808320000004], 0, 13.168081760406494, 1639251815.931106], "version": 0.2, "tvm_version": "0.8.dev0"}
{"input": ["opencl -keys=adreno,opencl,gpu -device=adreno -max_num_threads=256", "conv2d_nchwc_acc32.image2d", [["TENSOR", [1, 256, 14, 14, 4], "float32"], ["TENSOR", [512, 1024, 1, 1, 4], "float32"], [2, 2], [0, 0, 0, 0], [1, 1], "float32"], {}], "config": {"index": 62035, "code_hash": null, "entity": [["tile_fc", "sp", [-1, 2, 4]], ["tile_y", "sp", [-1, 2, 4]], ["tile_x", "sp", [-1, 2, 4]], ["tile_rcc", "sp", [-1, 128]], ["tile_ry", "sp", [-1, 1]], ["tile_rx", "sp", [-1, 1]], ["auto_unroll_max_step", "ot", 0], ["unroll_explicit", "ot", 1]]}, "result": [[0.0020536375000000003], 0, 3.7729218006134033, 1639251820.0929492], "version": 0.2, "tvm_version": "0.8.dev0"}
{"input": ["opencl -keys=adreno,opencl,gpu -device=adreno -max_num_threads=256", "conv2d_nchwc_acc32.image2d", [["TENSOR", [1, 256, 14, 14, 4], "float32"], ["TENSOR", [512, 1024, 1, 1, 4], "float32"], [2, 2], [0, 0, 0, 0], [1, 1], "float32"], {}], "config": {"index": 74495, "code_hash": null, "entity": [["tile_fc", "sp", [-1, 2, 4]], ["tile_y", "sp", [-1, 2, 4]], ["tile_x", "sp", [-1, 2, 4]], ["tile_rcc", "sp", [-1, 32]], ["tile_ry", "sp", [-1, 1]], ["tile_rx", "sp", [-1, 1]], ["auto_unroll_max_step", "ot", 512], ["unroll_explicit", "ot", 1]]}, "result": [[0.00204443646], 0, 7.423986434936523, 1639251823.7794788], "version": 0.2, "tvm_version": "0.8.dev0"}
{"input": ["opencl -keys=adreno,opencl,gpu -device=adreno -max_num_threads=256", "conv2d_nchwc_acc32.image2d", [["TENSOR", [1, 256, 14, 14, 4], "float32"], ["TENSOR", [512, 1024, 1, 1, 4], "float32"], [2, 2], [0, 0, 0, 0], [1, 1], "float32"], {}], "config": {"index": 77959, "code_hash": null, "entity": [["tile_fc", "sp", [-1, 4, 8]], ["tile_y", "sp", [-1, 1, 2]], ["tile_x", "sp", [-1, 2, 4]], ["tile_rcc", "sp", [-1, 128]], ["tile_ry", "sp", [-1, 1]], ["tile_rx", "sp", [-1, 1]], ["auto_unroll_max_step", "ot", 512], ["unroll_explicit", "ot", 1]]}, "result": [[0.00371131146], 0, 3.813251256942749, 1639251828.2301362], "version": 0.2, "tvm_version": "0.8.dev0"}
{"input": ["opencl -keys=adreno,opencl,gpu -device=adreno -max_num_threads=256", "conv2d_nchwc_acc32.image2d", [["TENSOR", [1, 256, 14, 14, 4], "float32"], ["TENSOR", [512, 1024, 1, 1, 4], "float32"], [2, 2], [0, 0, 0, 0], [1, 1], "float32"], {}], "config": {"index": 76510, "code_hash": null, "entity": [["tile_fc", "sp", [-1, 1, 4]], ["tile_y", "sp", [-1, 2, 4]], ["tile_x", "sp", [-1, 1, 8]], ["tile_rcc", "sp", [-1, 64]], ["tile_ry", "sp", [-1, 1]], ["tile_rx", "sp", [-1, 1]], ["auto_unroll_max_step", "ot", 512], ["unroll_explicit", "ot", 1]]}, "result": [[0.02096417708], 0, 10.380937337875366, 1639251834.5258734], "version": 0.2, "tvm_version": "0.8.dev0"}
{"input": ["opencl -keys=adreno,opencl,gpu -device=adreno -max_num_threads=256", "conv2d_nchwc_acc32.image2d", [["TENSOR", [1, 256, 14, 14, 4], "float32"], ["TENSOR", [512, 1024, 1, 1, 4], "float32"], [2, 2], [0, 0, 0, 0], [1, 1], "float32"], {}], "config": {"index": 61938, "code_hash": null, "entity": [["tile_fc", "sp", [-1, 2, 8]], ["tile_y", "sp", [-1, 1, 2]], ["tile_x", "sp", [-1, 2, 4]], ["tile_rcc", "sp", [-1, 128]], ["tile_ry", "sp", [-1, 1]], ["tile_rx", "sp", [-1, 1]], ["auto_unroll_max_step", "ot", 0], ["unroll_explicit", "ot", 1]]}, "result": [[0.0022646843599999997], 0, 3.2661094665527344, 1639251838.1218536], "version": 0.2, "tvm_version": "0.8.dev0"}
{"input": ["opencl -keys=adreno,opencl,gpu -device=adreno -max_num_threads=256", "conv2d_nchwc_acc32.image2d", [["TENSOR", [1, 256, 14, 14, 4], "float32"], ["TENSOR", [512, 1024, 1, 1, 4], "float32"], [2, 2], [0, 0, 0, 0], [1, 1], "float32"], {}], "config": {"index": 74858, "code_hash": null, "entity": [["tile_fc", "sp", [-1, 2, 8]], ["tile_y", "sp", [-1, 2, 4]], ["tile_x", "sp", [-1, 1, 1]], ["tile_rcc", "sp", [-1, 64]], ["tile_ry", "sp", [-1, 1]], ["tile_rx", "sp", [-1, 1]], ["auto_unroll_max_step", "ot", 512], ["unroll_explicit", "ot", 1]]}, "result": [[0.00307248438], 0, 6.721336841583252, 1639251841.6290545], "version": 0.2, "tvm_version": "0.8.dev0"}
