sd888_log/ww50/conv2d_1_129_129_144x3_3_144_1/depthwise_conv2d_nchwc.log.tmp
{"input": ["opencl -keys=adreno,opencl,gpu -device=adreno -max_num_threads=256", "depthwise_conv2d_nchwc_acc32.image2d", [["TENSOR", [1, 36, 129, 129, 4], "float16"], ["TENSOR", [36, 1, 3, 3, 4], "float16"], [1, 1], [1, 1, 1, 1], [1, 1], "float16"], {}], "config": {"index": 89031, "code_hash": null, "entity": [["tile_fc", "sp", [-1, 1, 12, 1]], ["tile_y", "sp", [-1, 43, 1, 3]], ["tile_x", "sp", [-1, 3, 43, 1]], ["tile_ry", "sp", [-1, 3]], ["tile_rx", "sp", [-1, 3]], ["auto_unroll_max_step", "ot", 0], ["unroll_explicit", "ot", 0]]}, "result": [[0.04038992916], 0, 9.170913934707642, 1639731120.2640224], "version": 0.2, "tvm_version": "0.8.dev0"}
{"input": ["opencl -keys=adreno,opencl,gpu -device=adreno -max_num_threads=256", "depthwise_conv2d_nchwc_acc32.image2d", [["TENSOR", [1, 36, 129, 129, 4], "float16"], ["TENSOR", [36, 1, 3, 3, 4], "float16"], [1, 1], [1, 1, 1, 1], [1, 1], "float16"], {}], "config": {"index": 199146, "code_hash": null, "entity": [["tile_fc", "sp", [-1, 2, 3, 2]], ["tile_y", "sp", [-1, 3, 43, 1]], ["tile_x", "sp", [-1, 1, 1, 43]], ["tile_ry", "sp", [-1, 3]], ["tile_rx", "sp", [-1, 3]], ["auto_unroll_max_step", "ot", 512], ["unroll_explicit", "ot", 0]]}, "result": [[0.0411164406], 0, 9.258544921875, 1639731157.6800196], "version": 0.2, "tvm_version": "0.8.dev0"}
{"input": ["opencl -keys=adreno,opencl,gpu -device=adreno -max_num_threads=256", "depthwise_conv2d_nchwc_acc32.image2d", [["TENSOR", [1, 36, 129, 129, 4], "float16"], ["TENSOR", [36, 1, 3, 3, 4], "float16"], [1, 1], [1, 1, 1, 1], [1, 1], "float16"], {}], "config": {"index": 77852, "code_hash": null, "entity": [["tile_fc", "sp", [-1, 2, 9, 2]], ["tile_y", "sp", [-1, 43, 1, 3]], ["tile_x", "sp", [-1, 1, 1, 1]], ["tile_ry", "sp", [-1, 3]], ["tile_rx", "sp", [-1, 3]], ["auto_unroll_max_step", "ot", 0], ["unroll_explicit", "ot", 0]]}, "result": [[0.046837859360000005], 0, 10.352520227432251, 1639731170.9325206], "version": 0.2, "tvm_version": "0.8.dev0"}
{"input": ["opencl -keys=adreno,opencl,gpu -device=adreno -max_num_threads=256", "depthwise_conv2d_nchwc_acc32.image2d", [["TENSOR", [1, 36, 129, 129, 4], "float16"], ["TENSOR", [36, 1, 3, 3, 4], "float16"], [1, 1], [1, 1, 1, 1], [1, 1], "float16"], {}], "config": {"index": 44826, "code_hash": null, "entity": [["tile_fc", "sp", [-1, 3, 6, 1]], ["tile_y", "sp", [-1, 1, 1, 1]], ["tile_x", "sp", [-1, 1, 1, 43]], ["tile_ry", "sp", [-1, 3]], ["tile_rx", "sp", [-1, 1]], ["auto_unroll_max_step", "ot", 0], ["unroll_explicit", "ot", 0]]}, "result": [[0.012963776040000001], 0, 10.327475309371948, 1639731182.353235], "version": 0.2, "tvm_version": "0.8.dev0"}
{"input": ["opencl -keys=adreno,opencl,gpu -device=adreno -max_num_threads=256", "depthwise_conv2d_nchwc_acc32.image2d", [["TENSOR", [1, 36, 129, 129, 4], "float16"], ["TENSOR", [36, 1, 3, 3, 4], "float16"], [1, 1], [1, 1, 1, 1], [1, 1], "float16"], {}], "config": {"index": 200049, "code_hash": null, "entity": [["tile_fc", "sp", [-1, 1, 6, 2]], ["tile_y", "sp", [-1, 1, 1, 1]], ["tile_x", "sp", [-1, 3, 1, 43]], ["tile_ry", "sp", [-1, 3]], ["tile_rx", "sp", [-1, 3]], ["auto_unroll_max_step", "ot", 512], ["unroll_explicit", "ot", 0]]}, "result": [[0.014100187499999998], 0, 4.573707580566406, 1639731187.154106], "version": 0.2, "tvm_version": "0.8.dev0"}
{"input": ["opencl -keys=adreno,opencl,gpu -device=adreno -max_num_threads=256", "depthwise_conv2d_nchwc_acc32.image2d", [["TENSOR", [1, 36, 129, 129, 4], "float16"], ["TENSOR", [36, 1, 3, 3, 4], "float16"], [1, 1], [1, 1, 1, 1], [1, 1], "float16"], {}], "config": {"index": 383516, "code_hash": null, "entity": [["tile_fc", "sp", [-1, 2, 3, 1]], ["tile_y", "sp", [-1, 1, 43, 3]], ["tile_x", "sp", [-1, 1, 1, 129]], ["tile_ry", "sp", [-1, 1]], ["tile_rx", "sp", [-1, 3]], ["auto_unroll_max_step", "ot", 0], ["unroll_explicit", "ot", 1]]}, "result": [[0.01657049688], 0, 6.064806222915649, 1639731222.2024539], "version": 0.2, "tvm_version": "0.8.dev0"}
{"input": ["opencl -keys=adreno,opencl,gpu -device=adreno -max_num_threads=256", "depthwise_conv2d_nchwc_acc32.image2d", [["TENSOR", [1, 36, 129, 129, 4], "float16"], ["TENSOR", [36, 1, 3, 3, 4], "float16"], [1, 1], [1, 1, 1, 1], [1, 1], "float16"], {}], "config": {"index": 77555, "code_hash": null, "entity": [["tile_fc", "sp", [-1, 2, 1, 3]], ["tile_y", "sp", [-1, 3, 43, 1]], ["tile_x", "sp", [-1, 1, 1, 1]], ["tile_ry", "sp", [-1, 3]], ["tile_rx", "sp", [-1, 3]], ["auto_unroll_max_step", "ot", 0], ["unroll_explicit", "ot", 0]]}, "result": [[0.046114445819999995], 0, 12.157377481460571, 1639731292.5170364], "version": 0.2, "tvm_version": "0.8.dev0"}
{"input": ["opencl -keys=adreno,opencl,gpu -device=adreno -max_num_threads=256", "depthwise_conv2d_nchwc_acc32.image2d", [["TENSOR", [1, 36, 129, 129, 4], "float16"], ["TENSOR", [36, 1, 3, 3, 4], "float16"], [1, 1], [1, 1, 1, 1], [1, 1], "float16"], {}], "config": {"index": 90006, "code_hash": null, "entity": [["tile_fc", "sp", [-1, 12, 1, 1]], ["tile_y", "sp", [-1, 1, 3, 1]], ["tile_x", "sp", [-1, 1, 129, 1]], ["tile_ry", "sp", [-1, 3]], ["tile_rx", "sp", [-1, 3]], ["auto_unroll_max_step", "ot", 0], ["unroll_explicit", "ot", 0]]}, "result": [[0.00205438334], 0, 3.08130145072937, 1639731295.8593001], "version": 0.2, "tvm_version": "0.8.dev0"}
{"input": ["opencl -keys=adreno,opencl,gpu -device=adreno -max_num_threads=256", "depthwise_conv2d_nchwc_acc32.image2d", [["TENSOR", [1, 36, 129, 129, 4], "float16"], ["TENSOR", [36, 1, 3, 3, 4], "float16"], [1, 1], [1, 1, 1, 1], [1, 1], "float16"], {}], "config": {"index": 462206, "code_hash": null, "entity": [["tile_fc", "sp", [-1, 12, 1, 1]], ["tile_y", "sp", [-1, 1, 3, 43]], ["tile_x", "sp", [-1, 1, 1, 1]], ["tile_ry", "sp", [-1, 1]], ["tile_rx", "sp", [-1, 3]], ["auto_unroll_max_step", "ot", 512], ["unroll_explicit", "ot", 1]]}, "result": [[0.06840986455999999], 0, 16.240444660186768, 1639731308.9876237], "version": 0.2, "tvm_version": "0.8.dev0"}
{"input": ["opencl -keys=adreno,opencl,gpu -device=adreno -max_num_threads=256", "depthwise_conv2d_nchwc_acc32.image2d", [["TENSOR", [1, 36, 129, 129, 4], "float16"], ["TENSOR", [36, 1, 3, 3, 4], "float16"], [1, 1], [1, 1, 1, 1], [1, 1], "float16"], {}], "config": {"index": 96091, "code_hash": null, "entity": [["tile_fc", "sp", [-1, 2, 2, 9]], ["tile_y", "sp", [-1, 1, 1, 1]], ["tile_x", "sp", [-1, 1, 1, 43]], ["tile_ry", "sp", [-1, 3]], ["tile_rx", "sp", [-1, 3]], ["auto_unroll_max_step", "ot", 0], ["unroll_explicit", "ot", 0]]}, "result": [[0.02931435], 0, 6.878406047821045, 1639731316.1309881], "version": 0.2, "tvm_version": "0.8.dev0"}
{"input": ["opencl -keys=adreno,opencl,gpu -device=adreno -max_num_threads=256", "depthwise_conv2d_nchwc_acc32.image2d", [["TENSOR", [1, 36, 129, 129, 4], "float16"], ["TENSOR", [36, 1, 3, 3, 4], "float16"], [1, 1], [1, 1, 1, 1], [1, 1], "float16"], {}], "config": {"index": 384021, "code_hash": null, "entity": [["tile_fc", "sp", [-1, 1, 4, 1]], ["tile_y", "sp", [-1, 1, 1, 1]], ["tile_x", "sp", [-1, 1, 1, 1]], ["tile_ry", "sp", [-1, 3]], ["tile_rx", "sp", [-1, 3]], ["auto_unroll_max_step", "ot", 0], ["unroll_explicit", "ot", 1]]}, "result": [[0.0056557104200000005], 0, 10.325467109680176, 1639731319.5852044], "version": 0.2, "tvm_version": "0.8.dev0"}
{"input": ["opencl -keys=adreno,opencl,gpu -device=adreno -max_num_threads=256", "depthwise_conv2d_nchwc_acc32.image2d", [["TENSOR", [1, 36, 129, 129, 4], "float16"], ["TENSOR", [36, 1, 3, 3, 4], "float16"], [1, 1], [1, 1, 1, 1], [1, 1], "float16"], {}], "config": {"index": 192225, "code_hash": null, "entity": [["tile_fc", "sp", [-1, 2, 6, 1]], ["tile_y", "sp", [-1, 43, 1, 1]], ["tile_x", "sp", [-1, 1, 129, 1]], ["tile_ry", "sp", [-1, 3]], ["tile_rx", "sp", [-1, 3]], ["auto_unroll_max_step", "ot", 512], ["unroll_explicit", "ot", 0]]}, "result": [[0.025636223939999998], 0, 7.036728382110596, 1639731326.853032], "version": 0.2, "tvm_version": "0.8.dev0"}
{"input": ["opencl -keys=adreno,opencl,gpu -device=adreno -max_num_threads=256", "depthwise_conv2d_nchwc_acc32.image2d", [["TENSOR", [1, 36, 129, 129, 4], "float16"], ["TENSOR", [36, 1, 3, 3, 4], "float16"], [1, 1], [1, 1, 1, 1], [1, 1], "float16"], {}], "config": {"index": 397117, "code_hash": null, "entity": [["tile_fc", "sp", [-1, 3, 3, 1]], ["tile_y", "sp", [-1, 129, 1, 1]], ["tile_x", "sp", [-1, 1, 129, 1]], ["tile_ry", "sp", [-1, 3]], ["tile_rx", "sp", [-1, 3]], ["auto_unroll_max_step", "ot", 0], ["unroll_explicit", "ot", 1]]}, "result": [[0.02923366248], 0, 14.858787298202515, 1639731334.6874855], "version": 0.2, "tvm_version": "0.8.dev0"}
{"input": ["opencl -keys=adreno,opencl,gpu -device=adreno -max_num_threads=256", "depthwise_conv2d_nchwc_acc32.image2d", [["TENSOR", [1, 36, 129, 129, 4], "float16"], ["TENSOR", [36, 1, 3, 3, 4], "float16"], [1, 1], [1, 1, 1, 1], [1, 1], "float16"], {}], "config": {"index": 425452, "code_hash": null, "entity": [["tile_fc", "sp", [-1, 2, 9, 2]], ["tile_y", "sp", [-1, 1, 3, 43]], ["tile_x", "sp", [-1, 1, 1, 3]], ["tile_ry", "sp", [-1, 1]], ["tile_rx", "sp", [-1, 1]], ["auto_unroll_max_step", "ot", 512], ["unroll_explicit", "ot", 1]]}, "result": [[0.021447330200000003], 0, 8.20005989074707, 1639731343.1177132], "version": 0.2, "tvm_version": "0.8.dev0"}
{"input": ["opencl -keys=adreno,opencl,gpu -device=adreno -max_num_threads=256", "depthwise_conv2d_nchwc_acc32.image2d", [["TENSOR", [1, 36, 129, 129, 4], "float16"], ["TENSOR", [36, 1, 3, 3, 4], "float16"], [1, 1], [1, 1, 1, 1], [1, 1], "float16"], {}], "config": {"index": 96627, "code_hash": null, "entity": [["tile_fc", "sp", [-1, 6, 6, 1]], ["tile_y", "sp", [-1, 1, 43, 1]], ["tile_x", "sp", [-1, 1, 1, 43]], ["tile_ry", "sp", [-1, 3]], ["tile_rx", "sp", [-1, 3]], ["auto_unroll_max_step", "ot", 0], ["unroll_explicit", "ot", 0]]}, "result": [[0.040437718739999996], 0, 8.613658428192139, 1639731355.1256487], "version": 0.2, "tvm_version": "0.8.dev0"}
{"input": ["opencl -keys=adreno,opencl,gpu -device=adreno -max_num_threads=256", "depthwise_conv2d_nchwc_acc32.image2d", [["TENSOR", [1, 36, 129, 129, 4], "float16"], ["TENSOR", [36, 1, 3, 3, 4], "float16"], [1, 1], [1, 1, 1, 1], [1, 1], "float16"], {}], "config": {"index": 86891, "code_hash": null, "entity": [["tile_fc", "sp", [-1, 2, 2, 9]], ["tile_y", "sp", [-1, 1, 3, 1]], ["tile_x", "sp", [-1, 1, 43, 1]], ["tile_ry", "sp", [-1, 3]], ["tile_rx", "sp", [-1, 3]], ["auto_unroll_max_step", "ot", 0], ["unroll_explicit", "ot", 0]]}, "result": [[0.043382232279999995], 0, 17.731786966323853, 1639731364.2643733], "version": 0.2, "tvm_version": "0.8.dev0"}
{"input": ["opencl -keys=adreno,opencl,gpu -device=adreno -max_num_threads=256", "depthwise_conv2d_nchwc_acc32.image2d", [["TENSOR", [1, 36, 129, 129, 4], "float16"], ["TENSOR", [36, 1, 3, 3, 4], "float16"], [1, 1], [1, 1, 1, 1], [1, 1], "float16"], {}], "config": {"index": 205946, "code_hash": null, "entity": [["tile_fc", "sp", [-1, 2, 3, 2]], ["tile_y", "sp", [-1, 1, 43, 3]], ["tile_x", "sp", [-1, 1, 1, 1]], ["tile_ry", "sp", [-1, 1]], ["tile_rx", "sp", [-1, 1]], ["auto_unroll_max_step", "ot", 1500], ["unroll_explicit", "ot", 0]]}, "result": [[0.0043383677], 0, 3.8695425987243652, 1639731371.925004], "version": 0.2, "tvm_version": "0.8.dev0"}
{"input": ["opencl -keys=adreno,opencl,gpu -device=adreno -max_num_threads=256", "depthwise_conv2d_nchwc_acc32.image2d", [["TENSOR", [1, 36, 129, 129, 4], "float16"], ["TENSOR", [36, 1, 3, 3, 4], "float16"], [1, 1], [1, 1, 1, 1], [1, 1], "float16"], {}], "config": {"index": 333761, "code_hash": null, "entity": [["tile_fc", "sp", [-1, 2, 2, 3]], ["tile_y", "sp", [-1, 1, 1, 3]], ["tile_x", "sp", [-1, 1, 1, 1]], ["tile_ry", "sp", [-1, 3]], ["tile_rx", "sp", [-1, 1]], ["auto_unroll_max_step", "ot", 0], ["unroll_explicit", "ot", 1]]}, "result": [[0.0135804073], 0, 16.911279439926147, 1639731395.4969099], "version": 0.2, "tvm_version": "0.8.dev0"}
{"input": ["opencl -keys=adreno,opencl,gpu -device=adreno -max_num_threads=256", "depthwise_conv2d_nchwc_acc32.image2d", [["TENSOR", [1, 36, 129, 129, 4], "float16"], ["TENSOR", [36, 1, 3, 3, 4], "float16"], [1, 1], [1, 1, 1, 1], [1, 1], "float16"], {}], "config": {"index": 163795, "code_hash": null, "entity": [["tile_fc", "sp", [-1, 1, 3, 12]], ["tile_y", "sp", [-1, 43, 3, 1]], ["tile_x", "sp", [-1, 1, 43, 1]], ["tile_ry", "sp", [-1, 1]], ["tile_rx", "sp", [-1, 3]], ["auto_unroll_max_step", "ot", 512], ["unroll_explicit", "ot", 0]]}, "result": [[0.03776000312], 0, 10.962952136993408, 1639731446.8629434], "version": 0.2, "tvm_version": "0.8.dev0"}
{"input": ["opencl -keys=adreno,opencl,gpu -device=adreno -max_num_threads=256", "depthwise_conv2d_nchwc_acc32.image2d", [["TENSOR", [1, 36, 129, 129, 4], "float16"], ["TENSOR", [36, 1, 3, 3, 4], "float16"], [1, 1], [1, 1, 1, 1], [1, 1], "float16"], {}], "config": {"index": 4829, "code_hash": null, "entity": [["tile_fc", "sp", [-1, 2, 9, 1]], ["tile_y", "sp", [-1, 1, 1, 1]], ["tile_x", "sp", [-1, 129, 1, 1]], ["tile_ry", "sp", [-1, 1]], ["tile_rx", "sp", [-1, 1]], ["auto_unroll_max_step", "ot", 0], ["unroll_explicit", "ot", 0]]}, "result": [[0.013284127080000001], 0, 4.94908881187439, 1639731452.0019033], "version": 0.2, "tvm_version": "0.8.dev0"}
{"input": ["opencl -keys=adreno,opencl,gpu -device=adreno -max_num_threads=256", "depthwise_conv2d_nchwc_acc32.image2d", [["TENSOR", [1, 36, 129, 129, 4], "float16"], ["TENSOR", [36, 1, 3, 3, 4], "float16"], [1, 1], [1, 1, 1, 1], [1, 1], "float16"], {}], "config": {"index": 2845, "code_hash": null, "entity": [["tile_fc", "sp", [-1, 1, 3, 2]], ["tile_y", "sp", [-1, 1, 1, 43]], ["tile_x", "sp", [-1, 3, 1, 1]], ["tile_ry", "sp", [-1, 1]], ["tile_rx", "sp", [-1, 1]], ["auto_unroll_max_step", "ot", 0], ["unroll_explicit", "ot", 0]]}, "result": [[0.0196683125], 0, 5.793503284454346, 1639731463.7415507], "version": 0.2, "tvm_version": "0.8.dev0"}
{"input": ["opencl -keys=adreno,opencl,gpu -device=adreno -max_num_threads=256", "depthwise_conv2d_nchwc_acc32.image2d", [["TENSOR", [1, 36, 129, 129, 4], "float16"], ["TENSOR", [36, 1, 3, 3, 4], "float16"], [1, 1], [1, 1, 1, 1], [1, 1], "float16"], {}], "config": {"index": 595984, "code_hash": null, "entity": [["tile_fc", "sp", [-1, 1, 3, 6]], ["tile_y", "sp", [-1, 3, 43, 1]], ["tile_x", "sp", [-1, 1, 3, 1]], ["tile_ry", "sp", [-1, 3]], ["tile_rx", "sp", [-1, 3]], ["auto_unroll_max_step", "ot", 1500], ["unroll_explicit", "ot", 1]]}, "result": [[0.0039127968800000005], 0, 11.287256956100464, 1639731469.0813107], "version": 0.2, "tvm_version": "0.8.dev0"}
{"input": ["opencl -keys=adreno,opencl,gpu -device=adreno -max_num_threads=256", "depthwise_conv2d_nchwc_acc32.image2d", [["TENSOR", [1, 36, 129, 129, 4], "float16"], ["TENSOR", [36, 1, 3, 3, 4], "float16"], [1, 1], [1, 1, 1, 1], [1, 1], "float16"], {}], "config": {"index": 544765, "code_hash": null, "entity": [["tile_fc", "sp", [-1, 2, 3, 3]], ["tile_y", "sp", [-1, 3, 43, 1]], ["tile_x", "sp", [-1, 1, 3, 1]], ["tile_ry", "sp", [-1, 3]], ["tile_rx", "sp", [-1, 1]], ["auto_unroll_max_step", "ot", 1500], ["unroll_explicit", "ot", 1]]}, "result": [[0.0036865177], 0, 4.550489902496338, 1639731476.5691402], "version": 0.2, "tvm_version": "0.8.dev0"}
{"input": ["opencl -keys=adreno,opencl,gpu -device=adreno -max_num_threads=256", "depthwise_conv2d_nchwc_acc32.image2d", [["TENSOR", [1, 36, 129, 129, 4], "float16"], ["TENSOR", [36, 1, 3, 3, 4], "float16"], [1, 1], [1, 1, 1, 1], [1, 1], "float16"], {}], "config": {"index": 282891, "code_hash": null, "entity": [["tile_fc", "sp", [-1, 2, 2, 9]], ["tile_y", "sp", [-1, 1, 1, 43]], ["tile_x", "sp", [-1, 1, 1, 1]], ["tile_ry", "sp", [-1, 3]], ["tile_rx", "sp", [-1, 3]], ["auto_unroll_max_step", "ot", 1500], ["unroll_explicit", "ot", 0]]}, "result": [[0.0325888177], 0, 12.324313640594482, 1639731484.5078297], "version": 0.2, "tvm_version": "0.8.dev0"}
{"input": ["opencl -keys=adreno,opencl,gpu -device=adreno -max_num_threads=256", "depthwise_conv2d_nchwc_acc32.image2d", [["TENSOR", [1, 36, 129, 129, 4], "float16"], ["TENSOR", [36, 1, 3, 3, 4], "float16"], [1, 1], [1, 1, 1, 1], [1, 1], "float16"], {}], "config": {"index": 134481, "code_hash": null, "entity": [["tile_fc", "sp", [-1, 6, 1, 6]], ["tile_y", "sp", [-1, 1, 1, 1]], ["tile_x", "sp", [-1, 1, 3, 1]], ["tile_ry", "sp", [-1, 3]], ["tile_rx", "sp", [-1, 1]], ["auto_unroll_max_step", "ot", 512], ["unroll_explicit", "ot", 0]]}, "result": [[0.016323388520000003], 0, 6.243792772293091, 1639731490.9870899], "version": 0.2, "tvm_version": "0.8.dev0"}
{"input": ["opencl -keys=adreno,opencl,gpu -device=adreno -max_num_threads=256", "depthwise_conv2d_nchwc_acc32.image2d", [["TENSOR", [1, 36, 129, 129, 4], "float16"], ["TENSOR", [36, 1, 3, 3, 4], "float16"], [1, 1], [1, 1, 1, 1], [1, 1], "float16"], {}], "config": {"index": 11063, "code_hash": null, "entity": [["tile_fc", "sp", [-1, 6, 2, 3]], ["tile_y", "sp", [-1, 1, 3, 43]], ["tile_x", "sp", [-1, 1, 43, 1]], ["tile_ry", "sp", [-1, 1]], ["tile_rx", "sp", [-1, 1]], ["auto_unroll_max_step", "ot", 0], ["unroll_explicit", "ot", 0]]}, "result": [[0.03455208644], 0, 14.944491863250732, 1639731499.7140431], "version": 0.2, "tvm_version": "0.8.dev0"}
{"input": ["opencl -keys=adreno,opencl,gpu -device=adreno -max_num_threads=256", "depthwise_conv2d_nchwc_acc32.image2d", [["TENSOR", [1, 36, 129, 129, 4], "float16"], ["TENSOR", [36, 1, 3, 3, 4], "float16"], [1, 1], [1, 1, 1, 1], [1, 1], "float16"], {}], "config": {"index": 365437, "code_hash": null, "entity": [["tile_fc", "sp", [-1, 2, 1, 2]], ["tile_y", "sp", [-1, 1, 43, 1]], ["tile_x", "sp", [-1, 1, 3, 1]], ["tile_ry", "sp", [-1, 1]], ["tile_rx", "sp", [-1, 3]], ["auto_unroll_max_step", "ot", 0], ["unroll_explicit", "ot", 1]]}, "result": [[0.0016452250000000002], 0, 3.71277117729187, 1639731503.6397274], "version": 0.2, "tvm_version": "0.8.dev0"}
{"input": ["opencl -keys=adreno,opencl,gpu -device=adreno -max_num_threads=256", "depthwise_conv2d_nchwc_acc32.image2d", [["TENSOR", [1, 36, 129, 129, 4], "float16"], ["TENSOR", [36, 1, 3, 3, 4], "float16"], [1, 1], [1, 1, 1, 1], [1, 1], "float16"], {}], "config": {"index": 7065, "code_hash": null, "entity": [["tile_fc", "sp", [-1, 2, 3, 3]], ["tile_y", "sp", [-1, 1, 43, 1]], ["tile_x", "sp", [-1, 1, 3, 1]], ["tile_ry", "sp", [-1, 1]], ["tile_rx", "sp", [-1, 1]], ["auto_unroll_max_step", "ot", 0], ["unroll_explicit", "ot", 0]]}, "result": [[0.00224726666], 0, 3.4044907093048096, 1639731800.1664526], "version": 0.2, "tvm_version": "0.8.dev0"}
{"input": ["opencl -keys=adreno,opencl,gpu -device=adreno -max_num_threads=256", "depthwise_conv2d_nchwc_acc32.image2d", [["TENSOR", [1, 36, 129, 129, 4], "float16"], ["TENSOR", [36, 1, 3, 3, 4], "float16"], [1, 1], [1, 1, 1, 1], [1, 1], "float16"], {}], "config": {"index": 7066, "code_hash": null, "entity": [["tile_fc", "sp", [-1, 4, 3, 3]], ["tile_y", "sp", [-1, 1, 43, 1]], ["tile_x", "sp", [-1, 1, 3, 1]], ["tile_ry", "sp", [-1, 1]], ["tile_rx", "sp", [-1, 1]], ["auto_unroll_max_step", "ot", 0], ["unroll_explicit", "ot", 0]]}, "result": [[0.00296044374], 0, 8.5546236038208, 1639731805.2847905], "version": 0.2, "tvm_version": "0.8.dev0"}
{"input": ["opencl -keys=adreno,opencl,gpu -device=adreno -max_num_threads=256", "depthwise_conv2d_nchwc_acc32.image2d", [["TENSOR", [1, 36, 129, 129, 4], "float16"], ["TENSOR", [36, 1, 3, 3, 4], "float16"], [1, 1], [1, 1, 1, 1], [1, 1], "float16"], {}], "config": {"index": 7064, "code_hash": null, "entity": [["tile_fc", "sp", [-1, 1, 3, 3]], ["tile_y", "sp", [-1, 1, 43, 1]], ["tile_x", "sp", [-1, 1, 3, 1]], ["tile_ry", "sp", [-1, 1]], ["tile_rx", "sp", [-1, 1]], ["auto_unroll_max_step", "ot", 0], ["unroll_explicit", "ot", 0]]}, "result": [[0.0013509375000000001], 0, 3.1894702911376953, 1639731808.9171114], "version": 0.2, "tvm_version": "0.8.dev0"}
{"input": ["opencl -keys=adreno,opencl,gpu -device=adreno -max_num_threads=256", "depthwise_conv2d_nchwc_acc32.image2d", [["TENSOR", [1, 36, 129, 129, 4], "float16"], ["TENSOR", [36, 1, 3, 3, 4], "float16"], [1, 1], [1, 1, 1, 1], [1, 1], "float16"], {}], "config": {"index": 314265, "code_hash": null, "entity": [["tile_fc", "sp", [-1, 2, 3, 3]], ["tile_y", "sp", [-1, 1, 43, 1]], ["tile_x", "sp", [-1, 1, 3, 1]], ["tile_ry", "sp", [-1, 1]], ["tile_rx", "sp", [-1, 1]], ["auto_unroll_max_step", "ot", 0], ["unroll_explicit", "ot", 1]]}, "result": [[0.0022206], 0, 6.839966297149658, 1639731812.582175], "version": 0.2, "tvm_version": "0.8.dev0"}
{"input": ["opencl -keys=adreno,opencl,gpu -device=adreno -max_num_threads=256", "depthwise_conv2d_nchwc_acc32.image2d", [["TENSOR", [1, 36, 129, 129, 4], "float16"], ["TENSOR", [36, 1, 3, 3, 4], "float16"], [1, 1], [1, 1, 1, 1], [1, 1], "float16"], {}], "config": {"index": 7047, "code_hash": null, "entity": [["tile_fc", "sp", [-1, 3, 3, 2]], ["tile_y", "sp", [-1, 1, 43, 1]], ["tile_x", "sp", [-1, 1, 3, 1]], ["tile_ry", "sp", [-1, 1]], ["tile_rx", "sp", [-1, 1]], ["auto_unroll_max_step", "ot", 0], ["unroll_explicit", "ot", 0]]}, "result": [[0.0021889802], 0, 3.606132745742798, 1639731816.4359334], "version": 0.2, "tvm_version": "0.8.dev0"}
{"input": ["opencl -keys=adreno,opencl,gpu -device=adreno -max_num_threads=256", "depthwise_conv2d_nchwc_acc32.image2d", [["TENSOR", [1, 36, 129, 129, 4], "float16"], ["TENSOR", [36, 1, 3, 3, 4], "float16"], [1, 1], [1, 1, 1, 1], [1, 1], "float16"], {}], "config": {"index": 15065, "code_hash": null, "entity": [["tile_fc", "sp", [-1, 2, 3, 3]], ["tile_y", "sp", [-1, 1, 43, 1]], ["tile_x", "sp", [-1, 1, 1, 3]], ["tile_ry", "sp", [-1, 1]], ["tile_rx", "sp", [-1, 1]], ["auto_unroll_max_step", "ot", 0], ["unroll_explicit", "ot", 0]]}, "result": [[0.0445470802], 0, 14.02336859703064, 1639731826.8647962], "version": 0.2, "tvm_version": "0.8.dev0"}
{"input": ["opencl -keys=adreno,opencl,gpu -device=adreno -max_num_threads=256", "depthwise_conv2d_nchwc_acc32.image2d", [["TENSOR", [1, 36, 129, 129, 4], "float16"], ["TENSOR", [36, 1, 3, 3, 4], "float16"], [1, 1], [1, 1, 1, 1], [1, 1], "float16"], {}], "config": {"index": 864, "code_hash": null, "entity": [["tile_fc", "sp", [-1, 1, 3, 3]], ["tile_y", "sp", [-1, 1, 129, 1]], ["tile_x", "sp", [-1, 1, 1, 1]], ["tile_ry", "sp", [-1, 1]], ["tile_rx", "sp", [-1, 1]], ["auto_unroll_max_step", "ot", 0], ["unroll_explicit", "ot", 0]]}, "result": [[0.0017486812399999999], 0, 3.6663312911987305, 1639731830.814226], "version": 0.2, "tvm_version": "0.8.dev0"}
{"input": ["opencl -keys=adreno,opencl,gpu -device=adreno -max_num_threads=256", "depthwise_conv2d_nchwc_acc32.image2d", [["TENSOR", [1, 36, 129, 129, 4], "float16"], ["TENSOR", [36, 1, 3, 3, 4], "float16"], [1, 1], [1, 1, 1, 1], [1, 1], "float16"], {}], "config": {"index": 314247, "code_hash": null, "entity": [["tile_fc", "sp", [-1, 3, 3, 2]], ["tile_y", "sp", [-1, 1, 43, 1]], ["tile_x", "sp", [-1, 1, 3, 1]], ["tile_ry", "sp", [-1, 1]], ["tile_rx", "sp", [-1, 1]], ["auto_unroll_max_step", "ot", 0], ["unroll_explicit", "ot", 1]]}, "result": [[0.00221468228], 0, 7.439997911453247, 1639731834.632796], "version": 0.2, "tvm_version": "0.8.dev0"}
{"input": ["opencl -keys=adreno,opencl,gpu -device=adreno -max_num_threads=256", "depthwise_conv2d_nchwc_acc32.image2d", [["TENSOR", [1, 36, 129, 129, 4], "float16"], ["TENSOR", [36, 1, 3, 3, 4], "float16"], [1, 1], [1, 1, 1, 1], [1, 1], "float16"], {}], "config": {"index": 865, "code_hash": null, "entity": [["tile_fc", "sp", [-1, 2, 3, 3]], ["tile_y", "sp", [-1, 1, 129, 1]], ["tile_x", "sp", [-1, 1, 1, 1]], ["tile_ry", "sp", [-1, 1]], ["tile_rx", "sp", [-1, 1]], ["auto_unroll_max_step", "ot", 0], ["unroll_explicit", "ot", 0]]}, "result": [[0.0027935541599999995], 0, 3.6881651878356934, 1639731839.8550434], "version": 0.2, "tvm_version": "0.8.dev0"}
{"input": ["opencl -keys=adreno,opencl,gpu -device=adreno -max_num_threads=256", "depthwise_conv2d_nchwc_acc32.image2d", [["TENSOR", [1, 36, 129, 129, 4], "float16"], ["TENSOR", [36, 1, 3, 3, 4], "float16"], [1, 1], [1, 1, 1, 1], [1, 1], "float16"], {}], "config": {"index": 314266, "code_hash": null, "entity": [["tile_fc", "sp", [-1, 4, 3, 3]], ["tile_y", "sp", [-1, 1, 43, 1]], ["tile_x", "sp", [-1, 1, 3, 1]], ["tile_ry", "sp", [-1, 1]], ["tile_rx", "sp", [-1, 1]], ["auto_unroll_max_step", "ot", 0], ["unroll_explicit", "ot", 1]]}, "result": [[0.00294213958], 0, 6.787639379501343, 1639731842.9780161], "version": 0.2, "tvm_version": "0.8.dev0"}
{"input": ["opencl -keys=adreno,opencl,gpu -device=adreno -max_num_threads=256", "depthwise_conv2d_nchwc_acc32.image2d", [["TENSOR", [1, 36, 129, 129, 4], "float16"], ["TENSOR", [36, 1, 3, 3, 4], "float16"], [1, 1], [1, 1, 1, 1], [1, 1], "float16"], {}], "config": {"index": 314264, "code_hash": null, "entity": [["tile_fc", "sp", [-1, 1, 3, 3]], ["tile_y", "sp", [-1, 1, 43, 1]], ["tile_x", "sp", [-1, 1, 3, 1]], ["tile_ry", "sp", [-1, 1]], ["tile_rx", "sp", [-1, 1]], ["auto_unroll_max_step", "ot", 0], ["unroll_explicit", "ot", 1]]}, "result": [[0.00135506876], 0, 3.558351993560791, 1639731846.8016877], "version": 0.2, "tvm_version": "0.8.dev0"}
{"input": ["opencl -keys=adreno,opencl,gpu -device=adreno -max_num_threads=256", "depthwise_conv2d_nchwc_acc32.image2d", [["TENSOR", [1, 36, 129, 129, 4], "float16"], ["TENSOR", [36, 1, 3, 3, 4], "float16"], [1, 1], [1, 1, 1, 1], [1, 1], "float16"], {}], "config": {"index": 7164, "code_hash": null, "entity": [["tile_fc", "sp", [-1, 1, 3, 3]], ["tile_y", "sp", [-1, 3, 43, 1]], ["tile_x", "sp", [-1, 1, 3, 1]], ["tile_ry", "sp", [-1, 1]], ["tile_rx", "sp", [-1, 1]], ["auto_unroll_max_step", "ot", 0], ["unroll_explicit", "ot", 0]]}, "result": [[0.00226259062], 0, 8.787054061889648, 1639731852.032483], "version": 0.2, "tvm_version": "0.8.dev0"}
{"input": ["opencl -keys=adreno,opencl,gpu -device=adreno -max_num_threads=256", "depthwise_conv2d_nchwc_acc32.image2d", [["TENSOR", [1, 36, 129, 129, 4], "float16"], ["TENSOR", [36, 1, 3, 3, 4], "float16"], [1, 1], [1, 1, 1, 1], [1, 1], "float16"], {}], "config": {"index": 15046, "code_hash": null, "entity": [["tile_fc", "sp", [-1, 2, 3, 2]], ["tile_y", "sp", [-1, 1, 43, 1]], ["tile_x", "sp", [-1, 1, 1, 3]], ["tile_ry", "sp", [-1, 1]], ["tile_rx", "sp", [-1, 1]], ["auto_unroll_max_step", "ot", 0], ["unroll_explicit", "ot", 0]]}, "result": [[0.00260930104], 0, 4.672414302825928, 1639731856.9281394], "version": 0.2, "tvm_version": "0.8.dev0"}
{"input": ["opencl -keys=adreno,opencl,gpu -device=adreno -max_num_threads=256", "depthwise_conv2d_nchwc_acc32.image2d", [["TENSOR", [1, 36, 129, 129, 4], "float16"], ["TENSOR", [36, 1, 3, 3, 4], "float16"], [1, 1], [1, 1, 1, 1], [1, 1], "float16"], {}], "config": {"index": 322246, "code_hash": null, "entity": [["tile_fc", "sp", [-1, 2, 3, 2]], ["tile_y", "sp", [-1, 1, 43, 1]], ["tile_x", "sp", [-1, 1, 1, 3]], ["tile_ry", "sp", [-1, 1]], ["tile_rx", "sp", [-1, 1]], ["auto_unroll_max_step", "ot", 0], ["unroll_explicit", "ot", 1]]}, "result": [[0.0026057197799999997], 0, 7.901655673980713, 1639731860.1707642], "version": 0.2, "tvm_version": "0.8.dev0"}
{"input": ["opencl -keys=adreno,opencl,gpu -device=adreno -max_num_threads=256", "depthwise_conv2d_nchwc_acc32.image2d", [["TENSOR", [1, 36, 129, 129, 4], "float16"], ["TENSOR", [36, 1, 3, 3, 4], "float16"], [1, 1], [1, 1, 1, 1], [1, 1], "float16"], {}], "config": {"index": 7165, "code_hash": null, "entity": [["tile_fc", "sp", [-1, 2, 3, 3]], ["tile_y", "sp", [-1, 3, 43, 1]], ["tile_x", "sp", [-1, 1, 3, 1]], ["tile_ry", "sp", [-1, 1]], ["tile_rx", "sp", [-1, 1]], ["auto_unroll_max_step", "ot", 0], ["unroll_explicit", "ot", 0]]}, "result": [[0.04570087394], 0, 11.2114896774292, 1639731871.6552312], "version": 0.2, "tvm_version": "0.8.dev0"}
{"input": ["opencl -keys=adreno,opencl,gpu -device=adreno -max_num_threads=256", "depthwise_conv2d_nchwc_acc32.image2d", [["TENSOR", [1, 36, 129, 129, 4], "float16"], ["TENSOR", [36, 1, 3, 3, 4], "float16"], [1, 1], [1, 1, 1, 1], [1, 1], "float16"], {}], "config": {"index": 7068, "code_hash": null, "entity": [["tile_fc", "sp", [-1, 3, 4, 3]], ["tile_y", "sp", [-1, 1, 43, 1]], ["tile_x", "sp", [-1, 1, 3, 1]], ["tile_ry", "sp", [-1, 1]], ["tile_rx", "sp", [-1, 1]], ["auto_unroll_max_step", "ot", 0], ["unroll_explicit", "ot", 0]]}, "result": [[0.0027693624999999998], 0, 15.30310344696045, 1639731875.759475], "version": 0.2, "tvm_version": "0.8.dev0"}
{"input": ["opencl -keys=adreno,opencl,gpu -device=adreno -max_num_threads=256", "depthwise_conv2d_nchwc_acc32.image2d", [["TENSOR", [1, 36, 129, 129, 4], "float16"], ["TENSOR", [36, 1, 3, 3, 4], "float16"], [1, 1], [1, 1, 1, 1], [1, 1], "float16"], {}], "config": {"index": 32666, "code_hash": null, "entity": [["tile_fc", "sp", [-1, 4, 3, 3]], ["tile_y", "sp", [-1, 1, 43, 1]], ["tile_x", "sp", [-1, 1, 3, 1]], ["tile_ry", "sp", [-1, 3]], ["tile_rx", "sp", [-1, 1]], ["auto_unroll_max_step", "ot", 0], ["unroll_explicit", "ot", 0]]}, "result": [[0.00297262918], 0, 3.2772836685180664, 1639731879.557777], "version": 0.2, "tvm_version": "0.8.dev0"}
{"input": ["opencl -keys=adreno,opencl,gpu -device=adreno -max_num_threads=256", "depthwise_conv2d_nchwc_acc32.image2d", [["TENSOR", [1, 36, 129, 129, 4], "float16"], ["TENSOR", [36, 1, 3, 3, 4], "float16"], [1, 1], [1, 1, 1, 1], [1, 1], "float16"], {}], "config": {"index": 314246, "code_hash": null, "entity": [["tile_fc", "sp", [-1, 2, 3, 2]], ["tile_y", "sp", [-1, 1, 43, 1]], ["tile_x", "sp", [-1, 1, 3, 1]], ["tile_ry", "sp", [-1, 1]], ["tile_rx", "sp", [-1, 1]], ["auto_unroll_max_step", "ot", 0], ["unroll_explicit", "ot", 1]]}, "result": [[0.0018145916600000001], 0, 6.990945816040039, 1639731883.284086], "version": 0.2, "tvm_version": "0.8.dev0"}
{"input": ["opencl -keys=adreno,opencl,gpu -device=adreno -max_num_threads=256", "depthwise_conv2d_nchwc_acc32.image2d", [["TENSOR", [1, 36, 129, 129, 4], "float16"], ["TENSOR", [36, 1, 3, 3, 4], "float16"], [1, 1], [1, 1, 1, 1], [1, 1], "float16"], {}], "config": {"index": 83847, "code_hash": null, "entity": [["tile_fc", "sp", [-1, 3, 3, 2]], ["tile_y", "sp", [-1, 1, 43, 1]], ["tile_x", "sp", [-1, 1, 3, 1]], ["tile_ry", "sp", [-1, 3]], ["tile_rx", "sp", [-1, 3]], ["auto_unroll_max_step", "ot", 0], ["unroll_explicit", "ot", 0]]}, "result": [[0.00220747812], 0, 3.67592716217041, 1639731887.205092], "version": 0.2, "tvm_version": "0.8.dev0"}
{"input": ["opencl -keys=adreno,opencl,gpu -device=adreno -max_num_threads=256", "depthwise_conv2d_nchwc_acc32.image2d", [["TENSOR", [1, 36, 129, 129, 4], "float16"], ["TENSOR", [36, 1, 3, 3, 4], "float16"], [1, 1], [1, 1, 1, 1], [1, 1], "float16"], {}], "config": {"index": 322265, "code_hash": null, "entity": [["tile_fc", "sp", [-1, 2, 3, 3]], ["tile_y", "sp", [-1, 1, 43, 1]], ["tile_x", "sp", [-1, 1, 1, 3]], ["tile_ry", "sp", [-1, 1]], ["tile_rx", "sp", [-1, 1]], ["auto_unroll_max_step", "ot", 0], ["unroll_explicit", "ot", 1]]}, "result": [[0.0452967729], 0, 13.345666646957397, 1639731896.986255], "version": 0.2, "tvm_version": "0.8.dev0"}
{"input": ["opencl -keys=adreno,opencl,gpu -device=adreno -max_num_threads=256", "depthwise_conv2d_nchwc_acc32.image2d", [["TENSOR", [1, 36, 129, 129, 4], "float16"], ["TENSOR", [36, 1, 3, 3, 4], "float16"], [1, 1], [1, 1, 1, 1], [1, 1], "float16"], {}], "config": {"index": 308064, "code_hash": null, "entity": [["tile_fc", "sp", [-1, 1, 3, 3]], ["tile_y", "sp", [-1, 1, 129, 1]], ["tile_x", "sp", [-1, 1, 1, 1]], ["tile_ry", "sp", [-1, 1]], ["tile_rx", "sp", [-1, 1]], ["auto_unroll_max_step", "ot", 0], ["unroll_explicit", "ot", 1]]}, "result": [[0.0017548218800000001], 0, 3.436781167984009, 1639731900.6479752], "version": 0.2, "tvm_version": "0.8.dev0"}
{"input": ["opencl -keys=adreno,opencl,gpu -device=adreno -max_num_threads=256", "depthwise_conv2d_nchwc_acc32.image2d", [["TENSOR", [1, 36, 129, 129, 4], "float16"], ["TENSOR", [36, 1, 3, 3, 4], "float16"], [1, 1], [1, 1, 1, 1], [1, 1], "float16"], {}], "config": {"index": 32665, "code_hash": null, "entity": [["tile_fc", "sp", [-1, 2, 3, 3]], ["tile_y", "sp", [-1, 1, 43, 1]], ["tile_x", "sp", [-1, 1, 3, 1]], ["tile_ry", "sp", [-1, 3]], ["tile_rx", "sp", [-1, 1]], ["auto_unroll_max_step", "ot", 0], ["unroll_explicit", "ot", 0]]}, "result": [[0.0022603448], 0, 6.359517335891724, 1639731903.6910074], "version": 0.2, "tvm_version": "0.8.dev0"}
{"input": ["opencl -keys=adreno,opencl,gpu -device=adreno -max_num_threads=256", "depthwise_conv2d_nchwc_acc32.image2d", [["TENSOR", [1, 36, 129, 129, 4], "float16"], ["TENSOR", [36, 1, 3, 3, 4], "float16"], [1, 1], [1, 1, 1, 1], [1, 1], "float16"], {}], "config": {"index": 7045, "code_hash": null, "entity": [["tile_fc", "sp", [-1, 1, 3, 2]], ["tile_y", "sp", [-1, 1, 43, 1]], ["tile_x", "sp", [-1, 1, 3, 1]], ["tile_ry", "sp", [-1, 1]], ["tile_rx", "sp", [-1, 1]], ["auto_unroll_max_step", "ot", 0], ["unroll_explicit", "ot", 0]]}, "result": [[0.0014067322999999998], 0, 6.8541905879974365, 1639731910.8292022], "version": 0.2, "tvm_version": "0.8.dev0"}
{"input": ["opencl -keys=adreno,opencl,gpu -device=adreno -max_num_threads=256", "depthwise_conv2d_nchwc_acc32.image2d", [["TENSOR", [1, 36, 129, 129, 4], "float16"], ["TENSOR", [36, 1, 3, 3, 4], "float16"], [1, 1], [1, 1, 1, 1], [1, 1], "float16"], {}], "config": {"index": 314245, "code_hash": null, "entity": [["tile_fc", "sp", [-1, 1, 3, 2]], ["tile_y", "sp", [-1, 1, 43, 1]], ["tile_x", "sp", [-1, 1, 3, 1]], ["tile_ry", "sp", [-1, 1]], ["tile_rx", "sp", [-1, 1]], ["auto_unroll_max_step", "ot", 0], ["unroll_explicit", "ot", 1]]}, "result": [[0.00140609166], 0, 3.3502445220947266, 1639731907.3217196], "version": 0.2, "tvm_version": "0.8.dev0"}
{"input": ["opencl -keys=adreno,opencl,gpu -device=adreno -max_num_threads=256", "depthwise_conv2d_nchwc_acc32.image2d", [["TENSOR", [1, 36, 129, 129, 4], "float16"], ["TENSOR", [36, 1, 3, 3, 4], "float16"], [1, 1], [1, 1, 1, 1], [1, 1], "float16"], {}], "config": {"index": 83821, "code_hash": null, "entity": [["tile_fc", "sp", [-1, 1, 4, 1]], ["tile_y", "sp", [-1, 1, 43, 1]], ["tile_x", "sp", [-1, 1, 3, 1]], ["tile_ry", "sp", [-1, 3]], ["tile_rx", "sp", [-1, 3]], ["auto_unroll_max_step", "ot", 0], ["unroll_explicit", "ot", 0]]}, "result": [[0.00118866354], 0, 4.178592205047607, 1639731915.287039], "version": 0.2, "tvm_version": "0.8.dev0"}
{"input": ["opencl -keys=adreno,opencl,gpu -device=adreno -max_num_threads=256", "depthwise_conv2d_nchwc_acc32.image2d", [["TENSOR", [1, 36, 129, 129, 4], "float16"], ["TENSOR", [36, 1, 3, 3, 4], "float16"], [1, 1], [1, 1, 1, 1], [1, 1], "float16"], {}], "config": {"index": 365447, "code_hash": null, "entity": [["tile_fc", "sp", [-1, 3, 3, 2]], ["tile_y", "sp", [-1, 1, 43, 1]], ["tile_x", "sp", [-1, 1, 3, 1]], ["tile_ry", "sp", [-1, 1]], ["tile_rx", "sp", [-1, 3]], ["auto_unroll_max_step", "ot", 0], ["unroll_explicit", "ot", 1]]}, "result": [[0.00223288438], 0, 7.380064487457275, 1639731918.512182], "version": 0.2, "tvm_version": "0.8.dev0"}
{"input": ["opencl -keys=adreno,opencl,gpu -device=adreno -max_num_threads=256", "depthwise_conv2d_nchwc_acc32.image2d", [["TENSOR", [1, 36, 129, 129, 4], "float16"], ["TENSOR", [36, 1, 3, 3, 4], "float16"], [1, 1], [1, 1, 1, 1], [1, 1], "float16"], {}], "config": {"index": 308065, "code_hash": null, "entity": [["tile_fc", "sp", [-1, 2, 3, 3]], ["tile_y", "sp", [-1, 1, 129, 1]], ["tile_x", "sp", [-1, 1, 1, 1]], ["tile_ry", "sp", [-1, 1]], ["tile_rx", "sp", [-1, 1]], ["auto_unroll_max_step", "ot", 0], ["unroll_explicit", "ot", 1]]}, "result": [[0.00281235], 0, 3.9823038578033447, 1639731922.770897], "version": 0.2, "tvm_version": "0.8.dev0"}
{"input": ["opencl -keys=adreno,opencl,gpu -device=adreno -max_num_threads=256", "depthwise_conv2d_nchwc_acc32.image2d", [["TENSOR", [1, 36, 129, 129, 4], "float16"], ["TENSOR", [36, 1, 3, 3, 4], "float16"], [1, 1], [1, 1, 1, 1], [1, 1], "float16"], {}], "config": {"index": 7048, "code_hash": null, "entity": [["tile_fc", "sp", [-1, 6, 3, 2]], ["tile_y", "sp", [-1, 1, 43, 1]], ["tile_x", "sp", [-1, 1, 3, 1]], ["tile_ry", "sp", [-1, 1]], ["tile_rx", "sp", [-1, 1]], ["auto_unroll_max_step", "ot", 0], ["unroll_explicit", "ot", 0]]}, "result": [[0.0029175603999999997], 0, 7.5741660594940186, 1639731926.348408], "version": 0.2, "tvm_version": "0.8.dev0"}
{"input": ["opencl -keys=adreno,opencl,gpu -device=adreno -max_num_threads=256", "depthwise_conv2d_nchwc_acc32.image2d", [["TENSOR", [1, 36, 129, 129, 4], "float16"], ["TENSOR", [36, 1, 3, 3, 4], "float16"], [1, 1], [1, 1, 1, 1], [1, 1], "float16"], {}], "config": {"index": 846, "code_hash": null, "entity": [["tile_fc", "sp", [-1, 2, 3, 2]], ["tile_y", "sp", [-1, 1, 129, 1]], ["tile_x", "sp", [-1, 1, 1, 1]], ["tile_ry", "sp", [-1, 1]], ["tile_rx", "sp", [-1, 1]], ["auto_unroll_max_step", "ot", 0], ["unroll_explicit", "ot", 0]]}, "result": [[0.00216159792], 0, 3.3718976974487305, 1639731929.9924219], "version": 0.2, "tvm_version": "0.8.dev0"}
{"input": ["opencl -keys=adreno,opencl,gpu -device=adreno -max_num_threads=256", "depthwise_conv2d_nchwc_acc32.image2d", [["TENSOR", [1, 36, 129, 129, 4], "float16"], ["TENSOR", [36, 1, 3, 3, 4], "float16"], [1, 1], [1, 1, 1, 1], [1, 1], "float16"], {}], "config": {"index": 7076, "code_hash": null, "entity": [["tile_fc", "sp", [-1, 3, 3, 4]], ["tile_y", "sp", [-1, 1, 43, 1]], ["tile_x", "sp", [-1, 1, 3, 1]], ["tile_ry", "sp", [-1, 1]], ["tile_rx", "sp", [-1, 1]], ["auto_unroll_max_step", "ot", 0], ["unroll_explicit", "ot", 0]]}, "result": [[0.0029493572999999993], 0, 6.432736158370972, 1639731933.0946467], "version": 0.2, "tvm_version": "0.8.dev0"}
{"input": ["opencl -keys=adreno,opencl,gpu -device=adreno -max_num_threads=256", "depthwise_conv2d_nchwc_acc32.image2d", [["TENSOR", [1, 36, 129, 129, 4], "float16"], ["TENSOR", [36, 1, 3, 3, 4], "float16"], [1, 1], [1, 1, 1, 1], [1, 1], "float16"], {}], "config": {"index": 308046, "code_hash": null, "entity": [["tile_fc", "sp", [-1, 2, 3, 2]], ["tile_y", "sp", [-1, 1, 129, 1]], ["tile_x", "sp", [-1, 1, 1, 1]], ["tile_ry", "sp", [-1, 1]], ["tile_rx", "sp", [-1, 1]], ["auto_unroll_max_step", "ot", 0], ["unroll_explicit", "ot", 1]]}, "result": [[0.00218075626], 0, 3.1472184658050537, 1639731936.6587305], "version": 0.2, "tvm_version": "0.8.dev0"}
{"input": ["opencl -keys=adreno,opencl,gpu -device=adreno -max_num_threads=256", "depthwise_conv2d_nchwc_acc32.image2d", [["TENSOR", [1, 36, 129, 129, 4], "float16"], ["TENSOR", [36, 1, 3, 3, 4], "float16"], [1, 1], [1, 1, 1, 1], [1, 1], "float16"], {}], "config": {"index": 77646, "code_hash": null, "entity": [["tile_fc", "sp", [-1, 2, 3, 2]], ["tile_y", "sp", [-1, 1, 129, 1]], ["tile_x", "sp", [-1, 1, 1, 1]], ["tile_ry", "sp", [-1, 3]], ["tile_rx", "sp", [-1, 3]], ["auto_unroll_max_step", "ot", 0], ["unroll_explicit", "ot", 0]]}, "result": [[0.00217237604], 0, 6.3403801918029785, 1639731939.8808358], "version": 0.2, "tvm_version": "0.8.dev0"}
{"input": ["opencl -keys=adreno,opencl,gpu -device=adreno -max_num_threads=256", "depthwise_conv2d_nchwc_acc32.image2d", [["TENSOR", [1, 36, 129, 129, 4], "float16"], ["TENSOR", [36, 1, 3, 3, 4], "float16"], [1, 1], [1, 1, 1, 1], [1, 1], "float16"], {}], "config": {"index": 83815, "code_hash": null, "entity": [["tile_fc", "sp", [-1, 1, 3, 1]], ["tile_y", "sp", [-1, 1, 43, 1]], ["tile_x", "sp", [-1, 1, 3, 1]], ["tile_ry", "sp", [-1, 3]], ["tile_rx", "sp", [-1, 3]], ["auto_unroll_max_step", "ot", 0], ["unroll_explicit", "ot", 0]]}, "result": [[0.00122056772], 0, 3.7590482234954834, 1639731943.868244], "version": 0.2, "tvm_version": "0.8.dev0"}
{"input": ["opencl -keys=adreno,opencl,gpu -device=adreno -max_num_threads=256", "depthwise_conv2d_nchwc_acc32.image2d", [["TENSOR", [1, 36, 129, 129, 4], "float16"], ["TENSOR", [36, 1, 3, 3, 4], "float16"], [1, 1], [1, 1, 1, 1], [1, 1], "float16"], {}], "config": {"index": 314364, "code_hash": null, "entity": [["tile_fc", "sp", [-1, 1, 3, 3]], ["tile_y", "sp", [-1, 3, 43, 1]], ["tile_x", "sp", [-1, 1, 3, 1]], ["tile_ry", "sp", [-1, 1]], ["tile_rx", "sp", [-1, 1]], ["auto_unroll_max_step", "ot", 0], ["unroll_explicit", "ot", 1]]}, "result": [[0.00223209062], 0, 6.722397327423096, 1639731946.9508414], "version": 0.2, "tvm_version": "0.8.dev0"}
{"input": ["opencl -keys=adreno,opencl,gpu -device=adreno -max_num_threads=256", "depthwise_conv2d_nchwc_acc32.image2d", [["TENSOR", [1, 36, 129, 129, 4], "float16"], ["TENSOR", [36, 1, 3, 3, 4], "float16"], [1, 1], [1, 1, 1, 1], [1, 1], "float16"], {}], "config": {"index": 26465, "code_hash": null, "entity": [["tile_fc", "sp", [-1, 2, 3, 3]], ["tile_y", "sp", [-1, 1, 129, 1]], ["tile_x", "sp", [-1, 1, 1, 1]], ["tile_ry", "sp", [-1, 3]], ["tile_rx", "sp", [-1, 1]], ["auto_unroll_max_step", "ot", 0], ["unroll_explicit", "ot", 0]]}, "result": [[0.0029131822799999996], 0, 3.558788537979126, 1639731950.7931511], "version": 0.2, "tvm_version": "0.8.dev0"}
{"input": ["opencl -keys=adreno,opencl,gpu -device=adreno -max_num_threads=256", "depthwise_conv2d_nchwc_acc32.image2d", [["TENSOR", [1, 36, 129, 129, 4], "float16"], ["TENSOR", [36, 1, 3, 3, 4], "float16"], [1, 1], [1, 1, 1, 1], [1, 1], "float16"], {}], "config": {"index": 32647, "code_hash": null, "entity": [["tile_fc", "sp", [-1, 3, 3, 2]], ["tile_y", "sp", [-1, 1, 43, 1]], ["tile_x", "sp", [-1, 1, 3, 1]], ["tile_ry", "sp", [-1, 3]], ["tile_rx", "sp", [-1, 1]], ["auto_unroll_max_step", "ot", 0], ["unroll_explicit", "ot", 0]]}, "result": [[0.00223087916], 0, 7.48084568977356, 1639731954.7569966], "version": 0.2, "tvm_version": "0.8.dev0"}
{"input": ["opencl -keys=adreno,opencl,gpu -device=adreno -max_num_threads=256", "depthwise_conv2d_nchwc_acc32.image2d", [["TENSOR", [1, 36, 129, 129, 4], "float16"], ["TENSOR", [36, 1, 3, 3, 4], "float16"], [1, 1], [1, 1, 1, 1], [1, 1], "float16"], {}], "config": {"index": 314248, "code_hash": null, "entity": [["tile_fc", "sp", [-1, 6, 3, 2]], ["tile_y", "sp", [-1, 1, 43, 1]], ["tile_x", "sp", [-1, 1, 3, 1]], ["tile_ry", "sp", [-1, 1]], ["tile_rx", "sp", [-1, 1]], ["auto_unroll_max_step", "ot", 0], ["unroll_explicit", "ot", 1]]}, "result": [[0.00292274168], 0, 3.349665641784668, 1639731958.4313078], "version": 0.2, "tvm_version": "0.8.dev0"}
{"input": ["opencl -keys=adreno,opencl,gpu -device=adreno -max_num_threads=256", "depthwise_conv2d_nchwc_acc32.image2d", [["TENSOR", [1, 36, 129, 129, 4], "float16"], ["TENSOR", [36, 1, 3, 3, 4], "float16"], [1, 1], [1, 1, 1, 1], [1, 1], "float16"], {}], "config": {"index": 314365, "code_hash": null, "entity": [["tile_fc", "sp", [-1, 2, 3, 3]], ["tile_y", "sp", [-1, 3, 43, 1]], ["tile_x", "sp", [-1, 1, 3, 1]], ["tile_ry", "sp", [-1, 1]], ["tile_rx", "sp", [-1, 1]], ["auto_unroll_max_step", "ot", 0], ["unroll_explicit", "ot", 1]]}, "result": [[0.045913343720000006], 0, 12.739994049072266, 1639731967.8100438], "version": 0.2, "tvm_version": "0.8.dev0"}
{"input": ["opencl -keys=adreno,opencl,gpu -device=adreno -max_num_threads=256", "depthwise_conv2d_nchwc_acc32.image2d", [["TENSOR", [1, 36, 129, 129, 4], "float16"], ["TENSOR", [36, 1, 3, 3, 4], "float16"], [1, 1], [1, 1, 1, 1], [1, 1], "float16"], {}], "config": {"index": 32621, "code_hash": null, "entity": [["tile_fc", "sp", [-1, 1, 4, 1]], ["tile_y", "sp", [-1, 1, 43, 1]], ["tile_x", "sp", [-1, 1, 3, 1]], ["tile_ry", "sp", [-1, 3]], ["tile_rx", "sp", [-1, 1]], ["auto_unroll_max_step", "ot", 0], ["unroll_explicit", "ot", 0]]}, "result": [[0.0012358198], 0, 3.692319869995117, 1639731971.8125498], "version": 0.2, "tvm_version": "0.8.dev0"}
{"input": ["opencl -keys=adreno,opencl,gpu -device=adreno -max_num_threads=256", "depthwise_conv2d_nchwc_acc32.image2d", [["TENSOR", [1, 36, 129, 129, 4], "float16"], ["TENSOR", [36, 1, 3, 3, 4], "float16"], [1, 1], [1, 1, 1, 1], [1, 1], "float16"], {}], "config": {"index": 83848, "code_hash": null, "entity": [["tile_fc", "sp", [-1, 6, 3, 2]], ["tile_y", "sp", [-1, 1, 43, 1]], ["tile_x", "sp", [-1, 1, 3, 1]], ["tile_ry", "sp", [-1, 3]], ["tile_rx", "sp", [-1, 3]], ["auto_unroll_max_step", "ot", 0], ["unroll_explicit", "ot", 0]]}, "result": [[0.00292858646], 0, 7.193177700042725, 1639731975.300186], "version": 0.2, "tvm_version": "0.8.dev0"}
{"input": ["opencl -keys=adreno,opencl,gpu -device=adreno -max_num_threads=256", "depthwise_conv2d_nchwc_acc32.image2d", [["TENSOR", [1, 36, 129, 129, 4], "float16"], ["TENSOR", [36, 1, 3, 3, 4], "float16"], [1, 1], [1, 1, 1, 1], [1, 1], "float16"], {}], "config": {"index": 26464, "code_hash": null, "entity": [["tile_fc", "sp", [-1, 1, 3, 3]], ["tile_y", "sp", [-1, 1, 129, 1]], ["tile_x", "sp", [-1, 1, 1, 1]], ["tile_ry", "sp", [-1, 3]], ["tile_rx", "sp", [-1, 1]], ["auto_unroll_max_step", "ot", 0], ["unroll_explicit", "ot", 0]]}, "result": [[0.0018803437400000001], 0, 3.6988377571105957, 1639731979.290828], "version": 0.2, "tvm_version": "0.8.dev0"}
{"input": ["opencl -keys=adreno,opencl,gpu -device=adreno -max_num_threads=256", "depthwise_conv2d_nchwc_acc32.image2d", [["TENSOR", [1, 36, 129, 129, 4], "float16"], ["TENSOR", [36, 1, 3, 3, 4], "float16"], [1, 1], [1, 1, 1, 1], [1, 1], "float16"], {}], "config": {"index": 391021, "code_hash": null, "entity": [["tile_fc", "sp", [-1, 1, 4, 1]], ["tile_y", "sp", [-1, 1, 43, 1]], ["tile_x", "sp", [-1, 1, 3, 1]], ["tile_ry", "sp", [-1, 3]], ["tile_rx", "sp", [-1, 3]], ["auto_unroll_max_step", "ot", 0], ["unroll_explicit", "ot", 1]]}, "result": [[0.00121037604], 0, 3.3857057094573975, 1639731983.018045], "version": 0.2, "tvm_version": "0.8.dev0"}
{"input": ["opencl -keys=adreno,opencl,gpu -device=adreno -max_num_threads=256", "depthwise_conv2d_nchwc_acc32.image2d", [["TENSOR", [1, 36, 129, 129, 4], "float16"], ["TENSOR", [36, 1, 3, 3, 4], "float16"], [1, 1], [1, 1, 1, 1], [1, 1], "float16"], {}], "config": {"index": 32615, "code_hash": null, "entity": [["tile_fc", "sp", [-1, 1, 3, 1]], ["tile_y", "sp", [-1, 1, 43, 1]], ["tile_x", "sp", [-1, 1, 3, 1]], ["tile_ry", "sp", [-1, 3]], ["tile_rx", "sp", [-1, 1]], ["auto_unroll_max_step", "ot", 0], ["unroll_explicit", "ot", 0]]}, "result": [[0.00123693644], 0, 6.112451076507568, 1639731985.7596192], "version": 0.2, "tvm_version": "0.8.dev0"}
{"input": ["opencl -keys=adreno,opencl,gpu -device=adreno -max_num_threads=256", "depthwise_conv2d_nchwc_acc32.image2d", [["TENSOR", [1, 36, 129, 129, 4], "float16"], ["TENSOR", [36, 1, 3, 3, 4], "float16"], [1, 1], [1, 1, 1, 1], [1, 1], "float16"], {}], "config": {"index": 314268, "code_hash": null, "entity": [["tile_fc", "sp", [-1, 3, 4, 3]], ["tile_y", "sp", [-1, 1, 43, 1]], ["tile_x", "sp", [-1, 1, 3, 1]], ["tile_ry", "sp", [-1, 1]], ["tile_rx", "sp", [-1, 1]], ["auto_unroll_max_step", "ot", 0], ["unroll_explicit", "ot", 1]]}, "result": [[0.00277655], 0, 3.4949028491973877, 1639731989.6075196], "version": 0.2, "tvm_version": "0.8.dev0"}
{"input": ["opencl -keys=adreno,opencl,gpu -device=adreno -max_num_threads=256", "depthwise_conv2d_nchwc_acc32.image2d", [["TENSOR", [1, 36, 129, 129, 4], "float16"], ["TENSOR", [36, 1, 3, 3, 4], "float16"], [1, 1], [1, 1, 1, 1], [1, 1], "float16"], {}], "config": {"index": 1146, "code_hash": null, "entity": [["tile_fc", "sp", [-1, 2, 3, 2]], ["tile_y", "sp", [-1, 1, 43, 3]], ["tile_x", "sp", [-1, 1, 1, 1]], ["tile_ry", "sp", [-1, 1]], ["tile_rx", "sp", [-1, 1]], ["auto_unroll_max_step", "ot", 0], ["unroll_explicit", "ot", 0]]}, "result": [[0.0043235322799999995], 0, 6.974629878997803, 1639731993.090749], "version": 0.2, "tvm_version": "0.8.dev0"}
{"input": ["opencl -keys=adreno,opencl,gpu -device=adreno -max_num_threads=256", "depthwise_conv2d_nchwc_acc32.image2d", [["TENSOR", [1, 36, 129, 129, 4], "float16"], ["TENSOR", [36, 1, 3, 3, 4], "float16"], [1, 1], [1, 1, 1, 1], [1, 1], "float16"], {}], "config": {"index": 384846, "code_hash": null, "entity": [["tile_fc", "sp", [-1, 2, 3, 2]], ["tile_y", "sp", [-1, 1, 129, 1]], ["tile_x", "sp", [-1, 1, 1, 1]], ["tile_ry", "sp", [-1, 3]], ["tile_rx", "sp", [-1, 3]], ["auto_unroll_max_step", "ot", 0], ["unroll_explicit", "ot", 1]]}, "result": [[0.00214869376], 0, 3.5041072368621826, 1639731996.8475387], "version": 0.2, "tvm_version": "0.8.dev0"}
{"input": ["opencl -keys=adreno,opencl,gpu -device=adreno -max_num_threads=256", "depthwise_conv2d_nchwc_acc32.image2d", [["TENSOR", [1, 36, 129, 129, 4], "float16"], ["TENSOR", [36, 1, 3, 3, 4], "float16"], [1, 1], [1, 1, 1, 1], [1, 1], "float16"], {}], "config": {"index": 308346, "code_hash": null, "entity": [["tile_fc", "sp", [-1, 2, 3, 2]], ["tile_y", "sp", [-1, 1, 43, 3]], ["tile_x", "sp", [-1, 1, 1, 1]], ["tile_ry", "sp", [-1, 1]], ["tile_rx", "sp", [-1, 1]], ["auto_unroll_max_step", "ot", 0], ["unroll_explicit", "ot", 1]]}, "result": [[0.0043569677000000005], 0, 7.232327461242676, 1639732000.6060257], "version": 0.2, "tvm_version": "0.8.dev0"}
{"input": ["opencl -keys=adreno,opencl,gpu -device=adreno -max_num_threads=256", "depthwise_conv2d_nchwc_acc32.image2d", [["TENSOR", [1, 36, 129, 129, 4], "float16"], ["TENSOR", [36, 1, 3, 3, 4], "float16"], [1, 1], [1, 1, 1, 1], [1, 1], "float16"], {}], "config": {"index": 391015, "code_hash": null, "entity": [["tile_fc", "sp", [-1, 1, 3, 1]], ["tile_y", "sp", [-1, 1, 43, 1]], ["tile_x", "sp", [-1, 1, 3, 1]], ["tile_ry", "sp", [-1, 3]], ["tile_rx", "sp", [-1, 3]], ["auto_unroll_max_step", "ot", 0], ["unroll_explicit", "ot", 1]]}, "result": [[0.0012264312599999999], 0, 3.549410581588745, 1639732004.4725282], "version": 0.2, "tvm_version": "0.8.dev0"}
{"input": ["opencl -keys=adreno,opencl,gpu -device=adreno -max_num_threads=256", "depthwise_conv2d_nchwc_acc32.image2d", [["TENSOR", [1, 36, 129, 129, 4], "float16"], ["TENSOR", [36, 1, 3, 3, 4], "float16"], [1, 1], [1, 1, 1, 1], [1, 1], "float16"], {}], "config": {"index": 52046, "code_hash": null, "entity": [["tile_fc", "sp", [-1, 2, 3, 2]], ["tile_y", "sp", [-1, 1, 129, 1]], ["tile_x", "sp", [-1, 1, 1, 1]], ["tile_ry", "sp", [-1, 1]], ["tile_rx", "sp", [-1, 3]], ["auto_unroll_max_step", "ot", 0], ["unroll_explicit", "ot", 0]]}, "result": [[0.00219374062], 0, 8.62913703918457, 1639732009.5218868], "version": 0.2, "tvm_version": "0.8.dev0"}
{"input": ["opencl -keys=adreno,opencl,gpu -device=adreno -max_num_threads=256", "depthwise_conv2d_nchwc_acc32.image2d", [["TENSOR", [1, 36, 129, 129, 4], "float16"], ["TENSOR", [36, 1, 3, 3, 4], "float16"], [1, 1], [1, 1, 1, 1], [1, 1], "float16"], {}], "config": {"index": 359246, "code_hash": null, "entity": [["tile_fc", "sp", [-1, 2, 3, 2]], ["tile_y", "sp", [-1, 1, 129, 1]], ["tile_x", "sp", [-1, 1, 1, 1]], ["tile_ry", "sp", [-1, 1]], ["tile_rx", "sp", [-1, 3]], ["auto_unroll_max_step", "ot", 0], ["unroll_explicit", "ot", 1]]}, "result": [[0.00217340104], 0, 7.1073899269104, 1639732016.9107456], "version": 0.2, "tvm_version": "0.8.dev0"}
{"input": ["opencl -keys=adreno,opencl,gpu -device=adreno -max_num_threads=256", "depthwise_conv2d_nchwc_acc32.image2d", [["TENSOR", [1, 36, 129, 129, 4], "float16"], ["TENSOR", [36, 1, 3, 3, 4], "float16"], [1, 1], [1, 1, 1, 1], [1, 1], "float16"], {}], "config": {"index": 373446, "code_hash": null, "entity": [["tile_fc", "sp", [-1, 2, 3, 2]], ["tile_y", "sp", [-1, 1, 43, 1]], ["tile_x", "sp", [-1, 1, 1, 3]], ["tile_ry", "sp", [-1, 1]], ["tile_rx", "sp", [-1, 3]], ["auto_unroll_max_step", "ot", 0], ["unroll_explicit", "ot", 1]]}, "result": [[0.0026203447799999996], 0, 3.9113574028015137, 1639732013.792466], "version": 0.2, "tvm_version": "0.8.dev0"}
{"input": ["opencl -keys=adreno,opencl,gpu -device=adreno -max_num_threads=256", "depthwise_conv2d_nchwc_acc32.image2d", [["TENSOR", [1, 36, 129, 129, 4], "float16"], ["TENSOR", [36, 1, 3, 3, 4], "float16"], [1, 1], [1, 1, 1, 1], [1, 1], "float16"], {}], "config": {"index": 58246, "code_hash": null, "entity": [["tile_fc", "sp", [-1, 2, 3, 2]], ["tile_y", "sp", [-1, 1, 43, 1]], ["tile_x", "sp", [-1, 1, 3, 1]], ["tile_ry", "sp", [-1, 1]], ["tile_rx", "sp", [-1, 3]], ["auto_unroll_max_step", "ot", 0], ["unroll_explicit", "ot", 0]]}, "result": [[0.00183556666], 0, 3.667658805847168, 1639732020.9887595], "version": 0.2, "tvm_version": "0.8.dev0"}
{"input": ["opencl -keys=adreno,opencl,gpu -device=adreno -max_num_threads=256", "depthwise_conv2d_nchwc_acc32.image2d", [["TENSOR", [1, 36, 129, 129, 4], "float16"], ["TENSOR", [36, 1, 3, 3, 4], "float16"], [1, 1], [1, 1, 1, 1], [1, 1], "float16"], {}], "config": {"index": 365446, "code_hash": null, "entity": [["tile_fc", "sp", [-1, 2, 3, 2]], ["tile_y", "sp", [-1, 1, 43, 1]], ["tile_x", "sp", [-1, 1, 3, 1]], ["tile_ry", "sp", [-1, 1]], ["tile_rx", "sp", [-1, 3]], ["auto_unroll_max_step", "ot", 0], ["unroll_explicit", "ot", 1]]}, "result": [[0.00183135416], 0, 7.4582273960113525, 1639732024.900404], "version": 0.2, "tvm_version": "0.8.dev0"}
{"input": ["opencl -keys=adreno,opencl,gpu -device=adreno -max_num_threads=256", "depthwise_conv2d_nchwc_acc32.image2d", [["TENSOR", [1, 36, 129, 129, 4], "float16"], ["TENSOR", [36, 1, 3, 3, 4], "float16"], [1, 1], [1, 1, 1, 1], [1, 1], "float16"], {}], "config": {"index": 339866, "code_hash": null, "entity": [["tile_fc", "sp", [-1, 4, 3, 3]], ["tile_y", "sp", [-1, 1, 43, 1]], ["tile_x", "sp", [-1, 1, 3, 1]], ["tile_ry", "sp", [-1, 3]], ["tile_rx", "sp", [-1, 1]], ["auto_unroll_max_step", "ot", 0], ["unroll_explicit", "ot", 1]]}, "result": [[0.00294366146], 0, 3.6790623664855957, 1639732028.854802], "version": 0.2, "tvm_version": "0.8.dev0"}
{"input": ["opencl -keys=adreno,opencl,gpu -device=adreno -max_num_threads=256", "depthwise_conv2d_nchwc_acc32.image2d", [["TENSOR", [1, 36, 129, 129, 4], "float16"], ["TENSOR", [36, 1, 3, 3, 4], "float16"], [1, 1], [1, 1, 1, 1], [1, 1], "float16"], {}], "config": {"index": 83846, "code_hash": null, "entity": [["tile_fc", "sp", [-1, 2, 3, 2]], ["tile_y", "sp", [-1, 1, 43, 1]], ["tile_x", "sp", [-1, 1, 3, 1]], ["tile_ry", "sp", [-1, 3]], ["tile_rx", "sp", [-1, 3]], ["auto_unroll_max_step", "ot", 0], ["unroll_explicit", "ot", 0]]}, "result": [[0.00182467396], 0, 6.489132642745972, 1639732031.7078984], "version": 0.2, "tvm_version": "0.8.dev0"}
{"input": ["opencl -keys=adreno,opencl,gpu -device=adreno -max_num_threads=256", "depthwise_conv2d_nchwc_acc32.image2d", [["TENSOR", [1, 36, 129, 129, 4], "float16"], ["TENSOR", [36, 1, 3, 3, 4], "float16"], [1, 1], [1, 1, 1, 1], [1, 1], "float16"], {}], "config": {"index": 339865, "code_hash": null, "entity": [["tile_fc", "sp", [-1, 2, 3, 3]], ["tile_y", "sp", [-1, 1, 43, 1]], ["tile_x", "sp", [-1, 1, 3, 1]], ["tile_ry", "sp", [-1, 3]], ["tile_rx", "sp", [-1, 1]], ["auto_unroll_max_step", "ot", 0], ["unroll_explicit", "ot", 1]]}, "result": [[0.00225168542], 0, 4.233382940292358, 1639732036.2430515], "version": 0.2, "tvm_version": "0.8.dev0"}
{"input": ["opencl -keys=adreno,opencl,gpu -device=adreno -max_num_threads=256", "depthwise_conv2d_nchwc_acc32.image2d", [["TENSOR", [1, 36, 129, 129, 4], "float16"], ["TENSOR", [36, 1, 3, 3, 4], "float16"], [1, 1], [1, 1, 1, 1], [1, 1], "float16"], {}], "config": {"index": 339821, "code_hash": null, "entity": [["tile_fc", "sp", [-1, 1, 4, 1]], ["tile_y", "sp", [-1, 1, 43, 1]], ["tile_x", "sp", [-1, 1, 3, 1]], ["tile_ry", "sp", [-1, 3]], ["tile_rx", "sp", [-1, 1]], ["auto_unroll_max_step", "ot", 0], ["unroll_explicit", "ot", 1]]}, "result": [[0.00123733542], 0, 3.402125358581543, 1639732040.2426717], "version": 0.2, "tvm_version": "0.8.dev0"}
{"input": ["opencl -keys=adreno,opencl,gpu -device=adreno -max_num_threads=256", "depthwise_conv2d_nchwc_acc32.image2d", [["TENSOR", [1, 36, 129, 129, 4], "float16"], ["TENSOR", [36, 1, 3, 3, 4], "float16"], [1, 1], [1, 1, 1, 1], [1, 1], "float16"], {}], "config": {"index": 168836, "code_hash": null, "entity": [["tile_fc", "sp", [-1, 1, 1, 2]], ["tile_y", "sp", [-1, 1, 129, 1]], ["tile_x", "sp", [-1, 1, 1, 3]], ["tile_ry", "sp", [-1, 1]], ["tile_rx", "sp", [-1, 3]], ["auto_unroll_max_step", "ot", 512], ["unroll_explicit", "ot", 0]]}, "result": [[0.00189238334], 0, 6.17176628112793, 1639732043.0436234], "version": 0.2, "tvm_version": "0.8.dev0"}
{"input": ["opencl -keys=adreno,opencl,gpu -device=adreno -max_num_threads=256", "depthwise_conv2d_nchwc_acc32.image2d", [["TENSOR", [1, 36, 129, 129, 4], "float16"], ["TENSOR", [36, 1, 3, 3, 4], "float16"], [1, 1], [1, 1, 1, 1], [1, 1], "float16"], {}], "config": {"index": 318446, "code_hash": null, "entity": [["tile_fc", "sp", [-1, 2, 3, 2]], ["tile_y", "sp", [-1, 1, 1, 1]], ["tile_x", "sp", [-1, 3, 43, 1]], ["tile_ry", "sp", [-1, 1]], ["tile_rx", "sp", [-1, 1]], ["auto_unroll_max_step", "ot", 0], ["unroll_explicit", "ot", 1]]}, "result": [[0.00144889062], 0, 3.3001325130462646, 1639732046.5986273], "version": 0.2, "tvm_version": "0.8.dev0"}
