sd888_log/ww13/deelvin164_classifier.texture.float16.textures.log
{"input": ["opencl -keys=adreno,opencl,gpu -device=adreno -max_num_threads=256", "dense_small_batch.cuda", [["TENSOR", [1, 1280], "float16"], ["TENSOR", [560, 1280], "float16"], null, "float16"], {}], "config": {"index": 14, "code_hash": null, "entity": [["tile_k", "sp", [-1, 256]]]}, "result": [[0.0001053021], 0, 1.9775152206420898, 1644263981.9390984], "version": 0.2, "tvm_version": "0.8.dev0"}
{"input": ["opencl -keys=adreno,opencl,gpu -device=adreno -max_num_threads=256", "conv2d_nhwc.image2d", [["TENSOR", [1, 300, 300, 3], "float16"], ["TENSOR", [3, 3, 3, 32], "float16"], [2, 2], [0, 0, 0, 0], [1, 1], "float16"], {}], "config": {"index": 1538, "code_hash": null, "entity": [["tile_fc", "sp", [-1, 1, 8]], ["tile_y", "sp", [-1, 8, 1]], ["tile_x", "sp", [-1, 1, 8]], ["tile_rcc", "sp", [-1, 1]], ["tile_ry", "sp", [-1, 1]], ["tile_rx", "sp", [-1, 1]], ["auto_unroll_max_step", "ot", 1500], ["unroll_explicit", "ot", 0]]}, "result": [[0.00022591564000000003], 0, 1.227933645248413, 1644264323.2020736], "version": 0.2, "tvm_version": "0.8.dev0"}
{"input": ["opencl -keys=adreno,opencl,gpu -device=adreno -max_num_threads=256", "conv2d_nhwc.image2d", [["TENSOR", [1, 149, 149, 32], "float16"], ["TENSOR", [3, 3, 32, 96], "float16"], [1, 1], [1, 1, 1, 1], [1, 1], "float16"], {}], "config": {"index": 13623, "code_hash": null, "entity": [["tile_fc", "sp", [-1, 1, 8]], ["tile_y", "sp", [-1, 2, 4]], ["tile_x", "sp", [-1, 4, 2]], ["tile_rcc", "sp", [-1, 8]], ["tile_ry", "sp", [-1, 1]], ["tile_rx", "sp", [-1, 1]], ["auto_unroll_max_step", "ot", 512], ["unroll_explicit", "ot", 0]]}, "result": [[0.0031278145800000003], 0, 2.126689910888672, 1644265894.9894083], "version": 0.2, "tvm_version": "0.8.dev0"}
{"input": ["opencl -keys=adreno,opencl,gpu -device=adreno -max_num_threads=256", "conv2d_nhwc.image2d", [["TENSOR", [1, 149, 149, 24], "float16"], ["TENSOR", [3, 3, 24, 96], "float16"], [1, 1], [1, 1, 1, 1], [1, 1], "float16"], {}], "config": {"index": 29289, "code_hash": null, "entity": [["tile_fc", "sp", [-1, 1, 24]], ["tile_y", "sp", [-1, 4, 2]], ["tile_x", "sp", [-1, 2, 4]], ["tile_rcc", "sp", [-1, 2]], ["tile_ry", "sp", [-1, 1]], ["tile_rx", "sp", [-1, 3]], ["auto_unroll_max_step", "ot", 1500], ["unroll_explicit", "ot", 0]]}, "result": [[0.00233571876], 0, 2.1043527126312256, 1644267333.3772058], "version": 0.2, "tvm_version": "0.8.dev0"}
{"input": ["opencl -keys=adreno,opencl,gpu -device=adreno -max_num_threads=256", "conv2d_nhwc.image2d", [["TENSOR", [1, 149, 149, 96], "float16"], ["TENSOR", [1, 1, 96, 24], "float16"], [1, 1], [0, 0, 0, 0], [1, 1], "float16"], {}], "config": {"index": 113, "code_hash": null, "entity": [["tile_fc", "sp", [-1, 1, 6]], ["tile_y", "sp", [-1, 1, 4]], ["tile_x", "sp", [-1, 4, 2]], ["tile_rcc", "sp", [-1, 2]], ["tile_ry", "sp", [-1, 1]], ["tile_rx", "sp", [-1, 1]], ["auto_unroll_max_step", "ot", 0], ["unroll_explicit", "ot", 0]]}, "result": [[0.00069343854], 0, 1.6227853298187256, 1644268436.954692], "version": 0.2, "tvm_version": "0.8.dev0"}
{"input": ["opencl -keys=adreno,opencl,gpu -device=adreno -max_num_threads=256", "conv2d_nhwc.image2d", [["TENSOR", [1, 149, 149, 24], "float16"], ["TENSOR", [3, 3, 24, 192], "float16"], [1, 1], [1, 1, 1, 1], [1, 1], "float16"], {}], "config": {"index": 4813, "code_hash": null, "entity": [["tile_fc", "sp", [-1, 1, 16]], ["tile_y", "sp", [-1, 4, 1]], ["tile_x", "sp", [-1, 2, 4]], ["tile_rcc", "sp", [-1, 6]], ["tile_ry", "sp", [-1, 1]], ["tile_rx", "sp", [-1, 1]], ["auto_unroll_max_step", "ot", 0], ["unroll_explicit", "ot", 0]]}, "result": [[0.0040960041600000005], 0, 7.5609917640686035, 1644269874.4878354], "version": 0.2, "tvm_version": "0.8.dev0"}
{"input": ["opencl -keys=adreno,opencl,gpu -device=adreno -max_num_threads=256", "conv2d_nhwc.image2d", [["TENSOR", [1, 149, 149, 192], "float16"], ["TENSOR", [1, 1, 192, 32], "float16"], [2, 2], [0, 0, 0, 0], [1, 1], "float16"], {}], "config": {"index": 628, "code_hash": null, "entity": [["tile_fc", "sp", [-1, 1, 8]], ["tile_y", "sp", [-1, 1, 4]], ["tile_x", "sp", [-1, 2, 2]], ["tile_rcc", "sp", [-1, 3]], ["tile_ry", "sp", [-1, 1]], ["tile_rx", "sp", [-1, 1]], ["auto_unroll_max_step", "ot", 1500], ["unroll_explicit", "ot", 0]]}, "result": [[0.00087874166], 0, 2.4009811878204346, 1644271192.5207424], "version": 0.2, "tvm_version": "0.8.dev0"}
{"input": ["opencl -keys=adreno,opencl,gpu -device=adreno -max_num_threads=256", "conv2d_nhwc.image2d", [["TENSOR", [1, 75, 75, 256], "float16"], ["TENSOR", [1, 1, 256, 32], "float16"], [1, 1], [0, 0, 0, 0], [1, 1], "float16"], {}], "config": {"index": 37, "code_hash": null, "entity": [["tile_fc", "sp", [-1, 1, 8]], ["tile_y", "sp", [-1, 2, 2]], ["tile_x", "sp", [-1, 2, 2]], ["tile_rcc", "sp", [-1, 2]], ["tile_ry", "sp", [-1, 1]], ["tile_rx", "sp", [-1, 1]], ["auto_unroll_max_step", "ot", 0], ["unroll_explicit", "ot", 0]]}, "result": [[0.0005463073], 0, 3.0391862392425537, 1644272278.0322938], "version": 0.2, "tvm_version": "0.8.dev0"}
{"input": ["opencl -keys=adreno,opencl,gpu -device=adreno -max_num_threads=256", "conv2d_nhwc.image2d", [["TENSOR", [1, 75, 75, 32], "float16"], ["TENSOR", [3, 3, 32, 256], "float16"], [1, 1], [1, 1, 1, 1], [1, 1], "float16"], {}], "config": {"index": 348, "code_hash": null, "entity": [["tile_fc", "sp", [-1, 1, 64]], ["tile_y", "sp", [-1, 1, 2]], ["tile_x", "sp", [-1, 4, 1]], ["tile_rcc", "sp", [-1, 2]], ["tile_ry", "sp", [-1, 1]], ["tile_rx", "sp", [-1, 1]], ["auto_unroll_max_step", "ot", 0], ["unroll_explicit", "ot", 0]]}, "result": [[0.00165672082], 0, 3.11661958694458, 1644273723.287298], "version": 0.2, "tvm_version": "0.8.dev0"}
{"input": ["opencl -keys=adreno,opencl,gpu -device=adreno -max_num_threads=256", "conv2d_nhwc.image2d", [["TENSOR", [1, 75, 75, 256], "float16"], ["TENSOR", [1, 1, 256, 48], "float16"], [2, 2], [0, 0, 0, 0], [1, 1], "float16"], {}], "config": {"index": 77748, "code_hash": null, "entity": [["tile_fc", "sp", [-1, 1, 12]], ["tile_y", "sp", [-1, 1, 1]], ["tile_x", "sp", [-1, 1, 8]], ["tile_rcc", "sp", [-1, 64]], ["tile_ry", "sp", [-1, 1]], ["tile_rx", "sp", [-1, 1]], ["auto_unroll_max_step", "ot", 0], ["unroll_explicit", "ot", 1]]}, "result": [[0.00041210834], 0, 3.24172306060791, 1644274718.3308585], "version": 0.2, "tvm_version": "0.8.dev0"}
{"input": ["opencl -keys=adreno,opencl,gpu -device=adreno -max_num_threads=256", "conv2d_nhwc.image2d", [["TENSOR", [1, 38, 38, 48], "float16"], ["TENSOR", [3, 3, 48, 384], "float16"], [1, 1], [1, 1, 1, 1], [1, 1], "float16"], {}], "config": {"index": 878090, "code_hash": null, "entity": [["tile_fc", "sp", [-1, 2, 48]], ["tile_y", "sp", [-1, 4, 1]], ["tile_x", "sp", [-1, 2, 1]], ["tile_rcc", "sp", [-1, 12]], ["tile_ry", "sp", [-1, 3]], ["tile_rx", "sp", [-1, 3]], ["auto_unroll_max_step", "ot", 1500], ["unroll_explicit", "ot", 0]]}, "result": [[0.00117525936], 0, 2.024854898452759, 1644277067.848348], "version": 0.2, "tvm_version": "0.8.dev0"}
{"input": ["opencl -keys=adreno,opencl,gpu -device=adreno -max_num_threads=256", "conv2d_nhwc.image2d", [["TENSOR", [1, 38, 38, 384], "float16"], ["TENSOR", [1, 1, 384, 48], "float16"], [1, 1], [0, 0, 0, 0], [1, 1], "float16"], {}], "config": {"index": 24364, "code_hash": null, "entity": [["tile_fc", "sp", [-1, 3, 4]], ["tile_y", "sp", [-1, 5, 4]], ["tile_x", "sp", [-1, 1, 8]], ["tile_rcc", "sp", [-1, 24]], ["tile_ry", "sp", [-1, 1]], ["tile_rx", "sp", [-1, 1]], ["auto_unroll_max_step", "ot", 0], ["unroll_explicit", "ot", 0]]}, "result": [[0.00031311458], 0, 1.0609967708587646, 1644277931.5873773], "version": 0.2, "tvm_version": "0.8.dev0"}
{"input": ["opencl -keys=adreno,opencl,gpu -device=adreno -max_num_threads=256", "conv2d_nhwc.image2d", [["TENSOR", [1, 38, 38, 48], "float16"], ["TENSOR", [1, 1, 48, 384], "float16"], [1, 1], [0, 0, 0, 0], [1, 1], "float16"], {}], "config": {"index": 136417, "code_hash": null, "entity": [["tile_fc", "sp", [-1, 1, 96]], ["tile_y", "sp", [-1, 4, 2]], ["tile_x", "sp", [-1, 2, 1]], ["tile_rcc", "sp", [-1, 12]], ["tile_ry", "sp", [-1, 1]], ["tile_rx", "sp", [-1, 1]], ["auto_unroll_max_step", "ot", 512], ["unroll_explicit", "ot", 0]]}, "result": [[0.00017667604], 0, 1.2814018726348877, 1644279406.8148727], "version": 0.2, "tvm_version": "0.8.dev0"}
{"input": ["opencl -keys=adreno,opencl,gpu -device=adreno -max_num_threads=256", "depthwise_conv2d_nhwc.image2d", [["TENSOR", [1, 38, 38, 384], "float16"], ["TENSOR", [5, 5, 384, 1], "float16"], [2, 2], [0, 0, 0, 0], [1, 1], "float16"], {}], "config": {"index": 401496, "code_hash": null, "entity": [["tile_fc", "sp", [-1, 1, 48]], ["tile_y", "sp", [-1, 1, 1]], ["tile_x", "sp", [-1, 1, 5]], ["tile_ry", "sp", [-1, 5]], ["tile_rx", "sp", [-1, 5]], ["auto_unroll_max_step", "ot", 512], ["unroll_explicit", "ot", 1]]}, "result": [[0.00015957292], 0, 1.5003330707550049, 1644280804.7949119], "version": 0.2, "tvm_version": "0.8.dev0"}
{"input": ["opencl -keys=adreno,opencl,gpu -device=adreno -max_num_threads=256", "conv2d_nhwc.image2d", [["TENSOR", [1, 17, 17, 384], "float16"], ["TENSOR", [1, 1, 384, 96], "float16"], [1, 1], [0, 0, 0, 0], [1, 1], "float16"], {}], "config": {"index": 77027, "code_hash": null, "entity": [["tile_fc", "sp", [-1, 1, 12]], ["tile_y", "sp", [-1, 1, 10]], ["tile_x", "sp", [-1, 4, 1]], ["tile_rcc", "sp", [-1, 2]], ["tile_ry", "sp", [-1, 1]], ["tile_rx", "sp", [-1, 1]], ["auto_unroll_max_step", "ot", 0], ["unroll_explicit", "ot", 1]]}, "result": [[0.00012382289999999998], 0, 0.8299641609191895, 1644281449.8822596], "version": 0.2, "tvm_version": "0.8.dev0"}
{"input": ["opencl -keys=adreno,opencl,gpu -device=adreno -max_num_threads=256", "conv2d_nhwc.image2d", [["TENSOR", [1, 17, 17, 768], "float16"], ["TENSOR", [1, 1, 768, 96], "float16"], [1, 1], [0, 0, 0, 0], [1, 1], "float16"], {}], "config": {"index": 60363, "code_hash": null, "entity": [["tile_fc", "sp", [-1, 1, 12]], ["tile_y", "sp", [-1, 2, 10]], ["tile_x", "sp", [-1, 2, 1]], ["tile_rcc", "sp", [-1, 2]], ["tile_ry", "sp", [-1, 1]], ["tile_rx", "sp", [-1, 1]], ["auto_unroll_max_step", "ot", 1500], ["unroll_explicit", "ot", 0]]}, "result": [[0.00019669792000000003], 0, 1.5432405471801758, 1644282493.2114663], "version": 0.2, "tvm_version": "0.8.dev0"}
{"input": ["opencl -keys=adreno,opencl,gpu -device=adreno -max_num_threads=256", "conv2d_nhwc.image2d", [["TENSOR", [1, 17, 17, 96], "float16"], ["TENSOR", [1, 1, 96, 768], "float16"], [1, 1], [0, 0, 0, 0], [1, 1], "float16"], {}], "config": {"index": 59527, "code_hash": null, "entity": [["tile_fc", "sp", [-1, 1, 96]], ["tile_y", "sp", [-1, 2, 2]], ["tile_x", "sp", [-1, 2, 1]], ["tile_rcc", "sp", [-1, 2]], ["tile_ry", "sp", [-1, 1]], ["tile_rx", "sp", [-1, 1]], ["auto_unroll_max_step", "ot", 512], ["unroll_explicit", "ot", 0]]}, "result": [[0.0001365823], 0, 1.8762145042419434, 1644283719.3274562], "version": 0.2, "tvm_version": "0.8.dev0"}
{"input": ["opencl -keys=adreno,opencl,gpu -device=adreno -max_num_threads=256", "depthwise_conv2d_nhwc.image2d", [["TENSOR", [1, 17, 17, 768], "float16"], ["TENSOR", [5, 5, 768, 1], "float16"], [1, 1], [2, 2, 2, 2], [1, 1], "float16"], {}], "config": {"index": 329023, "code_hash": null, "entity": [["tile_fc", "sp", [-1, 1, 64]], ["tile_y", "sp", [-1, 1, 4]], ["tile_x", "sp", [-1, 2, 1]], ["tile_ry", "sp", [-1, 1]], ["tile_rx", "sp", [-1, 1]], ["auto_unroll_max_step", "ot", 0], ["unroll_explicit", "ot", 1]]}, "result": [[0.00016535520000000002], 0, 1.7721199989318848, 1644285147.498236], "version": 0.2, "tvm_version": "0.8.dev0"}
{"input": ["opencl -keys=adreno,opencl,gpu -device=adreno -max_num_threads=256", "conv2d_nhwc.image2d", [["TENSOR", [1, 17, 17, 768], "float16"], ["TENSOR", [1, 1, 768, 144], "float16"], [1, 1], [0, 0, 0, 0], [1, 1], "float16"], {}], "config": {"index": 39548, "code_hash": null, "entity": [["tile_fc", "sp", [-1, 1, 36]], ["tile_y", "sp", [-1, 2, 1]], ["tile_x", "sp", [-1, 2, 10]], ["tile_rcc", "sp", [-1, 2]], ["tile_ry", "sp", [-1, 1]], ["tile_rx", "sp", [-1, 1]], ["auto_unroll_max_step", "ot", 512], ["unroll_explicit", "ot", 0]]}, "result": [[0.00029343749999999997], 0, 0.9647202491760254, 1644286076.919168], "version": 0.2, "tvm_version": "0.8.dev0"}
{"input": ["opencl -keys=adreno,opencl,gpu -device=adreno -max_num_threads=256", "depthwise_conv2d_nhwc.image2d", [["TENSOR", [1, 17, 17, 1152], "float16"], ["TENSOR", [5, 5, 1152, 1], "float16"], [1, 1], [2, 2, 2, 2], [1, 1], "float16"], {}], "config": {"index": 687311, "code_hash": null, "entity": [["tile_fc", "sp", [-1, 1, 32]], ["tile_y", "sp", [-1, 1, 1]], ["tile_x", "sp", [-1, 1, 10]], ["tile_ry", "sp", [-1, 1]], ["tile_rx", "sp", [-1, 1]], ["auto_unroll_max_step", "ot", 512], ["unroll_explicit", "ot", 1]]}, "result": [[0.0002458625], 0, 2.1861329078674316, 1644287875.1080022], "version": 0.2, "tvm_version": "0.8.dev0"}
{"input": ["opencl -keys=adreno,opencl,gpu -device=adreno -max_num_threads=256", "conv2d_nhwc.image2d", [["TENSOR", [1, 17, 17, 1152], "float16"], ["TENSOR", [1, 1, 1152, 144], "float16"], [1, 1], [0, 0, 0, 0], [1, 1], "float16"], {}], "config": {"index": 49489, "code_hash": null, "entity": [["tile_fc", "sp", [-1, 1, 9]], ["tile_y", "sp", [-1, 2, 1]], ["tile_x", "sp", [-1, 2, 10]], ["tile_rcc", "sp", [-1, 2]], ["tile_ry", "sp", [-1, 1]], ["tile_rx", "sp", [-1, 1]], ["auto_unroll_max_step", "ot", 512], ["unroll_explicit", "ot", 0]]}, "result": [[0.00043991146000000003], 0, 1.8377745151519775, 1644289303.0770621], "version": 0.2, "tvm_version": "0.8.dev0"}
{"input": ["opencl -keys=adreno,opencl,gpu -device=adreno -max_num_threads=256", "conv2d_nhwc.image2d", [["TENSOR", [1, 17, 17, 144], "float16"], ["TENSOR", [1, 1, 144, 1152], "float16"], [1, 1], [0, 0, 0, 0], [1, 1], "float16"], {}], "config": {"index": 179989, "code_hash": null, "entity": [["tile_fc", "sp", [-1, 1, 32]], ["tile_y", "sp", [-1, 1, 2]], ["tile_x", "sp", [-1, 4, 5]], ["tile_rcc", "sp", [-1, 2]], ["tile_ry", "sp", [-1, 1]], ["tile_rx", "sp", [-1, 1]], ["auto_unroll_max_step", "ot", 1500], ["unroll_explicit", "ot", 0]]}, "result": [[0.00028160936], 0, 1.8418986797332764, 1644291502.2268171], "version": 0.2, "tvm_version": "0.8.dev0"}
{"input": ["opencl -keys=adreno,opencl,gpu -device=adreno -max_num_threads=256", "depthwise_conv2d_nhwc.image2d", [["TENSOR", [1, 17, 17, 1152], "float16"], ["TENSOR", [5, 5, 1152, 1], "float16"], [2, 2], [0, 0, 0, 0], [1, 1], "float16"], {}], "config": {"index": 273516, "code_hash": null, "entity": [["tile_fc", "sp", [-1, 1, 18]], ["tile_y", "sp", [-1, 1, 1]], ["tile_x", "sp", [-1, 1, 4]], ["tile_ry", "sp", [-1, 5]], ["tile_rx", "sp", [-1, 1]], ["auto_unroll_max_step", "ot", 1500], ["unroll_explicit", "ot", 1]]}, "result": [[0.00010887916000000001], 0, 0.770235538482666, 1644292242.1103976], "version": 0.2, "tvm_version": "0.8.dev0"}
{"input": ["opencl -keys=adreno,opencl,gpu -device=adreno -max_num_threads=256", "conv2d_nhwc.image2d", [["TENSOR", [1, 7, 7, 1152], "float16"], ["TENSOR", [1, 1, 1152, 192], "float16"], [1, 1], [0, 0, 0, 0], [1, 1], "float16"], {}], "config": {"index": 95114, "code_hash": null, "entity": [["tile_fc", "sp", [-1, 1, 16]], ["tile_y", "sp", [-1, 1, 1]], ["tile_x", "sp", [-1, 1, 4]], ["tile_rcc", "sp", [-1, 1]], ["tile_ry", "sp", [-1, 1]], ["tile_rx", "sp", [-1, 1]], ["auto_unroll_max_step", "ot", 512], ["unroll_explicit", "ot", 1]]}, "result": [[0.00017251145999999998], 0, 1.0577442646026611, 1644293069.1204402], "version": 0.2, "tvm_version": "0.8.dev0"}
{"input": ["opencl -keys=adreno,opencl,gpu -device=adreno -max_num_threads=256", "conv2d_nhwc.image2d", [["TENSOR", [1, 7, 7, 192], "float16"], ["TENSOR", [1, 1, 192, 1536], "float16"], [1, 1], [0, 0, 0, 0], [1, 1], "float16"], {}], "config": {"index": 95798, "code_hash": null, "entity": [["tile_fc", "sp", [-1, 1, 16]], ["tile_y", "sp", [-1, 1, 8]], ["tile_x", "sp", [-1, 8, 1]], ["tile_rcc", "sp", [-1, 12]], ["tile_ry", "sp", [-1, 1]], ["tile_rx", "sp", [-1, 1]], ["auto_unroll_max_step", "ot", 1500], ["unroll_explicit", "ot", 0]]}, "result": [[0.00014949272], 0, 1.0138704776763916, 1644294702.5119088], "version": 0.2, "tvm_version": "0.8.dev0"}
{"input": ["opencl -keys=adreno,opencl,gpu -device=adreno -max_num_threads=256", "depthwise_conv2d_nhwc.image2d", [["TENSOR", [1, 7, 7, 1536], "float16"], ["TENSOR", [5, 5, 1536, 1], "float16"], [1, 1], [2, 2, 2, 2], [1, 1], "float16"], {}], "config": {"index": 21349, "code_hash": null, "entity": [["tile_fc", "sp", [-1, 1, 16]], ["tile_y", "sp", [-1, 1, 4]], ["tile_x", "sp", [-1, 1, 8]], ["tile_ry", "sp", [-1, 5]], ["tile_rx", "sp", [-1, 1]], ["auto_unroll_max_step", "ot", 0], ["unroll_explicit", "ot", 0]]}, "result": [[8.432396e-05], 0, 1.7924599647521973, 1644295473.148846], "version": 0.2, "tvm_version": "0.8.dev0"}
{"input": ["opencl -keys=adreno,opencl,gpu -device=adreno -max_num_threads=256", "conv2d_nhwc.image2d", [["TENSOR", [1, 7, 7, 1536], "float16"], ["TENSOR", [1, 1, 1536, 192], "float16"], [1, 1], [0, 0, 0, 0], [1, 1], "float16"], {}], "config": {"index": 106018, "code_hash": null, "entity": [["tile_fc", "sp", [-1, 1, 8]], ["tile_y", "sp", [-1, 1, 1]], ["tile_x", "sp", [-1, 1, 8]], ["tile_rcc", "sp", [-1, 1]], ["tile_ry", "sp", [-1, 1]], ["tile_rx", "sp", [-1, 1]], ["auto_unroll_max_step", "ot", 1500], ["unroll_explicit", "ot", 1]]}, "result": [[0.00022374168], 0, 1.7852325439453125, 1644296730.057124], "version": 0.2, "tvm_version": "0.8.dev0"}
{"input": ["opencl -keys=adreno,opencl,gpu -device=adreno -max_num_threads=256", "conv2d_nhwc.image2d", [["TENSOR", [1, 7, 7, 192], "float16"], ["TENSOR", [1, 1, 192, 1280], "float16"], [1, 1], [0, 0, 0, 0], [1, 1], "float16"], {}], "config": {"index": 48707, "code_hash": null, "entity": [["tile_fc", "sp", [-1, 2, 16]], ["tile_y", "sp", [-1, 1, 8]], ["tile_x", "sp", [-1, 8, 1]], ["tile_rcc", "sp", [-1, 16]], ["tile_ry", "sp", [-1, 1]], ["tile_rx", "sp", [-1, 1]], ["auto_unroll_max_step", "ot", 512], ["unroll_explicit", "ot", 0]]}, "result": [[0.00010211665999999999], 0, 1.4588820934295654, 1644297586.93489], "version": 0.2, "tvm_version": "0.8.dev0"}
{"input": ["opencl -keys=adreno,opencl,gpu -device=adreno -max_num_threads=256", "dense_small_batch.cuda", [["TENSOR", [1, 1280], "float16"], ["TENSOR", [2507, 1280], "float16"], null, "float16"], {}], "config": {"index": 10, "code_hash": null, "entity": [["tile_k", "sp", [-1, 64]]]}, "result": [[0.00037003228], 0, 1.6866366863250732, 1644297760.0268152], "version": 0.2, "tvm_version": "0.8.dev0"}
