sd888_log/ww50/conv2d_1_257_257_32x1_1_32_16/my_conv2d_nchw_cuda.log.tmp
{"input": ["opencl -keys=opencl,gpu -max_num_threads=256", "conv2d_nhwc.cuda", [["TENSOR", [1, 257, 257, 32], "float16"], ["TENSOR", [1, 1, 32, 16], "float16"], [1, 1], [0, 0, 0, 0], [1, 1], "float16"], {}], "config": {"index": 683, "code_hash": null, "entity": [["tile_n", "ot", 8], ["tile_c", "ot", 8], ["num_thread_n", "ot", 4], ["num_thread_c", "ot", 8], ["vthread_n", "ot", 1], ["vthread_c", "ot", 1], ["step", "ot", 32]]}, "result": [[0.03171267708], 0, 52.779340744018555, 1639553337.3158422], "version": 0.2, "tvm_version": "0.8.dev0"}
{"input": ["opencl -keys=opencl,gpu -max_num_threads=256", "conv2d_nhwc.cuda", [["TENSOR", [1, 257, 257, 32], "float16"], ["TENSOR", [1, 1, 32, 16], "float16"], [1, 1], [0, 0, 0, 0], [1, 1], "float16"], {}], "config": {"index": 630, "code_hash": null, "entity": [["tile_n", "ot", 2], ["tile_c", "ot", 2], ["num_thread_n", "ot", 8], ["num_thread_c", "ot", 16], ["vthread_n", "ot", 2], ["vthread_c", "ot", 2], ["step", "ot", 3]]}, "result": [[0.02422743748], 0, 6.902047872543335, 1639553344.4822605], "version": 0.2, "tvm_version": "0.8.dev0"}
{"input": ["opencl -keys=opencl,gpu -max_num_threads=256", "conv2d_nhwc.cuda", [["TENSOR", [1, 257, 257, 32], "float16"], ["TENSOR", [1, 1, 32, 16], "float16"], [1, 1], [0, 0, 0, 0], [1, 1], "float16"], {}], "config": {"index": 105, "code_hash": null, "entity": [["tile_n", "ot", 2], ["tile_c", "ot", 8], ["num_thread_n", "ot", 16], ["num_thread_c", "ot", 4], ["vthread_n", "ot", 2], ["vthread_c", "ot", 1], ["step", "ot", 16]]}, "result": [[0.06833071560000001], 0, 50.43635535240173, 1639553440.911917], "version": 0.2, "tvm_version": "0.8.dev0"}
{"input": ["opencl -keys=opencl,gpu -max_num_threads=256", "conv2d_nhwc.cuda", [["TENSOR", [1, 257, 257, 32], "float16"], ["TENSOR", [1, 1, 32, 16], "float16"], [1, 1], [0, 0, 0, 0], [1, 1], "float16"], {}], "config": {"index": 225, "code_hash": null, "entity": [["tile_n", "ot", 2], ["tile_c", "ot", 2], ["num_thread_n", "ot", 8], ["num_thread_c", "ot", 16], ["vthread_n", "ot", 1], ["vthread_c", "ot", 2], ["step", "ot", 16]]}, "result": [[0.01809675938], 0, 5.677460432052612, 1639553447.1348026], "version": 0.2, "tvm_version": "0.8.dev0"}
{"input": ["opencl -keys=opencl,gpu -max_num_threads=256", "conv2d_nhwc.cuda", [["TENSOR", [1, 257, 257, 32], "float16"], ["TENSOR", [1, 1, 32, 16], "float16"], [1, 1], [0, 0, 0, 0], [1, 1], "float16"], {}], "config": {"index": 1142, "code_hash": null, "entity": [["tile_n", "ot", 8], ["tile_c", "ot", 8], ["num_thread_n", "ot", 4], ["num_thread_c", "ot", 4], ["vthread_n", "ot", 1], ["vthread_c", "ot", 2], ["step", "ot", 64]]}, "result": [[0.05721153852000001], 0, 16.806973457336426, 1639553458.273444], "version": 0.2, "tvm_version": "0.8.dev0"}
{"input": ["opencl -keys=opencl,gpu -max_num_threads=256", "conv2d_nhwc.cuda", [["TENSOR", [1, 257, 257, 32], "float16"], ["TENSOR", [1, 1, 32, 16], "float16"], [1, 1], [0, 0, 0, 0], [1, 1], "float16"], {}], "config": {"index": 1030, "code_hash": null, "entity": [["tile_n", "ot", 4], ["tile_c", "ot", 4], ["num_thread_n", "ot", 4], ["num_thread_c", "ot", 16], ["vthread_n", "ot", 1], ["vthread_c", "ot", 1], ["step", "ot", 64]]}, "result": [[0.02341606874], 0, 6.146190404891968, 1639553574.737622], "version": 0.2, "tvm_version": "0.8.dev0"}
{"input": ["opencl -keys=opencl,gpu -max_num_threads=256", "conv2d_nhwc.cuda", [["TENSOR", [1, 257, 257, 32], "float16"], ["TENSOR", [1, 1, 32, 16], "float16"], [1, 1], [0, 0, 0, 0], [1, 1], "float16"], {}], "config": {"index": 331, "code_hash": null, "entity": [["tile_n", "ot", 4], ["tile_c", "ot", 8], ["num_thread_n", "ot", 4], ["num_thread_c", "ot", 4], ["vthread_n", "ot", 1], ["vthread_c", "ot", 1], ["step", "ot", 3]]}, "result": [[0.03630061666], 0, 52.935007095336914, 1639553651.5080285], "version": 0.2, "tvm_version": "0.8.dev0"}
{"input": ["opencl -keys=opencl,gpu -max_num_threads=256", "conv2d_nhwc.cuda", [["TENSOR", [1, 257, 257, 32], "float16"], ["TENSOR", [1, 1, 32, 16], "float16"], [1, 1], [0, 0, 0, 0], [1, 1], "float16"], {}], "config": {"index": 690, "code_hash": null, "entity": [["tile_n", "ot", 2], ["tile_c", "ot", 8], ["num_thread_n", "ot", 8], ["num_thread_c", "ot", 8], ["vthread_n", "ot", 1], ["vthread_c", "ot", 1], ["step", "ot", 32]]}, "result": [[0.039271528119999996], 0, 53.35362124443054, 1639553705.0803556], "version": 0.2, "tvm_version": "0.8.dev0"}
{"input": ["opencl -keys=opencl,gpu -max_num_threads=256", "conv2d_nhwc.cuda", [["TENSOR", [1, 257, 257, 32], "float16"], ["TENSOR", [1, 1, 32, 16], "float16"], [1, 1], [0, 0, 0, 0], [1, 1], "float16"], {}], "config": {"index": 1282, "code_hash": null, "entity": [["tile_n", "ot", 4], ["tile_c", "ot", 4], ["num_thread_n", "ot", 8], ["num_thread_c", "ot", 16], ["vthread_n", "ot", 2], ["vthread_c", "ot", 2], ["step", "ot", 64]]}, "result": [[0.044732120800000004], 0, 8.9790620803833, 1639553714.2800744], "version": 0.2, "tvm_version": "0.8.dev0"}
{"input": ["opencl -keys=opencl,gpu -max_num_threads=256", "conv2d_nhwc.cuda", [["TENSOR", [1, 257, 257, 32], "float16"], ["TENSOR", [1, 1, 32, 16], "float16"], [1, 1], [0, 0, 0, 0], [1, 1], "float16"], {}], "config": {"index": 627, "code_hash": null, "entity": [["tile_n", "ot", 2], ["tile_c", "ot", 8], ["num_thread_n", "ot", 4], ["num_thread_c", "ot", 16], ["vthread_n", "ot", 2], ["vthread_c", "ot", 2], ["step", "ot", 3]]}, "result": [[0.06958990518], 0, 13.019526243209839, 1639553774.1621342], "version": 0.2, "tvm_version": "0.8.dev0"}
{"input": ["opencl -keys=opencl,gpu -max_num_threads=256", "conv2d_nhwc.cuda", [["TENSOR", [1, 257, 257, 32], "float16"], ["TENSOR", [1, 1, 32, 16], "float16"], [1, 1], [0, 0, 0, 0], [1, 1], "float16"], {}], "config": {"index": 968, "code_hash": null, "entity": [["tile_n", "ot", 8], ["tile_c", "ot", 4], ["num_thread_n", "ot", 16], ["num_thread_c", "ot", 16], ["vthread_n", "ot", 2], ["vthread_c", "ot", 2], ["step", "ot", 32]]}, "result": [[0.05944767394], 0, 23.90762948989868, 1639553785.071153], "version": 0.2, "tvm_version": "0.8.dev0"}
{"input": ["opencl -keys=opencl,gpu -max_num_threads=256", "conv2d_nhwc.cuda", [["TENSOR", [1, 257, 257, 32], "float16"], ["TENSOR", [1, 1, 32, 16], "float16"], [1, 1], [0, 0, 0, 0], [1, 1], "float16"], {}], "config": {"index": 389, "code_hash": null, "entity": [["tile_n", "ot", 8], ["tile_c", "ot", 2], ["num_thread_n", "ot", 8], ["num_thread_c", "ot", 16], ["vthread_n", "ot", 1], ["vthread_c", "ot", 1], ["step", "ot", 3]]}, "result": [[0.02423275832], 0, 5.787580490112305, 1639553791.075018], "version": 0.2, "tvm_version": "0.8.dev0"}
{"input": ["opencl -keys=opencl,gpu -max_num_threads=256", "conv2d_nhwc.cuda", [["TENSOR", [1, 257, 257, 32], "float16"], ["TENSOR", [1, 1, 32, 16], "float16"], [1, 1], [0, 0, 0, 0], [1, 1], "float16"], {}], "config": {"index": 628, "code_hash": null, "entity": [["tile_n", "ot", 4], ["tile_c", "ot", 8], ["num_thread_n", "ot", 4], ["num_thread_c", "ot", 16], ["vthread_n", "ot", 2], ["vthread_c", "ot", 2], ["step", "ot", 3]]}, "result": [[0.06986947602], 0, 18.22791600227356, 1639553803.5237217], "version": 0.2, "tvm_version": "0.8.dev0"}
{"input": ["opencl -keys=opencl,gpu -max_num_threads=256", "conv2d_nhwc.cuda", [["TENSOR", [1, 257, 257, 32], "float16"], ["TENSOR", [1, 1, 32, 16], "float16"], [1, 1], [0, 0, 0, 0], [1, 1], "float16"], {}], "config": {"index": 181, "code_hash": null, "entity": [["tile_n", "ot", 4], ["tile_c", "ot", 2], ["num_thread_n", "ot", 16], ["num_thread_c", "ot", 4], ["vthread_n", "ot", 1], ["vthread_c", "ot", 2], ["step", "ot", 16]]}, "result": [[0.010085522920000001], 0, 3.60669207572937, 1639553807.3624501], "version": 0.2, "tvm_version": "0.8.dev0"}
{"input": ["opencl -keys=opencl,gpu -max_num_threads=256", "conv2d_nhwc.cuda", [["TENSOR", [1, 257, 257, 32], "float16"], ["TENSOR", [1, 1, 32, 16], "float16"], [1, 1], [0, 0, 0, 0], [1, 1], "float16"], {}], "config": {"index": 235, "code_hash": null, "entity": [["tile_n", "ot", 4], ["tile_c", "ot", 2], ["num_thread_n", "ot", 16], ["num_thread_c", "ot", 16], ["vthread_n", "ot", 1], ["vthread_c", "ot", 2], ["step", "ot", 16]]}, "result": [[0.03194120312], 0, 10.238786697387695, 1639553814.013157], "version": 0.2, "tvm_version": "0.8.dev0"}
{"input": ["opencl -keys=opencl,gpu -max_num_threads=256", "conv2d_nhwc.cuda", [["TENSOR", [1, 257, 257, 32], "float16"], ["TENSOR", [1, 1, 32, 16], "float16"], [1, 1], [0, 0, 0, 0], [1, 1], "float16"], {}], "config": {"index": 193, "code_hash": null, "entity": [["tile_n", "ot", 4], ["tile_c", "ot", 4], ["num_thread_n", "ot", 4], ["num_thread_c", "ot", 8], ["vthread_n", "ot", 1], ["vthread_c", "ot", 2], ["step", "ot", 16]]}, "result": [[0.01746077082], 0, 5.351583957672119, 1639553819.6158357], "version": 0.2, "tvm_version": "0.8.dev0"}
{"input": ["opencl -keys=opencl,gpu -max_num_threads=256", "conv2d_nhwc.cuda", [["TENSOR", [1, 257, 257, 32], "float16"], ["TENSOR", [1, 1, 32, 16], "float16"], [1, 1], [0, 0, 0, 0], [1, 1], "float16"], {}], "config": {"index": 591, "code_hash": null, "entity": [["tile_n", "ot", 2], ["tile_c", "ot", 8], ["num_thread_n", "ot", 16], ["num_thread_c", "ot", 4], ["vthread_n", "ot", 2], ["vthread_c", "ot", 2], ["step", "ot", 3]]}, "result": [[0.07432086768], 0, 18.604499578475952, 1639553832.865987], "version": 0.2, "tvm_version": "0.8.dev0"}
{"input": ["opencl -keys=opencl,gpu -max_num_threads=256", "conv2d_nhwc.cuda", [["TENSOR", [1, 257, 257, 32], "float16"], ["TENSOR", [1, 1, 32, 16], "float16"], [1, 1], [0, 0, 0, 0], [1, 1], "float16"], {}], "config": {"index": 1086, "code_hash": null, "entity": [["tile_n", "ot", 2], ["tile_c", "ot", 8], ["num_thread_n", "ot", 4], ["num_thread_c", "ot", 8], ["vthread_n", "ot", 2], ["vthread_c", "ot", 1], ["step", "ot", 64]]}, "result": [[0.05139276248], 0, 9.843300104141235, 1639553842.9410489], "version": 0.2, "tvm_version": "0.8.dev0"}
{"input": ["opencl -keys=opencl,gpu -max_num_threads=256", "conv2d_nhwc.cuda", [["TENSOR", [1, 257, 257, 32], "float16"], ["TENSOR", [1, 1, 32, 16], "float16"], [1, 1], [0, 0, 0, 0], [1, 1], "float16"], {}], "config": {"index": 332, "code_hash": null, "entity": [["tile_n", "ot", 8], ["tile_c", "ot", 8], ["num_thread_n", "ot", 4], ["num_thread_c", "ot", 4], ["vthread_n", "ot", 1], ["vthread_c", "ot", 1], ["step", "ot", 3]]}, "result": [[0.03630347708], 0, 17.92223572731018, 1639553851.0340545], "version": 0.2, "tvm_version": "0.8.dev0"}
{"input": ["opencl -keys=opencl,gpu -max_num_threads=256", "conv2d_nhwc.cuda", [["TENSOR", [1, 257, 257, 32], "float16"], ["TENSOR", [1, 1, 32, 16], "float16"], [1, 1], [0, 0, 0, 0], [1, 1], "float16"], {}], "config": {"index": 559, "code_hash": null, "entity": [["tile_n", "ot", 4], ["tile_c", "ot", 2], ["num_thread_n", "ot", 16], ["num_thread_c", "ot", 16], ["vthread_n", "ot", 1], ["vthread_c", "ot", 2], ["step", "ot", 3]]}, "result": [[0.045416531219999993], 0, 9.011589765548706, 1639553860.2339206], "version": 0.2, "tvm_version": "0.8.dev0"}
{"input": ["opencl -keys=opencl,gpu -max_num_threads=256", "conv2d_nhwc.cuda", [["TENSOR", [1, 257, 257, 32], "float16"], ["TENSOR", [1, 1, 32, 16], "float16"], [1, 1], [0, 0, 0, 0], [1, 1], "float16"], {}], "config": {"index": 120, "code_hash": null, "entity": [["tile_n", "ot", 2], ["tile_c", "ot", 4], ["num_thread_n", "ot", 8], ["num_thread_c", "ot", 8], ["vthread_n", "ot", 2], ["vthread_c", "ot", 1], ["step", "ot", 16]]}, "result": [[0.021867445819999998], 0, 5.498841047286987, 1639553912.07201], "version": 0.2, "tvm_version": "0.8.dev0"}
{"input": ["opencl -keys=opencl,gpu -max_num_threads=256", "conv2d_nhwc.cuda", [["TENSOR", [1, 257, 257, 32], "float16"], ["TENSOR", [1, 1, 32, 16], "float16"], [1, 1], [0, 0, 0, 0], [1, 1], "float16"], {}], "config": {"index": 236, "code_hash": null, "entity": [["tile_n", "ot", 8], ["tile_c", "ot", 2], ["num_thread_n", "ot", 16], ["num_thread_c", "ot", 16], ["vthread_n", "ot", 1], ["vthread_c", "ot", 2], ["step", "ot", 16]]}, "result": [[0.031991925000000004], 0, 6.985485315322876, 1639554020.6940491], "version": 0.2, "tvm_version": "0.8.dev0"}
{"input": ["opencl -keys=opencl,gpu -max_num_threads=256", "conv2d_nhwc.cuda", [["TENSOR", [1, 257, 257, 32], "float16"], ["TENSOR", [1, 1, 32, 16], "float16"], [1, 1], [0, 0, 0, 0], [1, 1], "float16"], {}], "config": {"index": 922, "code_hash": null, "entity": [["tile_n", "ot", 4], ["tile_c", "ot", 4], ["num_thread_n", "ot", 4], ["num_thread_c", "ot", 8], ["vthread_n", "ot", 2], ["vthread_c", "ot", 2], ["step", "ot", 32]]}, "result": [[0.02312001146], 0, 53.08395218849182, 1639554121.4081109], "version": 0.2, "tvm_version": "0.8.dev0"}
{"input": ["opencl -keys=opencl,gpu -max_num_threads=256", "conv2d_nhwc.cuda", [["TENSOR", [1, 257, 257, 32], "float16"], ["TENSOR", [1, 1, 32, 16], "float16"], [1, 1], [0, 0, 0, 0], [1, 1], "float16"], {}], "config": {"index": 1182, "code_hash": null, "entity": [["tile_n", "ot", 2], ["tile_c", "ot", 4], ["num_thread_n", "ot", 16], ["num_thread_c", "ot", 8], ["vthread_n", "ot", 1], ["vthread_c", "ot", 2], ["step", "ot", 64]]}, "result": [[0.03857280726], 0, 7.8641722202301025, 1639554129.4876995], "version": 0.2, "tvm_version": "0.8.dev0"}
{"input": ["opencl -keys=opencl,gpu -max_num_threads=256", "conv2d_nhwc.cuda", [["TENSOR", [1, 257, 257, 32], "float16"], ["TENSOR", [1, 1, 32, 16], "float16"], [1, 1], [0, 0, 0, 0], [1, 1], "float16"], {}], "config": {"index": 143, "code_hash": null, "entity": [["tile_n", "ot", 8], ["tile_c", "ot", 8], ["num_thread_n", "ot", 4], ["num_thread_c", "ot", 16], ["vthread_n", "ot", 2], ["vthread_c", "ot", 1], ["step", "ot", 16]]}, "result": [[0.07090898746], 0, 20.702972888946533, 1639554142.3431754], "version": 0.2, "tvm_version": "0.8.dev0"}
{"input": ["opencl -keys=opencl,gpu -max_num_threads=256", "conv2d_nhwc.cuda", [["TENSOR", [1, 257, 257, 32], "float16"], ["TENSOR", [1, 1, 32, 16], "float16"], [1, 1], [0, 0, 0, 0], [1, 1], "float16"], {}], "config": {"index": 959, "code_hash": null, "entity": [["tile_n", "ot", 8], ["tile_c", "ot", 4], ["num_thread_n", "ot", 8], ["num_thread_c", "ot", 16], ["vthread_n", "ot", 2], ["vthread_c", "ot", 2], ["step", "ot", 32]]}, "result": [[0.0450376729], 0, 8.948729515075684, 1639554151.5287924], "version": 0.2, "tvm_version": "0.8.dev0"}
{"input": ["opencl -keys=opencl,gpu -max_num_threads=256", "conv2d_nhwc.cuda", [["TENSOR", [1, 257, 257, 32], "float16"], ["TENSOR", [1, 1, 32, 16], "float16"], [1, 1], [0, 0, 0, 0], [1, 1], "float16"], {}], "config": {"index": 1061, "code_hash": null, "entity": [["tile_n", "ot", 8], ["tile_c", "ot", 8], ["num_thread_n", "ot", 4], ["num_thread_c", "ot", 4], ["vthread_n", "ot", 2], ["vthread_c", "ot", 1], ["step", "ot", 64]]}, "result": [[0.04130237602], 0, 17.53716278076172, 1639554160.1192007], "version": 0.2, "tvm_version": "0.8.dev0"}
{"input": ["opencl -keys=opencl,gpu -max_num_threads=256", "conv2d_nhwc.cuda", [["TENSOR", [1, 257, 257, 32], "float16"], ["TENSOR", [1, 1, 32, 16], "float16"], [1, 1], [0, 0, 0, 0], [1, 1], "float16"], {}], "config": {"index": 496, "code_hash": null, "entity": [["tile_n", "ot", 4], ["tile_c", "ot", 2], ["num_thread_n", "ot", 8], ["num_thread_c", "ot", 4], ["vthread_n", "ot", 1], ["vthread_c", "ot", 2], ["step", "ot", 3]]}, "result": [[0.015250188539999997], 0, 4.621459245681763, 1639554226.2207294], "version": 0.2, "tvm_version": "0.8.dev0"}
{"input": ["opencl -keys=opencl,gpu -max_num_threads=256", "conv2d_nhwc.cuda", [["TENSOR", [1, 257, 257, 32], "float16"], ["TENSOR", [1, 1, 32, 16], "float16"], [1, 1], [0, 0, 0, 0], [1, 1], "float16"], {}], "config": {"index": 62, "code_hash": null, "entity": [["tile_n", "ot", 8], ["tile_c", "ot", 8], ["num_thread_n", "ot", 4], ["num_thread_c", "ot", 16], ["vthread_n", "ot", 1], ["vthread_c", "ot", 1], ["step", "ot", 16]]}, "result": [[0.036672773959999995], 0, 54.57128596305847, 1639554327.7258475], "version": 0.2, "tvm_version": "0.8.dev0"}
{"input": ["opencl -keys=opencl,gpu -max_num_threads=256", "conv2d_nhwc.cuda", [["TENSOR", [1, 257, 257, 32], "float16"], ["TENSOR", [1, 1, 32, 16], "float16"], [1, 1], [0, 0, 0, 0], [1, 1], "float16"], {}], "config": {"index": 394, "code_hash": null, "entity": [["tile_n", "ot", 4], ["tile_c", "ot", 8], ["num_thread_n", "ot", 8], ["num_thread_c", "ot", 16], ["vthread_n", "ot", 1], ["vthread_c", "ot", 1], ["step", "ot", 3]]}, "result": [[0.07531150414], 0, 13.835158348083496, 1639554341.7286534], "version": 0.2, "tvm_version": "0.8.dev0"}
{"input": ["opencl -keys=opencl,gpu -max_num_threads=256", "conv2d_nhwc.cuda", [["TENSOR", [1, 257, 257, 32], "float16"], ["TENSOR", [1, 1, 32, 16], "float16"], [1, 1], [0, 0, 0, 0], [1, 1], "float16"], {}], "config": {"index": 396, "code_hash": null, "entity": [["tile_n", "ot", 2], ["tile_c", "ot", 2], ["num_thread_n", "ot", 16], ["num_thread_c", "ot", 16], ["vthread_n", "ot", 1], ["vthread_c", "ot", 1], ["step", "ot", 3]]}, "result": [[0.0453427781], 0, 22.776606798171997, 1639554350.7073967], "version": 0.2, "tvm_version": "0.8.dev0"}
{"input": ["opencl -keys=opencl,gpu -max_num_threads=256", "conv2d_nhwc.cuda", [["TENSOR", [1, 257, 257, 32], "float16"], ["TENSOR", [1, 1, 32, 16], "float16"], [1, 1], [0, 0, 0, 0], [1, 1], "float16"], {}], "config": {"index": 804, "code_hash": null, "entity": [["tile_n", "ot", 2], ["tile_c", "ot", 4], ["num_thread_n", "ot", 16], ["num_thread_c", "ot", 16], ["vthread_n", "ot", 2], ["vthread_c", "ot", 1], ["step", "ot", 32]]}, "result": [[0.058412429140000006], 0, 26.397881984710693, 1639554444.3639343], "version": 0.2, "tvm_version": "0.8.dev0"}
{"input": ["opencl -keys=opencl,gpu -max_num_threads=256", "conv2d_nhwc.cuda", [["TENSOR", [1, 257, 257, 32], "float16"], ["TENSOR", [1, 1, 32, 16], "float16"], [1, 1], [0, 0, 0, 0], [1, 1], "float16"], {}], "config": {"index": 460, "code_hash": null, "entity": [["tile_n", "ot", 4], ["tile_c", "ot", 2], ["num_thread_n", "ot", 4], ["num_thread_c", "ot", 16], ["vthread_n", "ot", 2], ["vthread_c", "ot", 1], ["step", "ot", 3]]}, "result": [[0.0200579927], 0, 5.085920095443726, 1639554511.7214804], "version": 0.2, "tvm_version": "0.8.dev0"}
{"input": ["opencl -keys=opencl,gpu -max_num_threads=256", "conv2d_nhwc.cuda", [["TENSOR", [1, 257, 257, 32], "float16"], ["TENSOR", [1, 1, 32, 16], "float16"], [1, 1], [0, 0, 0, 0], [1, 1], "float16"], {}], "config": {"index": 1107, "code_hash": null, "entity": [["tile_n", "ot", 2], ["tile_c", "ot", 2], ["num_thread_n", "ot", 4], ["num_thread_c", "ot", 16], ["vthread_n", "ot", 2], ["vthread_c", "ot", 1], ["step", "ot", 64]]}, "result": [[0.012104365620000002], 0, 4.017019510269165, 1639554533.4663124], "version": 0.2, "tvm_version": "0.8.dev0"}
{"input": ["opencl -keys=opencl,gpu -max_num_threads=256", "conv2d_nhwc.cuda", [["TENSOR", [1, 257, 257, 32], "float16"], ["TENSOR", [1, 1, 32, 16], "float16"], [1, 1], [0, 0, 0, 0], [1, 1], "float16"], {}], "config": {"index": 1159, "code_hash": null, "entity": [["tile_n", "ot", 4], ["tile_c", "ot", 8], ["num_thread_n", "ot", 16], ["num_thread_c", "ot", 4], ["vthread_n", "ot", 1], ["vthread_c", "ot", 2], ["step", "ot", 64]]}, "result": [[0.07324545726000001], 0, 17.361324787139893, 1639554546.8245473], "version": 0.2, "tvm_version": "0.8.dev0"}
{"input": ["opencl -keys=opencl,gpu -max_num_threads=256", "conv2d_nhwc.cuda", [["TENSOR", [1, 257, 257, 32], "float16"], ["TENSOR", [1, 1, 32, 16], "float16"], [1, 1], [0, 0, 0, 0], [1, 1], "float16"], {}], "config": {"index": 592, "code_hash": null, "entity": [["tile_n", "ot", 4], ["tile_c", "ot", 8], ["num_thread_n", "ot", 16], ["num_thread_c", "ot", 4], ["vthread_n", "ot", 2], ["vthread_c", "ot", 2], ["step", "ot", 3]]}, "result": [[0.07454492706], 0, 29.46047806739807, 1639554576.5129373], "version": 0.2, "tvm_version": "0.8.dev0"}
{"input": ["opencl -keys=opencl,gpu -max_num_threads=256", "conv2d_nhwc.cuda", [["TENSOR", [1, 257, 257, 32], "float16"], ["TENSOR", [1, 1, 32, 16], "float16"], [1, 1], [0, 0, 0, 0], [1, 1], "float16"], {}], "config": {"index": 784, "code_hash": null, "entity": [["tile_n", "ot", 4], ["tile_c", "ot", 2], ["num_thread_n", "ot", 4], ["num_thread_c", "ot", 16], ["vthread_n", "ot", 2], ["vthread_c", "ot", 1], ["step", "ot", 32]]}, "result": [[0.01212325104], 0, 4.097321033477783, 1639554601.681116], "version": 0.2, "tvm_version": "0.8.dev0"}
{"input": ["opencl -keys=opencl,gpu -max_num_threads=256", "conv2d_nhwc.cuda", [["TENSOR", [1, 257, 257, 32], "float16"], ["TENSOR", [1, 1, 32, 16], "float16"], [1, 1], [0, 0, 0, 0], [1, 1], "float16"], {}], "config": {"index": 783, "code_hash": null, "entity": [["tile_n", "ot", 2], ["tile_c", "ot", 2], ["num_thread_n", "ot", 4], ["num_thread_c", "ot", 16], ["vthread_n", "ot", 2], ["vthread_c", "ot", 1], ["step", "ot", 32]]}, "result": [[0.01210092604], 0, 7.9349706172943115, 1639554605.5205696], "version": 0.2, "tvm_version": "0.8.dev0"}
{"input": ["opencl -keys=opencl,gpu -max_num_threads=256", "conv2d_nhwc.cuda", [["TENSOR", [1, 257, 257, 32], "float16"], ["TENSOR", [1, 1, 32, 16], "float16"], [1, 1], [0, 0, 0, 0], [1, 1], "float16"], {}], "config": {"index": 379, "code_hash": null, "entity": [["tile_n", "ot", 4], ["tile_c", "ot", 2], ["num_thread_n", "ot", 4], ["num_thread_c", "ot", 16], ["vthread_n", "ot", 1], ["vthread_c", "ot", 1], ["step", "ot", 3]]}, "result": [[0.0201827677], 0, 5.141531467437744, 1639554610.8433971], "version": 0.2, "tvm_version": "0.8.dev0"}
{"input": ["opencl -keys=opencl,gpu -max_num_threads=256", "conv2d_nhwc.cuda", [["TENSOR", [1, 257, 257, 32], "float16"], ["TENSOR", [1, 1, 32, 16], "float16"], [1, 1], [0, 0, 0, 0], [1, 1], "float16"], {}], "config": {"index": 378, "code_hash": null, "entity": [["tile_n", "ot", 2], ["tile_c", "ot", 2], ["num_thread_n", "ot", 4], ["num_thread_c", "ot", 16], ["vthread_n", "ot", 1], ["vthread_c", "ot", 1], ["step", "ot", 3]]}, "result": [[0.020167971859999998], 0, 10.49588131904602, 1639554616.2091618], "version": 0.2, "tvm_version": "0.8.dev0"}
{"input": ["opencl -keys=opencl,gpu -max_num_threads=256", "conv2d_nhwc.cuda", [["TENSOR", [1, 257, 257, 32], "float16"], ["TENSOR", [1, 1, 32, 16], "float16"], [1, 1], [0, 0, 0, 0], [1, 1], "float16"], {}], "config": {"index": 841, "code_hash": null, "entity": [["tile_n", "ot", 4], ["tile_c", "ot", 4], ["num_thread_n", "ot", 4], ["num_thread_c", "ot", 8], ["vthread_n", "ot", 1], ["vthread_c", "ot", 2], ["step", "ot", 32]]}, "result": [[0.023131411440000003], 0, 5.661471605300903, 1639554622.0891082], "version": 0.2, "tvm_version": "0.8.dev0"}
{"input": ["opencl -keys=opencl,gpu -max_num_threads=256", "conv2d_nhwc.cuda", [["TENSOR", [1, 257, 257, 32], "float16"], ["TENSOR", [1, 1, 32, 16], "float16"], [1, 1], [0, 0, 0, 0], [1, 1], "float16"], {}], "config": {"index": 1027, "code_hash": null, "entity": [["tile_n", "ot", 4], ["tile_c", "ot", 2], ["num_thread_n", "ot", 4], ["num_thread_c", "ot", 16], ["vthread_n", "ot", 1], ["vthread_c", "ot", 1], ["step", "ot", 64]]}, "result": [[0.01210859584], 0, 9.720087766647339, 1639554626.1880229], "version": 0.2, "tvm_version": "0.8.dev0"}
{"input": ["opencl -keys=opencl,gpu -max_num_threads=256", "conv2d_nhwc.cuda", [["TENSOR", [1, 257, 257, 32], "float16"], ["TENSOR", [1, 1, 32, 16], "float16"], [1, 1], [0, 0, 0, 0], [1, 1], "float16"], {}], "config": {"index": 1026, "code_hash": null, "entity": [["tile_n", "ot", 2], ["tile_c", "ot", 2], ["num_thread_n", "ot", 4], ["num_thread_c", "ot", 16], ["vthread_n", "ot", 1], ["vthread_c", "ot", 1], ["step", "ot", 64]]}, "result": [[0.01210776042], 0, 4.576339244842529, 1639554630.9931204], "version": 0.2, "tvm_version": "0.8.dev0"}
{"input": ["opencl -keys=opencl,gpu -max_num_threads=256", "conv2d_nhwc.cuda", [["TENSOR", [1, 257, 257, 32], "float16"], ["TENSOR", [1, 1, 32, 16], "float16"], [1, 1], [0, 0, 0, 0], [1, 1], "float16"], {}], "config": {"index": 702, "code_hash": null, "entity": [["tile_n", "ot", 2], ["tile_c", "ot", 2], ["num_thread_n", "ot", 4], ["num_thread_c", "ot", 16], ["vthread_n", "ot", 1], ["vthread_c", "ot", 1], ["step", "ot", 32]]}, "result": [[0.01213209792], 0, 8.63398551940918, 1639554635.094581], "version": 0.2, "tvm_version": "0.8.dev0"}
{"input": ["opencl -keys=opencl,gpu -max_num_threads=256", "conv2d_nhwc.cuda", [["TENSOR", [1, 257, 257, 32], "float16"], ["TENSOR", [1, 1, 32, 16], "float16"], [1, 1], [0, 0, 0, 0], [1, 1], "float16"], {}], "config": {"index": 703, "code_hash": null, "entity": [["tile_n", "ot", 4], ["tile_c", "ot", 2], ["num_thread_n", "ot", 4], ["num_thread_c", "ot", 16], ["vthread_n", "ot", 1], ["vthread_c", "ot", 1], ["step", "ot", 32]]}, "result": [[0.01215333334], 0, 4.438255548477173, 1639554639.7989714], "version": 0.2, "tvm_version": "0.8.dev0"}
{"input": ["opencl -keys=opencl,gpu -max_num_threads=256", "conv2d_nhwc.cuda", [["TENSOR", [1, 257, 257, 32], "float16"], ["TENSOR", [1, 1, 32, 16], "float16"], [1, 1], [0, 0, 0, 0], [1, 1], "float16"], {}], "config": {"index": 785, "code_hash": null, "entity": [["tile_n", "ot", 8], ["tile_c", "ot", 2], ["num_thread_n", "ot", 4], ["num_thread_c", "ot", 16], ["vthread_n", "ot", 2], ["vthread_c", "ot", 1], ["step", "ot", 32]]}, "result": [[0.012157648959999998], 0, 8.912375926971436, 1639554644.2817855], "version": 0.2, "tvm_version": "0.8.dev0"}
{"input": ["opencl -keys=opencl,gpu -max_num_threads=256", "conv2d_nhwc.cuda", [["TENSOR", [1, 257, 257, 32], "float16"], ["TENSOR", [1, 1, 32, 16], "float16"], [1, 1], [0, 0, 0, 0], [1, 1], "float16"], {}], "config": {"index": 865, "code_hash": null, "entity": [["tile_n", "ot", 4], ["tile_c", "ot", 2], ["num_thread_n", "ot", 4], ["num_thread_c", "ot", 16], ["vthread_n", "ot", 1], ["vthread_c", "ot", 2], ["step", "ot", 32]]}, "result": [[0.01589790312], 0, 4.546736240386963, 1639554649.0380878], "version": 0.2, "tvm_version": "0.8.dev0"}
{"input": ["opencl -keys=opencl,gpu -max_num_threads=256", "conv2d_nhwc.cuda", [["TENSOR", [1, 257, 257, 32], "float16"], ["TENSOR", [1, 1, 32, 16], "float16"], [1, 1], [0, 0, 0, 0], [1, 1], "float16"], {}], "config": {"index": 1165, "code_hash": null, "entity": [["tile_n", "ot", 4], ["tile_c", "ot", 4], ["num_thread_n", "ot", 4], ["num_thread_c", "ot", 8], ["vthread_n", "ot", 1], ["vthread_c", "ot", 2], ["step", "ot", 64]]}, "result": [[0.023136884360000002], 0, 10.184981107711792, 1639554654.684359], "version": 0.2, "tvm_version": "0.8.dev0"}
{"input": ["opencl -keys=opencl,gpu -max_num_threads=256", "conv2d_nhwc.cuda", [["TENSOR", [1, 257, 257, 32], "float16"], ["TENSOR", [1, 1, 32, 16], "float16"], [1, 1], [0, 0, 0, 0], [1, 1], "float16"], {}], "config": {"index": 840, "code_hash": null, "entity": [["tile_n", "ot", 2], ["tile_c", "ot", 4], ["num_thread_n", "ot", 4], ["num_thread_c", "ot", 8], ["vthread_n", "ot", 1], ["vthread_c", "ot", 2], ["step", "ot", 32]]}, "result": [[0.023141685400000004], 0, 5.843285083770752, 1639554660.7768116], "version": 0.2, "tvm_version": "0.8.dev0"}
{"input": ["opencl -keys=opencl,gpu -max_num_threads=256", "conv2d_nhwc.cuda", [["TENSOR", [1, 257, 257, 32], "float16"], ["TENSOR", [1, 1, 32, 16], "float16"], [1, 1], [0, 0, 0, 0], [1, 1], "float16"], {}], "config": {"index": 192, "code_hash": null, "entity": [["tile_n", "ot", 2], ["tile_c", "ot", 4], ["num_thread_n", "ot", 4], ["num_thread_c", "ot", 8], ["vthread_n", "ot", 1], ["vthread_c", "ot", 2], ["step", "ot", 16]]}, "result": [[0.017491322899999998], 0, 11.020535707473755, 1639554665.9642808], "version": 0.2, "tvm_version": "0.8.dev0"}
{"input": ["opencl -keys=opencl,gpu -max_num_threads=256", "conv2d_nhwc.cuda", [["TENSOR", [1, 257, 257, 32], "float16"], ["TENSOR", [1, 1, 32, 16], "float16"], [1, 1], [0, 0, 0, 0], [1, 1], "float16"], {}], "config": {"index": 1189, "code_hash": null, "entity": [["tile_n", "ot", 4], ["tile_c", "ot", 2], ["num_thread_n", "ot", 4], ["num_thread_c", "ot", 16], ["vthread_n", "ot", 1], ["vthread_c", "ot", 2], ["step", "ot", 64]]}, "result": [[0.01487920208], 0, 4.320012092590332, 1639554670.5107167], "version": 0.2, "tvm_version": "0.8.dev0"}
{"input": ["opencl -keys=opencl,gpu -max_num_threads=256", "conv2d_nhwc.cuda", [["TENSOR", [1, 257, 257, 32], "float16"], ["TENSOR", [1, 1, 32, 16], "float16"], [1, 1], [0, 0, 0, 0], [1, 1], "float16"], {}], "config": {"index": 864, "code_hash": null, "entity": [["tile_n", "ot", 2], ["tile_c", "ot", 2], ["num_thread_n", "ot", 4], ["num_thread_c", "ot", 16], ["vthread_n", "ot", 1], ["vthread_c", "ot", 2], ["step", "ot", 32]]}, "result": [[0.01596055624], 0, 8.851965188980103, 1639554675.0502], "version": 0.2, "tvm_version": "0.8.dev0"}
{"input": ["opencl -keys=opencl,gpu -max_num_threads=256", "conv2d_nhwc.cuda", [["TENSOR", [1, 257, 257, 32], "float16"], ["TENSOR", [1, 1, 32, 16], "float16"], [1, 1], [0, 0, 0, 0], [1, 1], "float16"], {}], "config": {"index": 786, "code_hash": null, "entity": [["tile_n", "ot", 2], ["tile_c", "ot", 4], ["num_thread_n", "ot", 4], ["num_thread_c", "ot", 16], ["vthread_n", "ot", 2], ["vthread_c", "ot", 1], ["step", "ot", 32]]}, "result": [[0.021383031240000003], 0, 6.551445960998535, 1639554681.8430974], "version": 0.2, "tvm_version": "0.8.dev0"}
{"input": ["opencl -keys=opencl,gpu -max_num_threads=256", "conv2d_nhwc.cuda", [["TENSOR", [1, 257, 257, 32], "float16"], ["TENSOR", [1, 1, 32, 16], "float16"], [1, 1], [0, 0, 0, 0], [1, 1], "float16"], {}], "config": {"index": 705, "code_hash": null, "entity": [["tile_n", "ot", 2], ["tile_c", "ot", 4], ["num_thread_n", "ot", 4], ["num_thread_c", "ot", 16], ["vthread_n", "ot", 1], ["vthread_c", "ot", 1], ["step", "ot", 32]]}, "result": [[0.021371726039999997], 0, 24.456382751464844, 1639554712.5726614], "version": 0.2, "tvm_version": "0.8.dev0"}
{"input": ["opencl -keys=opencl,gpu -max_num_threads=256", "conv2d_nhwc.cuda", [["TENSOR", [1, 257, 257, 32], "float16"], ["TENSOR", [1, 1, 32, 16], "float16"], [1, 1], [0, 0, 0, 0], [1, 1], "float16"], {}], "config": {"index": 706, "code_hash": null, "entity": [["tile_n", "ot", 4], ["tile_c", "ot", 4], ["num_thread_n", "ot", 4], ["num_thread_c", "ot", 16], ["vthread_n", "ot", 1], ["vthread_c", "ot", 1], ["step", "ot", 32]]}, "result": [[0.02137868958], 0, 30.161539793014526, 1639554718.285552], "version": 0.2, "tvm_version": "0.8.dev0"}
{"input": ["opencl -keys=opencl,gpu -max_num_threads=256", "conv2d_nhwc.cuda", [["TENSOR", [1, 257, 257, 32], "float16"], ["TENSOR", [1, 1, 32, 16], "float16"], [1, 1], [0, 0, 0, 0], [1, 1], "float16"], {}], "config": {"index": 1164, "code_hash": null, "entity": [["tile_n", "ot", 2], ["tile_c", "ot", 4], ["num_thread_n", "ot", 4], ["num_thread_c", "ot", 8], ["vthread_n", "ot", 1], ["vthread_c", "ot", 2], ["step", "ot", 64]]}, "result": [[0.02314713958], 0, 6.747532844543457, 1639554725.2789328], "version": 0.2, "tvm_version": "0.8.dev0"}
{"input": ["opencl -keys=opencl,gpu -max_num_threads=256", "conv2d_nhwc.cuda", [["TENSOR", [1, 257, 257, 32], "float16"], ["TENSOR", [1, 1, 32, 16], "float16"], [1, 1], [0, 0, 0, 0], [1, 1], "float16"], {}], "config": {"index": 1108, "code_hash": null, "entity": [["tile_n", "ot", 4], ["tile_c", "ot", 2], ["num_thread_n", "ot", 4], ["num_thread_c", "ot", 16], ["vthread_n", "ot", 2], ["vthread_c", "ot", 1], ["step", "ot", 64]]}, "result": [[0.012092859380000001], 0, 11.040821552276611, 1639554729.5821893], "version": 0.2, "tvm_version": "0.8.dev0"}
{"input": ["opencl -keys=opencl,gpu -max_num_threads=256", "conv2d_nhwc.cuda", [["TENSOR", [1, 257, 257, 32], "float16"], ["TENSOR", [1, 1, 32, 16], "float16"], [1, 1], [0, 0, 0, 0], [1, 1], "float16"], {}], "config": {"index": 842, "code_hash": null, "entity": [["tile_n", "ot", 8], ["tile_c", "ot", 4], ["num_thread_n", "ot", 4], ["num_thread_c", "ot", 8], ["vthread_n", "ot", 1], ["vthread_c", "ot", 2], ["step", "ot", 32]]}, "result": [[0.02315818956], 0, 5.833175897598267, 1639554735.6678774], "version": 0.2, "tvm_version": "0.8.dev0"}
{"input": ["opencl -keys=opencl,gpu -max_num_threads=256", "conv2d_nhwc.cuda", [["TENSOR", [1, 257, 257, 32], "float16"], ["TENSOR", [1, 1, 32, 16], "float16"], [1, 1], [0, 0, 0, 0], [1, 1], "float16"], {}], "config": {"index": 704, "code_hash": null, "entity": [["tile_n", "ot", 8], ["tile_c", "ot", 2], ["num_thread_n", "ot", 4], ["num_thread_c", "ot", 16], ["vthread_n", "ot", 1], ["vthread_c", "ot", 1], ["step", "ot", 32]]}, "result": [[0.01208402186], 0, 9.632959365844727, 1639554739.4757965], "version": 0.2, "tvm_version": "0.8.dev0"}
{"input": ["opencl -keys=opencl,gpu -max_num_threads=256", "conv2d_nhwc.cuda", [["TENSOR", [1, 257, 257, 32], "float16"], ["TENSOR", [1, 1, 32, 16], "float16"], [1, 1], [0, 0, 0, 0], [1, 1], "float16"], {}], "config": {"index": 1028, "code_hash": null, "entity": [["tile_n", "ot", 8], ["tile_c", "ot", 2], ["num_thread_n", "ot", 4], ["num_thread_c", "ot", 16], ["vthread_n", "ot", 1], ["vthread_c", "ot", 1], ["step", "ot", 64]]}, "result": [[0.01211188124], 0, 4.064035177230835, 1639554743.785055], "version": 0.2, "tvm_version": "0.8.dev0"}
{"input": ["opencl -keys=opencl,gpu -max_num_threads=256", "conv2d_nhwc.cuda", [["TENSOR", [1, 257, 257, 32], "float16"], ["TENSOR", [1, 1, 32, 16], "float16"], [1, 1], [0, 0, 0, 0], [1, 1], "float16"], {}], "config": {"index": 194, "code_hash": null, "entity": [["tile_n", "ot", 8], ["tile_c", "ot", 4], ["num_thread_n", "ot", 4], ["num_thread_c", "ot", 8], ["vthread_n", "ot", 1], ["vthread_c", "ot", 2], ["step", "ot", 16]]}, "result": [[0.017454751020000003], 0, 8.826659440994263, 1639554748.556223], "version": 0.2, "tvm_version": "0.8.dev0"}
{"input": ["opencl -keys=opencl,gpu -max_num_threads=256", "conv2d_nhwc.cuda", [["TENSOR", [1, 257, 257, 32], "float16"], ["TENSOR", [1, 1, 32, 16], "float16"], [1, 1], [0, 0, 0, 0], [1, 1], "float16"], {}], "config": {"index": 1188, "code_hash": null, "entity": [["tile_n", "ot", 2], ["tile_c", "ot", 2], ["num_thread_n", "ot", 4], ["num_thread_c", "ot", 16], ["vthread_n", "ot", 1], ["vthread_c", "ot", 2], ["step", "ot", 64]]}, "result": [[0.014843860400000002], 0, 4.161022186279297, 1639554752.9563742], "version": 0.2, "tvm_version": "0.8.dev0"}
{"input": ["opencl -keys=opencl,gpu -max_num_threads=256", "conv2d_nhwc.cuda", [["TENSOR", [1, 257, 257, 32], "float16"], ["TENSOR", [1, 1, 32, 16], "float16"], [1, 1], [0, 0, 0, 0], [1, 1], "float16"], {}], "config": {"index": 1029, "code_hash": null, "entity": [["tile_n", "ot", 2], ["tile_c", "ot", 4], ["num_thread_n", "ot", 4], ["num_thread_c", "ot", 16], ["vthread_n", "ot", 1], ["vthread_c", "ot", 1], ["step", "ot", 64]]}, "result": [[0.023386793739999998], 0, 9.73693299293518, 1639554758.5292768], "version": 0.2, "tvm_version": "0.8.dev0"}
{"input": ["opencl -keys=opencl,gpu -max_num_threads=256", "conv2d_nhwc.cuda", [["TENSOR", [1, 257, 257, 32], "float16"], ["TENSOR", [1, 1, 32, 16], "float16"], [1, 1], [0, 0, 0, 0], [1, 1], "float16"], {}], "config": {"index": 459, "code_hash": null, "entity": [["tile_n", "ot", 2], ["tile_c", "ot", 2], ["num_thread_n", "ot", 4], ["num_thread_c", "ot", 16], ["vthread_n", "ot", 2], ["vthread_c", "ot", 1], ["step", "ot", 3]]}, "result": [[0.02016159166], 0, 5.1141297817230225, 1639554763.8654797], "version": 0.2, "tvm_version": "0.8.dev0"}
{"input": ["opencl -keys=opencl,gpu -max_num_threads=256", "conv2d_nhwc.cuda", [["TENSOR", [1, 257, 257, 32], "float16"], ["TENSOR", [1, 1, 32, 16], "float16"], [1, 1], [0, 0, 0, 0], [1, 1], "float16"], {}], "config": {"index": 866, "code_hash": null, "entity": [["tile_n", "ot", 8], ["tile_c", "ot", 2], ["num_thread_n", "ot", 4], ["num_thread_c", "ot", 16], ["vthread_n", "ot", 1], ["vthread_c", "ot", 2], ["step", "ot", 32]]}, "result": [[0.015894185399999997], 0, 9.471395492553711, 1639554768.217976], "version": 0.2, "tvm_version": "0.8.dev0"}
{"input": ["opencl -keys=opencl,gpu -max_num_threads=256", "conv2d_nhwc.cuda", [["TENSOR", [1, 257, 257, 32], "float16"], ["TENSOR", [1, 1, 32, 16], "float16"], [1, 1], [0, 0, 0, 0], [1, 1], "float16"], {}], "config": {"index": 274, "code_hash": null, "entity": [["tile_n", "ot", 4], ["tile_c", "ot", 4], ["num_thread_n", "ot", 4], ["num_thread_c", "ot", 8], ["vthread_n", "ot", 2], ["vthread_c", "ot", 2], ["step", "ot", 16]]}, "result": [[0.017500273939999998], 0, 4.618230104446411, 1639554773.0697036], "version": 0.2, "tvm_version": "0.8.dev0"}
{"input": ["opencl -keys=opencl,gpu -max_num_threads=256", "conv2d_nhwc.cuda", [["TENSOR", [1, 257, 257, 32], "float16"], ["TENSOR", [1, 1, 32, 16], "float16"], [1, 1], [0, 0, 0, 0], [1, 1], "float16"], {}], "config": {"index": 380, "code_hash": null, "entity": [["tile_n", "ot", 8], ["tile_c", "ot", 2], ["num_thread_n", "ot", 4], ["num_thread_c", "ot", 16], ["vthread_n", "ot", 1], ["vthread_c", "ot", 1], ["step", "ot", 3]]}, "result": [[0.020183383319999998], 0, 9.613614797592163, 1639554778.075589], "version": 0.2, "tvm_version": "0.8.dev0"}
{"input": ["opencl -keys=opencl,gpu -max_num_threads=256", "conv2d_nhwc.cuda", [["TENSOR", [1, 257, 257, 32], "float16"], ["TENSOR", [1, 1, 32, 16], "float16"], [1, 1], [0, 0, 0, 0], [1, 1], "float16"], {}], "config": {"index": 1166, "code_hash": null, "entity": [["tile_n", "ot", 8], ["tile_c", "ot", 4], ["num_thread_n", "ot", 4], ["num_thread_c", "ot", 8], ["vthread_n", "ot", 1], ["vthread_c", "ot", 2], ["step", "ot", 64]]}, "result": [[0.02303914686], 0, 5.802684307098389, 1639554784.1083763], "version": 0.2, "tvm_version": "0.8.dev0"}
{"input": ["opencl -keys=opencl,gpu -max_num_threads=256", "conv2d_nhwc.cuda", [["TENSOR", [1, 257, 257, 32], "float16"], ["TENSOR", [1, 1, 32, 16], "float16"], [1, 1], [0, 0, 0, 0], [1, 1], "float16"], {}], "config": {"index": 921, "code_hash": null, "entity": [["tile_n", "ot", 2], ["tile_c", "ot", 4], ["num_thread_n", "ot", 4], ["num_thread_c", "ot", 8], ["vthread_n", "ot", 2], ["vthread_c", "ot", 2], ["step", "ot", 32]]}, "result": [[0.02314279166], 0, 11.088784217834473, 1639554789.401935], "version": 0.2, "tvm_version": "0.8.dev0"}
{"input": ["opencl -keys=opencl,gpu -max_num_threads=256", "conv2d_nhwc.cuda", [["TENSOR", [1, 257, 257, 32], "float16"], ["TENSOR", [1, 1, 32, 16], "float16"], [1, 1], [0, 0, 0, 0], [1, 1], "float16"], {}], "config": {"index": 217, "code_hash": null, "entity": [["tile_n", "ot", 4], ["tile_c", "ot", 2], ["num_thread_n", "ot", 4], ["num_thread_c", "ot", 16], ["vthread_n", "ot", 1], ["vthread_c", "ot", 2], ["step", "ot", 16]]}, "result": [[0.01250464686], 0, 3.8910608291625977, 1639554793.5486786], "version": 0.2, "tvm_version": "0.8.dev0"}
{"input": ["opencl -keys=opencl,gpu -max_num_threads=256", "conv2d_nhwc.cuda", [["TENSOR", [1, 257, 257, 32], "float16"], ["TENSOR", [1, 1, 32, 16], "float16"], [1, 1], [0, 0, 0, 0], [1, 1], "float16"], {}], "config": {"index": 58, "code_hash": null, "entity": [["tile_n", "ot", 4], ["tile_c", "ot", 4], ["num_thread_n", "ot", 4], ["num_thread_c", "ot", 16], ["vthread_n", "ot", 1], ["vthread_c", "ot", 1], ["step", "ot", 16]]}, "result": [[0.018641120820000003], 0, 8.61144232749939, 1639554798.2779799], "version": 0.2, "tvm_version": "0.8.dev0"}
{"input": ["opencl -keys=opencl,gpu -max_num_threads=256", "conv2d_nhwc.cuda", [["TENSOR", [1, 257, 257, 32], "float16"], ["TENSOR", [1, 1, 32, 16], "float16"], [1, 1], [0, 0, 0, 0], [1, 1], "float16"], {}], "config": {"index": 57, "code_hash": null, "entity": [["tile_n", "ot", 2], ["tile_c", "ot", 4], ["num_thread_n", "ot", 4], ["num_thread_c", "ot", 16], ["vthread_n", "ot", 1], ["vthread_c", "ot", 1], ["step", "ot", 16]]}, "result": [[0.0186307031], 0, 4.875756740570068, 1639554803.3317533], "version": 0.2, "tvm_version": "0.8.dev0"}
{"input": ["opencl -keys=opencl,gpu -max_num_threads=256", "conv2d_nhwc.cuda", [["TENSOR", [1, 257, 257, 32], "float16"], ["TENSOR", [1, 1, 32, 16], "float16"], [1, 1], [0, 0, 0, 0], [1, 1], "float16"], {}], "config": {"index": 298, "code_hash": null, "entity": [["tile_n", "ot", 4], ["tile_c", "ot", 2], ["num_thread_n", "ot", 4], ["num_thread_c", "ot", 16], ["vthread_n", "ot", 2], ["vthread_c", "ot", 2], ["step", "ot", 16]]}, "result": [[0.0125671604], 0, 8.797544002532959, 1639554807.2717552], "version": 0.2, "tvm_version": "0.8.dev0"}
{"input": ["opencl -keys=opencl,gpu -max_num_threads=256", "conv2d_nhwc.cuda", [["TENSOR", [1, 257, 257, 32], "float16"], ["TENSOR", [1, 1, 32, 16], "float16"], [1, 1], [0, 0, 0, 0], [1, 1], "float16"], {}], "config": {"index": 946, "code_hash": null, "entity": [["tile_n", "ot", 4], ["tile_c", "ot", 2], ["num_thread_n", "ot", 4], ["num_thread_c", "ot", 16], ["vthread_n", "ot", 2], ["vthread_c", "ot", 2], ["step", "ot", 32]]}, "result": [[0.01589734688], 0, 4.467775344848633, 1639554811.9743729], "version": 0.2, "tvm_version": "0.8.dev0"}
{"input": ["opencl -keys=opencl,gpu -max_num_threads=256", "conv2d_nhwc.cuda", [["TENSOR", [1, 257, 257, 32], "float16"], ["TENSOR", [1, 1, 32, 16], "float16"], [1, 1], [0, 0, 0, 0], [1, 1], "float16"], {}], "config": {"index": 541, "code_hash": null, "entity": [["tile_n", "ot", 4], ["tile_c", "ot", 2], ["num_thread_n", "ot", 4], ["num_thread_c", "ot", 16], ["vthread_n", "ot", 1], ["vthread_c", "ot", 2], ["step", "ot", 3]]}, "result": [[0.02016261248], 0, 9.62380075454712, 1639554817.138274], "version": 0.2, "tvm_version": "0.8.dev0"}
{"input": ["opencl -keys=opencl,gpu -max_num_threads=256", "conv2d_nhwc.cuda", [["TENSOR", [1, 257, 257, 32], "float16"], ["TENSOR", [1, 1, 32, 16], "float16"], [1, 1], [0, 0, 0, 0], [1, 1], "float16"], {}], "config": {"index": 1190, "code_hash": null, "entity": [["tile_n", "ot", 8], ["tile_c", "ot", 2], ["num_thread_n", "ot", 4], ["num_thread_c", "ot", 16], ["vthread_n", "ot", 1], ["vthread_c", "ot", 2], ["step", "ot", 64]]}, "result": [[0.014847542699999999], 0, 4.179372549057007, 1639554821.5478213], "version": 0.2, "tvm_version": "0.8.dev0"}
{"input": ["opencl -keys=opencl,gpu -max_num_threads=256", "conv2d_nhwc.cuda", [["TENSOR", [1, 257, 257, 32], "float16"], ["TENSOR", [1, 1, 32, 16], "float16"], [1, 1], [0, 0, 0, 0], [1, 1], "float16"], {}], "config": {"index": 273, "code_hash": null, "entity": [["tile_n", "ot", 2], ["tile_c", "ot", 4], ["num_thread_n", "ot", 4], ["num_thread_c", "ot", 8], ["vthread_n", "ot", 2], ["vthread_c", "ot", 2], ["step", "ot", 16]]}, "result": [[0.01750435416], 0, 8.91634464263916, 1639554826.2921653], "version": 0.2, "tvm_version": "0.8.dev0"}
{"input": ["opencl -keys=opencl,gpu -max_num_threads=256", "conv2d_nhwc.cuda", [["TENSOR", [1, 257, 257, 32], "float16"], ["TENSOR", [1, 1, 32, 16], "float16"], [1, 1], [0, 0, 0, 0], [1, 1], "float16"], {}], "config": {"index": 788, "code_hash": null, "entity": [["tile_n", "ot", 8], ["tile_c", "ot", 4], ["num_thread_n", "ot", 4], ["num_thread_c", "ot", 16], ["vthread_n", "ot", 2], ["vthread_c", "ot", 1], ["step", "ot", 32]]}, "result": [[0.02137722186], 0, 5.343819618225098, 1639554831.881679], "version": 0.2, "tvm_version": "0.8.dev0"}
{"input": ["opencl -keys=opencl,gpu -max_num_threads=256", "conv2d_nhwc.cuda", [["TENSOR", [1, 257, 257, 32], "float16"], ["TENSOR", [1, 1, 32, 16], "float16"], [1, 1], [0, 0, 0, 0], [1, 1], "float16"], {}], "config": {"index": 707, "code_hash": null, "entity": [["tile_n", "ot", 8], ["tile_c", "ot", 4], ["num_thread_n", "ot", 4], ["num_thread_c", "ot", 16], ["vthread_n", "ot", 1], ["vthread_c", "ot", 1], ["step", "ot", 32]]}, "result": [[0.02133472394], 0, 10.90966272354126, 1639554837.4556053], "version": 0.2, "tvm_version": "0.8.dev0"}
{"input": ["opencl -keys=opencl,gpu -max_num_threads=256", "conv2d_nhwc.cuda", [["TENSOR", [1, 257, 257, 32], "float16"], ["TENSOR", [1, 1, 32, 16], "float16"], [1, 1], [0, 0, 0, 0], [1, 1], "float16"], {}], "config": {"index": 1109, "code_hash": null, "entity": [["tile_n", "ot", 8], ["tile_c", "ot", 2], ["num_thread_n", "ot", 4], ["num_thread_c", "ot", 16], ["vthread_n", "ot", 2], ["vthread_c", "ot", 1], ["step", "ot", 64]]}, "result": [[0.01210301042], 0, 4.341086387634277, 1639554842.002585], "version": 0.2, "tvm_version": "0.8.dev0"}
{"input": ["opencl -keys=opencl,gpu -max_num_threads=256", "conv2d_nhwc.cuda", [["TENSOR", [1, 257, 257, 32], "float16"], ["TENSOR", [1, 1, 32, 16], "float16"], [1, 1], [0, 0, 0, 0], [1, 1], "float16"], {}], "config": {"index": 216, "code_hash": null, "entity": [["tile_n", "ot", 2], ["tile_c", "ot", 2], ["num_thread_n", "ot", 4], ["num_thread_c", "ot", 16], ["vthread_n", "ot", 1], ["vthread_c", "ot", 2], ["step", "ot", 16]]}, "result": [[0.01250660208], 0, 8.177817821502686, 1639554845.8853061], "version": 0.2, "tvm_version": "0.8.dev0"}
{"input": ["opencl -keys=opencl,gpu -max_num_threads=256", "conv2d_nhwc.cuda", [["TENSOR", [1, 257, 257, 32], "float16"], ["TENSOR", [1, 1, 32, 16], "float16"], [1, 1], [0, 0, 0, 0], [1, 1], "float16"], {}], "config": {"index": 135, "code_hash": null, "entity": [["tile_n", "ot", 2], ["tile_c", "ot", 2], ["num_thread_n", "ot", 4], ["num_thread_c", "ot", 16], ["vthread_n", "ot", 2], ["vthread_c", "ot", 1], ["step", "ot", 16]]}, "result": [[0.01207144062], 0, 3.745985507965088, 1639554849.824228], "version": 0.2, "tvm_version": "0.8.dev0"}
{"input": ["opencl -keys=opencl,gpu -max_num_threads=256", "conv2d_nhwc.cuda", [["TENSOR", [1, 257, 257, 32], "float16"], ["TENSOR", [1, 1, 32, 16], "float16"], [1, 1], [0, 0, 0, 0], [1, 1], "float16"], {}], "config": {"index": 136, "code_hash": null, "entity": [["tile_n", "ot", 4], ["tile_c", "ot", 2], ["num_thread_n", "ot", 4], ["num_thread_c", "ot", 16], ["vthread_n", "ot", 2], ["vthread_c", "ot", 1], ["step", "ot", 16]]}, "result": [[0.01208467602], 0, 7.686506986618042, 1639554853.7750952], "version": 0.2, "tvm_version": "0.8.dev0"}
{"input": ["opencl -keys=opencl,gpu -max_num_threads=256", "conv2d_nhwc.cuda", [["TENSOR", [1, 257, 257, 32], "float16"], ["TENSOR", [1, 1, 32, 16], "float16"], [1, 1], [0, 0, 0, 0], [1, 1], "float16"], {}], "config": {"index": 760, "code_hash": null, "entity": [["tile_n", "ot", 4], ["tile_c", "ot", 4], ["num_thread_n", "ot", 4], ["num_thread_c", "ot", 8], ["vthread_n", "ot", 2], ["vthread_c", "ot", 1], ["step", "ot", 32]]}, "result": [[0.0231436573], 0, 5.424814462661743, 1639554859.4215744], "version": 0.2, "tvm_version": "0.8.dev0"}
{"input": ["opencl -keys=opencl,gpu -max_num_threads=256", "conv2d_nhwc.cuda", [["TENSOR", [1, 257, 257, 32], "float16"], ["TENSOR", [1, 1, 32, 16], "float16"], [1, 1], [0, 0, 0, 0], [1, 1], "float16"], {}], "config": {"index": 759, "code_hash": null, "entity": [["tile_n", "ot", 2], ["tile_c", "ot", 4], ["num_thread_n", "ot", 4], ["num_thread_c", "ot", 8], ["vthread_n", "ot", 2], ["vthread_c", "ot", 1], ["step", "ot", 32]]}, "result": [[0.02319552394], 0, 11.384596586227417, 1639554865.3888843], "version": 0.2, "tvm_version": "0.8.dev0"}
{"input": ["opencl -keys=opencl,gpu -max_num_threads=256", "conv2d_nhwc.cuda", [["TENSOR", [1, 257, 257, 32], "float16"], ["TENSOR", [1, 1, 32, 16], "float16"], [1, 1], [0, 0, 0, 0], [1, 1], "float16"], {}], "config": {"index": 923, "code_hash": null, "entity": [["tile_n", "ot", 8], ["tile_c", "ot", 4], ["num_thread_n", "ot", 4], ["num_thread_c", "ot", 8], ["vthread_n", "ot", 2], ["vthread_c", "ot", 2], ["step", "ot", 32]]}, "result": [[0.02315892186], 0, 6.154045820236206, 1639554871.8743951], "version": 0.2, "tvm_version": "0.8.dev0"}
{"input": ["opencl -keys=opencl,gpu -max_num_threads=256", "conv2d_nhwc.cuda", [["TENSOR", [1, 257, 257, 32], "float16"], ["TENSOR", [1, 1, 32, 16], "float16"], [1, 1], [0, 0, 0, 0], [1, 1], "float16"], {}], "config": {"index": 218, "code_hash": null, "entity": [["tile_n", "ot", 8], ["tile_c", "ot", 2], ["num_thread_n", "ot", 4], ["num_thread_c", "ot", 16], ["vthread_n", "ot", 1], ["vthread_c", "ot", 2], ["step", "ot", 16]]}, "result": [[0.012503290620000001], 0, 10.423864126205444, 1639554876.1762054], "version": 0.2, "tvm_version": "0.8.dev0"}
{"input": ["opencl -keys=opencl,gpu -max_num_threads=256", "conv2d_nhwc.cuda", [["TENSOR", [1, 257, 257, 32], "float16"], ["TENSOR", [1, 1, 32, 16], "float16"], [1, 1], [0, 0, 0, 0], [1, 1], "float16"], {}], "config": {"index": 297, "code_hash": null, "entity": [["tile_n", "ot", 2], ["tile_c", "ot", 2], ["num_thread_n", "ot", 4], ["num_thread_c", "ot", 16], ["vthread_n", "ot", 2], ["vthread_c", "ot", 2], ["step", "ot", 16]]}, "result": [[0.01250936666], 0, 4.789283514022827, 1639554881.206398], "version": 0.2, "tvm_version": "0.8.dev0"}
{"input": ["opencl -keys=opencl,gpu -max_num_threads=256", "conv2d_nhwc.cuda", [["TENSOR", [1, 257, 257, 32], "float16"], ["TENSOR", [1, 1, 32, 16], "float16"], [1, 1], [0, 0, 0, 0], [1, 1], "float16"], {}], "config": {"index": 945, "code_hash": null, "entity": [["tile_n", "ot", 2], ["tile_c", "ot", 2], ["num_thread_n", "ot", 4], ["num_thread_c", "ot", 16], ["vthread_n", "ot", 2], ["vthread_c", "ot", 2], ["step", "ot", 32]]}, "result": [[0.01588412186], 0, 9.744932651519775, 1639554886.1628752], "version": 0.2, "tvm_version": "0.8.dev0"}
{"input": ["opencl -keys=opencl,gpu -max_num_threads=256", "conv2d_nhwc.cuda", [["TENSOR", [1, 257, 257, 32], "float16"], ["TENSOR", [1, 1, 32, 16], "float16"], [1, 1], [0, 0, 0, 0], [1, 1], "float16"], {}], "config": {"index": 59, "code_hash": null, "entity": [["tile_n", "ot", 8], ["tile_c", "ot", 4], ["num_thread_n", "ot", 4], ["num_thread_c", "ot", 16], ["vthread_n", "ot", 1], ["vthread_c", "ot", 1], ["step", "ot", 16]]}, "result": [[0.01858173852], 0, 5.051878213882446, 1639554891.4352612], "version": 0.2, "tvm_version": "0.8.dev0"}
{"input": ["opencl -keys=opencl,gpu -max_num_threads=256", "conv2d_nhwc.cuda", [["TENSOR", [1, 257, 257, 32], "float16"], ["TENSOR", [1, 1, 32, 16], "float16"], [1, 1], [0, 0, 0, 0], [1, 1], "float16"], {}], "config": {"index": 540, "code_hash": null, "entity": [["tile_n", "ot", 2], ["tile_c", "ot", 2], ["num_thread_n", "ot", 4], ["num_thread_c", "ot", 16], ["vthread_n", "ot", 1], ["vthread_c", "ot", 2], ["step", "ot", 3]]}, "result": [[0.02011205936], 0, 10.236751794815063, 1639554896.6260092], "version": 0.2, "tvm_version": "0.8.dev0"}
{"input": ["opencl -keys=opencl,gpu -max_num_threads=256", "conv2d_nhwc.cuda", [["TENSOR", [1, 257, 257, 32], "float16"], ["TENSOR", [1, 1, 32, 16], "float16"], [1, 1], [0, 0, 0, 0], [1, 1], "float16"], {}], "config": {"index": 54, "code_hash": null, "entity": [["tile_n", "ot", 2], ["tile_c", "ot", 2], ["num_thread_n", "ot", 4], ["num_thread_c", "ot", 16], ["vthread_n", "ot", 1], ["vthread_c", "ot", 1], ["step", "ot", 16]]}, "result": [[0.012064673960000001], 0, 4.271494626998901, 1639554901.1393018], "version": 0.2, "tvm_version": "0.8.dev0"}
{"input": ["opencl -keys=opencl,gpu -max_num_threads=256", "conv2d_nhwc.cuda", [["TENSOR", [1, 257, 257, 32], "float16"], ["TENSOR", [1, 1, 32, 16], "float16"], [1, 1], [0, 0, 0, 0], [1, 1], "float16"], {}], "config": {"index": 55, "code_hash": null, "entity": [["tile_n", "ot", 4], ["tile_c", "ot", 2], ["num_thread_n", "ot", 4], ["num_thread_c", "ot", 16], ["vthread_n", "ot", 1], ["vthread_c", "ot", 1], ["step", "ot", 16]]}, "result": [[0.0120719875], 0, 8.445413589477539, 1639554905.3231006], "version": 0.2, "tvm_version": "0.8.dev0"}
{"input": ["opencl -keys=opencl,gpu -max_num_threads=256", "conv2d_nhwc.cuda", [["TENSOR", [1, 257, 257, 32], "float16"], ["TENSOR", [1, 1, 32, 16], "float16"], [1, 1], [0, 0, 0, 0], [1, 1], "float16"], {}], "config": {"index": 299, "code_hash": null, "entity": [["tile_n", "ot", 8], ["tile_c", "ot", 2], ["num_thread_n", "ot", 4], ["num_thread_c", "ot", 16], ["vthread_n", "ot", 2], ["vthread_c", "ot", 2], ["step", "ot", 16]]}, "result": [[0.01251696874], 0, 4.164198875427246, 1639554909.680037], "version": 0.2, "tvm_version": "0.8.dev0"}
{"input": ["opencl -keys=opencl,gpu -max_num_threads=256", "conv2d_nhwc.cuda", [["TENSOR", [1, 257, 257, 32], "float16"], ["TENSOR", [1, 1, 32, 16], "float16"], [1, 1], [0, 0, 0, 0], [1, 1], "float16"], {}], "config": {"index": 678, "code_hash": null, "entity": [["tile_n", "ot", 2], ["tile_c", "ot", 4], ["num_thread_n", "ot", 4], ["num_thread_c", "ot", 8], ["vthread_n", "ot", 1], ["vthread_c", "ot", 1], ["step", "ot", 32]]}, "result": [[0.02315945936], 0, 9.935388088226318, 1639554915.4594095], "version": 0.2, "tvm_version": "0.8.dev0"}
{"input": ["opencl -keys=opencl,gpu -max_num_threads=256", "conv2d_nhwc.cuda", [["TENSOR", [1, 257, 257, 32], "float16"], ["TENSOR", [1, 1, 32, 16], "float16"], [1, 1], [0, 0, 0, 0], [1, 1], "float16"], {}], "config": {"index": 679, "code_hash": null, "entity": [["tile_n", "ot", 4], ["tile_c", "ot", 4], ["num_thread_n", "ot", 4], ["num_thread_c", "ot", 8], ["vthread_n", "ot", 1], ["vthread_c", "ot", 1], ["step", "ot", 32]]}, "result": [[0.023133983320000003], 0, 6.037601947784424, 1639554921.7029772], "version": 0.2, "tvm_version": "0.8.dev0"}
{"input": ["opencl -keys=opencl,gpu -max_num_threads=256", "conv2d_nhwc.cuda", [["TENSOR", [1, 257, 257, 32], "float16"], ["TENSOR", [1, 1, 32, 16], "float16"], [1, 1], [0, 0, 0, 0], [1, 1], "float16"], {}], "config": {"index": 1191, "code_hash": null, "entity": [["tile_n", "ot", 2], ["tile_c", "ot", 4], ["num_thread_n", "ot", 4], ["num_thread_c", "ot", 16], ["vthread_n", "ot", 1], ["vthread_c", "ot", 2], ["step", "ot", 64]]}, "result": [[0.03784389166], 0, 30.473944187164307, 1639554971.9395049], "version": 0.2, "tvm_version": "0.8.dev0"}
