sd888_log/ww04/deelvin164_detector.texture.float16.autotvm.log
{"input": ["opencl -keys=adreno,opencl,gpu -device=adreno -max_num_threads=256", "conv2d_nchwc.image2d", [["TENSOR", [1, 88, 5, 5], "float16"], ["TENSOR", [36, 88, 3, 3], "float16"], [1, 1], [1, 1, 1, 1], [1, 1], "float16"], {}], "config": {"index": 3225, "code_hash": null, "entity": [["tile_fc", "sp", [-1, 1, 3]], ["tile_y", "sp", [-1, 1, 8]], ["tile_x", "sp", [-1, 2, 2]], ["tile_rcc", "sp", [-1, 1]], ["tile_ry", "sp", [-1, 1]], ["tile_rx", "sp", [-1, 1]], ["auto_unroll_max_step", "ot", 1500], ["unroll_explicit", "ot", 0]]}, "result": [[7.967603999999999e-05], 0, 1.8840582370758057, 1643011356.1456094], "version": 0.2, "tvm_version": "0.8.dev0"}
{"input": ["opencl -keys=adreno,opencl,gpu -device=adreno -max_num_threads=256", "conv2d_nchwc.image2d", [["TENSOR", [1, 88, 10, 10], "float16"], ["TENSOR", [36, 88, 3, 3], "float16"], [1, 1], [1, 1, 1, 1], [1, 1], "float16"], {}], "config": {"index": 2865, "code_hash": null, "entity": [["tile_fc", "sp", [-1, 1, 9]], ["tile_y", "sp", [-1, 1, 6]], ["tile_x", "sp", [-1, 1, 1]], ["tile_rcc", "sp", [-1, 22]], ["tile_ry", "sp", [-1, 3]], ["tile_rx", "sp", [-1, 1]], ["auto_unroll_max_step", "ot", 0], ["unroll_explicit", "ot", 0]]}, "result": [[8.445415999999999e-05], 0, 0.6584799289703369, 1643011585.0364168], "version": 0.2, "tvm_version": "0.8.dev0"}
{"input": ["opencl -keys=adreno,opencl,gpu -device=adreno -max_num_threads=256", "conv2d_nchwc.image2d", [["TENSOR", [1, 88, 20, 20], "float16"], ["TENSOR", [36, 88, 3, 3], "float16"], [1, 1], [1, 1, 1, 1], [1, 1], "float16"], {}], "config": {"index": 8639, "code_hash": null, "entity": [["tile_fc", "sp", [-1, 1, 3]], ["tile_y", "sp", [-1, 2, 10]], ["tile_x", "sp", [-1, 1, 5]], ["tile_rcc", "sp", [-1, 11]], ["tile_ry", "sp", [-1, 1]], ["tile_rx", "sp", [-1, 3]], ["auto_unroll_max_step", "ot", 512], ["unroll_explicit", "ot", 0]]}, "result": [[0.00012074688], 0, 0.5377423763275146, 1643012535.4743626], "version": 0.2, "tvm_version": "0.8.dev0"}
{"input": ["opencl -keys=adreno,opencl,gpu -device=adreno -max_num_threads=256", "conv2d_nchwc.image2d", [["TENSOR", [1, 88, 40, 40], "float16"], ["TENSOR", [36, 88, 3, 3], "float16"], [1, 1], [1, 1, 1, 1], [1, 1], "float16"], {}], "config": {"index": 41412, "code_hash": null, "entity": [["tile_fc", "sp", [-1, 1, 3]], ["tile_y", "sp", [-1, 1, 10]], ["tile_x", "sp", [-1, 5, 4]], ["tile_rcc", "sp", [-1, 1]], ["tile_ry", "sp", [-1, 3]], ["tile_rx", "sp", [-1, 3]], ["auto_unroll_max_step", "ot", 1500], ["unroll_explicit", "ot", 0]]}, "result": [[0.00029072082000000004], 0, 1.4461677074432373, 1643013081.776583], "version": 0.2, "tvm_version": "0.8.dev0"}
{"input": ["opencl -keys=adreno,opencl,gpu -device=adreno -max_num_threads=256", "conv2d_nchwc.image2d", [["TENSOR", [1, 88, 5, 5], "float16"], ["TENSOR", [88, 88, 3, 3], "float16"], [1, 1], [1, 1, 1, 1], [1, 1], "float16"], {}], "config": {"index": 4506, "code_hash": null, "entity": [["tile_fc", "sp", [-1, 1, 2]], ["tile_y", "sp", [-1, 1, 8]], ["tile_x", "sp", [-1, 1, 4]], ["tile_rcc", "sp", [-1, 1]], ["tile_ry", "sp", [-1, 3]], ["tile_rx", "sp", [-1, 1]], ["auto_unroll_max_step", "ot", 512], ["unroll_explicit", "ot", 0]]}, "result": [[8.440624e-05], 0, 3.4304726123809814, 1643014080.8043046], "version": 0.2, "tvm_version": "0.8.dev0"}
{"input": ["opencl -keys=adreno,opencl,gpu -device=adreno -max_num_threads=256", "conv2d_nchwc.image2d", [["TENSOR", [1, 88, 5, 5], "float16"], ["TENSOR", [27, 88, 3, 3], "float16"], [1, 1], [1, 1, 1, 1], [1, 1], "float16"], {}], "config": {"index": 1816, "code_hash": null, "entity": [["tile_fc", "sp", [-1, 1, 7]], ["tile_y", "sp", [-1, 1, 4]], ["tile_x", "sp", [-1, 1, 4]], ["tile_rcc", "sp", [-1, 1]], ["tile_ry", "sp", [-1, 1]], ["tile_rx", "sp", [-1, 3]], ["auto_unroll_max_step", "ot", 1500], ["unroll_explicit", "ot", 0]]}, "result": [[7.24198e-05], 0, 2.5274810791015625, 1643014533.0560243], "version": 0.2, "tvm_version": "0.8.dev0"}
{"input": ["opencl -keys=adreno,opencl,gpu -device=adreno -max_num_threads=256", "conv2d_nchwc.image2d", [["TENSOR", [1, 88, 10, 10], "float16"], ["TENSOR", [88, 88, 3, 3], "float16"], [1, 1], [1, 1, 1, 1], [1, 1], "float16"], {}], "config": {"index": 20357, "code_hash": null, "entity": [["tile_fc", "sp", [-1, 1, 11]], ["tile_y", "sp", [-1, 1, 12]], ["tile_x", "sp", [-1, 2, 1]], ["tile_rcc", "sp", [-1, 22]], ["tile_ry", "sp", [-1, 1]], ["tile_rx", "sp", [-1, 3]], ["auto_unroll_max_step", "ot", 512], ["unroll_explicit", "ot", 0]]}, "result": [[0.00011397084], 0, 0.5497980117797852, 1643015025.4595466], "version": 0.2, "tvm_version": "0.8.dev0"}
{"input": ["opencl -keys=adreno,opencl,gpu -device=adreno -max_num_threads=256", "conv2d_nchwc.image2d", [["TENSOR", [1, 88, 10, 10], "float16"], ["TENSOR", [27, 88, 3, 3], "float16"], [1, 1], [1, 1, 1, 1], [1, 1], "float16"], {}], "config": {"index": 952, "code_hash": null, "entity": [["tile_fc", "sp", [-1, 1, 7]], ["tile_y", "sp", [-1, 1, 2]], ["tile_x", "sp", [-1, 1, 12]], ["tile_rcc", "sp", [-1, 1]], ["tile_ry", "sp", [-1, 3]], ["tile_rx", "sp", [-1, 1]], ["auto_unroll_max_step", "ot", 0], ["unroll_explicit", "ot", 0]]}, "result": [[8.178126000000001e-05], 0, 1.009389877319336, 1643015499.0327926], "version": 0.2, "tvm_version": "0.8.dev0"}
{"input": ["opencl -keys=adreno,opencl,gpu -device=adreno -max_num_threads=256", "conv2d_nchwc.image2d", [["TENSOR", [1, 88, 20, 20], "float16"], ["TENSOR", [88, 88, 3, 3], "float16"], [1, 1], [1, 1, 1, 1], [1, 1], "float16"], {}], "config": {"index": 2607, "code_hash": null, "entity": [["tile_fc", "sp", [-1, 1, 22]], ["tile_y", "sp", [-1, 2, 1]], ["tile_x", "sp", [-1, 2, 10]], ["tile_rcc", "sp", [-1, 1]], ["tile_ry", "sp", [-1, 3]], ["tile_rx", "sp", [-1, 1]], ["auto_unroll_max_step", "ot", 0], ["unroll_explicit", "ot", 0]]}, "result": [[0.00022637187999999999], 0, 1.3199574947357178, 1643016148.4909604], "version": 0.2, "tvm_version": "0.8.dev0"}
{"input": ["opencl -keys=adreno,opencl,gpu -device=adreno -max_num_threads=256", "conv2d_nchwc.image2d", [["TENSOR", [1, 88, 20, 20], "float16"], ["TENSOR", [27, 88, 3, 3], "float16"], [1, 1], [1, 1, 1, 1], [1, 1], "float16"], {}], "config": {"index": 2011, "code_hash": null, "entity": [["tile_fc", "sp", [-1, 1, 7]], ["tile_y", "sp", [-1, 2, 2]], ["tile_x", "sp", [-1, 1, 4]], ["tile_rcc", "sp", [-1, 22]], ["tile_ry", "sp", [-1, 1]], ["tile_rx", "sp", [-1, 3]], ["auto_unroll_max_step", "ot", 0], ["unroll_explicit", "ot", 0]]}, "result": [[0.00011869583999999999], 0, 0.7131013870239258, 1643016502.0737393], "version": 0.2, "tvm_version": "0.8.dev0"}
{"input": ["opencl -keys=adreno,opencl,gpu -device=adreno -max_num_threads=256", "conv2d_nchwc.image2d", [["TENSOR", [1, 88, 20, 20], "float16"], ["TENSOR", [88, 88, 1, 1], "float16"], [1, 1], [0, 0, 0, 0], [1, 1], "float16"], {}], "config": {"index": 4566, "code_hash": null, "entity": [["tile_fc", "sp", [-1, 1, 22]], ["tile_y", "sp", [-1, 1, 5]], ["tile_x", "sp", [-1, 1, 5]], ["tile_rcc", "sp", [-1, 1]], ["tile_ry", "sp", [-1, 1]], ["tile_rx", "sp", [-1, 1]], ["auto_unroll_max_step", "ot", 1500], ["unroll_explicit", "ot", 0]]}, "result": [[7.620207999999999e-05], 0, 1.2953121662139893, 1643017151.524329], "version": 0.2, "tvm_version": "0.8.dev0"}
{"input": ["opencl -keys=adreno,opencl,gpu -device=adreno -max_num_threads=256", "conv2d_nchwc.image2d", [["TENSOR", [1, 88, 10, 10], "float16"], ["TENSOR", [88, 88, 1, 1], "float16"], [1, 1], [0, 0, 0, 0], [1, 1], "float16"], {}], "config": {"index": 2416, "code_hash": null, "entity": [["tile_fc", "sp", [-1, 1, 11]], ["tile_y", "sp", [-1, 2, 3]], ["tile_x", "sp", [-1, 1, 2]], ["tile_rcc", "sp", [-1, 22]], ["tile_ry", "sp", [-1, 1]], ["tile_rx", "sp", [-1, 1]], ["auto_unroll_max_step", "ot", 0], ["unroll_explicit", "ot", 0]]}, "result": [[5.109688e-05], 0, 1.0657110214233398, 1643017386.7054849], "version": 0.2, "tvm_version": "0.8.dev0"}
{"input": ["opencl -keys=adreno,opencl,gpu -device=adreno -max_num_threads=256", "conv2d_nchwc.image2d", [["TENSOR", [1, 40, 40, 40], "float16"], ["TENSOR", [88, 40, 3, 3], "float16"], [2, 2], [0, 0, 1, 1], [1, 1], "float16"], {}], "config": {"index": 2826, "code_hash": null, "entity": [["tile_fc", "sp", [-1, 1, 11]], ["tile_y", "sp", [-1, 1, 4]], ["tile_x", "sp", [-1, 5, 2]], ["tile_rcc", "sp", [-1, 2]], ["tile_ry", "sp", [-1, 3]], ["tile_rx", "sp", [-1, 1]], ["auto_unroll_max_step", "ot", 0], ["unroll_explicit", "ot", 0]]}, "result": [[0.00013553334000000002], 0, 0.7693140506744385, 1643017746.3419294], "version": 0.2, "tvm_version": "0.8.dev0"}
{"input": ["opencl -keys=adreno,opencl,gpu -device=adreno -max_num_threads=256", "conv2d_nchwc.image2d", [["TENSOR", [1, 672, 1, 1], "float16"], ["TENSOR", [28, 672, 1, 1], "float16"], [1, 1], [0, 0, 0, 0], [1, 1], "float16"], {}], "config": {"index": 101, "code_hash": null, "entity": [["tile_fc", "sp", [-1, 1, 7]], ["tile_y", "sp", [-1, 1, 4]], ["tile_x", "sp", [-1, 2, 2]], ["tile_rcc", "sp", [-1, 6]], ["tile_ry", "sp", [-1, 1]], ["tile_rx", "sp", [-1, 1]], ["auto_unroll_max_step", "ot", 512], ["unroll_explicit", "ot", 0]]}, "result": [[6.224478000000001e-05], 0, 0.6596970558166504, 1643018328.850798], "version": 0.2, "tvm_version": "0.8.dev0"}
{"input": ["opencl -keys=adreno,opencl,gpu -device=adreno -max_num_threads=256", "conv2d_nchwc.image2d", [["TENSOR", [1, 28, 1, 1], "float16"], ["TENSOR", [672, 28, 1, 1], "float16"], [1, 1], [0, 0, 0, 0], [1, 1], "float16"], {}], "config": {"index": 2430, "code_hash": null, "entity": [["tile_fc", "sp", [-1, 1, 21]], ["tile_y", "sp", [-1, 1, 2]], ["tile_x", "sp", [-1, 1, 1]], ["tile_rcc", "sp", [-1, 7]], ["tile_ry", "sp", [-1, 1]], ["tile_rx", "sp", [-1, 1]], ["auto_unroll_max_step", "ot", 512], ["unroll_explicit", "ot", 0]]}, "result": [[4.86854e-05], 0, 0.5490186214447021, 1643018600.7588427], "version": 0.2, "tvm_version": "0.8.dev0"}
{"input": ["opencl -keys=adreno,opencl,gpu -device=adreno -max_num_threads=256", "conv2d_nchwc.image2d", [["TENSOR", [1, 480, 1, 1], "float16"], ["TENSOR", [20, 480, 1, 1], "float16"], [1, 1], [0, 0, 0, 0], [1, 1], "float16"], {}], "config": {"index": 152, "code_hash": null, "entity": [["tile_fc", "sp", [-1, 1, 5]], ["tile_y", "sp", [-1, 1, 2]], ["tile_x", "sp", [-1, 1, 4]], ["tile_rcc", "sp", [-1, 60]], ["tile_ry", "sp", [-1, 1]], ["tile_rx", "sp", [-1, 1]], ["auto_unroll_max_step", "ot", 512], ["unroll_explicit", "ot", 0]]}, "result": [[6.565000000000001e-05], 0, 0.46820950508117676, 1643019280.617584], "version": 0.2, "tvm_version": "0.8.dev0"}
{"input": ["opencl -keys=adreno,opencl,gpu -device=adreno -max_num_threads=256", "conv2d_nchwc.image2d", [["TENSOR", [1, 20, 1, 1], "float16"], ["TENSOR", [480, 20, 1, 1], "float16"], [1, 1], [0, 0, 0, 0], [1, 1], "float16"], {}], "config": {"index": 3512, "code_hash": null, "entity": [["tile_fc", "sp", [-1, 6, 20]], ["tile_y", "sp", [-1, 4, 1]], ["tile_x", "sp", [-1, 1, 4]], ["tile_rcc", "sp", [-1, 1]], ["tile_ry", "sp", [-1, 1]], ["tile_rx", "sp", [-1, 1]], ["auto_unroll_max_step", "ot", 1500], ["unroll_explicit", "ot", 0]]}, "result": [[5.6210419999999994e-05], 0, 0.6120543479919434, 1643019459.4356103], "version": 0.2, "tvm_version": "0.8.dev0"}
{"input": ["opencl -keys=adreno,opencl,gpu -device=adreno -max_num_threads=256", "conv2d_nchwc.image2d", [["TENSOR", [1, 240, 1, 1], "float16"], ["TENSOR", [10, 240, 1, 1], "float16"], [1, 1], [0, 0, 0, 0], [1, 1], "float16"], {}], "config": {"index": 25, "code_hash": null, "entity": [["tile_fc", "sp", [-1, 1, 3]], ["tile_y", "sp", [-1, 1, 4]], ["tile_x", "sp", [-1, 1, 4]], ["tile_rcc", "sp", [-1, 2]], ["tile_ry", "sp", [-1, 1]], ["tile_rx", "sp", [-1, 1]], ["auto_unroll_max_step", "ot", 1500], ["unroll_explicit", "ot", 0]]}, "result": [[7.458126e-05], 0, 0.713552713394165, 1643019699.583256], "version": 0.2, "tvm_version": "0.8.dev0"}
{"input": ["opencl -keys=adreno,opencl,gpu -device=adreno -max_num_threads=256", "conv2d_nchwc.image2d", [["TENSOR", [1, 10, 1, 1], "float16"], ["TENSOR", [240, 10, 1, 1], "float16"], [1, 1], [0, 0, 0, 0], [1, 1], "float16"], {}], "config": {"index": 2613, "code_hash": null, "entity": [["tile_fc", "sp", [-1, 1, 20]], ["tile_y", "sp", [-1, 1, 4]], ["tile_x", "sp", [-1, 2, 2]], ["tile_rcc", "sp", [-1, 3]], ["tile_ry", "sp", [-1, 1]], ["tile_rx", "sp", [-1, 1]], ["auto_unroll_max_step", "ot", 0], ["unroll_explicit", "ot", 1]]}, "result": [[5.2859379999999996e-05], 0, 0.5151710510253906, 1643019892.7785575], "version": 0.2, "tvm_version": "0.8.dev0"}
{"input": ["opencl -keys=adreno,opencl,gpu -device=adreno -max_num_threads=256", "conv2d_nchwc.image2d", [["TENSOR", [1, 144, 1, 1], "float16"], ["TENSOR", [6, 144, 1, 1], "float16"], [1, 1], [0, 0, 0, 0], [1, 1], "float16"], {}], "config": {"index": 18, "code_hash": null, "entity": [["tile_fc", "sp", [-1, 1, 2]], ["tile_y", "sp", [-1, 1, 4]], ["tile_x", "sp", [-1, 1, 4]], ["tile_rcc", "sp", [-1, 1]], ["tile_ry", "sp", [-1, 1]], ["tile_rx", "sp", [-1, 1]], ["auto_unroll_max_step", "ot", 1500], ["unroll_explicit", "ot", 0]]}, "result": [[5.169895999999999e-05], 0, 0.5848023891448975, 1643019994.0238636], "version": 0.2, "tvm_version": "0.8.dev0"}
{"input": ["opencl -keys=adreno,opencl,gpu -device=adreno -max_num_threads=256", "conv2d_nchwc.image2d", [["TENSOR", [1, 6, 1, 1], "float16"], ["TENSOR", [144, 6, 1, 1], "float16"], [1, 1], [0, 0, 0, 0], [1, 1], "float16"], {}], "config": {"index": 2127, "code_hash": null, "entity": [["tile_fc", "sp", [-1, 1, 18]], ["tile_y", "sp", [-1, 1, 4]], ["tile_x", "sp", [-1, 1, 2]], ["tile_rcc", "sp", [-1, 1]], ["tile_ry", "sp", [-1, 1]], ["tile_rx", "sp", [-1, 1]], ["auto_unroll_max_step", "ot", 1500], ["unroll_explicit", "ot", 1]]}, "result": [[4.938022e-05], 0, 0.6518635749816895, 1643020219.4879596], "version": 0.2, "tvm_version": "0.8.dev0"}
{"input": ["opencl -keys=adreno,opencl,gpu -device=adreno -max_num_threads=256", "conv2d_nchwc.image2d", [["TENSOR", [1, 96, 1, 1], "float16"], ["TENSOR", [4, 96, 1, 1], "float16"], [1, 1], [0, 0, 0, 0], [1, 1], "float16"], {}], "config": {"index": 423, "code_hash": null, "entity": [["tile_fc", "sp", [-1, 1, 1]], ["tile_y", "sp", [-1, 1, 2]], ["tile_x", "sp", [-1, 2, 2]], ["tile_rcc", "sp", [-1, 4]], ["tile_ry", "sp", [-1, 1]], ["tile_rx", "sp", [-1, 1]], ["auto_unroll_max_step", "ot", 512], ["unroll_explicit", "ot", 0]]}, "result": [[5.035624000000001e-05], 0, 0.6626331806182861, 1643020527.5547464], "version": 0.2, "tvm_version": "0.8.dev0"}
{"input": ["opencl -keys=adreno,opencl,gpu -device=adreno -max_num_threads=256", "conv2d_nchwc.image2d", [["TENSOR", [1, 4, 1, 1], "float16"], ["TENSOR", [96, 4, 1, 1], "float16"], [1, 1], [0, 0, 0, 0], [1, 1], "float16"], {}], "config": {"index": 15, "code_hash": null, "entity": [["tile_fc", "sp", [-1, 1, 24]], ["tile_y", "sp", [-1, 2, 2]], ["tile_x", "sp", [-1, 4, 1]], ["tile_rcc", "sp", [-1, 1]], ["tile_ry", "sp", [-1, 1]], ["tile_rx", "sp", [-1, 1]], ["auto_unroll_max_step", "ot", 0], ["unroll_explicit", "ot", 0]]}, "result": [[5.000208e-05], 0, 0.6536574363708496, 1643020630.2810853], "version": 0.2, "tvm_version": "0.8.dev0"}
{"input": ["opencl -keys=adreno,opencl,gpu -device=adreno -max_num_threads=256", "conv2d_nchwc.image2d", [["TENSOR", [1, 16, 1, 1], "float16"], ["TENSOR", [4, 16, 1, 1], "float16"], [1, 1], [0, 0, 0, 0], [1, 1], "float16"], {}], "config": {"index": 625, "code_hash": null, "entity": [["tile_fc", "sp", [-1, 1, 1]], ["tile_y", "sp", [-1, 2, 1]], ["tile_x", "sp", [-1, 4, 1]], ["tile_rcc", "sp", [-1, 4]], ["tile_ry", "sp", [-1, 1]], ["tile_rx", "sp", [-1, 1]], ["auto_unroll_max_step", "ot", 1500], ["unroll_explicit", "ot", 1]]}, "result": [[5.066042000000001e-05], 0, 0.6067283153533936, 1643020980.4507854], "version": 0.2, "tvm_version": "0.8.dev0"}
{"input": ["opencl -keys=adreno,opencl,gpu -device=adreno -max_num_threads=256", "conv2d_nchwc.image2d", [["TENSOR", [1, 4, 1, 1], "float16"], ["TENSOR", [16, 4, 1, 1], "float16"], [1, 1], [0, 0, 0, 0], [1, 1], "float16"], {}], "config": {"index": 31, "code_hash": null, "entity": [["tile_fc", "sp", [-1, 1, 4]], ["tile_y", "sp", [-1, 2, 2]], ["tile_x", "sp", [-1, 1, 4]], ["tile_rcc", "sp", [-1, 1]], ["tile_ry", "sp", [-1, 1]], ["tile_rx", "sp", [-1, 1]], ["auto_unroll_max_step", "ot", 512], ["unroll_explicit", "ot", 1]]}, "result": [[8.620418000000002e-05], 0, 0.5778605937957764, 1643021044.5757265], "version": 0.2, "tvm_version": "0.8.dev0"}
{"input": ["opencl -keys=adreno,opencl,gpu -device=adreno -max_num_threads=256", "conv2d_nchwc.image2d", [["TENSOR", [1, 32, 1, 1], "float16"], ["TENSOR", [8, 32, 1, 1], "float16"], [1, 1], [0, 0, 0, 0], [1, 1], "float16"], {}], "config": {"index": 0, "code_hash": null, "entity": [["tile_fc", "sp", [-1, 1, 2]], ["tile_y", "sp", [-1, 1, 4]], ["tile_x", "sp", [-1, 1, 4]], ["tile_rcc", "sp", [-1, 1]], ["tile_ry", "sp", [-1, 1]], ["tile_rx", "sp", [-1, 1]], ["auto_unroll_max_step", "ot", 0], ["unroll_explicit", "ot", 0]]}, "result": [[0.000126575], 0, 0.7077374458312988, 1643021066.292611], "version": 0.2, "tvm_version": "0.8.dev0"}
{"input": ["opencl -keys=adreno,opencl,gpu -device=adreno -max_num_threads=256", "conv2d_nchwc.image2d", [["TENSOR", [1, 8, 1, 1], "float16"], ["TENSOR", [32, 8, 1, 1], "float16"], [1, 1], [0, 0, 0, 0], [1, 1], "float16"], {}], "config": {"index": 167, "code_hash": null, "entity": [["tile_fc", "sp", [-1, 1, 8]], ["tile_y", "sp", [-1, 1, 4]], ["tile_x", "sp", [-1, 1, 4]], ["tile_rcc", "sp", [-1, 2]], ["tile_ry", "sp", [-1, 1]], ["tile_rx", "sp", [-1, 1]], ["auto_unroll_max_step", "ot", 1500], ["unroll_explicit", "ot", 0]]}, "result": [[4.983958e-05], 0, 0.6335856914520264, 1643021237.911326], "version": 0.2, "tvm_version": "0.8.dev0"}
{"input": ["opencl -keys=adreno,opencl,gpu -device=adreno -max_num_threads=256", "conv2d_nchwc.image2d", [["TENSOR", [1, 3, 320, 320], "float16"], ["TENSOR", [32, 3, 3, 3], "float16"], [2, 2], [0, 0, 1, 1], [1, 1], "float16"], {}], "config": {"index": 28864, "code_hash": null, "entity": [["tile_fc", "sp", [-1, 1, 8]], ["tile_y", "sp", [-1, 2, 1]], ["tile_x", "sp", [-1, 4, 8]], ["tile_rcc", "sp", [-1, 1]], ["tile_ry", "sp", [-1, 3]], ["tile_rx", "sp", [-1, 3]], ["auto_unroll_max_step", "ot", 512], ["unroll_explicit", "ot", 0]]}, "result": [[0.00033100727999999994], 0, 1.7638599872589111, 1643022034.1850498], "version": 0.2, "tvm_version": "0.8.dev0"}
{"input": ["opencl -keys=adreno,opencl,gpu -device=adreno -max_num_threads=256", "depthwise_conv2d_nchwc.image2d", [["TENSOR", [1, 32, 160, 160], "float16"], ["TENSOR", [32, 1, 3, 3], "float16"], [1, 1], [1, 1, 1, 1], [1, 1], "float16"], {}], "config": {"index": 313869, "code_hash": null, "entity": [["tile_fc", "sp", [-1, 1, 8]], ["tile_y", "sp", [-1, 1, 2]], ["tile_x", "sp", [-1, 1, 40]], ["tile_ry", "sp", [-1, 3]], ["tile_rx", "sp", [-1, 3]], ["auto_unroll_max_step", "ot", 512], ["unroll_explicit", "ot", 0]]}, "result": [[0.00029908646], 0, 1.7193610668182373, 1643023343.3652196], "version": 0.2, "tvm_version": "0.8.dev0"}
{"input": ["opencl -keys=adreno,opencl,gpu -device=adreno -max_num_threads=256", "conv2d_nchwc.image2d", [["TENSOR", [1, 32, 160, 160], "float16"], ["TENSOR", [16, 32, 1, 1], "float16"], [1, 1], [0, 0, 0, 0], [1, 1], "float16"], {}], "config": {"index": 17014, "code_hash": null, "entity": [["tile_fc", "sp", [-1, 1, 4]], ["tile_y", "sp", [-1, 2, 4]], ["tile_x", "sp", [-1, 2, 8]], ["tile_rcc", "sp", [-1, 2]], ["tile_ry", "sp", [-1, 1]], ["tile_rx", "sp", [-1, 1]], ["auto_unroll_max_step", "ot", 1500], ["unroll_explicit", "ot", 0]]}, "result": [[0.00019954688000000002], 0, 1.3477275371551514, 1643023881.1609464], "version": 0.2, "tvm_version": "0.8.dev0"}
{"input": ["opencl -keys=adreno,opencl,gpu -device=adreno -max_num_threads=256", "depthwise_conv2d_nchwc.image2d", [["TENSOR", [1, 16, 160, 160], "float16"], ["TENSOR", [16, 1, 3, 3], "float16"], [1, 1], [1, 1, 1, 1], [1, 1], "float16"], {}], "config": {"index": 89429, "code_hash": null, "entity": [["tile_fc", "sp", [-1, 1, 4]], ["tile_y", "sp", [-1, 1, 8]], ["tile_x", "sp", [-1, 1, 16]], ["tile_ry", "sp", [-1, 3]], ["tile_rx", "sp", [-1, 3]], ["auto_unroll_max_step", "ot", 0], ["unroll_explicit", "ot", 0]]}, "result": [[0.00016332292], 0, 1.058121919631958, 1643025200.9443853], "version": 0.2, "tvm_version": "0.8.dev0"}
{"input": ["opencl -keys=adreno,opencl,gpu -device=adreno -max_num_threads=256", "conv2d_nchwc.image2d", [["TENSOR", [1, 16, 160, 160], "float16"], ["TENSOR", [16, 16, 1, 1], "float16"], [1, 1], [0, 0, 0, 0], [1, 1], "float16"], {}], "config": {"index": 8186, "code_hash": null, "entity": [["tile_fc", "sp", [-1, 1, 4]], ["tile_y", "sp", [-1, 1, 4]], ["tile_x", "sp", [-1, 4, 8]], ["tile_rcc", "sp", [-1, 2]], ["tile_ry", "sp", [-1, 1]], ["tile_rx", "sp", [-1, 1]], ["auto_unroll_max_step", "ot", 512], ["unroll_explicit", "ot", 0]]}, "result": [[0.00010998853999999999], 0, 0.9533591270446777, 1643025883.3764467], "version": 0.2, "tvm_version": "0.8.dev0"}
{"input": ["opencl -keys=adreno,opencl,gpu -device=adreno -max_num_threads=256", "conv2d_nchwc.image2d", [["TENSOR", [1, 16, 160, 160], "float16"], ["TENSOR", [96, 16, 1, 1], "float16"], [1, 1], [0, 0, 0, 0], [1, 1], "float16"], {}], "config": {"index": 106332, "code_hash": null, "entity": [["tile_fc", "sp", [-1, 1, 24]], ["tile_y", "sp", [-1, 4, 2]], ["tile_x", "sp", [-1, 1, 16]], ["tile_rcc", "sp", [-1, 2]], ["tile_ry", "sp", [-1, 1]], ["tile_rx", "sp", [-1, 1]], ["auto_unroll_max_step", "ot", 1500], ["unroll_explicit", "ot", 0]]}, "result": [[0.00031222916], 0, 3.0945637226104736, 1643027248.60773], "version": 0.2, "tvm_version": "0.8.dev0"}
{"input": ["opencl -keys=adreno,opencl,gpu -device=adreno -max_num_threads=256", "depthwise_conv2d_nchwc.image2d", [["TENSOR", [1, 96, 160, 160], "float16"], ["TENSOR", [96, 1, 3, 3], "float16"], [2, 2], [0, 0, 1, 1], [1, 1], "float16"], {}], "config": {"index": 1448204, "code_hash": null, "entity": [["tile_fc", "sp", [-1, 1, 3]], ["tile_y", "sp", [-1, 1, 10]], ["tile_x", "sp", [-1, 1, 16]], ["tile_ry", "sp", [-1, 3]], ["tile_rx", "sp", [-1, 3]], ["auto_unroll_max_step", "ot", 1500], ["unroll_explicit", "ot", 1]]}, "result": [[0.00072130312], 0, 2.3885531425476074, 1643028000.8736293], "version": 0.2, "tvm_version": "0.8.dev0"}
{"input": ["opencl -keys=adreno,opencl,gpu -device=adreno -max_num_threads=256", "conv2d_nchwc.image2d", [["TENSOR", [1, 96, 80, 80], "float16"], ["TENSOR", [24, 96, 1, 1], "float16"], [1, 1], [0, 0, 0, 0], [1, 1], "float16"], {}], "config": {"index": 27063, "code_hash": null, "entity": [["tile_fc", "sp", [-1, 3, 2]], ["tile_y", "sp", [-1, 1, 8]], ["tile_x", "sp", [-1, 5, 8]], ["tile_rcc", "sp", [-1, 6]], ["tile_ry", "sp", [-1, 1]], ["tile_rx", "sp", [-1, 1]], ["auto_unroll_max_step", "ot", 512], ["unroll_explicit", "ot", 0]]}, "result": [[0.00019861561999999998], 0, 1.1933064460754395, 1643029389.9206028], "version": 0.2, "tvm_version": "0.8.dev0"}
{"input": ["opencl -keys=adreno,opencl,gpu -device=adreno -max_num_threads=256", "depthwise_conv2d_nchwc.image2d", [["TENSOR", [1, 144, 80, 80], "float16"], ["TENSOR", [144, 1, 3, 3], "float16"], [1, 1], [1, 1, 1, 1], [1, 1], "float16"], {}], "config": {"index": 1300299, "code_hash": null, "entity": [["tile_fc", "sp", [-1, 1, 3]], ["tile_y", "sp", [-1, 1, 8]], ["tile_x", "sp", [-1, 1, 16]], ["tile_ry", "sp", [-1, 3]], ["tile_rx", "sp", [-1, 1]], ["auto_unroll_max_step", "ot", 512], ["unroll_explicit", "ot", 1]]}, "result": [[0.00035740623999999996], 0, 1.570875644683838, 1643030389.63721], "version": 0.2, "tvm_version": "0.8.dev0"}
{"input": ["opencl -keys=adreno,opencl,gpu -device=adreno -max_num_threads=256", "conv2d_nchwc.image2d", [["TENSOR", [1, 144, 80, 80], "float16"], ["TENSOR", [24, 144, 1, 1], "float16"], [1, 1], [0, 0, 0, 0], [1, 1], "float16"], {}], "config": {"index": 42248, "code_hash": null, "entity": [["tile_fc", "sp", [-1, 1, 6]], ["tile_y", "sp", [-1, 2, 4]], ["tile_x", "sp", [-1, 2, 10]], ["tile_rcc", "sp", [-1, 2]], ["tile_ry", "sp", [-1, 1]], ["tile_rx", "sp", [-1, 1]], ["auto_unroll_max_step", "ot", 1500], ["unroll_explicit", "ot", 0]]}, "result": [[0.00024445], 0, 1.5073063373565674, 1643031683.0608592], "version": 0.2, "tvm_version": "0.8.dev0"}
{"input": ["opencl -keys=adreno,opencl,gpu -device=adreno -max_num_threads=256", "conv2d_nchwc.image2d", [["TENSOR", [1, 24, 80, 80], "float16"], ["TENSOR", [144, 24, 1, 1], "float16"], [1, 1], [0, 0, 0, 0], [1, 1], "float16"], {}], "config": {"index": 204947, "code_hash": null, "entity": [["tile_fc", "sp", [-1, 1, 18]], ["tile_y", "sp", [-1, 2, 4]], ["tile_x", "sp", [-1, 2, 8]], ["tile_rcc", "sp", [-1, 2]], ["tile_ry", "sp", [-1, 1]], ["tile_rx", "sp", [-1, 1]], ["auto_unroll_max_step", "ot", 512], ["unroll_explicit", "ot", 1]]}, "result": [[0.00015351039999999999], 0, 1.5469119548797607, 1643032278.754046], "version": 0.2, "tvm_version": "0.8.dev0"}
{"input": ["opencl -keys=adreno,opencl,gpu -device=adreno -max_num_threads=256", "depthwise_conv2d_nchwc.image2d", [["TENSOR", [1, 144, 80, 80], "float16"], ["TENSOR", [144, 1, 5, 5], "float16"], [2, 2], [1, 1, 2, 2], [1, 1], "float16"], {}], "config": {"index": 646951, "code_hash": null, "entity": [["tile_fc", "sp", [-1, 1, 12]], ["tile_y", "sp", [-1, 1, 1]], ["tile_x", "sp", [-1, 1, 40]], ["tile_ry", "sp", [-1, 5]], ["tile_rx", "sp", [-1, 5]], ["auto_unroll_max_step", "ot", 512], ["unroll_explicit", "ot", 1]]}, "result": [[0.00038875208], 0, 1.3476216793060303, 1643034005.2449703], "version": 0.2, "tvm_version": "0.8.dev0"}
{"input": ["opencl -keys=adreno,opencl,gpu -device=adreno -max_num_threads=256", "conv2d_nchwc.image2d", [["TENSOR", [1, 144, 40, 40], "float16"], ["TENSOR", [40, 144, 1, 1], "float16"], [1, 1], [0, 0, 0, 0], [1, 1], "float16"], {}], "config": {"index": 35477, "code_hash": null, "entity": [["tile_fc", "sp", [-1, 1, 10]], ["tile_y", "sp", [-1, 8, 1]], ["tile_x", "sp", [-1, 1, 10]], ["tile_rcc", "sp", [-1, 36]], ["tile_ry", "sp", [-1, 1]], ["tile_rx", "sp", [-1, 1]], ["auto_unroll_max_step", "ot", 1500], ["unroll_explicit", "ot", 0]]}, "result": [[0.00010634584], 0, 0.8342370986938477, 1643034967.780809], "version": 0.2, "tvm_version": "0.8.dev0"}
{"input": ["opencl -keys=adreno,opencl,gpu -device=adreno -max_num_threads=256", "depthwise_conv2d_nchwc.image2d", [["TENSOR", [1, 240, 40, 40], "float16"], ["TENSOR", [240, 1, 5, 5], "float16"], [1, 1], [2, 2, 2, 2], [1, 1], "float16"], {}], "config": {"index": 825768, "code_hash": null, "entity": [["tile_fc", "sp", [-1, 1, 1]], ["tile_y", "sp", [-1, 1, 8]], ["tile_x", "sp", [-1, 1, 40]], ["tile_ry", "sp", [-1, 1]], ["tile_rx", "sp", [-1, 1]], ["auto_unroll_max_step", "ot", 512], ["unroll_explicit", "ot", 1]]}, "result": [[0.00025363958], 0, 1.4572899341583252, 1643035987.0960698], "version": 0.2, "tvm_version": "0.8.dev0"}
{"input": ["opencl -keys=adreno,opencl,gpu -device=adreno -max_num_threads=256", "conv2d_nchwc.image2d", [["TENSOR", [1, 240, 40, 40], "float16"], ["TENSOR", [40, 240, 1, 1], "float16"], [1, 1], [0, 0, 0, 0], [1, 1], "float16"], {}], "config": {"index": 18403, "code_hash": null, "entity": [["tile_fc", "sp", [-1, 1, 5]], ["tile_y", "sp", [-1, 2, 5]], ["tile_x", "sp", [-1, 2, 10]], ["tile_rcc", "sp", [-1, 2]], ["tile_ry", "sp", [-1, 1]], ["tile_rx", "sp", [-1, 1]], ["auto_unroll_max_step", "ot", 512], ["unroll_explicit", "ot", 0]]}, "result": [[0.00015326665999999998], 0, 0.8537352085113525, 1643036433.3516977], "version": 0.2, "tvm_version": "0.8.dev0"}
{"input": ["opencl -keys=adreno,opencl,gpu -device=adreno -max_num_threads=256", "conv2d_nchwc.image2d", [["TENSOR", [1, 40, 40, 40], "float16"], ["TENSOR", [240, 40, 1, 1], "float16"], [1, 1], [0, 0, 0, 0], [1, 1], "float16"], {}], "config": {"index": 8526, "code_hash": null, "entity": [["tile_fc", "sp", [-1, 1, 20]], ["tile_y", "sp", [-1, 4, 5]], ["tile_x", "sp", [-1, 1, 10]], ["tile_rcc", "sp", [-1, 1]], ["tile_ry", "sp", [-1, 1]], ["tile_rx", "sp", [-1, 1]], ["auto_unroll_max_step", "ot", 0], ["unroll_explicit", "ot", 0]]}, "result": [[0.00011639063999999999], 0, 0.9111406803131104, 1643037201.3656793], "version": 0.2, "tvm_version": "0.8.dev0"}
{"input": ["opencl -keys=adreno,opencl,gpu -device=adreno -max_num_threads=256", "depthwise_conv2d_nchwc.image2d", [["TENSOR", [1, 240, 40, 40], "float16"], ["TENSOR", [240, 1, 3, 3], "float16"], [2, 2], [0, 0, 1, 1], [1, 1], "float16"], {}], "config": {"index": 204798, "code_hash": null, "entity": [["tile_fc", "sp", [-1, 1, 5]], ["tile_y", "sp", [-1, 1, 5]], ["tile_x", "sp", [-1, 1, 5]], ["tile_ry", "sp", [-1, 3]], ["tile_rx", "sp", [-1, 3]], ["auto_unroll_max_step", "ot", 1500], ["unroll_explicit", "ot", 0]]}, "result": [[0.00013607708000000002], 0, 0.9634268283843994, 1643038096.2774594], "version": 0.2, "tvm_version": "0.8.dev0"}
{"input": ["opencl -keys=adreno,opencl,gpu -device=adreno -max_num_threads=256", "conv2d_nchwc.image2d", [["TENSOR", [1, 240, 20, 20], "float16"], ["TENSOR", [80, 240, 1, 1], "float16"], [1, 1], [0, 0, 0, 0], [1, 1], "float16"], {}], "config": {"index": 14419, "code_hash": null, "entity": [["tile_fc", "sp", [-1, 1, 2]], ["tile_y", "sp", [-1, 1, 5]], ["tile_x", "sp", [-1, 2, 10]], ["tile_rcc", "sp", [-1, 60]], ["tile_ry", "sp", [-1, 1]], ["tile_rx", "sp", [-1, 1]], ["auto_unroll_max_step", "ot", 0], ["unroll_explicit", "ot", 0]]}, "result": [[8.907812e-05], 0, 0.49411869049072266, 1643038483.5613449], "version": 0.2, "tvm_version": "0.8.dev0"}
{"input": ["opencl -keys=adreno,opencl,gpu -device=adreno -max_num_threads=256", "depthwise_conv2d_nchwc.image2d", [["TENSOR", [1, 480, 20, 20], "float16"], ["TENSOR", [480, 1, 3, 3], "float16"], [1, 1], [1, 1, 1, 1], [1, 1], "float16"], {}], "config": {"index": 639422, "code_hash": null, "entity": [["tile_fc", "sp", [-1, 1, 10]], ["tile_y", "sp", [-1, 1, 5]], ["tile_x", "sp", [-1, 2, 10]], ["tile_ry", "sp", [-1, 3]], ["tile_rx", "sp", [-1, 1]], ["auto_unroll_max_step", "ot", 1500], ["unroll_explicit", "ot", 1]]}, "result": [[0.00010047811999999999], 0, 0.7704064846038818, 1643039518.1026926], "version": 0.2, "tvm_version": "0.8.dev0"}
{"input": ["opencl -keys=adreno,opencl,gpu -device=adreno -max_num_threads=256", "conv2d_nchwc.image2d", [["TENSOR", [1, 480, 20, 20], "float16"], ["TENSOR", [80, 480, 1, 1], "float16"], [1, 1], [0, 0, 0, 0], [1, 1], "float16"], {}], "config": {"index": 40575, "code_hash": null, "entity": [["tile_fc", "sp", [-1, 1, 10]], ["tile_y", "sp", [-1, 2, 5]], ["tile_x", "sp", [-1, 2, 5]], ["tile_rcc", "sp", [-1, 2]], ["tile_ry", "sp", [-1, 1]], ["tile_rx", "sp", [-1, 1]], ["auto_unroll_max_step", "ot", 1500], ["unroll_explicit", "ot", 0]]}, "result": [[0.000141975], 0, 0.9418079853057861, 1643040540.109807], "version": 0.2, "tvm_version": "0.8.dev0"}
{"input": ["opencl -keys=adreno,opencl,gpu -device=adreno -max_num_threads=256", "conv2d_nchwc.image2d", [["TENSOR", [1, 80, 20, 20], "float16"], ["TENSOR", [480, 80, 1, 1], "float16"], [1, 1], [0, 0, 0, 0], [1, 1], "float16"], {}], "config": {"index": 116364, "code_hash": null, "entity": [["tile_fc", "sp", [-1, 1, 24]], ["tile_y", "sp", [-1, 2, 10]], ["tile_x", "sp", [-1, 2, 1]], ["tile_rcc", "sp", [-1, 20]], ["tile_ry", "sp", [-1, 1]], ["tile_rx", "sp", [-1, 1]], ["auto_unroll_max_step", "ot", 1500], ["unroll_explicit", "ot", 0]]}, "result": [[0.00012020208], 0, 0.771204948425293, 1643041333.0766778], "version": 0.2, "tvm_version": "0.8.dev0"}
{"input": ["opencl -keys=adreno,opencl,gpu -device=adreno -max_num_threads=256", "depthwise_conv2d_nchwc.image2d", [["TENSOR", [1, 480, 20, 20], "float16"], ["TENSOR", [480, 1, 5, 5], "float16"], [1, 1], [2, 2, 2, 2], [1, 1], "float16"], {}], "config": {"index": 436732, "code_hash": null, "entity": [["tile_fc", "sp", [-1, 1, 6]], ["tile_y", "sp", [-1, 1, 4]], ["tile_x", "sp", [-1, 1, 20]], ["tile_ry", "sp", [-1, 1]], ["tile_rx", "sp", [-1, 5]], ["auto_unroll_max_step", "ot", 0], ["unroll_explicit", "ot", 1]]}, "result": [[0.0001512927], 0, 1.8160457611083984, 1643041990.463163], "version": 0.2, "tvm_version": "0.8.dev0"}
{"input": ["opencl -keys=adreno,opencl,gpu -device=adreno -max_num_threads=256", "conv2d_nchwc.image2d", [["TENSOR", [1, 480, 20, 20], "float16"], ["TENSOR", [112, 480, 1, 1], "float16"], [1, 1], [0, 0, 0, 0], [1, 1], "float16"], {}], "config": {"index": 46702, "code_hash": null, "entity": [["tile_fc", "sp", [-1, 1, 14]], ["tile_y", "sp", [-1, 5, 4]], ["tile_x", "sp", [-1, 1, 4]], ["tile_rcc", "sp", [-1, 6]], ["tile_ry", "sp", [-1, 1]], ["tile_rx", "sp", [-1, 1]], ["auto_unroll_max_step", "ot", 1500], ["unroll_explicit", "ot", 0]]}, "result": [[0.00019299064000000002], 0, 0.771451473236084, 1643042502.6472533], "version": 0.2, "tvm_version": "0.8.dev0"}
{"input": ["opencl -keys=adreno,opencl,gpu -device=adreno -max_num_threads=256", "conv2d_nchwc.image2d", [["TENSOR", [1, 112, 20, 20], "float16"], ["TENSOR", [672, 112, 1, 1], "float16"], [1, 1], [0, 0, 0, 0], [1, 1], "float16"], {}], "config": {"index": 7373, "code_hash": null, "entity": [["tile_fc", "sp", [-1, 1, 24]], ["tile_y", "sp", [-1, 2, 5]], ["tile_x", "sp", [-1, 2, 1]], ["tile_rcc", "sp", [-1, 2]], ["tile_ry", "sp", [-1, 1]], ["tile_rx", "sp", [-1, 1]], ["auto_unroll_max_step", "ot", 0], ["unroll_explicit", "ot", 0]]}, "result": [[0.0001576802], 0, 1.0261852741241455, 1643043241.5191228], "version": 0.2, "tvm_version": "0.8.dev0"}
{"input": ["opencl -keys=adreno,opencl,gpu -device=adreno -max_num_threads=256", "depthwise_conv2d_nchwc.image2d", [["TENSOR", [1, 672, 20, 20], "float16"], ["TENSOR", [672, 1, 5, 5], "float16"], [1, 1], [2, 2, 2, 2], [1, 1], "float16"], {}], "config": {"index": 699182, "code_hash": null, "entity": [["tile_fc", "sp", [-1, 1, 12]], ["tile_y", "sp", [-1, 1, 4]], ["tile_x", "sp", [-1, 1, 20]], ["tile_ry", "sp", [-1, 5]], ["tile_rx", "sp", [-1, 5]], ["auto_unroll_max_step", "ot", 1500], ["unroll_explicit", "ot", 1]]}, "result": [[0.00020344062], 0, 1.7073886394500732, 1643044076.0883245], "version": 0.2, "tvm_version": "0.8.dev0"}
{"input": ["opencl -keys=adreno,opencl,gpu -device=adreno -max_num_threads=256", "conv2d_nchwc.image2d", [["TENSOR", [1, 672, 20, 20], "float16"], ["TENSOR", [112, 672, 1, 1], "float16"], [1, 1], [0, 0, 0, 0], [1, 1], "float16"], {}], "config": {"index": 22029, "code_hash": null, "entity": [["tile_fc", "sp", [-1, 1, 14]], ["tile_y", "sp", [-1, 2, 2]], ["tile_x", "sp", [-1, 2, 5]], ["tile_rcc", "sp", [-1, 2]], ["tile_ry", "sp", [-1, 1]], ["tile_rx", "sp", [-1, 1]], ["auto_unroll_max_step", "ot", 512], ["unroll_explicit", "ot", 0]]}, "result": [[0.00026963646], 0, 0.7955403327941895, 1643044915.524612], "version": 0.2, "tvm_version": "0.8.dev0"}
{"input": ["opencl -keys=adreno,opencl,gpu -device=adreno -max_num_threads=256", "conv2d_nchwc.image2d", [["TENSOR", [1, 112, 20, 20], "float16"], ["TENSOR", [88, 112, 3, 3], "float16"], [2, 2], [0, 0, 1, 1], [1, 1], "float16"], {}], "config": {"index": 53600, "code_hash": null, "entity": [["tile_fc", "sp", [-1, 1, 11]], ["tile_y", "sp", [-1, 1, 4]], ["tile_x", "sp", [-1, 2, 2]], ["tile_rcc", "sp", [-1, 28]], ["tile_ry", "sp", [-1, 3]], ["tile_rx", "sp", [-1, 3]], ["auto_unroll_max_step", "ot", 1500], ["unroll_explicit", "ot", 0]]}, "result": [[0.00016442291999999996], 0, 0.9043276309967041, 1643045277.7937584], "version": 0.2, "tvm_version": "0.8.dev0"}
{"input": ["opencl -keys=adreno,opencl,gpu -device=adreno -max_num_threads=256", "conv2d_nchwc.image2d", [["TENSOR", [1, 88, 10, 10], "float16"], ["TENSOR", [88, 88, 3, 3], "float16"], [2, 2], [0, 0, 1, 1], [1, 1], "float16"], {}], "config": {"index": 8783, "code_hash": null, "entity": [["tile_fc", "sp", [-1, 1, 22]], ["tile_y", "sp", [-1, 1, 4]], ["tile_x", "sp", [-1, 1, 2]], ["tile_rcc", "sp", [-1, 1]], ["tile_ry", "sp", [-1, 1]], ["tile_rx", "sp", [-1, 3]], ["auto_unroll_max_step", "ot", 1500], ["unroll_explicit", "ot", 0]]}, "result": [[9.868646e-05], 0, 0.6409218311309814, 1643045622.284392], "version": 0.2, "tvm_version": "0.8.dev0"}
{"input": ["opencl -keys=adreno,opencl,gpu -device=adreno -max_num_threads=256", "conv2d_nchwc.image2d", [["TENSOR", [1, 24, 80, 80], "float16"], ["TENSOR", [88, 24, 3, 3], "float16"], [2, 2], [0, 0, 1, 1], [1, 1], "float16"], {}], "config": {"index": 43234, "code_hash": null, "entity": [["tile_fc", "sp", [-1, 1, 11]], ["tile_y", "sp", [-1, 1, 4]], ["tile_x", "sp", [-1, 4, 5]], ["tile_rcc", "sp", [-1, 2]], ["tile_ry", "sp", [-1, 1]], ["tile_rx", "sp", [-1, 1]], ["auto_unroll_max_step", "ot", 1500], ["unroll_explicit", "ot", 0]]}, "result": [[0.00019884584000000002], 0, 0.8730010986328125, 1643046190.648001], "version": 0.2, "tvm_version": "0.8.dev0"}
{"input": ["opencl -keys=adreno,opencl,gpu -device=adreno -max_num_threads=256", "depthwise_conv2d_nchwc.image2d", [["TENSOR", [1, 88, 5, 5], "float16"], ["TENSOR", [88, 1, 3, 3], "float16"], [1, 1], [1, 1, 1, 1], [1, 1], "float16"], {}], "config": {"index": 983, "code_hash": null, "entity": [["tile_fc", "sp", [-1, 11, 1]], ["tile_y", "sp", [-1, 1, 8]], ["tile_x", "sp", [-1, 1, 1]], ["tile_ry", "sp", [-1, 3]], ["tile_rx", "sp", [-1, 1]], ["auto_unroll_max_step", "ot", 0], ["unroll_explicit", "ot", 0]]}, "result": [[4.959062e-05], 0, 0.6017429828643799, 1643046491.919132], "version": 0.2, "tvm_version": "0.8.dev0"}
{"input": ["opencl -keys=adreno,opencl,gpu -device=adreno -max_num_threads=256", "conv2d_nchwc.image2d", [["TENSOR", [1, 88, 5, 5], "float16"], ["TENSOR", [88, 88, 1, 1], "float16"], [1, 1], [0, 0, 0, 0], [1, 1], "float16"], {}], "config": {"index": 188, "code_hash": null, "entity": [["tile_fc", "sp", [-1, 1, 22]], ["tile_y", "sp", [-1, 2, 1]], ["tile_x", "sp", [-1, 1, 8]], ["tile_rcc", "sp", [-1, 1]], ["tile_ry", "sp", [-1, 1]], ["tile_rx", "sp", [-1, 1]], ["auto_unroll_max_step", "ot", 0], ["unroll_explicit", "ot", 0]]}, "result": [[5.267812e-05], 0, 0.6141147613525391, 1643046653.1555264], "version": 0.2, "tvm_version": "0.8.dev0"}
{"input": ["opencl -keys=adreno,opencl,gpu -device=adreno -max_num_threads=256", "depthwise_conv2d_nchwc.image2d", [["TENSOR", [1, 88, 10, 10], "float16"], ["TENSOR", [88, 1, 3, 3], "float16"], [1, 1], [1, 1, 1, 1], [1, 1], "float16"], {}], "config": {"index": 15002, "code_hash": null, "entity": [["tile_fc", "sp", [-1, 1, 22]], ["tile_y", "sp", [-1, 1, 3]], ["tile_x", "sp", [-1, 3, 1]], ["tile_ry", "sp", [-1, 3]], ["tile_rx", "sp", [-1, 1]], ["auto_unroll_max_step", "ot", 512], ["unroll_explicit", "ot", 0]]}, "result": [[5.0157299999999995e-05], 0, 0.6219189167022705, 1643046850.4776037], "version": 0.2, "tvm_version": "0.8.dev0"}
{"input": ["opencl -keys=adreno,opencl,gpu -device=adreno -max_num_threads=256", "depthwise_conv2d_nchwc.image2d", [["TENSOR", [1, 88, 20, 20], "float16"], ["TENSOR", [88, 1, 3, 3], "float16"], [1, 1], [1, 1, 1, 1], [1, 1], "float16"], {}], "config": {"index": 69533, "code_hash": null, "entity": [["tile_fc", "sp", [-1, 1, 22]], ["tile_y", "sp", [-1, 5, 1]], ["tile_x", "sp", [-1, 1, 10]], ["tile_ry", "sp", [-1, 3]], ["tile_rx", "sp", [-1, 3]], ["auto_unroll_max_step", "ot", 1500], ["unroll_explicit", "ot", 1]]}, "result": [[3.387708e-05], 0, 0.4995391368865967, 1643047897.029837], "version": 0.2, "tvm_version": "0.8.dev0"}
{"input": ["opencl -keys=adreno,opencl,gpu -device=adreno -max_num_threads=256", "conv2d_nchwc.image2d", [["TENSOR", [1, 88, 40, 40], "float16"], ["TENSOR", [88, 88, 1, 1], "float16"], [1, 1], [0, 0, 0, 0], [1, 1], "float16"], {}], "config": {"index": 10572, "code_hash": null, "entity": [["tile_fc", "sp", [-1, 1, 22]], ["tile_y", "sp", [-1, 4, 5]], ["tile_x", "sp", [-1, 2, 2]], ["tile_rcc", "sp", [-1, 1]], ["tile_ry", "sp", [-1, 1]], ["tile_rx", "sp", [-1, 1]], ["auto_unroll_max_step", "ot", 1500], ["unroll_explicit", "ot", 0]]}, "result": [[0.00010666876], 0, 0.821425199508667, 1643048085.6594262], "version": 0.2, "tvm_version": "0.8.dev0"}
{"input": ["opencl -keys=adreno,opencl,gpu -device=adreno -max_num_threads=256", "depthwise_conv2d_nchwc.image2d", [["TENSOR", [1, 88, 40, 40], "float16"], ["TENSOR", [88, 1, 3, 3], "float16"], [1, 1], [1, 1, 1, 1], [1, 1], "float16"], {}], "config": {"index": 151906, "code_hash": null, "entity": [["tile_fc", "sp", [-1, 1, 2]], ["tile_y", "sp", [-1, 1, 5]], ["tile_x", "sp", [-1, 1, 8]], ["tile_ry", "sp", [-1, 1]], ["tile_rx", "sp", [-1, 3]], ["auto_unroll_max_step", "ot", 512], ["unroll_explicit", "ot", 1]]}, "result": [[9.25802e-05], 0, 0.7880723476409912, 1643048861.0013554], "version": 0.2, "tvm_version": "0.8.dev0"}
{"input": ["opencl -keys=adreno,opencl,gpu -device=adreno -max_num_threads=256", "conv2d_nchwc.image2d", [["TENSOR", [1, 88, 40, 40], "float16"], ["TENSOR", [88, 88, 3, 3], "float16"], [1, 1], [1, 1, 1, 1], [1, 1], "float16"], {}], "config": {"index": 22663, "code_hash": null, "entity": [["tile_fc", "sp", [-1, 1, 22]], ["tile_y", "sp", [-1, 1, 2]], ["tile_x", "sp", [-1, 4, 5]], ["tile_rcc", "sp", [-1, 2]], ["tile_ry", "sp", [-1, 1]], ["tile_rx", "sp", [-1, 1]], ["auto_unroll_max_step", "ot", 512], ["unroll_explicit", "ot", 0]]}, "result": [[0.0005535822799999999], 0, 0.8252048492431641, 1643049656.2831562], "version": 0.2, "tvm_version": "0.8.dev0"}
{"input": ["opencl -keys=adreno,opencl,gpu -device=adreno -max_num_threads=256", "conv2d_nchwc.image2d", [["TENSOR", [1, 88, 40, 40], "float16"], ["TENSOR", [27, 88, 3, 3], "float16"], [1, 1], [1, 1, 1, 1], [1, 1], "float16"], {}], "config": {"index": 9152, "code_hash": null, "entity": [["tile_fc", "sp", [-1, 1, 7]], ["tile_y", "sp", [-1, 5, 4]], ["tile_x", "sp", [-1, 1, 8]], ["tile_rcc", "sp", [-1, 2]], ["tile_ry", "sp", [-1, 1]], ["tile_rx", "sp", [-1, 1]], ["auto_unroll_max_step", "ot", 512], ["unroll_explicit", "ot", 0]]}, "result": [[0.00026894374], 0, 0.775658130645752, 1643049814.7370887], "version": 0.2, "tvm_version": "0.8.dev0"}
