sd888_log/ww48/mobilenetv1.texture.float16.acc32.autotvm.log
{"input": ["opencl -keys=adreno,opencl,gpu -device=adreno -max_num_threads=256", "conv2d_nchw.cuda", [["TENSOR", [1, 3, 224, 224], "float16"], ["TENSOR", [32, 3, 3, 3], "float16"], [2, 2], [1, 1, 1, 1], [1, 1], "float16"], {}], "config": {"index": 4622330, "code_hash": null, "entity": [["tile_f", "sp", [-1, 2, 8, 2]], ["tile_y", "sp", [-1, 1, 2, 4]], ["tile_x", "sp", [-1, 1, 8, 1]], ["tile_rc", "sp", [-1, 1]], ["tile_ry", "sp", [-1, 1]], ["tile_rx", "sp", [-1, 3]], ["auto_unroll_max_step", "ot", 0], ["unroll_explicit", "ot", 0]]}, "result": [[0.00035265], 0, 5.8117828369140625, 1638815723.238151], "version": 0.2, "tvm_version": "0.8.dev0"}
{"input": ["opencl -keys=adreno,opencl,gpu -device=adreno -max_num_threads=256", "depthwise_conv2d_nchwc_acc32.image2d", [["TENSOR", [1, 8, 112, 112, 4], "float16"], ["TENSOR", [8, 1, 3, 3, 4], "float16"], [1, 1], [1, 1, 1, 1], [1, 1], "float16"], {}], "config": {"index": 8728080, "code_hash": null, "entity": [["tile_fc", "sp", [-1, 1, 1, 1]], ["tile_y", "sp", [-1, 1, 7, 1]], ["tile_x", "sp", [-1, 1, 16, 1]], ["tile_ry", "sp", [-1, 1]], ["tile_rx", "sp", [-1, 3]], ["auto_unroll_max_step", "ot", 1500], ["unroll_explicit", "ot", 1]]}, "result": [[0.000173025], 0, 1.1747033596038818, 1638820789.9272435], "version": 0.2, "tvm_version": "0.8.dev0"}
{"input": ["opencl -keys=adreno,opencl,gpu -device=adreno -max_num_threads=256", "conv2d_nchwc_acc32.image2d", [["TENSOR", [1, 8, 112, 112, 4], "float16"], ["TENSOR", [16, 32, 1, 1, 4], "float16"], [1, 1], [0, 0, 0, 0], [1, 1], "float16"], {}], "config": {"index": 22149, "code_hash": null, "entity": [["tile_fc", "sp", [-1, 1, 16]], ["tile_y", "sp", [-1, 4, 1]], ["tile_x", "sp", [-1, 1, 8]], ["tile_rcc", "sp", [-1, 8]], ["tile_ry", "sp", [-1, 1]], ["tile_rx", "sp", [-1, 1]], ["auto_unroll_max_step", "ot", 0], ["unroll_explicit", "ot", 0]]}, "result": [[0.00021661562], 0, 1.2978582382202148, 1638821987.7083871], "version": 0.2, "tvm_version": "0.8.dev0"}
{"input": ["opencl -keys=adreno,opencl,gpu -device=adreno -max_num_threads=256", "depthwise_conv2d_nchwc_acc32.image2d", [["TENSOR", [1, 16, 112, 112, 4], "float16"], ["TENSOR", [16, 1, 3, 3, 4], "float16"], [2, 2], [1, 1, 1, 1], [1, 1], "float16"], {}], "config": {"index": 4991245, "code_hash": null, "entity": [["tile_fc", "sp", [-1, 1, 1, 1]], ["tile_y", "sp", [-1, 1, 28, 2]], ["tile_x", "sp", [-1, 1, 8, 1]], ["tile_ry", "sp", [-1, 1]], ["tile_rx", "sp", [-1, 3]], ["auto_unroll_max_step", "ot", 1500], ["unroll_explicit", "ot", 1]]}, "result": [[0.0002512396], 0, 1.537172555923462, 1638824492.592667], "version": 0.2, "tvm_version": "0.8.dev0"}
{"input": ["opencl -keys=adreno,opencl,gpu -device=adreno -max_num_threads=256", "conv2d_nchwc_acc32.image2d", [["TENSOR", [1, 16, 56, 56, 4], "float16"], ["TENSOR", [32, 64, 1, 1, 4], "float16"], [1, 1], [0, 0, 0, 0], [1, 1], "float16"], {}], "config": {"index": 130999, "code_hash": null, "entity": [["tile_fc", "sp", [-1, 2, 8]], ["tile_y", "sp", [-1, 7, 4]], ["tile_x", "sp", [-1, 1, 4]], ["tile_rcc", "sp", [-1, 16]], ["tile_ry", "sp", [-1, 1]], ["tile_rx", "sp", [-1, 1]], ["auto_unroll_max_step", "ot", 512], ["unroll_explicit", "ot", 1]]}, "result": [[0.00017908646], 0, 2.2050468921661377, 1638825856.0916173], "version": 0.2, "tvm_version": "0.8.dev0"}
{"input": ["opencl -keys=adreno,opencl,gpu -device=adreno -max_num_threads=256", "depthwise_conv2d_nchwc_acc32.image2d", [["TENSOR", [1, 32, 56, 56, 4], "float16"], ["TENSOR", [32, 1, 3, 3, 4], "float16"], [1, 1], [1, 1, 1, 1], [1, 1], "float16"], {}], "config": {"index": 5627664, "code_hash": null, "entity": [["tile_fc", "sp", [-1, 1, 1, 1]], ["tile_y", "sp", [-1, 1, 4, 1]], ["tile_x", "sp", [-1, 1, 14, 4]], ["tile_ry", "sp", [-1, 3]], ["tile_rx", "sp", [-1, 3]], ["auto_unroll_max_step", "ot", 0], ["unroll_explicit", "ot", 1]]}, "result": [[0.00018093542000000002], 0, 1.401505708694458, 1638829622.5208948], "version": 0.2, "tvm_version": "0.8.dev0"}
{"input": ["opencl -keys=adreno,opencl,gpu -device=adreno -max_num_threads=256", "conv2d_nchwc_acc32.image2d", [["TENSOR", [1, 32, 56, 56, 4], "float16"], ["TENSOR", [32, 128, 1, 1, 4], "float16"], [1, 1], [0, 0, 0, 0], [1, 1], "float16"], {}], "config": {"index": 60937, "code_hash": null, "entity": [["tile_fc", "sp", [-1, 1, 32]], ["tile_y", "sp", [-1, 4, 1]], ["tile_x", "sp", [-1, 1, 4]], ["tile_rcc", "sp", [-1, 32]], ["tile_ry", "sp", [-1, 1]], ["tile_rx", "sp", [-1, 1]], ["auto_unroll_max_step", "ot", 512], ["unroll_explicit", "ot", 0]]}, "result": [[0.00031950938], 0, 3.5443012714385986, 1638830675.530047], "version": 0.2, "tvm_version": "0.8.dev0"}
{"input": ["opencl -keys=adreno,opencl,gpu -device=adreno -max_num_threads=256", "depthwise_conv2d_nchwc_acc32.image2d", [["TENSOR", [1, 32, 56, 56, 4], "float16"], ["TENSOR", [32, 1, 3, 3, 4], "float16"], [2, 2], [1, 1, 1, 1], [1, 1], "float16"], {}], "config": {"index": 919083, "code_hash": null, "entity": [["tile_fc", "sp", [-1, 1, 4, 1]], ["tile_y", "sp", [-1, 1, 7, 1]], ["tile_x", "sp", [-1, 1, 4, 1]], ["tile_ry", "sp", [-1, 1]], ["tile_rx", "sp", [-1, 3]], ["auto_unroll_max_step", "ot", 1500], ["unroll_explicit", "ot", 0]]}, "result": [[0.00014123022000000002], 0, 1.0439269542694092, 1638832846.9895885], "version": 0.2, "tvm_version": "0.8.dev0"}
{"input": ["opencl -keys=adreno,opencl,gpu -device=adreno -max_num_threads=256", "conv2d_nchwc_acc32.image2d", [["TENSOR", [1, 32, 28, 28, 4], "float16"], ["TENSOR", [64, 128, 1, 1, 4], "float16"], [1, 1], [0, 0, 0, 0], [1, 1], "float16"], {}], "config": {"index": 70861, "code_hash": null, "entity": [["tile_fc", "sp", [-1, 1, 32]], ["tile_y", "sp", [-1, 1, 2]], ["tile_x", "sp", [-1, 4, 7]], ["tile_rcc", "sp", [-1, 32]], ["tile_ry", "sp", [-1, 1]], ["tile_rx", "sp", [-1, 1]], ["auto_unroll_max_step", "ot", 0], ["unroll_explicit", "ot", 1]]}, "result": [[0.00017002188000000002], 0, 1.1304638385772705, 1638834577.753685], "version": 0.2, "tvm_version": "0.8.dev0"}
{"input": ["opencl -keys=adreno,opencl,gpu -device=adreno -max_num_threads=256", "depthwise_conv2d_nchwc_acc32.image2d", [["TENSOR", [1, 64, 28, 28, 4], "float16"], ["TENSOR", [64, 1, 3, 3, 4], "float16"], [1, 1], [1, 1, 1, 1], [1, 1], "float16"], {}], "config": {"index": 444373, "code_hash": null, "entity": [["tile_fc", "sp", [-1, 1, 4, 1]], ["tile_y", "sp", [-1, 1, 4, 1]], ["tile_x", "sp", [-1, 1, 7, 1]], ["tile_ry", "sp", [-1, 3]], ["tile_rx", "sp", [-1, 3]], ["auto_unroll_max_step", "ot", 0], ["unroll_explicit", "ot", 0]]}, "result": [[0.00010603228], 0, 2.0403618812561035, 1638835792.6797814], "version": 0.2, "tvm_version": "0.8.dev0"}
{"input": ["opencl -keys=adreno,opencl,gpu -device=adreno -max_num_threads=256", "conv2d_nchwc_acc32.image2d", [["TENSOR", [1, 64, 28, 28, 4], "float16"], ["TENSOR", [64, 256, 1, 1, 4], "float16"], [1, 1], [0, 0, 0, 0], [1, 1], "float16"], {}], "config": {"index": 82728, "code_hash": null, "entity": [["tile_fc", "sp", [-1, 1, 64]], ["tile_y", "sp", [-1, 1, 1]], ["tile_x", "sp", [-1, 4, 7]], ["tile_rcc", "sp", [-1, 64]], ["tile_ry", "sp", [-1, 1]], ["tile_rx", "sp", [-1, 1]], ["auto_unroll_max_step", "ot", 0], ["unroll_explicit", "ot", 1]]}, "result": [[0.00030680729999999997], 0, 2.280212879180908, 1638838881.402411], "version": 0.2, "tvm_version": "0.8.dev0"}
{"input": ["opencl -keys=adreno,opencl,gpu -device=adreno -max_num_threads=256", "depthwise_conv2d_nchwc_acc32.image2d", [["TENSOR", [1, 64, 28, 28, 4], "float16"], ["TENSOR", [64, 1, 3, 3, 4], "float16"], [2, 2], [1, 1, 1, 1], [1, 1], "float16"], {}], "config": {"index": 72598, "code_hash": null, "entity": [["tile_fc", "sp", [-1, 1, 16, 1]], ["tile_y", "sp", [-1, 1, 1, 1]], ["tile_x", "sp", [-1, 1, 7, 1]], ["tile_ry", "sp", [-1, 3]], ["tile_rx", "sp", [-1, 3]], ["auto_unroll_max_step", "ot", 0], ["unroll_explicit", "ot", 0]]}, "result": [[8.563435999999998e-05], 0, 1.9691047668457031, 1638840024.7302701], "version": 0.2, "tvm_version": "0.8.dev0"}
{"input": ["opencl -keys=adreno,opencl,gpu -device=adreno -max_num_threads=256", "conv2d_nchwc_acc32.image2d", [["TENSOR", [1, 64, 14, 14, 4], "float16"], ["TENSOR", [128, 256, 1, 1, 4], "float16"], [1, 1], [0, 0, 0, 0], [1, 1], "float16"], {}], "config": {"index": 21643, "code_hash": null, "entity": [["tile_fc", "sp", [-1, 1, 32]], ["tile_y", "sp", [-1, 1, 1]], ["tile_x", "sp", [-1, 4, 4]], ["tile_rcc", "sp", [-1, 1]], ["tile_ry", "sp", [-1, 1]], ["tile_rx", "sp", [-1, 1]], ["auto_unroll_max_step", "ot", 512], ["unroll_explicit", "ot", 0]]}, "result": [[0.00019983022], 0, 0.9386124610900879, 1638842103.6722517], "version": 0.2, "tvm_version": "0.8.dev0"}
{"input": ["opencl -keys=adreno,opencl,gpu -device=adreno -max_num_threads=256", "depthwise_conv2d_nchwc_acc32.image2d", [["TENSOR", [1, 128, 14, 14, 4], "float16"], ["TENSOR", [128, 1, 3, 3, 4], "float16"], [1, 1], [1, 1, 1, 1], [1, 1], "float16"], {}], "config": {"index": 73515, "code_hash": null, "entity": [["tile_fc", "sp", [-1, 1, 4, 4]], ["tile_y", "sp", [-1, 1, 2, 1]], ["tile_x", "sp", [-1, 1, 7, 1]], ["tile_ry", "sp", [-1, 1]], ["tile_rx", "sp", [-1, 3]], ["auto_unroll_max_step", "ot", 0], ["unroll_explicit", "ot", 0]]}, "result": [[7.941146e-05], 0, 2.118830680847168, 1638842880.586311], "version": 0.2, "tvm_version": "0.8.dev0"}
{"input": ["opencl -keys=adreno,opencl,gpu -device=adreno -max_num_threads=256", "conv2d_nchwc_acc32.image2d", [["TENSOR", [1, 128, 14, 14, 4], "float16"], ["TENSOR", [128, 512, 1, 1, 4], "float16"], [1, 1], [0, 0, 0, 0], [1, 1], "float16"], {}], "config": {"index": 68126, "code_hash": null, "entity": [["tile_fc", "sp", [-1, 1, 16]], ["tile_y", "sp", [-1, 4, 4]], ["tile_x", "sp", [-1, 1, 2]], ["tile_rcc", "sp", [-1, 1]], ["tile_ry", "sp", [-1, 1]], ["tile_rx", "sp", [-1, 1]], ["auto_unroll_max_step", "ot", 0], ["unroll_explicit", "ot", 1]]}, "result": [[0.00036815624], 0, 2.3194711208343506, 1638845356.1969182], "version": 0.2, "tvm_version": "0.8.dev0"}
{"input": ["opencl -keys=adreno,opencl,gpu -device=adreno -max_num_threads=256", "depthwise_conv2d_nchwc_acc32.image2d", [["TENSOR", [1, 128, 14, 14, 4], "float16"], ["TENSOR", [128, 1, 3, 3, 4], "float16"], [2, 2], [1, 1, 1, 1], [1, 1], "float16"], {}], "config": {"index": 23073, "code_hash": null, "entity": [["tile_fc", "sp", [-1, 1, 64, 1]], ["tile_y", "sp", [-1, 1, 1, 1]], ["tile_x", "sp", [-1, 1, 1, 1]], ["tile_ry", "sp", [-1, 1]], ["tile_rx", "sp", [-1, 1]], ["auto_unroll_max_step", "ot", 0], ["unroll_explicit", "ot", 1]]}, "result": [[6.722188e-05], 0, 0.8832752704620361, 1638845997.658829], "version": 0.2, "tvm_version": "0.8.dev0"}
{"input": ["opencl -keys=adreno,opencl,gpu -device=adreno -max_num_threads=256", "conv2d_nchwc_acc32.image2d", [["TENSOR", [1, 128, 7, 7, 4], "float16"], ["TENSOR", [256, 512, 1, 1, 4], "float16"], [1, 1], [0, 0, 0, 0], [1, 1], "float16"], {}], "config": {"index": 39276, "code_hash": null, "entity": [["tile_fc", "sp", [-1, 1, 64]], ["tile_y", "sp", [-1, 1, 2]], ["tile_x", "sp", [-1, 4, 2]], ["tile_rcc", "sp", [-1, 1]], ["tile_ry", "sp", [-1, 1]], ["tile_rx", "sp", [-1, 1]], ["auto_unroll_max_step", "ot", 0], ["unroll_explicit", "ot", 1]]}, "result": [[0.00028512084], 0, 1.1475303173065186, 1638847078.9211109], "version": 0.2, "tvm_version": "0.8.dev0"}
{"input": ["opencl -keys=adreno,opencl,gpu -device=adreno -max_num_threads=256", "depthwise_conv2d_nchwc_acc32.image2d", [["TENSOR", [1, 256, 7, 7, 4], "float16"], ["TENSOR", [256, 1, 3, 3, 4], "float16"], [1, 1], [1, 1, 1, 1], [1, 1], "float16"], {}], "config": {"index": 28095, "code_hash": null, "entity": [["tile_fc", "sp", [-1, 1, 1, 2]], ["tile_y", "sp", [-1, 1, 7, 1]], ["tile_x", "sp", [-1, 1, 7, 1]], ["tile_ry", "sp", [-1, 1]], ["tile_rx", "sp", [-1, 3]], ["auto_unroll_max_step", "ot", 1500], ["unroll_explicit", "ot", 0]]}, "result": [[6.725834e-05], 0, 1.8121616840362549, 1638848048.527655], "version": 0.2, "tvm_version": "0.8.dev0"}
{"input": ["opencl -keys=adreno,opencl,gpu -device=adreno -max_num_threads=256", "conv2d_nchwc_acc32.image2d", [["TENSOR", [1, 256, 7, 7, 4], "float16"], ["TENSOR", [256, 1024, 1, 1, 4], "float16"], [1, 1], [0, 0, 0, 0], [1, 1], "float16"], {}], "config": {"index": 876, "code_hash": null, "entity": [["tile_fc", "sp", [-1, 1, 64]], ["tile_y", "sp", [-1, 1, 2]], ["tile_x", "sp", [-1, 4, 2]], ["tile_rcc", "sp", [-1, 1]], ["tile_ry", "sp", [-1, 1]], ["tile_rx", "sp", [-1, 1]], ["auto_unroll_max_step", "ot", 0], ["unroll_explicit", "ot", 0]]}, "result": [[0.00055437188], 0, 3.0740127563476562, 1638849245.8619974], "version": 0.2, "tvm_version": "0.8.dev0"}
{"input": ["opencl -keys=adreno,opencl,gpu -device=adreno -max_num_threads=256", "dense_small_batch.cuda", [["TENSOR", [1, 1024], "float16"], ["TENSOR", [1000, 1024], "float16"], null, "float16"], {}], "config": {"index": 6, "code_hash": null, "entity": [["tile_k", "sp", [-1, 64]]]}, "result": [[0.00016056145999999996], 0, 1.3228023052215576, 1638849813.96787], "version": 0.2, "tvm_version": "0.8.dev0"}
