sd888_log/ww48/mobilenetv1.texture.float16.acc32.autotvm.log.tmp
{"input": ["opencl -keys=adreno,opencl,gpu -device=adreno -max_num_threads=256", "conv2d_nchw.cuda", [["TENSOR", [1, 3, 224, 224], "float16"], ["TENSOR", [32, 3, 3, 3], "float16"], [2, 2], [1, 1, 1, 1], [1, 1], "float16"], {}], "config": {"index": 7796107, "code_hash": null, "entity": [["tile_f", "sp", [-1, 1, 4, 1]], ["tile_y", "sp", [-1, 7, 2, 2]], ["tile_x", "sp", [-1, 8, 2, 1]], ["tile_rc", "sp", [-1, 3]], ["tile_ry", "sp", [-1, 3]], ["tile_rx", "sp", [-1, 3]], ["auto_unroll_max_step", "ot", 0], ["unroll_explicit", "ot", 0]]}, "result": [[0.02787163332], 0, 6.141202449798584, 1638813311.9786582], "version": 0.2, "tvm_version": "0.8.dev0"}
{"input": ["opencl -keys=adreno,opencl,gpu -device=adreno -max_num_threads=256", "conv2d_nchw.cuda", [["TENSOR", [1, 3, 224, 224], "float16"], ["TENSOR", [32, 3, 3, 3], "float16"], [2, 2], [1, 1, 1, 1], [1, 1], "float16"], {}], "config": {"index": 2546213, "code_hash": null, "entity": [["tile_f", "sp", [-1, 32, 1, 1]], ["tile_y", "sp", [-1, 1, 1, 8]], ["tile_x", "sp", [-1, 1, 112, 1]], ["tile_rc", "sp", [-1, 1]], ["tile_ry", "sp", [-1, 3]], ["tile_rx", "sp", [-1, 1]], ["auto_unroll_max_step", "ot", 0], ["unroll_explicit", "ot", 0]]}, "result": [[0.01531157394], 0, 9.290044784545898, 1638813315.3243668], "version": 0.2, "tvm_version": "0.8.dev0"}
{"input": ["opencl -keys=adreno,opencl,gpu -device=adreno -max_num_threads=256", "conv2d_nchw.cuda", [["TENSOR", [1, 3, 224, 224], "float16"], ["TENSOR", [32, 3, 3, 3], "float16"], [2, 2], [1, 1, 1, 1], [1, 1], "float16"], {}], "config": {"index": 42064590, "code_hash": null, "entity": [["tile_f", "sp", [-1, 2, 1, 2]], ["tile_y", "sp", [-1, 1, 2, 2]], ["tile_x", "sp", [-1, 1, 1, 2]], ["tile_rc", "sp", [-1, 1]], ["tile_ry", "sp", [-1, 3]], ["tile_rx", "sp", [-1, 3]], ["auto_unroll_max_step", "ot", 512], ["unroll_explicit", "ot", 1]]}, "result": [[0.04972626562], 0, 8.887578964233398, 1638813324.4402394], "version": 0.2, "tvm_version": "0.8.dev0"}
{"input": ["opencl -keys=adreno,opencl,gpu -device=adreno -max_num_threads=256", "conv2d_nchw.cuda", [["TENSOR", [1, 3, 224, 224], "float16"], ["TENSOR", [32, 3, 3, 3], "float16"], [2, 2], [1, 1, 1, 1], [1, 1], "float16"], {}], "config": {"index": 29786424, "code_hash": null, "entity": [["tile_f", "sp", [-1, 8, 1, 2]], ["tile_y", "sp", [-1, 2, 28, 1]], ["tile_x", "sp", [-1, 2, 4, 1]], ["tile_rc", "sp", [-1, 3]], ["tile_ry", "sp", [-1, 3]], ["tile_rx", "sp", [-1, 1]], ["auto_unroll_max_step", "ot", 0], ["unroll_explicit", "ot", 1]]}, "result": [[0.0263822854], 0, 5.236599922180176, 1638813329.9351828], "version": 0.2, "tvm_version": "0.8.dev0"}
{"input": ["opencl -keys=adreno,opencl,gpu -device=adreno -max_num_threads=256", "conv2d_nchw.cuda", [["TENSOR", [1, 3, 224, 224], "float16"], ["TENSOR", [32, 3, 3, 3], "float16"], [2, 2], [1, 1, 1, 1], [1, 1], "float16"], {}], "config": {"index": 33697846, "code_hash": null, "entity": [["tile_f", "sp", [-1, 8, 4, 1]], ["tile_y", "sp", [-1, 8, 7, 1]], ["tile_x", "sp", [-1, 1, 2, 7]], ["tile_rc", "sp", [-1, 1]], ["tile_ry", "sp", [-1, 3]], ["tile_rx", "sp", [-1, 3]], ["auto_unroll_max_step", "ot", 0], ["unroll_explicit", "ot", 1]]}, "result": [[0.0364609427], 0, 7.021733283996582, 1638813337.2234259], "version": 0.2, "tvm_version": "0.8.dev0"}
{"input": ["opencl -keys=adreno,opencl,gpu -device=adreno -max_num_threads=256", "conv2d_nchw.cuda", [["TENSOR", [1, 3, 224, 224], "float16"], ["TENSOR", [32, 3, 3, 3], "float16"], [2, 2], [1, 1, 1, 1], [1, 1], "float16"], {}], "config": {"index": 31382913, "code_hash": null, "entity": [["tile_f", "sp", [-1, 8, 2, 1]], ["tile_y", "sp", [-1, 1, 7, 16]], ["tile_x", "sp", [-1, 2, 2, 4]], ["tile_rc", "sp", [-1, 1]], ["tile_ry", "sp", [-1, 1]], ["tile_rx", "sp", [-1, 3]], ["auto_unroll_max_step", "ot", 0], ["unroll_explicit", "ot", 1]]}, "result": [[0.03449180416], 0, 6.496192693710327, 1638813391.6204925], "version": 0.2, "tvm_version": "0.8.dev0"}
{"input": ["opencl -keys=adreno,opencl,gpu -device=adreno -max_num_threads=256", "conv2d_nchw.cuda", [["TENSOR", [1, 3, 224, 224], "float16"], ["TENSOR", [32, 3, 3, 3], "float16"], [2, 2], [1, 1, 1, 1], [1, 1], "float16"], {}], "config": {"index": 1329764, "code_hash": null, "entity": [["tile_f", "sp", [-1, 2, 4, 4]], ["tile_y", "sp", [-1, 1, 4, 4]], ["tile_x", "sp", [-1, 1, 8, 1]], ["tile_rc", "sp", [-1, 3]], ["tile_ry", "sp", [-1, 1]], ["tile_rx", "sp", [-1, 1]], ["auto_unroll_max_step", "ot", 0], ["unroll_explicit", "ot", 0]]}, "result": [[0.00256832396], 0, 1.8914103507995605, 1638813397.39051], "version": 0.2, "tvm_version": "0.8.dev0"}
{"input": ["opencl -keys=adreno,opencl,gpu -device=adreno -max_num_threads=256", "conv2d_nchw.cuda", [["TENSOR", [1, 3, 224, 224], "float16"], ["TENSOR", [32, 3, 3, 3], "float16"], [2, 2], [1, 1, 1, 1], [1, 1], "float16"], {}], "config": {"index": 23575639, "code_hash": null, "entity": [["tile_f", "sp", [-1, 2, 4, 2]], ["tile_y", "sp", [-1, 7, 2, 1]], ["tile_x", "sp", [-1, 1, 8, 2]], ["tile_rc", "sp", [-1, 3]], ["tile_ry", "sp", [-1, 1]], ["tile_rx", "sp", [-1, 3]], ["auto_unroll_max_step", "ot", 1500], ["unroll_explicit", "ot", 0]]}, "result": [[0.01913803124], 0, 4.130160331726074, 1638813446.2673986], "version": 0.2, "tvm_version": "0.8.dev0"}
{"input": ["opencl -keys=adreno,opencl,gpu -device=adreno -max_num_threads=256", "conv2d_nchw.cuda", [["TENSOR", [1, 3, 224, 224], "float16"], ["TENSOR", [32, 3, 3, 3], "float16"], [2, 2], [1, 1, 1, 1], [1, 1], "float16"], {}], "config": {"index": 25253078, "code_hash": null, "entity": [["tile_f", "sp", [-1, 1, 1, 8]], ["tile_y", "sp", [-1, 28, 1, 1]], ["tile_x", "sp", [-1, 2, 1, 1]], ["tile_rc", "sp", [-1, 3]], ["tile_ry", "sp", [-1, 3]], ["tile_rx", "sp", [-1, 3]], ["auto_unroll_max_step", "ot", 1500], ["unroll_explicit", "ot", 0]]}, "result": [[0.07887650934], 0, 17.034932851791382, 1638813459.234413], "version": 0.2, "tvm_version": "0.8.dev0"}
{"input": ["opencl -keys=adreno,opencl,gpu -device=adreno -max_num_threads=256", "conv2d_nchw.cuda", [["TENSOR", [1, 3, 224, 224], "float16"], ["TENSOR", [32, 3, 3, 3], "float16"], [2, 2], [1, 1, 1, 1], [1, 1], "float16"], {}], "config": {"index": 42501677, "code_hash": null, "entity": [["tile_f", "sp", [-1, 8, 2, 2]], ["tile_y", "sp", [-1, 1, 4, 1]], ["tile_x", "sp", [-1, 8, 2, 7]], ["tile_rc", "sp", [-1, 1]], ["tile_ry", "sp", [-1, 3]], ["tile_rx", "sp", [-1, 3]], ["auto_unroll_max_step", "ot", 512], ["unroll_explicit", "ot", 1]]}, "result": [[0.03985054478], 0, 14.196794986724854, 1638813473.6984746], "version": 0.2, "tvm_version": "0.8.dev0"}
{"input": ["opencl -keys=adreno,opencl,gpu -device=adreno -max_num_threads=256", "conv2d_nchw.cuda", [["TENSOR", [1, 3, 224, 224], "float16"], ["TENSOR", [32, 3, 3, 3], "float16"], [2, 2], [1, 1, 1, 1], [1, 1], "float16"], {}], "config": {"index": 23530475, "code_hash": null, "entity": [["tile_f", "sp", [-1, 8, 1, 1]], ["tile_y", "sp", [-1, 4, 1, 2]], ["tile_x", "sp", [-1, 7, 4, 2]], ["tile_rc", "sp", [-1, 3]], ["tile_ry", "sp", [-1, 1]], ["tile_rx", "sp", [-1, 3]], ["auto_unroll_max_step", "ot", 1500], ["unroll_explicit", "ot", 0]]}, "result": [[0.07929043226], 0, 14.714175462722778, 1638813488.6254115], "version": 0.2, "tvm_version": "0.8.dev0"}
{"input": ["opencl -keys=adreno,opencl,gpu -device=adreno -max_num_threads=256", "conv2d_nchw.cuda", [["TENSOR", [1, 3, 224, 224], "float16"], ["TENSOR", [32, 3, 3, 3], "float16"], [2, 2], [1, 1, 1, 1], [1, 1], "float16"], {}], "config": {"index": 47737784, "code_hash": null, "entity": [["tile_f", "sp", [-1, 8, 1, 2]], ["tile_y", "sp", [-1, 1, 1, 1]], ["tile_x", "sp", [-1, 1, 14, 2]], ["tile_rc", "sp", [-1, 3]], ["tile_ry", "sp", [-1, 3]], ["tile_rx", "sp", [-1, 1]], ["auto_unroll_max_step", "ot", 1500], ["unroll_explicit", "ot", 1]]}, "result": [[0.010155917720000001], 0, 4.896236896514893, 1638813507.037465], "version": 0.2, "tvm_version": "0.8.dev0"}
{"input": ["opencl -keys=adreno,opencl,gpu -device=adreno -max_num_threads=256", "conv2d_nchw.cuda", [["TENSOR", [1, 3, 224, 224], "float16"], ["TENSOR", [32, 3, 3, 3], "float16"], [2, 2], [1, 1, 1, 1], [1, 1], "float16"], {}], "config": {"index": 14127713, "code_hash": null, "entity": [["tile_f", "sp", [-1, 1, 8, 2]], ["tile_y", "sp", [-1, 1, 1, 1]], ["tile_x", "sp", [-1, 2, 2, 14]], ["tile_rc", "sp", [-1, 1]], ["tile_ry", "sp", [-1, 1]], ["tile_rx", "sp", [-1, 3]], ["auto_unroll_max_step", "ot", 512], ["unroll_explicit", "ot", 0]]}, "result": [[0.015193568740000002], 0, 3.44012451171875, 1638813510.932125], "version": 0.2, "tvm_version": "0.8.dev0"}
{"input": ["opencl -keys=adreno,opencl,gpu -device=adreno -max_num_threads=256", "conv2d_nchw.cuda", [["TENSOR", [1, 3, 224, 224], "float16"], ["TENSOR", [32, 3, 3, 3], "float16"], [2, 2], [1, 1, 1, 1], [1, 1], "float16"], {}], "config": {"index": 1673227, "code_hash": null, "entity": [["tile_f", "sp", [-1, 8, 1, 1]], ["tile_y", "sp", [-1, 1, 4, 2]], ["tile_x", "sp", [-1, 2, 28, 2]], ["tile_rc", "sp", [-1, 3]], ["tile_ry", "sp", [-1, 1]], ["tile_rx", "sp", [-1, 1]], ["auto_unroll_max_step", "ot", 0], ["unroll_explicit", "ot", 0]]}, "result": [[0.014455202079999998], 0, 3.5850679874420166, 1638813540.1080194], "version": 0.2, "tvm_version": "0.8.dev0"}
{"input": ["opencl -keys=adreno,opencl,gpu -device=adreno -max_num_threads=256", "conv2d_nchw.cuda", [["TENSOR", [1, 3, 224, 224], "float16"], ["TENSOR", [32, 3, 3, 3], "float16"], [2, 2], [1, 1, 1, 1], [1, 1], "float16"], {}], "config": {"index": 10383915, "code_hash": null, "entity": [["tile_f", "sp", [-1, 8, 1, 1]], ["tile_y", "sp", [-1, 1, 8, 2]], ["tile_x", "sp", [-1, 2, 7, 2]], ["tile_rc", "sp", [-1, 3]], ["tile_ry", "sp", [-1, 1]], ["tile_rx", "sp", [-1, 1]], ["auto_unroll_max_step", "ot", 512], ["unroll_explicit", "ot", 0]]}, "result": [[0.01259817188], 0, 3.8913846015930176, 1638813560.4295168], "version": 0.2, "tvm_version": "0.8.dev0"}
{"input": ["opencl -keys=adreno,opencl,gpu -device=adreno -max_num_threads=256", "conv2d_nchw.cuda", [["TENSOR", [1, 3, 224, 224], "float16"], ["TENSOR", [32, 3, 3, 3], "float16"], [2, 2], [1, 1, 1, 1], [1, 1], "float16"], {}], "config": {"index": 8128799, "code_hash": null, "entity": [["tile_f", "sp", [-1, 2, 2, 1]], ["tile_y", "sp", [-1, 1, 1, 14]], ["tile_x", "sp", [-1, 7, 2, 2]], ["tile_rc", "sp", [-1, 3]], ["tile_ry", "sp", [-1, 3]], ["tile_rx", "sp", [-1, 3]], ["auto_unroll_max_step", "ot", 0], ["unroll_explicit", "ot", 0]]}, "result": [[0.02600478854], 0, 5.375739097595215, 1638813566.057068], "version": 0.2, "tvm_version": "0.8.dev0"}
{"input": ["opencl -keys=adreno,opencl,gpu -device=adreno -max_num_threads=256", "conv2d_nchw.cuda", [["TENSOR", [1, 3, 224, 224], "float16"], ["TENSOR", [32, 3, 3, 3], "float16"], [2, 2], [1, 1, 1, 1], [1, 1], "float16"], {}], "config": {"index": 14954517, "code_hash": null, "entity": [["tile_f", "sp", [-1, 2, 1, 16]], ["tile_y", "sp", [-1, 2, 7, 2]], ["tile_x", "sp", [-1, 1, 7, 4]], ["tile_rc", "sp", [-1, 3]], ["tile_ry", "sp", [-1, 1]], ["tile_rx", "sp", [-1, 3]], ["auto_unroll_max_step", "ot", 512], ["unroll_explicit", "ot", 0]]}, "result": [[0.00483222812], 0, 1.9778389930725098, 1638813568.2946856], "version": 0.2, "tvm_version": "0.8.dev0"}
{"input": ["opencl -keys=adreno,opencl,gpu -device=adreno -max_num_threads=256", "conv2d_nchw.cuda", [["TENSOR", [1, 3, 224, 224], "float16"], ["TENSOR", [32, 3, 3, 3], "float16"], [2, 2], [1, 1, 1, 1], [1, 1], "float16"], {}], "config": {"index": 16564482, "code_hash": null, "entity": [["tile_f", "sp", [-1, 1, 16, 1]], ["tile_y", "sp", [-1, 1, 7, 8]], ["tile_x", "sp", [-1, 4, 2, 1]], ["tile_rc", "sp", [-1, 3]], ["tile_ry", "sp", [-1, 3]], ["tile_rx", "sp", [-1, 3]], ["auto_unroll_max_step", "ot", 512], ["unroll_explicit", "ot", 0]]}, "result": [[0.01877529688], 0, 3.9168014526367188, 1638813572.6043825], "version": 0.2, "tvm_version": "0.8.dev0"}
{"input": ["opencl -keys=adreno,opencl,gpu -device=adreno -max_num_threads=256", "conv2d_nchw.cuda", [["TENSOR", [1, 3, 224, 224], "float16"], ["TENSOR", [32, 3, 3, 3], "float16"], [2, 2], [1, 1, 1, 1], [1, 1], "float16"], {}], "config": {"index": 3125826, "code_hash": null, "entity": [["tile_f", "sp", [-1, 1, 16, 1]], ["tile_y", "sp", [-1, 1, 2, 7]], ["tile_x", "sp", [-1, 2, 1, 14]], ["tile_rc", "sp", [-1, 1]], ["tile_ry", "sp", [-1, 3]], ["tile_rx", "sp", [-1, 1]], ["auto_unroll_max_step", "ot", 0], ["unroll_explicit", "ot", 0]]}, "result": [[0.01415510938], 0, 3.693207263946533, 1638813576.569473], "version": 0.2, "tvm_version": "0.8.dev0"}
{"input": ["opencl -keys=adreno,opencl,gpu -device=adreno -max_num_threads=256", "conv2d_nchw.cuda", [["TENSOR", [1, 3, 224, 224], "float16"], ["TENSOR", [32, 3, 3, 3], "float16"], [2, 2], [1, 1, 1, 1], [1, 1], "float16"], {}], "config": {"index": 46767310, "code_hash": null, "entity": [["tile_f", "sp", [-1, 1, 4, 2]], ["tile_y", "sp", [-1, 2, 8, 1]], ["tile_x", "sp", [-1, 1, 4, 4]], ["tile_rc", "sp", [-1, 1]], ["tile_ry", "sp", [-1, 3]], ["tile_rx", "sp", [-1, 1]], ["auto_unroll_max_step", "ot", 1500], ["unroll_explicit", "ot", 1]]}, "result": [[0.0017959281200000002], 0, 3.46677827835083, 1638813580.2785487], "version": 0.2, "tvm_version": "0.8.dev0"}
{"input": ["opencl -keys=adreno,opencl,gpu -device=adreno -max_num_threads=256", "conv2d_nchw.cuda", [["TENSOR", [1, 3, 224, 224], "float16"], ["TENSOR", [32, 3, 3, 3], "float16"], [2, 2], [1, 1, 1, 1], [1, 1], "float16"], {}], "config": {"index": 17612321, "code_hash": null, "entity": [["tile_f", "sp", [-1, 2, 2, 4]], ["tile_y", "sp", [-1, 4, 7, 2]], ["tile_x", "sp", [-1, 16, 1, 1]], ["tile_rc", "sp", [-1, 1]], ["tile_ry", "sp", [-1, 1]], ["tile_rx", "sp", [-1, 1]], ["auto_unroll_max_step", "ot", 1500], ["unroll_explicit", "ot", 0]]}, "result": [[0.020887495819999997], 0, 6.515227317810059, 1638813584.485035], "version": 0.2, "tvm_version": "0.8.dev0"}
{"input": ["opencl -keys=adreno,opencl,gpu -device=adreno -max_num_threads=256", "conv2d_nchw.cuda", [["TENSOR", [1, 3, 224, 224], "float16"], ["TENSOR", [32, 3, 3, 3], "float16"], [2, 2], [1, 1, 1, 1], [1, 1], "float16"], {}], "config": {"index": 48806566, "code_hash": null, "entity": [["tile_f", "sp", [-1, 1, 1, 8]], ["tile_y", "sp", [-1, 1, 1, 2]], ["tile_x", "sp", [-1, 4, 7, 2]], ["tile_rc", "sp", [-1, 1]], ["tile_ry", "sp", [-1, 1]], ["tile_rx", "sp", [-1, 3]], ["auto_unroll_max_step", "ot", 1500], ["unroll_explicit", "ot", 1]]}, "result": [[0.03792528956], 0, 13.691344022750854, 1638813606.058249], "version": 0.2, "tvm_version": "0.8.dev0"}
{"input": ["opencl -keys=adreno,opencl,gpu -device=adreno -max_num_threads=256", "conv2d_nchw.cuda", [["TENSOR", [1, 3, 224, 224], "float16"], ["TENSOR", [32, 3, 3, 3], "float16"], [2, 2], [1, 1, 1, 1], [1, 1], "float16"], {}], "config": {"index": 28864327, "code_hash": null, "entity": [["tile_f", "sp", [-1, 4, 1, 2]], ["tile_y", "sp", [-1, 2, 1, 7]], ["tile_x", "sp", [-1, 4, 28, 1]], ["tile_rc", "sp", [-1, 1]], ["tile_ry", "sp", [-1, 3]], ["tile_rx", "sp", [-1, 1]], ["auto_unroll_max_step", "ot", 0], ["unroll_explicit", "ot", 1]]}, "result": [[0.01821876456], 0, 3.9686951637268066, 1638813626.1801915], "version": 0.2, "tvm_version": "0.8.dev0"}
{"input": ["opencl -keys=adreno,opencl,gpu -device=adreno -max_num_threads=256", "conv2d_nchw.cuda", [["TENSOR", [1, 3, 224, 224], "float16"], ["TENSOR", [32, 3, 3, 3], "float16"], [2, 2], [1, 1, 1, 1], [1, 1], "float16"], {}], "config": {"index": 5598788, "code_hash": null, "entity": [["tile_f", "sp", [-1, 1, 32, 1]], ["tile_y", "sp", [-1, 1, 4, 1]], ["tile_x", "sp", [-1, 8, 2, 1]], ["tile_rc", "sp", [-1, 3]], ["tile_ry", "sp", [-1, 1]], ["tile_rx", "sp", [-1, 3]], ["auto_unroll_max_step", "ot", 0], ["unroll_explicit", "ot", 0]]}, "result": [[0.0013822302], 0, 5.484501838684082, 1638813627.7004597], "version": 0.2, "tvm_version": "0.8.dev0"}
{"input": ["opencl -keys=adreno,opencl,gpu -device=adreno -max_num_threads=256", "conv2d_nchw.cuda", [["TENSOR", [1, 3, 224, 224], "float16"], ["TENSOR", [32, 3, 3, 3], "float16"], [2, 2], [1, 1, 1, 1], [1, 1], "float16"], {}], "config": {"index": 9585351, "code_hash": null, "entity": [["tile_f", "sp", [-1, 1, 1, 32]], ["tile_y", "sp", [-1, 7, 4, 4]], ["tile_x", "sp", [-1, 1, 4, 7]], ["tile_rc", "sp", [-1, 1]], ["tile_ry", "sp", [-1, 1]], ["tile_rx", "sp", [-1, 1]], ["auto_unroll_max_step", "ot", 512], ["unroll_explicit", "ot", 0]]}, "result": [[0.041748139579999996], 0, 7.543253660202026, 1638813635.6167803], "version": 0.2, "tvm_version": "0.8.dev0"}
{"input": ["opencl -keys=adreno,opencl,gpu -device=adreno -max_num_threads=256", "conv2d_nchw.cuda", [["TENSOR", [1, 3, 224, 224], "float16"], ["TENSOR", [32, 3, 3, 3], "float16"], [2, 2], [1, 1, 1, 1], [1, 1], "float16"], {}], "config": {"index": 5062997, "code_hash": null, "entity": [["tile_f", "sp", [-1, 2, 1, 4]], ["tile_y", "sp", [-1, 7, 1, 8]], ["tile_x", "sp", [-1, 1, 4, 4]], ["tile_rc", "sp", [-1, 1]], ["tile_ry", "sp", [-1, 1]], ["tile_rx", "sp", [-1, 3]], ["auto_unroll_max_step", "ot", 0], ["unroll_explicit", "ot", 0]]}, "result": [[0.02939247916], 0, 13.767007112503052, 1638813641.8617482], "version": 0.2, "tvm_version": "0.8.dev0"}
{"input": ["opencl -keys=adreno,opencl,gpu -device=adreno -max_num_threads=256", "conv2d_nchw.cuda", [["TENSOR", [1, 3, 224, 224], "float16"], ["TENSOR", [32, 3, 3, 3], "float16"], [2, 2], [1, 1, 1, 1], [1, 1], "float16"], {}], "config": {"index": 88288, "code_hash": null, "entity": [["tile_f", "sp", [-1, 4, 4, 2]], ["tile_y", "sp", [-1, 8, 14, 1]], ["tile_x", "sp", [-1, 2, 2, 1]], ["tile_rc", "sp", [-1, 1]], ["tile_ry", "sp", [-1, 1]], ["tile_rx", "sp", [-1, 1]], ["auto_unroll_max_step", "ot", 0], ["unroll_explicit", "ot", 0]]}, "result": [[0.05851072082], 0, 10.241076231002808, 1638813653.6755404], "version": 0.2, "tvm_version": "0.8.dev0"}
{"input": ["opencl -keys=adreno,opencl,gpu -device=adreno -max_num_threads=256", "conv2d_nchw.cuda", [["TENSOR", [1, 3, 224, 224], "float16"], ["TENSOR", [32, 3, 3, 3], "float16"], [2, 2], [1, 1, 1, 1], [1, 1], "float16"], {}], "config": {"index": 2723816, "code_hash": null, "entity": [["tile_f", "sp", [-1, 4, 4, 2]], ["tile_y", "sp", [-1, 1, 4, 2]], ["tile_x", "sp", [-1, 1, 8, 2]], ["tile_rc", "sp", [-1, 1]], ["tile_ry", "sp", [-1, 3]], ["tile_rx", "sp", [-1, 1]], ["auto_unroll_max_step", "ot", 0], ["unroll_explicit", "ot", 0]]}, "result": [[0.00230270834], 0, 1.740243911743164, 1638814362.1639214], "version": 0.2, "tvm_version": "0.8.dev0"}
{"input": ["opencl -keys=adreno,opencl,gpu -device=adreno -max_num_threads=256", "conv2d_nchw.cuda", [["TENSOR", [1, 3, 224, 224], "float16"], ["TENSOR", [32, 3, 3, 3], "float16"], [2, 2], [1, 1, 1, 1], [1, 1], "float16"], {}], "config": {"index": 11504616, "code_hash": null, "entity": [["tile_f", "sp", [-1, 4, 4, 2]], ["tile_y", "sp", [-1, 1, 4, 2]], ["tile_x", "sp", [-1, 1, 8, 2]], ["tile_rc", "sp", [-1, 1]], ["tile_ry", "sp", [-1, 3]], ["tile_rx", "sp", [-1, 1]], ["auto_unroll_max_step", "ot", 512], ["unroll_explicit", "ot", 0]]}, "result": [[0.0022781760399999997], 0, 3.1212921142578125, 1638814363.5666084], "version": 0.2, "tvm_version": "0.8.dev0"}
{"input": ["opencl -keys=adreno,opencl,gpu -device=adreno -max_num_threads=256", "conv2d_nchw.cuda", [["TENSOR", [1, 3, 224, 224], "float16"], ["TENSOR", [32, 3, 3, 3], "float16"], [2, 2], [1, 1, 1, 1], [1, 1], "float16"], {}], "config": {"index": 2862973, "code_hash": null, "entity": [["tile_f", "sp", [-1, 8, 2, 2]], ["tile_y", "sp", [-1, 1, 7, 1]], ["tile_x", "sp", [-1, 1, 4, 4]], ["tile_rc", "sp", [-1, 1]], ["tile_ry", "sp", [-1, 3]], ["tile_rx", "sp", [-1, 1]], ["auto_unroll_max_step", "ot", 0], ["unroll_explicit", "ot", 0]]}, "result": [[0.010625781239999998], 0, 3.1812117099761963, 1638814367.043512], "version": 0.2, "tvm_version": "0.8.dev0"}
{"input": ["opencl -keys=adreno,opencl,gpu -device=adreno -max_num_threads=256", "conv2d_nchw.cuda", [["TENSOR", [1, 3, 224, 224], "float16"], ["TENSOR", [32, 3, 3, 3], "float16"], [2, 2], [1, 1, 1, 1], [1, 1], "float16"], {}], "config": {"index": 2723814, "code_hash": null, "entity": [["tile_f", "sp", [-1, 1, 4, 2]], ["tile_y", "sp", [-1, 1, 4, 2]], ["tile_x", "sp", [-1, 1, 8, 2]], ["tile_rc", "sp", [-1, 1]], ["tile_ry", "sp", [-1, 3]], ["tile_rx", "sp", [-1, 1]], ["auto_unroll_max_step", "ot", 0], ["unroll_explicit", "ot", 0]]}, "result": [[0.00102942396], 0, 4.178910732269287, 1638814368.1234045], "version": 0.2, "tvm_version": "0.8.dev0"}
{"input": ["opencl -keys=adreno,opencl,gpu -device=adreno -max_num_threads=256", "conv2d_nchw.cuda", [["TENSOR", [1, 3, 224, 224], "float16"], ["TENSOR", [32, 3, 3, 3], "float16"], [2, 2], [1, 1, 1, 1], [1, 1], "float16"], {}], "config": {"index": 2490520, "code_hash": null, "entity": [["tile_f", "sp", [-1, 4, 4, 2]], ["tile_y", "sp", [-1, 1, 1, 7]], ["tile_x", "sp", [-1, 1, 16, 1]], ["tile_rc", "sp", [-1, 1]], ["tile_ry", "sp", [-1, 3]], ["tile_rx", "sp", [-1, 1]], ["auto_unroll_max_step", "ot", 0], ["unroll_explicit", "ot", 0]]}, "result": [[0.012133602080000002], 0, 3.1114540100097656, 1638814371.5820324], "version": 0.2, "tvm_version": "0.8.dev0"}
{"input": ["opencl -keys=adreno,opencl,gpu -device=adreno -max_num_threads=256", "conv2d_nchw.cuda", [["TENSOR", [1, 3, 224, 224], "float16"], ["TENSOR", [32, 3, 3, 3], "float16"], [2, 2], [1, 1, 1, 1], [1, 1], "float16"], {}], "config": {"index": 11643773, "code_hash": null, "entity": [["tile_f", "sp", [-1, 8, 2, 2]], ["tile_y", "sp", [-1, 1, 7, 1]], ["tile_x", "sp", [-1, 1, 4, 4]], ["tile_rc", "sp", [-1, 1]], ["tile_ry", "sp", [-1, 3]], ["tile_rx", "sp", [-1, 1]], ["auto_unroll_max_step", "ot", 512], ["unroll_explicit", "ot", 0]]}, "result": [[0.01056316352], 0, 5.80241584777832, 1638814374.27413], "version": 0.2, "tvm_version": "0.8.dev0"}
{"input": ["opencl -keys=adreno,opencl,gpu -device=adreno -max_num_threads=256", "conv2d_nchw.cuda", [["TENSOR", [1, 3, 224, 224], "float16"], ["TENSOR", [32, 3, 3, 3], "float16"], [2, 2], [1, 1, 1, 1], [1, 1], "float16"], {}], "config": {"index": 2505190, "code_hash": null, "entity": [["tile_f", "sp", [-1, 1, 4, 2]], ["tile_y", "sp", [-1, 1, 1, 4]], ["tile_x", "sp", [-1, 1, 28, 1]], ["tile_rc", "sp", [-1, 1]], ["tile_ry", "sp", [-1, 3]], ["tile_rx", "sp", [-1, 1]], ["auto_unroll_max_step", "ot", 0], ["unroll_explicit", "ot", 0]]}, "result": [[0.00107470416], 0, 1.3691818714141846, 1638814375.9427567], "version": 0.2, "tvm_version": "0.8.dev0"}
{"input": ["opencl -keys=adreno,opencl,gpu -device=adreno -max_num_threads=256", "conv2d_nchw.cuda", [["TENSOR", [1, 3, 224, 224], "float16"], ["TENSOR", [32, 3, 3, 3], "float16"], [2, 2], [1, 1, 1, 1], [1, 1], "float16"], {}], "config": {"index": 2490522, "code_hash": null, "entity": [["tile_f", "sp", [-1, 2, 8, 2]], ["tile_y", "sp", [-1, 1, 1, 7]], ["tile_x", "sp", [-1, 1, 16, 1]], ["tile_rc", "sp", [-1, 1]], ["tile_ry", "sp", [-1, 3]], ["tile_rx", "sp", [-1, 1]], ["auto_unroll_max_step", "ot", 0], ["unroll_explicit", "ot", 0]]}, "result": [[0.0023404750000000003], 0, 8.679681062698364, 1638814383.3023717], "version": 0.2, "tvm_version": "0.8.dev0"}
{"input": ["opencl -keys=adreno,opencl,gpu -device=adreno -max_num_threads=256", "conv2d_nchw.cuda", [["TENSOR", [1, 3, 224, 224], "float16"], ["TENSOR", [32, 3, 3, 3], "float16"], [2, 2], [1, 1, 1, 1], [1, 1], "float16"], {}], "config": {"index": 2427352, "code_hash": null, "entity": [["tile_f", "sp", [-1, 4, 4, 2]], ["tile_y", "sp", [-1, 1, 4, 4]], ["tile_x", "sp", [-1, 1, 8, 1]], ["tile_rc", "sp", [-1, 1]], ["tile_ry", "sp", [-1, 3]], ["tile_rx", "sp", [-1, 1]], ["auto_unroll_max_step", "ot", 0], ["unroll_explicit", "ot", 0]]}, "result": [[0.00226507084], 0, 1.525301218032837, 1638814385.1608956], "version": 0.2, "tvm_version": "0.8.dev0"}
{"input": ["opencl -keys=adreno,opencl,gpu -device=adreno -max_num_threads=256", "conv2d_nchw.cuda", [["TENSOR", [1, 3, 224, 224], "float16"], ["TENSOR", [32, 3, 3, 3], "float16"], [2, 2], [1, 1, 1, 1], [1, 1], "float16"], {}], "config": {"index": 2839736, "code_hash": null, "entity": [["tile_f", "sp", [-1, 4, 4, 2]], ["tile_y", "sp", [-1, 1, 8, 1]], ["tile_x", "sp", [-1, 2, 2, 4]], ["tile_rc", "sp", [-1, 1]], ["tile_ry", "sp", [-1, 3]], ["tile_rx", "sp", [-1, 1]], ["auto_unroll_max_step", "ot", 0], ["unroll_explicit", "ot", 0]]}, "result": [[0.01322234272], 0, 4.87917423248291, 1638814388.4732893], "version": 0.2, "tvm_version": "0.8.dev0"}
{"input": ["opencl -keys=adreno,opencl,gpu -device=adreno -max_num_threads=256", "conv2d_nchw.cuda", [["TENSOR", [1, 3, 224, 224], "float16"], ["TENSOR", [32, 3, 3, 3], "float16"], [2, 2], [1, 1, 1, 1], [1, 1], "float16"], {}], "config": {"index": 11246792, "code_hash": null, "entity": [["tile_f", "sp", [-1, 4, 4, 2]], ["tile_y", "sp", [-1, 1, 1, 4]], ["tile_x", "sp", [-1, 2, 14, 1]], ["tile_rc", "sp", [-1, 1]], ["tile_ry", "sp", [-1, 3]], ["tile_rx", "sp", [-1, 1]], ["auto_unroll_max_step", "ot", 512], ["unroll_explicit", "ot", 0]]}, "result": [[0.01314449582], 0, 3.163364887237549, 1638814391.9328105], "version": 0.2, "tvm_version": "0.8.dev0"}
{"input": ["opencl -keys=adreno,opencl,gpu -device=adreno -max_num_threads=256", "conv2d_nchw.cuda", [["TENSOR", [1, 3, 224, 224], "float16"], ["TENSOR", [32, 3, 3, 3], "float16"], [2, 2], [1, 1, 1, 1], [1, 1], "float16"], {}], "config": {"index": 4544882, "code_hash": null, "entity": [["tile_f", "sp", [-1, 2, 8, 2]], ["tile_y", "sp", [-1, 1, 2, 7]], ["tile_x", "sp", [-1, 2, 4, 1]], ["tile_rc", "sp", [-1, 1]], ["tile_ry", "sp", [-1, 1]], ["tile_rx", "sp", [-1, 3]], ["auto_unroll_max_step", "ot", 0], ["unroll_explicit", "ot", 0]]}, "result": [[0.01384927916], 0, 6.309128522872925, 1638814395.1090639], "version": 0.2, "tvm_version": "0.8.dev0"}
{"input": ["opencl -keys=adreno,opencl,gpu -device=adreno -max_num_threads=256", "conv2d_nchw.cuda", [["TENSOR", [1, 3, 224, 224], "float16"], ["TENSOR", [32, 3, 3, 3], "float16"], [2, 2], [1, 1, 1, 1], [1, 1], "float16"], {}], "config": {"index": 2348952, "code_hash": null, "entity": [["tile_f", "sp", [-1, 4, 4, 2]], ["tile_y", "sp", [-1, 1, 4, 4]], ["tile_x", "sp", [-1, 2, 4, 1]], ["tile_rc", "sp", [-1, 1]], ["tile_ry", "sp", [-1, 3]], ["tile_rx", "sp", [-1, 1]], ["auto_unroll_max_step", "ot", 0], ["unroll_explicit", "ot", 0]]}, "result": [[0.0137661823], 0, 3.3605740070343018, 1638814398.7671227], "version": 0.2, "tvm_version": "0.8.dev0"}
{"input": ["opencl -keys=adreno,opencl,gpu -device=adreno -max_num_threads=256", "conv2d_nchw.cuda", [["TENSOR", [1, 3, 224, 224], "float16"], ["TENSOR", [32, 3, 3, 3], "float16"], [2, 2], [1, 1, 1, 1], [1, 1], "float16"], {}], "config": {"index": 2489568, "code_hash": null, "entity": [["tile_f", "sp", [-1, 4, 4, 2]], ["tile_y", "sp", [-1, 2, 1, 4]], ["tile_x", "sp", [-1, 1, 16, 1]], ["tile_rc", "sp", [-1, 1]], ["tile_ry", "sp", [-1, 3]], ["tile_rx", "sp", [-1, 1]], ["auto_unroll_max_step", "ot", 0], ["unroll_explicit", "ot", 0]]}, "result": [[0.0132476], 0, 6.344192028045654, 1638814401.797327], "version": 0.2, "tvm_version": "0.8.dev0"}
{"input": ["opencl -keys=adreno,opencl,gpu -device=adreno -max_num_threads=256", "conv2d_nchw.cuda", [["TENSOR", [1, 3, 224, 224], "float16"], ["TENSOR", [32, 3, 3, 3], "float16"], [2, 2], [1, 1, 1, 1], [1, 1], "float16"], {}], "config": {"index": 2348730, "code_hash": null, "entity": [["tile_f", "sp", [-1, 2, 8, 2]], ["tile_y", "sp", [-1, 1, 2, 4]], ["tile_x", "sp", [-1, 2, 4, 1]], ["tile_rc", "sp", [-1, 1]], ["tile_ry", "sp", [-1, 3]], ["tile_rx", "sp", [-1, 1]], ["auto_unroll_max_step", "ot", 0], ["unroll_explicit", "ot", 0]]}, "result": [[0.00236506874], 0, 2.028451919555664, 1638814404.1427028], "version": 0.2, "tvm_version": "0.8.dev0"}
{"input": ["opencl -keys=adreno,opencl,gpu -device=adreno -max_num_threads=256", "conv2d_nchw.cuda", [["TENSOR", [1, 3, 224, 224], "float16"], ["TENSOR", [32, 3, 3, 3], "float16"], [2, 2], [1, 1, 1, 1], [1, 1], "float16"], {}], "config": {"index": 2862976, "code_hash": null, "entity": [["tile_f", "sp", [-1, 4, 4, 2]], ["tile_y", "sp", [-1, 1, 7, 1]], ["tile_x", "sp", [-1, 1, 4, 4]], ["tile_rc", "sp", [-1, 1]], ["tile_ry", "sp", [-1, 3]], ["tile_rx", "sp", [-1, 1]], ["auto_unroll_max_step", "ot", 0], ["unroll_explicit", "ot", 0]]}, "result": [[0.00224568436], 0, 3.32563853263855, 1638814405.433599], "version": 0.2, "tvm_version": "0.8.dev0"}
{"input": ["opencl -keys=adreno,opencl,gpu -device=adreno -max_num_threads=256", "conv2d_nchw.cuda", [["TENSOR", [1, 3, 224, 224], "float16"], ["TENSOR", [32, 3, 3, 3], "float16"], [2, 2], [1, 1, 1, 1], [1, 1], "float16"], {}], "config": {"index": 2426794, "code_hash": null, "entity": [["tile_f", "sp", [-1, 2, 8, 2]], ["tile_y", "sp", [-1, 1, 1, 4]], ["tile_x", "sp", [-1, 1, 8, 1]], ["tile_rc", "sp", [-1, 1]], ["tile_ry", "sp", [-1, 3]], ["tile_rx", "sp", [-1, 1]], ["auto_unroll_max_step", "ot", 0], ["unroll_explicit", "ot", 0]]}, "result": [[0.00044460520000000006], 0, 2.3141379356384277, 1638814408.0340247], "version": 0.2, "tvm_version": "0.8.dev0"}
{"input": ["opencl -keys=adreno,opencl,gpu -device=adreno -max_num_threads=256", "conv2d_nchw.cuda", [["TENSOR", [1, 3, 224, 224], "float16"], ["TENSOR", [32, 3, 3, 3], "float16"], [2, 2], [1, 1, 1, 1], [1, 1], "float16"], {}], "config": {"index": 11208152, "code_hash": null, "entity": [["tile_f", "sp", [-1, 4, 4, 2]], ["tile_y", "sp", [-1, 1, 4, 4]], ["tile_x", "sp", [-1, 1, 8, 1]], ["tile_rc", "sp", [-1, 1]], ["tile_ry", "sp", [-1, 3]], ["tile_rx", "sp", [-1, 1]], ["auto_unroll_max_step", "ot", 512], ["unroll_explicit", "ot", 0]]}, "result": [[0.00225933854], 0, 3.6235098838806152, 1638814409.383443], "version": 0.2, "tvm_version": "0.8.dev0"}
{"input": ["opencl -keys=adreno,opencl,gpu -device=adreno -max_num_threads=256", "conv2d_nchw.cuda", [["TENSOR", [1, 3, 224, 224], "float16"], ["TENSOR", [32, 3, 3, 3], "float16"], [2, 2], [1, 1, 1, 1], [1, 1], "float16"], {}], "config": {"index": 266602, "code_hash": null, "entity": [["tile_f", "sp", [-1, 4, 2, 4]], ["tile_y", "sp", [-1, 1, 1, 1]], ["tile_x", "sp", [-1, 2, 14, 1]], ["tile_rc", "sp", [-1, 1]], ["tile_ry", "sp", [-1, 1]], ["tile_rx", "sp", [-1, 1]], ["auto_unroll_max_step", "ot", 0], ["unroll_explicit", "ot", 0]]}, "result": [[0.0049904323], 0, 2.9337821006774902, 1638814412.6149552], "version": 0.2, "tvm_version": "0.8.dev0"}
{"input": ["opencl -keys=adreno,opencl,gpu -device=adreno -max_num_threads=256", "conv2d_nchw.cuda", [["TENSOR", [1, 3, 224, 224], "float16"], ["TENSOR", [32, 3, 3, 3], "float16"], [2, 2], [1, 1, 1, 1], [1, 1], "float16"], {}], "config": {"index": 11168394, "code_hash": null, "entity": [["tile_f", "sp", [-1, 2, 8, 2]], ["tile_y", "sp", [-1, 1, 1, 4]], ["tile_x", "sp", [-1, 1, 7, 1]], ["tile_rc", "sp", [-1, 1]], ["tile_ry", "sp", [-1, 3]], ["tile_rx", "sp", [-1, 1]], ["auto_unroll_max_step", "ot", 512], ["unroll_explicit", "ot", 0]]}, "result": [[0.0005527177199999999], 0, 3.976886034011841, 1638814413.692985], "version": 0.2, "tvm_version": "0.8.dev0"}
{"input": ["opencl -keys=adreno,opencl,gpu -device=adreno -max_num_threads=256", "conv2d_nchw.cuda", [["TENSOR", [1, 3, 224, 224], "float16"], ["TENSOR", [32, 3, 3, 3], "float16"], [2, 2], [1, 1, 1, 1], [1, 1], "float16"], {}], "config": {"index": 20285416, "code_hash": null, "entity": [["tile_f", "sp", [-1, 4, 4, 2]], ["tile_y", "sp", [-1, 1, 4, 2]], ["tile_x", "sp", [-1, 1, 8, 2]], ["tile_rc", "sp", [-1, 1]], ["tile_ry", "sp", [-1, 3]], ["tile_rx", "sp", [-1, 1]], ["auto_unroll_max_step", "ot", 1500], ["unroll_explicit", "ot", 0]]}, "result": [[0.00225898542], 0, 1.8410181999206543, 1638814415.841548], "version": 0.2, "tvm_version": "0.8.dev0"}
{"input": ["opencl -keys=adreno,opencl,gpu -device=adreno -max_num_threads=256", "conv2d_nchw.cuda", [["TENSOR", [1, 3, 224, 224], "float16"], ["TENSOR", [32, 3, 3, 3], "float16"], [2, 2], [1, 1, 1, 1], [1, 1], "float16"], {}], "config": {"index": 11271320, "code_hash": null, "entity": [["tile_f", "sp", [-1, 4, 4, 2]], ["tile_y", "sp", [-1, 1, 1, 7]], ["tile_x", "sp", [-1, 1, 16, 1]], ["tile_rc", "sp", [-1, 1]], ["tile_ry", "sp", [-1, 3]], ["tile_rx", "sp", [-1, 1]], ["auto_unroll_max_step", "ot", 512], ["unroll_explicit", "ot", 0]]}, "result": [[0.012258568760000001], 0, 4.560458183288574, 1638814418.6034384], "version": 0.2, "tvm_version": "0.8.dev0"}
{"input": ["opencl -keys=adreno,opencl,gpu -device=adreno -max_num_threads=256", "conv2d_nchw.cuda", [["TENSOR", [1, 3, 224, 224], "float16"], ["TENSOR", [32, 3, 3, 3], "float16"], [2, 2], [1, 1, 1, 1], [1, 1], "float16"], {}], "config": {"index": 19988952, "code_hash": null, "entity": [["tile_f", "sp", [-1, 4, 4, 2]], ["tile_y", "sp", [-1, 1, 4, 4]], ["tile_x", "sp", [-1, 1, 8, 1]], ["tile_rc", "sp", [-1, 1]], ["tile_ry", "sp", [-1, 3]], ["tile_rx", "sp", [-1, 1]], ["auto_unroll_max_step", "ot", 1500], ["unroll_explicit", "ot", 0]]}, "result": [[0.00227386876], 0, 1.377241849899292, 1638814420.326033], "version": 0.2, "tvm_version": "0.8.dev0"}
{"input": ["opencl -keys=adreno,opencl,gpu -device=adreno -max_num_threads=256", "conv2d_nchw.cuda", [["TENSOR", [1, 3, 224, 224], "float16"], ["TENSOR", [32, 3, 3, 3], "float16"], [2, 2], [1, 1, 1, 1], [1, 1], "float16"], {}], "config": {"index": 2356570, "code_hash": null, "entity": [["tile_f", "sp", [-1, 2, 8, 2]], ["tile_y", "sp", [-1, 1, 2, 4]], ["tile_x", "sp", [-1, 4, 4, 1]], ["tile_rc", "sp", [-1, 1]], ["tile_ry", "sp", [-1, 3]], ["tile_rx", "sp", [-1, 1]], ["auto_unroll_max_step", "ot", 0], ["unroll_explicit", "ot", 0]]}, "result": [[0.015372019780000001], 0, 4.743685007095337, 1638814423.6859236], "version": 0.2, "tvm_version": "0.8.dev0"}
{"input": ["opencl -keys=adreno,opencl,gpu -device=adreno -max_num_threads=256", "conv2d_nchw.cuda", [["TENSOR", [1, 3, 224, 224], "float16"], ["TENSOR", [32, 3, 3, 3], "float16"], [2, 2], [1, 1, 1, 1], [1, 1], "float16"], {}], "config": {"index": 2839122, "code_hash": null, "entity": [["tile_f", "sp", [-1, 2, 8, 2]], ["tile_y", "sp", [-1, 1, 4, 1]], ["tile_x", "sp", [-1, 2, 2, 4]], ["tile_rc", "sp", [-1, 1]], ["tile_ry", "sp", [-1, 3]], ["tile_rx", "sp", [-1, 1]], ["auto_unroll_max_step", "ot", 0], ["unroll_explicit", "ot", 0]]}, "result": [[0.00245668334], 0, 1.556389331817627, 1638814425.5338478], "version": 0.2, "tvm_version": "0.8.dev0"}
{"input": ["opencl -keys=adreno,opencl,gpu -device=adreno -max_num_threads=256", "conv2d_nchw.cuda", [["TENSOR", [1, 3, 224, 224], "float16"], ["TENSOR", [32, 3, 3, 3], "float16"], [2, 2], [1, 1, 1, 1], [1, 1], "float16"], {}], "config": {"index": 11129530, "code_hash": null, "entity": [["tile_f", "sp", [-1, 2, 8, 2]], ["tile_y", "sp", [-1, 1, 2, 4]], ["tile_x", "sp", [-1, 2, 4, 1]], ["tile_rc", "sp", [-1, 1]], ["tile_ry", "sp", [-1, 3]], ["tile_rx", "sp", [-1, 1]], ["auto_unroll_max_step", "ot", 512], ["unroll_explicit", "ot", 0]]}, "result": [[0.0023964166599999997], 0, 2.986156940460205, 1638814427.0109923], "version": 0.2, "tvm_version": "0.8.dev0"}
{"input": ["opencl -keys=adreno,opencl,gpu -device=adreno -max_num_threads=256", "conv2d_nchw.cuda", [["TENSOR", [1, 3, 224, 224], "float16"], ["TENSOR", [32, 3, 3, 3], "float16"], [2, 2], [1, 1, 1, 1], [1, 1], "float16"], {}], "config": {"index": 266610, "code_hash": null, "entity": [["tile_f", "sp", [-1, 2, 2, 8]], ["tile_y", "sp", [-1, 1, 1, 1]], ["tile_x", "sp", [-1, 2, 14, 1]], ["tile_rc", "sp", [-1, 1]], ["tile_ry", "sp", [-1, 1]], ["tile_rx", "sp", [-1, 1]], ["auto_unroll_max_step", "ot", 0], ["unroll_explicit", "ot", 0]]}, "result": [[0.0035334229], 0, 1.6455202102661133, 1638814429.1990886], "version": 0.2, "tvm_version": "0.8.dev0"}
{"input": ["opencl -keys=adreno,opencl,gpu -device=adreno -max_num_threads=256", "conv2d_nchw.cuda", [["TENSOR", [1, 3, 224, 224], "float16"], ["TENSOR", [32, 3, 3, 3], "float16"], [2, 2], [1, 1, 1, 1], [1, 1], "float16"], {}], "config": {"index": 2348786, "code_hash": null, "entity": [["tile_f", "sp", [-1, 2, 8, 2]], ["tile_y", "sp", [-1, 2, 2, 4]], ["tile_x", "sp", [-1, 2, 4, 1]], ["tile_rc", "sp", [-1, 1]], ["tile_ry", "sp", [-1, 3]], ["tile_rx", "sp", [-1, 1]], ["auto_unroll_max_step", "ot", 0], ["unroll_explicit", "ot", 0]]}, "result": [[0.015474102080000001], 0, 4.897708892822266, 1638814432.440544], "version": 0.2, "tvm_version": "0.8.dev0"}
{"input": ["opencl -keys=adreno,opencl,gpu -device=adreno -max_num_threads=256", "conv2d_nchw.cuda", [["TENSOR", [1, 3, 224, 224], "float16"], ["TENSOR", [32, 3, 3, 3], "float16"], [2, 2], [1, 1, 1, 1], [1, 1], "float16"], {}], "config": {"index": 11207594, "code_hash": null, "entity": [["tile_f", "sp", [-1, 2, 8, 2]], ["tile_y", "sp", [-1, 1, 1, 4]], ["tile_x", "sp", [-1, 1, 8, 1]], ["tile_rc", "sp", [-1, 1]], ["tile_ry", "sp", [-1, 3]], ["tile_rx", "sp", [-1, 1]], ["auto_unroll_max_step", "ot", 512], ["unroll_explicit", "ot", 0]]}, "result": [[0.00044500208], 0, 1.235480546951294, 1638814434.0071168], "version": 0.2, "tvm_version": "0.8.dev0"}
{"input": ["opencl -keys=adreno,opencl,gpu -device=adreno -max_num_threads=256", "conv2d_nchw.cuda", [["TENSOR", [1, 3, 224, 224], "float16"], ["TENSOR", [32, 3, 3, 3], "float16"], [2, 2], [1, 1, 1, 1], [1, 1], "float16"], {}], "config": {"index": 2464368, "code_hash": null, "entity": [["tile_f", "sp", [-1, 4, 4, 2]], ["tile_y", "sp", [-1, 2, 1, 2]], ["tile_x", "sp", [-1, 2, 14, 1]], ["tile_rc", "sp", [-1, 1]], ["tile_ry", "sp", [-1, 3]], ["tile_rx", "sp", [-1, 1]], ["auto_unroll_max_step", "ot", 0], ["unroll_explicit", "ot", 0]]}, "result": [[0.012704559380000001], 0, 4.211900234222412, 1638814436.9722102], "version": 0.2, "tvm_version": "0.8.dev0"}
{"input": ["opencl -keys=adreno,opencl,gpu -device=adreno -max_num_threads=256", "conv2d_nchw.cuda", [["TENSOR", [1, 3, 224, 224], "float16"], ["TENSOR", [32, 3, 3, 3], "float16"], [2, 2], [1, 1, 1, 1], [1, 1], "float16"], {}], "config": {"index": 266598, "code_hash": null, "entity": [["tile_f", "sp", [-1, 4, 1, 4]], ["tile_y", "sp", [-1, 1, 1, 1]], ["tile_x", "sp", [-1, 2, 14, 1]], ["tile_rc", "sp", [-1, 1]], ["tile_ry", "sp", [-1, 1]], ["tile_rx", "sp", [-1, 1]], ["auto_unroll_max_step", "ot", 0], ["unroll_explicit", "ot", 0]]}, "result": [[0.00261195314], 0, 1.5490131378173828, 1638814438.862787], "version": 0.2, "tvm_version": "0.8.dev0"}
{"input": ["opencl -keys=adreno,opencl,gpu -device=adreno -max_num_threads=256", "conv2d_nchw.cuda", [["TENSOR", [1, 3, 224, 224], "float16"], ["TENSOR", [32, 3, 3, 3], "float16"], [2, 2], [1, 1, 1, 1], [1, 1], "float16"], {}], "config": {"index": 2433736, "code_hash": null, "entity": [["tile_f", "sp", [-1, 4, 4, 2]], ["tile_y", "sp", [-1, 1, 4, 2]], ["tile_x", "sp", [-1, 2, 8, 1]], ["tile_rc", "sp", [-1, 1]], ["tile_ry", "sp", [-1, 3]], ["tile_rx", "sp", [-1, 1]], ["auto_unroll_max_step", "ot", 0], ["unroll_explicit", "ot", 0]]}, "result": [[0.00227045624], 0, 3.102216958999634, 1638814440.391566], "version": 0.2, "tvm_version": "0.8.dev0"}
{"input": ["opencl -keys=adreno,opencl,gpu -device=adreno -max_num_threads=256", "conv2d_nchw.cuda", [["TENSOR", [1, 3, 224, 224], "float16"], ["TENSOR", [32, 3, 3, 3], "float16"], [2, 2], [1, 1, 1, 1], [1, 1], "float16"], {}], "config": {"index": 9047402, "code_hash": null, "entity": [["tile_f", "sp", [-1, 4, 2, 4]], ["tile_y", "sp", [-1, 1, 1, 1]], ["tile_x", "sp", [-1, 2, 14, 1]], ["tile_rc", "sp", [-1, 1]], ["tile_ry", "sp", [-1, 1]], ["tile_rx", "sp", [-1, 1]], ["auto_unroll_max_step", "ot", 512], ["unroll_explicit", "ot", 0]]}, "result": [[0.00492062708], 0, 1.9898366928100586, 1638814442.6900892], "version": 0.2, "tvm_version": "0.8.dev0"}
{"input": ["opencl -keys=adreno,opencl,gpu -device=adreno -max_num_threads=256", "conv2d_nchw.cuda", [["TENSOR", [1, 3, 224, 224], "float16"], ["TENSOR", [32, 3, 3, 3], "float16"], [2, 2], [1, 1, 1, 1], [1, 1], "float16"], {}], "config": {"index": 1239769, "code_hash": null, "entity": [["tile_f", "sp", [-1, 2, 2, 4]], ["tile_y", "sp", [-1, 1, 4, 1]], ["tile_x", "sp", [-1, 1, 4, 1]], ["tile_rc", "sp", [-1, 3]], ["tile_ry", "sp", [-1, 1]], ["tile_rx", "sp", [-1, 1]], ["auto_unroll_max_step", "ot", 0], ["unroll_explicit", "ot", 0]]}, "result": [[0.0029559073000000003], 0, 3.375666379928589, 1638814444.054644], "version": 0.2, "tvm_version": "0.8.dev0"}
{"input": ["opencl -keys=adreno,opencl,gpu -device=adreno -max_num_threads=256", "conv2d_nchw.cuda", [["TENSOR", [1, 3, 224, 224], "float16"], ["TENSOR", [32, 3, 3, 3], "float16"], [2, 2], [1, 1, 1, 1], [1, 1], "float16"], {}], "config": {"index": 2863256, "code_hash": null, "entity": [["tile_f", "sp", [-1, 4, 4, 2]], ["tile_y", "sp", [-1, 1, 8, 1]], ["tile_x", "sp", [-1, 1, 4, 4]], ["tile_rc", "sp", [-1, 1]], ["tile_ry", "sp", [-1, 3]], ["tile_rx", "sp", [-1, 1]], ["auto_unroll_max_step", "ot", 0], ["unroll_explicit", "ot", 0]]}, "result": [[0.00232797604], 0, 1.5290703773498535, 1638814445.90354], "version": 0.2, "tvm_version": "0.8.dev0"}
{"input": ["opencl -keys=adreno,opencl,gpu -device=adreno -max_num_threads=256", "conv2d_nchw.cuda", [["TENSOR", [1, 3, 224, 224], "float16"], ["TENSOR", [32, 3, 3, 3], "float16"], [2, 2], [1, 1, 1, 1], [1, 1], "float16"], {}], "config": {"index": 2723538, "code_hash": null, "entity": [["tile_f", "sp", [-1, 2, 8, 2]], ["tile_y", "sp", [-1, 2, 2, 2]], ["tile_x", "sp", [-1, 1, 8, 2]], ["tile_rc", "sp", [-1, 1]], ["tile_ry", "sp", [-1, 3]], ["tile_rx", "sp", [-1, 1]], ["auto_unroll_max_step", "ot", 0], ["unroll_explicit", "ot", 0]]}, "result": [[0.00230363124], 0, 2.7809524536132812, 1638814447.1852102], "version": 0.2, "tvm_version": "0.8.dev0"}
{"input": ["opencl -keys=adreno,opencl,gpu -device=adreno -max_num_threads=256", "conv2d_nchw.cuda", [["TENSOR", [1, 3, 224, 224], "float16"], ["TENSOR", [32, 3, 3, 3], "float16"], [2, 2], [1, 1, 1, 1], [1, 1], "float16"], {}], "config": {"index": 2427130, "code_hash": null, "entity": [["tile_f", "sp", [-1, 2, 8, 2]], ["tile_y", "sp", [-1, 1, 2, 4]], ["tile_x", "sp", [-1, 1, 8, 1]], ["tile_rc", "sp", [-1, 1]], ["tile_ry", "sp", [-1, 3]], ["tile_rx", "sp", [-1, 1]], ["auto_unroll_max_step", "ot", 0], ["unroll_explicit", "ot", 0]]}, "result": [[0.00037436978], 0, 1.1769697666168213, 1638814449.418355], "version": 0.2, "tvm_version": "0.8.dev0"}
{"input": ["opencl -keys=adreno,opencl,gpu -device=adreno -max_num_threads=256", "conv2d_nchw.cuda", [["TENSOR", [1, 3, 224, 224], "float16"], ["TENSOR", [32, 3, 3, 3], "float16"], [2, 2], [1, 1, 1, 1], [1, 1], "float16"], {}], "config": {"index": 2489514, "code_hash": null, "entity": [["tile_f", "sp", [-1, 2, 8, 2]], ["tile_y", "sp", [-1, 1, 1, 4]], ["tile_x", "sp", [-1, 1, 16, 1]], ["tile_rc", "sp", [-1, 1]], ["tile_ry", "sp", [-1, 3]], ["tile_rx", "sp", [-1, 1]], ["auto_unroll_max_step", "ot", 0], ["unroll_explicit", "ot", 0]]}, "result": [[0.00042747187999999997], 0, 2.3115575313568115, 1638814450.579603], "version": 0.2, "tvm_version": "0.8.dev0"}
{"input": ["opencl -keys=adreno,opencl,gpu -device=adreno -max_num_threads=256", "conv2d_nchw.cuda", [["TENSOR", [1, 3, 224, 224], "float16"], ["TENSOR", [32, 3, 3, 3], "float16"], [2, 2], [1, 1, 1, 1], [1, 1], "float16"], {}], "config": {"index": 2489570, "code_hash": null, "entity": [["tile_f", "sp", [-1, 2, 8, 2]], ["tile_y", "sp", [-1, 2, 1, 4]], ["tile_x", "sp", [-1, 1, 16, 1]], ["tile_rc", "sp", [-1, 1]], ["tile_ry", "sp", [-1, 3]], ["tile_rx", "sp", [-1, 1]], ["auto_unroll_max_step", "ot", 0], ["unroll_explicit", "ot", 0]]}, "result": [[0.00229409374], 0, 1.559880256652832, 1638814452.423625], "version": 0.2, "tvm_version": "0.8.dev0"}
{"input": ["opencl -keys=adreno,opencl,gpu -device=adreno -max_num_threads=256", "conv2d_nchw.cuda", [["TENSOR", [1, 3, 224, 224], "float16"], ["TENSOR", [32, 3, 3, 3], "float16"], [2, 2], [1, 1, 1, 1], [1, 1], "float16"], {}], "config": {"index": 4919016, "code_hash": null, "entity": [["tile_f", "sp", [-1, 4, 4, 2]], ["tile_y", "sp", [-1, 1, 4, 2]], ["tile_x", "sp", [-1, 1, 8, 2]], ["tile_rc", "sp", [-1, 1]], ["tile_ry", "sp", [-1, 1]], ["tile_rx", "sp", [-1, 3]], ["auto_unroll_max_step", "ot", 0], ["unroll_explicit", "ot", 0]]}, "result": [[0.0022714896], 0, 2.828434705734253, 1638814453.7114382], "version": 0.2, "tvm_version": "0.8.dev0"}
{"input": ["opencl -keys=adreno,opencl,gpu -device=adreno -max_num_threads=256", "conv2d_nchw.cuda", [["TENSOR", [1, 3, 224, 224], "float16"], ["TENSOR", [32, 3, 3, 3], "float16"], [2, 2], [1, 1, 1, 1], [1, 1], "float16"], {}], "config": {"index": 4532888, "code_hash": null, "entity": [["tile_f", "sp", [-1, 8, 1, 2]], ["tile_y", "sp", [-1, 1, 7, 1]], ["tile_x", "sp", [-1, 1, 4, 1]], ["tile_rc", "sp", [-1, 1]], ["tile_ry", "sp", [-1, 1]], ["tile_rx", "sp", [-1, 3]], ["auto_unroll_max_step", "ot", 0], ["unroll_explicit", "ot", 0]]}, "result": [[0.00120702292], 0, 1.4264073371887207, 1638814455.4600873], "version": 0.2, "tvm_version": "0.8.dev0"}
{"input": ["opencl -keys=adreno,opencl,gpu -device=adreno -max_num_threads=256", "conv2d_nchw.cuda", [["TENSOR", [1, 3, 224, 224], "float16"], ["TENSOR", [32, 3, 3, 3], "float16"], [2, 2], [1, 1, 1, 1], [1, 1], "float16"], {}], "config": {"index": 11643776, "code_hash": null, "entity": [["tile_f", "sp", [-1, 4, 4, 2]], ["tile_y", "sp", [-1, 1, 7, 1]], ["tile_x", "sp", [-1, 1, 4, 4]], ["tile_rc", "sp", [-1, 1]], ["tile_ry", "sp", [-1, 3]], ["tile_rx", "sp", [-1, 1]], ["auto_unroll_max_step", "ot", 512], ["unroll_explicit", "ot", 0]]}, "result": [[0.00224835208], 0, 2.958430051803589, 1638814456.993479], "version": 0.2, "tvm_version": "0.8.dev0"}
{"input": ["opencl -keys=adreno,opencl,gpu -device=adreno -max_num_threads=256", "conv2d_nchw.cuda", [["TENSOR", [1, 3, 224, 224], "float16"], ["TENSOR", [32, 3, 3, 3], "float16"], [2, 2], [1, 1, 1, 1], [1, 1], "float16"], {}], "config": {"index": 2505173, "code_hash": null, "entity": [["tile_f", "sp", [-1, 4, 4, 1]], ["tile_y", "sp", [-1, 1, 1, 4]], ["tile_x", "sp", [-1, 1, 28, 1]], ["tile_rc", "sp", [-1, 1]], ["tile_ry", "sp", [-1, 3]], ["tile_rx", "sp", [-1, 1]], ["auto_unroll_max_step", "ot", 0], ["unroll_explicit", "ot", 0]]}, "result": [[0.0009328521000000001], 0, 1.2801663875579834, 1638814458.568251], "version": 0.2, "tvm_version": "0.8.dev0"}
{"input": ["opencl -keys=adreno,opencl,gpu -device=adreno -max_num_threads=256", "conv2d_nchw.cuda", [["TENSOR", [1, 3, 224, 224], "float16"], ["TENSOR", [32, 3, 3, 3], "float16"], [2, 2], [1, 1, 1, 1], [1, 1], "float16"], {}], "config": {"index": 11619922, "code_hash": null, "entity": [["tile_f", "sp", [-1, 2, 8, 2]], ["tile_y", "sp", [-1, 1, 4, 1]], ["tile_x", "sp", [-1, 2, 2, 4]], ["tile_rc", "sp", [-1, 1]], ["tile_ry", "sp", [-1, 3]], ["tile_rx", "sp", [-1, 1]], ["auto_unroll_max_step", "ot", 512], ["unroll_explicit", "ot", 0]]}, "result": [[0.00244690938], 0, 2.522724151611328, 1638814459.842872], "version": 0.2, "tvm_version": "0.8.dev0"}
{"input": ["opencl -keys=adreno,opencl,gpu -device=adreno -max_num_threads=256", "conv2d_nchw.cuda", [["TENSOR", [1, 3, 224, 224], "float16"], ["TENSOR", [32, 3, 3, 3], "float16"], [2, 2], [1, 1, 1, 1], [1, 1], "float16"], {}], "config": {"index": 2426795, "code_hash": null, "entity": [["tile_f", "sp", [-1, 1, 16, 2]], ["tile_y", "sp", [-1, 1, 1, 4]], ["tile_x", "sp", [-1, 1, 8, 1]], ["tile_rc", "sp", [-1, 1]], ["tile_ry", "sp", [-1, 3]], ["tile_rx", "sp", [-1, 1]], ["auto_unroll_max_step", "ot", 0], ["unroll_explicit", "ot", 0]]}, "result": [[0.0006474125], 0, 1.4002811908721924, 1638814461.594323], "version": 0.2, "tvm_version": "0.8.dev0"}
{"input": ["opencl -keys=adreno,opencl,gpu -device=adreno -max_num_threads=256", "conv2d_nchw.cuda", [["TENSOR", [1, 3, 224, 224], "float16"], ["TENSOR", [32, 3, 3, 3], "float16"], [2, 2], [1, 1, 1, 1], [1, 1], "float16"], {}], "config": {"index": 4543986, "code_hash": null, "entity": [["tile_f", "sp", [-1, 2, 8, 2]], ["tile_y", "sp", [-1, 2, 2, 4]], ["tile_x", "sp", [-1, 2, 4, 1]], ["tile_rc", "sp", [-1, 1]], ["tile_ry", "sp", [-1, 1]], ["tile_rx", "sp", [-1, 3]], ["auto_unroll_max_step", "ot", 0], ["unroll_explicit", "ot", 0]]}, "result": [[0.015575245820000002], 0, 4.793689012527466, 1638814464.9651608], "version": 0.2, "tvm_version": "0.8.dev0"}
{"input": ["opencl -keys=adreno,opencl,gpu -device=adreno -max_num_threads=256", "conv2d_nchw.cuda", [["TENSOR", [1, 3, 224, 224], "float16"], ["TENSOR", [32, 3, 3, 3], "float16"], [2, 2], [1, 1, 1, 1], [1, 1], "float16"], {}], "config": {"index": 4532891, "code_hash": null, "entity": [["tile_f", "sp", [-1, 2, 2, 2]], ["tile_y", "sp", [-1, 1, 7, 1]], ["tile_x", "sp", [-1, 1, 4, 1]], ["tile_rc", "sp", [-1, 1]], ["tile_ry", "sp", [-1, 1]], ["tile_rx", "sp", [-1, 3]], ["auto_unroll_max_step", "ot", 0], ["unroll_explicit", "ot", 0]]}, "result": [[0.00119585938], 0, 1.3616514205932617, 1638814466.6346636], "version": 0.2, "tvm_version": "0.8.dev0"}
{"input": ["opencl -keys=adreno,opencl,gpu -device=adreno -max_num_threads=256", "conv2d_nchw.cuda", [["TENSOR", [1, 3, 224, 224], "float16"], ["TENSOR", [32, 3, 3, 3], "float16"], [2, 2], [1, 1, 1, 1], [1, 1], "float16"], {}], "config": {"index": 9047410, "code_hash": null, "entity": [["tile_f", "sp", [-1, 2, 2, 8]], ["tile_y", "sp", [-1, 1, 1, 1]], ["tile_x", "sp", [-1, 2, 14, 1]], ["tile_rc", "sp", [-1, 1]], ["tile_ry", "sp", [-1, 1]], ["tile_rx", "sp", [-1, 1]], ["auto_unroll_max_step", "ot", 512], ["unroll_explicit", "ot", 0]]}, "result": [[0.0037073187400000003], 0, 2.94245982170105, 1638814468.2468078], "version": 0.2, "tvm_version": "0.8.dev0"}
{"input": ["opencl -keys=adreno,opencl,gpu -device=adreno -max_num_threads=256", "conv2d_nchw.cuda", [["TENSOR", [1, 3, 224, 224], "float16"], ["TENSOR", [32, 3, 3, 3], "float16"], [2, 2], [1, 1, 1, 1], [1, 1], "float16"], {}], "config": {"index": 9047398, "code_hash": null, "entity": [["tile_f", "sp", [-1, 4, 1, 4]], ["tile_y", "sp", [-1, 1, 1, 1]], ["tile_x", "sp", [-1, 2, 14, 1]], ["tile_rc", "sp", [-1, 1]], ["tile_ry", "sp", [-1, 1]], ["tile_rx", "sp", [-1, 1]], ["auto_unroll_max_step", "ot", 512], ["unroll_explicit", "ot", 0]]}, "result": [[0.00263742708], 0, 1.541029930114746, 1638814470.0922332], "version": 0.2, "tvm_version": "0.8.dev0"}
{"input": ["opencl -keys=adreno,opencl,gpu -device=adreno -max_num_threads=256", "conv2d_nchw.cuda", [["TENSOR", [1, 3, 224, 224], "float16"], ["TENSOR", [32, 3, 3, 3], "float16"], [2, 2], [1, 1, 1, 1], [1, 1], "float16"], {}], "config": {"index": 9047399, "code_hash": null, "entity": [["tile_f", "sp", [-1, 8, 1, 4]], ["tile_y", "sp", [-1, 1, 1, 1]], ["tile_x", "sp", [-1, 2, 14, 1]], ["tile_rc", "sp", [-1, 1]], ["tile_ry", "sp", [-1, 1]], ["tile_rx", "sp", [-1, 1]], ["auto_unroll_max_step", "ot", 512], ["unroll_explicit", "ot", 0]]}, "result": [[0.014515289580000002], 0, 4.586515426635742, 1638814473.182872], "version": 0.2, "tvm_version": "0.8.dev0"}
{"input": ["opencl -keys=adreno,opencl,gpu -device=adreno -max_num_threads=256", "conv2d_nchw.cuda", [["TENSOR", [1, 3, 224, 224], "float16"], ["TENSOR", [32, 3, 3, 3], "float16"], [2, 2], [1, 1, 1, 1], [1, 1], "float16"], {}], "config": {"index": 235801, "code_hash": null, "entity": [["tile_f", "sp", [-1, 2, 2, 4]], ["tile_y", "sp", [-1, 1, 2, 1]], ["tile_x", "sp", [-1, 2, 8, 1]], ["tile_rc", "sp", [-1, 1]], ["tile_ry", "sp", [-1, 1]], ["tile_rx", "sp", [-1, 1]], ["auto_unroll_max_step", "ot", 0], ["unroll_explicit", "ot", 0]]}, "result": [[0.0013504322999999998], 0, 1.363708734512329, 1638814474.851682], "version": 0.2, "tvm_version": "0.8.dev0"}
{"input": ["opencl -keys=adreno,opencl,gpu -device=adreno -max_num_threads=256", "conv2d_nchw.cuda", [["TENSOR", [1, 3, 224, 224], "float16"], ["TENSOR", [32, 3, 3, 3], "float16"], [2, 2], [1, 1, 1, 1], [1, 1], "float16"], {}], "config": {"index": 2862696, "code_hash": null, "entity": [["tile_f", "sp", [-1, 4, 4, 2]], ["tile_y", "sp", [-1, 2, 4, 1]], ["tile_x", "sp", [-1, 1, 4, 4]], ["tile_rc", "sp", [-1, 1]], ["tile_ry", "sp", [-1, 3]], ["tile_rx", "sp", [-1, 1]], ["auto_unroll_max_step", "ot", 0], ["unroll_explicit", "ot", 0]]}, "result": [[0.0138948052], 0, 4.3407063484191895, 1638814477.8611712], "version": 0.2, "tvm_version": "0.8.dev0"}
{"input": ["opencl -keys=adreno,opencl,gpu -device=adreno -max_num_threads=256", "conv2d_nchw.cuda", [["TENSOR", [1, 3, 224, 224], "float16"], ["TENSOR", [32, 3, 3, 3], "float16"], [2, 2], [1, 1, 1, 1], [1, 1], "float16"], {}], "config": {"index": 290747, "code_hash": null, "entity": [["tile_f", "sp", [-1, 1, 4, 8]], ["tile_y", "sp", [-1, 2, 2, 1]], ["tile_x", "sp", [-1, 1, 16, 1]], ["tile_rc", "sp", [-1, 1]], ["tile_ry", "sp", [-1, 1]], ["tile_rx", "sp", [-1, 1]], ["auto_unroll_max_step", "ot", 0], ["unroll_explicit", "ot", 0]]}, "result": [[0.0008458520799999999], 0, 1.1462368965148926, 1638814479.3055158], "version": 0.2, "tvm_version": "0.8.dev0"}
{"input": ["opencl -keys=adreno,opencl,gpu -device=adreno -max_num_threads=256", "conv2d_nchw.cuda", [["TENSOR", [1, 3, 224, 224], "float16"], ["TENSOR", [32, 3, 3, 3], "float16"], [2, 2], [1, 1, 1, 1], [1, 1], "float16"], {}], "config": {"index": 4532914, "code_hash": null, "entity": [["tile_f", "sp", [-1, 2, 2, 8]], ["tile_y", "sp", [-1, 1, 7, 1]], ["tile_x", "sp", [-1, 1, 4, 1]], ["tile_rc", "sp", [-1, 1]], ["tile_ry", "sp", [-1, 1]], ["tile_rx", "sp", [-1, 3]], ["auto_unroll_max_step", "ot", 0], ["unroll_explicit", "ot", 0]]}, "result": [[0.0007380749999999999], 0, 2.2933571338653564, 1638814480.4726276], "version": 0.2, "tvm_version": "0.8.dev0"}
{"input": ["opencl -keys=adreno,opencl,gpu -device=adreno -max_num_threads=256", "conv2d_nchw.cuda", [["TENSOR", [1, 3, 224, 224], "float16"], ["TENSOR", [32, 3, 3, 3], "float16"], [2, 2], [1, 1, 1, 1], [1, 1], "float16"], {}], "config": {"index": 2723146, "code_hash": null, "entity": [["tile_f", "sp", [-1, 2, 8, 2]], ["tile_y", "sp", [-1, 4, 1, 2]], ["tile_x", "sp", [-1, 1, 8, 2]], ["tile_rc", "sp", [-1, 1]], ["tile_ry", "sp", [-1, 3]], ["tile_rx", "sp", [-1, 1]], ["auto_unroll_max_step", "ot", 0], ["unroll_explicit", "ot", 0]]}, "result": [[0.0153584104], 0, 3.6072165966033936, 1638814484.3882515], "version": 0.2, "tvm_version": "0.8.dev0"}
{"input": ["opencl -keys=adreno,opencl,gpu -device=adreno -max_num_threads=256", "conv2d_nchw.cuda", [["TENSOR", [1, 3, 224, 224], "float16"], ["TENSOR", [32, 3, 3, 3], "float16"], [2, 2], [1, 1, 1, 1], [1, 1], "float16"], {}], "config": {"index": 2723090, "code_hash": null, "entity": [["tile_f", "sp", [-1, 2, 8, 2]], ["tile_y", "sp", [-1, 2, 1, 2]], ["tile_x", "sp", [-1, 1, 8, 2]], ["tile_rc", "sp", [-1, 1]], ["tile_ry", "sp", [-1, 3]], ["tile_rx", "sp", [-1, 1]], ["auto_unroll_max_step", "ot", 0], ["unroll_explicit", "ot", 0]]}, "result": [[0.00237811146], 0, 4.999495983123779, 1638814485.830881], "version": 0.2, "tvm_version": "0.8.dev0"}
{"input": ["opencl -keys=adreno,opencl,gpu -device=adreno -max_num_threads=256", "conv2d_nchw.cuda", [["TENSOR", [1, 3, 224, 224], "float16"], ["TENSOR", [32, 3, 3, 3], "float16"], [2, 2], [1, 1, 1, 1], [1, 1], "float16"], {}], "config": {"index": 1325561, "code_hash": null, "entity": [["tile_f", "sp", [-1, 2, 2, 4]], ["tile_y", "sp", [-1, 1, 2, 1]], ["tile_x", "sp", [-1, 1, 8, 1]], ["tile_rc", "sp", [-1, 3]], ["tile_ry", "sp", [-1, 1]], ["tile_rx", "sp", [-1, 1]], ["auto_unroll_max_step", "ot", 0], ["unroll_explicit", "ot", 0]]}, "result": [[0.0028948177], 0, 1.87727689743042, 1638814488.0042117], "version": 0.2, "tvm_version": "0.8.dev0"}
{"input": ["opencl -keys=adreno,opencl,gpu -device=adreno -max_num_threads=256", "conv2d_nchw.cuda", [["TENSOR", [1, 3, 224, 224], "float16"], ["TENSOR", [32, 3, 3, 3], "float16"], [2, 2], [1, 1, 1, 1], [1, 1], "float16"], {}], "config": {"index": 10020569, "code_hash": null, "entity": [["tile_f", "sp", [-1, 2, 2, 4]], ["tile_y", "sp", [-1, 1, 4, 1]], ["tile_x", "sp", [-1, 1, 4, 1]], ["tile_rc", "sp", [-1, 3]], ["tile_ry", "sp", [-1, 1]], ["tile_rx", "sp", [-1, 1]], ["auto_unroll_max_step", "ot", 512], ["unroll_explicit", "ot", 0]]}, "result": [[0.00296238646], 0, 3.412184000015259, 1638814489.579087], "version": 0.2, "tvm_version": "0.8.dev0"}
{"input": ["opencl -keys=adreno,opencl,gpu -device=adreno -max_num_threads=256", "conv2d_nchw.cuda", [["TENSOR", [1, 3, 224, 224], "float16"], ["TENSOR", [32, 3, 3, 3], "float16"], [2, 2], [1, 1, 1, 1], [1, 1], "float16"], {}], "config": {"index": 11504282, "code_hash": null, "entity": [["tile_f", "sp", [-1, 2, 8, 2]], ["tile_y", "sp", [-1, 1, 2, 2]], ["tile_x", "sp", [-1, 1, 8, 2]], ["tile_rc", "sp", [-1, 1]], ["tile_ry", "sp", [-1, 3]], ["tile_rx", "sp", [-1, 1]], ["auto_unroll_max_step", "ot", 512], ["unroll_explicit", "ot", 0]]}, "result": [[0.0004846604], 0, 1.2628352642059326, 1638814491.116349], "version": 0.2, "tvm_version": "0.8.dev0"}
{"input": ["opencl -keys=adreno,opencl,gpu -device=adreno -max_num_threads=256", "conv2d_nchw.cuda", [["TENSOR", [1, 3, 224, 224], "float16"], ["TENSOR", [32, 3, 3, 3], "float16"], [2, 2], [1, 1, 1, 1], [1, 1], "float16"], {}], "config": {"index": 11207930, "code_hash": null, "entity": [["tile_f", "sp", [-1, 2, 8, 2]], ["tile_y", "sp", [-1, 1, 2, 4]], ["tile_x", "sp", [-1, 1, 8, 1]], ["tile_rc", "sp", [-1, 1]], ["tile_ry", "sp", [-1, 3]], ["tile_rx", "sp", [-1, 1]], ["auto_unroll_max_step", "ot", 512], ["unroll_explicit", "ot", 0]]}, "result": [[0.00037569270000000003], 0, 2.2427756786346436, 1638814492.1285424], "version": 0.2, "tvm_version": "0.8.dev0"}
{"input": ["opencl -keys=adreno,opencl,gpu -device=adreno -max_num_threads=256", "conv2d_nchw.cuda", [["TENSOR", [1, 3, 224, 224], "float16"], ["TENSOR", [32, 3, 3, 3], "float16"], [2, 2], [1, 1, 1, 1], [1, 1], "float16"], {}], "config": {"index": 2433412, "code_hash": null, "entity": [["tile_f", "sp", [-1, 2, 4, 4]], ["tile_y", "sp", [-1, 1, 2, 2]], ["tile_x", "sp", [-1, 2, 8, 1]], ["tile_rc", "sp", [-1, 1]], ["tile_ry", "sp", [-1, 3]], ["tile_rx", "sp", [-1, 1]], ["auto_unroll_max_step", "ot", 0], ["unroll_explicit", "ot", 0]]}, "result": [[0.00226432918], 0, 1.8117811679840088, 1638814494.2764304], "version": 0.2, "tvm_version": "0.8.dev0"}
{"input": ["opencl -keys=adreno,opencl,gpu -device=adreno -max_num_threads=256", "conv2d_nchw.cuda", [["TENSOR", [1, 3, 224, 224], "float16"], ["TENSOR", [32, 3, 3, 3], "float16"], [2, 2], [1, 1, 1, 1], [1, 1], "float16"], {}], "config": {"index": 31309412, "code_hash": null, "entity": [["tile_f", "sp", [-1, 1, 1, 4]], ["tile_y", "sp", [-1, 2, 1, 4]], ["tile_x", "sp", [-1, 2, 28, 2]], ["tile_rc", "sp", [-1, 1]], ["tile_ry", "sp", [-1, 1]], ["tile_rx", "sp", [-1, 3]], ["auto_unroll_max_step", "ot", 0], ["unroll_explicit", "ot", 1]]}, "result": [[0.0106782125], 0, 2.9053947925567627, 1638814543.5685737], "version": 0.2, "tvm_version": "0.8.dev0"}
{"input": ["opencl -keys=adreno,opencl,gpu -device=adreno -max_num_threads=256", "conv2d_nchw.cuda", [["TENSOR", [1, 3, 224, 224], "float16"], ["TENSOR", [32, 3, 3, 3], "float16"], [2, 2], [1, 1, 1, 1], [1, 1], "float16"], {}], "config": {"index": 28766011, "code_hash": null, "entity": [["tile_f", "sp", [-1, 1, 4, 4]], ["tile_y", "sp", [-1, 1, 4, 1]], ["tile_x", "sp", [-1, 1, 8, 1]], ["tile_rc", "sp", [-1, 1]], ["tile_ry", "sp", [-1, 3]], ["tile_rx", "sp", [-1, 1]], ["auto_unroll_max_step", "ot", 0], ["unroll_explicit", "ot", 1]]}, "result": [[0.00087570416], 0, 2.5246994495391846, 1638815230.0236878], "version": 0.2, "tvm_version": "0.8.dev0"}
{"input": ["opencl -keys=adreno,opencl,gpu -device=adreno -max_num_threads=256", "conv2d_nchw.cuda", [["TENSOR", [1, 3, 224, 224], "float16"], ["TENSOR", [32, 3, 3, 3], "float16"], [2, 2], [1, 1, 1, 1], [1, 1], "float16"], {}], "config": {"index": 2423611, "code_hash": null, "entity": [["tile_f", "sp", [-1, 1, 4, 4]], ["tile_y", "sp", [-1, 1, 4, 1]], ["tile_x", "sp", [-1, 1, 8, 1]], ["tile_rc", "sp", [-1, 1]], ["tile_ry", "sp", [-1, 3]], ["tile_rx", "sp", [-1, 1]], ["auto_unroll_max_step", "ot", 0], ["unroll_explicit", "ot", 0]]}, "result": [[0.0008744375], 0, 3.807065486907959, 1638815231.332157], "version": 0.2, "tvm_version": "0.8.dev0"}
{"input": ["opencl -keys=adreno,opencl,gpu -device=adreno -max_num_threads=256", "conv2d_nchw.cuda", [["TENSOR", [1, 3, 224, 224], "float16"], ["TENSOR", [32, 3, 3, 3], "float16"], [2, 2], [1, 1, 1, 1], [1, 1], "float16"], {}], "config": {"index": 29065882, "code_hash": null, "entity": [["tile_f", "sp", [-1, 2, 8, 2]], ["tile_y", "sp", [-1, 1, 2, 2]], ["tile_x", "sp", [-1, 1, 8, 2]], ["tile_rc", "sp", [-1, 1]], ["tile_ry", "sp", [-1, 3]], ["tile_rx", "sp", [-1, 1]], ["auto_unroll_max_step", "ot", 0], ["unroll_explicit", "ot", 1]]}, "result": [[0.00043594272], 0, 1.2776904106140137, 1638815232.9814937], "version": 0.2, "tvm_version": "0.8.dev0"}
{"input": ["opencl -keys=adreno,opencl,gpu -device=adreno -max_num_threads=256", "conv2d_nchw.cuda", [["TENSOR", [1, 3, 224, 224], "float16"], ["TENSOR", [32, 3, 3, 3], "float16"], [2, 2], [1, 1, 1, 1], [1, 1], "float16"], {}], "config": {"index": 2723482, "code_hash": null, "entity": [["tile_f", "sp", [-1, 2, 8, 2]], ["tile_y", "sp", [-1, 1, 2, 2]], ["tile_x", "sp", [-1, 1, 8, 2]], ["tile_rc", "sp", [-1, 1]], ["tile_ry", "sp", [-1, 3]], ["tile_rx", "sp", [-1, 1]], ["auto_unroll_max_step", "ot", 0], ["unroll_explicit", "ot", 0]]}, "result": [[0.00045898958000000005], 0, 2.789100170135498, 1638815234.5539367], "version": 0.2, "tvm_version": "0.8.dev0"}
{"input": ["opencl -keys=adreno,opencl,gpu -device=adreno -max_num_threads=256", "conv2d_nchw.cuda", [["TENSOR", [1, 3, 224, 224], "float16"], ["TENSOR", [32, 3, 3, 3], "float16"], [2, 2], [1, 1, 1, 1], [1, 1], "float16"], {}], "config": {"index": 30875587, "code_hash": null, "entity": [["tile_f", "sp", [-1, 1, 4, 4]], ["tile_y", "sp", [-1, 1, 8, 1]], ["tile_x", "sp", [-1, 1, 4, 1]], ["tile_rc", "sp", [-1, 1]], ["tile_ry", "sp", [-1, 1]], ["tile_rx", "sp", [-1, 3]], ["auto_unroll_max_step", "ot", 0], ["unroll_explicit", "ot", 1]]}, "result": [[0.0009204177], 0, 1.3603894710540771, 1638815236.6321], "version": 0.2, "tvm_version": "0.8.dev0"}
{"input": ["opencl -keys=adreno,opencl,gpu -device=adreno -max_num_threads=256", "conv2d_nchw.cuda", [["TENSOR", [1, 3, 224, 224], "float16"], ["TENSOR", [32, 3, 3, 3], "float16"], [2, 2], [1, 1, 1, 1], [1, 1], "float16"], {}], "config": {"index": 37546811, "code_hash": null, "entity": [["tile_f", "sp", [-1, 1, 4, 4]], ["tile_y", "sp", [-1, 1, 4, 1]], ["tile_x", "sp", [-1, 1, 8, 1]], ["tile_rc", "sp", [-1, 1]], ["tile_ry", "sp", [-1, 3]], ["tile_rx", "sp", [-1, 1]], ["auto_unroll_max_step", "ot", 512], ["unroll_explicit", "ot", 1]]}, "result": [[0.00111004896], 0, 2.908026933670044, 1638815237.8847027], "version": 0.2, "tvm_version": "0.8.dev0"}
{"input": ["opencl -keys=adreno,opencl,gpu -device=adreno -max_num_threads=256", "conv2d_nchw.cuda", [["TENSOR", [1, 3, 224, 224], "float16"], ["TENSOR", [32, 3, 3, 3], "float16"], [2, 2], [1, 1, 1, 1], [1, 1], "float16"], {}], "config": {"index": 46327611, "code_hash": null, "entity": [["tile_f", "sp", [-1, 1, 4, 4]], ["tile_y", "sp", [-1, 1, 4, 1]], ["tile_x", "sp", [-1, 1, 8, 1]], ["tile_rc", "sp", [-1, 1]], ["tile_ry", "sp", [-1, 3]], ["tile_rx", "sp", [-1, 1]], ["auto_unroll_max_step", "ot", 1500], ["unroll_explicit", "ot", 1]]}, "result": [[0.00110057292], 0, 1.8387763500213623, 1638815240.104352], "version": 0.2, "tvm_version": "0.8.dev0"}
{"input": ["opencl -keys=adreno,opencl,gpu -device=adreno -max_num_threads=256", "conv2d_nchw.cuda", [["TENSOR", [1, 3, 224, 224], "float16"], ["TENSOR", [32, 3, 3, 3], "float16"], [2, 2], [1, 1, 1, 1], [1, 1], "float16"], {}], "config": {"index": 11204411, "code_hash": null, "entity": [["tile_f", "sp", [-1, 1, 4, 4]], ["tile_y", "sp", [-1, 1, 4, 1]], ["tile_x", "sp", [-1, 1, 8, 1]], ["tile_rc", "sp", [-1, 1]], ["tile_ry", "sp", [-1, 3]], ["tile_rx", "sp", [-1, 1]], ["auto_unroll_max_step", "ot", 512], ["unroll_explicit", "ot", 0]]}, "result": [[0.00088922396], 0, 2.644214153289795, 1638815241.3058686], "version": 0.2, "tvm_version": "0.8.dev0"}
