sd888_log/ww48/yolov3_textures.fp16.log.tmp
{"input": ["opencl -keys=adreno,opencl,gpu -device=adreno -max_num_threads=256", "conv2d_nhwc.cuda", [["TENSOR", [1, 416, 416, 3], "float16"], ["TENSOR", [3, 3, 3, 32], "float16"], [1, 1], [1, 1, 1, 1], [1, 1], "float16"], {}], "config": {"index": 167, "code_hash": null, "entity": [["tile_n", "ot", 8], ["tile_c", "ot", 4], ["num_thread_n", "ot", 4], ["num_thread_c", "ot", 4], ["vthread_n", "ot", 1], ["vthread_c", "ot", 2], ["step", "ot", 16]]}, "result": [[0.06055206144], 0, 45.83908820152283, 1637952419.378495], "version": 0.2, "tvm_version": "0.8.dev0"}
{"input": ["opencl -keys=adreno,opencl,gpu -device=adreno -max_num_threads=256", "conv2d_nhwc.cuda", [["TENSOR", [1, 416, 416, 3], "float16"], ["TENSOR", [3, 3, 3, 32], "float16"], [1, 1], [1, 1, 1, 1], [1, 1], "float16"], {}], "config": {"index": 1180, "code_hash": null, "entity": [["tile_n", "ot", 4], ["tile_c", "ot", 2], ["num_thread_n", "ot", 16], ["num_thread_c", "ot", 8], ["vthread_n", "ot", 1], ["vthread_c", "ot", 2], ["step", "ot", 64]]}, "result": [[0.04870824686], 0, 41.97966694831848, 1637952823.0456061], "version": 0.2, "tvm_version": "0.8.dev0"}
{"input": ["opencl -keys=adreno,opencl,gpu -device=adreno -max_num_threads=256", "conv2d_nhwc.cuda", [["TENSOR", [1, 416, 416, 3], "float16"], ["TENSOR", [3, 3, 3, 32], "float16"], [1, 1], [1, 1, 1, 1], [1, 1], "float16"], {}], "config": {"index": 567, "code_hash": null, "entity": [["tile_n", "ot", 2], ["tile_c", "ot", 2], ["num_thread_n", "ot", 4], ["num_thread_c", "ot", 4], ["vthread_n", "ot", 2], ["vthread_c", "ot", 2], ["step", "ot", 3]]}, "result": [[0.057723348939999995], 0, 12.92588996887207, 1637953080.0210373], "version": 0.2, "tvm_version": "0.8.dev0"}
{"input": ["opencl -keys=adreno,opencl,gpu -device=adreno -max_num_threads=256", "conv2d_nhwc.cuda", [["TENSOR", [1, 416, 416, 3], "float16"], ["TENSOR", [3, 3, 3, 32], "float16"], [1, 1], [1, 1, 1, 1], [1, 1], "float16"], {}], "config": {"index": 185, "code_hash": null, "entity": [["tile_n", "ot", 8], ["tile_c", "ot", 4], ["num_thread_n", "ot", 16], ["num_thread_c", "ot", 4], ["vthread_n", "ot", 1], ["vthread_c", "ot", 2], ["step", "ot", 16]]}, "result": [[0.04192463955999999], 0, 10.171308040618896, 1637953191.2050402], "version": 0.2, "tvm_version": "0.8.dev0"}
{"input": ["opencl -keys=adreno,opencl,gpu -device=adreno -max_num_threads=256", "conv2d_nhwc.cuda", [["TENSOR", [1, 416, 416, 3], "float16"], ["TENSOR", [3, 3, 3, 32], "float16"], [1, 1], [1, 1, 1, 1], [1, 1], "float16"], {}], "config": {"index": 1156, "code_hash": null, "entity": [["tile_n", "ot", 4], ["tile_c", "ot", 4], ["num_thread_n", "ot", 16], ["num_thread_c", "ot", 4], ["vthread_n", "ot", 1], ["vthread_c", "ot", 2], ["step", "ot", 64]]}, "result": [[0.04191799582], 0, 10.826845169067383, 1637953518.9879696], "version": 0.2, "tvm_version": "0.8.dev0"}
{"input": ["opencl -keys=adreno,opencl,gpu -device=adreno -max_num_threads=256", "conv2d_nhwc.cuda", [["TENSOR", [1, 416, 416, 3], "float16"], ["TENSOR", [3, 3, 3, 32], "float16"], [1, 1], [1, 1, 1, 1], [1, 1], "float16"], {}], "config": {"index": 488, "code_hash": null, "entity": [["tile_n", "ot", 8], ["tile_c", "ot", 2], ["num_thread_n", "ot", 4], ["num_thread_c", "ot", 4], ["vthread_n", "ot", 1], ["vthread_c", "ot", 2], ["step", "ot", 3]]}, "result": [[0.057650014560000004], 0, 23.91497540473938, 1637953532.0951362], "version": 0.2, "tvm_version": "0.8.dev0"}
{"input": ["opencl -keys=adreno,opencl,gpu -device=adreno -max_num_threads=256", "conv2d_nhwc.cuda", [["TENSOR", [1, 416, 416, 3], "float16"], ["TENSOR", [3, 3, 3, 32], "float16"], [1, 1], [1, 1, 1, 1], [1, 1], "float16"], {}], "config": {"index": 174, "code_hash": null, "entity": [["tile_n", "ot", 2], ["tile_c", "ot", 4], ["num_thread_n", "ot", 8], ["num_thread_c", "ot", 4], ["vthread_n", "ot", 1], ["vthread_c", "ot", 2], ["step", "ot", 16]]}, "result": [[0.039656529159999995], 0, 10.18924856185913, 1637953542.8474946], "version": 0.2, "tvm_version": "0.8.dev0"}
{"input": ["opencl -keys=adreno,opencl,gpu -device=adreno -max_num_threads=256", "conv2d_nhwc.cuda", [["TENSOR", [1, 416, 416, 3], "float16"], ["TENSOR", [3, 3, 3, 32], "float16"], [1, 1], [1, 1, 1, 1], [1, 1], "float16"], {}], "config": {"index": 176, "code_hash": null, "entity": [["tile_n", "ot", 8], ["tile_c", "ot", 4], ["num_thread_n", "ot", 8], ["num_thread_c", "ot", 4], ["vthread_n", "ot", 1], ["vthread_c", "ot", 2], ["step", "ot", 16]]}, "result": [[0.0396508052], 0, 11.815202713012695, 1637954281.3332717], "version": 0.2, "tvm_version": "0.8.dev0"}
{"input": ["opencl -keys=adreno,opencl,gpu -device=adreno -max_num_threads=256", "conv2d_nhwc.cuda", [["TENSOR", [1, 416, 416, 3], "float16"], ["TENSOR", [3, 3, 3, 32], "float16"], [1, 1], [1, 1, 1, 1], [1, 1], "float16"], {}], "config": {"index": 175, "code_hash": null, "entity": [["tile_n", "ot", 4], ["tile_c", "ot", 4], ["num_thread_n", "ot", 8], ["num_thread_c", "ot", 4], ["vthread_n", "ot", 1], ["vthread_c", "ot", 2], ["step", "ot", 16]]}, "result": [[0.03964235], 0, 24.86844801902771, 1637954294.3915474], "version": 0.2, "tvm_version": "0.8.dev0"}
{"input": ["opencl -keys=adreno,opencl,gpu -device=adreno -max_num_threads=256", "conv2d_nhwc.cuda", [["TENSOR", [1, 416, 416, 3], "float16"], ["TENSOR", [3, 3, 3, 32], "float16"], [1, 1], [1, 1, 1, 1], [1, 1], "float16"], {}], "config": {"index": 499, "code_hash": null, "entity": [["tile_n", "ot", 4], ["tile_c", "ot", 4], ["num_thread_n", "ot", 8], ["num_thread_c", "ot", 4], ["vthread_n", "ot", 1], ["vthread_c", "ot", 2], ["step", "ot", 3]]}, "result": [[0.039549948939999996], 0, 10.634438276290894, 1637954307.4690611], "version": 0.2, "tvm_version": "0.8.dev0"}
{"input": ["opencl -keys=adreno,opencl,gpu -device=adreno -max_num_threads=256", "conv2d_nhwc.cuda", [["TENSOR", [1, 416, 416, 3], "float16"], ["TENSOR", [3, 3, 3, 32], "float16"], [1, 1], [1, 1, 1, 1], [1, 1], "float16"], {}], "config": {"index": 507, "code_hash": null, "entity": [["tile_n", "ot", 2], ["tile_c", "ot", 4], ["num_thread_n", "ot", 16], ["num_thread_c", "ot", 4], ["vthread_n", "ot", 1], ["vthread_c", "ot", 2], ["step", "ot", 3]]}, "result": [[0.04176599062], 0, 35.617995262145996, 1637954392.6109319], "version": 0.2, "tvm_version": "0.8.dev0"}
{"input": ["opencl -keys=adreno,opencl,gpu -device=adreno -max_num_threads=256", "conv2d_nhwc.cuda", [["TENSOR", [1, 416, 416, 3], "float16"], ["TENSOR", [3, 3, 3, 32], "float16"], [1, 1], [1, 1, 1, 1], [1, 1], "float16"], {}], "config": {"index": 824, "code_hash": null, "entity": [["tile_n", "ot", 8], ["tile_c", "ot", 4], ["num_thread_n", "ot", 8], ["num_thread_c", "ot", 4], ["vthread_n", "ot", 1], ["vthread_c", "ot", 2], ["step", "ot", 32]]}, "result": [[0.03963362812], 0, 11.550806999206543, 1637954472.6313422], "version": 0.2, "tvm_version": "0.8.dev0"}
{"input": ["opencl -keys=adreno,opencl,gpu -device=adreno -max_num_threads=256", "conv2d_nhwc.cuda", [["TENSOR", [1, 416, 416, 3], "float16"], ["TENSOR", [3, 3, 3, 32], "float16"], [1, 1], [1, 1, 1, 1], [1, 1], "float16"], {}], "config": {"index": 823, "code_hash": null, "entity": [["tile_n", "ot", 4], ["tile_c", "ot", 4], ["num_thread_n", "ot", 8], ["num_thread_c", "ot", 4], ["vthread_n", "ot", 1], ["vthread_c", "ot", 2], ["step", "ot", 32]]}, "result": [[0.039639540599999995], 0, 25.484501123428345, 1637954486.5842025], "version": 0.2, "tvm_version": "0.8.dev0"}
{"input": ["opencl -keys=adreno,opencl,gpu -device=adreno -max_num_threads=256", "conv2d_nhwc.cuda", [["TENSOR", [1, 416, 416, 3], "float16"], ["TENSOR", [3, 3, 3, 32], "float16"], [1, 1], [1, 1, 1, 1], [1, 1], "float16"], {}], "config": {"index": 190, "code_hash": null, "entity": [["tile_n", "ot", 4], ["tile_c", "ot", 2], ["num_thread_n", "ot", 4], ["num_thread_c", "ot", 8], ["vthread_n", "ot", 1], ["vthread_c", "ot", 2], ["step", "ot", 16]]}, "result": [[0.030709840619999998], 0, 28.29828643798828, 1637954583.9820392], "version": 0.2, "tvm_version": "0.8.dev0"}
{"input": ["opencl -keys=adreno,opencl,gpu -device=adreno -max_num_threads=256", "conv2d_nhwc.cuda", [["TENSOR", [1, 416, 416, 3], "float16"], ["TENSOR", [3, 3, 3, 32], "float16"], [1, 1], [1, 1, 1, 1], [1, 1], "float16"], {}], "config": {"index": 1161, "code_hash": null, "entity": [["tile_n", "ot", 2], ["tile_c", "ot", 2], ["num_thread_n", "ot", 4], ["num_thread_c", "ot", 8], ["vthread_n", "ot", 1], ["vthread_c", "ot", 2], ["step", "ot", 64]]}, "result": [[0.030715646860000004], 0, 13.357985258102417, 1637954597.7548885], "version": 0.2, "tvm_version": "0.8.dev0"}
{"input": ["opencl -keys=adreno,opencl,gpu -device=adreno -max_num_threads=256", "conv2d_nhwc.cuda", [["TENSOR", [1, 416, 416, 3], "float16"], ["TENSOR", [3, 3, 3, 32], "float16"], [1, 1], [1, 1, 1, 1], [1, 1], "float16"], {}], "config": {"index": 191, "code_hash": null, "entity": [["tile_n", "ot", 8], ["tile_c", "ot", 2], ["num_thread_n", "ot", 4], ["num_thread_c", "ot", 8], ["vthread_n", "ot", 1], ["vthread_c", "ot", 2], ["step", "ot", 16]]}, "result": [[0.03072755936], 0, 25.560762882232666, 1637954609.9840903], "version": 0.2, "tvm_version": "0.8.dev0"}
{"input": ["opencl -keys=adreno,opencl,gpu -device=adreno -max_num_threads=256", "conv2d_nhwc.cuda", [["TENSOR", [1, 416, 416, 3], "float16"], ["TENSOR", [3, 3, 3, 32], "float16"], [1, 1], [1, 1, 1, 1], [1, 1], "float16"], {}], "config": {"index": 513, "code_hash": null, "entity": [["tile_n", "ot", 2], ["tile_c", "ot", 2], ["num_thread_n", "ot", 4], ["num_thread_c", "ot", 8], ["vthread_n", "ot", 1], ["vthread_c", "ot", 2], ["step", "ot", 3]]}, "result": [[0.03073748852], 0, 14.660284042358398, 1637954626.155598], "version": 0.2, "tvm_version": "0.8.dev0"}
{"input": ["opencl -keys=adreno,opencl,gpu -device=adreno -max_num_threads=256", "conv2d_nhwc.cuda", [["TENSOR", [1, 416, 416, 3], "float16"], ["TENSOR", [3, 3, 3, 32], "float16"], [1, 1], [1, 1, 1, 1], [1, 1], "float16"], {}], "config": {"index": 839, "code_hash": null, "entity": [["tile_n", "ot", 8], ["tile_c", "ot", 2], ["num_thread_n", "ot", 4], ["num_thread_c", "ot", 8], ["vthread_n", "ot", 1], ["vthread_c", "ot", 2], ["step", "ot", 32]]}, "result": [[0.0307020854], 0, 31.30100727081299, 1637954674.0209482], "version": 0.2, "tvm_version": "0.8.dev0"}
{"input": ["opencl -keys=adreno,opencl,gpu -device=adreno -max_num_threads=256", "conv2d_nhwc.cuda", [["TENSOR", [1, 416, 416, 3], "float16"], ["TENSOR", [3, 3, 3, 32], "float16"], [1, 1], [1, 1, 1, 1], [1, 1], "float16"], {}], "config": {"index": 1163, "code_hash": null, "entity": [["tile_n", "ot", 8], ["tile_c", "ot", 2], ["num_thread_n", "ot", 4], ["num_thread_c", "ot", 8], ["vthread_n", "ot", 1], ["vthread_c", "ot", 2], ["step", "ot", 64]]}, "result": [[0.03071313124], 0, 15.254748106002808, 1637954721.2742], "version": 0.2, "tvm_version": "0.8.dev0"}
{"input": ["opencl -keys=adreno,opencl,gpu -device=adreno -max_num_threads=256", "conv2d_nhwc.cuda", [["TENSOR", [1, 416, 416, 3], "float16"], ["TENSOR", [3, 3, 3, 32], "float16"], [1, 1], [1, 1, 1, 1], [1, 1], "float16"], {}], "config": {"index": 838, "code_hash": null, "entity": [["tile_n", "ot", 4], ["tile_c", "ot", 2], ["num_thread_n", "ot", 4], ["num_thread_c", "ot", 8], ["vthread_n", "ot", 1], ["vthread_c", "ot", 2], ["step", "ot", 32]]}, "result": [[0.030728526040000002], 0, 26.763683319091797, 1637954732.8097298], "version": 0.2, "tvm_version": "0.8.dev0"}
{"input": ["opencl -keys=adreno,opencl,gpu -device=adreno -max_num_threads=256", "conv2d_nhwc.cuda", [["TENSOR", [1, 416, 416, 3], "float16"], ["TENSOR", [3, 3, 3, 32], "float16"], [1, 1], [1, 1, 1, 1], [1, 1], "float16"], {}], "config": {"index": 532, "code_hash": null, "entity": [["tile_n", "ot", 4], ["tile_c", "ot", 2], ["num_thread_n", "ot", 16], ["num_thread_c", "ot", 8], ["vthread_n", "ot", 1], ["vthread_c", "ot", 2], ["step", "ot", 3]]}, "result": [[0.048768882279999995], 0, 31.446595668792725, 1637954764.9110827], "version": 0.2, "tvm_version": "0.8.dev0"}
{"input": ["opencl -keys=adreno,opencl,gpu -device=adreno -max_num_threads=256", "conv2d_nhwc.cuda", [["TENSOR", [1, 416, 416, 3], "float16"], ["TENSOR", [3, 3, 3, 32], "float16"], [1, 1], [1, 1, 1, 1], [1, 1], "float16"], {}], "config": {"index": 165, "code_hash": null, "entity": [["tile_n", "ot", 2], ["tile_c", "ot", 4], ["num_thread_n", "ot", 4], ["num_thread_c", "ot", 4], ["vthread_n", "ot", 1], ["vthread_c", "ot", 2], ["step", "ot", 16]]}, "result": [[0.06054783642], 0, 15.969010353088379, 1637954947.4874759], "version": 0.2, "tvm_version": "0.8.dev0"}
{"input": ["opencl -keys=adreno,opencl,gpu -device=adreno -max_num_threads=256", "conv2d_nhwc.cuda", [["TENSOR", [1, 416, 416, 3], "float16"], ["TENSOR", [3, 3, 3, 32], "float16"], [1, 1], [1, 1, 1, 1], [1, 1], "float16"], {}], "config": {"index": 815, "code_hash": null, "entity": [["tile_n", "ot", 8], ["tile_c", "ot", 4], ["num_thread_n", "ot", 4], ["num_thread_c", "ot", 4], ["vthread_n", "ot", 1], ["vthread_c", "ot", 2], ["step", "ot", 32]]}, "result": [[0.06056105726], 0, 29.592005014419556, 1637954993.7800918], "version": 0.2, "tvm_version": "0.8.dev0"}
{"input": ["opencl -keys=adreno,opencl,gpu -device=adreno -max_num_threads=256", "conv2d_nhwc.cuda", [["TENSOR", [1, 416, 416, 3], "float16"], ["TENSOR", [3, 3, 3, 32], "float16"], [1, 1], [1, 1, 1, 1], [1, 1], "float16"], {}], "config": {"index": 490, "code_hash": null, "entity": [["tile_n", "ot", 4], ["tile_c", "ot", 4], ["num_thread_n", "ot", 4], ["num_thread_c", "ot", 4], ["vthread_n", "ot", 1], ["vthread_c", "ot", 2], ["step", "ot", 3]]}, "result": [[0.061372335400000005], 0, 34.720232009887695, 1637955029.2328863], "version": 0.2, "tvm_version": "0.8.dev0"}
{"input": ["opencl -keys=adreno,opencl,gpu -device=adreno -max_num_threads=256", "conv2d_nhwc.cuda", [["TENSOR", [1, 416, 416, 3], "float16"], ["TENSOR", [3, 3, 3, 32], "float16"], [1, 1], [1, 1, 1, 1], [1, 1], "float16"], {}], "config": {"index": 1139, "code_hash": null, "entity": [["tile_n", "ot", 8], ["tile_c", "ot", 4], ["num_thread_n", "ot", 4], ["num_thread_c", "ot", 4], ["vthread_n", "ot", 1], ["vthread_c", "ot", 2], ["step", "ot", 64]]}, "result": [[0.06056322081999999], 0, 14.84072232246399, 1637955044.5156476], "version": 0.2, "tvm_version": "0.8.dev0"}
{"input": ["opencl -keys=adreno,opencl,gpu -device=adreno -max_num_threads=256", "conv2d_nhwc.cuda", [["TENSOR", [1, 416, 416, 3], "float16"], ["TENSOR", [3, 3, 3, 32], "float16"], [1, 1], [1, 1, 1, 1], [1, 1], "float16"], {}], "config": {"index": 1138, "code_hash": null, "entity": [["tile_n", "ot", 4], ["tile_c", "ot", 4], ["num_thread_n", "ot", 4], ["num_thread_c", "ot", 4], ["vthread_n", "ot", 1], ["vthread_c", "ot", 2], ["step", "ot", 64]]}, "result": [[0.060534286439999994], 0, 12.972837686538696, 1637955110.4021297], "version": 0.2, "tvm_version": "0.8.dev0"}
{"input": ["opencl -keys=adreno,opencl,gpu -device=adreno -max_num_threads=256", "conv2d_nhwc.cuda", [["TENSOR", [1, 416, 416, 3], "float16"], ["TENSOR", [3, 3, 3, 32], "float16"], [1, 1], [1, 1, 1, 1], [1, 1], "float16"], {}], "config": {"index": 522, "code_hash": null, "entity": [["tile_n", "ot", 2], ["tile_c", "ot", 2], ["num_thread_n", "ot", 8], ["num_thread_c", "ot", 8], ["vthread_n", "ot", 1], ["vthread_c", "ot", 2], ["step", "ot", 3]]}, "result": [[0.03286917914], 0, 21.598028898239136, 1637955119.0538762], "version": 0.2, "tvm_version": "0.8.dev0"}
{"input": ["opencl -keys=adreno,opencl,gpu -device=adreno -max_num_threads=256", "conv2d_nhwc.cuda", [["TENSOR", [1, 416, 416, 3], "float16"], ["TENSOR", [3, 3, 3, 32], "float16"], [1, 1], [1, 1, 1, 1], [1, 1], "float16"], {}], "config": {"index": 524, "code_hash": null, "entity": [["tile_n", "ot", 8], ["tile_c", "ot", 2], ["num_thread_n", "ot", 8], ["num_thread_c", "ot", 8], ["vthread_n", "ot", 1], ["vthread_c", "ot", 2], ["step", "ot", 3]]}, "result": [[0.03288536562], 0, 8.89871597290039, 1637955128.4150643], "version": 0.2, "tvm_version": "0.8.dev0"}
{"input": ["opencl -keys=adreno,opencl,gpu -device=adreno -max_num_threads=256", "conv2d_nhwc.cuda", [["TENSOR", [1, 416, 416, 3], "float16"], ["TENSOR", [3, 3, 3, 32], "float16"], [1, 1], [1, 1, 1, 1], [1, 1], "float16"], {}], "config": {"index": 523, "code_hash": null, "entity": [["tile_n", "ot", 4], ["tile_c", "ot", 2], ["num_thread_n", "ot", 8], ["num_thread_c", "ot", 8], ["vthread_n", "ot", 1], ["vthread_c", "ot", 2], ["step", "ot", 3]]}, "result": [[0.032879122920000003], 0, 17.898376941680908, 1637955137.4321258], "version": 0.2, "tvm_version": "0.8.dev0"}
{"input": ["opencl -keys=adreno,opencl,gpu -device=adreno -max_num_threads=256", "conv2d_nhwc.cuda", [["TENSOR", [1, 416, 416, 3], "float16"], ["TENSOR", [3, 3, 3, 32], "float16"], [1, 1], [1, 1, 1, 1], [1, 1], "float16"], {}], "config": {"index": 847, "code_hash": null, "entity": [["tile_n", "ot", 4], ["tile_c", "ot", 2], ["num_thread_n", "ot", 8], ["num_thread_c", "ot", 8], ["vthread_n", "ot", 1], ["vthread_c", "ot", 2], ["step", "ot", 32]]}, "result": [[0.033361344779999996], 0, 9.123642444610596, 1637955147.1701212], "version": 0.2, "tvm_version": "0.8.dev0"}
{"input": ["opencl -keys=adreno,opencl,gpu -device=adreno -max_num_threads=256", "conv2d_nhwc.cuda", [["TENSOR", [1, 416, 416, 3], "float16"], ["TENSOR", [3, 3, 3, 32], "float16"], [1, 1], [1, 1, 1, 1], [1, 1], "float16"], {}], "config": {"index": 848, "code_hash": null, "entity": [["tile_n", "ot", 8], ["tile_c", "ot", 2], ["num_thread_n", "ot", 8], ["num_thread_c", "ot", 8], ["vthread_n", "ot", 1], ["vthread_c", "ot", 2], ["step", "ot", 32]]}, "result": [[0.03337422394], 0, 18.068179607391357, 1637955156.1345336], "version": 0.2, "tvm_version": "0.8.dev0"}
{"input": ["opencl -keys=adreno,opencl,gpu -device=adreno -max_num_threads=256", "conv2d_nhwc.cuda", [["TENSOR", [1, 416, 416, 3], "float16"], ["TENSOR", [3, 3, 3, 32], "float16"], [1, 1], [1, 1, 1, 1], [1, 1], "float16"], {}], "config": {"index": 846, "code_hash": null, "entity": [["tile_n", "ot", 2], ["tile_c", "ot", 2], ["num_thread_n", "ot", 8], ["num_thread_c", "ot", 8], ["vthread_n", "ot", 1], ["vthread_c", "ot", 2], ["step", "ot", 32]]}, "result": [[0.0333676677], 0, 9.08125638961792, 1637955165.7134497], "version": 0.2, "tvm_version": "0.8.dev0"}
{"input": ["opencl -keys=adreno,opencl,gpu -device=adreno -max_num_threads=256", "conv2d_nhwc.cuda", [["TENSOR", [1, 416, 416, 3], "float16"], ["TENSOR", [3, 3, 3, 32], "float16"], [1, 1], [1, 1, 1, 1], [1, 1], "float16"], {}], "config": {"index": 200, "code_hash": null, "entity": [["tile_n", "ot", 8], ["tile_c", "ot", 2], ["num_thread_n", "ot", 8], ["num_thread_c", "ot", 8], ["vthread_n", "ot", 1], ["vthread_c", "ot", 2], ["step", "ot", 16]]}, "result": [[0.03336927706], 0, 8.561094284057617, 1637955252.8256426], "version": 0.2, "tvm_version": "0.8.dev0"}
{"input": ["opencl -keys=adreno,opencl,gpu -device=adreno -max_num_threads=256", "conv2d_nhwc.cuda", [["TENSOR", [1, 416, 416, 3], "float16"], ["TENSOR", [3, 3, 3, 32], "float16"], [1, 1], [1, 1, 1, 1], [1, 1], "float16"], {}], "config": {"index": 198, "code_hash": null, "entity": [["tile_n", "ot", 2], ["tile_c", "ot", 2], ["num_thread_n", "ot", 8], ["num_thread_c", "ot", 8], ["vthread_n", "ot", 1], ["vthread_c", "ot", 2], ["step", "ot", 16]]}, "result": [[0.03337613854], 0, 16.990556240081787, 1637955261.2650912], "version": 0.2, "tvm_version": "0.8.dev0"}
{"input": ["opencl -keys=adreno,opencl,gpu -device=adreno -max_num_threads=256", "conv2d_nhwc.cuda", [["TENSOR", [1, 416, 416, 3], "float16"], ["TENSOR", [3, 3, 3, 32], "float16"], [1, 1], [1, 1, 1, 1], [1, 1], "float16"], {}], "config": {"index": 199, "code_hash": null, "entity": [["tile_n", "ot", 4], ["tile_c", "ot", 2], ["num_thread_n", "ot", 8], ["num_thread_c", "ot", 8], ["vthread_n", "ot", 1], ["vthread_c", "ot", 2], ["step", "ot", 16]]}, "result": [[0.03336335416], 0, 8.9794442653656, 1637955270.6779778], "version": 0.2, "tvm_version": "0.8.dev0"}
{"input": ["opencl -keys=adreno,opencl,gpu -device=adreno -max_num_threads=256", "conv2d_nhwc.cuda", [["TENSOR", [1, 416, 416, 3], "float16"], ["TENSOR", [3, 3, 3, 32], "float16"], [1, 1], [1, 1, 1, 1], [1, 1], "float16"], {}], "config": {"index": 486, "code_hash": null, "entity": [["tile_n", "ot", 2], ["tile_c", "ot", 2], ["num_thread_n", "ot", 4], ["num_thread_c", "ot", 4], ["vthread_n", "ot", 1], ["vthread_c", "ot", 2], ["step", "ot", 3]]}, "result": [[0.05764081559999999], 0, 21.17474889755249, 1637955282.8914862], "version": 0.2, "tvm_version": "0.8.dev0"}
{"input": ["opencl -keys=adreno,opencl,gpu -device=adreno -max_num_threads=256", "conv2d_nhwc.cuda", [["TENSOR", [1, 416, 416, 3], "float16"], ["TENSOR", [3, 3, 3, 32], "float16"], [1, 1], [1, 1, 1, 1], [1, 1], "float16"], {}], "config": {"index": 487, "code_hash": null, "entity": [["tile_n", "ot", 4], ["tile_c", "ot", 2], ["num_thread_n", "ot", 4], ["num_thread_c", "ot", 4], ["vthread_n", "ot", 1], ["vthread_c", "ot", 2], ["step", "ot", 3]]}, "result": [[0.05764018956], 0, 12.540544271469116, 1637955295.8579204], "version": 0.2, "tvm_version": "0.8.dev0"}
{"input": ["opencl -keys=adreno,opencl,gpu -device=adreno -max_num_threads=256", "conv2d_nhwc.cuda", [["TENSOR", [1, 416, 416, 3], "float16"], ["TENSOR", [3, 3, 3, 32], "float16"], [1, 1], [1, 1, 1, 1], [1, 1], "float16"], {}], "config": {"index": 812, "code_hash": null, "entity": [["tile_n", "ot", 8], ["tile_c", "ot", 2], ["num_thread_n", "ot", 4], ["num_thread_c", "ot", 4], ["vthread_n", "ot", 1], ["vthread_c", "ot", 2], ["step", "ot", 32]]}, "result": [[0.05724674267999999], 0, 27.34198498725891, 1637955310.681098], "version": 0.2, "tvm_version": "0.8.dev0"}
{"input": ["opencl -keys=adreno,opencl,gpu -device=adreno -max_num_threads=256", "conv2d_nhwc.cuda", [["TENSOR", [1, 416, 416, 3], "float16"], ["TENSOR", [3, 3, 3, 32], "float16"], [1, 1], [1, 1, 1, 1], [1, 1], "float16"], {}], "config": {"index": 164, "code_hash": null, "entity": [["tile_n", "ot", 8], ["tile_c", "ot", 2], ["num_thread_n", "ot", 4], ["num_thread_c", "ot", 4], ["vthread_n", "ot", 1], ["vthread_c", "ot", 2], ["step", "ot", 16]]}, "result": [[0.05723355102], 0, 12.45633864402771, 1637955323.6068432], "version": 0.2, "tvm_version": "0.8.dev0"}
{"input": ["opencl -keys=adreno,opencl,gpu -device=adreno -max_num_threads=256", "conv2d_nhwc.cuda", [["TENSOR", [1, 416, 416, 3], "float16"], ["TENSOR", [3, 3, 3, 32], "float16"], [1, 1], [1, 1, 1, 1], [1, 1], "float16"], {}], "config": {"index": 1171, "code_hash": null, "entity": [["tile_n", "ot", 4], ["tile_c", "ot", 2], ["num_thread_n", "ot", 8], ["num_thread_c", "ot", 8], ["vthread_n", "ot", 1], ["vthread_c", "ot", 2], ["step", "ot", 64]]}, "result": [[0.03335955728], 0, 21.620940685272217, 1637955332.7898116], "version": 0.2, "tvm_version": "0.8.dev0"}
{"input": ["opencl -keys=adreno,opencl,gpu -device=adreno -max_num_threads=256", "conv2d_nhwc.cuda", [["TENSOR", [1, 416, 416, 3], "float16"], ["TENSOR", [3, 3, 3, 32], "float16"], [1, 1], [1, 1, 1, 1], [1, 1], "float16"], {}], "config": {"index": 1170, "code_hash": null, "entity": [["tile_n", "ot", 2], ["tile_c", "ot", 2], ["num_thread_n", "ot", 8], ["num_thread_c", "ot", 8], ["vthread_n", "ot", 1], ["vthread_c", "ot", 2], ["step", "ot", 64]]}, "result": [[0.033375284379999995], 0, 8.52634310722351, 1637955341.8204231], "version": 0.2, "tvm_version": "0.8.dev0"}
{"input": ["opencl -keys=adreno,opencl,gpu -device=adreno -max_num_threads=256", "conv2d_nhwc.cuda", [["TENSOR", [1, 416, 416, 3], "float16"], ["TENSOR", [3, 3, 3, 32], "float16"], [1, 1], [1, 1, 1, 1], [1, 1], "float16"], {}], "config": {"index": 163, "code_hash": null, "entity": [["tile_n", "ot", 4], ["tile_c", "ot", 2], ["num_thread_n", "ot", 4], ["num_thread_c", "ot", 4], ["vthread_n", "ot", 1], ["vthread_c", "ot", 2], ["step", "ot", 16]]}, "result": [[0.05722458122], 0, 21.1503803730011, 1637955354.4888427], "version": 0.2, "tvm_version": "0.8.dev0"}
{"input": ["opencl -keys=adreno,opencl,gpu -device=adreno -max_num_threads=256", "conv2d_nhwc.cuda", [["TENSOR", [1, 416, 416, 3], "float16"], ["TENSOR", [3, 3, 3, 32], "float16"], [1, 1], [1, 1, 1, 1], [1, 1], "float16"], {}], "config": {"index": 1172, "code_hash": null, "entity": [["tile_n", "ot", 8], ["tile_c", "ot", 2], ["num_thread_n", "ot", 8], ["num_thread_c", "ot", 8], ["vthread_n", "ot", 1], ["vthread_c", "ot", 2], ["step", "ot", 64]]}, "result": [[0.03333920416], 0, 9.252632141113281, 1637955364.5494194], "version": 0.2, "tvm_version": "0.8.dev0"}
{"input": ["opencl -keys=adreno,opencl,gpu -device=adreno -max_num_threads=256", "conv2d_nhwc.cuda", [["TENSOR", [1, 416, 416, 3], "float16"], ["TENSOR", [3, 3, 3, 32], "float16"], [1, 1], [1, 1, 1, 1], [1, 1], "float16"], {}], "config": {"index": 495, "code_hash": null, "entity": [["tile_n", "ot", 2], ["tile_c", "ot", 2], ["num_thread_n", "ot", 8], ["num_thread_c", "ot", 4], ["vthread_n", "ot", 1], ["vthread_c", "ot", 2], ["step", "ot", 3]]}, "result": [[0.06587035934], 0, 23.409454584121704, 1637955378.751509], "version": 0.2, "tvm_version": "0.8.dev0"}
{"input": ["opencl -keys=adreno,opencl,gpu -device=adreno -max_num_threads=256", "conv2d_nhwc.cuda", [["TENSOR", [1, 416, 416, 3], "float16"], ["TENSOR", [3, 3, 3, 32], "float16"], [1, 1], [1, 1, 1, 1], [1, 1], "float16"], {}], "config": {"index": 1136, "code_hash": null, "entity": [["tile_n", "ot", 8], ["tile_c", "ot", 2], ["num_thread_n", "ot", 4], ["num_thread_c", "ot", 4], ["vthread_n", "ot", 1], ["vthread_c", "ot", 2], ["step", "ot", 64]]}, "result": [[0.057249947899999994], 0, 12.130263805389404, 1637955391.3557591], "version": 0.2, "tvm_version": "0.8.dev0"}
{"input": ["opencl -keys=adreno,opencl,gpu -device=adreno -max_num_threads=256", "conv2d_nhwc.cuda", [["TENSOR", [1, 416, 416, 3], "float16"], ["TENSOR", [3, 3, 3, 32], "float16"], [1, 1], [1, 1, 1, 1], [1, 1], "float16"], {}], "config": {"index": 811, "code_hash": null, "entity": [["tile_n", "ot", 4], ["tile_c", "ot", 2], ["num_thread_n", "ot", 4], ["num_thread_c", "ot", 4], ["vthread_n", "ot", 1], ["vthread_c", "ot", 2], ["step", "ot", 32]]}, "result": [[0.05725160102], 0, 24.67938494682312, 1637955403.9259858], "version": 0.2, "tvm_version": "0.8.dev0"}
{"input": ["opencl -keys=adreno,opencl,gpu -device=adreno -max_num_threads=256", "conv2d_nhwc.cuda", [["TENSOR", [1, 416, 416, 3], "float16"], ["TENSOR", [3, 3, 3, 32], "float16"], [1, 1], [1, 1, 1, 1], [1, 1], "float16"], {}], "config": {"index": 594, "code_hash": null, "entity": [["tile_n", "ot", 2], ["tile_c", "ot", 2], ["num_thread_n", "ot", 4], ["num_thread_c", "ot", 8], ["vthread_n", "ot", 2], ["vthread_c", "ot", 2], ["step", "ot", 3]]}, "result": [[0.03062181978], 0, 9.289798021316528, 1637955413.749908], "version": 0.2, "tvm_version": "0.8.dev0"}
{"input": ["opencl -keys=adreno,opencl,gpu -device=adreno -max_num_threads=256", "conv2d_nhwc.cuda", [["TENSOR", [1, 416, 416, 3], "float16"], ["TENSOR", [3, 3, 3, 32], "float16"], [1, 1], [1, 1, 1, 1], [1, 1], "float16"], {}], "config": {"index": 568, "code_hash": null, "entity": [["tile_n", "ot", 4], ["tile_c", "ot", 2], ["num_thread_n", "ot", 4], ["num_thread_c", "ot", 4], ["vthread_n", "ot", 2], ["vthread_c", "ot", 2], ["step", "ot", 3]]}, "result": [[0.05772955414], 0, 22.48930025100708, 1637955426.966972], "version": 0.2, "tvm_version": "0.8.dev0"}
{"input": ["opencl -keys=adreno,opencl,gpu -device=adreno -max_num_threads=256", "conv2d_nhwc.cuda", [["TENSOR", [1, 416, 416, 3], "float16"], ["TENSOR", [3, 3, 3, 32], "float16"], [1, 1], [1, 1, 1, 1], [1, 1], "float16"], {}], "config": {"index": 1135, "code_hash": null, "entity": [["tile_n", "ot", 4], ["tile_c", "ot", 2], ["num_thread_n", "ot", 4], ["num_thread_c", "ot", 4], ["vthread_n", "ot", 1], ["vthread_c", "ot", 2], ["step", "ot", 64]]}, "result": [[0.05724939164], 0, 60.10511827468872, 1637955487.8555524], "version": 0.2, "tvm_version": "0.8.dev0"}
{"input": ["opencl -keys=adreno,opencl,gpu -device=adreno -max_num_threads=256", "conv2d_nhwc.cuda", [["TENSOR", [1, 416, 416, 3], "float16"], ["TENSOR", [3, 3, 3, 32], "float16"], [1, 1], [1, 1, 1, 1], [1, 1], "float16"], {}], "config": {"index": 162, "code_hash": null, "entity": [["tile_n", "ot", 2], ["tile_c", "ot", 2], ["num_thread_n", "ot", 4], ["num_thread_c", "ot", 4], ["vthread_n", "ot", 1], ["vthread_c", "ot", 2], ["step", "ot", 16]]}, "result": [[0.05723549478], 0, 13.436057090759277, 1637955501.767503], "version": 0.2, "tvm_version": "0.8.dev0"}
{"input": ["opencl -keys=adreno,opencl,gpu -device=adreno -max_num_threads=256", "conv2d_nhwc.cuda", [["TENSOR", [1, 416, 416, 3], "float16"], ["TENSOR", [3, 3, 3, 32], "float16"], [1, 1], [1, 1, 1, 1], [1, 1], "float16"], {}], "config": {"index": 496, "code_hash": null, "entity": [["tile_n", "ot", 4], ["tile_c", "ot", 2], ["num_thread_n", "ot", 8], ["num_thread_c", "ot", 4], ["vthread_n", "ot", 1], ["vthread_c", "ot", 2], ["step", "ot", 3]]}, "result": [[0.06587069686], 0, 27.929926872253418, 1637955516.2868435], "version": 0.2, "tvm_version": "0.8.dev0"}
{"input": ["opencl -keys=adreno,opencl,gpu -device=adreno -max_num_threads=256", "conv2d_nhwc.cuda", [["TENSOR", [1, 416, 416, 3], "float16"], ["TENSOR", [3, 3, 3, 32], "float16"], [1, 1], [1, 1, 1, 1], [1, 1], "float16"], {}], "config": {"index": 172, "code_hash": null, "entity": [["tile_n", "ot", 4], ["tile_c", "ot", 2], ["num_thread_n", "ot", 8], ["num_thread_c", "ot", 4], ["vthread_n", "ot", 1], ["vthread_c", "ot", 2], ["step", "ot", 16]]}, "result": [[0.06584784163999999], 0, 28.013011932373047, 1637955544.798485], "version": 0.2, "tvm_version": "0.8.dev0"}
{"input": ["opencl -keys=adreno,opencl,gpu -device=adreno -max_num_threads=256", "conv2d_nhwc.cuda", [["TENSOR", [1, 416, 416, 3], "float16"], ["TENSOR", [3, 3, 3, 32], "float16"], [1, 1], [1, 1, 1, 1], [1, 1], "float16"], {}], "config": {"index": 173, "code_hash": null, "entity": [["tile_n", "ot", 8], ["tile_c", "ot", 2], ["num_thread_n", "ot", 8], ["num_thread_c", "ot", 4], ["vthread_n", "ot", 1], ["vthread_c", "ot", 2], ["step", "ot", 16]]}, "result": [[0.06585970102], 0, 14.070436954498291, 1637955530.8424108], "version": 0.2, "tvm_version": "0.8.dev0"}
{"input": ["opencl -keys=adreno,opencl,gpu -device=adreno -max_num_threads=256", "conv2d_nhwc.cuda", [["TENSOR", [1, 416, 416, 3], "float16"], ["TENSOR", [3, 3, 3, 32], "float16"], [1, 1], [1, 1, 1, 1], [1, 1], "float16"], {}], "config": {"index": 272, "code_hash": null, "entity": [["tile_n", "ot", 8], ["tile_c", "ot", 2], ["num_thread_n", "ot", 4], ["num_thread_c", "ot", 8], ["vthread_n", "ot", 2], ["vthread_c", "ot", 2], ["step", "ot", 16]]}, "result": [[0.030661165599999998], 0, 8.676909446716309, 1637955648.754706], "version": 0.2, "tvm_version": "0.8.dev0"}
{"input": ["opencl -keys=adreno,opencl,gpu -device=adreno -max_num_threads=256", "conv2d_nhwc.cuda", [["TENSOR", [1, 416, 416, 3], "float16"], ["TENSOR", [3, 3, 3, 32], "float16"], [1, 1], [1, 1, 1, 1], [1, 1], "float16"], {}], "config": {"index": 171, "code_hash": null, "entity": [["tile_n", "ot", 2], ["tile_c", "ot", 2], ["num_thread_n", "ot", 8], ["num_thread_c", "ot", 4], ["vthread_n", "ot", 1], ["vthread_c", "ot", 2], ["step", "ot", 16]]}, "result": [[0.06582815414], 0, 22.616415977478027, 1637955662.7092853], "version": 0.2, "tvm_version": "0.8.dev0"}
{"input": ["opencl -keys=adreno,opencl,gpu -device=adreno -max_num_threads=256", "conv2d_nhwc.cuda", [["TENSOR", [1, 416, 416, 3], "float16"], ["TENSOR", [3, 3, 3, 32], "float16"], [1, 1], [1, 1, 1, 1], [1, 1], "float16"], {}], "config": {"index": 1134, "code_hash": null, "entity": [["tile_n", "ot", 2], ["tile_c", "ot", 2], ["num_thread_n", "ot", 4], ["num_thread_c", "ot", 4], ["vthread_n", "ot", 1], ["vthread_c", "ot", 2], ["step", "ot", 64]]}, "result": [[0.05724348018], 0, 12.909468173980713, 1637955676.0962548], "version": 0.2, "tvm_version": "0.8.dev0"}
{"input": ["opencl -keys=adreno,opencl,gpu -device=adreno -max_num_threads=256", "conv2d_nhwc.cuda", [["TENSOR", [1, 416, 416, 3], "float16"], ["TENSOR", [3, 3, 3, 32], "float16"], [1, 1], [1, 1, 1, 1], [1, 1], "float16"], {}], "config": {"index": 271, "code_hash": null, "entity": [["tile_n", "ot", 4], ["tile_c", "ot", 2], ["num_thread_n", "ot", 4], ["num_thread_c", "ot", 8], ["vthread_n", "ot", 2], ["vthread_c", "ot", 2], ["step", "ot", 16]]}, "result": [[0.03066223332], 0, 23.150063276290894, 1637955686.353361], "version": 0.2, "tvm_version": "0.8.dev0"}
{"input": ["opencl -keys=adreno,opencl,gpu -device=adreno -max_num_threads=256", "conv2d_nhwc.cuda", [["TENSOR", [1, 416, 416, 3], "float16"], ["TENSOR", [3, 3, 3, 32], "float16"], [1, 1], [1, 1, 1, 1], [1, 1], "float16"], {}], "config": {"index": 821, "code_hash": null, "entity": [["tile_n", "ot", 8], ["tile_c", "ot", 2], ["num_thread_n", "ot", 8], ["num_thread_c", "ot", 4], ["vthread_n", "ot", 1], ["vthread_c", "ot", 2], ["step", "ot", 32]]}, "result": [[0.06584097706], 0, 14.520402908325195, 1637955701.3152835], "version": 0.2, "tvm_version": "0.8.dev0"}
{"input": ["opencl -keys=adreno,opencl,gpu -device=adreno -max_num_threads=256", "conv2d_nhwc.cuda", [["TENSOR", [1, 416, 416, 3], "float16"], ["TENSOR", [3, 3, 3, 32], "float16"], [1, 1], [1, 1, 1, 1], [1, 1], "float16"], {}], "config": {"index": 909, "code_hash": null, "entity": [["tile_n", "ot", 2], ["tile_c", "ot", 2], ["num_thread_n", "ot", 16], ["num_thread_c", "ot", 4], ["vthread_n", "ot", 2], ["vthread_c", "ot", 2], ["step", "ot", 32]]}, "result": [[0.05692134374], 0, 27.328498601913452, 1637955714.1433172], "version": 0.2, "tvm_version": "0.8.dev0"}
{"input": ["opencl -keys=adreno,opencl,gpu -device=adreno -max_num_threads=256", "conv2d_nhwc.cuda", [["TENSOR", [1, 416, 416, 3], "float16"], ["TENSOR", [3, 3, 3, 32], "float16"], [1, 1], [1, 1, 1, 1], [1, 1], "float16"], {}], "config": {"index": 1227, "code_hash": null, "entity": [["tile_n", "ot", 2], ["tile_c", "ot", 4], ["num_thread_n", "ot", 8], ["num_thread_c", "ot", 4], ["vthread_n", "ot", 2], ["vthread_c", "ot", 2], ["step", "ot", 64]]}, "result": [[0.06165031666], 0, 13.906593084335327, 1637955728.5585668], "version": 0.2, "tvm_version": "0.8.dev0"}
{"input": ["opencl -keys=adreno,opencl,gpu -device=adreno -max_num_threads=256", "conv2d_nhwc.cuda", [["TENSOR", [1, 416, 416, 3], "float16"], ["TENSOR", [3, 3, 3, 32], "float16"], [1, 1], [1, 1, 1, 1], [1, 1], "float16"], {}], "config": {"index": 901, "code_hash": null, "entity": [["tile_n", "ot", 4], ["tile_c", "ot", 2], ["num_thread_n", "ot", 8], ["num_thread_c", "ot", 4], ["vthread_n", "ot", 2], ["vthread_c", "ot", 2], ["step", "ot", 32]]}, "result": [[0.0655531656], 0, 14.135379552841187, 1637955832.3868134], "version": 0.2, "tvm_version": "0.8.dev0"}
{"input": ["opencl -keys=adreno,opencl,gpu -device=adreno -max_num_threads=256", "conv2d_nhwc.cuda", [["TENSOR", [1, 416, 416, 3], "float16"], ["TENSOR", [3, 3, 3, 32], "float16"], [1, 1], [1, 1, 1, 1], [1, 1], "float16"], {}], "config": {"index": 910, "code_hash": null, "entity": [["tile_n", "ot", 4], ["tile_c", "ot", 2], ["num_thread_n", "ot", 16], ["num_thread_c", "ot", 4], ["vthread_n", "ot", 2], ["vthread_c", "ot", 2], ["step", "ot", 32]]}, "result": [[0.0569312281], 0, 13.050427198410034, 1637956175.3567348], "version": 0.2, "tvm_version": "0.8.dev0"}
{"input": ["opencl -keys=adreno,opencl,gpu -device=adreno -max_num_threads=256", "conv2d_nhwc.cuda", [["TENSOR", [1, 416, 416, 3], "float16"], ["TENSOR", [3, 3, 3, 32], "float16"], [1, 1], [1, 1, 1, 1], [1, 1], "float16"], {}], "config": {"index": 1260, "code_hash": null, "entity": [["tile_n", "ot", 2], ["tile_c", "ot", 2], ["num_thread_n", "ot", 16], ["num_thread_c", "ot", 8], ["vthread_n", "ot", 2], ["vthread_c", "ot", 2], ["step", "ot", 64]]}, "result": [[0.04857653228], 0, 11.439750909805298, 1637956665.2687454], "version": 0.2, "tvm_version": "0.8.dev0"}
{"input": ["opencl -keys=adreno,opencl,gpu -device=adreno -max_num_threads=256", "conv2d_nhwc.cuda", [["TENSOR", [1, 416, 416, 3], "float16"], ["TENSOR", [3, 3, 3, 32], "float16"], [1, 1], [1, 1, 1, 1], [1, 1], "float16"], {}], "config": {"index": 595, "code_hash": null, "entity": [["tile_n", "ot", 4], ["tile_c", "ot", 2], ["num_thread_n", "ot", 4], ["num_thread_c", "ot", 8], ["vthread_n", "ot", 2], ["vthread_c", "ot", 2], ["step", "ot", 3]]}, "result": [[0.03061258436], 0, 8.310399055480957, 1637956871.7599401], "version": 0.2, "tvm_version": "0.8.dev0"}
{"input": ["opencl -keys=adreno,opencl,gpu -device=adreno -max_num_threads=256", "conv2d_nhwc.cuda", [["TENSOR", [1, 416, 416, 3], "float16"], ["TENSOR", [3, 3, 3, 32], "float16"], [1, 1], [1, 1, 1, 1], [1, 1], "float16"], {}], "config": {"index": 919, "code_hash": null, "entity": [["tile_n", "ot", 4], ["tile_c", "ot", 2], ["num_thread_n", "ot", 4], ["num_thread_c", "ot", 8], ["vthread_n", "ot", 2], ["vthread_c", "ot", 2], ["step", "ot", 32]]}, "result": [[0.03065776144], 0, 16.782142400741577, 1637956880.2486382], "version": 0.2, "tvm_version": "0.8.dev0"}
{"input": ["opencl -keys=adreno,opencl,gpu -device=adreno -max_num_threads=256", "conv2d_nhwc.cuda", [["TENSOR", [1, 416, 416, 3], "float16"], ["TENSOR", [3, 3, 3, 32], "float16"], [1, 1], [1, 1, 1, 1], [1, 1], "float16"], {}], "config": {"index": 920, "code_hash": null, "entity": [["tile_n", "ot", 8], ["tile_c", "ot", 2], ["num_thread_n", "ot", 4], ["num_thread_c", "ot", 8], ["vthread_n", "ot", 2], ["vthread_c", "ot", 2], ["step", "ot", 32]]}, "result": [[0.03065064896], 0, 8.338271617889404, 1637956889.0670524], "version": 0.2, "tvm_version": "0.8.dev0"}
{"input": ["opencl -keys=adreno,opencl,gpu -device=adreno -max_num_threads=256", "conv2d_nhwc.cuda", [["TENSOR", [1, 416, 416, 3], "float16"], ["TENSOR", [3, 3, 3, 32], "float16"], [1, 1], [1, 1, 1, 1], [1, 1], "float16"], {}], "config": {"index": 1243, "code_hash": null, "entity": [["tile_n", "ot", 4], ["tile_c", "ot", 2], ["num_thread_n", "ot", 4], ["num_thread_c", "ot", 8], ["vthread_n", "ot", 2], ["vthread_c", "ot", 2], ["step", "ot", 64]]}, "result": [[0.03066039374], 0, 16.96097993850708, 1637956897.7059743], "version": 0.2, "tvm_version": "0.8.dev0"}
{"input": ["opencl -keys=adreno,opencl,gpu -device=adreno -max_num_threads=256", "conv2d_nhwc.cuda", [["TENSOR", [1, 416, 416, 3], "float16"], ["TENSOR", [3, 3, 3, 32], "float16"], [1, 1], [1, 1, 1, 1], [1, 1], "float16"], {}], "config": {"index": 1244, "code_hash": null, "entity": [["tile_n", "ot", 8], ["tile_c", "ot", 2], ["num_thread_n", "ot", 4], ["num_thread_c", "ot", 8], ["vthread_n", "ot", 2], ["vthread_c", "ot", 2], ["step", "ot", 64]]}, "result": [[0.03064938332], 0, 9.01407790184021, 1637956907.2135594], "version": 0.2, "tvm_version": "0.8.dev0"}
{"input": ["opencl -keys=adreno,opencl,gpu -device=adreno -max_num_threads=256", "conv2d_nhwc.cuda", [["TENSOR", [1, 416, 416, 3], "float16"], ["TENSOR", [3, 3, 3, 32], "float16"], [1, 1], [1, 1, 1, 1], [1, 1], "float16"], {}], "config": {"index": 270, "code_hash": null, "entity": [["tile_n", "ot", 2], ["tile_c", "ot", 2], ["num_thread_n", "ot", 4], ["num_thread_c", "ot", 8], ["vthread_n", "ot", 2], ["vthread_c", "ot", 2], ["step", "ot", 16]]}, "result": [[0.030660264579999996], 0, 17.741180658340454, 1637956915.9574652], "version": 0.2, "tvm_version": "0.8.dev0"}
{"input": ["opencl -keys=adreno,opencl,gpu -device=adreno -max_num_threads=256", "conv2d_nhwc.cuda", [["TENSOR", [1, 416, 416, 3], "float16"], ["TENSOR", [3, 3, 3, 32], "float16"], [1, 1], [1, 1, 1, 1], [1, 1], "float16"], {}], "config": {"index": 596, "code_hash": null, "entity": [["tile_n", "ot", 8], ["tile_c", "ot", 2], ["num_thread_n", "ot", 4], ["num_thread_c", "ot", 8], ["vthread_n", "ot", 2], ["vthread_c", "ot", 2], ["step", "ot", 3]]}, "result": [[0.0306180552], 0, 9.28502607345581, 1637956925.7027507], "version": 0.2, "tvm_version": "0.8.dev0"}
{"input": ["opencl -keys=adreno,opencl,gpu -device=adreno -max_num_threads=256", "conv2d_nhwc.cuda", [["TENSOR", [1, 416, 416, 3], "float16"], ["TENSOR", [3, 3, 3, 32], "float16"], [1, 1], [1, 1, 1, 1], [1, 1], "float16"], {}], "config": {"index": 1242, "code_hash": null, "entity": [["tile_n", "ot", 2], ["tile_c", "ot", 2], ["num_thread_n", "ot", 4], ["num_thread_c", "ot", 8], ["vthread_n", "ot", 2], ["vthread_c", "ot", 2], ["step", "ot", 64]]}, "result": [[0.030654898939999998], 0, 17.924142837524414, 1637956934.364688], "version": 0.2, "tvm_version": "0.8.dev0"}
{"input": ["opencl -keys=adreno,opencl,gpu -device=adreno -max_num_threads=256", "conv2d_nhwc.cuda", [["TENSOR", [1, 416, 416, 3], "float16"], ["TENSOR", [3, 3, 3, 32], "float16"], [1, 1], [1, 1, 1, 1], [1, 1], "float16"], {}], "config": {"index": 918, "code_hash": null, "entity": [["tile_n", "ot", 2], ["tile_c", "ot", 2], ["num_thread_n", "ot", 4], ["num_thread_c", "ot", 8], ["vthread_n", "ot", 2], ["vthread_c", "ot", 2], ["step", "ot", 32]]}, "result": [[0.03065378124], 0, 8.743404388427734, 1637956943.5312877], "version": 0.2, "tvm_version": "0.8.dev0"}
{"input": ["opencl -keys=adreno,opencl,gpu -device=adreno -max_num_threads=256", "conv2d_nhwc.cuda", [["TENSOR", [1, 416, 416, 3], "float16"], ["TENSOR", [3, 3, 3, 32], "float16"], [1, 1], [1, 1, 1, 1], [1, 1], "float16"], {}], "config": {"index": 1233, "code_hash": null, "entity": [["tile_n", "ot", 2], ["tile_c", "ot", 2], ["num_thread_n", "ot", 16], ["num_thread_c", "ot", 4], ["vthread_n", "ot", 2], ["vthread_c", "ot", 2], ["step", "ot", 64]]}, "result": [[0.056921397900000004], 0, 20.9281005859375, 1637956955.7359061], "version": 0.2, "tvm_version": "0.8.dev0"}
{"input": ["opencl -keys=adreno,opencl,gpu -device=adreno -max_num_threads=256", "conv2d_nhwc.cuda", [["TENSOR", [1, 416, 416, 3], "float16"], ["TENSOR", [3, 3, 3, 32], "float16"], [1, 1], [1, 1, 1, 1], [1, 1], "float16"], {}], "config": {"index": 1253, "code_hash": null, "entity": [["tile_n", "ot", 8], ["tile_c", "ot", 2], ["num_thread_n", "ot", 8], ["num_thread_c", "ot", 8], ["vthread_n", "ot", 2], ["vthread_c", "ot", 2], ["step", "ot", 64]]}, "result": [[0.0333390979], 0, 8.32597541809082, 1637956964.5653389], "version": 0.2, "tvm_version": "0.8.dev0"}
{"input": ["opencl -keys=adreno,opencl,gpu -device=adreno -max_num_threads=256", "conv2d_nhwc.cuda", [["TENSOR", [1, 416, 416, 3], "float16"], ["TENSOR", [3, 3, 3, 32], "float16"], [1, 1], [1, 1, 1, 1], [1, 1], "float16"], {}], "config": {"index": 1252, "code_hash": null, "entity": [["tile_n", "ot", 4], ["tile_c", "ot", 2], ["num_thread_n", "ot", 8], ["num_thread_c", "ot", 8], ["vthread_n", "ot", 2], ["vthread_c", "ot", 2], ["step", "ot", 64]]}, "result": [[0.03334474374], 0, 17.769853830337524, 1637956974.029611], "version": 0.2, "tvm_version": "0.8.dev0"}
{"input": ["opencl -keys=adreno,opencl,gpu -device=adreno -max_num_threads=256", "conv2d_nhwc.cuda", [["TENSOR", [1, 416, 416, 3], "float16"], ["TENSOR", [3, 3, 3, 32], "float16"], [1, 1], [1, 1, 1, 1], [1, 1], "float16"], {}], "config": {"index": 1234, "code_hash": null, "entity": [["tile_n", "ot", 4], ["tile_c", "ot", 2], ["num_thread_n", "ot", 16], ["num_thread_c", "ot", 4], ["vthread_n", "ot", 2], ["vthread_c", "ot", 2], ["step", "ot", 64]]}, "result": [[0.05693450624], 0, 12.805174827575684, 1637956987.4872596], "version": 0.2, "tvm_version": "0.8.dev0"}
{"input": ["opencl -keys=adreno,opencl,gpu -device=adreno -max_num_threads=256", "conv2d_nhwc.cuda", [["TENSOR", [1, 416, 416, 3], "float16"], ["TENSOR", [3, 3, 3, 32], "float16"], [1, 1], [1, 1, 1, 1], [1, 1], "float16"], {}], "config": {"index": 1251, "code_hash": null, "entity": [["tile_n", "ot", 2], ["tile_c", "ot", 2], ["num_thread_n", "ot", 8], ["num_thread_c", "ot", 8], ["vthread_n", "ot", 2], ["vthread_c", "ot", 2], ["step", "ot", 64]]}, "result": [[0.03335078124], 0, 22.29497742652893, 1637956996.9967372], "version": 0.2, "tvm_version": "0.8.dev0"}
{"input": ["opencl -keys=adreno,opencl,gpu -device=adreno -max_num_threads=256", "conv2d_nhwc.cuda", [["TENSOR", [1, 416, 416, 3], "float16"], ["TENSOR", [3, 3, 3, 32], "float16"], [1, 1], [1, 1, 1, 1], [1, 1], "float16"], {}], "config": {"index": 1261, "code_hash": null, "entity": [["tile_n", "ot", 4], ["tile_c", "ot", 2], ["num_thread_n", "ot", 16], ["num_thread_c", "ot", 8], ["vthread_n", "ot", 2], ["vthread_c", "ot", 2], ["step", "ot", 64]]}, "result": [[0.048597065599999996], 0, 11.11918592453003, 1637957008.608366], "version": 0.2, "tvm_version": "0.8.dev0"}
{"input": ["opencl -keys=adreno,opencl,gpu -device=adreno -max_num_threads=256", "conv2d_nhwc.cuda", [["TENSOR", [1, 416, 416, 3], "float16"], ["TENSOR", [3, 3, 3, 32], "float16"], [1, 1], [1, 1, 1, 1], [1, 1], "float16"], {}], "config": {"index": 1224, "code_hash": null, "entity": [["tile_n", "ot", 2], ["tile_c", "ot", 2], ["num_thread_n", "ot", 8], ["num_thread_c", "ot", 4], ["vthread_n", "ot", 2], ["vthread_c", "ot", 2], ["step", "ot", 64]]}, "result": [[0.06555329684], 0, 24.76197648048401, 1637957022.2698677], "version": 0.2, "tvm_version": "0.8.dev0"}
{"input": ["opencl -keys=adreno,opencl,gpu -device=adreno -max_num_threads=256", "conv2d_nhwc.cuda", [["TENSOR", [1, 416, 416, 3], "float16"], ["TENSOR", [3, 3, 3, 32], "float16"], [1, 1], [1, 1, 1, 1], [1, 1], "float16"], {}], "config": {"index": 1225, "code_hash": null, "entity": [["tile_n", "ot", 4], ["tile_c", "ot", 2], ["num_thread_n", "ot", 8], ["num_thread_c", "ot", 4], ["vthread_n", "ot", 2], ["vthread_c", "ot", 2], ["step", "ot", 64]]}, "result": [[0.06554840934], 0, 14.129001379013062, 1637957036.899005], "version": 0.2, "tvm_version": "0.8.dev0"}
{"input": ["opencl -keys=adreno,opencl,gpu -device=adreno -max_num_threads=256", "conv2d_nhwc.cuda", [["TENSOR", [1, 416, 416, 3], "float16"], ["TENSOR", [3, 3, 3, 32], "float16"], [1, 1], [1, 1, 1, 1], [1, 1], "float16"], {}], "config": {"index": 1216, "code_hash": null, "entity": [["tile_n", "ot", 4], ["tile_c", "ot", 2], ["num_thread_n", "ot", 4], ["num_thread_c", "ot", 4], ["vthread_n", "ot", 2], ["vthread_c", "ot", 2], ["step", "ot", 64]]}, "result": [[0.05710131978000001], 0, 27.377060651779175, 1637957050.167523], "version": 0.2, "tvm_version": "0.8.dev0"}
{"input": ["opencl -keys=adreno,opencl,gpu -device=adreno -max_num_threads=256", "conv2d_nhwc.cuda", [["TENSOR", [1, 416, 416, 3], "float16"], ["TENSOR", [3, 3, 3, 32], "float16"], [1, 1], [1, 1, 1, 1], [1, 1], "float16"], {}], "config": {"index": 820, "code_hash": null, "entity": [["tile_n", "ot", 4], ["tile_c", "ot", 2], ["num_thread_n", "ot", 8], ["num_thread_c", "ot", 4], ["vthread_n", "ot", 1], ["vthread_c", "ot", 2], ["step", "ot", 32]]}, "result": [[0.0658430656], 0, 14.502254962921143, 1637957065.1536412], "version": 0.2, "tvm_version": "0.8.dev0"}
{"input": ["opencl -keys=adreno,opencl,gpu -device=adreno -max_num_threads=256", "conv2d_nhwc.cuda", [["TENSOR", [1, 416, 416, 3], "float16"], ["TENSOR", [3, 3, 3, 32], "float16"], [1, 1], [1, 1, 1, 1], [1, 1], "float16"], {}], "config": {"index": 603, "code_hash": null, "entity": [["tile_n", "ot", 2], ["tile_c", "ot", 2], ["num_thread_n", "ot", 8], ["num_thread_c", "ot", 8], ["vthread_n", "ot", 2], ["vthread_c", "ot", 2], ["step", "ot", 3]]}, "result": [[0.03278011144], 0, 23.681711435317993, 1637957074.3494244], "version": 0.2, "tvm_version": "0.8.dev0"}
{"input": ["opencl -keys=adreno,opencl,gpu -device=adreno -max_num_threads=256", "conv2d_nhwc.cuda", [["TENSOR", [1, 416, 416, 3], "float16"], ["TENSOR", [3, 3, 3, 32], "float16"], [1, 1], [1, 1, 1, 1], [1, 1], "float16"], {}], "config": {"index": 810, "code_hash": null, "entity": [["tile_n", "ot", 2], ["tile_c", "ot", 2], ["num_thread_n", "ot", 4], ["num_thread_c", "ot", 4], ["vthread_n", "ot", 1], ["vthread_c", "ot", 2], ["step", "ot", 32]]}, "result": [[0.057238084360000004], 0, 12.981064319610596, 1637957087.754851], "version": 0.2, "tvm_version": "0.8.dev0"}
{"input": ["opencl -keys=adreno,opencl,gpu -device=adreno -max_num_threads=256", "conv2d_nhwc.cuda", [["TENSOR", [1, 416, 416, 3], "float16"], ["TENSOR", [3, 3, 3, 32], "float16"], [1, 1], [1, 1, 1, 1], [1, 1], "float16"], {}], "config": {"index": 1144, "code_hash": null, "entity": [["tile_n", "ot", 4], ["tile_c", "ot", 2], ["num_thread_n", "ot", 8], ["num_thread_c", "ot", 4], ["vthread_n", "ot", 1], ["vthread_c", "ot", 2], ["step", "ot", 64]]}, "result": [[0.06585655102], 0, 27.397197723388672, 1637957102.1904511], "version": 0.2, "tvm_version": "0.8.dev0"}
{"input": ["opencl -keys=adreno,opencl,gpu -device=adreno -max_num_threads=256", "conv2d_nhwc.cuda", [["TENSOR", [1, 416, 416, 3], "float16"], ["TENSOR", [3, 3, 3, 32], "float16"], [1, 1], [1, 1, 1, 1], [1, 1], "float16"], {}], "config": {"index": 1215, "code_hash": null, "entity": [["tile_n", "ot", 2], ["tile_c", "ot", 2], ["num_thread_n", "ot", 4], ["num_thread_c", "ot", 4], ["vthread_n", "ot", 2], ["vthread_c", "ot", 2], ["step", "ot", 64]]}, "result": [[0.057124256219999996], 0, 14.240678071975708, 1637957116.893148], "version": 0.2, "tvm_version": "0.8.dev0"}
{"input": ["opencl -keys=adreno,opencl,gpu -device=adreno -max_num_threads=256", "conv2d_nhwc.cuda", [["TENSOR", [1, 416, 416, 3], "float16"], ["TENSOR", [3, 3, 3, 32], "float16"], [1, 1], [1, 1, 1, 1], [1, 1], "float16"], {}], "config": {"index": 929, "code_hash": null, "entity": [["tile_n", "ot", 8], ["tile_c", "ot", 2], ["num_thread_n", "ot", 8], ["num_thread_c", "ot", 8], ["vthread_n", "ot", 2], ["vthread_c", "ot", 2], ["step", "ot", 32]]}, "result": [[0.03334356354], 0, 25.376028060913086, 1637957189.9253757], "version": 0.2, "tvm_version": "0.8.dev0"}
{"input": ["opencl -keys=adreno,opencl,gpu -device=adreno -max_num_threads=256", "conv2d_nhwc.cuda", [["TENSOR", [1, 416, 416, 3], "float16"], ["TENSOR", [3, 3, 3, 32], "float16"], [1, 1], [1, 1, 1, 1], [1, 1], "float16"], {}], "config": {"index": 1226, "code_hash": null, "entity": [["tile_n", "ot", 8], ["tile_c", "ot", 2], ["num_thread_n", "ot", 8], ["num_thread_c", "ot", 4], ["vthread_n", "ot", 2], ["vthread_c", "ot", 2], ["step", "ot", 64]]}, "result": [[0.06557224891999999], 0, 13.812118530273438, 1637957204.2263856], "version": 0.2, "tvm_version": "0.8.dev0"}
{"input": ["opencl -keys=adreno,opencl,gpu -device=adreno -max_num_threads=256", "conv2d_nhwc.cuda", [["TENSOR", [1, 416, 416, 3], "float16"], ["TENSOR", [3, 3, 3, 32], "float16"], [1, 1], [1, 1, 1, 1], [1, 1], "float16"], {}], "config": {"index": 281, "code_hash": null, "entity": [["tile_n", "ot", 8], ["tile_c", "ot", 2], ["num_thread_n", "ot", 8], ["num_thread_c", "ot", 8], ["vthread_n", "ot", 2], ["vthread_c", "ot", 2], ["step", "ot", 16]]}, "result": [[0.0333335781], 0, 24.030571460723877, 1637957214.4635327], "version": 0.2, "tvm_version": "0.8.dev0"}
{"input": ["opencl -keys=adreno,opencl,gpu -device=adreno -max_num_threads=256", "conv2d_nhwc.cuda", [["TENSOR", [1, 416, 416, 3], "float16"], ["TENSOR", [3, 3, 3, 32], "float16"], [1, 1], [1, 1, 1, 1], [1, 1], "float16"], {}], "config": {"index": 1228, "code_hash": null, "entity": [["tile_n", "ot", 4], ["tile_c", "ot", 4], ["num_thread_n", "ot", 8], ["num_thread_c", "ot", 4], ["vthread_n", "ot", 2], ["vthread_c", "ot", 2], ["step", "ot", 64]]}, "result": [[0.06166134998], 0, 13.532792091369629, 1637957228.4477367], "version": 0.2, "tvm_version": "0.8.dev0"}
{"input": ["opencl -keys=adreno,opencl,gpu -device=adreno -max_num_threads=256", "conv2d_nhwc.cuda", [["TENSOR", [1, 416, 416, 3], "float16"], ["TENSOR", [3, 3, 3, 32], "float16"], [1, 1], [1, 1, 1, 1], [1, 1], "float16"], {}], "config": {"index": 253, "code_hash": null, "entity": [["tile_n", "ot", 4], ["tile_c", "ot", 2], ["num_thread_n", "ot", 8], ["num_thread_c", "ot", 4], ["vthread_n", "ot", 2], ["vthread_c", "ot", 2], ["step", "ot", 16]]}, "result": [[0.06553087394], 0, 26.872990369796753, 1637957241.812158], "version": 0.2, "tvm_version": "0.8.dev0"}
{"input": ["opencl -keys=adreno,opencl,gpu -device=adreno -max_num_threads=256", "conv2d_nhwc.cuda", [["TENSOR", [1, 416, 416, 3], "float16"], ["TENSOR", [3, 3, 3, 32], "float16"], [1, 1], [1, 1, 1, 1], [1, 1], "float16"], {}], "config": {"index": 576, "code_hash": null, "entity": [["tile_n", "ot", 2], ["tile_c", "ot", 2], ["num_thread_n", "ot", 8], ["num_thread_c", "ot", 4], ["vthread_n", "ot", 2], ["vthread_c", "ot", 2], ["step", "ot", 3]]}, "result": [[0.0655828802], 0, 12.970877170562744, 1637957255.2795997], "version": 0.2, "tvm_version": "0.8.dev0"}
{"input": ["opencl -keys=adreno,opencl,gpu -device=adreno -max_num_threads=256", "conv2d_nhwc.cuda", [["TENSOR", [1, 416, 416, 3], "float16"], ["TENSOR", [3, 3, 3, 32], "float16"], [1, 1], [1, 1, 1, 1], [1, 1], "float16"], {}], "config": {"index": 1143, "code_hash": null, "entity": [["tile_n", "ot", 2], ["tile_c", "ot", 2], ["num_thread_n", "ot", 8], ["num_thread_c", "ot", 4], ["vthread_n", "ot", 1], ["vthread_c", "ot", 2], ["step", "ot", 64]]}, "result": [[0.06585562498], 0, 27.8890597820282, 1637957270.2177072], "version": 0.2, "tvm_version": "0.8.dev0"}
{"input": ["opencl -keys=adreno,opencl,gpu -device=adreno -max_num_threads=256", "conv2d_nhwc.cuda", [["TENSOR", [1, 416, 416, 3], "float16"], ["TENSOR", [3, 3, 3, 32], "float16"], [1, 1], [1, 1, 1, 1], [1, 1], "float16"], {}], "config": {"index": 891, "code_hash": null, "entity": [["tile_n", "ot", 2], ["tile_c", "ot", 2], ["num_thread_n", "ot", 4], ["num_thread_c", "ot", 4], ["vthread_n", "ot", 2], ["vthread_c", "ot", 2], ["step", "ot", 32]]}, "result": [[0.057113238520000005], 0, 12.478593826293945, 1637957283.1787193], "version": 0.2, "tvm_version": "0.8.dev0"}
{"input": ["opencl -keys=adreno,opencl,gpu -device=adreno -max_num_threads=256", "conv2d_nhwc.cuda", [["TENSOR", [1, 416, 416, 3], "float16"], ["TENSOR", [3, 3, 3, 32], "float16"], [1, 1], [1, 1, 1, 1], [1, 1], "float16"], {}], "config": {"index": 604, "code_hash": null, "entity": [["tile_n", "ot", 4], ["tile_c", "ot", 2], ["num_thread_n", "ot", 8], ["num_thread_c", "ot", 8], ["vthread_n", "ot", 2], ["vthread_c", "ot", 2], ["step", "ot", 3]]}, "result": [[0.03278263122], 0, 21.20062828063965, 1637957291.9199636], "version": 0.2, "tvm_version": "0.8.dev0"}
{"input": ["opencl -keys=adreno,opencl,gpu -device=adreno -max_num_threads=256", "conv2d_nhwc.cuda", [["TENSOR", [1, 416, 416, 3], "float16"], ["TENSOR", [3, 3, 3, 32], "float16"], [1, 1], [1, 1, 1, 1], [1, 1], "float16"], {}], "config": {"index": 1262, "code_hash": null, "entity": [["tile_n", "ot", 8], ["tile_c", "ot", 2], ["num_thread_n", "ot", 16], ["num_thread_c", "ot", 8], ["vthread_n", "ot", 2], ["vthread_c", "ot", 2], ["step", "ot", 64]]}, "result": [[0.04859767394], 0, 10.926946640014648, 1637957303.3545527], "version": 0.2, "tvm_version": "0.8.dev0"}
{"input": ["opencl -keys=adreno,opencl,gpu -device=adreno -max_num_threads=256", "conv2d_nhwc.cuda", [["TENSOR", [1, 416, 416, 3], "float16"], ["TENSOR", [3, 3, 3, 32], "float16"], [1, 1], [1, 1, 1, 1], [1, 1], "float16"], {}], "config": {"index": 1145, "code_hash": null, "entity": [["tile_n", "ot", 8], ["tile_c", "ot", 2], ["num_thread_n", "ot", 8], ["num_thread_c", "ot", 4], ["vthread_n", "ot", 1], ["vthread_c", "ot", 2], ["step", "ot", 64]]}, "result": [[0.06584107602], 0, 24.516892671585083, 1637957316.9945104], "version": 0.2, "tvm_version": "0.8.dev0"}
{"input": ["opencl -keys=adreno,opencl,gpu -device=adreno -max_num_threads=256", "conv2d_nhwc.cuda", [["TENSOR", [1, 416, 416, 3], "float16"], ["TENSOR", [3, 3, 3, 32], "float16"], [1, 1], [1, 1, 1, 1], [1, 1], "float16"], {}], "config": {"index": 254, "code_hash": null, "entity": [["tile_n", "ot", 8], ["tile_c", "ot", 2], ["num_thread_n", "ot", 8], ["num_thread_c", "ot", 4], ["vthread_n", "ot", 2], ["vthread_c", "ot", 2], ["step", "ot", 16]]}, "result": [[0.06555902498], 0, 14.133951187133789, 1637957331.6132429], "version": 0.2, "tvm_version": "0.8.dev0"}
{"input": ["opencl -keys=adreno,opencl,gpu -device=adreno -max_num_threads=256", "conv2d_nhwc.cuda", [["TENSOR", [1, 416, 416, 3], "float16"], ["TENSOR", [3, 3, 3, 32], "float16"], [1, 1], [1, 1, 1, 1], [1, 1], "float16"], {}], "config": {"index": 911, "code_hash": null, "entity": [["tile_n", "ot", 8], ["tile_c", "ot", 2], ["num_thread_n", "ot", 16], ["num_thread_c", "ot", 4], ["vthread_n", "ot", 2], ["vthread_c", "ot", 2], ["step", "ot", 32]]}, "result": [[0.05693061664], 0, 26.696964979171753, 1637957344.1922927], "version": 0.2, "tvm_version": "0.8.dev0"}
{"input": ["opencl -keys=adreno,opencl,gpu -device=adreno -max_num_threads=256", "conv2d_nhwc.cuda", [["TENSOR", [1, 416, 416, 3], "float16"], ["TENSOR", [3, 3, 3, 32], "float16"], [1, 1], [1, 1, 1, 1], [1, 1], "float16"], {}], "config": {"index": 819, "code_hash": null, "entity": [["tile_n", "ot", 2], ["tile_c", "ot", 2], ["num_thread_n", "ot", 8], ["num_thread_c", "ot", 4], ["vthread_n", "ot", 1], ["vthread_c", "ot", 2], ["step", "ot", 32]]}, "result": [[0.06585400622], 0, 13.72234320640564, 1637957358.4008288], "version": 0.2, "tvm_version": "0.8.dev0"}
{"input": ["opencl -keys=adreno,opencl,gpu -device=adreno -max_num_threads=256", "conv2d_nhwc.cuda", [["TENSOR", [1, 416, 416, 3], "float16"], ["TENSOR", [3, 3, 3, 32], "float16"], [1, 1], [1, 1, 1, 1], [1, 1], "float16"], {}], "config": {"index": 902, "code_hash": null, "entity": [["tile_n", "ot", 8], ["tile_c", "ot", 2], ["num_thread_n", "ot", 8], ["num_thread_c", "ot", 4], ["vthread_n", "ot", 2], ["vthread_c", "ot", 2], ["step", "ot", 32]]}, "result": [[0.06556268227999999], 0, 28.150930643081665, 1637957372.8522594], "version": 0.2, "tvm_version": "0.8.dev0"}
{"input": ["opencl -keys=adreno,opencl,gpu -device=adreno -max_num_threads=256", "conv2d_nhwc.cuda", [["TENSOR", [1, 416, 416, 3], "float16"], ["TENSOR", [3, 3, 3, 32], "float16"], [1, 1], [1, 1, 1, 1], [1, 1], "float16"], {}], "config": {"index": 605, "code_hash": null, "entity": [["tile_n", "ot", 8], ["tile_c", "ot", 2], ["num_thread_n", "ot", 8], ["num_thread_c", "ot", 8], ["vthread_n", "ot", 2], ["vthread_c", "ot", 2], ["step", "ot", 3]]}, "result": [[0.032775538539999996], 0, 8.700472116470337, 1637957382.0653563], "version": 0.2, "tvm_version": "0.8.dev0"}
{"input": ["opencl -keys=adreno,opencl,gpu -device=adreno -max_num_threads=256", "conv2d_nhwc.cuda", [["TENSOR", [1, 416, 416, 3], "float16"], ["TENSOR", [3, 3, 3, 32], "float16"], [1, 1], [1, 1, 1, 1], [1, 1], "float16"], {}], "config": {"index": 928, "code_hash": null, "entity": [["tile_n", "ot", 4], ["tile_c", "ot", 2], ["num_thread_n", "ot", 8], ["num_thread_c", "ot", 8], ["vthread_n", "ot", 2], ["vthread_c", "ot", 2], ["step", "ot", 32]]}, "result": [[0.03333136352], 0, 16.997957944869995, 1637957390.3813179], "version": 0.2, "tvm_version": "0.8.dev0"}
{"input": ["opencl -keys=adreno,opencl,gpu -device=adreno -max_num_threads=256", "conv2d_nhwc.cuda", [["TENSOR", [1, 416, 416, 3], "float16"], ["TENSOR", [3, 3, 3, 32], "float16"], [1, 1], [1, 1, 1, 1], [1, 1], "float16"], {}], "config": {"index": 893, "code_hash": null, "entity": [["tile_n", "ot", 8], ["tile_c", "ot", 2], ["num_thread_n", "ot", 4], ["num_thread_c", "ot", 4], ["vthread_n", "ot", 2], ["vthread_c", "ot", 2], ["step", "ot", 32]]}, "result": [[0.0571312281], 0, 12.878089904785156, 1637957403.7168834], "version": 0.2, "tvm_version": "0.8.dev0"}
{"input": ["opencl -keys=adreno,opencl,gpu -device=adreno -max_num_threads=256", "conv2d_nhwc.cuda", [["TENSOR", [1, 416, 416, 3], "float16"], ["TENSOR", [3, 3, 3, 32], "float16"], [1, 1], [1, 1, 1, 1], [1, 1], "float16"], {}], "config": {"index": 900, "code_hash": null, "entity": [["tile_n", "ot", 2], ["tile_c", "ot", 2], ["num_thread_n", "ot", 8], ["num_thread_c", "ot", 4], ["vthread_n", "ot", 2], ["vthread_c", "ot", 2], ["step", "ot", 32]]}, "result": [[0.06557374476], 0, 26.681231260299683, 1637957417.5313973], "version": 0.2, "tvm_version": "0.8.dev0"}
{"input": ["opencl -keys=adreno,opencl,gpu -device=adreno -max_num_threads=256", "conv2d_nhwc.cuda", [["TENSOR", [1, 416, 416, 3], "float16"], ["TENSOR", [3, 3, 3, 32], "float16"], [1, 1], [1, 1, 1, 1], [1, 1], "float16"], {}], "config": {"index": 280, "code_hash": null, "entity": [["tile_n", "ot", 4], ["tile_c", "ot", 2], ["num_thread_n", "ot", 8], ["num_thread_c", "ot", 8], ["vthread_n", "ot", 2], ["vthread_c", "ot", 2], ["step", "ot", 16]]}, "result": [[0.033340294779999995], 0, 9.524192094802856, 1637957427.5843358], "version": 0.2, "tvm_version": "0.8.dev0"}
{"input": ["opencl -keys=adreno,opencl,gpu -device=adreno -max_num_threads=256", "conv2d_nhwc.cuda", [["TENSOR", [1, 416, 416, 3], "float16"], ["TENSOR", [3, 3, 3, 32], "float16"], [1, 1], [1, 1, 1, 1], [1, 1], "float16"], {}], "config": {"index": 577, "code_hash": null, "entity": [["tile_n", "ot", 4], ["tile_c", "ot", 2], ["num_thread_n", "ot", 8], ["num_thread_c", "ot", 4], ["vthread_n", "ot", 2], ["vthread_c", "ot", 2], ["step", "ot", 3]]}, "result": [[0.06557094788000001], 0, 23.211421728134155, 1637957441.285717], "version": 0.2, "tvm_version": "0.8.dev0"}
{"input": ["opencl -keys=adreno,opencl,gpu -device=adreno -max_num_threads=256", "conv2d_nhwc.cuda", [["TENSOR", [1, 416, 416, 3], "float16"], ["TENSOR", [3, 3, 3, 32], "float16"], [1, 1], [1, 1, 1, 1], [1, 1], "float16"], {}], "config": {"index": 245, "code_hash": null, "entity": [["tile_n", "ot", 8], ["tile_c", "ot", 2], ["num_thread_n", "ot", 4], ["num_thread_c", "ot", 4], ["vthread_n", "ot", 2], ["vthread_c", "ot", 2], ["step", "ot", 16]]}, "result": [[0.057099589560000004], 0, 13.116101264953613, 1637957454.894167], "version": 0.2, "tvm_version": "0.8.dev0"}
{"input": ["opencl -keys=adreno,opencl,gpu -device=adreno -max_num_threads=256", "conv2d_nhwc.cuda", [["TENSOR", [1, 416, 416, 3], "float16"], ["TENSOR", [3, 3, 3, 32], "float16"], [1, 1], [1, 1, 1, 1], [1, 1], "float16"], {}], "config": {"index": 569, "code_hash": null, "entity": [["tile_n", "ot", 8], ["tile_c", "ot", 2], ["num_thread_n", "ot", 4], ["num_thread_c", "ot", 4], ["vthread_n", "ot", 2], ["vthread_c", "ot", 2], ["step", "ot", 3]]}, "result": [[0.057725171840000006], 0, 26.188987731933594, 1637957467.9876335], "version": 0.2, "tvm_version": "0.8.dev0"}
{"input": ["opencl -keys=adreno,opencl,gpu -device=adreno -max_num_threads=256", "conv2d_nhwc.cuda", [["TENSOR", [1, 416, 416, 3], "float16"], ["TENSOR", [3, 3, 3, 32], "float16"], [1, 1], [1, 1, 1, 1], [1, 1], "float16"], {}], "config": {"index": 252, "code_hash": null, "entity": [["tile_n", "ot", 2], ["tile_c", "ot", 2], ["num_thread_n", "ot", 8], ["num_thread_c", "ot", 4], ["vthread_n", "ot", 2], ["vthread_c", "ot", 2], ["step", "ot", 16]]}, "result": [[0.06552405414], 0, 28.042805671691895, 1637957496.5373838], "version": 0.2, "tvm_version": "0.8.dev0"}
{"input": ["opencl -keys=adreno,opencl,gpu -device=adreno -max_num_threads=256", "conv2d_nhwc.cuda", [["TENSOR", [1, 416, 416, 3], "float16"], ["TENSOR", [3, 3, 3, 32], "float16"], [1, 1], [1, 1, 1, 1], [1, 1], "float16"], {}], "config": {"index": 256, "code_hash": null, "entity": [["tile_n", "ot", 4], ["tile_c", "ot", 4], ["num_thread_n", "ot", 8], ["num_thread_c", "ot", 4], ["vthread_n", "ot", 2], ["vthread_c", "ot", 2], ["step", "ot", 16]]}, "result": [[0.0616500177], 0, 13.297634363174438, 1637957481.8152814], "version": 0.2, "tvm_version": "0.8.dev0"}
{"input": ["opencl -keys=adreno,opencl,gpu -device=adreno -max_num_threads=256", "conv2d_nhwc.cuda", [["TENSOR", [1, 416, 416, 3], "float16"], ["TENSOR", [3, 3, 3, 32], "float16"], [1, 1], [1, 1, 1, 1], [1, 1], "float16"], {}], "config": {"index": 1217, "code_hash": null, "entity": [["tile_n", "ot", 8], ["tile_c", "ot", 2], ["num_thread_n", "ot", 4], ["num_thread_c", "ot", 4], ["vthread_n", "ot", 2], ["vthread_c", "ot", 2], ["step", "ot", 64]]}, "result": [[0.057118652060000004], 0, 12.189972400665283, 1637957509.245014], "version": 0.2, "tvm_version": "0.8.dev0"}
{"input": ["opencl -keys=adreno,opencl,gpu -device=adreno -max_num_threads=256", "conv2d_nhwc.cuda", [["TENSOR", [1, 416, 416, 3], "float16"], ["TENSOR", [3, 3, 3, 32], "float16"], [1, 1], [1, 1, 1, 1], [1, 1], "float16"], {}], "config": {"index": 497, "code_hash": null, "entity": [["tile_n", "ot", 8], ["tile_c", "ot", 2], ["num_thread_n", "ot", 8], ["num_thread_c", "ot", 4], ["vthread_n", "ot", 1], ["vthread_c", "ot", 2], ["step", "ot", 3]]}, "result": [[0.06586969372], 0, 25.55025553703308, 1637957522.624694], "version": 0.2, "tvm_version": "0.8.dev0"}
