sd888_log/ww50/conv2d_1_257_257_32x3_3_32_1/depthwise_conv2d_nchwc.log.tmp
{"input": ["opencl -keys=adreno,opencl,gpu -device=adreno -max_num_threads=256", "depthwise_conv2d_nchwc_acc32.image2d", [["TENSOR", [1, 8, 257, 257, 4], "float16"], ["TENSOR", [8, 1, 3, 3, 4], "float16"], [1, 1], [1, 1, 1, 1], [1, 1], "float16"], {}], "config": {"index": 3057, "code_hash": null, "entity": [["tile_fc", "sp", [-1, 2, 1, 4]], ["tile_y", "sp", [-1, 1, 1, 1]], ["tile_x", "sp", [-1, 1, 257, 1]], ["tile_ry", "sp", [-1, 3]], ["tile_rx", "sp", [-1, 1]], ["auto_unroll_max_step", "ot", 1500], ["unroll_explicit", "ot", 0]]}, "result": [[0.0014306312600000002], 0, 5.703890562057495, 1639729882.369263], "version": 0.2, "tvm_version": "0.8.dev0"}
{"input": ["opencl -keys=adreno,opencl,gpu -device=adreno -max_num_threads=256", "depthwise_conv2d_nchwc_acc32.image2d", [["TENSOR", [1, 8, 257, 257, 4], "float16"], ["TENSOR", [8, 1, 3, 3, 4], "float16"], [1, 1], [1, 1, 1, 1], [1, 1], "float16"], {}], "config": {"index": 1400, "code_hash": null, "entity": [["tile_fc", "sp", [-1, 1, 1, 1]], ["tile_y", "sp", [-1, 1, 257, 1]], ["tile_x", "sp", [-1, 257, 1, 1]], ["tile_ry", "sp", [-1, 1]], ["tile_rx", "sp", [-1, 1]], ["auto_unroll_max_step", "ot", 512], ["unroll_explicit", "ot", 0]]}, "result": [[0.01773489686], 0, 5.024280071258545, 1639729892.8142047], "version": 0.2, "tvm_version": "0.8.dev0"}
{"input": ["opencl -keys=adreno,opencl,gpu -device=adreno -max_num_threads=256", "depthwise_conv2d_nchwc_acc32.image2d", [["TENSOR", [1, 8, 257, 257, 4], "float16"], ["TENSOR", [8, 1, 3, 3, 4], "float16"], [1, 1], [1, 1, 1, 1], [1, 1], "float16"], {}], "config": {"index": 3331, "code_hash": null, "entity": [["tile_fc", "sp", [-1, 2, 1, 2]], ["tile_y", "sp", [-1, 1, 257, 1]], ["tile_x", "sp", [-1, 257, 1, 1]], ["tile_ry", "sp", [-1, 1]], ["tile_rx", "sp", [-1, 3]], ["auto_unroll_max_step", "ot", 1500], ["unroll_explicit", "ot", 0]]}, "result": [[0.027010324999999998], 0, 22.477080583572388, 1639729925.2566333], "version": 0.2, "tvm_version": "0.8.dev0"}
{"input": ["opencl -keys=adreno,opencl,gpu -device=adreno -max_num_threads=256", "depthwise_conv2d_nchwc_acc32.image2d", [["TENSOR", [1, 8, 257, 257, 4], "float16"], ["TENSOR", [8, 1, 3, 3, 4], "float16"], [1, 1], [1, 1, 1, 1], [1, 1], "float16"], {}], "config": {"index": 126, "code_hash": null, "entity": [["tile_fc", "sp", [-1, 4, 2, 1]], ["tile_y", "sp", [-1, 1, 257, 1]], ["tile_x", "sp", [-1, 257, 1, 1]], ["tile_ry", "sp", [-1, 1]], ["tile_rx", "sp", [-1, 1]], ["auto_unroll_max_step", "ot", 0], ["unroll_explicit", "ot", 0]]}, "result": [[0.03439928124], 0, 7.723074197769165, 1639729933.1673367], "version": 0.2, "tvm_version": "0.8.dev0"}
{"input": ["opencl -keys=adreno,opencl,gpu -device=adreno -max_num_threads=256", "depthwise_conv2d_nchwc_acc32.image2d", [["TENSOR", [1, 8, 257, 257, 4], "float16"], ["TENSOR", [8, 1, 3, 3, 4], "float16"], [1, 1], [1, 1, 1, 1], [1, 1], "float16"], {}], "config": {"index": 5930, "code_hash": null, "entity": [["tile_fc", "sp", [-1, 1, 1, 2]], ["tile_y", "sp", [-1, 1, 1, 1]], ["tile_x", "sp", [-1, 1, 257, 1]], ["tile_ry", "sp", [-1, 1]], ["tile_rx", "sp", [-1, 3]], ["auto_unroll_max_step", "ot", 512], ["unroll_explicit", "ot", 1]]}, "result": [[0.00092981354], 0, 9.991162061691284, 1639729935.4759915], "version": 0.2, "tvm_version": "0.8.dev0"}
{"input": ["opencl -keys=adreno,opencl,gpu -device=adreno -max_num_threads=256", "depthwise_conv2d_nchwc_acc32.image2d", [["TENSOR", [1, 8, 257, 257, 4], "float16"], ["TENSOR", [8, 1, 3, 3, 4], "float16"], [1, 1], [1, 1, 1, 1], [1, 1], "float16"], {}], "config": {"index": 804, "code_hash": null, "entity": [["tile_fc", "sp", [-1, 1, 2, 1]], ["tile_y", "sp", [-1, 1, 1, 1]], ["tile_x", "sp", [-1, 1, 257, 1]], ["tile_ry", "sp", [-1, 1]], ["tile_rx", "sp", [-1, 3]], ["auto_unroll_max_step", "ot", 0], ["unroll_explicit", "ot", 0]]}, "result": [[0.00089297292], 0, 3.759087562561035, 1639729942.0466812], "version": 0.2, "tvm_version": "0.8.dev0"}
{"input": ["opencl -keys=adreno,opencl,gpu -device=adreno -max_num_threads=256", "depthwise_conv2d_nchwc_acc32.image2d", [["TENSOR", [1, 8, 257, 257, 4], "float16"], ["TENSOR", [8, 1, 3, 3, 4], "float16"], [1, 1], [1, 1, 1, 1], [1, 1], "float16"], {}], "config": {"index": 5444, "code_hash": null, "entity": [["tile_fc", "sp", [-1, 1, 2, 1]], ["tile_y", "sp", [-1, 1, 1, 1]], ["tile_x", "sp", [-1, 1, 1, 1]], ["tile_ry", "sp", [-1, 3]], ["tile_rx", "sp", [-1, 1]], ["auto_unroll_max_step", "ot", 512], ["unroll_explicit", "ot", 1]]}, "result": [[0.009206578120000001], 0, 7.93899130821228, 1639729946.2350852], "version": 0.2, "tvm_version": "0.8.dev0"}
{"input": ["opencl -keys=adreno,opencl,gpu -device=adreno -max_num_threads=256", "depthwise_conv2d_nchwc_acc32.image2d", [["TENSOR", [1, 8, 257, 257, 4], "float16"], ["TENSOR", [8, 1, 3, 3, 4], "float16"], [1, 1], [1, 1, 1, 1], [1, 1], "float16"], {}], "config": {"index": 650, "code_hash": null, "entity": [["tile_fc", "sp", [-1, 1, 1, 2]], ["tile_y", "sp", [-1, 1, 1, 1]], ["tile_x", "sp", [-1, 1, 1, 1]], ["tile_ry", "sp", [-1, 1]], ["tile_rx", "sp", [-1, 3]], ["auto_unroll_max_step", "ot", 0], ["unroll_explicit", "ot", 0]]}, "result": [[0.026070609380000002], 0, 6.4487879276275635, 1639729959.7082143], "version": 0.2, "tvm_version": "0.8.dev0"}
{"input": ["opencl -keys=adreno,opencl,gpu -device=adreno -max_num_threads=256", "depthwise_conv2d_nchwc_acc32.image2d", [["TENSOR", [1, 8, 257, 257, 4], "float16"], ["TENSOR", [8, 1, 3, 3, 4], "float16"], [1, 1], [1, 1, 1, 1], [1, 1], "float16"], {}], "config": {"index": 4333, "code_hash": null, "entity": [["tile_fc", "sp", [-1, 1, 2, 2]], ["tile_y", "sp", [-1, 1, 1, 1]], ["tile_x", "sp", [-1, 1, 257, 1]], ["tile_ry", "sp", [-1, 3]], ["tile_rx", "sp", [-1, 1]], ["auto_unroll_max_step", "ot", 0], ["unroll_explicit", "ot", 1]]}, "result": [[0.0010427427], 0, 3.163158893585205, 1639729963.290546], "version": 0.2, "tvm_version": "0.8.dev0"}
{"input": ["opencl -keys=adreno,opencl,gpu -device=adreno -max_num_threads=256", "depthwise_conv2d_nchwc_acc32.image2d", [["TENSOR", [1, 8, 257, 257, 4], "float16"], ["TENSOR", [8, 1, 3, 3, 4], "float16"], [1, 1], [1, 1, 1, 1], [1, 1], "float16"], {}], "config": {"index": 5086, "code_hash": null, "entity": [["tile_fc", "sp", [-1, 4, 2, 1]], ["tile_y", "sp", [-1, 1, 257, 1]], ["tile_x", "sp", [-1, 1, 1, 257]], ["tile_ry", "sp", [-1, 3]], ["tile_rx", "sp", [-1, 3]], ["auto_unroll_max_step", "ot", 0], ["unroll_explicit", "ot", 1]]}, "result": [[0.0342784979], 0, 7.625759840011597, 1639729973.3868866], "version": 0.2, "tvm_version": "0.8.dev0"}
{"input": ["opencl -keys=adreno,opencl,gpu -device=adreno -max_num_threads=256", "depthwise_conv2d_nchwc_acc32.image2d", [["TENSOR", [1, 8, 257, 257, 4], "float16"], ["TENSOR", [8, 1, 3, 3, 4], "float16"], [1, 1], [1, 1, 1, 1], [1, 1], "float16"], {}], "config": {"index": 3441, "code_hash": null, "entity": [["tile_fc", "sp", [-1, 2, 1, 1]], ["tile_y", "sp", [-1, 1, 1, 1]], ["tile_x", "sp", [-1, 1, 1, 257]], ["tile_ry", "sp", [-1, 1]], ["tile_rx", "sp", [-1, 3]], ["auto_unroll_max_step", "ot", 1500], ["unroll_explicit", "ot", 0]]}, "result": [[0.034011927059999995], 0, 10.003796100616455, 1639730012.2121627], "version": 0.2, "tvm_version": "0.8.dev0"}
{"input": ["opencl -keys=adreno,opencl,gpu -device=adreno -max_num_threads=256", "depthwise_conv2d_nchwc_acc32.image2d", [["TENSOR", [1, 8, 257, 257, 4], "float16"], ["TENSOR", [8, 1, 3, 3, 4], "float16"], [1, 1], [1, 1, 1, 1], [1, 1], "float16"], {}], "config": {"index": 2274, "code_hash": null, "entity": [["tile_fc", "sp", [-1, 2, 2, 2]], ["tile_y", "sp", [-1, 257, 1, 1]], ["tile_x", "sp", [-1, 1, 1, 1]], ["tile_ry", "sp", [-1, 3]], ["tile_rx", "sp", [-1, 3]], ["auto_unroll_max_step", "ot", 512], ["unroll_explicit", "ot", 0]]}, "result": [[0.03310850726], 0, 8.306618690490723, 1639730020.7178175], "version": 0.2, "tvm_version": "0.8.dev0"}
{"input": ["opencl -keys=adreno,opencl,gpu -device=adreno -max_num_threads=256", "depthwise_conv2d_nchwc_acc32.image2d", [["TENSOR", [1, 8, 257, 257, 4], "float16"], ["TENSOR", [8, 1, 3, 3, 4], "float16"], [1, 1], [1, 1, 1, 1], [1, 1], "float16"], {}], "config": {"index": 5345, "code_hash": null, "entity": [["tile_fc", "sp", [-1, 2, 2, 1]], ["tile_y", "sp", [-1, 1, 1, 257]], ["tile_x", "sp", [-1, 1, 257, 1]], ["tile_ry", "sp", [-1, 1]], ["tile_rx", "sp", [-1, 1]], ["auto_unroll_max_step", "ot", 512], ["unroll_explicit", "ot", 1]]}, "result": [[0.01993376354], 0, 13.763802289962769, 1639730026.1822782], "version": 0.2, "tvm_version": "0.8.dev0"}
{"input": ["opencl -keys=adreno,opencl,gpu -device=adreno -max_num_threads=256", "depthwise_conv2d_nchwc_acc32.image2d", [["TENSOR", [1, 8, 257, 257, 4], "float16"], ["TENSOR", [8, 1, 3, 3, 4], "float16"], [1, 1], [1, 1, 1, 1], [1, 1], "float16"], {}], "config": {"index": 1963, "code_hash": null, "entity": [["tile_fc", "sp", [-1, 8, 1, 1]], ["tile_y", "sp", [-1, 1, 257, 1]], ["tile_x", "sp", [-1, 1, 1, 1]], ["tile_ry", "sp", [-1, 1]], ["tile_rx", "sp", [-1, 3]], ["auto_unroll_max_step", "ot", 512], ["unroll_explicit", "ot", 0]]}, "result": [[0.00274523646], 0, 2.7259624004364014, 1639730029.2201767], "version": 0.2, "tvm_version": "0.8.dev0"}
{"input": ["opencl -keys=adreno,opencl,gpu -device=adreno -max_num_threads=256", "depthwise_conv2d_nchwc_acc32.image2d", [["TENSOR", [1, 8, 257, 257, 4], "float16"], ["TENSOR", [8, 1, 3, 3, 4], "float16"], [1, 1], [1, 1, 1, 1], [1, 1], "float16"], {}], "config": {"index": 5763, "code_hash": null, "entity": [["tile_fc", "sp", [-1, 8, 1, 1]], ["tile_y", "sp", [-1, 1, 1, 1]], ["tile_x", "sp", [-1, 1, 1, 1]], ["tile_ry", "sp", [-1, 1]], ["tile_rx", "sp", [-1, 3]], ["auto_unroll_max_step", "ot", 512], ["unroll_explicit", "ot", 1]]}, "result": [[0.0390757927], 0, 13.149852991104126, 1639730039.5961409], "version": 0.2, "tvm_version": "0.8.dev0"}
{"input": ["opencl -keys=adreno,opencl,gpu -device=adreno -max_num_threads=256", "depthwise_conv2d_nchwc_acc32.image2d", [["TENSOR", [1, 8, 257, 257, 4], "float16"], ["TENSOR", [8, 1, 3, 3, 4], "float16"], [1, 1], [1, 1, 1, 1], [1, 1], "float16"], {}], "config": {"index": 2956, "code_hash": null, "entity": [["tile_fc", "sp", [-1, 1, 1, 4]], ["tile_y", "sp", [-1, 1, 1, 257]], ["tile_x", "sp", [-1, 1, 1, 1]], ["tile_ry", "sp", [-1, 3]], ["tile_rx", "sp", [-1, 1]], ["auto_unroll_max_step", "ot", 1500], ["unroll_explicit", "ot", 0]]}, "result": [[0.02986292916], 0, 7.396002769470215, 1639730048.3990006], "version": 0.2, "tvm_version": "0.8.dev0"}
{"input": ["opencl -keys=adreno,opencl,gpu -device=adreno -max_num_threads=256", "depthwise_conv2d_nchwc_acc32.image2d", [["TENSOR", [1, 8, 257, 257, 4], "float16"], ["TENSOR", [8, 1, 3, 3, 4], "float16"], [1, 1], [1, 1, 1, 1], [1, 1], "float16"], {}], "config": {"index": 3898, "code_hash": null, "entity": [["tile_fc", "sp", [-1, 1, 2, 4]], ["tile_y", "sp", [-1, 1, 257, 1]], ["tile_x", "sp", [-1, 1, 1, 1]], ["tile_ry", "sp", [-1, 1]], ["tile_rx", "sp", [-1, 1]], ["auto_unroll_max_step", "ot", 0], ["unroll_explicit", "ot", 1]]}, "result": [[0.0021725229200000003], 0, 2.961562156677246, 1639730066.9349077], "version": 0.2, "tvm_version": "0.8.dev0"}
{"input": ["opencl -keys=adreno,opencl,gpu -device=adreno -max_num_threads=256", "depthwise_conv2d_nchwc_acc32.image2d", [["TENSOR", [1, 8, 257, 257, 4], "float16"], ["TENSOR", [8, 1, 3, 3, 4], "float16"], [1, 1], [1, 1, 1, 1], [1, 1], "float16"], {}], "config": {"index": 698, "code_hash": null, "entity": [["tile_fc", "sp", [-1, 1, 2, 4]], ["tile_y", "sp", [-1, 1, 257, 1]], ["tile_x", "sp", [-1, 1, 1, 1]], ["tile_ry", "sp", [-1, 1]], ["tile_rx", "sp", [-1, 3]], ["auto_unroll_max_step", "ot", 0], ["unroll_explicit", "ot", 0]]}, "result": [[0.00215743438], 0, 2.7357873916625977, 1639730124.092189], "version": 0.2, "tvm_version": "0.8.dev0"}
{"input": ["opencl -keys=adreno,opencl,gpu -device=adreno -max_num_threads=256", "depthwise_conv2d_nchwc_acc32.image2d", [["TENSOR", [1, 8, 257, 257, 4], "float16"], ["TENSOR", [8, 1, 3, 3, 4], "float16"], [1, 1], [1, 1, 1, 1], [1, 1], "float16"], {}], "config": {"index": 5346, "code_hash": null, "entity": [["tile_fc", "sp", [-1, 4, 2, 1]], ["tile_y", "sp", [-1, 1, 1, 257]], ["tile_x", "sp", [-1, 1, 257, 1]], ["tile_ry", "sp", [-1, 1]], ["tile_rx", "sp", [-1, 1]], ["auto_unroll_max_step", "ot", 512], ["unroll_explicit", "ot", 1]]}, "result": [[0.03325595312], 0, 7.512861013412476, 1639730161.7793562], "version": 0.2, "tvm_version": "0.8.dev0"}
{"input": ["opencl -keys=adreno,opencl,gpu -device=adreno -max_num_threads=256", "depthwise_conv2d_nchwc_acc32.image2d", [["TENSOR", [1, 8, 257, 257, 4], "float16"], ["TENSOR", [8, 1, 3, 3, 4], "float16"], [1, 1], [1, 1, 1, 1], [1, 1], "float16"], {}], "config": {"index": 4776, "code_hash": null, "entity": [["tile_fc", "sp", [-1, 1, 1, 4]], ["tile_y", "sp", [-1, 1, 257, 1]], ["tile_x", "sp", [-1, 1, 1, 257]], ["tile_ry", "sp", [-1, 1]], ["tile_rx", "sp", [-1, 3]], ["auto_unroll_max_step", "ot", 0], ["unroll_explicit", "ot", 1]]}, "result": [[0.01747973958], 0, 5.183352947235107, 1639730171.6935856], "version": 0.2, "tvm_version": "0.8.dev0"}
{"input": ["opencl -keys=adreno,opencl,gpu -device=adreno -max_num_threads=256", "depthwise_conv2d_nchwc_acc32.image2d", [["TENSOR", [1, 8, 257, 257, 4], "float16"], ["TENSOR", [8, 1, 3, 3, 4], "float16"], [1, 1], [1, 1, 1, 1], [1, 1], "float16"], {}], "config": {"index": 2084, "code_hash": null, "entity": [["tile_fc", "sp", [-1, 1, 2, 1]], ["tile_y", "sp", [-1, 1, 1, 1]], ["tile_x", "sp", [-1, 1, 257, 1]], ["tile_ry", "sp", [-1, 1]], ["tile_rx", "sp", [-1, 3]], ["auto_unroll_max_step", "ot", 512], ["unroll_explicit", "ot", 0]]}, "result": [[0.0008921926999999999], 0, 2.730297803878784, 1639730248.6819713], "version": 0.2, "tvm_version": "0.8.dev0"}
{"input": ["opencl -keys=adreno,opencl,gpu -device=adreno -max_num_threads=256", "depthwise_conv2d_nchwc_acc32.image2d", [["TENSOR", [1, 8, 257, 257, 4], "float16"], ["TENSOR", [8, 1, 3, 3, 4], "float16"], [1, 1], [1, 1, 1, 1], [1, 1], "float16"], {}], "config": {"index": 5924, "code_hash": null, "entity": [["tile_fc", "sp", [-1, 1, 2, 1]], ["tile_y", "sp", [-1, 1, 1, 1]], ["tile_x", "sp", [-1, 1, 257, 1]], ["tile_ry", "sp", [-1, 1]], ["tile_rx", "sp", [-1, 3]], ["auto_unroll_max_step", "ot", 512], ["unroll_explicit", "ot", 1]]}, "result": [[0.00089462188], 0, 5.2462170124053955, 1639730251.1588628], "version": 0.2, "tvm_version": "0.8.dev0"}
{"input": ["opencl -keys=adreno,opencl,gpu -device=adreno -max_num_threads=256", "depthwise_conv2d_nchwc_acc32.image2d", [["TENSOR", [1, 8, 257, 257, 4], "float16"], ["TENSOR", [8, 1, 3, 3, 4], "float16"], [1, 1], [1, 1, 1, 1], [1, 1], "float16"], {}], "config": {"index": 2080, "code_hash": null, "entity": [["tile_fc", "sp", [-1, 1, 1, 1]], ["tile_y", "sp", [-1, 1, 1, 1]], ["tile_x", "sp", [-1, 1, 257, 1]], ["tile_ry", "sp", [-1, 1]], ["tile_rx", "sp", [-1, 3]], ["auto_unroll_max_step", "ot", 512], ["unroll_explicit", "ot", 0]]}, "result": [[0.0009185], 0, 2.5044729709625244, 1639730253.873024], "version": 0.2, "tvm_version": "0.8.dev0"}
{"input": ["opencl -keys=adreno,opencl,gpu -device=adreno -max_num_threads=256", "depthwise_conv2d_nchwc_acc32.image2d", [["TENSOR", [1, 8, 257, 257, 4], "float16"], ["TENSOR", [8, 1, 3, 3, 4], "float16"], [1, 1], [1, 1, 1, 1], [1, 1], "float16"], {}], "config": {"index": 2404, "code_hash": null, "entity": [["tile_fc", "sp", [-1, 1, 2, 1]], ["tile_y", "sp", [-1, 1, 1, 1]], ["tile_x", "sp", [-1, 1, 257, 1]], ["tile_ry", "sp", [-1, 3]], ["tile_rx", "sp", [-1, 3]], ["auto_unroll_max_step", "ot", 512], ["unroll_explicit", "ot", 0]]}, "result": [[0.0009178802], 0, 5.091028690338135, 1639730256.468448], "version": 0.2, "tvm_version": "0.8.dev0"}
{"input": ["opencl -keys=adreno,opencl,gpu -device=adreno -max_num_threads=256", "depthwise_conv2d_nchwc_acc32.image2d", [["TENSOR", [1, 8, 257, 257, 4], "float16"], ["TENSOR", [8, 1, 3, 3, 4], "float16"], [1, 1], [1, 1, 1, 1], [1, 1], "float16"], {}], "config": {"index": 2090, "code_hash": null, "entity": [["tile_fc", "sp", [-1, 1, 1, 2]], ["tile_y", "sp", [-1, 1, 1, 1]], ["tile_x", "sp", [-1, 1, 257, 1]], ["tile_ry", "sp", [-1, 1]], ["tile_rx", "sp", [-1, 3]], ["auto_unroll_max_step", "ot", 512], ["unroll_explicit", "ot", 0]]}, "result": [[0.00101251042], 0, 2.621891736984253, 1639730259.3090067], "version": 0.2, "tvm_version": "0.8.dev0"}
{"input": ["opencl -keys=adreno,opencl,gpu -device=adreno -max_num_threads=256", "depthwise_conv2d_nchwc_acc32.image2d", [["TENSOR", [1, 8, 257, 257, 4], "float16"], ["TENSOR", [8, 1, 3, 3, 4], "float16"], [1, 1], [1, 1, 1, 1], [1, 1], "float16"], {}], "config": {"index": 5920, "code_hash": null, "entity": [["tile_fc", "sp", [-1, 1, 1, 1]], ["tile_y", "sp", [-1, 1, 1, 1]], ["tile_x", "sp", [-1, 1, 257, 1]], ["tile_ry", "sp", [-1, 1]], ["tile_rx", "sp", [-1, 3]], ["auto_unroll_max_step", "ot", 512], ["unroll_explicit", "ot", 1]]}, "result": [[0.0009103916599999999], 0, 5.4899818897247314, 1639730262.1863127], "version": 0.2, "tvm_version": "0.8.dev0"}
{"input": ["opencl -keys=adreno,opencl,gpu -device=adreno -max_num_threads=256", "depthwise_conv2d_nchwc_acc32.image2d", [["TENSOR", [1, 8, 257, 257, 4], "float16"], ["TENSOR", [8, 1, 3, 3, 4], "float16"], [1, 1], [1, 1, 1, 1], [1, 1], "float16"], {}], "config": {"index": 4644, "code_hash": null, "entity": [["tile_fc", "sp", [-1, 1, 2, 1]], ["tile_y", "sp", [-1, 1, 1, 1]], ["tile_x", "sp", [-1, 1, 257, 1]], ["tile_ry", "sp", [-1, 1]], ["tile_rx", "sp", [-1, 3]], ["auto_unroll_max_step", "ot", 0], ["unroll_explicit", "ot", 1]]}, "result": [[0.00089505208], 0, 3.0522048473358154, 1639730265.427201], "version": 0.2, "tvm_version": "0.8.dev0"}
{"input": ["opencl -keys=adreno,opencl,gpu -device=adreno -max_num_threads=256", "depthwise_conv2d_nchwc_acc32.image2d", [["TENSOR", [1, 8, 257, 257, 4], "float16"], ["TENSOR", [8, 1, 3, 3, 4], "float16"], [1, 1], [1, 1, 1, 1], [1, 1], "float16"], {}], "config": {"index": 2081, "code_hash": null, "entity": [["tile_fc", "sp", [-1, 2, 1, 1]], ["tile_y", "sp", [-1, 1, 1, 1]], ["tile_x", "sp", [-1, 1, 257, 1]], ["tile_ry", "sp", [-1, 1]], ["tile_rx", "sp", [-1, 3]], ["auto_unroll_max_step", "ot", 512], ["unroll_explicit", "ot", 0]]}, "result": [[0.000984], 0, 5.522693634033203, 1639730267.9344316], "version": 0.2, "tvm_version": "0.8.dev0"}
{"input": ["opencl -keys=adreno,opencl,gpu -device=adreno -max_num_threads=256", "depthwise_conv2d_nchwc_acc32.image2d", [["TENSOR", [1, 8, 257, 257, 4], "float16"], ["TENSOR", [8, 1, 3, 3, 4], "float16"], [1, 1], [1, 1, 1, 1], [1, 1], "float16"], {}], "config": {"index": 2400, "code_hash": null, "entity": [["tile_fc", "sp", [-1, 1, 1, 1]], ["tile_y", "sp", [-1, 1, 1, 1]], ["tile_x", "sp", [-1, 1, 257, 1]], ["tile_ry", "sp", [-1, 3]], ["tile_rx", "sp", [-1, 3]], ["auto_unroll_max_step", "ot", 512], ["unroll_explicit", "ot", 0]]}, "result": [[0.00091996042], 0, 2.7620954513549805, 1639730270.939235], "version": 0.2, "tvm_version": "0.8.dev0"}
{"input": ["opencl -keys=adreno,opencl,gpu -device=adreno -max_num_threads=256", "depthwise_conv2d_nchwc_acc32.image2d", [["TENSOR", [1, 8, 257, 257, 4], "float16"], ["TENSOR", [8, 1, 3, 3, 4], "float16"], [1, 1], [1, 1, 1, 1], [1, 1], "float16"], {}], "config": {"index": 2410, "code_hash": null, "entity": [["tile_fc", "sp", [-1, 1, 1, 2]], ["tile_y", "sp", [-1, 1, 1, 1]], ["tile_x", "sp", [-1, 1, 257, 1]], ["tile_ry", "sp", [-1, 3]], ["tile_rx", "sp", [-1, 3]], ["auto_unroll_max_step", "ot", 512], ["unroll_explicit", "ot", 0]]}, "result": [[0.00101245208], 0, 5.531027793884277, 1639730273.775836], "version": 0.2, "tvm_version": "0.8.dev0"}
{"input": ["opencl -keys=adreno,opencl,gpu -device=adreno -max_num_threads=256", "depthwise_conv2d_nchwc_acc32.image2d", [["TENSOR", [1, 8, 257, 257, 4], "float16"], ["TENSOR", [8, 1, 3, 3, 4], "float16"], [1, 1], [1, 1, 1, 1], [1, 1], "float16"], {}], "config": {"index": 1124, "code_hash": null, "entity": [["tile_fc", "sp", [-1, 1, 2, 1]], ["tile_y", "sp", [-1, 1, 1, 1]], ["tile_x", "sp", [-1, 1, 257, 1]], ["tile_ry", "sp", [-1, 3]], ["tile_rx", "sp", [-1, 3]], ["auto_unroll_max_step", "ot", 0], ["unroll_explicit", "ot", 0]]}, "result": [[0.00090514478], 0, 2.6757991313934326, 1639730276.6980622], "version": 0.2, "tvm_version": "0.8.dev0"}
{"input": ["opencl -keys=adreno,opencl,gpu -device=adreno -max_num_threads=256", "depthwise_conv2d_nchwc_acc32.image2d", [["TENSOR", [1, 8, 257, 257, 4], "float16"], ["TENSOR", [8, 1, 3, 3, 4], "float16"], [1, 1], [1, 1, 1, 1], [1, 1], "float16"], {}], "config": {"index": 800, "code_hash": null, "entity": [["tile_fc", "sp", [-1, 1, 1, 1]], ["tile_y", "sp", [-1, 1, 1, 1]], ["tile_x", "sp", [-1, 1, 257, 1]], ["tile_ry", "sp", [-1, 1]], ["tile_rx", "sp", [-1, 3]], ["auto_unroll_max_step", "ot", 0], ["unroll_explicit", "ot", 0]]}, "result": [[0.0009060395800000002], 0, 5.3313891887664795, 1639730279.3243997], "version": 0.2, "tvm_version": "0.8.dev0"}
{"input": ["opencl -keys=adreno,opencl,gpu -device=adreno -max_num_threads=256", "depthwise_conv2d_nchwc_acc32.image2d", [["TENSOR", [1, 8, 257, 257, 4], "float16"], ["TENSOR", [8, 1, 3, 3, 4], "float16"], [1, 1], [1, 1, 1, 1], [1, 1], "float16"], {}], "config": {"index": 3364, "code_hash": null, "entity": [["tile_fc", "sp", [-1, 1, 2, 1]], ["tile_y", "sp", [-1, 1, 1, 1]], ["tile_x", "sp", [-1, 1, 257, 1]], ["tile_ry", "sp", [-1, 1]], ["tile_rx", "sp", [-1, 3]], ["auto_unroll_max_step", "ot", 1500], ["unroll_explicit", "ot", 0]]}, "result": [[0.0008991927], 0, 2.625520944595337, 1639730282.186806], "version": 0.2, "tvm_version": "0.8.dev0"}
{"input": ["opencl -keys=adreno,opencl,gpu -device=adreno -max_num_threads=256", "depthwise_conv2d_nchwc_acc32.image2d", [["TENSOR", [1, 8, 257, 257, 4], "float16"], ["TENSOR", [8, 1, 3, 3, 4], "float16"], [1, 1], [1, 1, 1, 1], [1, 1], "float16"], {}], "config": {"index": 1450, "code_hash": null, "entity": [["tile_fc", "sp", [-1, 1, 1, 2]], ["tile_y", "sp", [-1, 1, 1, 1]], ["tile_x", "sp", [-1, 1, 257, 1]], ["tile_ry", "sp", [-1, 1]], ["tile_rx", "sp", [-1, 1]], ["auto_unroll_max_step", "ot", 512], ["unroll_explicit", "ot", 0]]}, "result": [[0.00101382604], 0, 5.297748327255249, 1639730284.8679109], "version": 0.2, "tvm_version": "0.8.dev0"}
{"input": ["opencl -keys=adreno,opencl,gpu -device=adreno -max_num_threads=256", "depthwise_conv2d_nchwc_acc32.image2d", [["TENSOR", [1, 8, 257, 257, 4], "float16"], ["TENSOR", [8, 1, 3, 3, 4], "float16"], [1, 1], [1, 1, 1, 1], [1, 1], "float16"], {}], "config": {"index": 1764, "code_hash": null, "entity": [["tile_fc", "sp", [-1, 1, 2, 1]], ["tile_y", "sp", [-1, 1, 1, 1]], ["tile_x", "sp", [-1, 1, 257, 1]], ["tile_ry", "sp", [-1, 3]], ["tile_rx", "sp", [-1, 1]], ["auto_unroll_max_step", "ot", 512], ["unroll_explicit", "ot", 0]]}, "result": [[0.0009052302199999999], 0, 2.569124460220337, 1639730287.6418786], "version": 0.2, "tvm_version": "0.8.dev0"}
{"input": ["opencl -keys=adreno,opencl,gpu -device=adreno -max_num_threads=256", "depthwise_conv2d_nchwc_acc32.image2d", [["TENSOR", [1, 8, 257, 257, 4], "float16"], ["TENSOR", [8, 1, 3, 3, 4], "float16"], [1, 1], [1, 1, 1, 1], [1, 1], "float16"], {}], "config": {"index": 5921, "code_hash": null, "entity": [["tile_fc", "sp", [-1, 2, 1, 1]], ["tile_y", "sp", [-1, 1, 1, 1]], ["tile_x", "sp", [-1, 1, 257, 1]], ["tile_ry", "sp", [-1, 1]], ["tile_rx", "sp", [-1, 3]], ["auto_unroll_max_step", "ot", 512], ["unroll_explicit", "ot", 1]]}, "result": [[0.00092835626], 0, 5.226710081100464, 1639730290.315003], "version": 0.2, "tvm_version": "0.8.dev0"}
{"input": ["opencl -keys=adreno,opencl,gpu -device=adreno -max_num_threads=256", "depthwise_conv2d_nchwc_acc32.image2d", [["TENSOR", [1, 8, 257, 257, 4], "float16"], ["TENSOR", [8, 1, 3, 3, 4], "float16"], [1, 1], [1, 1, 1, 1], [1, 1], "float16"], {}], "config": {"index": 1770, "code_hash": null, "entity": [["tile_fc", "sp", [-1, 1, 1, 2]], ["tile_y", "sp", [-1, 1, 1, 1]], ["tile_x", "sp", [-1, 1, 257, 1]], ["tile_ry", "sp", [-1, 3]], ["tile_rx", "sp", [-1, 1]], ["auto_unroll_max_step", "ot", 512], ["unroll_explicit", "ot", 0]]}, "result": [[0.0010184510400000001], 0, 2.65434193611145, 1639730293.1771343], "version": 0.2, "tvm_version": "0.8.dev0"}
{"input": ["opencl -keys=adreno,opencl,gpu -device=adreno -max_num_threads=256", "depthwise_conv2d_nchwc_acc32.image2d", [["TENSOR", [1, 8, 257, 257, 4], "float16"], ["TENSOR", [8, 1, 3, 3, 4], "float16"], [1, 1], [1, 1, 1, 1], [1, 1], "float16"], {}], "config": {"index": 7204, "code_hash": null, "entity": [["tile_fc", "sp", [-1, 1, 2, 1]], ["tile_y", "sp", [-1, 1, 1, 1]], ["tile_x", "sp", [-1, 1, 257, 1]], ["tile_ry", "sp", [-1, 1]], ["tile_rx", "sp", [-1, 3]], ["auto_unroll_max_step", "ot", 1500], ["unroll_explicit", "ot", 1]]}, "result": [[0.0008990635600000001], 0, 4.93034029006958, 1639730295.4618688], "version": 0.2, "tvm_version": "0.8.dev0"}
{"input": ["opencl -keys=adreno,opencl,gpu -device=adreno -max_num_threads=256", "depthwise_conv2d_nchwc_acc32.image2d", [["TENSOR", [1, 8, 257, 257, 4], "float16"], ["TENSOR", [8, 1, 3, 3, 4], "float16"], [1, 1], [1, 1, 1, 1], [1, 1], "float16"], {}], "config": {"index": 3360, "code_hash": null, "entity": [["tile_fc", "sp", [-1, 1, 1, 1]], ["tile_y", "sp", [-1, 1, 1, 1]], ["tile_x", "sp", [-1, 1, 257, 1]], ["tile_ry", "sp", [-1, 1]], ["tile_rx", "sp", [-1, 3]], ["auto_unroll_max_step", "ot", 1500], ["unroll_explicit", "ot", 0]]}, "result": [[0.00089074792], 0, 3.1068174839019775, 1639730298.7861245], "version": 0.2, "tvm_version": "0.8.dev0"}
{"input": ["opencl -keys=adreno,opencl,gpu -device=adreno -max_num_threads=256", "depthwise_conv2d_nchwc_acc32.image2d", [["TENSOR", [1, 8, 257, 257, 4], "float16"], ["TENSOR", [8, 1, 3, 3, 4], "float16"], [1, 1], [1, 1, 1, 1], [1, 1], "float16"], {}], "config": {"index": 6244, "code_hash": null, "entity": [["tile_fc", "sp", [-1, 1, 2, 1]], ["tile_y", "sp", [-1, 1, 1, 1]], ["tile_x", "sp", [-1, 1, 257, 1]], ["tile_ry", "sp", [-1, 3]], ["tile_rx", "sp", [-1, 3]], ["auto_unroll_max_step", "ot", 512], ["unroll_explicit", "ot", 1]]}, "result": [[0.00090555416], 0, 5.805899143218994, 1639730301.482104], "version": 0.2, "tvm_version": "0.8.dev0"}
{"input": ["opencl -keys=adreno,opencl,gpu -device=adreno -max_num_threads=256", "depthwise_conv2d_nchwc_acc32.image2d", [["TENSOR", [1, 8, 257, 257, 4], "float16"], ["TENSOR", [8, 1, 3, 3, 4], "float16"], [1, 1], [1, 1, 1, 1], [1, 1], "float16"], {}], "config": {"index": 2401, "code_hash": null, "entity": [["tile_fc", "sp", [-1, 2, 1, 1]], ["tile_y", "sp", [-1, 1, 1, 1]], ["tile_x", "sp", [-1, 1, 257, 1]], ["tile_ry", "sp", [-1, 3]], ["tile_rx", "sp", [-1, 3]], ["auto_unroll_max_step", "ot", 512], ["unroll_explicit", "ot", 0]]}, "result": [[0.0009744708400000001], 0, 2.593130111694336, 1639730304.3033297], "version": 0.2, "tvm_version": "0.8.dev0"}
{"input": ["opencl -keys=adreno,opencl,gpu -device=adreno -max_num_threads=256", "depthwise_conv2d_nchwc_acc32.image2d", [["TENSOR", [1, 8, 257, 257, 4], "float16"], ["TENSOR", [8, 1, 3, 3, 4], "float16"], [1, 1], [1, 1, 1, 1], [1, 1], "float16"], {}], "config": {"index": 1760, "code_hash": null, "entity": [["tile_fc", "sp", [-1, 1, 1, 1]], ["tile_y", "sp", [-1, 1, 1, 1]], ["tile_x", "sp", [-1, 1, 257, 1]], ["tile_ry", "sp", [-1, 3]], ["tile_rx", "sp", [-1, 1]], ["auto_unroll_max_step", "ot", 512], ["unroll_explicit", "ot", 0]]}, "result": [[0.000926525], 0, 5.352685213088989, 1639730307.0728676], "version": 0.2, "tvm_version": "0.8.dev0"}
{"input": ["opencl -keys=adreno,opencl,gpu -device=adreno -max_num_threads=256", "depthwise_conv2d_nchwc_acc32.image2d", [["TENSOR", [1, 8, 257, 257, 4], "float16"], ["TENSOR", [8, 1, 3, 3, 4], "float16"], [1, 1], [1, 1, 1, 1], [1, 1], "float16"], {}], "config": {"index": 810, "code_hash": null, "entity": [["tile_fc", "sp", [-1, 1, 1, 2]], ["tile_y", "sp", [-1, 1, 1, 1]], ["tile_x", "sp", [-1, 1, 257, 1]], ["tile_ry", "sp", [-1, 1]], ["tile_rx", "sp", [-1, 3]], ["auto_unroll_max_step", "ot", 0], ["unroll_explicit", "ot", 0]]}, "result": [[0.00101570938], 0, 2.787438154220581, 1639730310.0843837], "version": 0.2, "tvm_version": "0.8.dev0"}
{"input": ["opencl -keys=adreno,opencl,gpu -device=adreno -max_num_threads=256", "depthwise_conv2d_nchwc_acc32.image2d", [["TENSOR", [1, 8, 257, 257, 4], "float16"], ["TENSOR", [8, 1, 3, 3, 4], "float16"], [1, 1], [1, 1, 1, 1], [1, 1], "float16"], {}], "config": {"index": 4640, "code_hash": null, "entity": [["tile_fc", "sp", [-1, 1, 1, 1]], ["tile_y", "sp", [-1, 1, 1, 1]], ["tile_x", "sp", [-1, 1, 257, 1]], ["tile_ry", "sp", [-1, 1]], ["tile_rx", "sp", [-1, 3]], ["auto_unroll_max_step", "ot", 0], ["unroll_explicit", "ot", 1]]}, "result": [[0.00091715834], 0, 5.234130859375, 1639730312.5405412], "version": 0.2, "tvm_version": "0.8.dev0"}
{"input": ["opencl -keys=adreno,opencl,gpu -device=adreno -max_num_threads=256", "depthwise_conv2d_nchwc_acc32.image2d", [["TENSOR", [1, 8, 257, 257, 4], "float16"], ["TENSOR", [8, 1, 3, 3, 4], "float16"], [1, 1], [1, 1, 1, 1], [1, 1], "float16"], {}], "config": {"index": 484, "code_hash": null, "entity": [["tile_fc", "sp", [-1, 1, 2, 1]], ["tile_y", "sp", [-1, 1, 1, 1]], ["tile_x", "sp", [-1, 1, 257, 1]], ["tile_ry", "sp", [-1, 3]], ["tile_rx", "sp", [-1, 1]], ["auto_unroll_max_step", "ot", 0], ["unroll_explicit", "ot", 0]]}, "result": [[0.00089695208], 0, 2.7535083293914795, 1639730315.5394232], "version": 0.2, "tvm_version": "0.8.dev0"}
{"input": ["opencl -keys=adreno,opencl,gpu -device=adreno -max_num_threads=256", "depthwise_conv2d_nchwc_acc32.image2d", [["TENSOR", [1, 8, 257, 257, 4], "float16"], ["TENSOR", [8, 1, 3, 3, 4], "float16"], [1, 1], [1, 1, 1, 1], [1, 1], "float16"], {}], "config": {"index": 5604, "code_hash": null, "entity": [["tile_fc", "sp", [-1, 1, 2, 1]], ["tile_y", "sp", [-1, 1, 1, 1]], ["tile_x", "sp", [-1, 1, 257, 1]], ["tile_ry", "sp", [-1, 3]], ["tile_rx", "sp", [-1, 1]], ["auto_unroll_max_step", "ot", 512], ["unroll_explicit", "ot", 1]]}, "result": [[0.00088246042], 0, 5.7161359786987305, 1639730318.510164], "version": 0.2, "tvm_version": "0.8.dev0"}
{"input": ["opencl -keys=adreno,opencl,gpu -device=adreno -max_num_threads=256", "depthwise_conv2d_nchwc_acc32.image2d", [["TENSOR", [1, 8, 257, 257, 4], "float16"], ["TENSOR", [8, 1, 3, 3, 4], "float16"], [1, 1], [1, 1, 1, 1], [1, 1], "float16"], {}], "config": {"index": 1120, "code_hash": null, "entity": [["tile_fc", "sp", [-1, 1, 1, 1]], ["tile_y", "sp", [-1, 1, 1, 1]], ["tile_x", "sp", [-1, 1, 257, 1]], ["tile_ry", "sp", [-1, 3]], ["tile_rx", "sp", [-1, 3]], ["auto_unroll_max_step", "ot", 0], ["unroll_explicit", "ot", 0]]}, "result": [[0.0009110323], 0, 2.6498255729675293, 1639730321.3557196], "version": 0.2, "tvm_version": "0.8.dev0"}
{"input": ["opencl -keys=adreno,opencl,gpu -device=adreno -max_num_threads=256", "depthwise_conv2d_nchwc_acc32.image2d", [["TENSOR", [1, 8, 257, 257, 4], "float16"], ["TENSOR", [8, 1, 3, 3, 4], "float16"], [1, 1], [1, 1, 1, 1], [1, 1], "float16"], {}], "config": {"index": 3684, "code_hash": null, "entity": [["tile_fc", "sp", [-1, 1, 2, 1]], ["tile_y", "sp", [-1, 1, 1, 1]], ["tile_x", "sp", [-1, 1, 257, 1]], ["tile_ry", "sp", [-1, 3]], ["tile_rx", "sp", [-1, 3]], ["auto_unroll_max_step", "ot", 1500], ["unroll_explicit", "ot", 0]]}, "result": [[0.0008978958199999999], 0, 5.0751800537109375, 1639730323.789376], "version": 0.2, "tvm_version": "0.8.dev0"}
{"input": ["opencl -keys=adreno,opencl,gpu -device=adreno -max_num_threads=256", "depthwise_conv2d_nchwc_acc32.image2d", [["TENSOR", [1, 8, 257, 257, 4], "float16"], ["TENSOR", [8, 1, 3, 3, 4], "float16"], [1, 1], [1, 1, 1, 1], [1, 1], "float16"], {}], "config": {"index": 3370, "code_hash": null, "entity": [["tile_fc", "sp", [-1, 1, 1, 2]], ["tile_y", "sp", [-1, 1, 1, 1]], ["tile_x", "sp", [-1, 1, 257, 1]], ["tile_ry", "sp", [-1, 1]], ["tile_rx", "sp", [-1, 3]], ["auto_unroll_max_step", "ot", 1500], ["unroll_explicit", "ot", 0]]}, "result": [[0.00100702708], 0, 2.975841760635376, 1639730326.9980085], "version": 0.2, "tvm_version": "0.8.dev0"}
{"input": ["opencl -keys=adreno,opencl,gpu -device=adreno -max_num_threads=256", "depthwise_conv2d_nchwc_acc32.image2d", [["TENSOR", [1, 8, 257, 257, 4], "float16"], ["TENSOR", [8, 1, 3, 3, 4], "float16"], [1, 1], [1, 1, 1, 1], [1, 1], "float16"], {}], "config": {"index": 1130, "code_hash": null, "entity": [["tile_fc", "sp", [-1, 1, 1, 2]], ["tile_y", "sp", [-1, 1, 1, 1]], ["tile_x", "sp", [-1, 1, 257, 1]], ["tile_ry", "sp", [-1, 3]], ["tile_rx", "sp", [-1, 3]], ["auto_unroll_max_step", "ot", 0], ["unroll_explicit", "ot", 0]]}, "result": [[0.0010073125000000002], 0, 5.4308555126190186, 1639730329.463665], "version": 0.2, "tvm_version": "0.8.dev0"}
{"input": ["opencl -keys=adreno,opencl,gpu -device=adreno -max_num_threads=256", "depthwise_conv2d_nchwc_acc32.image2d", [["TENSOR", [1, 8, 257, 257, 4], "float16"], ["TENSOR", [8, 1, 3, 3, 4], "float16"], [1, 1], [1, 1, 1, 1], [1, 1], "float16"], {}], "config": {"index": 7200, "code_hash": null, "entity": [["tile_fc", "sp", [-1, 1, 1, 1]], ["tile_y", "sp", [-1, 1, 1, 1]], ["tile_x", "sp", [-1, 1, 257, 1]], ["tile_ry", "sp", [-1, 1]], ["tile_rx", "sp", [-1, 3]], ["auto_unroll_max_step", "ot", 1500], ["unroll_explicit", "ot", 1]]}, "result": [[0.00091337188], 0, 2.472656011581421, 1639730332.142632], "version": 0.2, "tvm_version": "0.8.dev0"}
{"input": ["opencl -keys=adreno,opencl,gpu -device=adreno -max_num_threads=256", "depthwise_conv2d_nchwc_acc32.image2d", [["TENSOR", [1, 8, 257, 257, 4], "float16"], ["TENSOR", [8, 1, 3, 3, 4], "float16"], [1, 1], [1, 1, 1, 1], [1, 1], "float16"], {}], "config": {"index": 6240, "code_hash": null, "entity": [["tile_fc", "sp", [-1, 1, 1, 1]], ["tile_y", "sp", [-1, 1, 1, 1]], ["tile_x", "sp", [-1, 1, 257, 1]], ["tile_ry", "sp", [-1, 3]], ["tile_rx", "sp", [-1, 3]], ["auto_unroll_max_step", "ot", 512], ["unroll_explicit", "ot", 1]]}, "result": [[0.0009126197999999999], 0, 5.9430153369903564, 1639730335.633032], "version": 0.2, "tvm_version": "0.8.dev0"}
{"input": ["opencl -keys=adreno,opencl,gpu -device=adreno -max_num_threads=256", "depthwise_conv2d_nchwc_acc32.image2d", [["TENSOR", [1, 8, 257, 257, 4], "float16"], ["TENSOR", [8, 1, 3, 3, 4], "float16"], [1, 1], [1, 1, 1, 1], [1, 1], "float16"], {}], "config": {"index": 801, "code_hash": null, "entity": [["tile_fc", "sp", [-1, 2, 1, 1]], ["tile_y", "sp", [-1, 1, 1, 1]], ["tile_x", "sp", [-1, 1, 257, 1]], ["tile_ry", "sp", [-1, 1]], ["tile_rx", "sp", [-1, 3]], ["auto_unroll_max_step", "ot", 0], ["unroll_explicit", "ot", 0]]}, "result": [[0.0010000073000000001], 0, 2.819892406463623, 1639730338.65062], "version": 0.2, "tvm_version": "0.8.dev0"}
{"input": ["opencl -keys=adreno,opencl,gpu -device=adreno -max_num_threads=256", "depthwise_conv2d_nchwc_acc32.image2d", [["TENSOR", [1, 8, 257, 257, 4], "float16"], ["TENSOR", [8, 1, 3, 3, 4], "float16"], [1, 1], [1, 1, 1, 1], [1, 1], "float16"], {}], "config": {"index": 4964, "code_hash": null, "entity": [["tile_fc", "sp", [-1, 1, 2, 1]], ["tile_y", "sp", [-1, 1, 1, 1]], ["tile_x", "sp", [-1, 1, 257, 1]], ["tile_ry", "sp", [-1, 3]], ["tile_rx", "sp", [-1, 3]], ["auto_unroll_max_step", "ot", 0], ["unroll_explicit", "ot", 1]]}, "result": [[0.0009085718799999999], 0, 5.427868366241455, 1639730341.3008213], "version": 0.2, "tvm_version": "0.8.dev0"}
{"input": ["opencl -keys=adreno,opencl,gpu -device=adreno -max_num_threads=256", "depthwise_conv2d_nchwc_acc32.image2d", [["TENSOR", [1, 8, 257, 257, 4], "float16"], ["TENSOR", [8, 1, 3, 3, 4], "float16"], [1, 1], [1, 1, 1, 1], [1, 1], "float16"], {}], "config": {"index": 5290, "code_hash": null, "entity": [["tile_fc", "sp", [-1, 1, 1, 2]], ["tile_y", "sp", [-1, 1, 1, 1]], ["tile_x", "sp", [-1, 1, 257, 1]], ["tile_ry", "sp", [-1, 1]], ["tile_rx", "sp", [-1, 1]], ["auto_unroll_max_step", "ot", 512], ["unroll_explicit", "ot", 1]]}, "result": [[0.0009210552199999999], 0, 2.51242995262146, 1639730344.0689647], "version": 0.2, "tvm_version": "0.8.dev0"}
{"input": ["opencl -keys=adreno,opencl,gpu -device=adreno -max_num_threads=256", "depthwise_conv2d_nchwc_acc32.image2d", [["TENSOR", [1, 8, 257, 257, 4], "float16"], ["TENSOR", [8, 1, 3, 3, 4], "float16"], [1, 1], [1, 1, 1, 1], [1, 1], "float16"], {}], "config": {"index": 1444, "code_hash": null, "entity": [["tile_fc", "sp", [-1, 1, 2, 1]], ["tile_y", "sp", [-1, 1, 1, 1]], ["tile_x", "sp", [-1, 1, 257, 1]], ["tile_ry", "sp", [-1, 1]], ["tile_rx", "sp", [-1, 1]], ["auto_unroll_max_step", "ot", 512], ["unroll_explicit", "ot", 0]]}, "result": [[0.0009075562600000001], 0, 5.118107795715332, 1639730346.6841996], "version": 0.2, "tvm_version": "0.8.dev0"}
{"input": ["opencl -keys=adreno,opencl,gpu -device=adreno -max_num_threads=256", "depthwise_conv2d_nchwc_acc32.image2d", [["TENSOR", [1, 8, 257, 257, 4], "float16"], ["TENSOR", [8, 1, 3, 3, 4], "float16"], [1, 1], [1, 1, 1, 1], [1, 1], "float16"], {}], "config": {"index": 3361, "code_hash": null, "entity": [["tile_fc", "sp", [-1, 2, 1, 1]], ["tile_y", "sp", [-1, 1, 1, 1]], ["tile_x", "sp", [-1, 1, 257, 1]], ["tile_ry", "sp", [-1, 1]], ["tile_rx", "sp", [-1, 3]], ["auto_unroll_max_step", "ot", 1500], ["unroll_explicit", "ot", 0]]}, "result": [[0.00100081042], 0, 2.5797712802886963, 1639730349.4578538], "version": 0.2, "tvm_version": "0.8.dev0"}
{"input": ["opencl -keys=adreno,opencl,gpu -device=adreno -max_num_threads=256", "depthwise_conv2d_nchwc_acc32.image2d", [["TENSOR", [1, 8, 257, 257, 4], "float16"], ["TENSOR", [8, 1, 3, 3, 4], "float16"], [1, 1], [1, 1, 1, 1], [1, 1], "float16"], {}], "config": {"index": 3680, "code_hash": null, "entity": [["tile_fc", "sp", [-1, 1, 1, 1]], ["tile_y", "sp", [-1, 1, 1, 1]], ["tile_x", "sp", [-1, 1, 257, 1]], ["tile_ry", "sp", [-1, 3]], ["tile_rx", "sp", [-1, 3]], ["auto_unroll_max_step", "ot", 1500], ["unroll_explicit", "ot", 0]]}, "result": [[0.00092144478], 0, 5.227656602859497, 1639730352.1059387], "version": 0.2, "tvm_version": "0.8.dev0"}
{"input": ["opencl -keys=adreno,opencl,gpu -device=adreno -max_num_threads=256", "depthwise_conv2d_nchwc_acc32.image2d", [["TENSOR", [1, 8, 257, 257, 4], "float16"], ["TENSOR", [8, 1, 3, 3, 4], "float16"], [1, 1], [1, 1, 1, 1], [1, 1], "float16"], {}], "config": {"index": 3690, "code_hash": null, "entity": [["tile_fc", "sp", [-1, 1, 1, 2]], ["tile_y", "sp", [-1, 1, 1, 1]], ["tile_x", "sp", [-1, 1, 257, 1]], ["tile_ry", "sp", [-1, 3]], ["tile_rx", "sp", [-1, 3]], ["auto_unroll_max_step", "ot", 1500], ["unroll_explicit", "ot", 0]]}, "result": [[0.00102131668], 0, 3.103238344192505, 1639730355.3998427], "version": 0.2, "tvm_version": "0.8.dev0"}
{"input": ["opencl -keys=adreno,opencl,gpu -device=adreno -max_num_threads=256", "depthwise_conv2d_nchwc_acc32.image2d", [["TENSOR", [1, 8, 257, 257, 4], "float16"], ["TENSOR", [8, 1, 3, 3, 4], "float16"], [1, 1], [1, 1, 1, 1], [1, 1], "float16"], {}], "config": {"index": 1761, "code_hash": null, "entity": [["tile_fc", "sp", [-1, 2, 1, 1]], ["tile_y", "sp", [-1, 1, 1, 1]], ["tile_x", "sp", [-1, 1, 257, 1]], ["tile_ry", "sp", [-1, 3]], ["tile_rx", "sp", [-1, 1]], ["auto_unroll_max_step", "ot", 512], ["unroll_explicit", "ot", 0]]}, "result": [[0.0010134260399999998], 0, 6.3347814083099365, 1639730358.648722], "version": 0.2, "tvm_version": "0.8.dev0"}
{"input": ["opencl -keys=adreno,opencl,gpu -device=adreno -max_num_threads=256", "depthwise_conv2d_nchwc_acc32.image2d", [["TENSOR", [1, 8, 257, 257, 4], "float16"], ["TENSOR", [8, 1, 3, 3, 4], "float16"], [1, 1], [1, 1, 1, 1], [1, 1], "float16"], {}], "config": {"index": 2730, "code_hash": null, "entity": [["tile_fc", "sp", [-1, 1, 1, 2]], ["tile_y", "sp", [-1, 1, 1, 1]], ["tile_x", "sp", [-1, 1, 257, 1]], ["tile_ry", "sp", [-1, 1]], ["tile_rx", "sp", [-1, 1]], ["auto_unroll_max_step", "ot", 1500], ["unroll_explicit", "ot", 0]]}, "result": [[0.00100399584], 0, 2.7231645584106445, 1639730361.6066363], "version": 0.2, "tvm_version": "0.8.dev0"}
{"input": ["opencl -keys=adreno,opencl,gpu -device=adreno -max_num_threads=256", "depthwise_conv2d_nchwc_acc32.image2d", [["TENSOR", [1, 8, 257, 257, 4], "float16"], ["TENSOR", [8, 1, 3, 3, 4], "float16"], [1, 1], [1, 1, 1, 1], [1, 1], "float16"], {}], "config": {"index": 3044, "code_hash": null, "entity": [["tile_fc", "sp", [-1, 1, 2, 1]], ["tile_y", "sp", [-1, 1, 1, 1]], ["tile_x", "sp", [-1, 1, 257, 1]], ["tile_ry", "sp", [-1, 3]], ["tile_rx", "sp", [-1, 1]], ["auto_unroll_max_step", "ot", 1500], ["unroll_explicit", "ot", 0]]}, "result": [[0.00090185624], 0, 5.652183771133423, 1639730364.5457265], "version": 0.2, "tvm_version": "0.8.dev0"}
{"input": ["opencl -keys=adreno,opencl,gpu -device=adreno -max_num_threads=256", "depthwise_conv2d_nchwc_acc32.image2d", [["TENSOR", [1, 8, 257, 257, 4], "float16"], ["TENSOR", [8, 1, 3, 3, 4], "float16"], [1, 1], [1, 1, 1, 1], [1, 1], "float16"], {}], "config": {"index": 170, "code_hash": null, "entity": [["tile_fc", "sp", [-1, 1, 1, 2]], ["tile_y", "sp", [-1, 1, 1, 1]], ["tile_x", "sp", [-1, 1, 257, 1]], ["tile_ry", "sp", [-1, 1]], ["tile_rx", "sp", [-1, 1]], ["auto_unroll_max_step", "ot", 0], ["unroll_explicit", "ot", 0]]}, "result": [[0.00098849272], 0, 3.0011892318725586, 1639730367.7764313], "version": 0.2, "tvm_version": "0.8.dev0"}
{"input": ["opencl -keys=adreno,opencl,gpu -device=adreno -max_num_threads=256", "depthwise_conv2d_nchwc_acc32.image2d", [["TENSOR", [1, 8, 257, 257, 4], "float16"], ["TENSOR", [8, 1, 3, 3, 4], "float16"], [1, 1], [1, 1, 1, 1], [1, 1], "float16"], {}], "config": {"index": 5284, "code_hash": null, "entity": [["tile_fc", "sp", [-1, 1, 2, 1]], ["tile_y", "sp", [-1, 1, 1, 1]], ["tile_x", "sp", [-1, 1, 257, 1]], ["tile_ry", "sp", [-1, 1]], ["tile_rx", "sp", [-1, 1]], ["auto_unroll_max_step", "ot", 512], ["unroll_explicit", "ot", 1]]}, "result": [[0.0008929364599999999], 0, 5.480384588241577, 1639730370.2778175], "version": 0.2, "tvm_version": "0.8.dev0"}
{"input": ["opencl -keys=adreno,opencl,gpu -device=adreno -max_num_threads=256", "depthwise_conv2d_nchwc_acc32.image2d", [["TENSOR", [1, 8, 257, 257, 4], "float16"], ["TENSOR", [8, 1, 3, 3, 4], "float16"], [1, 1], [1, 1, 1, 1], [1, 1], "float16"], {}], "config": {"index": 1440, "code_hash": null, "entity": [["tile_fc", "sp", [-1, 1, 1, 1]], ["tile_y", "sp", [-1, 1, 1, 1]], ["tile_x", "sp", [-1, 1, 257, 1]], ["tile_ry", "sp", [-1, 1]], ["tile_rx", "sp", [-1, 1]], ["auto_unroll_max_step", "ot", 512], ["unroll_explicit", "ot", 0]]}, "result": [[0.00092424272], 0, 2.4659574031829834, 1639730373.00497], "version": 0.2, "tvm_version": "0.8.dev0"}
{"input": ["opencl -keys=adreno,opencl,gpu -device=adreno -max_num_threads=256", "depthwise_conv2d_nchwc_acc32.image2d", [["TENSOR", [1, 8, 257, 257, 4], "float16"], ["TENSOR", [8, 1, 3, 3, 4], "float16"], [1, 1], [1, 1, 1, 1], [1, 1], "float16"], {}], "config": {"index": 3050, "code_hash": null, "entity": [["tile_fc", "sp", [-1, 1, 1, 2]], ["tile_y", "sp", [-1, 1, 1, 1]], ["tile_x", "sp", [-1, 1, 257, 1]], ["tile_ry", "sp", [-1, 3]], ["tile_rx", "sp", [-1, 1]], ["auto_unroll_max_step", "ot", 1500], ["unroll_explicit", "ot", 0]]}, "result": [[0.0009725635400000001], 0, 5.282050848007202, 1639730375.8309238], "version": 0.2, "tvm_version": "0.8.dev0"}
{"input": ["opencl -keys=adreno,opencl,gpu -device=adreno -max_num_threads=256", "depthwise_conv2d_nchwc_acc32.image2d", [["TENSOR", [1, 8, 257, 257, 4], "float16"], ["TENSOR", [8, 1, 3, 3, 4], "float16"], [1, 1], [1, 1, 1, 1], [1, 1], "float16"], {}], "config": {"index": 5600, "code_hash": null, "entity": [["tile_fc", "sp", [-1, 1, 1, 1]], ["tile_y", "sp", [-1, 1, 1, 1]], ["tile_x", "sp", [-1, 1, 257, 1]], ["tile_ry", "sp", [-1, 3]], ["tile_rx", "sp", [-1, 1]], ["auto_unroll_max_step", "ot", 512], ["unroll_explicit", "ot", 1]]}, "result": [[0.0009079125], 0, 2.5691707134246826, 1639730378.6074517], "version": 0.2, "tvm_version": "0.8.dev0"}
{"input": ["opencl -keys=adreno,opencl,gpu -device=adreno -max_num_threads=256", "depthwise_conv2d_nchwc_acc32.image2d", [["TENSOR", [1, 8, 257, 257, 4], "float16"], ["TENSOR", [8, 1, 3, 3, 4], "float16"], [1, 1], [1, 1, 1, 1], [1, 1], "float16"], {}], "config": {"index": 3040, "code_hash": null, "entity": [["tile_fc", "sp", [-1, 1, 1, 1]], ["tile_y", "sp", [-1, 1, 1, 1]], ["tile_x", "sp", [-1, 1, 257, 1]], ["tile_ry", "sp", [-1, 3]], ["tile_rx", "sp", [-1, 1]], ["auto_unroll_max_step", "ot", 1500], ["unroll_explicit", "ot", 0]]}, "result": [[0.00093444064], 0, 4.858840465545654, 1639730380.907125], "version": 0.2, "tvm_version": "0.8.dev0"}
{"input": ["opencl -keys=adreno,opencl,gpu -device=adreno -max_num_threads=256", "depthwise_conv2d_nchwc_acc32.image2d", [["TENSOR", [1, 8, 257, 257, 4], "float16"], ["TENSOR", [8, 1, 3, 3, 4], "float16"], [1, 1], [1, 1, 1, 1], [1, 1], "float16"], {}], "config": {"index": 4324, "code_hash": null, "entity": [["tile_fc", "sp", [-1, 1, 2, 1]], ["tile_y", "sp", [-1, 1, 1, 1]], ["tile_x", "sp", [-1, 1, 257, 1]], ["tile_ry", "sp", [-1, 3]], ["tile_rx", "sp", [-1, 1]], ["auto_unroll_max_step", "ot", 0], ["unroll_explicit", "ot", 1]]}, "result": [[0.0008998874999999999], 0, 2.920236825942993, 1639730384.0439668], "version": 0.2, "tvm_version": "0.8.dev0"}
{"input": ["opencl -keys=adreno,opencl,gpu -device=adreno -max_num_threads=256", "depthwise_conv2d_nchwc_acc32.image2d", [["TENSOR", [1, 8, 257, 257, 4], "float16"], ["TENSOR", [8, 1, 3, 3, 4], "float16"], [1, 1], [1, 1, 1, 1], [1, 1], "float16"], {}], "config": {"index": 490, "code_hash": null, "entity": [["tile_fc", "sp", [-1, 1, 1, 2]], ["tile_y", "sp", [-1, 1, 1, 1]], ["tile_x", "sp", [-1, 1, 257, 1]], ["tile_ry", "sp", [-1, 3]], ["tile_rx", "sp", [-1, 1]], ["auto_unroll_max_step", "ot", 0], ["unroll_explicit", "ot", 0]]}, "result": [[0.00102844582], 0, 5.55277419090271, 1639730386.6849802], "version": 0.2, "tvm_version": "0.8.dev0"}
{"input": ["opencl -keys=adreno,opencl,gpu -device=adreno -max_num_threads=256", "depthwise_conv2d_nchwc_acc32.image2d", [["TENSOR", [1, 8, 257, 257, 4], "float16"], ["TENSOR", [8, 1, 3, 3, 4], "float16"], [1, 1], [1, 1, 1, 1], [1, 1], "float16"], {}], "config": {"index": 4650, "code_hash": null, "entity": [["tile_fc", "sp", [-1, 1, 1, 2]], ["tile_y", "sp", [-1, 1, 1, 1]], ["tile_x", "sp", [-1, 1, 257, 1]], ["tile_ry", "sp", [-1, 1]], ["tile_rx", "sp", [-1, 3]], ["auto_unroll_max_step", "ot", 0], ["unroll_explicit", "ot", 1]]}, "result": [[0.001012925], 0, 2.8646867275238037, 1639730389.7621248], "version": 0.2, "tvm_version": "0.8.dev0"}
{"input": ["opencl -keys=adreno,opencl,gpu -device=adreno -max_num_threads=256", "depthwise_conv2d_nchwc_acc32.image2d", [["TENSOR", [1, 8, 257, 257, 4], "float16"], ["TENSOR", [8, 1, 3, 3, 4], "float16"], [1, 1], [1, 1, 1, 1], [1, 1], "float16"], {}], "config": {"index": 4641, "code_hash": null, "entity": [["tile_fc", "sp", [-1, 2, 1, 1]], ["tile_y", "sp", [-1, 1, 1, 1]], ["tile_x", "sp", [-1, 1, 257, 1]], ["tile_ry", "sp", [-1, 1]], ["tile_rx", "sp", [-1, 3]], ["auto_unroll_max_step", "ot", 0], ["unroll_explicit", "ot", 1]]}, "result": [[0.00099836144], 0, 5.357068061828613, 1639730392.25558], "version": 0.2, "tvm_version": "0.8.dev0"}
{"input": ["opencl -keys=adreno,opencl,gpu -device=adreno -max_num_threads=256", "depthwise_conv2d_nchwc_acc32.image2d", [["TENSOR", [1, 8, 257, 257, 4], "float16"], ["TENSOR", [8, 1, 3, 3, 4], "float16"], [1, 1], [1, 1, 1, 1], [1, 1], "float16"], {}], "config": {"index": 480, "code_hash": null, "entity": [["tile_fc", "sp", [-1, 1, 1, 1]], ["tile_y", "sp", [-1, 1, 1, 1]], ["tile_x", "sp", [-1, 1, 257, 1]], ["tile_ry", "sp", [-1, 3]], ["tile_rx", "sp", [-1, 1]], ["auto_unroll_max_step", "ot", 0], ["unroll_explicit", "ot", 0]]}, "result": [[0.00093018958], 0, 3.1412346363067627, 1639730395.6246285], "version": 0.2, "tvm_version": "0.8.dev0"}
{"input": ["opencl -keys=adreno,opencl,gpu -device=adreno -max_num_threads=256", "depthwise_conv2d_nchwc_acc32.image2d", [["TENSOR", [1, 8, 257, 257, 4], "float16"], ["TENSOR", [8, 1, 3, 3, 4], "float16"], [1, 1], [1, 1, 1, 1], [1, 1], "float16"], {}], "config": {"index": 7201, "code_hash": null, "entity": [["tile_fc", "sp", [-1, 2, 1, 1]], ["tile_y", "sp", [-1, 1, 1, 1]], ["tile_x", "sp", [-1, 1, 257, 1]], ["tile_ry", "sp", [-1, 1]], ["tile_rx", "sp", [-1, 3]], ["auto_unroll_max_step", "ot", 1500], ["unroll_explicit", "ot", 1]]}, "result": [[0.0009236572800000001], 0, 5.7596352100372314, 1639730398.257596], "version": 0.2, "tvm_version": "0.8.dev0"}
{"input": ["opencl -keys=adreno,opencl,gpu -device=adreno -max_num_threads=256", "depthwise_conv2d_nchwc_acc32.image2d", [["TENSOR", [1, 8, 257, 257, 4], "float16"], ["TENSOR", [8, 1, 3, 3, 4], "float16"], [1, 1], [1, 1, 1, 1], [1, 1], "float16"], {}], "config": {"index": 5610, "code_hash": null, "entity": [["tile_fc", "sp", [-1, 1, 1, 2]], ["tile_y", "sp", [-1, 1, 1, 1]], ["tile_x", "sp", [-1, 1, 257, 1]], ["tile_ry", "sp", [-1, 3]], ["tile_rx", "sp", [-1, 1]], ["auto_unroll_max_step", "ot", 512], ["unroll_explicit", "ot", 1]]}, "result": [[0.00093137812], 0, 2.570614814758301, 1639730401.1599333], "version": 0.2, "tvm_version": "0.8.dev0"}
{"input": ["opencl -keys=adreno,opencl,gpu -device=adreno -max_num_threads=256", "depthwise_conv2d_nchwc_acc32.image2d", [["TENSOR", [1, 8, 257, 257, 4], "float16"], ["TENSOR", [8, 1, 3, 3, 4], "float16"], [1, 1], [1, 1, 1, 1], [1, 1], "float16"], {}], "config": {"index": 6241, "code_hash": null, "entity": [["tile_fc", "sp", [-1, 2, 1, 1]], ["tile_y", "sp", [-1, 1, 1, 1]], ["tile_x", "sp", [-1, 1, 257, 1]], ["tile_ry", "sp", [-1, 3]], ["tile_rx", "sp", [-1, 3]], ["auto_unroll_max_step", "ot", 512], ["unroll_explicit", "ot", 1]]}, "result": [[0.00090029792], 0, 5.475898265838623, 1639730404.0756829], "version": 0.2, "tvm_version": "0.8.dev0"}
{"input": ["opencl -keys=adreno,opencl,gpu -device=adreno -max_num_threads=256", "depthwise_conv2d_nchwc_acc32.image2d", [["TENSOR", [1, 8, 257, 257, 4], "float16"], ["TENSOR", [8, 1, 3, 3, 4], "float16"], [1, 1], [1, 1, 1, 1], [1, 1], "float16"], {}], "config": {"index": 164, "code_hash": null, "entity": [["tile_fc", "sp", [-1, 1, 2, 1]], ["tile_y", "sp", [-1, 1, 1, 1]], ["tile_x", "sp", [-1, 1, 257, 1]], ["tile_ry", "sp", [-1, 1]], ["tile_rx", "sp", [-1, 1]], ["auto_unroll_max_step", "ot", 0], ["unroll_explicit", "ot", 0]]}, "result": [[0.00089435624], 0, 3.110783100128174, 1639730407.3984966], "version": 0.2, "tvm_version": "0.8.dev0"}
{"input": ["opencl -keys=adreno,opencl,gpu -device=adreno -max_num_threads=256", "depthwise_conv2d_nchwc_acc32.image2d", [["TENSOR", [1, 8, 257, 257, 4], "float16"], ["TENSOR", [8, 1, 3, 3, 4], "float16"], [1, 1], [1, 1, 1, 1], [1, 1], "float16"], {}], "config": {"index": 1121, "code_hash": null, "entity": [["tile_fc", "sp", [-1, 2, 1, 1]], ["tile_y", "sp", [-1, 1, 1, 1]], ["tile_x", "sp", [-1, 1, 257, 1]], ["tile_ry", "sp", [-1, 3]], ["tile_rx", "sp", [-1, 3]], ["auto_unroll_max_step", "ot", 0], ["unroll_explicit", "ot", 0]]}, "result": [[0.00099672812], 0, 5.4694788455963135, 1639730409.7662704], "version": 0.2, "tvm_version": "0.8.dev0"}
{"input": ["opencl -keys=adreno,opencl,gpu -device=adreno -max_num_threads=256", "depthwise_conv2d_nchwc_acc32.image2d", [["TENSOR", [1, 8, 257, 257, 4], "float16"], ["TENSOR", [8, 1, 3, 3, 4], "float16"], [1, 1], [1, 1, 1, 1], [1, 1], "float16"], {}], "config": {"index": 7210, "code_hash": null, "entity": [["tile_fc", "sp", [-1, 1, 1, 2]], ["tile_y", "sp", [-1, 1, 1, 1]], ["tile_x", "sp", [-1, 1, 257, 1]], ["tile_ry", "sp", [-1, 1]], ["tile_rx", "sp", [-1, 3]], ["auto_unroll_max_step", "ot", 1500], ["unroll_explicit", "ot", 1]]}, "result": [[0.00091911458], 0, 2.976846933364868, 1639730412.9424546], "version": 0.2, "tvm_version": "0.8.dev0"}
{"input": ["opencl -keys=adreno,opencl,gpu -device=adreno -max_num_threads=256", "depthwise_conv2d_nchwc_acc32.image2d", [["TENSOR", [1, 8, 257, 257, 4], "float16"], ["TENSOR", [8, 1, 3, 3, 4], "float16"], [1, 1], [1, 1, 1, 1], [1, 1], "float16"], {}], "config": {"index": 7524, "code_hash": null, "entity": [["tile_fc", "sp", [-1, 1, 2, 1]], ["tile_y", "sp", [-1, 1, 1, 1]], ["tile_x", "sp", [-1, 1, 257, 1]], ["tile_ry", "sp", [-1, 3]], ["tile_rx", "sp", [-1, 3]], ["auto_unroll_max_step", "ot", 1500], ["unroll_explicit", "ot", 1]]}, "result": [[0.0008928125], 0, 5.626510858535767, 1639730415.6007724], "version": 0.2, "tvm_version": "0.8.dev0"}
{"input": ["opencl -keys=adreno,opencl,gpu -device=adreno -max_num_threads=256", "depthwise_conv2d_nchwc_acc32.image2d", [["TENSOR", [1, 8, 257, 257, 4], "float16"], ["TENSOR", [8, 1, 3, 3, 4], "float16"], [1, 1], [1, 1, 1, 1], [1, 1], "float16"], {}], "config": {"index": 3681, "code_hash": null, "entity": [["tile_fc", "sp", [-1, 2, 1, 1]], ["tile_y", "sp", [-1, 1, 1, 1]], ["tile_x", "sp", [-1, 1, 257, 1]], ["tile_ry", "sp", [-1, 3]], ["tile_rx", "sp", [-1, 3]], ["auto_unroll_max_step", "ot", 1500], ["unroll_explicit", "ot", 0]]}, "result": [[0.0009949812400000002], 0, 2.727120876312256, 1639730418.5230825], "version": 0.2, "tvm_version": "0.8.dev0"}
