sd888_log/ww50/conv2d_1_257_257_32x3_3_32_1/depthwise_conv2d_nhwc.log
{"input": ["opencl -keys=adreno,opencl,gpu -device=adreno -max_num_threads=256", "depthwise_conv2d_nhwc.image2d", [["TENSOR", [1, 257, 257, 32], "float16"], ["TENSOR", [3, 3, 32, 1], "float16"], [1, 1], [1, 1, 1, 1], [1, 1], "float16"], {}], "config": {"index": 5274851, "code_hash": null, "entity": [["tile_fc", "sp", [-1, 2, 1, 2]], ["tile_y", "sp", [-1, 1, 2, 2]], ["tile_x", "sp", [-1, 1, 65, 1]], ["tile_ry", "sp", [-1, 1]], ["tile_rx", "sp", [-1, 3]], ["auto_unroll_max_step", "ot", 1500], ["unroll_explicit", "ot", 0]]}, "result": [[0.00266100938], 0, 3.082716703414917, 1639726637.5429325], "version": 0.2, "tvm_version": "0.8.dev0"}
