sd888_log/ww12/vgg16.texture.float16.acc16.autotvm.log
{"input": ["opencl -keys=adreno,opencl,gpu -device=adreno -max_num_threads=256", "conv2d_nchw_winograd.image2d", [["TENSOR", [1, 3, 224, 224], "float16"], ["TENSOR", [64, 3, 3, 3], "float16"], [1, 1], [1, 1, 1, 1], [1, 1], "float16"], {}], "config": {"index": 33500, "code_hash": null, "entity": [["tile_b", "sp", [-1, 1, 1, 1]], ["tile_y", "sp", [-1, 1, 2, 1]], ["tile_x", "sp", [-1, 1, 49, 1]], ["tile_rc", "sp", [-1, 1]], ["auto_unroll_max_step", "ot", 128], ["unroll_explicit", "ot", 0]]}, "result": [[0.006781381239999999], 0, 5.54276967048645, 1648121626.105793], "version": 0.2, "tvm_version": "0.8.dev0"}
{"input": ["opencl -keys=adreno,opencl,gpu -device=adreno -max_num_threads=256", "conv2d_nchw_winograd.image2d", [["TENSOR", [1, 64, 224, 224], "float16"], ["TENSOR", [64, 64, 3, 3], "float16"], [1, 1], [1, 1, 1, 1], [1, 1], "float16"], {}], "config": {"index": 772324, "code_hash": null, "entity": [["tile_b", "sp", [-1, 1, 1, 1]], ["tile_y", "sp", [-1, 1, 16, 1]], ["tile_x", "sp", [-1, 2, 8, 2]], ["tile_rc", "sp", [-1, 2]], ["auto_unroll_max_step", "ot", 1500], ["unroll_explicit", "ot", 1]]}, "result": [[0.030004409359999998], 0, 15.590283632278442, 1648138075.4732606], "version": 0.2, "tvm_version": "0.8.dev0"}
{"input": ["opencl -keys=adreno,opencl,gpu -device=adreno -max_num_threads=256", "conv2d_nchw_winograd.image2d", [["TENSOR", [1, 64, 112, 112], "float16"], ["TENSOR", [128, 64, 3, 3], "float16"], [1, 1], [1, 1, 1, 1], [1, 1], "float16"], {}], "config": {"index": 556380, "code_hash": null, "entity": [["tile_b", "sp", [-1, 1, 1, 1]], ["tile_y", "sp", [-1, 1, 32, 1]], ["tile_x", "sp", [-1, 2, 28, 2]], ["tile_rc", "sp", [-1, 8]], ["auto_unroll_max_step", "ot", 1500], ["unroll_explicit", "ot", 1]]}, "result": [[0.009941110400000001], 0, 7.270512580871582, 1648153664.490329], "version": 0.2, "tvm_version": "0.8.dev0"}
{"input": ["opencl -keys=adreno,opencl,gpu -device=adreno -max_num_threads=256", "conv2d_nchw_winograd.image2d", [["TENSOR", [1, 128, 112, 112], "float16"], ["TENSOR", [128, 128, 3, 3], "float16"], [1, 1], [1, 1, 1, 1], [1, 1], "float16"], {}], "config": {"index": 258458, "code_hash": null, "entity": [["tile_b", "sp", [-1, 1, 1, 1]], ["tile_y", "sp", [-1, 1, 16, 1]], ["tile_x", "sp", [-1, 4, 28, 1]], ["tile_rc", "sp", [-1, 2]], ["auto_unroll_max_step", "ot", 1500], ["unroll_explicit", "ot", 0]]}, "result": [[0.01700040312], 0, 14.449634075164795, 1648165694.0639608], "version": 0.2, "tvm_version": "0.8.dev0"}
{"input": ["opencl -keys=adreno,opencl,gpu -device=adreno -max_num_threads=256", "conv2d_nchw_winograd.image2d", [["TENSOR", [1, 128, 56, 56], "float16"], ["TENSOR", [256, 128, 3, 3], "float16"], [1, 1], [1, 1, 1, 1], [1, 1], "float16"], {}], "config": {"index": 262527, "code_hash": null, "entity": [["tile_b", "sp", [-1, 1, 1, 1]], ["tile_y", "sp", [-1, 1, 64, 1]], ["tile_x", "sp", [-1, 2, 14, 1]], ["tile_rc", "sp", [-1, 2]], ["auto_unroll_max_step", "ot", 1500], ["unroll_explicit", "ot", 1]]}, "result": [[0.0065574145799999995], 0, 9.886637449264526, 1648178414.4742453], "version": 0.2, "tvm_version": "0.8.dev0"}
{"input": ["opencl -keys=adreno,opencl,gpu -device=adreno -max_num_threads=256", "conv2d_nchw_winograd.image2d", [["TENSOR", [1, 256, 56, 56], "float16"], ["TENSOR", [256, 256, 3, 3], "float16"], [1, 1], [1, 1, 1, 1], [1, 1], "float16"], {}], "config": {"index": 136598, "code_hash": null, "entity": [["tile_b", "sp", [-1, 1, 1, 1]], ["tile_y", "sp", [-1, 2, 4, 1]], ["tile_x", "sp", [-1, 7, 14, 1]], ["tile_rc", "sp", [-1, 4]], ["auto_unroll_max_step", "ot", 1500], ["unroll_explicit", "ot", 0]]}, "result": [[0.010017687499999999], 0, 6.343578577041626, 1648191731.2327516], "version": 0.2, "tvm_version": "0.8.dev0"}
{"input": ["opencl -keys=adreno,opencl,gpu -device=adreno -max_num_threads=256", "conv2d_nchw_winograd.image2d", [["TENSOR", [1, 256, 28, 28], "float16"], ["TENSOR", [512, 256, 3, 3], "float16"], [1, 1], [1, 1, 1, 1], [1, 1], "float16"], {}], "config": {"index": 15866, "code_hash": null, "entity": [["tile_b", "sp", [-1, 1, 1, 1]], ["tile_y", "sp", [-1, 1, 16, 1]], ["tile_x", "sp", [-1, 4, 49, 1]], ["tile_rc", "sp", [-1, 2]], ["auto_unroll_max_step", "ot", 0], ["unroll_explicit", "ot", 0]]}, "result": [[0.00354631354], 0, 3.274674415588379, 1648197426.6607754], "version": 0.2, "tvm_version": "0.8.dev0"}
{"input": ["opencl -keys=adreno,opencl,gpu -device=adreno -max_num_threads=256", "conv2d_nchw_winograd.image2d", [["TENSOR", [1, 512, 28, 28], "float16"], ["TENSOR", [512, 512, 3, 3], "float16"], [1, 1], [1, 1, 1, 1], [1, 1], "float16"], {}], "config": {"index": 549298, "code_hash": null, "entity": [["tile_b", "sp", [-1, 1, 1, 1]], ["tile_y", "sp", [-1, 1, 16, 2]], ["tile_x", "sp", [-1, 1, 28, 7]], ["tile_rc", "sp", [-1, 32]], ["auto_unroll_max_step", "ot", 1500], ["unroll_explicit", "ot", 1]]}, "result": [[0.008591790620000001], 0, 51.637794971466064, 1648198264.8318176], "version": 0.2, "tvm_version": "0.8.dev0"}
{"input": ["opencl -keys=adreno,opencl,gpu -device=adreno -max_num_threads=256", "conv2d_nchw_winograd.image2d", [["TENSOR", [1, 512, 14, 14], "float16"], ["TENSOR", [512, 512, 3, 3], "float16"], [1, 1], [1, 1, 1, 1], [1, 1], "float16"], {}], "config": {"index": 19353, "code_hash": null, "entity": [["tile_b", "sp", [-1, 1, 1, 1]], ["tile_y", "sp", [-1, 1, 64, 1]], ["tile_x", "sp", [-1, 7, 1, 1]], ["tile_rc", "sp", [-1, 1]], ["auto_unroll_max_step", "ot", 1500], ["unroll_explicit", "ot", 0]]}, "result": [[0.0027164072999999998], 0, 3.1322057247161865, 1648215346.1436613], "version": 0.2, "tvm_version": "0.8.dev0"}
{"input": ["opencl -keys=adreno,opencl,gpu -device=adreno -max_num_threads=256", "dense_small_batch.cuda", [["TENSOR", [1, 4096], "float16"], ["TENSOR", [4096, 4096], "float16"], null, "float16"], {}], "config": {"index": 6, "code_hash": null, "entity": [["tile_k", "sp", [-1, 64]]]}, "result": [[0.0016663448], 0, 19.006739377975464, 1648215762.6108654], "version": 0.2, "tvm_version": "0.8.dev0"}
{"input": ["opencl -keys=adreno,opencl,gpu -device=adreno -max_num_threads=256", "dense_small_batch.cuda", [["TENSOR", [1, 4096], "float16"], ["TENSOR", [1000, 4096], "float16"], null, "float16"], {}], "config": {"index": 6, "code_hash": null, "entity": [["tile_k", "sp", [-1, 64]]]}, "result": [[0.00045840522000000004], 0, 9.38248085975647, 1648215889.4093952], "version": 0.2, "tvm_version": "0.8.dev0"}
{"input": ["opencl -keys=adreno,opencl,gpu -device=adreno -max_num_threads=256", "conv2d_nchwc.image2d", [["TENSOR", [1, 256, 56, 56], "float16"], ["TENSOR", [256, 256, 3, 3], "float16"], [1, 1], [1, 1, 1, 1], [1, 1], "float16"], {}], "config": {"index": 39512, "code_hash": null, "entity": [["tile_fc", "sp", [-1, 2, 32]], ["tile_y", "sp", [-1, 1, 8]], ["tile_x", "sp", [-1, 7, 2]], ["tile_rcc", "sp", [-1, 1]], ["tile_ry", "sp", [-1, 3]], ["tile_rx", "sp", [-1, 1]], ["auto_unroll_max_step", "ot", 0], ["unroll_explicit", "ot", 0]]}, "result": [[0.00692729582], 0, 3.48588490486145, 1645486314.8982074], "version": 0.2, "tvm_version": "0.8.dev0"}
