sd888_log/ww49/yolov3.texture.float16.acc32.autotvm.log.tmp
{"input": ["opencl -keys=adreno,opencl,gpu -device=adreno -max_num_threads=256", "conv2d_nhwc.cuda", [["TENSOR", [1, 416, 416, 3], "float16"], ["TENSOR", [3, 3, 3, 32], "float16"], [1, 1], [1, 1, 1, 1], [1, 1], "float16"], {}], "config": {"index": 490, "code_hash": null, "entity": [["tile_n", "ot", 4], ["tile_c", "ot", 4], ["num_thread_n", "ot", 4], ["num_thread_c", "ot", 4], ["vthread_n", "ot", 1], ["vthread_c", "ot", 2], ["step", "ot", 3]]}, "result": [[0.06140626978], 0, 31.999130964279175, 1638512086.120255], "version": 0.2, "tvm_version": "0.8.dev0"}
{"input": ["opencl -keys=adreno,opencl,gpu -device=adreno -max_num_threads=256", "conv2d_nhwc.cuda", [["TENSOR", [1, 416, 416, 3], "float16"], ["TENSOR", [3, 3, 3, 32], "float16"], [1, 1], [1, 1, 1, 1], [1, 1], "float16"], {}], "config": {"index": 857, "code_hash": null, "entity": [["tile_n", "ot", 8], ["tile_c", "ot", 2], ["num_thread_n", "ot", 16], ["num_thread_c", "ot", 8], ["vthread_n", "ot", 1], ["vthread_c", "ot", 2], ["step", "ot", 32]]}, "result": [[0.04874655936], 0, 46.60314750671387, 1638512297.4112313], "version": 0.2, "tvm_version": "0.8.dev0"}
{"input": ["opencl -keys=adreno,opencl,gpu -device=adreno -max_num_threads=256", "conv2d_nhwc.cuda", [["TENSOR", [1, 416, 416, 3], "float16"], ["TENSOR", [3, 3, 3, 32], "float16"], [1, 1], [1, 1, 1, 1], [1, 1], "float16"], {}], "config": {"index": 839, "code_hash": null, "entity": [["tile_n", "ot", 8], ["tile_c", "ot", 2], ["num_thread_n", "ot", 4], ["num_thread_c", "ot", 8], ["vthread_n", "ot", 1], ["vthread_c", "ot", 2], ["step", "ot", 32]]}, "result": [[0.030755891660000003], 0, 27.34606671333313, 1638512546.3866434], "version": 0.2, "tvm_version": "0.8.dev0"}
{"input": ["opencl -keys=adreno,opencl,gpu -device=adreno -max_num_threads=256", "conv2d_nhwc.cuda", [["TENSOR", [1, 416, 416, 3], "float16"], ["TENSOR", [3, 3, 3, 32], "float16"], [1, 1], [1, 1, 1, 1], [1, 1], "float16"], {}], "config": {"index": 831, "code_hash": null, "entity": [["tile_n", "ot", 2], ["tile_c", "ot", 4], ["num_thread_n", "ot", 16], ["num_thread_c", "ot", 4], ["vthread_n", "ot", 1], ["vthread_c", "ot", 2], ["step", "ot", 32]]}, "result": [[0.04195265416], 0, 61.171613454818726, 1638512891.487723], "version": 0.2, "tvm_version": "0.8.dev0"}
{"input": ["opencl -keys=adreno,opencl,gpu -device=adreno -max_num_threads=256", "conv2d_nhwc.cuda", [["TENSOR", [1, 416, 416, 3], "float16"], ["TENSOR", [3, 3, 3, 32], "float16"], [1, 1], [1, 1, 1, 1], [1, 1], "float16"], {}], "config": {"index": 176, "code_hash": null, "entity": [["tile_n", "ot", 8], ["tile_c", "ot", 4], ["num_thread_n", "ot", 8], ["num_thread_c", "ot", 4], ["vthread_n", "ot", 1], ["vthread_c", "ot", 2], ["step", "ot", 16]]}, "result": [[0.0396869229], 0, 12.345995903015137, 1638512904.223386], "version": 0.2, "tvm_version": "0.8.dev0"}
{"input": ["opencl -keys=adreno,opencl,gpu -device=adreno -max_num_threads=256", "conv2d_nhwc.cuda", [["TENSOR", [1, 416, 416, 3], "float16"], ["TENSOR", [3, 3, 3, 32], "float16"], [1, 1], [1, 1, 1, 1], [1, 1], "float16"], {}], "config": {"index": 837, "code_hash": null, "entity": [["tile_n", "ot", 2], ["tile_c", "ot", 2], ["num_thread_n", "ot", 4], ["num_thread_c", "ot", 8], ["vthread_n", "ot", 1], ["vthread_c", "ot", 2], ["step", "ot", 32]]}, "result": [[0.030719745819999998], 0, 13.361031532287598, 1638513699.2927608], "version": 0.2, "tvm_version": "0.8.dev0"}
{"input": ["opencl -keys=adreno,opencl,gpu -device=adreno -max_num_threads=256", "conv2d_nhwc.cuda", [["TENSOR", [1, 416, 416, 3], "float16"], ["TENSOR", [3, 3, 3, 32], "float16"], [1, 1], [1, 1, 1, 1], [1, 1], "float16"], {}], "config": {"index": 1161, "code_hash": null, "entity": [["tile_n", "ot", 2], ["tile_c", "ot", 2], ["num_thread_n", "ot", 4], ["num_thread_c", "ot", 8], ["vthread_n", "ot", 1], ["vthread_c", "ot", 2], ["step", "ot", 64]]}, "result": [[0.03072642082], 0, 26.25493550300598, 1638513712.1967525], "version": 0.2, "tvm_version": "0.8.dev0"}
{"input": ["opencl -keys=adreno,opencl,gpu -device=adreno -max_num_threads=256", "conv2d_nhwc.cuda", [["TENSOR", [1, 416, 416, 3], "float16"], ["TENSOR", [3, 3, 3, 32], "float16"], [1, 1], [1, 1, 1, 1], [1, 1], "float16"], {}], "config": {"index": 1163, "code_hash": null, "entity": [["tile_n", "ot", 8], ["tile_c", "ot", 2], ["num_thread_n", "ot", 4], ["num_thread_c", "ot", 8], ["vthread_n", "ot", 1], ["vthread_c", "ot", 2], ["step", "ot", 64]]}, "result": [[0.03072825102], 0, 11.95322585105896, 1638513724.5008755], "version": 0.2, "tvm_version": "0.8.dev0"}
{"input": ["opencl -keys=adreno,opencl,gpu -device=adreno -max_num_threads=256", "conv2d_nhwc.cuda", [["TENSOR", [1, 416, 416, 3], "float16"], ["TENSOR", [3, 3, 3, 32], "float16"], [1, 1], [1, 1, 1, 1], [1, 1], "float16"], {}], "config": {"index": 813, "code_hash": null, "entity": [["tile_n", "ot", 2], ["tile_c", "ot", 4], ["num_thread_n", "ot", 4], ["num_thread_c", "ot", 4], ["vthread_n", "ot", 1], ["vthread_c", "ot", 2], ["step", "ot", 32]]}, "result": [[0.06068316768], 0, 15.05128026008606, 1638513755.4327567], "version": 0.2, "tvm_version": "0.8.dev0"}
{"input": ["opencl -keys=adreno,opencl,gpu -device=adreno -max_num_threads=256", "conv2d_nhwc.cuda", [["TENSOR", [1, 416, 416, 3], "float16"], ["TENSOR", [3, 3, 3, 32], "float16"], [1, 1], [1, 1, 1, 1], [1, 1], "float16"], {}], "config": {"index": 815, "code_hash": null, "entity": [["tile_n", "ot", 8], ["tile_c", "ot", 4], ["num_thread_n", "ot", 4], ["num_thread_c", "ot", 4], ["vthread_n", "ot", 1], ["vthread_c", "ot", 2], ["step", "ot", 32]]}, "result": [[0.060658790600000005], 0, 29.354032516479492, 1638513769.7430208], "version": 0.2, "tvm_version": "0.8.dev0"}
{"input": ["opencl -keys=adreno,opencl,gpu -device=adreno -max_num_threads=256", "conv2d_nhwc.cuda", [["TENSOR", [1, 416, 416, 3], "float16"], ["TENSOR", [3, 3, 3, 32], "float16"], [1, 1], [1, 1, 1, 1], [1, 1], "float16"], {}], "config": {"index": 1139, "code_hash": null, "entity": [["tile_n", "ot", 8], ["tile_c", "ot", 4], ["num_thread_n", "ot", 4], ["num_thread_c", "ot", 4], ["vthread_n", "ot", 1], ["vthread_c", "ot", 2], ["step", "ot", 64]]}, "result": [[0.06056898538], 0, 14.424874544143677, 1638513784.5246775], "version": 0.2, "tvm_version": "0.8.dev0"}
{"input": ["opencl -keys=adreno,opencl,gpu -device=adreno -max_num_threads=256", "conv2d_nhwc.cuda", [["TENSOR", [1, 416, 416, 3], "float16"], ["TENSOR", [3, 3, 3, 32], "float16"], [1, 1], [1, 1, 1, 1], [1, 1], "float16"], {}], "config": {"index": 822, "code_hash": null, "entity": [["tile_n", "ot", 2], ["tile_c", "ot", 4], ["num_thread_n", "ot", 8], ["num_thread_c", "ot", 4], ["vthread_n", "ot", 1], ["vthread_c", "ot", 2], ["step", "ot", 32]]}, "result": [[0.03969084062], 0, 25.927514791488647, 1638513796.0410137], "version": 0.2, "tvm_version": "0.8.dev0"}
{"input": ["opencl -keys=adreno,opencl,gpu -device=adreno -max_num_threads=256", "conv2d_nhwc.cuda", [["TENSOR", [1, 416, 416, 3], "float16"], ["TENSOR", [3, 3, 3, 32], "float16"], [1, 1], [1, 1, 1, 1], [1, 1], "float16"], {}], "config": {"index": 1146, "code_hash": null, "entity": [["tile_n", "ot", 2], ["tile_c", "ot", 4], ["num_thread_n", "ot", 8], ["num_thread_c", "ot", 4], ["vthread_n", "ot", 1], ["vthread_c", "ot", 2], ["step", "ot", 64]]}, "result": [[0.03964878748], 0, 11.921847105026245, 1638513808.3471453], "version": 0.2, "tvm_version": "0.8.dev0"}
{"input": ["opencl -keys=adreno,opencl,gpu -device=adreno -max_num_threads=256", "conv2d_nhwc.cuda", [["TENSOR", [1, 416, 416, 3], "float16"], ["TENSOR", [3, 3, 3, 32], "float16"], [1, 1], [1, 1, 1, 1], [1, 1], "float16"], {}], "config": {"index": 1148, "code_hash": null, "entity": [["tile_n", "ot", 8], ["tile_c", "ot", 4], ["num_thread_n", "ot", 8], ["num_thread_c", "ot", 4], ["vthread_n", "ot", 1], ["vthread_c", "ot", 2], ["step", "ot", 64]]}, "result": [[0.03979007186], 0, 24.20733904838562, 1638513820.643157], "version": 0.2, "tvm_version": "0.8.dev0"}
{"input": ["opencl -keys=adreno,opencl,gpu -device=adreno -max_num_threads=256", "conv2d_nhwc.cuda", [["TENSOR", [1, 416, 416, 3], "float16"], ["TENSOR", [3, 3, 3, 32], "float16"], [1, 1], [1, 1, 1, 1], [1, 1], "float16"], {}], "config": {"index": 824, "code_hash": null, "entity": [["tile_n", "ot", 8], ["tile_c", "ot", 4], ["num_thread_n", "ot", 8], ["num_thread_c", "ot", 4], ["vthread_n", "ot", 1], ["vthread_c", "ot", 2], ["step", "ot", 32]]}, "result": [[0.03966789894], 0, 11.011028289794922, 1638513832.0002508], "version": 0.2, "tvm_version": "0.8.dev0"}
{"input": ["opencl -keys=adreno,opencl,gpu -device=adreno -max_num_threads=256", "conv2d_nhwc.cuda", [["TENSOR", [1, 416, 416, 3], "float16"], ["TENSOR", [3, 3, 3, 32], "float16"], [1, 1], [1, 1, 1, 1], [1, 1], "float16"], {}], "config": {"index": 1162, "code_hash": null, "entity": [["tile_n", "ot", 4], ["tile_c", "ot", 2], ["num_thread_n", "ot", 4], ["num_thread_c", "ot", 8], ["vthread_n", "ot", 1], ["vthread_c", "ot", 2], ["step", "ot", 64]]}, "result": [[0.030735797899999997], 0, 21.914464712142944, 1638513842.9192553], "version": 0.2, "tvm_version": "0.8.dev0"}
{"input": ["opencl -keys=adreno,opencl,gpu -device=adreno -max_num_threads=256", "conv2d_nhwc.cuda", [["TENSOR", [1, 416, 416, 3], "float16"], ["TENSOR", [3, 3, 3, 32], "float16"], [1, 1], [1, 1, 1, 1], [1, 1], "float16"], {}], "config": {"index": 838, "code_hash": null, "entity": [["tile_n", "ot", 4], ["tile_c", "ot", 2], ["num_thread_n", "ot", 4], ["num_thread_c", "ot", 8], ["vthread_n", "ot", 1], ["vthread_c", "ot", 2], ["step", "ot", 32]]}, "result": [[0.0307511177], 0, 10.228304147720337, 1638513853.5021305], "version": 0.2, "tvm_version": "0.8.dev0"}
{"input": ["opencl -keys=adreno,opencl,gpu -device=adreno -max_num_threads=256", "conv2d_nhwc.cuda", [["TENSOR", [1, 416, 416, 3], "float16"], ["TENSOR", [3, 3, 3, 32], "float16"], [1, 1], [1, 1, 1, 1], [1, 1], "float16"], {}], "config": {"index": 191, "code_hash": null, "entity": [["tile_n", "ot", 8], ["tile_c", "ot", 2], ["num_thread_n", "ot", 4], ["num_thread_c", "ot", 8], ["vthread_n", "ot", 1], ["vthread_c", "ot", 2], ["step", "ot", 16]]}, "result": [[0.030724644779999997], 0, 19.784780025482178, 1638513863.0536518], "version": 0.2, "tvm_version": "0.8.dev0"}
{"input": ["opencl -keys=adreno,opencl,gpu -device=adreno -max_num_threads=256", "conv2d_nhwc.cuda", [["TENSOR", [1, 416, 416, 3], "float16"], ["TENSOR", [3, 3, 3, 32], "float16"], [1, 1], [1, 1, 1, 1], [1, 1], "float16"], {}], "config": {"index": 814, "code_hash": null, "entity": [["tile_n", "ot", 4], ["tile_c", "ot", 4], ["num_thread_n", "ot", 4], ["num_thread_c", "ot", 4], ["vthread_n", "ot", 1], ["vthread_c", "ot", 2], ["step", "ot", 32]]}, "result": [[0.06074475309999999], 0, 14.350051403045654, 1638513877.8496447], "version": 0.2, "tvm_version": "0.8.dev0"}
{"input": ["opencl -keys=adreno,opencl,gpu -device=adreno -max_num_threads=256", "conv2d_nhwc.cuda", [["TENSOR", [1, 416, 416, 3], "float16"], ["TENSOR", [3, 3, 3, 32], "float16"], [1, 1], [1, 1, 1, 1], [1, 1], "float16"], {}], "config": {"index": 1138, "code_hash": null, "entity": [["tile_n", "ot", 4], ["tile_c", "ot", 4], ["num_thread_n", "ot", 4], ["num_thread_c", "ot", 4], ["vthread_n", "ot", 1], ["vthread_c", "ot", 2], ["step", "ot", 64]]}, "result": [[0.0606752906], 0, 28.36901044845581, 1638513891.8840702], "version": 0.2, "tvm_version": "0.8.dev0"}
{"input": ["opencl -keys=adreno,opencl,gpu -device=adreno -max_num_threads=256", "conv2d_nhwc.cuda", [["TENSOR", [1, 416, 416, 3], "float16"], ["TENSOR", [3, 3, 3, 32], "float16"], [1, 1], [1, 1, 1, 1], [1, 1], "float16"], {}], "config": {"index": 167, "code_hash": null, "entity": [["tile_n", "ot", 8], ["tile_c", "ot", 4], ["num_thread_n", "ot", 4], ["num_thread_c", "ot", 4], ["vthread_n", "ot", 1], ["vthread_c", "ot", 2], ["step", "ot", 16]]}, "result": [[0.06067791142], 0, 14.41373586654663, 1638513906.6853578], "version": 0.2, "tvm_version": "0.8.dev0"}
{"input": ["opencl -keys=adreno,opencl,gpu -device=adreno -max_num_threads=256", "conv2d_nhwc.cuda", [["TENSOR", [1, 416, 416, 3], "float16"], ["TENSOR", [3, 3, 3, 32], "float16"], [1, 1], [1, 1, 1, 1], [1, 1], "float16"], {}], "config": {"index": 1147, "code_hash": null, "entity": [["tile_n", "ot", 4], ["tile_c", "ot", 4], ["num_thread_n", "ot", 8], ["num_thread_c", "ot", 4], ["vthread_n", "ot", 1], ["vthread_c", "ot", 2], ["step", "ot", 64]]}, "result": [[0.03964645832], 0, 26.708397150039673, 1638513918.9758444], "version": 0.2, "tvm_version": "0.8.dev0"}
{"input": ["opencl -keys=adreno,opencl,gpu -device=adreno -max_num_threads=256", "conv2d_nhwc.cuda", [["TENSOR", [1, 416, 416, 3], "float16"], ["TENSOR", [3, 3, 3, 32], "float16"], [1, 1], [1, 1, 1, 1], [1, 1], "float16"], {}], "config": {"index": 823, "code_hash": null, "entity": [["tile_n", "ot", 4], ["tile_c", "ot", 4], ["num_thread_n", "ot", 8], ["num_thread_c", "ot", 4], ["vthread_n", "ot", 1], ["vthread_c", "ot", 2], ["step", "ot", 32]]}, "result": [[0.03969021664], 0, 11.273948669433594, 1638513930.7773056], "version": 0.2, "tvm_version": "0.8.dev0"}
{"input": ["opencl -keys=adreno,opencl,gpu -device=adreno -max_num_threads=256", "conv2d_nhwc.cuda", [["TENSOR", [1, 416, 416, 3], "float16"], ["TENSOR", [3, 3, 3, 32], "float16"], [1, 1], [1, 1, 1, 1], [1, 1], "float16"], {}], "config": {"index": 189, "code_hash": null, "entity": [["tile_n", "ot", 2], ["tile_c", "ot", 2], ["num_thread_n", "ot", 4], ["num_thread_c", "ot", 8], ["vthread_n", "ot", 1], ["vthread_c", "ot", 2], ["step", "ot", 16]]}, "result": [[0.03072982916], 0, 20.923468589782715, 1638513940.4350483], "version": 0.2, "tvm_version": "0.8.dev0"}
{"input": ["opencl -keys=adreno,opencl,gpu -device=adreno -max_num_threads=256", "conv2d_nhwc.cuda", [["TENSOR", [1, 416, 416, 3], "float16"], ["TENSOR", [3, 3, 3, 32], "float16"], [1, 1], [1, 1, 1, 1], [1, 1], "float16"], {}], "config": {"index": 190, "code_hash": null, "entity": [["tile_n", "ot", 4], ["tile_c", "ot", 2], ["num_thread_n", "ot", 4], ["num_thread_c", "ot", 8], ["vthread_n", "ot", 1], ["vthread_c", "ot", 2], ["step", "ot", 16]]}, "result": [[0.03077033228], 0, 9.359147071838379, 1638513950.1199067], "version": 0.2, "tvm_version": "0.8.dev0"}
{"input": ["opencl -keys=adreno,opencl,gpu -device=adreno -max_num_threads=256", "conv2d_nhwc.cuda", [["TENSOR", [1, 416, 416, 3], "float16"], ["TENSOR", [3, 3, 3, 32], "float16"], [1, 1], [1, 1, 1, 1], [1, 1], "float16"], {}], "config": {"index": 166, "code_hash": null, "entity": [["tile_n", "ot", 4], ["tile_c", "ot", 4], ["num_thread_n", "ot", 4], ["num_thread_c", "ot", 4], ["vthread_n", "ot", 1], ["vthread_c", "ot", 2], ["step", "ot", 16]]}, "result": [[0.060715727059999995], 0, 14.889165163040161, 1638513980.7230208], "version": 0.2, "tvm_version": "0.8.dev0"}
{"input": ["opencl -keys=adreno,opencl,gpu -device=adreno -max_num_threads=256", "conv2d_nhwc.cuda", [["TENSOR", [1, 416, 416, 3], "float16"], ["TENSOR", [3, 3, 3, 32], "float16"], [1, 1], [1, 1, 1, 1], [1, 1], "float16"], {}], "config": {"index": 1179, "code_hash": null, "entity": [["tile_n", "ot", 2], ["tile_c", "ot", 2], ["num_thread_n", "ot", 16], ["num_thread_c", "ot", 8], ["vthread_n", "ot", 1], ["vthread_c", "ot", 2], ["step", "ot", 64]]}, "result": [[0.0487072052], 0, 27.727593421936035, 1638513993.5752175], "version": 0.2, "tvm_version": "0.8.dev0"}
{"input": ["opencl -keys=adreno,opencl,gpu -device=adreno -max_num_threads=256", "conv2d_nhwc.cuda", [["TENSOR", [1, 416, 416, 3], "float16"], ["TENSOR", [3, 3, 3, 32], "float16"], [1, 1], [1, 1, 1, 1], [1, 1], "float16"], {}], "config": {"index": 855, "code_hash": null, "entity": [["tile_n", "ot", 2], ["tile_c", "ot", 2], ["num_thread_n", "ot", 16], ["num_thread_c", "ot", 8], ["vthread_n", "ot", 1], ["vthread_c", "ot", 2], ["step", "ot", 32]]}, "result": [[0.04870815206], 0, 12.976000547409058, 1638514006.993486], "version": 0.2, "tvm_version": "0.8.dev0"}
{"input": ["opencl -keys=adreno,opencl,gpu -device=adreno -max_num_threads=256", "conv2d_nhwc.cuda", [["TENSOR", [1, 416, 416, 3], "float16"], ["TENSOR", [3, 3, 3, 32], "float16"], [1, 1], [1, 1, 1, 1], [1, 1], "float16"], {}], "config": {"index": 174, "code_hash": null, "entity": [["tile_n", "ot", 2], ["tile_c", "ot", 4], ["num_thread_n", "ot", 8], ["num_thread_c", "ot", 4], ["vthread_n", "ot", 1], ["vthread_c", "ot", 2], ["step", "ot", 16]]}, "result": [[0.039673996860000005], 0, 25.425482988357544, 1638514019.4460046], "version": 0.2, "tvm_version": "0.8.dev0"}
{"input": ["opencl -keys=adreno,opencl,gpu -device=adreno -max_num_threads=256", "conv2d_nhwc.cuda", [["TENSOR", [1, 416, 416, 3], "float16"], ["TENSOR", [3, 3, 3, 32], "float16"], [1, 1], [1, 1, 1, 1], [1, 1], "float16"], {}], "config": {"index": 175, "code_hash": null, "entity": [["tile_n", "ot", 4], ["tile_c", "ot", 4], ["num_thread_n", "ot", 8], ["num_thread_c", "ot", 4], ["vthread_n", "ot", 1], ["vthread_c", "ot", 2], ["step", "ot", 16]]}, "result": [[0.03967967812], 0, 12.654866695404053, 1638514032.39806], "version": 0.2, "tvm_version": "0.8.dev0"}
{"input": ["opencl -keys=adreno,opencl,gpu -device=adreno -max_num_threads=256", "conv2d_nhwc.cuda", [["TENSOR", [1, 416, 416, 3], "float16"], ["TENSOR", [3, 3, 3, 32], "float16"], [1, 1], [1, 1, 1, 1], [1, 1], "float16"], {}], "config": {"index": 515, "code_hash": null, "entity": [["tile_n", "ot", 8], ["tile_c", "ot", 2], ["num_thread_n", "ot", 4], ["num_thread_c", "ot", 8], ["vthread_n", "ot", 1], ["vthread_c", "ot", 2], ["step", "ot", 3]]}, "result": [[0.0307656677], 0, 22.912282466888428, 1638514042.666069], "version": 0.2, "tvm_version": "0.8.dev0"}
{"input": ["opencl -keys=adreno,opencl,gpu -device=adreno -max_num_threads=256", "conv2d_nhwc.cuda", [["TENSOR", [1, 416, 416, 3], "float16"], ["TENSOR", [3, 3, 3, 32], "float16"], [1, 1], [1, 1, 1, 1], [1, 1], "float16"], {}], "config": {"index": 513, "code_hash": null, "entity": [["tile_n", "ot", 2], ["tile_c", "ot", 2], ["num_thread_n", "ot", 4], ["num_thread_c", "ot", 8], ["vthread_n", "ot", 1], ["vthread_c", "ot", 2], ["step", "ot", 3]]}, "result": [[0.03075242706], 0, 9.888513803482056, 1638514084.3980582], "version": 0.2, "tvm_version": "0.8.dev0"}
{"input": ["opencl -keys=adreno,opencl,gpu -device=adreno -max_num_threads=256", "conv2d_nhwc.cuda", [["TENSOR", [1, 416, 416, 3], "float16"], ["TENSOR", [3, 3, 3, 32], "float16"], [1, 1], [1, 1, 1, 1], [1, 1], "float16"], {}], "config": {"index": 500, "code_hash": null, "entity": [["tile_n", "ot", 8], ["tile_c", "ot", 4], ["num_thread_n", "ot", 8], ["num_thread_c", "ot", 4], ["vthread_n", "ot", 1], ["vthread_c", "ot", 2], ["step", "ot", 3]]}, "result": [[0.03959544374], 0, 22.89381170272827, 1638514097.4183633], "version": 0.2, "tvm_version": "0.8.dev0"}
{"input": ["opencl -keys=adreno,opencl,gpu -device=adreno -max_num_threads=256", "conv2d_nhwc.cuda", [["TENSOR", [1, 416, 416, 3], "float16"], ["TENSOR", [3, 3, 3, 32], "float16"], [1, 1], [1, 1, 1, 1], [1, 1], "float16"], {}], "config": {"index": 514, "code_hash": null, "entity": [["tile_n", "ot", 4], ["tile_c", "ot", 2], ["num_thread_n", "ot", 4], ["num_thread_c", "ot", 8], ["vthread_n", "ot", 1], ["vthread_c", "ot", 2], ["step", "ot", 3]]}, "result": [[0.03073423854], 0, 10.60880184173584, 1638514108.3943143], "version": 0.2, "tvm_version": "0.8.dev0"}
{"input": ["opencl -keys=adreno,opencl,gpu -device=adreno -max_num_threads=256", "conv2d_nhwc.cuda", [["TENSOR", [1, 416, 416, 3], "float16"], ["TENSOR", [3, 3, 3, 32], "float16"], [1, 1], [1, 1, 1, 1], [1, 1], "float16"], {}], "config": {"index": 498, "code_hash": null, "entity": [["tile_n", "ot", 2], ["tile_c", "ot", 4], ["num_thread_n", "ot", 8], ["num_thread_c", "ot", 4], ["vthread_n", "ot", 1], ["vthread_c", "ot", 2], ["step", "ot", 3]]}, "result": [[0.03965740728], 0, 22.35986328125, 1638514120.1459703], "version": 0.2, "tvm_version": "0.8.dev0"}
{"input": ["opencl -keys=adreno,opencl,gpu -device=adreno -max_num_threads=256", "conv2d_nhwc.cuda", [["TENSOR", [1, 416, 416, 3], "float16"], ["TENSOR", [3, 3, 3, 32], "float16"], [1, 1], [1, 1, 1, 1], [1, 1], "float16"], {}], "config": {"index": 499, "code_hash": null, "entity": [["tile_n", "ot", 4], ["tile_c", "ot", 4], ["num_thread_n", "ot", 8], ["num_thread_c", "ot", 4], ["vthread_n", "ot", 1], ["vthread_c", "ot", 2], ["step", "ot", 3]]}, "result": [[0.03959752498], 0, 12.860052347183228, 1638514133.3554068], "version": 0.2, "tvm_version": "0.8.dev0"}
{"input": ["opencl -keys=adreno,opencl,gpu -device=adreno -max_num_threads=256", "conv2d_nhwc.cuda", [["TENSOR", [1, 416, 416, 3], "float16"], ["TENSOR", [3, 3, 3, 32], "float16"], [1, 1], [1, 1, 1, 1], [1, 1], "float16"], {}], "config": {"index": 1181, "code_hash": null, "entity": [["tile_n", "ot", 8], ["tile_c", "ot", 2], ["num_thread_n", "ot", 16], ["num_thread_c", "ot", 8], ["vthread_n", "ot", 1], ["vthread_c", "ot", 2], ["step", "ot", 64]]}, "result": [[0.04871335205999999], 0, 25.329813480377197, 1638514145.8394399], "version": 0.2, "tvm_version": "0.8.dev0"}
{"input": ["opencl -keys=adreno,opencl,gpu -device=adreno -max_num_threads=256", "conv2d_nhwc.cuda", [["TENSOR", [1, 416, 416, 3], "float16"], ["TENSOR", [3, 3, 3, 32], "float16"], [1, 1], [1, 1, 1, 1], [1, 1], "float16"], {}], "config": {"index": 1170, "code_hash": null, "entity": [["tile_n", "ot", 2], ["tile_c", "ot", 2], ["num_thread_n", "ot", 8], ["num_thread_c", "ot", 8], ["vthread_n", "ot", 1], ["vthread_c", "ot", 2], ["step", "ot", 64]]}, "result": [[0.03338499374], 0, 10.491115093231201, 1638514156.6960456], "version": 0.2, "tvm_version": "0.8.dev0"}
{"input": ["opencl -keys=adreno,opencl,gpu -device=adreno -max_num_threads=256", "conv2d_nhwc.cuda", [["TENSOR", [1, 416, 416, 3], "float16"], ["TENSOR", [3, 3, 3, 32], "float16"], [1, 1], [1, 1, 1, 1], [1, 1], "float16"], {}], "config": {"index": 846, "code_hash": null, "entity": [["tile_n", "ot", 2], ["tile_c", "ot", 2], ["num_thread_n", "ot", 8], ["num_thread_c", "ot", 8], ["vthread_n", "ot", 1], ["vthread_c", "ot", 2], ["step", "ot", 32]]}, "result": [[0.033379153120000005], 0, 20.900221824645996, 1638514167.1132765], "version": 0.2, "tvm_version": "0.8.dev0"}
{"input": ["opencl -keys=adreno,opencl,gpu -device=adreno -max_num_threads=256", "conv2d_nhwc.cuda", [["TENSOR", [1, 416, 416, 3], "float16"], ["TENSOR", [3, 3, 3, 32], "float16"], [1, 1], [1, 1, 1, 1], [1, 1], "float16"], {}], "config": {"index": 1180, "code_hash": null, "entity": [["tile_n", "ot", 4], ["tile_c", "ot", 2], ["num_thread_n", "ot", 16], ["num_thread_c", "ot", 8], ["vthread_n", "ot", 1], ["vthread_c", "ot", 2], ["step", "ot", 64]]}, "result": [[0.04881627602], 0, 12.642274379730225, 1638514180.1510863], "version": 0.2, "tvm_version": "0.8.dev0"}
{"input": ["opencl -keys=adreno,opencl,gpu -device=adreno -max_num_threads=256", "conv2d_nhwc.cuda", [["TENSOR", [1, 416, 416, 3], "float16"], ["TENSOR", [3, 3, 3, 32], "float16"], [1, 1], [1, 1, 1, 1], [1, 1], "float16"], {}], "config": {"index": 856, "code_hash": null, "entity": [["tile_n", "ot", 4], ["tile_c", "ot", 2], ["num_thread_n", "ot", 16], ["num_thread_c", "ot", 8], ["vthread_n", "ot", 1], ["vthread_c", "ot", 2], ["step", "ot", 32]]}, "result": [[0.048772864560000004], 0, 24.839147329330444, 1638514192.3632436], "version": 0.2, "tvm_version": "0.8.dev0"}
{"input": ["opencl -keys=adreno,opencl,gpu -device=adreno -max_num_threads=256", "conv2d_nhwc.cuda", [["TENSOR", [1, 416, 416, 3], "float16"], ["TENSOR", [3, 3, 3, 32], "float16"], [1, 1], [1, 1, 1, 1], [1, 1], "float16"], {}], "config": {"index": 207, "code_hash": null, "entity": [["tile_n", "ot", 2], ["tile_c", "ot", 2], ["num_thread_n", "ot", 16], ["num_thread_c", "ot", 8], ["vthread_n", "ot", 1], ["vthread_c", "ot", 2], ["step", "ot", 16]]}, "result": [[0.0487664177], 0, 13.747074842453003, 1638514206.690742], "version": 0.2, "tvm_version": "0.8.dev0"}
{"input": ["opencl -keys=adreno,opencl,gpu -device=adreno -max_num_threads=256", "conv2d_nhwc.cuda", [["TENSOR", [1, 416, 416, 3], "float16"], ["TENSOR", [3, 3, 3, 32], "float16"], [1, 1], [1, 1, 1, 1], [1, 1], "float16"], {}], "config": {"index": 209, "code_hash": null, "entity": [["tile_n", "ot", 8], ["tile_c", "ot", 2], ["num_thread_n", "ot", 16], ["num_thread_c", "ot", 8], ["vthread_n", "ot", 1], ["vthread_c", "ot", 2], ["step", "ot", 16]]}, "result": [[0.04871569998], 0, 25.907819032669067, 1638514218.869101], "version": 0.2, "tvm_version": "0.8.dev0"}
{"input": ["opencl -keys=adreno,opencl,gpu -device=adreno -max_num_threads=256", "conv2d_nhwc.cuda", [["TENSOR", [1, 416, 416, 3], "float16"], ["TENSOR", [3, 3, 3, 32], "float16"], [1, 1], [1, 1, 1, 1], [1, 1], "float16"], {}], "config": {"index": 1155, "code_hash": null, "entity": [["tile_n", "ot", 2], ["tile_c", "ot", 4], ["num_thread_n", "ot", 16], ["num_thread_c", "ot", 4], ["vthread_n", "ot", 1], ["vthread_c", "ot", 2], ["step", "ot", 64]]}, "result": [[0.0419006531], 0, 11.72272801399231, 1638514230.968192], "version": 0.2, "tvm_version": "0.8.dev0"}
{"input": ["opencl -keys=adreno,opencl,gpu -device=adreno -max_num_threads=256", "conv2d_nhwc.cuda", [["TENSOR", [1, 416, 416, 3], "float16"], ["TENSOR", [3, 3, 3, 32], "float16"], [1, 1], [1, 1, 1, 1], [1, 1], "float16"], {}], "config": {"index": 848, "code_hash": null, "entity": [["tile_n", "ot", 8], ["tile_c", "ot", 2], ["num_thread_n", "ot", 8], ["num_thread_c", "ot", 8], ["vthread_n", "ot", 1], ["vthread_c", "ot", 2], ["step", "ot", 32]]}, "result": [[0.033495552080000005], 0, 21.82407307624817, 1638514241.0872166], "version": 0.2, "tvm_version": "0.8.dev0"}
{"input": ["opencl -keys=adreno,opencl,gpu -device=adreno -max_num_threads=256", "conv2d_nhwc.cuda", [["TENSOR", [1, 416, 416, 3], "float16"], ["TENSOR", [3, 3, 3, 32], "float16"], [1, 1], [1, 1, 1, 1], [1, 1], "float16"], {}], "config": {"index": 1172, "code_hash": null, "entity": [["tile_n", "ot", 8], ["tile_c", "ot", 2], ["num_thread_n", "ot", 8], ["num_thread_c", "ot", 8], ["vthread_n", "ot", 1], ["vthread_c", "ot", 2], ["step", "ot", 64]]}, "result": [[0.03337826352], 0, 10.228629350662231, 1638514251.6514807], "version": 0.2, "tvm_version": "0.8.dev0"}
{"input": ["opencl -keys=adreno,opencl,gpu -device=adreno -max_num_threads=256", "conv2d_nhwc.cuda", [["TENSOR", [1, 416, 416, 3], "float16"], ["TENSOR", [3, 3, 3, 32], "float16"], [1, 1], [1, 1, 1, 1], [1, 1], "float16"], {}], "config": {"index": 531, "code_hash": null, "entity": [["tile_n", "ot", 2], ["tile_c", "ot", 2], ["num_thread_n", "ot", 16], ["num_thread_c", "ot", 8], ["vthread_n", "ot", 1], ["vthread_c", "ot", 2], ["step", "ot", 3]]}, "result": [[0.048846835400000004], 0, 24.66627788543701, 1638514266.1067564], "version": 0.2, "tvm_version": "0.8.dev0"}
{"input": ["opencl -keys=adreno,opencl,gpu -device=adreno -max_num_threads=256", "conv2d_nhwc.cuda", [["TENSOR", [1, 416, 416, 3], "float16"], ["TENSOR", [3, 3, 3, 32], "float16"], [1, 1], [1, 1, 1, 1], [1, 1], "float16"], {}], "config": {"index": 208, "code_hash": null, "entity": [["tile_n", "ot", 4], ["tile_c", "ot", 2], ["num_thread_n", "ot", 16], ["num_thread_c", "ot", 8], ["vthread_n", "ot", 1], ["vthread_c", "ot", 2], ["step", "ot", 16]]}, "result": [[0.04870329894], 0, 14.077797651290894, 1638514280.6057274], "version": 0.2, "tvm_version": "0.8.dev0"}
{"input": ["opencl -keys=adreno,opencl,gpu -device=adreno -max_num_threads=256", "conv2d_nhwc.cuda", [["TENSOR", [1, 416, 416, 3], "float16"], ["TENSOR", [3, 3, 3, 32], "float16"], [1, 1], [1, 1, 1, 1], [1, 1], "float16"], {}], "config": {"index": 533, "code_hash": null, "entity": [["tile_n", "ot", 8], ["tile_c", "ot", 2], ["num_thread_n", "ot", 16], ["num_thread_c", "ot", 8], ["vthread_n", "ot", 1], ["vthread_c", "ot", 2], ["step", "ot", 3]]}, "result": [[0.04895747706], 0, 26.39736580848694, 1638514292.9386368], "version": 0.2, "tvm_version": "0.8.dev0"}
{"input": ["opencl -keys=adreno,opencl,gpu -device=adreno -max_num_threads=256", "conv2d_nhwc.cuda", [["TENSOR", [1, 416, 416, 3], "float16"], ["TENSOR", [3, 3, 3, 32], "float16"], [1, 1], [1, 1, 1, 1], [1, 1], "float16"], {}], "config": {"index": 1171, "code_hash": null, "entity": [["tile_n", "ot", 4], ["tile_c", "ot", 2], ["num_thread_n", "ot", 8], ["num_thread_c", "ot", 8], ["vthread_n", "ot", 1], ["vthread_c", "ot", 2], ["step", "ot", 64]]}, "result": [[0.03341180728], 0, 10.191152572631836, 1638514303.477157], "version": 0.2, "tvm_version": "0.8.dev0"}
{"input": ["opencl -keys=adreno,opencl,gpu -device=adreno -max_num_threads=256", "conv2d_nhwc.cuda", [["TENSOR", [1, 416, 416, 3], "float16"], ["TENSOR", [3, 3, 3, 32], "float16"], [1, 1], [1, 1, 1, 1], [1, 1], "float16"], {}], "config": {"index": 847, "code_hash": null, "entity": [["tile_n", "ot", 4], ["tile_c", "ot", 2], ["num_thread_n", "ot", 8], ["num_thread_c", "ot", 8], ["vthread_n", "ot", 1], ["vthread_c", "ot", 2], ["step", "ot", 32]]}, "result": [[0.03345156874], 0, 20.134490489959717, 1638514313.4236507], "version": 0.2, "tvm_version": "0.8.dev0"}
{"input": ["opencl -keys=adreno,opencl,gpu -device=adreno -max_num_threads=256", "conv2d_nhwc.cuda", [["TENSOR", [1, 416, 416, 3], "float16"], ["TENSOR", [3, 3, 3, 32], "float16"], [1, 1], [1, 1, 1, 1], [1, 1], "float16"], {}], "config": {"index": 532, "code_hash": null, "entity": [["tile_n", "ot", 4], ["tile_c", "ot", 2], ["num_thread_n", "ot", 16], ["num_thread_c", "ot", 8], ["vthread_n", "ot", 1], ["vthread_c", "ot", 2], ["step", "ot", 3]]}, "result": [[0.04879808433999999], 0, 12.186541080474854, 1638514325.9429293], "version": 0.2, "tvm_version": "0.8.dev0"}
{"input": ["opencl -keys=adreno,opencl,gpu -device=adreno -max_num_threads=256", "conv2d_nhwc.cuda", [["TENSOR", [1, 416, 416, 3], "float16"], ["TENSOR", [3, 3, 3, 32], "float16"], [1, 1], [1, 1, 1, 1], [1, 1], "float16"], {}], "config": {"index": 200, "code_hash": null, "entity": [["tile_n", "ot", 8], ["tile_c", "ot", 2], ["num_thread_n", "ot", 8], ["num_thread_c", "ot", 8], ["vthread_n", "ot", 1], ["vthread_c", "ot", 2], ["step", "ot", 16]]}, "result": [[0.033368931240000003], 0, 22.79593825340271, 1638514336.5625336], "version": 0.2, "tvm_version": "0.8.dev0"}
{"input": ["opencl -keys=adreno,opencl,gpu -device=adreno -max_num_threads=256", "conv2d_nhwc.cuda", [["TENSOR", [1, 416, 416, 3], "float16"], ["TENSOR", [3, 3, 3, 32], "float16"], [1, 1], [1, 1, 1, 1], [1, 1], "float16"], {}], "config": {"index": 198, "code_hash": null, "entity": [["tile_n", "ot", 2], ["tile_c", "ot", 2], ["num_thread_n", "ot", 8], ["num_thread_c", "ot", 8], ["vthread_n", "ot", 1], ["vthread_c", "ot", 2], ["step", "ot", 16]]}, "result": [[0.03340197914], 0, 11.324809551239014, 1638514348.4968164], "version": 0.2, "tvm_version": "0.8.dev0"}
{"input": ["opencl -keys=adreno,opencl,gpu -device=adreno -max_num_threads=256", "conv2d_nhwc.cuda", [["TENSOR", [1, 416, 416, 3], "float16"], ["TENSOR", [3, 3, 3, 32], "float16"], [1, 1], [1, 1, 1, 1], [1, 1], "float16"], {}], "config": {"index": 1157, "code_hash": null, "entity": [["tile_n", "ot", 8], ["tile_c", "ot", 4], ["num_thread_n", "ot", 16], ["num_thread_c", "ot", 4], ["vthread_n", "ot", 1], ["vthread_c", "ot", 2], ["step", "ot", 64]]}, "result": [[0.041940406240000005], 0, 24.714069843292236, 1638514361.9037323], "version": 0.2, "tvm_version": "0.8.dev0"}
{"input": ["opencl -keys=adreno,opencl,gpu -device=adreno -max_num_threads=256", "conv2d_nhwc.cuda", [["TENSOR", [1, 416, 416, 3], "float16"], ["TENSOR", [3, 3, 3, 32], "float16"], [1, 1], [1, 1, 1, 1], [1, 1], "float16"], {}], "config": {"index": 833, "code_hash": null, "entity": [["tile_n", "ot", 8], ["tile_c", "ot", 4], ["num_thread_n", "ot", 16], ["num_thread_c", "ot", 4], ["vthread_n", "ot", 1], ["vthread_c", "ot", 2], ["step", "ot", 32]]}, "result": [[0.04202580520000001], 0, 11.425685167312622, 1638514373.6608007], "version": 0.2, "tvm_version": "0.8.dev0"}
{"input": ["opencl -keys=adreno,opencl,gpu -device=adreno -max_num_threads=256", "conv2d_nhwc.cuda", [["TENSOR", [1, 416, 416, 3], "float16"], ["TENSOR", [3, 3, 3, 32], "float16"], [1, 1], [1, 1, 1, 1], [1, 1], "float16"], {}], "config": {"index": 199, "code_hash": null, "entity": [["tile_n", "ot", 4], ["tile_c", "ot", 2], ["num_thread_n", "ot", 8], ["num_thread_c", "ot", 8], ["vthread_n", "ot", 1], ["vthread_c", "ot", 2], ["step", "ot", 16]]}, "result": [[0.03338708644], 0, 23.215566635131836, 1638514385.465403], "version": 0.2, "tvm_version": "0.8.dev0"}
{"input": ["opencl -keys=adreno,opencl,gpu -device=adreno -max_num_threads=256", "conv2d_nhwc.cuda", [["TENSOR", [1, 416, 416, 3], "float16"], ["TENSOR", [3, 3, 3, 32], "float16"], [1, 1], [1, 1, 1, 1], [1, 1], "float16"], {}], "config": {"index": 183, "code_hash": null, "entity": [["tile_n", "ot", 2], ["tile_c", "ot", 4], ["num_thread_n", "ot", 16], ["num_thread_c", "ot", 4], ["vthread_n", "ot", 1], ["vthread_c", "ot", 2], ["step", "ot", 16]]}, "result": [[0.041993132280000005], 0, 10.907719135284424, 1638514396.733963], "version": 0.2, "tvm_version": "0.8.dev0"}
{"input": ["opencl -keys=adreno,opencl,gpu -device=adreno -max_num_threads=256", "conv2d_nhwc.cuda", [["TENSOR", [1, 416, 416, 3], "float16"], ["TENSOR", [3, 3, 3, 32], "float16"], [1, 1], [1, 1, 1, 1], [1, 1], "float16"], {}], "config": {"index": 1156, "code_hash": null, "entity": [["tile_n", "ot", 4], ["tile_c", "ot", 4], ["num_thread_n", "ot", 16], ["num_thread_c", "ot", 4], ["vthread_n", "ot", 1], ["vthread_c", "ot", 2], ["step", "ot", 64]]}, "result": [[0.04195225624], 0, 23.86488962173462, 1638514409.7084918], "version": 0.2, "tvm_version": "0.8.dev0"}
{"input": ["opencl -keys=adreno,opencl,gpu -device=adreno -max_num_threads=256", "conv2d_nhwc.cuda", [["TENSOR", [1, 416, 416, 3], "float16"], ["TENSOR", [3, 3, 3, 32], "float16"], [1, 1], [1, 1, 1, 1], [1, 1], "float16"], {}], "config": {"index": 524, "code_hash": null, "entity": [["tile_n", "ot", 8], ["tile_c", "ot", 2], ["num_thread_n", "ot", 8], ["num_thread_c", "ot", 8], ["vthread_n", "ot", 1], ["vthread_c", "ot", 2], ["step", "ot", 3]]}, "result": [[0.032943746860000005], 0, 11.137574195861816, 1638514421.2464552], "version": 0.2, "tvm_version": "0.8.dev0"}
{"input": ["opencl -keys=adreno,opencl,gpu -device=adreno -max_num_threads=256", "conv2d_nhwc.cuda", [["TENSOR", [1, 416, 416, 3], "float16"], ["TENSOR", [3, 3, 3, 32], "float16"], [1, 1], [1, 1, 1, 1], [1, 1], "float16"], {}], "config": {"index": 522, "code_hash": null, "entity": [["tile_n", "ot", 2], ["tile_c", "ot", 2], ["num_thread_n", "ot", 8], ["num_thread_c", "ot", 8], ["vthread_n", "ot", 1], ["vthread_c", "ot", 2], ["step", "ot", 3]]}, "result": [[0.03288100312], 0, 20.947147369384766, 1638514431.0715594], "version": 0.2, "tvm_version": "0.8.dev0"}
{"input": ["opencl -keys=adreno,opencl,gpu -device=adreno -max_num_threads=256", "conv2d_nhwc.cuda", [["TENSOR", [1, 416, 416, 3], "float16"], ["TENSOR", [3, 3, 3, 32], "float16"], [1, 1], [1, 1, 1, 1], [1, 1], "float16"], {}], "config": {"index": 185, "code_hash": null, "entity": [["tile_n", "ot", 8], ["tile_c", "ot", 4], ["num_thread_n", "ot", 16], ["num_thread_c", "ot", 4], ["vthread_n", "ot", 1], ["vthread_c", "ot", 2], ["step", "ot", 16]]}, "result": [[0.041930769779999995], 0, 13.8881995677948, 1638514445.2948341], "version": 0.2, "tvm_version": "0.8.dev0"}
{"input": ["opencl -keys=adreno,opencl,gpu -device=adreno -max_num_threads=256", "conv2d_nhwc.cuda", [["TENSOR", [1, 416, 416, 3], "float16"], ["TENSOR", [3, 3, 3, 32], "float16"], [1, 1], [1, 1, 1, 1], [1, 1], "float16"], {}], "config": {"index": 523, "code_hash": null, "entity": [["tile_n", "ot", 4], ["tile_c", "ot", 2], ["num_thread_n", "ot", 8], ["num_thread_c", "ot", 8], ["vthread_n", "ot", 1], ["vthread_c", "ot", 2], ["step", "ot", 3]]}, "result": [[0.03292941144], 0, 10.533256769180298, 1638514531.6187344], "version": 0.2, "tvm_version": "0.8.dev0"}
{"input": ["opencl -keys=adreno,opencl,gpu -device=adreno -max_num_threads=256", "conv2d_nhwc.cuda", [["TENSOR", [1, 416, 416, 3], "float16"], ["TENSOR", [3, 3, 3, 32], "float16"], [1, 1], [1, 1, 1, 1], [1, 1], "float16"], {}], "config": {"index": 272, "code_hash": null, "entity": [["tile_n", "ot", 8], ["tile_c", "ot", 2], ["num_thread_n", "ot", 4], ["num_thread_c", "ot", 8], ["vthread_n", "ot", 2], ["vthread_c", "ot", 2], ["step", "ot", 16]]}, "result": [[0.030701904140000003], 0, 20.18371343612671, 1638514541.277689], "version": 0.2, "tvm_version": "0.8.dev0"}
{"input": ["opencl -keys=adreno,opencl,gpu -device=adreno -max_num_threads=256", "conv2d_nhwc.cuda", [["TENSOR", [1, 416, 416, 3], "float16"], ["TENSOR", [3, 3, 3, 32], "float16"], [1, 1], [1, 1, 1, 1], [1, 1], "float16"], {}], "config": {"index": 920, "code_hash": null, "entity": [["tile_n", "ot", 8], ["tile_c", "ot", 2], ["num_thread_n", "ot", 4], ["num_thread_c", "ot", 8], ["vthread_n", "ot", 2], ["vthread_c", "ot", 2], ["step", "ot", 32]]}, "result": [[0.03070619062], 0, 10.079095602035522, 1638514551.7712886], "version": 0.2, "tvm_version": "0.8.dev0"}
{"input": ["opencl -keys=adreno,opencl,gpu -device=adreno -max_num_threads=256", "conv2d_nhwc.cuda", [["TENSOR", [1, 416, 416, 3], "float16"], ["TENSOR", [3, 3, 3, 32], "float16"], [1, 1], [1, 1, 1, 1], [1, 1], "float16"], {}], "config": {"index": 596, "code_hash": null, "entity": [["tile_n", "ot", 8], ["tile_c", "ot", 2], ["num_thread_n", "ot", 4], ["num_thread_c", "ot", 8], ["vthread_n", "ot", 2], ["vthread_c", "ot", 2], ["step", "ot", 3]]}, "result": [[0.0306349479], 0, 20.943357467651367, 1638514562.6348453], "version": 0.2, "tvm_version": "0.8.dev0"}
{"input": ["opencl -keys=adreno,opencl,gpu -device=adreno -max_num_threads=256", "conv2d_nhwc.cuda", [["TENSOR", [1, 416, 416, 3], "float16"], ["TENSOR", [3, 3, 3, 32], "float16"], [1, 1], [1, 1, 1, 1], [1, 1], "float16"], {}], "config": {"index": 918, "code_hash": null, "entity": [["tile_n", "ot", 2], ["tile_c", "ot", 2], ["num_thread_n", "ot", 4], ["num_thread_c", "ot", 8], ["vthread_n", "ot", 2], ["vthread_c", "ot", 2], ["step", "ot", 32]]}, "result": [[0.030695785420000003], 0, 10.07817816734314, 1638514573.0599265], "version": 0.2, "tvm_version": "0.8.dev0"}
{"input": ["opencl -keys=adreno,opencl,gpu -device=adreno -max_num_threads=256", "conv2d_nhwc.cuda", [["TENSOR", [1, 416, 416, 3], "float16"], ["TENSOR", [3, 3, 3, 32], "float16"], [1, 1], [1, 1, 1, 1], [1, 1], "float16"], {}], "config": {"index": 595, "code_hash": null, "entity": [["tile_n", "ot", 4], ["tile_c", "ot", 2], ["num_thread_n", "ot", 4], ["num_thread_c", "ot", 8], ["vthread_n", "ot", 2], ["vthread_c", "ot", 2], ["step", "ot", 3]]}, "result": [[0.030627527060000003], 0, 10.901143789291382, 1638514631.1519759], "version": 0.2, "tvm_version": "0.8.dev0"}
{"input": ["opencl -keys=adreno,opencl,gpu -device=adreno -max_num_threads=256", "conv2d_nhwc.cuda", [["TENSOR", [1, 416, 416, 3], "float16"], ["TENSOR", [3, 3, 3, 32], "float16"], [1, 1], [1, 1, 1, 1], [1, 1], "float16"], {}], "config": {"index": 1244, "code_hash": null, "entity": [["tile_n", "ot", 8], ["tile_c", "ot", 2], ["num_thread_n", "ot", 4], ["num_thread_c", "ot", 8], ["vthread_n", "ot", 2], ["vthread_c", "ot", 2], ["step", "ot", 64]]}, "result": [[0.03067400208], 0, 20.061835289001465, 1638514640.3117442], "version": 0.2, "tvm_version": "0.8.dev0"}
{"input": ["opencl -keys=adreno,opencl,gpu -device=adreno -max_num_threads=256", "conv2d_nhwc.cuda", [["TENSOR", [1, 416, 416, 3], "float16"], ["TENSOR", [3, 3, 3, 32], "float16"], [1, 1], [1, 1, 1, 1], [1, 1], "float16"], {}], "config": {"index": 271, "code_hash": null, "entity": [["tile_n", "ot", 4], ["tile_c", "ot", 2], ["num_thread_n", "ot", 4], ["num_thread_c", "ot", 8], ["vthread_n", "ot", 2], ["vthread_c", "ot", 2], ["step", "ot", 16]]}, "result": [[0.030684702080000004], 0, 12.117939710617065, 1638514747.078024], "version": 0.2, "tvm_version": "0.8.dev0"}
{"input": ["opencl -keys=adreno,opencl,gpu -device=adreno -max_num_threads=256", "conv2d_nhwc.cuda", [["TENSOR", [1, 416, 416, 3], "float16"], ["TENSOR", [3, 3, 3, 32], "float16"], [1, 1], [1, 1, 1, 1], [1, 1], "float16"], {}], "config": {"index": 919, "code_hash": null, "entity": [["tile_n", "ot", 4], ["tile_c", "ot", 2], ["num_thread_n", "ot", 4], ["num_thread_c", "ot", 8], ["vthread_n", "ot", 2], ["vthread_c", "ot", 2], ["step", "ot", 32]]}, "result": [[0.03062798332], 0, 21.88318920135498, 1638514756.8432755], "version": 0.2, "tvm_version": "0.8.dev0"}
{"input": ["opencl -keys=adreno,opencl,gpu -device=adreno -max_num_threads=256", "conv2d_nhwc.cuda", [["TENSOR", [1, 416, 416, 3], "float16"], ["TENSOR", [3, 3, 3, 32], "float16"], [1, 1], [1, 1, 1, 1], [1, 1], "float16"], {}], "config": {"index": 270, "code_hash": null, "entity": [["tile_n", "ot", 2], ["tile_c", "ot", 2], ["num_thread_n", "ot", 4], ["num_thread_c", "ot", 8], ["vthread_n", "ot", 2], ["vthread_c", "ot", 2], ["step", "ot", 16]]}, "result": [[0.03066475728], 0, 11.517284870147705, 1638514863.2374613], "version": 0.2, "tvm_version": "0.8.dev0"}
{"input": ["opencl -keys=adreno,opencl,gpu -device=adreno -max_num_threads=256", "conv2d_nhwc.cuda", [["TENSOR", [1, 416, 416, 3], "float16"], ["TENSOR", [3, 3, 3, 32], "float16"], [1, 1], [1, 1, 1, 1], [1, 1], "float16"], {}], "config": {"index": 594, "code_hash": null, "entity": [["tile_n", "ot", 2], ["tile_c", "ot", 2], ["num_thread_n", "ot", 4], ["num_thread_c", "ot", 8], ["vthread_n", "ot", 2], ["vthread_c", "ot", 2], ["step", "ot", 3]]}, "result": [[0.0306401031], 0, 11.644439220428467, 1638514922.6862378], "version": 0.2, "tvm_version": "0.8.dev0"}
{"input": ["opencl -keys=adreno,opencl,gpu -device=adreno -max_num_threads=256", "conv2d_nhwc.cuda", [["TENSOR", [1, 416, 416, 3], "float16"], ["TENSOR", [3, 3, 3, 32], "float16"], [1, 1], [1, 1, 1, 1], [1, 1], "float16"], {}], "config": {"index": 1242, "code_hash": null, "entity": [["tile_n", "ot", 2], ["tile_c", "ot", 2], ["num_thread_n", "ot", 4], ["num_thread_c", "ot", 8], ["vthread_n", "ot", 2], ["vthread_c", "ot", 2], ["step", "ot", 64]]}, "result": [[0.03066453852], 0, 56.786405086517334, 1638515219.804885], "version": 0.2, "tvm_version": "0.8.dev0"}
{"input": ["opencl -keys=adreno,opencl,gpu -device=adreno -max_num_threads=256", "conv2d_nhwc.cuda", [["TENSOR", [1, 416, 416, 3], "float16"], ["TENSOR", [3, 3, 3, 32], "float16"], [1, 1], [1, 1, 1, 1], [1, 1], "float16"], {}], "config": {"index": 1243, "code_hash": null, "entity": [["tile_n", "ot", 4], ["tile_c", "ot", 2], ["num_thread_n", "ot", 4], ["num_thread_c", "ot", 8], ["vthread_n", "ot", 2], ["vthread_c", "ot", 2], ["step", "ot", 64]]}, "result": [[0.03067080104], 0, 9.457409381866455, 1638515229.5459645], "version": 0.2, "tvm_version": "0.8.dev0"}
{"input": ["opencl -keys=adreno,opencl,gpu -device=adreno -max_num_threads=256", "conv2d_nhwc.cuda", [["TENSOR", [1, 416, 416, 3], "float16"], ["TENSOR", [3, 3, 3, 32], "float16"], [1, 1], [1, 1, 1, 1], [1, 1], "float16"], {}], "config": {"index": 509, "code_hash": null, "entity": [["tile_n", "ot", 8], ["tile_c", "ot", 4], ["num_thread_n", "ot", 16], ["num_thread_c", "ot", 4], ["vthread_n", "ot", 1], ["vthread_c", "ot", 2], ["step", "ot", 3]]}, "result": [[0.04176671144], 0, 12.506210565567017, 1638515288.093482], "version": 0.2, "tvm_version": "0.8.dev0"}
{"input": ["opencl -keys=adreno,opencl,gpu -device=adreno -max_num_threads=256", "conv2d_nhwc.cuda", [["TENSOR", [1, 416, 416, 3], "float16"], ["TENSOR", [3, 3, 3, 32], "float16"], [1, 1], [1, 1, 1, 1], [1, 1], "float16"], {}], "config": {"index": 585, "code_hash": null, "entity": [["tile_n", "ot", 2], ["tile_c", "ot", 2], ["num_thread_n", "ot", 16], ["num_thread_c", "ot", 4], ["vthread_n", "ot", 2], ["vthread_c", "ot", 2], ["step", "ot", 3]]}, "result": [[0.05709981666], 0, 13.84736967086792, 1638515631.4802284], "version": 0.2, "tvm_version": "0.8.dev0"}
{"input": ["opencl -keys=adreno,opencl,gpu -device=adreno -max_num_threads=256", "conv2d_nhwc.cuda", [["TENSOR", [1, 416, 416, 3], "float16"], ["TENSOR", [3, 3, 3, 32], "float16"], [1, 1], [1, 1, 1, 1], [1, 1], "float16"], {}], "config": {"index": 262, "code_hash": null, "entity": [["tile_n", "ot", 4], ["tile_c", "ot", 2], ["num_thread_n", "ot", 16], ["num_thread_c", "ot", 4], ["vthread_n", "ot", 2], ["vthread_c", "ot", 2], ["step", "ot", 16]]}, "result": [[0.05709009686], 0, 27.166032791137695, 1638515644.8162186], "version": 0.2, "tvm_version": "0.8.dev0"}
{"input": ["opencl -keys=adreno,opencl,gpu -device=adreno -max_num_threads=256", "conv2d_nhwc.cuda", [["TENSOR", [1, 416, 416, 3], "float16"], ["TENSOR", [3, 3, 3, 32], "float16"], [1, 1], [1, 1, 1, 1], [1, 1], "float16"], {}], "config": {"index": 1135, "code_hash": null, "entity": [["tile_n", "ot", 4], ["tile_c", "ot", 2], ["num_thread_n", "ot", 4], ["num_thread_c", "ot", 4], ["vthread_n", "ot", 1], ["vthread_c", "ot", 2], ["step", "ot", 64]]}, "result": [[0.05731606872], 0, 61.70637559890747, 1638516485.2829015], "version": 0.2, "tvm_version": "0.8.dev0"}
{"input": ["opencl -keys=adreno,opencl,gpu -device=adreno -max_num_threads=256", "conv2d_nhwc.cuda", [["TENSOR", [1, 416, 416, 3], "float16"], ["TENSOR", [3, 3, 3, 32], "float16"], [1, 1], [1, 1, 1, 1], [1, 1], "float16"], {}], "config": {"index": 812, "code_hash": null, "entity": [["tile_n", "ot", 8], ["tile_c", "ot", 2], ["num_thread_n", "ot", 4], ["num_thread_c", "ot", 4], ["vthread_n", "ot", 1], ["vthread_c", "ot", 2], ["step", "ot", 32]]}, "result": [[0.05730586248], 0, 13.617033958435059, 1638516723.5127444], "version": 0.2, "tvm_version": "0.8.dev0"}
{"input": ["opencl -keys=adreno,opencl,gpu -device=adreno -max_num_threads=256", "conv2d_nhwc.cuda", [["TENSOR", [1, 416, 416, 3], "float16"], ["TENSOR", [3, 3, 3, 32], "float16"], [1, 1], [1, 1, 1, 1], [1, 1], "float16"], {}], "config": {"index": 581, "code_hash": null, "entity": [["tile_n", "ot", 8], ["tile_c", "ot", 4], ["num_thread_n", "ot", 8], ["num_thread_c", "ot", 4], ["vthread_n", "ot", 2], ["vthread_c", "ot", 2], ["step", "ot", 3]]}, "result": [[0.06365453644], 0, 28.8089599609375, 1638516738.701896], "version": 0.2, "tvm_version": "0.8.dev0"}
{"input": ["opencl -keys=adreno,opencl,gpu -device=adreno -max_num_threads=256", "conv2d_nhwc.cuda", [["TENSOR", [1, 416, 416, 3], "float16"], ["TENSOR", [3, 3, 3, 32], "float16"], [1, 1], [1, 1, 1, 1], [1, 1], "float16"], {}], "config": {"index": 1136, "code_hash": null, "entity": [["tile_n", "ot", 8], ["tile_c", "ot", 2], ["num_thread_n", "ot", 4], ["num_thread_c", "ot", 4], ["vthread_n", "ot", 1], ["vthread_c", "ot", 2], ["step", "ot", 64]]}, "result": [[0.05726191872], 0, 13.87256383895874, 1638516752.944258], "version": 0.2, "tvm_version": "0.8.dev0"}
{"input": ["opencl -keys=adreno,opencl,gpu -device=adreno -max_num_threads=256", "conv2d_nhwc.cuda", [["TENSOR", [1, 416, 416, 3], "float16"], ["TENSOR", [3, 3, 3, 32], "float16"], [1, 1], [1, 1, 1, 1], [1, 1], "float16"], {}], "config": {"index": 487, "code_hash": null, "entity": [["tile_n", "ot", 4], ["tile_c", "ot", 2], ["num_thread_n", "ot", 4], ["num_thread_c", "ot", 4], ["vthread_n", "ot", 1], ["vthread_c", "ot", 2], ["step", "ot", 3]]}, "result": [[0.05774152916], 0, 27.655136823654175, 1638516766.7440124], "version": 0.2, "tvm_version": "0.8.dev0"}
{"input": ["opencl -keys=adreno,opencl,gpu -device=adreno -max_num_threads=256", "conv2d_nhwc.cuda", [["TENSOR", [1, 416, 416, 3], "float16"], ["TENSOR", [3, 3, 3, 32], "float16"], [1, 1], [1, 1, 1, 1], [1, 1], "float16"], {}], "config": {"index": 252, "code_hash": null, "entity": [["tile_n", "ot", 2], ["tile_c", "ot", 2], ["num_thread_n", "ot", 8], ["num_thread_c", "ot", 4], ["vthread_n", "ot", 2], ["vthread_c", "ot", 2], ["step", "ot", 16]]}, "result": [[0.06558910205999999], 0, 14.684069871902466, 1638516781.7548711], "version": 0.2, "tvm_version": "0.8.dev0"}
{"input": ["opencl -keys=adreno,opencl,gpu -device=adreno -max_num_threads=256", "conv2d_nhwc.cuda", [["TENSOR", [1, 416, 416, 3], "float16"], ["TENSOR", [3, 3, 3, 32], "float16"], [1, 1], [1, 1, 1, 1], [1, 1], "float16"], {}], "config": {"index": 928, "code_hash": null, "entity": [["tile_n", "ot", 4], ["tile_c", "ot", 2], ["num_thread_n", "ot", 8], ["num_thread_c", "ot", 8], ["vthread_n", "ot", 2], ["vthread_c", "ot", 2], ["step", "ot", 32]]}, "result": [[0.03347395938], 0, 34.06469964981079, 1638517153.7489123], "version": 0.2, "tvm_version": "0.8.dev0"}
{"input": ["opencl -keys=adreno,opencl,gpu -device=adreno -max_num_threads=256", "conv2d_nhwc.cuda", [["TENSOR", [1, 416, 416, 3], "float16"], ["TENSOR", [3, 3, 3, 32], "float16"], [1, 1], [1, 1, 1, 1], [1, 1], "float16"], {}], "config": {"index": 254, "code_hash": null, "entity": [["tile_n", "ot", 8], ["tile_c", "ot", 2], ["num_thread_n", "ot", 8], ["num_thread_c", "ot", 4], ["vthread_n", "ot", 2], ["vthread_c", "ot", 2], ["step", "ot", 16]]}, "result": [[0.0655691854], 0, 30.314193725585938, 1638517439.9525838], "version": 0.2, "tvm_version": "0.8.dev0"}
{"input": ["opencl -keys=adreno,opencl,gpu -device=adreno -max_num_threads=256", "conv2d_nhwc.cuda", [["TENSOR", [1, 416, 416, 3], "float16"], ["TENSOR", [3, 3, 3, 32], "float16"], [1, 1], [1, 1, 1, 1], [1, 1], "float16"], {}], "config": {"index": 279, "code_hash": null, "entity": [["tile_n", "ot", 2], ["tile_c", "ot", 2], ["num_thread_n", "ot", 8], ["num_thread_c", "ot", 8], ["vthread_n", "ot", 2], ["vthread_c", "ot", 2], ["step", "ot", 16]]}, "result": [[0.03347023436], 0, 10.666364669799805, 1638518861.0259159], "version": 0.2, "tvm_version": "0.8.dev0"}
{"input": ["opencl -keys=adreno,opencl,gpu -device=adreno -max_num_threads=256", "conv2d_nhwc.cuda", [["TENSOR", [1, 416, 416, 3], "float16"], ["TENSOR", [3, 3, 3, 32], "float16"], [1, 1], [1, 1, 1, 1], [1, 1], "float16"], {}], "config": {"index": 605, "code_hash": null, "entity": [["tile_n", "ot", 8], ["tile_c", "ot", 2], ["num_thread_n", "ot", 8], ["num_thread_c", "ot", 8], ["vthread_n", "ot", 2], ["vthread_c", "ot", 2], ["step", "ot", 3]]}, "result": [[0.0327747375], 0, 59.23644709587097, 1638518983.7639449], "version": 0.2, "tvm_version": "0.8.dev0"}
{"input": ["opencl -keys=adreno,opencl,gpu -device=adreno -max_num_threads=256", "conv2d_nhwc.cuda", [["TENSOR", [1, 416, 416, 3], "float16"], ["TENSOR", [3, 3, 3, 32], "float16"], [1, 1], [1, 1, 1, 1], [1, 1], "float16"], {}], "config": {"index": 281, "code_hash": null, "entity": [["tile_n", "ot", 8], ["tile_c", "ot", 2], ["num_thread_n", "ot", 8], ["num_thread_c", "ot", 8], ["vthread_n", "ot", 2], ["vthread_c", "ot", 2], ["step", "ot", 16]]}, "result": [[0.033368303099999996], 0, 11.983211517333984, 1638519032.9103968], "version": 0.2, "tvm_version": "0.8.dev0"}
{"input": ["opencl -keys=adreno,opencl,gpu -device=adreno -max_num_threads=256", "conv2d_nhwc.cuda", [["TENSOR", [1, 416, 416, 3], "float16"], ["TENSOR", [3, 3, 3, 32], "float16"], [1, 1], [1, 1, 1, 1], [1, 1], "float16"], {}], "config": {"index": 280, "code_hash": null, "entity": [["tile_n", "ot", 4], ["tile_c", "ot", 2], ["num_thread_n", "ot", 8], ["num_thread_c", "ot", 8], ["vthread_n", "ot", 2], ["vthread_c", "ot", 2], ["step", "ot", 16]]}, "result": [[0.03334027394], 0, 22.487775087356567, 1638519043.4183815], "version": 0.2, "tvm_version": "0.8.dev0"}
{"input": ["opencl -keys=adreno,opencl,gpu -device=adreno -max_num_threads=256", "conv2d_nhwc.cuda", [["TENSOR", [1, 416, 416, 3], "float16"], ["TENSOR", [3, 3, 3, 32], "float16"], [1, 1], [1, 1, 1, 1], [1, 1], "float16"], {}], "config": {"index": 604, "code_hash": null, "entity": [["tile_n", "ot", 4], ["tile_c", "ot", 2], ["num_thread_n", "ot", 8], ["num_thread_c", "ot", 8], ["vthread_n", "ot", 2], ["vthread_c", "ot", 2], ["step", "ot", 3]]}, "result": [[0.03281681978], 0, 10.970011949539185, 1638519054.822715], "version": 0.2, "tvm_version": "0.8.dev0"}
{"input": ["opencl -keys=adreno,opencl,gpu -device=adreno -max_num_threads=256", "conv2d_nhwc.cuda", [["TENSOR", [1, 416, 416, 3], "float16"], ["TENSOR", [3, 3, 3, 32], "float16"], [1, 1], [1, 1, 1, 1], [1, 1], "float16"], {}], "config": {"index": 603, "code_hash": null, "entity": [["tile_n", "ot", 2], ["tile_c", "ot", 2], ["num_thread_n", "ot", 8], ["num_thread_c", "ot", 8], ["vthread_n", "ot", 2], ["vthread_c", "ot", 2], ["step", "ot", 3]]}, "result": [[0.03278646352], 0, 23.101921319961548, 1638519066.9662726], "version": 0.2, "tvm_version": "0.8.dev0"}
{"input": ["opencl -keys=adreno,opencl,gpu -device=adreno -max_num_threads=256", "conv2d_nhwc.cuda", [["TENSOR", [1, 416, 416, 3], "float16"], ["TENSOR", [3, 3, 3, 32], "float16"], [1, 1], [1, 1, 1, 1], [1, 1], "float16"], {}], "config": {"index": 929, "code_hash": null, "entity": [["tile_n", "ot", 8], ["tile_c", "ot", 2], ["num_thread_n", "ot", 8], ["num_thread_c", "ot", 8], ["vthread_n", "ot", 2], ["vthread_c", "ot", 2], ["step", "ot", 32]]}, "result": [[0.03337606874], 0, 12.211035251617432, 1638519079.5916314], "version": 0.2, "tvm_version": "0.8.dev0"}
{"input": ["opencl -keys=adreno,opencl,gpu -device=adreno -max_num_threads=256", "conv2d_nhwc.cuda", [["TENSOR", [1, 416, 416, 3], "float16"], ["TENSOR", [3, 3, 3, 32], "float16"], [1, 1], [1, 1, 1, 1], [1, 1], "float16"], {}], "config": {"index": 1253, "code_hash": null, "entity": [["tile_n", "ot", 8], ["tile_c", "ot", 2], ["num_thread_n", "ot", 8], ["num_thread_c", "ot", 8], ["vthread_n", "ot", 2], ["vthread_c", "ot", 2], ["step", "ot", 64]]}, "result": [[0.033369438540000004], 0, 23.470771312713623, 1638519090.8675628], "version": 0.2, "tvm_version": "0.8.dev0"}
{"input": ["opencl -keys=adreno,opencl,gpu -device=adreno -max_num_threads=256", "conv2d_nhwc.cuda", [["TENSOR", [1, 416, 416, 3], "float16"], ["TENSOR", [3, 3, 3, 32], "float16"], [1, 1], [1, 1, 1, 1], [1, 1], "float16"], {}], "config": {"index": 1251, "code_hash": null, "entity": [["tile_n", "ot", 2], ["tile_c", "ot", 2], ["num_thread_n", "ot", 8], ["num_thread_c", "ot", 8], ["vthread_n", "ot", 2], ["vthread_c", "ot", 2], ["step", "ot", 64]]}, "result": [[0.03333503438], 0, 12.265644788742065, 1638519103.5279107], "version": 0.2, "tvm_version": "0.8.dev0"}
{"input": ["opencl -keys=adreno,opencl,gpu -device=adreno -max_num_threads=256", "conv2d_nhwc.cuda", [["TENSOR", [1, 416, 416, 3], "float16"], ["TENSOR", [3, 3, 3, 32], "float16"], [1, 1], [1, 1, 1, 1], [1, 1], "float16"], {}], "config": {"index": 1252, "code_hash": null, "entity": [["tile_n", "ot", 4], ["tile_c", "ot", 2], ["num_thread_n", "ot", 8], ["num_thread_c", "ot", 8], ["vthread_n", "ot", 2], ["vthread_c", "ot", 2], ["step", "ot", 64]]}, "result": [[0.0333281354], 0, 23.60595703125, 1638519114.8828197], "version": 0.2, "tvm_version": "0.8.dev0"}
{"input": ["opencl -keys=adreno,opencl,gpu -device=adreno -max_num_threads=256", "conv2d_nhwc.cuda", [["TENSOR", [1, 416, 416, 3], "float16"], ["TENSOR", [3, 3, 3, 32], "float16"], [1, 1], [1, 1, 1, 1], [1, 1], "float16"], {}], "config": {"index": 927, "code_hash": null, "entity": [["tile_n", "ot", 2], ["tile_c", "ot", 2], ["num_thread_n", "ot", 8], ["num_thread_c", "ot", 8], ["vthread_n", "ot", 2], ["vthread_c", "ot", 2], ["step", "ot", 32]]}, "result": [[0.03336087082], 0, 10.648844718933105, 1638519125.911408], "version": 0.2, "tvm_version": "0.8.dev0"}
{"input": ["opencl -keys=adreno,opencl,gpu -device=adreno -max_num_threads=256", "conv2d_nhwc.cuda", [["TENSOR", [1, 416, 416, 3], "float16"], ["TENSOR", [3, 3, 3, 32], "float16"], [1, 1], [1, 1, 1, 1], [1, 1], "float16"], {}], "config": {"index": 245, "code_hash": null, "entity": [["tile_n", "ot", 8], ["tile_c", "ot", 2], ["num_thread_n", "ot", 4], ["num_thread_c", "ot", 4], ["vthread_n", "ot", 2], ["vthread_c", "ot", 2], ["step", "ot", 16]]}, "result": [[0.05716097705999999], 0, 15.63364863395691, 1638519190.427833], "version": 0.2, "tvm_version": "0.8.dev0"}
{"input": ["opencl -keys=adreno,opencl,gpu -device=adreno -max_num_threads=256", "conv2d_nhwc.cuda", [["TENSOR", [1, 416, 416, 3], "float16"], ["TENSOR", [3, 3, 3, 32], "float16"], [1, 1], [1, 1, 1, 1], [1, 1], "float16"], {}], "config": {"index": 1134, "code_hash": null, "entity": [["tile_n", "ot", 2], ["tile_c", "ot", 2], ["num_thread_n", "ot", 4], ["num_thread_c", "ot", 4], ["vthread_n", "ot", 1], ["vthread_c", "ot", 2], ["step", "ot", 64]]}, "result": [[0.05728018332], 0, 29.445148944854736, 1638519204.2558], "version": 0.2, "tvm_version": "0.8.dev0"}
{"input": ["opencl -keys=adreno,opencl,gpu -device=adreno -max_num_threads=256", "conv2d_nhwc.cuda", [["TENSOR", [1, 416, 416, 3], "float16"], ["TENSOR", [3, 3, 3, 32], "float16"], [1, 1], [1, 1, 1, 1], [1, 1], "float16"], {}], "config": {"index": 184, "code_hash": null, "entity": [["tile_n", "ot", 4], ["tile_c", "ot", 4], ["num_thread_n", "ot", 16], ["num_thread_c", "ot", 4], ["vthread_n", "ot", 1], ["vthread_c", "ot", 2], ["step", "ot", 16]]}, "result": [[0.042063932279999994], 0, 12.27353811264038, 1638519281.324068], "version": 0.2, "tvm_version": "0.8.dev0"}
{"input": ["opencl -keys=adreno,opencl,gpu -device=adreno -max_num_threads=256", "conv2d_nhwc.cuda", [["TENSOR", [1, 416, 416, 3], "float16"], ["TENSOR", [3, 3, 3, 32], "float16"], [1, 1], [1, 1, 1, 1], [1, 1], "float16"], {}], "config": {"index": 569, "code_hash": null, "entity": [["tile_n", "ot", 8], ["tile_c", "ot", 2], ["num_thread_n", "ot", 4], ["num_thread_c", "ot", 4], ["vthread_n", "ot", 2], ["vthread_c", "ot", 2], ["step", "ot", 3]]}, "result": [[0.057796906239999994], 0, 26.980623483657837, 1638519296.027106], "version": 0.2, "tvm_version": "0.8.dev0"}
{"input": ["opencl -keys=adreno,opencl,gpu -device=adreno -max_num_threads=256", "conv2d_nhwc.cuda", [["TENSOR", [1, 416, 416, 3], "float16"], ["TENSOR", [3, 3, 3, 32], "float16"], [1, 1], [1, 1, 1, 1], [1, 1], "float16"], {}], "config": {"index": 891, "code_hash": null, "entity": [["tile_n", "ot", 2], ["tile_c", "ot", 2], ["num_thread_n", "ot", 4], ["num_thread_c", "ot", 4], ["vthread_n", "ot", 2], ["vthread_c", "ot", 2], ["step", "ot", 32]]}, "result": [[0.057133314559999995], 0, 28.95095443725586, 1638519325.5227623], "version": 0.2, "tvm_version": "0.8.dev0"}
{"input": ["opencl -keys=adreno,opencl,gpu -device=adreno -max_num_threads=256", "conv2d_nhwc.cuda", [["TENSOR", [1, 416, 416, 3], "float16"], ["TENSOR", [3, 3, 3, 32], "float16"], [1, 1], [1, 1, 1, 1], [1, 1], "float16"], {}], "config": {"index": 1217, "code_hash": null, "entity": [["tile_n", "ot", 8], ["tile_c", "ot", 2], ["num_thread_n", "ot", 4], ["num_thread_c", "ot", 4], ["vthread_n", "ot", 2], ["vthread_c", "ot", 2], ["step", "ot", 64]]}, "result": [[0.057175267700000004], 0, 13.87895655632019, 1638519339.7361724], "version": 0.2, "tvm_version": "0.8.dev0"}
{"input": ["opencl -keys=adreno,opencl,gpu -device=adreno -max_num_threads=256", "conv2d_nhwc.cuda", [["TENSOR", [1, 416, 416, 3], "float16"], ["TENSOR", [3, 3, 3, 32], "float16"], [1, 1], [1, 1, 1, 1], [1, 1], "float16"], {}], "config": {"index": 580, "code_hash": null, "entity": [["tile_n", "ot", 4], ["tile_c", "ot", 4], ["num_thread_n", "ot", 8], ["num_thread_c", "ot", 4], ["vthread_n", "ot", 2], ["vthread_c", "ot", 2], ["step", "ot", 3]]}, "result": [[0.06605565935999999], 0, 29.095732927322388, 1638519354.9640892], "version": 0.2, "tvm_version": "0.8.dev0"}
{"input": ["opencl -keys=adreno,opencl,gpu -device=adreno -max_num_threads=256", "conv2d_nhwc.cuda", [["TENSOR", [1, 416, 416, 3], "float16"], ["TENSOR", [3, 3, 3, 32], "float16"], [1, 1], [1, 1, 1, 1], [1, 1], "float16"], {}], "config": {"index": 1215, "code_hash": null, "entity": [["tile_n", "ot", 2], ["tile_c", "ot", 2], ["num_thread_n", "ot", 4], ["num_thread_c", "ot", 4], ["vthread_n", "ot", 2], ["vthread_c", "ot", 2], ["step", "ot", 64]]}, "result": [[0.05713554166], 0, 14.835010051727295, 1638519370.1632912], "version": 0.2, "tvm_version": "0.8.dev0"}
{"input": ["opencl -keys=adreno,opencl,gpu -device=adreno -max_num_threads=256", "conv2d_nhwc.cuda", [["TENSOR", [1, 416, 416, 3], "float16"], ["TENSOR", [3, 3, 3, 32], "float16"], [1, 1], [1, 1, 1, 1], [1, 1], "float16"], {}], "config": {"index": 1216, "code_hash": null, "entity": [["tile_n", "ot", 4], ["tile_c", "ot", 2], ["num_thread_n", "ot", 4], ["num_thread_c", "ot", 4], ["vthread_n", "ot", 2], ["vthread_c", "ot", 2], ["step", "ot", 64]]}, "result": [[0.05725494894000001], 0, 28.974381685256958, 1638519384.3174355], "version": 0.2, "tvm_version": "0.8.dev0"}
{"input": ["opencl -keys=adreno,opencl,gpu -device=adreno -max_num_threads=256", "conv2d_nhwc.cuda", [["TENSOR", [1, 416, 416, 3], "float16"], ["TENSOR", [3, 3, 3, 32], "float16"], [1, 1], [1, 1, 1, 1], [1, 1], "float16"], {}], "config": {"index": 163, "code_hash": null, "entity": [["tile_n", "ot", 4], ["tile_c", "ot", 2], ["num_thread_n", "ot", 4], ["num_thread_c", "ot", 4], ["vthread_n", "ot", 1], ["vthread_c", "ot", 2], ["step", "ot", 16]]}, "result": [[0.05739106976], 0, 15.083718538284302, 1638519399.7023616], "version": 0.2, "tvm_version": "0.8.dev0"}
{"input": ["opencl -keys=adreno,opencl,gpu -device=adreno -max_num_threads=256", "conv2d_nhwc.cuda", [["TENSOR", [1, 416, 416, 3], "float16"], ["TENSOR", [3, 3, 3, 32], "float16"], [1, 1], [1, 1, 1, 1], [1, 1], "float16"], {}], "config": {"index": 164, "code_hash": null, "entity": [["tile_n", "ot", 8], ["tile_c", "ot", 2], ["num_thread_n", "ot", 4], ["num_thread_c", "ot", 4], ["vthread_n", "ot", 1], ["vthread_c", "ot", 2], ["step", "ot", 16]]}, "result": [[0.05727738124], 0, 29.03267526626587, 1638519413.6594632], "version": 0.2, "tvm_version": "0.8.dev0"}
{"input": ["opencl -keys=adreno,opencl,gpu -device=adreno -max_num_threads=256", "conv2d_nhwc.cuda", [["TENSOR", [1, 416, 416, 3], "float16"], ["TENSOR", [3, 3, 3, 32], "float16"], [1, 1], [1, 1, 1, 1], [1, 1], "float16"], {}], "config": {"index": 811, "code_hash": null, "entity": [["tile_n", "ot", 4], ["tile_c", "ot", 2], ["num_thread_n", "ot", 4], ["num_thread_c", "ot", 4], ["vthread_n", "ot", 1], ["vthread_c", "ot", 2], ["step", "ot", 32]]}, "result": [[0.05731248956], 0, 13.820643901824951, 1638519427.8574219], "version": 0.2, "tvm_version": "0.8.dev0"}
{"input": ["opencl -keys=adreno,opencl,gpu -device=adreno -max_num_threads=256", "conv2d_nhwc.cuda", [["TENSOR", [1, 416, 416, 3], "float16"], ["TENSOR", [3, 3, 3, 32], "float16"], [1, 1], [1, 1, 1, 1], [1, 1], "float16"], {}], "config": {"index": 810, "code_hash": null, "entity": [["tile_n", "ot", 2], ["tile_c", "ot", 2], ["num_thread_n", "ot", 4], ["num_thread_c", "ot", 4], ["vthread_n", "ot", 1], ["vthread_c", "ot", 2], ["step", "ot", 32]]}, "result": [[0.05726014372], 0, 28.70975112915039, 1638519442.762401], "version": 0.2, "tvm_version": "0.8.dev0"}
{"input": ["opencl -keys=adreno,opencl,gpu -device=adreno -max_num_threads=256", "conv2d_nhwc.cuda", [["TENSOR", [1, 416, 416, 3], "float16"], ["TENSOR", [3, 3, 3, 32], "float16"], [1, 1], [1, 1, 1, 1], [1, 1], "float16"], {}], "config": {"index": 587, "code_hash": null, "entity": [["tile_n", "ot", 8], ["tile_c", "ot", 2], ["num_thread_n", "ot", 16], ["num_thread_c", "ot", 4], ["vthread_n", "ot", 2], ["vthread_c", "ot", 2], ["step", "ot", 3]]}, "result": [[0.056964217680000005], 0, 13.920001029968262, 1638519457.0302238], "version": 0.2, "tvm_version": "0.8.dev0"}
{"input": ["opencl -keys=adreno,opencl,gpu -device=adreno -max_num_threads=256", "conv2d_nhwc.cuda", [["TENSOR", [1, 416, 416, 3], "float16"], ["TENSOR", [3, 3, 3, 32], "float16"], [1, 1], [1, 1, 1, 1], [1, 1], "float16"], {}], "config": {"index": 162, "code_hash": null, "entity": [["tile_n", "ot", 2], ["tile_c", "ot", 2], ["num_thread_n", "ot", 4], ["num_thread_c", "ot", 4], ["vthread_n", "ot", 1], ["vthread_c", "ot", 2], ["step", "ot", 16]]}, "result": [[0.057328921840000005], 0, 28.63602375984192, 1638519471.7715313], "version": 0.2, "tvm_version": "0.8.dev0"}
{"input": ["opencl -keys=adreno,opencl,gpu -device=adreno -max_num_threads=256", "conv2d_nhwc.cuda", [["TENSOR", [1, 416, 416, 3], "float16"], ["TENSOR", [3, 3, 3, 32], "float16"], [1, 1], [1, 1, 1, 1], [1, 1], "float16"], {}], "config": {"index": 508, "code_hash": null, "entity": [["tile_n", "ot", 4], ["tile_c", "ot", 4], ["num_thread_n", "ot", 16], ["num_thread_c", "ot", 4], ["vthread_n", "ot", 1], ["vthread_c", "ot", 2], ["step", "ot", 3]]}, "result": [[0.041791620800000005], 0, 12.794652938842773, 1638519484.9532704], "version": 0.2, "tvm_version": "0.8.dev0"}
