sd888_log/ww16/vgg16.texture.float16.acc32.autotvm_all_textures_fixed_codegen.log
{"input": ["opencl -keys=adreno,opencl,gpu -device=adreno -max_num_threads=256", "conv2d_nchwc_acc32.image2d", [["TENSOR", [1, 3, 224, 224], "float16"], ["TENSOR", [64, 3, 3, 3], "float16"], [1, 1], [1, 1, 1, 1], [1, 1], "float16"], {}], "config": {"index": 81126, "code_hash": null, "entity": [["tile_fc", "sp", [-1, 1, 16]], ["tile_y", "sp", [-1, 2, 1]], ["tile_x", "sp", [-1, 2, 8]], ["tile_rcc", "sp", [-1, 1]], ["tile_ry", "sp", [-1, 1]], ["tile_rx", "sp", [-1, 1]], ["auto_unroll_max_step", "ot", 0], ["unroll_explicit", "ot", 1]]}, "result": [[0.0008240625], 0, 3.34977650642395, 1650470276.4151325], "version": 0.2, "tvm_version": "0.8.dev0"}
{"input": ["opencl -keys=adreno,opencl,gpu -device=adreno -max_num_threads=256", "conv2d_nchw_winograd_acc32.image2d", [["TENSOR", [1, 3, 224, 224], "float16"], ["TENSOR", [64, 3, 3, 3], "float16"], [1, 1], [1, 1, 1, 1], [1, 1], "float16"], {}], "config": {"index": 1139, "code_hash": null, "entity": [["auto_unroll_max_step", "ot", 1500], ["unroll_explicit", "ot", 1], ["tile_y", "sp", [-1, 1, 2]], ["tile_x", "sp", [-1, 1, 32]], ["tile_rc", "sp", [-1, 1]]]}, "result": [[0.00886342084], 0, 6.555196523666382, 1650471152.9576032], "version": 0.2, "tvm_version": "0.8.dev0"}
{"input": ["opencl -keys=adreno,opencl,gpu -device=adreno -max_num_threads=256", "conv2d_nchwc_acc32.image2d", [["TENSOR", [1, 64, 224, 224], "float16"], ["TENSOR", [64, 64, 3, 3], "float16"], [1, 1], [1, 1, 1, 1], [1, 1], "float16"], {}], "config": {"index": 28950, "code_hash": null, "entity": [["tile_fc", "sp", [-1, 1, 16]], ["tile_y", "sp", [-1, 1, 4]], ["tile_x", "sp", [-1, 4, 7]], ["tile_rcc", "sp", [-1, 16]], ["tile_ry", "sp", [-1, 1]], ["tile_rx", "sp", [-1, 1]], ["auto_unroll_max_step", "ot", 0], ["unroll_explicit", "ot", 0]]}, "result": [[0.00943846772], 0, 6.560369968414307, 1650476052.8712015], "version": 0.2, "tvm_version": "0.8.dev0"}
{"input": ["opencl -keys=adreno,opencl,gpu -device=adreno -max_num_threads=256", "conv2d_nchw_winograd_acc32.image2d", [["TENSOR", [1, 64, 224, 224], "float16"], ["TENSOR", [64, 64, 3, 3], "float16"], [1, 1], [1, 1, 1, 1], [1, 1], "float16"], {}], "config": {"index": 1442, "code_hash": null, "entity": [["auto_unroll_max_step", "ot", 1500], ["unroll_explicit", "ot", 0], ["tile_y", "sp", [-1, 1, 16]], ["tile_x", "sp", [-1, 4, 4]], ["tile_rc", "sp", [-1, 2]]]}, "result": [[0.0252660927], 0, 12.298617839813232, 1650477876.911587], "version": 0.2, "tvm_version": "0.8.dev0"}
{"input": ["opencl -keys=adreno,opencl,gpu -device=adreno -max_num_threads=256", "conv2d_nchwc_acc32.image2d", [["TENSOR", [1, 64, 112, 112], "float16"], ["TENSOR", [128, 64, 3, 3], "float16"], [1, 1], [1, 1, 1, 1], [1, 1], "float16"], {}], "config": {"index": 177123, "code_hash": null, "entity": [["tile_fc", "sp", [-1, 1, 32]], ["tile_y", "sp", [-1, 2, 1]], ["tile_x", "sp", [-1, 2, 8]], ["tile_rcc", "sp", [-1, 16]], ["tile_ry", "sp", [-1, 1]], ["tile_rx", "sp", [-1, 1]], ["auto_unroll_max_step", "ot", 512], ["unroll_explicit", "ot", 0]]}, "result": [[0.00460053958], 0, 3.193021535873413, 1650481093.4972324], "version": 0.2, "tvm_version": "0.8.dev0"}
{"input": ["opencl -keys=adreno,opencl,gpu -device=adreno -max_num_threads=256", "conv2d_nchw_winograd_acc32.image2d", [["TENSOR", [1, 64, 112, 112], "float16"], ["TENSOR", [128, 64, 3, 3], "float16"], [1, 1], [1, 1, 1, 1], [1, 1], "float16"], {}], "config": {"index": 1638, "code_hash": null, "entity": [["auto_unroll_max_step", "ot", 0], ["unroll_explicit", "ot", 0], ["tile_y", "sp", [-1, 1, 16]], ["tile_x", "sp", [-1, 4, 4]], ["tile_rc", "sp", [-1, 2]]]}, "result": [[0.00862525104], 0, 5.636025905609131, 1650483423.8360863], "version": 0.2, "tvm_version": "0.8.dev0"}
{"input": ["opencl -keys=adreno,opencl,gpu -device=adreno -max_num_threads=256", "conv2d_nchwc_acc32.image2d", [["TENSOR", [1, 128, 112, 112], "float16"], ["TENSOR", [128, 128, 3, 3], "float16"], [1, 1], [1, 1, 1, 1], [1, 1], "float16"], {}], "config": {"index": 548402, "code_hash": null, "entity": [["tile_fc", "sp", [-1, 1, 16]], ["tile_y", "sp", [-1, 1, 2]], ["tile_x", "sp", [-1, 4, 4]], ["tile_rcc", "sp", [-1, 16]], ["tile_ry", "sp", [-1, 1]], ["tile_rx", "sp", [-1, 1]], ["auto_unroll_max_step", "ot", 0], ["unroll_explicit", "ot", 1]]}, "result": [[0.0091699854], 0, 4.539424180984497, 1650487399.3371632], "version": 0.2, "tvm_version": "0.8.dev0"}
{"input": ["opencl -keys=adreno,opencl,gpu -device=adreno -max_num_threads=256", "conv2d_nchw_winograd_acc32.image2d", [["TENSOR", [1, 128, 112, 112], "float16"], ["TENSOR", [128, 128, 3, 3], "float16"], [1, 1], [1, 1, 1, 1], [1, 1], "float16"], {}], "config": {"index": 1652, "code_hash": null, "entity": [["auto_unroll_max_step", "ot", 1500], ["unroll_explicit", "ot", 0], ["tile_y", "sp", [-1, 1, 32]], ["tile_x", "sp", [-1, 4, 4]], ["tile_rc", "sp", [-1, 2]]]}, "result": [[0.014135230200000001], 0, 7.104259729385376, 1650488460.8475106], "version": 0.2, "tvm_version": "0.8.dev0"}
{"input": ["opencl -keys=adreno,opencl,gpu -device=adreno -max_num_threads=256", "conv2d_nchwc_acc32.image2d", [["TENSOR", [1, 128, 56, 56], "float16"], ["TENSOR", [256, 128, 3, 3], "float16"], [1, 1], [1, 1, 1, 1], [1, 1], "float16"], {}], "config": {"index": 456335, "code_hash": null, "entity": [["tile_fc", "sp", [-1, 2, 8]], ["tile_y", "sp", [-1, 1, 1]], ["tile_x", "sp", [-1, 7, 8]], ["tile_rcc", "sp", [-1, 1]], ["tile_ry", "sp", [-1, 1]], ["tile_rx", "sp", [-1, 3]], ["auto_unroll_max_step", "ot", 0], ["unroll_explicit", "ot", 1]]}, "result": [[0.00428127708], 0, 2.538670301437378, 1650492192.3437123], "version": 0.2, "tvm_version": "0.8.dev0"}
{"input": ["opencl -keys=adreno,opencl,gpu -device=adreno -max_num_threads=256", "conv2d_nchw_winograd_acc32.image2d", [["TENSOR", [1, 128, 56, 56], "float16"], ["TENSOR", [256, 128, 3, 3], "float16"], [1, 1], [1, 1, 1, 1], [1, 1], "float16"], {}], "config": {"index": 2023, "code_hash": null, "entity": [["auto_unroll_max_step", "ot", 128], ["unroll_explicit", "ot", 0], ["tile_y", "sp", [-1, 2, 16]], ["tile_x", "sp", [-1, 7, 4]], ["tile_rc", "sp", [-1, 4]]]}, "result": [[0.00547121874], 0, 4.484960317611694, 1650493505.8388526], "version": 0.2, "tvm_version": "0.8.dev0"}
{"input": ["opencl -keys=adreno,opencl,gpu -device=adreno -max_num_threads=256", "conv2d_nchwc_acc32.image2d", [["TENSOR", [1, 256, 56, 56], "float16"], ["TENSOR", [256, 256, 3, 3], "float16"], [1, 1], [1, 1, 1, 1], [1, 1], "float16"], {}], "config": {"index": 493196, "code_hash": null, "entity": [["tile_fc", "sp", [-1, 1, 32]], ["tile_y", "sp", [-1, 1, 2]], ["tile_x", "sp", [-1, 4, 7]], ["tile_rcc", "sp", [-1, 1]], ["tile_ry", "sp", [-1, 3]], ["tile_rx", "sp", [-1, 1]], ["auto_unroll_max_step", "ot", 0], ["unroll_explicit", "ot", 1]]}, "result": [[0.00952163438], 0, 3.610767126083374, 1650496862.2862065], "version": 0.2, "tvm_version": "0.8.dev0"}
{"input": ["opencl -keys=adreno,opencl,gpu -device=adreno -max_num_threads=256", "conv2d_nchw_winograd_acc32.image2d", [["TENSOR", [1, 256, 56, 56], "float16"], ["TENSOR", [256, 256, 3, 3], "float16"], [1, 1], [1, 1, 1, 1], [1, 1], "float16"], {}], "config": {"index": 4722, "code_hash": null, "entity": [["auto_unroll_max_step", "ot", 0], ["unroll_explicit", "ot", 0], ["tile_y", "sp", [-1, 2, 16]], ["tile_x", "sp", [-1, 7, 4]], ["tile_rc", "sp", [-1, 32]]]}, "result": [[0.00920740938], 0, 5.501730442047119, 1650498807.4644835], "version": 0.2, "tvm_version": "0.8.dev0"}
{"input": ["opencl -keys=adreno,opencl,gpu -device=adreno -max_num_threads=256", "conv2d_nchwc_acc32.image2d", [["TENSOR", [1, 256, 28, 28], "float16"], ["TENSOR", [512, 256, 3, 3], "float16"], [1, 1], [1, 1, 1, 1], [1, 1], "float16"], {}], "config": {"index": 19866, "code_hash": null, "entity": [["tile_fc", "sp", [-1, 1, 32]], ["tile_y", "sp", [-1, 1, 4]], ["tile_x", "sp", [-1, 4, 1]], ["tile_rcc", "sp", [-1, 1]], ["tile_ry", "sp", [-1, 3]], ["tile_rx", "sp", [-1, 1]], ["auto_unroll_max_step", "ot", 0], ["unroll_explicit", "ot", 0]]}, "result": [[0.00499557812], 0, 3.1746933460235596, 1650500980.464642], "version": 0.2, "tvm_version": "0.8.dev0"}
{"input": ["opencl -keys=adreno,opencl,gpu -device=adreno -max_num_threads=256", "conv2d_nchw_winograd_acc32.image2d", [["TENSOR", [1, 256, 28, 28], "float16"], ["TENSOR", [512, 256, 3, 3], "float16"], [1, 1], [1, 1, 1, 1], [1, 1], "float16"], {}], "config": {"index": 1604, "code_hash": null, "entity": [["auto_unroll_max_step", "ot", 1500], ["unroll_explicit", "ot", 0], ["tile_y", "sp", [-1, 1, 32]], ["tile_x", "sp", [-1, 4, 7]], ["tile_rc", "sp", [-1, 2]]]}, "result": [[0.0041254698], 0, 3.0065767765045166, 1650502527.8541543], "version": 0.2, "tvm_version": "0.8.dev0"}
{"input": ["opencl -keys=adreno,opencl,gpu -device=adreno -max_num_threads=256", "conv2d_nchwc_acc32.image2d", [["TENSOR", [1, 512, 28, 28], "float16"], ["TENSOR", [512, 512, 3, 3], "float16"], [1, 1], [1, 1, 1, 1], [1, 1], "float16"], {}], "config": {"index": 354659, "code_hash": null, "entity": [["tile_fc", "sp", [-1, 2, 32]], ["tile_y", "sp", [-1, 1, 2]], ["tile_x", "sp", [-1, 7, 2]], ["tile_rcc", "sp", [-1, 128]], ["tile_ry", "sp", [-1, 3]], ["tile_rx", "sp", [-1, 3]], ["auto_unroll_max_step", "ot", 0], ["unroll_explicit", "ot", 1]]}, "result": [[0.009562972920000001], 0, 4.549807071685791, 1650502899.9135003], "version": 0.2, "tvm_version": "0.8.dev0"}
{"input": ["opencl -keys=adreno,opencl,gpu -device=adreno -max_num_threads=256", "conv2d_nchw_winograd_acc32.image2d", [["TENSOR", [1, 512, 28, 28], "float16"], ["TENSOR", [512, 512, 3, 3], "float16"], [1, 1], [1, 1, 1, 1], [1, 1], "float16"], {}], "config": {"index": 6312, "code_hash": null, "entity": [["auto_unroll_max_step", "ot", 0], ["unroll_explicit", "ot", 0], ["tile_y", "sp", [-1, 2, 32]], ["tile_x", "sp", [-1, 7, 14]], ["tile_rc", "sp", [-1, 32]]]}, "result": [[0.00791984688], 0, 4.764617443084717, 1650508022.4753041], "version": 0.2, "tvm_version": "0.8.dev0"}
{"input": ["opencl -keys=adreno,opencl,gpu -device=adreno -max_num_threads=256", "conv2d_nchwc_acc32.image2d", [["TENSOR", [1, 512, 14, 14], "float16"], ["TENSOR", [512, 512, 3, 3], "float16"], [1, 1], [1, 1, 1, 1], [1, 1], "float16"], {}], "config": {"index": 22358, "code_hash": null, "entity": [["tile_fc", "sp", [-1, 1, 8]], ["tile_y", "sp", [-1, 2, 8]], ["tile_x", "sp", [-1, 2, 1]], ["tile_rcc", "sp", [-1, 1]], ["tile_ry", "sp", [-1, 3]], ["tile_rx", "sp", [-1, 1]], ["auto_unroll_max_step", "ot", 0], ["unroll_explicit", "ot", 0]]}, "result": [[0.00327076458], 0, 3.332827568054199, 1650510482.1758184], "version": 0.2, "tvm_version": "0.8.dev0"}
{"input": ["opencl -keys=adreno,opencl,gpu -device=adreno -max_num_threads=256", "conv2d_nchw_winograd_acc32.image2d", [["TENSOR", [1, 512, 14, 14], "float16"], ["TENSOR", [512, 512, 3, 3], "float16"], [1, 1], [1, 1, 1, 1], [1, 1], "float16"], {}], "config": {"index": 973, "code_hash": null, "entity": [["auto_unroll_max_step", "ot", 128], ["unroll_explicit", "ot", 0], ["tile_y", "sp", [-1, 2, 16]], ["tile_x", "sp", [-1, 7, 7]], ["tile_rc", "sp", [-1, 32]]]}, "result": [[0.00303035522], 0, 4.268002033233643, 1650511808.9460983], "version": 0.2, "tvm_version": "0.8.dev0"}
{"input": ["opencl -keys=adreno,opencl,gpu -device=adreno -max_num_threads=256", "dense_small_batch.cuda", [["TENSOR", [1, 4096], "float16"], ["TENSOR", [4096, 4096], "float16"], null, "float16"], {}], "config": {"index": 7, "code_hash": null, "entity": [["tile_k", "sp", [-1, 128]]]}, "result": [[0.00150822812], 0, 12.88439655303955, 1650512804.0979602], "version": 0.2, "tvm_version": "0.8.dev0"}
{"input": ["opencl -keys=adreno,opencl,gpu -device=adreno -max_num_threads=256", "dense_small_batch.cuda", [["TENSOR", [1, 4096], "float16"], ["TENSOR", [1000, 4096], "float16"], null, "float16"], {}], "config": {"index": 7, "code_hash": null, "entity": [["tile_k", "sp", [-1, 128]]]}, "result": [[0.0004047771], 0, 3.7859857082366943, 1650512878.6132915], "version": 0.2, "tvm_version": "0.8.dev0"}
