logs/vit_base_patch16_224.texture.float32.autotvm.log.tmp
{"input": ["opencl -keys=adreno,opencl,gpu -device=adreno -max_num_threads=256 -texture_spatial_limit=16384 -thread_warp_size=1", "dense_small_batch.gpu", [["TENSOR", [1, 768], "float32"], ["TENSOR", [1000, 768], "float32"], null, "float32"], {}], "config": {"index": 12, "code_hash": null, "entity": [["tile_k", "sp", [-1, 96]]]}, "result": [[9.150463999999999e-05], 0, 1.1192948818206787, 1670238795.6865106], "version": 0.2, "tvm_version": "0.11.dev0"}
{"input": ["opencl -keys=adreno,opencl,gpu -device=adreno -max_num_threads=256 -texture_spatial_limit=16384 -thread_warp_size=1", "dense_small_batch.gpu", [["TENSOR", [1, 768], "float32"], ["TENSOR", [1000, 768], "float32"], null, "float32"], {}], "config": {"index": 0, "code_hash": null, "entity": [["tile_k", "sp", [-1, 1]]]}, "result": [[0.0025925222400000002], 0, 1.3932290077209473, 1670238796.002299], "version": 0.2, "tvm_version": "0.11.dev0"}
{"input": ["opencl -keys=adreno,opencl,gpu -device=adreno -max_num_threads=256 -texture_spatial_limit=16384 -thread_warp_size=1", "dense_small_batch.gpu", [["TENSOR", [1, 768], "float32"], ["TENSOR", [1000, 768], "float32"], null, "float32"], {}], "config": {"index": 9, "code_hash": null, "entity": [["tile_k", "sp", [-1, 32]]]}, "result": [[9.558528e-05], 0, 1.5480573177337646, 1670238796.175414], "version": 0.2, "tvm_version": "0.11.dev0"}
{"input": ["opencl -keys=adreno,opencl,gpu -device=adreno -max_num_threads=256 -texture_spatial_limit=16384 -thread_warp_size=1", "dense_small_batch.gpu", [["TENSOR", [1, 768], "float32"], ["TENSOR", [1000, 768], "float32"], null, "float32"], {}], "config": {"index": 5, "code_hash": null, "entity": [["tile_k", "sp", [-1, 8]]]}, "result": [[0.0003624448], 0, 2.058926582336426, 1670238796.7134042], "version": 0.2, "tvm_version": "0.11.dev0"}
{"input": ["opencl -keys=adreno,opencl,gpu -device=adreno -max_num_threads=256 -texture_spatial_limit=16384 -thread_warp_size=1", "dense_small_batch.gpu", [["TENSOR", [1, 768], "float32"], ["TENSOR", [1000, 768], "float32"], null, "float32"], {}], "config": {"index": 3, "code_hash": null, "entity": [["tile_k", "sp", [-1, 4]]]}, "result": [[0.0006766592000000001], 0, 2.1942217350006104, 1670238796.8697696], "version": 0.2, "tvm_version": "0.11.dev0"}
{"input": ["opencl -keys=adreno,opencl,gpu -device=adreno -max_num_threads=256 -texture_spatial_limit=16384 -thread_warp_size=1", "dense_small_batch.gpu", [["TENSOR", [1, 768], "float32"], ["TENSOR", [1000, 768], "float32"], null, "float32"], {}], "config": {"index": 17, "code_hash": null, "entity": [["tile_k", "sp", [-1, 768]]]}, "result": [[0.0002773248], 0, 2.880197525024414, 1670238797.5849693], "version": 0.2, "tvm_version": "0.11.dev0"}
{"input": ["opencl -keys=adreno,opencl,gpu -device=adreno -max_num_threads=256 -texture_spatial_limit=16384 -thread_warp_size=1", "dense_small_batch.gpu", [["TENSOR", [1, 768], "float32"], ["TENSOR", [1000, 768], "float32"], null, "float32"], {}], "config": {"index": 6, "code_hash": null, "entity": [["tile_k", "sp", [-1, 12]]]}, "result": [[0.00026155519999999997], 0, 3.162128448486328, 1670238798.085089], "version": 0.2, "tvm_version": "0.11.dev0"}
{"input": ["opencl -keys=adreno,opencl,gpu -device=adreno -max_num_threads=256 -texture_spatial_limit=16384 -thread_warp_size=1", "dense_small_batch.gpu", [["TENSOR", [1, 768], "float32"], ["TENSOR", [1000, 768], "float32"], null, "float32"], {}], "config": {"index": 8, "code_hash": null, "entity": [["tile_k", "sp", [-1, 24]]]}, "result": [[0.00015000064], 0, 2.6081411838531494, 1670238797.3674915], "version": 0.2, "tvm_version": "0.11.dev0"}
{"input": ["opencl -keys=adreno,opencl,gpu -device=adreno -max_num_threads=256 -texture_spatial_limit=16384 -thread_warp_size=1", "dense_small_batch.gpu", [["TENSOR", [1, 768], "float32"], ["TENSOR", [1000, 768], "float32"], null, "float32"], {}], "config": {"index": 14, "code_hash": null, "entity": [["tile_k", "sp", [-1, 192]]]}, "result": [[0.00011847680000000001], 0, 0.8430368900299072, 1670238799.119597], "version": 0.2, "tvm_version": "0.11.dev0"}
{"input": ["opencl -keys=adreno,opencl,gpu -device=adreno -max_num_threads=256 -texture_spatial_limit=16384 -thread_warp_size=1", "dense_small_batch.gpu", [["TENSOR", [1, 768], "float32"], ["TENSOR", [1000, 768], "float32"], null, "float32"], {}], "config": {"index": 7, "code_hash": null, "entity": [["tile_k", "sp", [-1, 16]]]}, "result": [[0.00020650496], 0, 2.0237650871276855, 1670238800.3033197], "version": 0.2, "tvm_version": "0.11.dev0"}
{"input": ["opencl -keys=adreno,opencl,gpu -device=adreno -max_num_threads=256 -texture_spatial_limit=16384 -thread_warp_size=1", "dense_small_batch.gpu", [["TENSOR", [1, 768], "float32"], ["TENSOR", [1000, 768], "float32"], null, "float32"], {}], "config": {"index": 4, "code_hash": null, "entity": [["tile_k", "sp", [-1, 6]]]}, "result": [[0.00047204863999999997], 0, 3.679844856262207, 1670238801.9577312], "version": 0.2, "tvm_version": "0.11.dev0"}
{"input": ["opencl -keys=adreno,opencl,gpu -device=adreno -max_num_threads=256 -texture_spatial_limit=16384 -thread_warp_size=1", "dense_small_batch.gpu", [["TENSOR", [1, 768], "float32"], ["TENSOR", [1000, 768], "float32"], null, "float32"], {}], "config": {"index": 2, "code_hash": null, "entity": [["tile_k", "sp", [-1, 3]]]}, "result": [[0.0008810751999999999], 0, 0.7831876277923584, 1670238799.0686915], "version": 0.2, "tvm_version": "0.11.dev0"}
{"input": ["opencl -keys=adreno,opencl,gpu -device=adreno -max_num_threads=256 -texture_spatial_limit=16384 -thread_warp_size=1", "dense_small_batch.gpu", [["TENSOR", [1, 768], "float32"], ["TENSOR", [1000, 768], "float32"], null, "float32"], {}], "config": {"index": 1, "code_hash": null, "entity": [["tile_k", "sp", [-1, 2]]]}, "result": [[0.00126925312], 0, 2.820850372314453, 1670238801.0984015], "version": 0.2, "tvm_version": "0.11.dev0"}
{"input": ["opencl -keys=adreno,opencl,gpu -device=adreno -max_num_threads=256 -texture_spatial_limit=16384 -thread_warp_size=1", "dense_small_batch.gpu", [["TENSOR", [1, 768], "float32"], ["TENSOR", [1000, 768], "float32"], null, "float32"], {}], "config": {"index": 11, "code_hash": null, "entity": [["tile_k", "sp", [-1, 64]]]}, "result": [[8.137216e-05], 0, 2.21492862701416, 1670238800.4854903], "version": 0.2, "tvm_version": "0.11.dev0"}
{"input": ["opencl -keys=adreno,opencl,gpu -device=adreno -max_num_threads=256 -texture_spatial_limit=16384 -thread_warp_size=1", "dense_small_batch.gpu", [["TENSOR", [1, 768], "float32"], ["TENSOR", [1000, 768], "float32"], null, "float32"], {}], "config": {"index": 15, "code_hash": null, "entity": [["tile_k", "sp", [-1, 256]]]}, "result": [[0.00011539967999999999], 0, 1.5286262035369873, 1670238799.8090947], "version": 0.2, "tvm_version": "0.11.dev0"}
{"input": ["opencl -keys=adreno,opencl,gpu -device=adreno -max_num_threads=256 -texture_spatial_limit=16384 -thread_warp_size=1", "dense_small_batch.gpu", [["TENSOR", [1, 768], "float32"], ["TENSOR", [1000, 768], "float32"], null, "float32"], {}], "config": {"index": 10, "code_hash": null, "entity": [["tile_k", "sp", [-1, 48]]]}, "result": [[8.375807999999999e-05], 0, 1.4385404586791992, 1670238799.7227335], "version": 0.2, "tvm_version": "0.11.dev0"}
{"input": ["opencl -keys=adreno,opencl,gpu -device=adreno -max_num_threads=256 -texture_spatial_limit=16384 -thread_warp_size=1", "dense_small_batch.gpu", [["TENSOR", [1, 768], "float32"], ["TENSOR", [1000, 768], "float32"], null, "float32"], {}], "config": {"index": 13, "code_hash": null, "entity": [["tile_k", "sp", [-1, 128]]]}, "result": [[9.506816000000002e-05], 0, 0.3681769371032715, 1670238802.6347513], "version": 0.2, "tvm_version": "0.11.dev0"}
{"input": ["opencl -keys=adreno,opencl,gpu -device=adreno -max_num_threads=256 -texture_spatial_limit=16384 -thread_warp_size=1", "dense_small_batch.gpu", [["TENSOR", [1, 768], "float32"], ["TENSOR", [1000, 768], "float32"], null, "float32"], {}], "config": {"index": 16, "code_hash": null, "entity": [["tile_k", "sp", [-1, 384]]]}, "result": [[0.00014030848], 0, 0.8228564262390137, 1670238803.0894203], "version": 0.2, "tvm_version": "0.11.dev0"}
{"input": ["opencl -keys=adreno,opencl,gpu -device=adreno -max_num_threads=256 -texture_spatial_limit=16384 -thread_warp_size=1", "dense_small_batch.gpu", [["TENSOR", [197, 3072], "float32"], ["TENSOR", [768, 3072], "float32"], null, "float32"], {}], "config": {"index": 10, "code_hash": null, "entity": [["tile_k", "sp", [-1, 48]]]}, "result": [[0.054304378880000004], 0, 44.118786334991455, 1670239201.5540779], "version": 0.2, "tvm_version": "0.11.dev0"}
{"input": ["opencl -keys=adreno,opencl,gpu -device=adreno -max_num_threads=256 -texture_spatial_limit=16384 -thread_warp_size=1", "dense_small_batch.gpu", [["TENSOR", [197, 3072], "float32"], ["TENSOR", [768, 3072], "float32"], null, "float32"], {}], "config": {"index": 15, "code_hash": null, "entity": [["tile_k", "sp", [-1, 256]]]}, "result": [[0.05229182464000001], 0, 39.98371958732605, 1670239197.4305906], "version": 0.2, "tvm_version": "0.11.dev0"}
{"input": ["opencl -keys=adreno,opencl,gpu -device=adreno -max_num_threads=256 -texture_spatial_limit=16384 -thread_warp_size=1", "dense_small_batch.gpu", [["TENSOR", [197, 3072], "float32"], ["TENSOR", [768, 3072], "float32"], null, "float32"], {}], "config": {"index": 8, "code_hash": null, "entity": [["tile_k", "sp", [-1, 24]]]}, "result": [[0.08677502976], 0, 35.13667178153992, 1670239192.5698376], "version": 0.2, "tvm_version": "0.11.dev0"}
{"input": ["opencl -keys=adreno,opencl,gpu -device=adreno -max_num_threads=256 -texture_spatial_limit=16384 -thread_warp_size=1", "dense_small_batch.gpu", [["TENSOR", [197, 3072], "float32"], ["TENSOR", [768, 3072], "float32"], null, "float32"], {}], "config": {"index": 11, "code_hash": null, "entity": [["tile_k", "sp", [-1, 64]]]}, "result": [[0.04876590591999999], 0, 31.45572543144226, 1670239188.8532817], "version": 0.2, "tvm_version": "0.11.dev0"}
{"input": ["opencl -keys=adreno,opencl,gpu -device=adreno -max_num_threads=256 -texture_spatial_limit=16384 -thread_warp_size=1", "dense_small_batch.gpu", [["TENSOR", [197, 3072], "float32"], ["TENSOR", [768, 3072], "float32"], null, "float32"], {}], "config": {"index": 12, "code_hash": null, "entity": [["tile_k", "sp", [-1, 96]]]}, "result": [[0.04846503936], 0, 7.842888832092285, 1670239227.5628552], "version": 0.2, "tvm_version": "0.11.dev0"}
{"input": ["opencl -keys=adreno,opencl,gpu -device=adreno -max_num_threads=256 -texture_spatial_limit=16384 -thread_warp_size=1", "dense_small_batch.gpu", [["TENSOR", [197, 3072], "float32"], ["TENSOR", [768, 3072], "float32"], null, "float32"], {}], "config": {"index": 9, "code_hash": null, "entity": [["tile_k", "sp", [-1, 32]]]}, "result": [[0.064660864], 0, 18.455803871154785, 1670239238.1798372], "version": 0.2, "tvm_version": "0.11.dev0"}
{"input": ["opencl -keys=adreno,opencl,gpu -device=adreno -max_num_threads=256 -texture_spatial_limit=16384 -thread_warp_size=1", "dense_small_batch.gpu", [["TENSOR", [197, 3072], "float32"], ["TENSOR", [768, 3072], "float32"], null, "float32"], {}], "config": {"index": 13, "code_hash": null, "entity": [["tile_k", "sp", [-1, 128]]]}, "result": [[0.048313093120000004], 0, 7.922500848770142, 1670239308.553255], "version": 0.2, "tvm_version": "0.11.dev0"}
{"input": ["opencl -keys=adreno,opencl,gpu -device=adreno -max_num_threads=256 -texture_spatial_limit=16384 -thread_warp_size=1", "dense_small_batch.gpu", [["TENSOR", [197, 3072], "float32"], ["TENSOR", [768, 3072], "float32"], null, "float32"], {}], "config": {"index": 14, "code_hash": null, "entity": [["tile_k", "sp", [-1, 192]]]}, "result": [[0.05288331264], 0, 30.78788995742798, 1670239331.4419441], "version": 0.2, "tvm_version": "0.11.dev0"}
{"input": ["opencl -keys=adreno,opencl,gpu -device=adreno -max_num_threads=256 -texture_spatial_limit=16384 -thread_warp_size=1", "dense_small_batch.gpu", [["TENSOR", [197, 3072], "float32"], ["TENSOR", [768, 3072], "float32"], null, "float32"], {}], "config": {"index": 17, "code_hash": null, "entity": [["tile_k", "sp", [-1, 512]]]}, "result": [[0.09238254080000001], 0, 14.576778173446655, 1670239315.207005], "version": 0.2, "tvm_version": "0.11.dev0"}
{"input": ["opencl -keys=adreno,opencl,gpu -device=adreno -max_num_threads=256 -texture_spatial_limit=16384 -thread_warp_size=1", "dense_small_batch.gpu", [["TENSOR", [197, 3072], "float32"], ["TENSOR", [768, 3072], "float32"], null, "float32"], {}], "config": {"index": 16, "code_hash": null, "entity": [["tile_k", "sp", [-1, 384]]]}, "result": [[0.08887942144], 0, 22.119199991226196, 1670239322.7456617], "version": 0.2, "tvm_version": "0.11.dev0"}
{"input": ["opencl -keys=adreno,opencl,gpu -device=adreno -max_num_threads=256 -texture_spatial_limit=16384 -thread_warp_size=1", "dense_small_batch.gpu", [["TENSOR", [197, 768], "float32"], ["TENSOR", [3072, 768], "float32"], null, "float32"], {}], "config": {"index": 15, "code_hash": null, "entity": [["tile_k", "sp", [-1, 256]]]}, "result": [[0.06746250751999999], 0, 10.96969723701477, 1670239518.2037463], "version": 0.2, "tvm_version": "0.11.dev0"}
{"input": ["opencl -keys=adreno,opencl,gpu -device=adreno -max_num_threads=256 -texture_spatial_limit=16384 -thread_warp_size=1", "dense_small_batch.gpu", [["TENSOR", [197, 768], "float32"], ["TENSOR", [3072, 768], "float32"], null, "float32"], {}], "config": {"index": 14, "code_hash": null, "entity": [["tile_k", "sp", [-1, 192]]]}, "result": [[0.06987802624], 0, 30.438339948654175, 1670239537.6835034], "version": 0.2, "tvm_version": "0.11.dev0"}
{"input": ["opencl -keys=adreno,opencl,gpu -device=adreno -max_num_threads=256 -texture_spatial_limit=16384 -thread_warp_size=1", "dense_small_batch.gpu", [["TENSOR", [197, 768], "float32"], ["TENSOR", [3072, 768], "float32"], null, "float32"], {}], "config": {"index": 8, "code_hash": null, "entity": [["tile_k", "sp", [-1, 24]]]}, "result": [[0.08508851199999999], 0, 65.18341064453125, 1670239572.4278617], "version": 0.2, "tvm_version": "0.11.dev0"}
{"input": ["opencl -keys=adreno,opencl,gpu -device=adreno -max_num_threads=256 -texture_spatial_limit=16384 -thread_warp_size=1", "dense_small_batch.gpu", [["TENSOR", [197, 768], "float32"], ["TENSOR", [3072, 768], "float32"], null, "float32"], {}], "config": {"index": 13, "code_hash": null, "entity": [["tile_k", "sp", [-1, 128]]]}, "result": [[0.05528511488000001], 0, 51.64573383331299, 1670239558.903448], "version": 0.2, "tvm_version": "0.11.dev0"}
{"input": ["opencl -keys=adreno,opencl,gpu -device=adreno -max_num_threads=256 -texture_spatial_limit=16384 -thread_warp_size=1", "dense_small_batch.gpu", [["TENSOR", [197, 768], "float32"], ["TENSOR", [3072, 768], "float32"], null, "float32"], {}], "config": {"index": 11, "code_hash": null, "entity": [["tile_k", "sp", [-1, 64]]]}, "result": [[0.04709826560000001], 0, 18.84548544883728, 1670239526.1079798], "version": 0.2, "tvm_version": "0.11.dev0"}
{"input": ["opencl -keys=adreno,opencl,gpu -device=adreno -max_num_threads=256 -texture_spatial_limit=16384 -thread_warp_size=1", "dense_small_batch.gpu", [["TENSOR", [197, 768], "float32"], ["TENSOR", [3072, 768], "float32"], null, "float32"], {}], "config": {"index": 9, "code_hash": null, "entity": [["tile_k", "sp", [-1, 32]]]}, "result": [[0.06623572992], 0, 62.81222891807556, 1670239635.6199124], "version": 0.2, "tvm_version": "0.11.dev0"}
{"input": ["opencl -keys=adreno,opencl,gpu -device=adreno -max_num_threads=256 -texture_spatial_limit=16384 -thread_warp_size=1", "dense_small_batch.gpu", [["TENSOR", [197, 768], "float32"], ["TENSOR", [3072, 768], "float32"], null, "float32"], {}], "config": {"index": 12, "code_hash": null, "entity": [["tile_k", "sp", [-1, 96]]]}, "result": [[0.05322258944], 0, 35.79142141342163, 1670239608.585146], "version": 0.2, "tvm_version": "0.11.dev0"}
{"input": ["opencl -keys=adreno,opencl,gpu -device=adreno -max_num_threads=256 -texture_spatial_limit=16384 -thread_warp_size=1", "dense_small_batch.gpu", [["TENSOR", [197, 768], "float32"], ["TENSOR", [3072, 768], "float32"], null, "float32"], {}], "config": {"index": 10, "code_hash": null, "entity": [["tile_k", "sp", [-1, 48]]]}, "result": [[0.04744262656], 0, 70.78654360771179, 1670239643.6012995], "version": 0.2, "tvm_version": "0.11.dev0"}
{"input": ["opencl -keys=adreno,opencl,gpu -device=adreno -max_num_threads=256 -texture_spatial_limit=16384 -thread_warp_size=1", "dense_small_batch.gpu", [["TENSOR", [197, 768], "float32"], ["TENSOR", [3072, 768], "float32"], null, "float32"], {}], "config": {"index": 16, "code_hash": null, "entity": [["tile_k", "sp", [-1, 384]]]}, "result": [[0.08300171776], 0, 52.00758695602417, 1670239624.807194], "version": 0.2, "tvm_version": "0.11.dev0"}
{"input": ["opencl -keys=adreno,opencl,gpu -device=adreno -max_num_threads=256 -texture_spatial_limit=16384 -thread_warp_size=1", "batch_matmul.cuda", [["TENSOR", [12, 197, 197], "float32"], ["TENSOR", [12, 64, 197], "float32"], [12, 197, 64], "float32", 0, 1], {}], "config": {"index": 65, "code_hash": null, "entity": [["tile_y", "sp", [-1, 1, 197]], ["tile_x", "sp", [-1, 8, 8]], ["tile_k", "sp", [-1, 1]], ["auto_unroll_max_step", "ot", 8], ["unroll_explicit", "ot", 0]]}, "result": [[0.03513004544], 0, 6.093886613845825, 1670239686.5251687], "version": 0.2, "tvm_version": "0.11.dev0"}
{"input": ["opencl -keys=adreno,opencl,gpu -device=adreno -max_num_threads=256 -texture_spatial_limit=16384 -thread_warp_size=1", "batch_matmul.cuda", [["TENSOR", [12, 197, 197], "float32"], ["TENSOR", [12, 64, 197], "float32"], [12, 197, 64], "float32", 0, 1], {}], "config": {"index": 1043, "code_hash": null, "entity": [["tile_y", "sp", [-1, 1, 197]], ["tile_x", "sp", [-1, 16, 2]], ["tile_k", "sp", [-1, 1]], ["auto_unroll_max_step", "ot", 32], ["unroll_explicit", "ot", 1]]}, "result": [[0.03227041792], 0, 5.787623167037964, 1670239686.1067681], "version": 0.2, "tvm_version": "0.11.dev0"}
{"input": ["opencl -keys=adreno,opencl,gpu -device=adreno -max_num_threads=256 -texture_spatial_limit=16384 -thread_warp_size=1", "batch_matmul.cuda", [["TENSOR", [12, 197, 197], "float32"], ["TENSOR", [12, 64, 197], "float32"], [12, 197, 64], "float32", 0, 1], {}], "config": {"index": 45, "code_hash": null, "entity": [["tile_y", "sp", [-1, 1, 1]], ["tile_x", "sp", [-1, 4, 4]], ["tile_k", "sp", [-1, 1]], ["auto_unroll_max_step", "ot", 8], ["unroll_explicit", "ot", 0]]}, "result": [[0.04986347008], 0, 17.45644497871399, 1670239722.7203555], "version": 0.2, "tvm_version": "0.11.dev0"}
{"input": ["opencl -keys=adreno,opencl,gpu -device=adreno -max_num_threads=256 -texture_spatial_limit=16384 -thread_warp_size=1", "batch_matmul.cuda", [["TENSOR", [12, 197, 197], "float32"], ["TENSOR", [12, 64, 197], "float32"], [12, 197, 64], "float32", 0, 1], {}], "config": {"index": 789, "code_hash": null, "entity": [["tile_y", "sp", [-1, 1, 1]], ["tile_x", "sp", [-1, 16, 2]], ["tile_k", "sp", [-1, 197]], ["auto_unroll_max_step", "ot", 8], ["unroll_explicit", "ot", 1]]}, "result": [[0.07728571392], 0, 12.545921802520752, 1670239717.8090563], "version": 0.2, "tvm_version": "0.11.dev0"}
{"input": ["opencl -keys=adreno,opencl,gpu -device=adreno -max_num_threads=256 -texture_spatial_limit=16384 -thread_warp_size=1", "batch_matmul.cuda", [["TENSOR", [12, 197, 197], "float32"], ["TENSOR", [12, 64, 197], "float32"], [12, 197, 64], "float32", 0, 1], {}], "config": {"index": 1098, "code_hash": null, "entity": [["tile_y", "sp", [-1, 1, 1]], ["tile_x", "sp", [-1, 4, 1]], ["tile_k", "sp", [-1, 197]], ["auto_unroll_max_step", "ot", 32], ["unroll_explicit", "ot", 1]]}, "result": [[0.056130590720000005], 0, 9.112776041030884, 1670239714.3782668], "version": 0.2, "tvm_version": "0.11.dev0"}
{"input": ["opencl -keys=adreno,opencl,gpu -device=adreno -max_num_threads=256 -texture_spatial_limit=16384 -thread_warp_size=1", "batch_matmul.cuda", [["TENSOR", [12, 197, 197], "float32"], ["TENSOR", [12, 64, 197], "float32"], [12, 197, 64], "float32", 0, 1], {}], "config": {"index": 35, "code_hash": null, "entity": [["tile_y", "sp", [-1, 1, 197]], ["tile_x", "sp", [-1, 16, 2]], ["tile_k", "sp", [-1, 1]], ["auto_unroll_max_step", "ot", 8], ["unroll_explicit", "ot", 0]]}, "result": [[0.0324811776], 0, 18.167821884155273, 1670239723.4244254], "version": 0.2, "tvm_version": "0.11.dev0"}
{"input": ["opencl -keys=adreno,opencl,gpu -device=adreno -max_num_threads=256 -texture_spatial_limit=16384 -thread_warp_size=1", "batch_matmul.cuda", [["TENSOR", [12, 197, 197], "float32"], ["TENSOR", [12, 64, 197], "float32"], [12, 197, 64], "float32", 0, 1], {}], "config": {"index": 1101, "code_hash": null, "entity": [["tile_y", "sp", [-1, 1, 1]], ["tile_x", "sp", [-1, 8, 1]], ["tile_k", "sp", [-1, 197]], ["auto_unroll_max_step", "ot", 32], ["unroll_explicit", "ot", 1]]}, "result": [[0.03204289024], 0, 23.25711989402771, 1670239746.8790705], "version": 0.2, "tvm_version": "0.11.dev0"}
{"input": ["opencl -keys=adreno,opencl,gpu -device=adreno -max_num_threads=256 -texture_spatial_limit=16384 -thread_warp_size=1", "batch_matmul.cuda", [["TENSOR", [12, 197, 197], "float32"], ["TENSOR", [12, 64, 197], "float32"], [12, 197, 64], "float32", 0, 1], {}], "config": {"index": 1067, "code_hash": null, "entity": [["tile_y", "sp", [-1, 1, 197]], ["tile_x", "sp", [-1, 2, 8]], ["tile_k", "sp", [-1, 1]], ["auto_unroll_max_step", "ot", 32], ["unroll_explicit", "ot", 1]]}, "result": [[0.04636531712], 0, 30.945854663848877, 1670239754.6652184], "version": 0.2, "tvm_version": "0.11.dev0"}
{"input": ["opencl -keys=adreno,opencl,gpu -device=adreno -max_num_threads=256 -texture_spatial_limit=16384 -thread_warp_size=1", "batch_matmul.cuda", [["TENSOR", [12, 197, 197], "float32"], ["TENSOR", [12, 64, 197], "float32"], [12, 197, 64], "float32", 0, 1], {}], "config": {"index": 356, "code_hash": null, "entity": [["tile_y", "sp", [-1, 1, 197]], ["tile_x", "sp", [-1, 64, 1]], ["tile_k", "sp", [-1, 1]], ["auto_unroll_max_step", "ot", 32], ["unroll_explicit", "ot", 0]]}, "result": [[0.05811234816], 0, 9.518890857696533, 1670239765.4955916], "version": 0.2, "tvm_version": "0.11.dev0"}
{"input": ["opencl -keys=adreno,opencl,gpu -device=adreno -max_num_threads=256 -texture_spatial_limit=16384 -thread_warp_size=1", "batch_matmul.cuda", [["TENSOR", [12, 197, 197], "float32"], ["TENSOR", [12, 64, 197], "float32"], [12, 197, 64], "float32", 0, 1], {}], "config": {"index": 47, "code_hash": null, "entity": [["tile_y", "sp", [-1, 1, 197]], ["tile_x", "sp", [-1, 4, 4]], ["tile_k", "sp", [-1, 1]], ["auto_unroll_max_step", "ot", 8], ["unroll_explicit", "ot", 0]]}, "result": [[0.029054336], 0, 14.43885850906372, 1670239770.3676035], "version": 0.2, "tvm_version": "0.11.dev0"}
{"input": ["opencl -keys=adreno,opencl,gpu -device=adreno -max_num_threads=256 -texture_spatial_limit=16384 -thread_warp_size=1", "batch_matmul.cuda", [["TENSOR", [12, 197, 197], "float32"], ["TENSOR", [12, 64, 197], "float32"], [12, 197, 64], "float32", 0, 1], {}], "config": {"index": 242, "code_hash": null, "entity": [["tile_y", "sp", [-1, 1, 197]], ["tile_x", "sp", [-1, 4, 16]], ["tile_k", "sp", [-1, 1]], ["auto_unroll_max_step", "ot", 16], ["unroll_explicit", "ot", 0]]}, "result": [[0.044782853119999994], 0, 9.400066137313843, 1670239765.3544343], "version": 0.2, "tvm_version": "0.11.dev0"}
{"input": ["opencl -keys=adreno,opencl,gpu -device=adreno -max_num_threads=256 -texture_spatial_limit=16384 -thread_warp_size=1", "batch_matmul.cuda", [["TENSOR", [12, 197, 197], "float32"], ["TENSOR", [12, 64, 197], "float32"], [12, 197, 64], "float32", 0, 1], {}], "config": {"index": 235, "code_hash": null, "entity": [["tile_y", "sp", [-1, 197, 1]], ["tile_x", "sp", [-1, 1, 16]], ["tile_k", "sp", [-1, 1]], ["auto_unroll_max_step", "ot", 16], ["unroll_explicit", "ot", 0]]}, "result": [[0.00767865856], 0, 1.9721038341522217, 1670239757.9332037], "version": 0.2, "tvm_version": "0.11.dev0"}
{"input": ["opencl -keys=adreno,opencl,gpu -device=adreno -max_num_threads=256 -texture_spatial_limit=16384 -thread_warp_size=1", "batch_matmul.cuda", [["TENSOR", [12, 197, 197], "float32"], ["TENSOR", [12, 64, 197], "float32"], [12, 197, 64], "float32", 0, 1], {}], "config": {"index": 200, "code_hash": null, "entity": [["tile_y", "sp", [-1, 1, 197]], ["tile_x", "sp", [-1, 8, 2]], ["tile_k", "sp", [-1, 1]], ["auto_unroll_max_step", "ot", 16], ["unroll_explicit", "ot", 0]]}, "result": [[0.03237924864], 0, 5.735141277313232, 1670239776.3428955], "version": 0.2, "tvm_version": "0.11.dev0"}
{"input": ["opencl -keys=adreno,opencl,gpu -device=adreno -max_num_threads=256 -texture_spatial_limit=16384 -thread_warp_size=1", "batch_matmul.cuda", [["TENSOR", [12, 197, 197], "float32"], ["TENSOR", [12, 64, 197], "float32"], [12, 197, 64], "float32", 0, 1], {}], "config": {"index": 365, "code_hash": null, "entity": [["tile_y", "sp", [-1, 1, 197]], ["tile_x", "sp", [-1, 4, 2]], ["tile_k", "sp", [-1, 1]], ["auto_unroll_max_step", "ot", 32], ["unroll_explicit", "ot", 0]]}, "result": [[0.046266879999999996], 0, 13.465759754180908, 1670239784.0570734], "version": 0.2, "tvm_version": "0.11.dev0"}
{"input": ["opencl -keys=adreno,opencl,gpu -device=adreno -max_num_threads=256 -texture_spatial_limit=16384 -thread_warp_size=1", "batch_matmul.cuda", [["TENSOR", [12, 197, 197], "float32"], ["TENSOR", [12, 64, 197], "float32"], [12, 197, 64], "float32", 0, 1], {}], "config": {"index": 213, "code_hash": null, "entity": [["tile_y", "sp", [-1, 1, 1]], ["tile_x", "sp", [-1, 4, 4]], ["tile_k", "sp", [-1, 1]], ["auto_unroll_max_step", "ot", 16], ["unroll_explicit", "ot", 0]]}, "result": [[0.04986235391999999], 0, 8.569969654083252, 1670239808.558845], "version": 0.2, "tvm_version": "0.11.dev0"}
{"input": ["opencl -keys=adreno,opencl,gpu -device=adreno -max_num_threads=256 -texture_spatial_limit=16384 -thread_warp_size=1", "batch_matmul.cuda", [["TENSOR", [12, 197, 197], "float32"], ["TENSOR", [12, 64, 197], "float32"], [12, 197, 64], "float32", 0, 1], {}], "config": {"index": 1203, "code_hash": null, "entity": [["tile_y", "sp", [-1, 1, 1]], ["tile_x", "sp", [-1, 4, 2]], ["tile_k", "sp", [-1, 1]], ["auto_unroll_max_step", "ot", 64], ["unroll_explicit", "ot", 1]]}, "result": [[0.05430736896], 0, 33.393240451812744, 1670239833.3566992], "version": 0.2, "tvm_version": "0.11.dev0"}
{"input": ["opencl -keys=adreno,opencl,gpu -device=adreno -max_num_threads=256 -texture_spatial_limit=16384 -thread_warp_size=1", "batch_matmul.cuda", [["TENSOR", [12, 197, 197], "float32"], ["TENSOR", [12, 64, 197], "float32"], [12, 197, 64], "float32", 0, 1], {}], "config": {"index": 258, "code_hash": null, "entity": [["tile_y", "sp", [-1, 1, 1]], ["tile_x", "sp", [-1, 4, 1]], ["tile_k", "sp", [-1, 197]], ["auto_unroll_max_step", "ot", 16], ["unroll_explicit", "ot", 0]]}, "result": [[0.0560626688], 0, 42.48537755012512, 1670239842.5159667], "version": 0.2, "tvm_version": "0.11.dev0"}
{"input": ["opencl -keys=adreno,opencl,gpu -device=adreno -max_num_threads=256 -texture_spatial_limit=16384 -thread_warp_size=1", "batch_matmul.cuda", [["TENSOR", [12, 197, 197], "float32"], ["TENSOR", [12, 64, 197], "float32"], [12, 197, 64], "float32", 0, 1], {}], "config": {"index": 203, "code_hash": null, "entity": [["tile_y", "sp", [-1, 1, 197]], ["tile_x", "sp", [-1, 16, 2]], ["tile_k", "sp", [-1, 1]], ["auto_unroll_max_step", "ot", 16], ["unroll_explicit", "ot", 0]]}, "result": [[0.032982804479999996], 0, 5.913645029067993, 1670239848.888808], "version": 0.2, "tvm_version": "0.11.dev0"}
{"input": ["opencl -keys=adreno,opencl,gpu -device=adreno -max_num_threads=256 -texture_spatial_limit=16384 -thread_warp_size=1", "batch_matmul.cuda", [["TENSOR", [12, 197, 197], "float32"], ["TENSOR", [12, 64, 197], "float32"], [12, 197, 64], "float32", 0, 1], {}], "config": {"index": 594, "code_hash": null, "entity": [["tile_y", "sp", [-1, 1, 1]], ["tile_x", "sp", [-1, 4, 1]], ["tile_k", "sp", [-1, 197]], ["auto_unroll_max_step", "ot", 64], ["unroll_explicit", "ot", 0]]}, "result": [[0.05605097472000001], 0, 9.322625875473022, 1670239852.3097234], "version": 0.2, "tvm_version": "0.11.dev0"}
{"input": ["opencl -keys=adreno,opencl,gpu -device=adreno -max_num_threads=256 -texture_spatial_limit=16384 -thread_warp_size=1", "batch_matmul.cuda", [["TENSOR", [12, 197, 197], "float32"], ["TENSOR", [12, 64, 197], "float32"], [12, 197, 64], "float32", 0, 1], {}], "config": {"index": 546, "code_hash": null, "entity": [["tile_y", "sp", [-1, 1, 1]], ["tile_x", "sp", [-1, 2, 4]], ["tile_k", "sp", [-1, 1]], ["auto_unroll_max_step", "ot", 64], ["unroll_explicit", "ot", 0]]}, "result": [[0.058935936], 0, 9.707443952560425, 1670239874.6125517], "version": 0.2, "tvm_version": "0.11.dev0"}
{"input": ["opencl -keys=adreno,opencl,gpu -device=adreno -max_num_threads=256 -texture_spatial_limit=16384 -thread_warp_size=1", "batch_matmul.cuda", [["TENSOR", [12, 197, 197], "float32"], ["TENSOR", [12, 64, 197], "float32"], [12, 197, 64], "float32", 0, 1], {}], "config": {"index": 1066, "code_hash": null, "entity": [["tile_y", "sp", [-1, 197, 1]], ["tile_x", "sp", [-1, 2, 8]], ["tile_k", "sp", [-1, 1]], ["auto_unroll_max_step", "ot", 32], ["unroll_explicit", "ot", 1]]}, "result": [[0.0026403686399999998], 0, 1.8486430644989014, 1670239866.729977], "version": 0.2, "tvm_version": "0.11.dev0"}
{"input": ["opencl -keys=adreno,opencl,gpu -device=adreno -max_num_threads=256 -texture_spatial_limit=16384 -thread_warp_size=1", "batch_matmul.cuda", [["TENSOR", [12, 197, 197], "float32"], ["TENSOR", [12, 64, 197], "float32"], [12, 197, 64], "float32", 0, 1], {}], "config": {"index": 679, "code_hash": null, "entity": [["tile_y", "sp", [-1, 197, 1]], ["tile_x", "sp", [-1, 4, 1]], ["tile_k", "sp", [-1, 1]], ["auto_unroll_max_step", "ot", 8], ["unroll_explicit", "ot", 1]]}, "result": [[0.00578433536], 0, 3.2547895908355713, 1670239868.1831973], "version": 0.2, "tvm_version": "0.11.dev0"}
{"input": ["opencl -keys=adreno,opencl,gpu -device=adreno -max_num_threads=256 -texture_spatial_limit=16384 -thread_warp_size=1", "batch_matmul.cuda", [["TENSOR", [12, 197, 197], "float32"], ["TENSOR", [12, 64, 197], "float32"], [12, 197, 64], "float32", 0, 1], {}], "config": {"index": 746, "code_hash": null, "entity": [["tile_y", "sp", [-1, 1, 197]], ["tile_x", "sp", [-1, 4, 16]], ["tile_k", "sp", [-1, 1]], ["auto_unroll_max_step", "ot", 8], ["unroll_explicit", "ot", 1]]}, "result": [[0.04483805184], 0, 10.733535051345825, 1670239875.6362753], "version": 0.2, "tvm_version": "0.11.dev0"}
{"input": ["opencl -keys=adreno,opencl,gpu -device=adreno -max_num_threads=256 -texture_spatial_limit=16384 -thread_warp_size=1", "batch_matmul.cuda", [["TENSOR", [12, 197, 197], "float32"], ["TENSOR", [12, 64, 197], "float32"], [12, 197, 64], "float32", 0, 1], {}], "config": {"index": 14, "code_hash": null, "entity": [["tile_y", "sp", [-1, 1, 197]], ["tile_x", "sp", [-1, 16, 1]], ["tile_k", "sp", [-1, 1]], ["auto_unroll_max_step", "ot", 8], ["unroll_explicit", "ot", 0]]}, "result": [[0.040516116479999996], 0, 6.980222463607788, 1670239916.1679103], "version": 0.2, "tvm_version": "0.11.dev0"}
{"input": ["opencl -keys=adreno,opencl,gpu -device=adreno -max_num_threads=256 -texture_spatial_limit=16384 -thread_warp_size=1", "batch_matmul.cuda", [["TENSOR", [12, 197, 197], "float32"], ["TENSOR", [12, 64, 197], "float32"], [12, 197, 64], "float32", 0, 1], {}], "config": {"index": 182, "code_hash": null, "entity": [["tile_y", "sp", [-1, 1, 197]], ["tile_x", "sp", [-1, 16, 1]], ["tile_k", "sp", [-1, 1]], ["auto_unroll_max_step", "ot", 16], ["unroll_explicit", "ot", 0]]}, "result": [[0.04095874048], 0, 20.5047447681427, 1670239929.7219598], "version": 0.2, "tvm_version": "0.11.dev0"}
{"input": ["opencl -keys=adreno,opencl,gpu -device=adreno -max_num_threads=256 -texture_spatial_limit=16384 -thread_warp_size=1", "batch_matmul.cuda", [["TENSOR", [12, 197, 197], "float32"], ["TENSOR", [12, 64, 197], "float32"], [12, 197, 64], "float32", 0, 1], {}], "config": {"index": 518, "code_hash": null, "entity": [["tile_y", "sp", [-1, 1, 197]], ["tile_x", "sp", [-1, 16, 1]], ["tile_k", "sp", [-1, 1]], ["auto_unroll_max_step", "ot", 64], ["unroll_explicit", "ot", 0]]}, "result": [[0.039715962880000004], 0, 13.632996559143066, 1670239922.849419], "version": 0.2, "tvm_version": "0.11.dev0"}
{"input": ["opencl -keys=adreno,opencl,gpu -device=adreno -max_num_threads=256 -texture_spatial_limit=16384 -thread_warp_size=1", "batch_matmul.cuda", [["TENSOR", [12, 197, 197], "float32"], ["TENSOR", [12, 64, 197], "float32"], [12, 197, 64], "float32", 0, 1], {}], "config": {"index": 350, "code_hash": null, "entity": [["tile_y", "sp", [-1, 1, 197]], ["tile_x", "sp", [-1, 16, 1]], ["tile_k", "sp", [-1, 1]], ["auto_unroll_max_step", "ot", 32], ["unroll_explicit", "ot", 0]]}, "result": [[0.0395785216], 0, 9.929426193237305, 1670239919.1491153], "version": 0.2, "tvm_version": "0.11.dev0"}
{"input": ["opencl -keys=adreno,opencl,gpu -device=adreno -max_num_threads=256 -texture_spatial_limit=16384 -thread_warp_size=1", "batch_matmul.cuda", [["TENSOR", [12, 197, 197], "float32"], ["TENSOR", [12, 64, 197], "float32"], [12, 197, 64], "float32", 0, 1], {}], "config": {"index": 1075, "code_hash": null, "entity": [["tile_y", "sp", [-1, 197, 1]], ["tile_x", "sp", [-1, 1, 16]], ["tile_k", "sp", [-1, 1]], ["auto_unroll_max_step", "ot", 32], ["unroll_explicit", "ot", 1]]}, "result": [[0.00278559232], 0, 1.4964721202850342, 1670239910.6681998], "version": 0.2, "tvm_version": "0.11.dev0"}
{"input": ["opencl -keys=adreno,opencl,gpu -device=adreno -max_num_threads=256 -texture_spatial_limit=16384 -thread_warp_size=1", "batch_matmul.cuda", [["TENSOR", [12, 197, 197], "float32"], ["TENSOR", [12, 64, 197], "float32"], [12, 197, 64], "float32", 0, 1], {}], "config": {"index": 739, "code_hash": null, "entity": [["tile_y", "sp", [-1, 197, 1]], ["tile_x", "sp", [-1, 1, 16]], ["tile_k", "sp", [-1, 1]], ["auto_unroll_max_step", "ot", 8], ["unroll_explicit", "ot", 1]]}, "result": [[0.00795482112], 0, 3.1851565837860107, 1670239912.424019], "version": 0.2, "tvm_version": "0.11.dev0"}
{"input": ["opencl -keys=adreno,opencl,gpu -device=adreno -max_num_threads=256 -texture_spatial_limit=16384 -thread_warp_size=1", "batch_matmul.cuda", [["TENSOR", [12, 197, 197], "float32"], ["TENSOR", [12, 64, 197], "float32"], [12, 197, 64], "float32", 0, 1], {}], "config": {"index": 730, "code_hash": null, "entity": [["tile_y", "sp", [-1, 197, 1]], ["tile_x", "sp", [-1, 2, 8]], ["tile_k", "sp", [-1, 1]], ["auto_unroll_max_step", "ot", 8], ["unroll_explicit", "ot", 1]]}, "result": [[0.00262360064], 0, 11.122010469436646, 1670239920.3059068], "version": 0.2, "tvm_version": "0.11.dev0"}
{"input": ["opencl -keys=adreno,opencl,gpu -device=adreno -max_num_threads=256 -texture_spatial_limit=16384 -thread_warp_size=1", "batch_matmul.cuda", [["TENSOR", [12, 197, 197], "float32"], ["TENSOR", [12, 64, 197], "float32"], [12, 197, 64], "float32", 0, 1], {}], "config": {"index": 686, "code_hash": null, "entity": [["tile_y", "sp", [-1, 1, 197]], ["tile_x", "sp", [-1, 16, 1]], ["tile_k", "sp", [-1, 1]], ["auto_unroll_max_step", "ot", 8], ["unroll_explicit", "ot", 1]]}, "result": [[0.0391508224], 0, 17.760517120361328, 1670239927.0028577], "version": 0.2, "tvm_version": "0.11.dev0"}
{"input": ["opencl -keys=adreno,opencl,gpu -device=adreno -max_num_threads=256 -texture_spatial_limit=16384 -thread_warp_size=1", "batch_matmul.cuda", [["TENSOR", [12, 197, 197], "float32"], ["TENSOR", [12, 64, 197], "float32"], [12, 197, 64], "float32", 0, 1], {}], "config": {"index": 67, "code_hash": null, "entity": [["tile_y", "sp", [-1, 197, 1]], ["tile_x", "sp", [-1, 1, 16]], ["tile_k", "sp", [-1, 1]], ["auto_unroll_max_step", "ot", 8], ["unroll_explicit", "ot", 0]]}, "result": [[0.00779547648], 0, 2.7319695949554443, 1670239932.7502053], "version": 0.2, "tvm_version": "0.11.dev0"}
{"input": ["opencl -keys=adreno,opencl,gpu -device=adreno -max_num_threads=256 -texture_spatial_limit=16384 -thread_warp_size=1", "batch_matmul.cuda", [["TENSOR", [12, 197, 197], "float32"], ["TENSOR", [12, 64, 197], "float32"], [12, 197, 64], "float32", 0, 1], {}], "config": {"index": 898, "code_hash": null, "entity": [["tile_y", "sp", [-1, 197, 1]], ["tile_x", "sp", [-1, 2, 8]], ["tile_k", "sp", [-1, 1]], ["auto_unroll_max_step", "ot", 16], ["unroll_explicit", "ot", 1]]}, "result": [[0.0026285055999999995], 0, 1.3947315216064453, 1670239931.3842747], "version": 0.2, "tvm_version": "0.11.dev0"}
{"input": ["opencl -keys=adreno,opencl,gpu -device=adreno -max_num_threads=256 -texture_spatial_limit=16384 -thread_warp_size=1", "batch_matmul.cuda", [["TENSOR", [12, 197, 197], "float32"], ["TENSOR", [12, 64, 197], "float32"], [12, 197, 64], "float32", 0, 1], {}], "config": {"index": 403, "code_hash": null, "entity": [["tile_y", "sp", [-1, 197, 1]], ["tile_x", "sp", [-1, 1, 16]], ["tile_k", "sp", [-1, 1]], ["auto_unroll_max_step", "ot", 32], ["unroll_explicit", "ot", 0]]}, "result": [[0.0076015206400000005], 0, 10.367494106292725, 1670239940.3494637], "version": 0.2, "tvm_version": "0.11.dev0"}
{"input": ["opencl -keys=adreno,opencl,gpu -device=adreno -max_num_threads=256 -texture_spatial_limit=16384 -thread_warp_size=1", "batch_matmul.cuda", [["TENSOR", [12, 197, 197], "float32"], ["TENSOR", [12, 64, 197], "float32"], [12, 197, 64], "float32", 0, 1], {}], "config": {"index": 907, "code_hash": null, "entity": [["tile_y", "sp", [-1, 197, 1]], ["tile_x", "sp", [-1, 1, 16]], ["tile_k", "sp", [-1, 1]], ["auto_unroll_max_step", "ot", 16], ["unroll_explicit", "ot", 1]]}, "result": [[0.00278925312], 0, 4.96212100982666, 1670239934.9492726], "version": 0.2, "tvm_version": "0.11.dev0"}
{"input": ["opencl -keys=adreno,opencl,gpu -device=adreno -max_num_threads=256 -texture_spatial_limit=16384 -thread_warp_size=1", "batch_matmul.cuda", [["TENSOR", [12, 197, 197], "float32"], ["TENSOR", [12, 64, 197], "float32"], [12, 197, 64], "float32", 0, 1], {}], "config": {"index": 1243, "code_hash": null, "entity": [["tile_y", "sp", [-1, 197, 1]], ["tile_x", "sp", [-1, 1, 16]], ["tile_k", "sp", [-1, 1]], ["auto_unroll_max_step", "ot", 64], ["unroll_explicit", "ot", 1]]}, "result": [[0.00278084608], 0, 1.1483118534088135, 1670239931.142816], "version": 0.2, "tvm_version": "0.11.dev0"}
{"input": ["opencl -keys=adreno,opencl,gpu -device=adreno -max_num_threads=256 -texture_spatial_limit=16384 -thread_warp_size=1", "batch_matmul.cuda", [["TENSOR", [12, 197, 197], "float32"], ["TENSOR", [12, 64, 197], "float32"], [12, 197, 64], "float32", 0, 1], {}], "config": {"index": 1022, "code_hash": null, "entity": [["tile_y", "sp", [-1, 1, 197]], ["tile_x", "sp", [-1, 16, 1]], ["tile_k", "sp", [-1, 1]], ["auto_unroll_max_step", "ot", 32], ["unroll_explicit", "ot", 1]]}, "result": [[0.05148665344], 0, 9.916276454925537, 1670239939.8528333], "version": 0.2, "tvm_version": "0.11.dev0"}
{"input": ["opencl -keys=adreno,opencl,gpu -device=adreno -max_num_threads=256 -texture_spatial_limit=16384 -thread_warp_size=1", "batch_matmul.cuda", [["TENSOR", [12, 197, 197], "float32"], ["TENSOR", [12, 64, 197], "float32"], [12, 197, 64], "float32", 0, 1], {}], "config": {"index": 1234, "code_hash": null, "entity": [["tile_y", "sp", [-1, 197, 1]], ["tile_x", "sp", [-1, 2, 8]], ["tile_k", "sp", [-1, 1]], ["auto_unroll_max_step", "ot", 64], ["unroll_explicit", "ot", 1]]}, "result": [[0.002626816], 0, 3.967869758605957, 1670239933.9208183], "version": 0.2, "tvm_version": "0.11.dev0"}
{"input": ["opencl -keys=adreno,opencl,gpu -device=adreno -max_num_threads=256 -texture_spatial_limit=16384 -thread_warp_size=1", "batch_matmul.cuda", [["TENSOR", [12, 197, 197], "float32"], ["TENSOR", [12, 64, 197], "float32"], [12, 197, 64], "float32", 0, 1], {}], "config": {"index": 58, "code_hash": null, "entity": [["tile_y", "sp", [-1, 197, 1]], ["tile_x", "sp", [-1, 2, 8]], ["tile_k", "sp", [-1, 1]], ["auto_unroll_max_step", "ot", 8], ["unroll_explicit", "ot", 0]]}, "result": [[0.01882935808], 0, 8.435619831085205, 1670239938.43304], "version": 0.2, "tvm_version": "0.11.dev0"}
{"input": ["opencl -keys=adreno,opencl,gpu -device=adreno -max_num_threads=256 -texture_spatial_limit=16384 -thread_warp_size=1", "batch_matmul.cuda", [["TENSOR", [12, 197, 197], "float32"], ["TENSOR", [12, 64, 197], "float32"], [12, 197, 64], "float32", 0, 1], {}], "config": {"index": 1190, "code_hash": null, "entity": [["tile_y", "sp", [-1, 1, 197]], ["tile_x", "sp", [-1, 16, 1]], ["tile_k", "sp", [-1, 1]], ["auto_unroll_max_step", "ot", 64], ["unroll_explicit", "ot", 1]]}, "result": [[0.051267645439999995], 0, 8.686980962753296, 1670239949.275683], "version": 0.2, "tvm_version": "0.11.dev0"}
{"input": ["opencl -keys=adreno,opencl,gpu -device=adreno -max_num_threads=256 -texture_spatial_limit=16384 -thread_warp_size=1", "batch_matmul.cuda", [["TENSOR", [12, 197, 197], "float32"], ["TENSOR", [12, 64, 197], "float32"], [12, 197, 64], "float32", 0, 1], {}], "config": {"index": 854, "code_hash": null, "entity": [["tile_y", "sp", [-1, 1, 197]], ["tile_x", "sp", [-1, 16, 1]], ["tile_k", "sp", [-1, 1]], ["auto_unroll_max_step", "ot", 16], ["unroll_explicit", "ot", 1]]}, "result": [[0.052842910720000004], 0, 12.496017694473267, 1670239953.0852628], "version": 0.2, "tvm_version": "0.11.dev0"}
{"input": ["opencl -keys=adreno,opencl,gpu -device=adreno -max_num_threads=256 -texture_spatial_limit=16384 -thread_warp_size=1", "batch_matmul.cuda", [["TENSOR", [12, 197, 197], "float32"], ["TENSOR", [12, 64, 197], "float32"], [12, 197, 64], "float32", 0, 1], {}], "config": {"index": 394, "code_hash": null, "entity": [["tile_y", "sp", [-1, 197, 1]], ["tile_x", "sp", [-1, 2, 8]], ["tile_k", "sp", [-1, 1]], ["auto_unroll_max_step", "ot", 32], ["unroll_explicit", "ot", 0]]}, "result": [[0.01884014592], 0, 17.30192756652832, 1670239957.9327743], "version": 0.2, "tvm_version": "0.11.dev0"}
{"input": ["opencl -keys=adreno,opencl,gpu -device=adreno -max_num_threads=256 -texture_spatial_limit=16384 -thread_warp_size=1", "batch_matmul.cuda", [["TENSOR", [12, 197, 197], "float32"], ["TENSOR", [12, 64, 197], "float32"], [12, 197, 64], "float32", 0, 1], {}], "config": {"index": 1063, "code_hash": null, "entity": [["tile_y", "sp", [-1, 197, 1]], ["tile_x", "sp", [-1, 1, 8]], ["tile_k", "sp", [-1, 1]], ["auto_unroll_max_step", "ot", 32], ["unroll_explicit", "ot", 1]]}, "result": [[0.002353152], 0, 14.774055480957031, 1670239955.4329367], "version": 0.2, "tvm_version": "0.11.dev0"}
{"input": ["opencl -keys=adreno,opencl,gpu -device=adreno -max_num_threads=256 -texture_spatial_limit=16384 -thread_warp_size=1", "batch_matmul.cuda", [["TENSOR", [12, 197, 197], "float32"], ["TENSOR", [12, 64, 197], "float32"], [12, 197, 64], "float32", 0, 1], {}], "config": {"index": 226, "code_hash": null, "entity": [["tile_y", "sp", [-1, 197, 1]], ["tile_x", "sp", [-1, 2, 8]], ["tile_k", "sp", [-1, 1]], ["auto_unroll_max_step", "ot", 16], ["unroll_explicit", "ot", 0]]}, "result": [[0.0187628544], 0, 3.7263333797454834, 1670239944.3709614], "version": 0.2, "tvm_version": "0.11.dev0"}
{"input": ["opencl -keys=adreno,opencl,gpu -device=adreno -max_num_threads=256 -texture_spatial_limit=16384 -thread_warp_size=1", "batch_matmul.cuda", [["TENSOR", [12, 197, 197], "float32"], ["TENSOR", [12, 64, 197], "float32"], [12, 197, 64], "float32", 0, 1], {}], "config": {"index": 571, "code_hash": null, "entity": [["tile_y", "sp", [-1, 197, 1]], ["tile_x", "sp", [-1, 1, 16]], ["tile_k", "sp", [-1, 1]], ["auto_unroll_max_step", "ot", 64], ["unroll_explicit", "ot", 0]]}, "result": [[0.007642501119999999], 0, 16.493200540542603, 1670239957.1657434], "version": 0.2, "tvm_version": "0.11.dev0"}
{"input": ["opencl -keys=adreno,opencl,gpu -device=adreno -max_num_threads=256 -texture_spatial_limit=16384 -thread_warp_size=1", "batch_matmul.cuda", [["TENSOR", [12, 197, 197], "float32"], ["TENSOR", [12, 64, 197], "float32"], [12, 197, 64], "float32", 0, 1], {}], "config": {"index": 50, "code_hash": null, "entity": [["tile_y", "sp", [-1, 1, 197]], ["tile_x", "sp", [-1, 8, 4]], ["tile_k", "sp", [-1, 1]], ["auto_unroll_max_step", "ot", 8], ["unroll_explicit", "ot", 0]]}, "result": [[0.028667765760000005], 0, 13.823550939559937, 1670239954.4474297], "version": 0.2, "tvm_version": "0.11.dev0"}
{"input": ["opencl -keys=adreno,opencl,gpu -device=adreno -max_num_threads=256 -texture_spatial_limit=16384 -thread_warp_size=1", "batch_matmul.cuda", [["TENSOR", [12, 197, 197], "float32"], ["TENSOR", [12, 64, 197], "float32"], [12, 197, 64], "float32", 0, 1], {}], "config": {"index": 727, "code_hash": null, "entity": [["tile_y", "sp", [-1, 197, 1]], ["tile_x", "sp", [-1, 1, 8]], ["tile_k", "sp", [-1, 1]], ["auto_unroll_max_step", "ot", 8], ["unroll_explicit", "ot", 1]]}, "result": [[0.00235675648], 0, 13.644603729248047, 1670239954.3001888], "version": 0.2, "tvm_version": "0.11.dev0"}
{"input": ["opencl -keys=adreno,opencl,gpu -device=adreno -max_num_threads=256 -texture_spatial_limit=16384 -thread_warp_size=1", "batch_matmul.cuda", [["TENSOR", [12, 197, 197], "float32"], ["TENSOR", [12, 64, 197], "float32"], [12, 197, 64], "float32", 0, 1], {}], "config": {"index": 1231, "code_hash": null, "entity": [["tile_y", "sp", [-1, 197, 1]], ["tile_x", "sp", [-1, 1, 8]], ["tile_k", "sp", [-1, 1]], ["auto_unroll_max_step", "ot", 64], ["unroll_explicit", "ot", 1]]}, "result": [[0.00235706368], 0, 1.202195405960083, 1670239959.418653], "version": 0.2, "tvm_version": "0.11.dev0"}
{"input": ["opencl -keys=adreno,opencl,gpu -device=adreno -max_num_threads=256 -texture_spatial_limit=16384 -thread_warp_size=1", "batch_matmul.cuda", [["TENSOR", [12, 197, 197], "float32"], ["TENSOR", [12, 64, 197], "float32"], [12, 197, 64], "float32", 0, 1], {}], "config": {"index": 62, "code_hash": null, "entity": [["tile_y", "sp", [-1, 1, 197]], ["tile_x", "sp", [-1, 4, 8]], ["tile_k", "sp", [-1, 1]], ["auto_unroll_max_step", "ot", 8], ["unroll_explicit", "ot", 0]]}, "result": [[0.034712012800000004], 0, 8.192021608352661, 1670239966.3792334], "version": 0.2, "tvm_version": "0.11.dev0"}
{"input": ["opencl -keys=adreno,opencl,gpu -device=adreno -max_num_threads=256 -texture_spatial_limit=16384 -thread_warp_size=1", "batch_matmul.cuda", [["TENSOR", [12, 197, 197], "float32"], ["TENSOR", [12, 64, 197], "float32"], [12, 197, 64], "float32", 0, 1], {}], "config": {"index": 562, "code_hash": null, "entity": [["tile_y", "sp", [-1, 197, 1]], ["tile_x", "sp", [-1, 2, 8]], ["tile_k", "sp", [-1, 1]], ["auto_unroll_max_step", "ot", 64], ["unroll_explicit", "ot", 0]]}, "result": [[0.01878773248], 0, 11.61933946609497, 1670239969.8458824], "version": 0.2, "tvm_version": "0.11.dev0"}
{"input": ["opencl -keys=adreno,opencl,gpu -device=adreno -max_num_threads=256 -texture_spatial_limit=16384 -thread_warp_size=1", "batch_matmul.cuda", [["TENSOR", [12, 197, 197], "float32"], ["TENSOR", [12, 64, 197], "float32"], [12, 197, 64], "float32", 0, 1], {}], "config": {"index": 722, "code_hash": null, "entity": [["tile_y", "sp", [-1, 1, 197]], ["tile_x", "sp", [-1, 8, 4]], ["tile_k", "sp", [-1, 1]], ["auto_unroll_max_step", "ot", 8], ["unroll_explicit", "ot", 1]]}, "result": [[0.029063905279999996], 0, 5.3141162395477295, 1670239963.4991524], "version": 0.2, "tvm_version": "0.11.dev0"}
{"input": ["opencl -keys=adreno,opencl,gpu -device=adreno -max_num_threads=256 -texture_spatial_limit=16384 -thread_warp_size=1", "batch_matmul.cuda", [["TENSOR", [12, 197, 197], "float32"], ["TENSOR", [12, 64, 197], "float32"], [12, 197, 64], "float32", 0, 1], {}], "config": {"index": 383, "code_hash": null, "entity": [["tile_y", "sp", [-1, 1, 197]], ["tile_x", "sp", [-1, 4, 4]], ["tile_k", "sp", [-1, 1]], ["auto_unroll_max_step", "ot", 32], ["unroll_explicit", "ot", 0]]}, "result": [[0.029242321919999998], 0, 16.823416709899902, 1670239975.0259256], "version": 0.2, "tvm_version": "0.11.dev0"}
{"input": ["opencl -keys=adreno,opencl,gpu -device=adreno -max_num_threads=256 -texture_spatial_limit=16384 -thread_warp_size=1", "batch_matmul.cuda", [["TENSOR", [12, 197, 197], "float32"], ["TENSOR", [12, 64, 197], "float32"], [12, 197, 64], "float32", 0, 1], {}], "config": {"index": 895, "code_hash": null, "entity": [["tile_y", "sp", [-1, 197, 1]], ["tile_x", "sp", [-1, 1, 8]], ["tile_k", "sp", [-1, 1]], ["auto_unroll_max_step", "ot", 16], ["unroll_explicit", "ot", 1]]}, "result": [[0.00235621376], 0, 2.1187217235565186, 1670239960.3459795], "version": 0.2, "tvm_version": "0.11.dev0"}
{"input": ["opencl -keys=adreno,opencl,gpu -device=adreno -max_num_threads=256 -texture_spatial_limit=16384 -thread_warp_size=1", "batch_matmul.cuda", [["TENSOR", [12, 197, 197], "float32"], ["TENSOR", [12, 64, 197], "float32"], [12, 197, 64], "float32", 0, 1], {}], "config": {"index": 398, "code_hash": null, "entity": [["tile_y", "sp", [-1, 1, 197]], ["tile_x", "sp", [-1, 4, 8]], ["tile_k", "sp", [-1, 1]], ["auto_unroll_max_step", "ot", 32], ["unroll_explicit", "ot", 0]]}, "result": [[0.0339286528], 0, 11.097711324691772, 1670239969.2983124], "version": 0.2, "tvm_version": "0.11.dev0"}
{"input": ["opencl -keys=adreno,opencl,gpu -device=adreno -max_num_threads=256 -texture_spatial_limit=16384 -thread_warp_size=1", "batch_matmul.cuda", [["TENSOR", [12, 197, 197], "float32"], ["TENSOR", [12, 64, 197], "float32"], [12, 197, 64], "float32", 0, 1], {}], "config": {"index": 734, "code_hash": null, "entity": [["tile_y", "sp", [-1, 1, 197]], ["tile_x", "sp", [-1, 4, 8]], ["tile_k", "sp", [-1, 1]], ["auto_unroll_max_step", "ot", 8], ["unroll_explicit", "ot", 1]]}, "result": [[0.03378998784], 0, 16.850930213928223, 1670239975.0251787], "version": 0.2, "tvm_version": "0.11.dev0"}
{"input": ["opencl -keys=adreno,opencl,gpu -device=adreno -max_num_threads=256 -texture_spatial_limit=16384 -thread_warp_size=1", "batch_matmul.cuda", [["TENSOR", [12, 197, 197], "float32"], ["TENSOR", [12, 64, 197], "float32"], [12, 197, 64], "float32", 0, 1], {}], "config": {"index": 215, "code_hash": null, "entity": [["tile_y", "sp", [-1, 1, 197]], ["tile_x", "sp", [-1, 4, 4]], ["tile_k", "sp", [-1, 1]], ["auto_unroll_max_step", "ot", 16], ["unroll_explicit", "ot", 0]]}, "result": [[0.028822353920000002], 0, 9.326909303665161, 1670239984.7578273], "version": 0.2, "tvm_version": "0.11.dev0"}
{"input": ["opencl -keys=adreno,opencl,gpu -device=adreno -max_num_threads=256 -texture_spatial_limit=16384 -thread_warp_size=1", "batch_matmul.cuda", [["TENSOR", [12, 197, 197], "float32"], ["TENSOR", [12, 64, 197], "float32"], [12, 197, 64], "float32", 0, 1], {}], "config": {"index": 391, "code_hash": null, "entity": [["tile_y", "sp", [-1, 197, 1]], ["tile_x", "sp", [-1, 1, 8]], ["tile_k", "sp", [-1, 1]], ["auto_unroll_max_step", "ot", 32], ["unroll_explicit", "ot", 0]]}, "result": [[0.02177060864], 0, 4.192084312438965, 1670239979.6725821], "version": 0.2, "tvm_version": "0.11.dev0"}
{"input": ["opencl -keys=adreno,opencl,gpu -device=adreno -max_num_threads=256 -texture_spatial_limit=16384 -thread_warp_size=1", "batch_matmul.cuda", [["TENSOR", [12, 197, 197], "float32"], ["TENSOR", [12, 64, 197], "float32"], [12, 197, 64], "float32", 0, 1], {}], "config": {"index": 32, "code_hash": null, "entity": [["tile_y", "sp", [-1, 1, 197]], ["tile_x", "sp", [-1, 8, 2]], ["tile_k", "sp", [-1, 1]], ["auto_unroll_max_step", "ot", 8], ["unroll_explicit", "ot", 0]]}, "result": [[0.032039628800000004], 0, 14.804308891296387, 1670239990.2390552], "version": 0.2, "tvm_version": "0.11.dev0"}
{"input": ["opencl -keys=adreno,opencl,gpu -device=adreno -max_num_threads=256 -texture_spatial_limit=16384 -thread_warp_size=1", "batch_matmul.cuda", [["TENSOR", [12, 197, 197], "float32"], ["TENSOR", [12, 64, 197], "float32"], [12, 197, 64], "float32", 0, 1], {}], "config": {"index": 1070, "code_hash": null, "entity": [["tile_y", "sp", [-1, 1, 197]], ["tile_x", "sp", [-1, 4, 8]], ["tile_k", "sp", [-1, 1]], ["auto_unroll_max_step", "ot", 32], ["unroll_explicit", "ot", 1]]}, "result": [[0.03409086464], 0, 10.462199687957764, 1670239985.7429643], "version": 0.2, "tvm_version": "0.11.dev0"}
{"input": ["opencl -keys=adreno,opencl,gpu -device=adreno -max_num_threads=256 -texture_spatial_limit=16384 -thread_warp_size=1", "batch_matmul.cuda", [["TENSOR", [12, 197, 197], "float32"], ["TENSOR", [12, 64, 197], "float32"], [12, 197, 64], "float32", 0, 1], {}], "config": {"index": 55, "code_hash": null, "entity": [["tile_y", "sp", [-1, 197, 1]], ["tile_x", "sp", [-1, 1, 8]], ["tile_k", "sp", [-1, 1]], ["auto_unroll_max_step", "ot", 8], ["unroll_explicit", "ot", 0]]}, "result": [[0.021717662719999996], 0, 4.1302337646484375, 1670239979.606905], "version": 0.2, "tvm_version": "0.11.dev0"}
{"input": ["opencl -keys=adreno,opencl,gpu -device=adreno -max_num_threads=256 -texture_spatial_limit=16384 -thread_warp_size=1", "batch_matmul.cuda", [["TENSOR", [12, 197, 197], "float32"], ["TENSOR", [12, 64, 197], "float32"], [12, 197, 64], "float32", 0, 1], {}], "config": {"index": 230, "code_hash": null, "entity": [["tile_y", "sp", [-1, 1, 197]], ["tile_x", "sp", [-1, 4, 8]], ["tile_k", "sp", [-1, 1]], ["auto_unroll_max_step", "ot", 16], ["unroll_explicit", "ot", 0]]}, "result": [[0.0346496768], 0, 16.332337379455566, 1670239991.7760928], "version": 0.2, "tvm_version": "0.11.dev0"}
{"input": ["opencl -keys=adreno,opencl,gpu -device=adreno -max_num_threads=256 -texture_spatial_limit=16384 -thread_warp_size=1", "batch_matmul.cuda", [["TENSOR", [12, 197, 197], "float32"], ["TENSOR", [12, 64, 197], "float32"], [12, 197, 64], "float32", 0, 1], {}], "config": {"index": 551, "code_hash": null, "entity": [["tile_y", "sp", [-1, 1, 197]], ["tile_x", "sp", [-1, 4, 4]], ["tile_k", "sp", [-1, 1]], ["auto_unroll_max_step", "ot", 64], ["unroll_explicit", "ot", 0]]}, "result": [[0.028578631679999997], 0, 19.919792890548706, 1670239995.3638117], "version": 0.2, "tvm_version": "0.11.dev0"}
{"input": ["opencl -keys=adreno,opencl,gpu -device=adreno -max_num_threads=256 -texture_spatial_limit=16384 -thread_warp_size=1", "batch_matmul.cuda", [["TENSOR", [12, 197, 197], "float32"], ["TENSOR", [12, 64, 197], "float32"], [12, 197, 64], "float32", 0, 1], {}], "config": {"index": 559, "code_hash": null, "entity": [["tile_y", "sp", [-1, 197, 1]], ["tile_x", "sp", [-1, 1, 8]], ["tile_k", "sp", [-1, 1]], ["auto_unroll_max_step", "ot", 64], ["unroll_explicit", "ot", 0]]}, "result": [[0.0219393536], 0, 20.41834807395935, 1670239995.9130569], "version": 0.2, "tvm_version": "0.11.dev0"}
{"input": ["opencl -keys=adreno,opencl,gpu -device=adreno -max_num_threads=256 -texture_spatial_limit=16384 -thread_warp_size=1", "batch_matmul.cuda", [["TENSOR", [12, 197, 197], "float32"], ["TENSOR", [12, 64, 197], "float32"], [12, 197, 64], "float32", 0, 1], {}], "config": {"index": 719, "code_hash": null, "entity": [["tile_y", "sp", [-1, 1, 197]], ["tile_x", "sp", [-1, 4, 4]], ["tile_k", "sp", [-1, 1]], ["auto_unroll_max_step", "ot", 8], ["unroll_explicit", "ot", 1]]}, "result": [[0.02933886464], 0, 5.4660093784332275, 1670240001.673725], "version": 0.2, "tvm_version": "0.11.dev0"}
{"input": ["opencl -keys=adreno,opencl,gpu -device=adreno -max_num_threads=256 -texture_spatial_limit=16384 -thread_warp_size=1", "batch_matmul.cuda", [["TENSOR", [12, 197, 197], "float32"], ["TENSOR", [12, 64, 197], "float32"], [12, 197, 64], "float32", 0, 1], {}], "config": {"index": 223, "code_hash": null, "entity": [["tile_y", "sp", [-1, 197, 1]], ["tile_x", "sp", [-1, 1, 8]], ["tile_k", "sp", [-1, 1]], ["auto_unroll_max_step", "ot", 16], ["unroll_explicit", "ot", 0]]}, "result": [[0.0217706752], 0, 9.561236143112183, 1670240005.8368983], "version": 0.2, "tvm_version": "0.11.dev0"}
{"input": ["opencl -keys=adreno,opencl,gpu -device=adreno -max_num_threads=256 -texture_spatial_limit=16384 -thread_warp_size=1", "batch_matmul.cuda", [["TENSOR", [12, 197, 197], "float32"], ["TENSOR", [12, 64, 197], "float32"], [12, 197, 64], "float32", 0, 1], {}], "config": {"index": 1055, "code_hash": null, "entity": [["tile_y", "sp", [-1, 1, 197]], ["tile_x", "sp", [-1, 4, 4]], ["tile_k", "sp", [-1, 1]], ["auto_unroll_max_step", "ot", 32], ["unroll_explicit", "ot", 1]]}, "result": [[0.039398072320000005], 0, 18.602140426635742, 1670240014.753699], "version": 0.2, "tvm_version": "0.11.dev0"}
{"input": ["opencl -keys=adreno,opencl,gpu -device=adreno -max_num_threads=256 -texture_spatial_limit=16384 -thread_warp_size=1", "batch_matmul.cuda", [["TENSOR", [12, 197, 197], "float32"], ["TENSOR", [12, 64, 197], "float32"], [12, 197, 64], "float32", 0, 1], {}], "config": {"index": 218, "code_hash": null, "entity": [["tile_y", "sp", [-1, 1, 197]], ["tile_x", "sp", [-1, 8, 4]], ["tile_k", "sp", [-1, 1]], ["auto_unroll_max_step", "ot", 16], ["unroll_explicit", "ot", 0]]}, "result": [[0.028510796799999998], 0, 14.698077201843262, 1670240010.9279587], "version": 0.2, "tvm_version": "0.11.dev0"}
{"input": ["opencl -keys=adreno,opencl,gpu -device=adreno -max_num_threads=256 -texture_spatial_limit=16384 -thread_warp_size=1", "batch_matmul.cuda", [["TENSOR", [12, 197, 197], "float32"], ["TENSOR", [12, 64, 197], "float32"], [12, 197, 64], "float32", 0, 1], {}], "config": {"index": 368, "code_hash": null, "entity": [["tile_y", "sp", [-1, 1, 197]], ["tile_x", "sp", [-1, 8, 2]], ["tile_k", "sp", [-1, 1]], ["auto_unroll_max_step", "ot", 32], ["unroll_explicit", "ot", 0]]}, "result": [[0.03214513152], 0, 20.113171100616455, 1670240016.3589737], "version": 0.2, "tvm_version": "0.11.dev0"}
{"input": ["opencl -keys=adreno,opencl,gpu -device=adreno -max_num_threads=256 -texture_spatial_limit=16384 -thread_warp_size=1", "batch_matmul.cuda", [["TENSOR", [12, 197, 197], "float32"], ["TENSOR", [12, 64, 197], "float32"], [12, 197, 64], "float32", 0, 1], {}], "config": {"index": 566, "code_hash": null, "entity": [["tile_y", "sp", [-1, 1, 197]], ["tile_x", "sp", [-1, 4, 8]], ["tile_k", "sp", [-1, 1]], ["auto_unroll_max_step", "ot", 64], ["unroll_explicit", "ot", 0]]}, "result": [[0.034095856640000005], 0, 5.935383558273315, 1670240002.1801848], "version": 0.2, "tvm_version": "0.11.dev0"}
{"input": ["opencl -keys=adreno,opencl,gpu -device=adreno -max_num_threads=256 -texture_spatial_limit=16384 -thread_warp_size=1", "batch_matmul.cuda", [["TENSOR", [12, 197, 197], "float32"], ["TENSOR", [12, 64, 197], "float32"], [12, 197, 64], "float32", 0, 1], {}], "config": {"index": 386, "code_hash": null, "entity": [["tile_y", "sp", [-1, 1, 197]], ["tile_x", "sp", [-1, 8, 4]], ["tile_k", "sp", [-1, 1]], ["auto_unroll_max_step", "ot", 32], ["unroll_explicit", "ot", 0]]}, "result": [[0.029241968639999998], 0, 23.598782539367676, 1670240019.8367052], "version": 0.2, "tvm_version": "0.11.dev0"}
{"input": ["opencl -keys=adreno,opencl,gpu -device=adreno -max_num_threads=256 -texture_spatial_limit=16384 -thread_warp_size=1", "batch_matmul.cuda", [["TENSOR", [12, 197, 197], "float32"], ["TENSOR", [12, 64, 197], "float32"], [12, 197, 64], "float32", 0, 1], {}], "config": {"index": 536, "code_hash": null, "entity": [["tile_y", "sp", [-1, 1, 197]], ["tile_x", "sp", [-1, 8, 2]], ["tile_k", "sp", [-1, 1]], ["auto_unroll_max_step", "ot", 64], ["unroll_explicit", "ot", 0]]}, "result": [[0.032375582720000004], 0, 11.641104698181152, 1670240007.879134], "version": 0.2, "tvm_version": "0.11.dev0"}
{"input": ["opencl -keys=adreno,opencl,gpu -device=adreno -max_num_threads=256 -texture_spatial_limit=16384 -thread_warp_size=1", "batch_matmul.cuda", [["TENSOR", [12, 197, 197], "float32"], ["TENSOR", [12, 64, 197], "float32"], [12, 197, 64], "float32", 0, 1], {}], "config": {"index": 1058, "code_hash": null, "entity": [["tile_y", "sp", [-1, 1, 197]], ["tile_x", "sp", [-1, 8, 4]], ["tile_k", "sp", [-1, 1]], ["auto_unroll_max_step", "ot", 32], ["unroll_explicit", "ot", 1]]}, "result": [[0.028507504640000004], 0, 11.61466646194458, 1670240031.765507], "version": 0.2, "tvm_version": "0.11.dev0"}
{"input": ["opencl -keys=adreno,opencl,gpu -device=adreno -max_num_threads=256 -texture_spatial_limit=16384 -thread_warp_size=1", "batch_matmul.cuda", [["TENSOR", [12, 197, 197], "float32"], ["TENSOR", [12, 64, 197], "float32"], [12, 197, 64], "float32", 0, 1], {}], "config": {"index": 902, "code_hash": null, "entity": [["tile_y", "sp", [-1, 1, 197]], ["tile_x", "sp", [-1, 4, 8]], ["tile_k", "sp", [-1, 1]], ["auto_unroll_max_step", "ot", 16], ["unroll_explicit", "ot", 1]]}, "result": [[0.03418564608], 0, 17.325419902801514, 1670240037.5884395], "version": 0.2, "tvm_version": "0.11.dev0"}
{"input": ["opencl -keys=adreno,opencl,gpu -device=adreno -max_num_threads=256 -texture_spatial_limit=16384 -thread_warp_size=1", "batch_matmul.cuda", [["TENSOR", [12, 197, 197], "float32"], ["TENSOR", [12, 64, 197], "float32"], [12, 197, 64], "float32", 0, 1], {}], "config": {"index": 554, "code_hash": null, "entity": [["tile_y", "sp", [-1, 1, 197]], ["tile_x", "sp", [-1, 8, 4]], ["tile_k", "sp", [-1, 1]], ["auto_unroll_max_step", "ot", 64], ["unroll_explicit", "ot", 0]]}, "result": [[0.02901523968], 0, 12.23562216758728, 1670240032.532325], "version": 0.2, "tvm_version": "0.11.dev0"}
{"input": ["opencl -keys=adreno,opencl,gpu -device=adreno -max_num_threads=256 -texture_spatial_limit=16384 -thread_warp_size=1", "batch_matmul.cuda", [["TENSOR", [12, 197, 197], "float32"], ["TENSOR", [12, 64, 197], "float32"], [12, 197, 64], "float32", 0, 1], {}], "config": {"index": 1238, "code_hash": null, "entity": [["tile_y", "sp", [-1, 1, 197]], ["tile_x", "sp", [-1, 4, 8]], ["tile_k", "sp", [-1, 1]], ["auto_unroll_max_step", "ot", 64], ["unroll_explicit", "ot", 1]]}, "result": [[0.033936220159999995], 0, 6.298335790634155, 1670240026.4335825], "version": 0.2, "tvm_version": "0.11.dev0"}
{"input": ["opencl -keys=adreno,opencl,gpu -device=adreno -max_num_threads=256 -texture_spatial_limit=16384 -thread_warp_size=1", "batch_matmul.cuda", [["TENSOR", [12, 197, 197], "float32"], ["TENSOR", [12, 64, 197], "float32"], [12, 197, 64], "float32", 0, 1], {}], "config": {"index": 7, "code_hash": null, "entity": [["tile_y", "sp", [-1, 197, 1]], ["tile_x", "sp", [-1, 4, 1]], ["tile_k", "sp", [-1, 1]], ["auto_unroll_max_step", "ot", 8], ["unroll_explicit", "ot", 0]]}, "result": [[0.00578702336], 0, 7.110857248306274, 1670240027.4575763], "version": 0.2, "tvm_version": "0.11.dev0"}
{"input": ["opencl -keys=adreno,opencl,gpu -device=adreno -max_num_threads=256 -texture_spatial_limit=16384 -thread_warp_size=1", "batch_matmul.cuda", [["TENSOR", [12, 197, 197], "float32"], ["TENSOR", [12, 64, 197], "float32"], [12, 197, 64], "float32", 0, 1], {}], "config": {"index": 890, "code_hash": null, "entity": [["tile_y", "sp", [-1, 1, 197]], ["tile_x", "sp", [-1, 8, 4]], ["tile_k", "sp", [-1, 1]], ["auto_unroll_max_step", "ot", 16], ["unroll_explicit", "ot", 1]]}, "result": [[0.030077194239999997], 0, 5.440716981887817, 1670240025.7184188], "version": 0.2, "tvm_version": "0.11.dev0"}
{"input": ["opencl -keys=adreno,opencl,gpu -device=adreno -max_num_threads=256 -texture_spatial_limit=16384 -thread_warp_size=1", "batch_matmul.cuda", [["TENSOR", [12, 197, 197], "float32"], ["TENSOR", [12, 64, 197], "float32"], [12, 197, 64], "float32", 0, 1], {}], "config": {"index": 1226, "code_hash": null, "entity": [["tile_y", "sp", [-1, 1, 197]], ["tile_x", "sp", [-1, 8, 4]], ["tile_k", "sp", [-1, 1]], ["auto_unroll_max_step", "ot", 64], ["unroll_explicit", "ot", 1]]}, "result": [[0.02860168192], 0, 17.507766246795654, 1670240037.6499846], "version": 0.2, "tvm_version": "0.11.dev0"}
{"input": ["opencl -keys=adreno,opencl,gpu -device=adreno -max_num_threads=256 -texture_spatial_limit=16384 -thread_warp_size=1", "batch_matmul.cuda", [["TENSOR", [12, 197, 197], "float32"], ["TENSOR", [12, 64, 197], "float32"], [12, 197, 64], "float32", 0, 1], {}], "config": {"index": 847, "code_hash": null, "entity": [["tile_y", "sp", [-1, 197, 1]], ["tile_x", "sp", [-1, 4, 1]], ["tile_k", "sp", [-1, 1]], ["auto_unroll_max_step", "ot", 16], ["unroll_explicit", "ot", 1]]}, "result": [[0.00579487232], 0, 18.810340881347656, 1670240039.1571922], "version": 0.2, "tvm_version": "0.11.dev0"}
