logs/vit_base_patch16_224.texture.float32.autotvm.log
{"input": ["opencl -keys=adreno,opencl,gpu -device=adreno -max_num_threads=256 -texture_spatial_limit=16384 -thread_warp_size=1", "dense_small_batch.gpu", [["TENSOR", [1, 768], "float32"], ["TENSOR", [1000, 768], "float32"], null, "float32"], {}], "config": {"index": 11, "code_hash": null, "entity": [["tile_k", "sp", [-1, 64]]]}, "result": [[8.137216e-05], 0, 2.21492862701416, 1670238800.4854903], "version": 0.2, "tvm_version": "0.11.dev0"}
{"input": ["opencl -keys=adreno,opencl,gpu -device=adreno -max_num_threads=256 -texture_spatial_limit=16384 -thread_warp_size=1", "dense_small_batch.gpu", [["TENSOR", [197, 3072], "float32"], ["TENSOR", [768, 3072], "float32"], null, "float32"], {}], "config": {"index": 13, "code_hash": null, "entity": [["tile_k", "sp", [-1, 128]]]}, "result": [[0.048313093120000004], 0, 7.922500848770142, 1670239308.553255], "version": 0.2, "tvm_version": "0.11.dev0"}
{"input": ["opencl -keys=adreno,opencl,gpu -device=adreno -max_num_threads=256 -texture_spatial_limit=16384 -thread_warp_size=1", "dense_small_batch.gpu", [["TENSOR", [197, 768], "float32"], ["TENSOR", [3072, 768], "float32"], null, "float32"], {}], "config": {"index": 11, "code_hash": null, "entity": [["tile_k", "sp", [-1, 64]]]}, "result": [[0.04709826560000001], 0, 18.84548544883728, 1670239526.1079798], "version": 0.2, "tvm_version": "0.11.dev0"}
{"input": ["opencl -keys=adreno,opencl,gpu -device=adreno -max_num_threads=256 -texture_spatial_limit=16384 -thread_warp_size=1", "batch_matmul.cuda", [["TENSOR", [12, 197, 197], "float32"], ["TENSOR", [12, 64, 197], "float32"], [12, 197, 64], "float32", 0, 1], {}], "config": {"index": 1063, "code_hash": null, "entity": [["tile_y", "sp", [-1, 197, 1]], ["tile_x", "sp", [-1, 1, 8]], ["tile_k", "sp", [-1, 1]], ["auto_unroll_max_step", "ot", 32], ["unroll_explicit", "ot", 1]]}, "result": [[0.002353152], 0, 14.774055480957031, 1670239955.4329367], "version": 0.2, "tvm_version": "0.11.dev0"}
{"input": ["opencl -keys=adreno,opencl,gpu -device=adreno -max_num_threads=256 -texture_spatial_limit=16384 -thread_warp_size=1", "batch_matmul.cuda", [["TENSOR", [12, 197, 64], "float32"], ["TENSOR", [12, 197, 64], "float32"], [12, 197, 197], "float32", 0, 1], {}], "config": {"index": 253, "code_hash": null, "entity": [["tile_y", "sp", [-1, 197, 1]], ["tile_x", "sp", [-1, 1, 1]], ["tile_k", "sp", [-1, 1]], ["auto_unroll_max_step", "ot", 8], ["unroll_explicit", "ot", 1]]}, "result": [[0.00984339968], 0, 13.701524019241333, 1670241312.9632869], "version": 0.2, "tvm_version": "0.11.dev0"}
{"input": ["opencl -keys=adreno,opencl,gpu -device=adreno -max_num_threads=256 -texture_spatial_limit=16384 -thread_warp_size=1", "dense_small_batch.gpu", [["TENSOR", [197, 768], "float32"], ["TENSOR", [768, 768], "float32"], null, "float32"], {}], "config": {"index": 11, "code_hash": null, "entity": [["tile_k", "sp", [-1, 64]]]}, "result": [[0.01170661376], 0, 2.4443392753601074, 1670243229.2850876], "version": 0.2, "tvm_version": "0.11.dev0"}
{"input": ["opencl -keys=adreno,opencl,gpu -device=adreno -max_num_threads=256 -texture_spatial_limit=16384 -thread_warp_size=1", "conv2d_nchwc.image2d", [["TENSOR", [1, 3, 224, 224], "float32"], ["TENSOR", [768, 3, 16, 16], "float32"], [16, 16], [0, 0, 0, 0], [1, 1], "float32"], {}], "config": {"index": 505398, "code_hash": null, "entity": [["tile_fc", "sp", [-1, 1, 32]], ["tile_y", "sp", [-1, 1, 8]], ["tile_x", "sp", [-1, 8, 2]], ["tile_rcc", "sp", [-1, 1]], ["tile_ry", "sp", [-1, 1]], ["tile_rx", "sp", [-1, 1]], ["auto_unroll_max_step", "ot", 1500], ["unroll_explicit", "ot", 0]]}, "result": [[0.0016524032], 0, 2.307433605194092, 1670247301.9819295], "version": 0.2, "tvm_version": "0.11.dev0"}
