logs/vit_base_patch16_224.texture.float16.acc16.autotvm.log.tmp
{"input": ["opencl -keys=adreno,opencl,gpu -device=adreno -max_num_threads=256 -texture_spatial_limit=16384 -thread_warp_size=1", "dense_small_batch.gpu", [["TENSOR", [1, 768], "float16"], ["TENSOR", [1000, 768], "float16"], null, "float16"], {}], "config": {"index": 0, "code_hash": null, "entity": [["tile_k", "sp", [-1, 1]]]}, "result": [[0.00249119744], 0, 4.059003829956055, 1670425300.8061643], "version": 0.2, "tvm_version": "0.11.dev0"}
{"input": ["opencl -keys=adreno,opencl,gpu -device=adreno -max_num_threads=256 -texture_spatial_limit=16384 -thread_warp_size=1", "dense_small_batch.gpu", [["TENSOR", [1, 768], "float16"], ["TENSOR", [1000, 768], "float16"], null, "float16"], {}], "config": {"index": 11, "code_hash": null, "entity": [["tile_k", "sp", [-1, 64]]]}, "result": [[8.617471999999999e-05], 0, 2.910460948944092, 1670425299.6538436], "version": 0.2, "tvm_version": "0.11.dev0"}
{"input": ["opencl -keys=adreno,opencl,gpu -device=adreno -max_num_threads=256 -texture_spatial_limit=16384 -thread_warp_size=1", "dense_small_batch.gpu", [["TENSOR", [1, 768], "float16"], ["TENSOR", [1000, 768], "float16"], null, "float16"], {}], "config": {"index": 15, "code_hash": null, "entity": [["tile_k", "sp", [-1, 256]]]}, "result": [[0.00011669504000000001], 0, 4.247522354125977, 1670425301.026817], "version": 0.2, "tvm_version": "0.11.dev0"}
{"input": ["opencl -keys=adreno,opencl,gpu -device=adreno -max_num_threads=256 -texture_spatial_limit=16384 -thread_warp_size=1", "dense_small_batch.gpu", [["TENSOR", [1, 768], "float16"], ["TENSOR", [1000, 768], "float16"], null, "float16"], {}], "config": {"index": 16, "code_hash": null, "entity": [["tile_k", "sp", [-1, 384]]]}, "result": [[0.00014304256], 0, 5.217898368835449, 1670425302.079359], "version": 0.2, "tvm_version": "0.11.dev0"}
{"input": ["opencl -keys=adreno,opencl,gpu -device=adreno -max_num_threads=256 -texture_spatial_limit=16384 -thread_warp_size=1", "dense_small_batch.gpu", [["TENSOR", [1, 768], "float16"], ["TENSOR", [1000, 768], "float16"], null, "float16"], {}], "config": {"index": 12, "code_hash": null, "entity": [["tile_k", "sp", [-1, 96]]]}, "result": [[9.314816e-05], 0, 2.8285417556762695, 1670425299.55047], "version": 0.2, "tvm_version": "0.11.dev0"}
{"input": ["opencl -keys=adreno,opencl,gpu -device=adreno -max_num_threads=256 -texture_spatial_limit=16384 -thread_warp_size=1", "dense_small_batch.gpu", [["TENSOR", [1, 768], "float16"], ["TENSOR", [1000, 768], "float16"], null, "float16"], {}], "config": {"index": 2, "code_hash": null, "entity": [["tile_k", "sp", [-1, 3]]]}, "result": [[0.00081211904], 0, 4.611548662185669, 1670425301.4097242], "version": 0.2, "tvm_version": "0.11.dev0"}
{"input": ["opencl -keys=adreno,opencl,gpu -device=adreno -max_num_threads=256 -texture_spatial_limit=16384 -thread_warp_size=1", "dense_small_batch.gpu", [["TENSOR", [1, 768], "float16"], ["TENSOR", [1000, 768], "float16"], null, "float16"], {}], "config": {"index": 5, "code_hash": null, "entity": [["tile_k", "sp", [-1, 8]]]}, "result": [[0.00033137152000000005], 0, 4.944904565811157, 1670425301.7679315], "version": 0.2, "tvm_version": "0.11.dev0"}
{"input": ["opencl -keys=adreno,opencl,gpu -device=adreno -max_num_threads=256 -texture_spatial_limit=16384 -thread_warp_size=1", "dense_small_batch.gpu", [["TENSOR", [1, 768], "float16"], ["TENSOR", [1000, 768], "float16"], null, "float16"], {}], "config": {"index": 14, "code_hash": null, "entity": [["tile_k", "sp", [-1, 192]]]}, "result": [[0.00011602944], 0, 3.5379796028137207, 1670425300.294169], "version": 0.2, "tvm_version": "0.11.dev0"}
{"input": ["opencl -keys=adreno,opencl,gpu -device=adreno -max_num_threads=256 -texture_spatial_limit=16384 -thread_warp_size=1", "dense_small_batch.gpu", [["TENSOR", [1, 768], "float16"], ["TENSOR", [1000, 768], "float16"], null, "float16"], {}], "config": {"index": 10, "code_hash": null, "entity": [["tile_k", "sp", [-1, 48]]]}, "result": [[8.910848e-05], 0, 1.9323399066925049, 1670425304.2186844], "version": 0.2, "tvm_version": "0.11.dev0"}
{"input": ["opencl -keys=adreno,opencl,gpu -device=adreno -max_num_threads=256 -texture_spatial_limit=16384 -thread_warp_size=1", "dense_small_batch.gpu", [["TENSOR", [1, 768], "float16"], ["TENSOR", [1000, 768], "float16"], null, "float16"], {}], "config": {"index": 13, "code_hash": null, "entity": [["tile_k", "sp", [-1, 128]]]}, "result": [[9.641472e-05], 0, 0.46577954292297363, 1670425302.7415855], "version": 0.2, "tvm_version": "0.11.dev0"}
{"input": ["opencl -keys=adreno,opencl,gpu -device=adreno -max_num_threads=256 -texture_spatial_limit=16384 -thread_warp_size=1", "dense_small_batch.gpu", [["TENSOR", [1, 768], "float16"], ["TENSOR", [1000, 768], "float16"], null, "float16"], {}], "config": {"index": 7, "code_hash": null, "entity": [["tile_k", "sp", [-1, 16]]]}, "result": [[0.00018105856], 0, 1.087874412536621, 1670425303.3737006], "version": 0.2, "tvm_version": "0.11.dev0"}
{"input": ["opencl -keys=adreno,opencl,gpu -device=adreno -max_num_threads=256 -texture_spatial_limit=16384 -thread_warp_size=1", "dense_small_batch.gpu", [["TENSOR", [1, 768], "float16"], ["TENSOR", [1000, 768], "float16"], null, "float16"], {}], "config": {"index": 6, "code_hash": null, "entity": [["tile_k", "sp", [-1, 12]]]}, "result": [[0.00023546880000000002], 0, 1.7606086730957031, 1670425304.056353], "version": 0.2, "tvm_version": "0.11.dev0"}
{"input": ["opencl -keys=adreno,opencl,gpu -device=adreno -max_num_threads=256 -texture_spatial_limit=16384 -thread_warp_size=1", "dense_small_batch.gpu", [["TENSOR", [1, 768], "float16"], ["TENSOR", [1000, 768], "float16"], null, "float16"], {}], "config": {"index": 9, "code_hash": null, "entity": [["tile_k", "sp", [-1, 32]]]}, "result": [[9.069055999999999e-05], 0, 0.5781238079071045, 1670425302.8399637], "version": 0.2, "tvm_version": "0.11.dev0"}
{"input": ["opencl -keys=adreno,opencl,gpu -device=adreno -max_num_threads=256 -texture_spatial_limit=16384 -thread_warp_size=1", "dense_small_batch.gpu", [["TENSOR", [1, 768], "float16"], ["TENSOR", [1000, 768], "float16"], null, "float16"], {}], "config": {"index": 1, "code_hash": null, "entity": [["tile_k", "sp", [-1, 2]]]}, "result": [[0.00118132224], 0, 2.736327648162842, 1670425305.0225823], "version": 0.2, "tvm_version": "0.11.dev0"}
{"input": ["opencl -keys=adreno,opencl,gpu -device=adreno -max_num_threads=256 -texture_spatial_limit=16384 -thread_warp_size=1", "dense_small_batch.gpu", [["TENSOR", [1, 768], "float16"], ["TENSOR", [1000, 768], "float16"], null, "float16"], {}], "config": {"index": 4, "code_hash": null, "entity": [["tile_k", "sp", [-1, 6]]]}, "result": [[0.00043154944], 0, 2.450322151184082, 1670425304.7416346], "version": 0.2, "tvm_version": "0.11.dev0"}
{"input": ["opencl -keys=adreno,opencl,gpu -device=adreno -max_num_threads=256 -texture_spatial_limit=16384 -thread_warp_size=1", "dense_small_batch.gpu", [["TENSOR", [1, 768], "float16"], ["TENSOR", [1000, 768], "float16"], null, "float16"], {}], "config": {"index": 3, "code_hash": null, "entity": [["tile_k", "sp", [-1, 4]]]}, "result": [[0.00062127616], 0, 1.1690056324005127, 1670425303.457803], "version": 0.2, "tvm_version": "0.11.dev0"}
{"input": ["opencl -keys=adreno,opencl,gpu -device=adreno -max_num_threads=256 -texture_spatial_limit=16384 -thread_warp_size=1", "dense_small_batch.gpu", [["TENSOR", [1, 768], "float16"], ["TENSOR", [1000, 768], "float16"], null, "float16"], {}], "config": {"index": 17, "code_hash": null, "entity": [["tile_k", "sp", [-1, 768]]]}, "result": [[0.00028005376], 0, 0.4408848285675049, 1670425305.6608074], "version": 0.2, "tvm_version": "0.11.dev0"}
{"input": ["opencl -keys=adreno,opencl,gpu -device=adreno -max_num_threads=256 -texture_spatial_limit=16384 -thread_warp_size=1", "dense_small_batch.gpu", [["TENSOR", [1, 768], "float16"], ["TENSOR", [1000, 768], "float16"], null, "float16"], {}], "config": {"index": 8, "code_hash": null, "entity": [["tile_k", "sp", [-1, 24]]]}, "result": [[0.00013832704], 0, 0.4998011589050293, 1670425305.718775], "version": 0.2, "tvm_version": "0.11.dev0"}
{"input": ["opencl -keys=adreno,opencl,gpu -device=adreno -max_num_threads=256 -texture_spatial_limit=16384 -thread_warp_size=1", "dense_small_batch.gpu", [["TENSOR", [197, 3072], "float16"], ["TENSOR", [768, 3072], "float16"], null, "float16"], {}], "config": {"index": 10, "code_hash": null, "entity": [["tile_k", "sp", [-1, 48]]]}, "result": [[0.04513298432], 0, 33.08156704902649, 1670425599.4168777], "version": 0.2, "tvm_version": "0.11.dev0"}
{"input": ["opencl -keys=adreno,opencl,gpu -device=adreno -max_num_threads=256 -texture_spatial_limit=16384 -thread_warp_size=1", "dense_small_batch.gpu", [["TENSOR", [197, 3072], "float16"], ["TENSOR", [768, 3072], "float16"], null, "float16"], {}], "config": {"index": 8, "code_hash": null, "entity": [["tile_k", "sp", [-1, 24]]]}, "result": [[0.07736309247999999], 0, 52.12016773223877, 1670425618.4707015], "version": 0.2, "tvm_version": "0.11.dev0"}
{"input": ["opencl -keys=adreno,opencl,gpu -device=adreno -max_num_threads=256 -texture_spatial_limit=16384 -thread_warp_size=1", "dense_small_batch.gpu", [["TENSOR", [197, 3072], "float16"], ["TENSOR", [768, 3072], "float16"], null, "float16"], {}], "config": {"index": 15, "code_hash": null, "entity": [["tile_k", "sp", [-1, 256]]]}, "result": [[0.05026814976], 0, 8.3124840259552, 1670425574.6429448], "version": 0.2, "tvm_version": "0.11.dev0"}
{"input": ["opencl -keys=adreno,opencl,gpu -device=adreno -max_num_threads=256 -texture_spatial_limit=16384 -thread_warp_size=1", "dense_small_batch.gpu", [["TENSOR", [197, 3072], "float16"], ["TENSOR", [768, 3072], "float16"], null, "float16"], {}], "config": {"index": 11, "code_hash": null, "entity": [["tile_k", "sp", [-1, 64]]]}, "result": [[0.03960142848], 0, 39.69706058502197, 1670425606.020887], "version": 0.2, "tvm_version": "0.11.dev0"}
{"input": ["opencl -keys=adreno,opencl,gpu -device=adreno -max_num_threads=256 -texture_spatial_limit=16384 -thread_warp_size=1", "dense_small_batch.gpu", [["TENSOR", [197, 3072], "float16"], ["TENSOR", [768, 3072], "float16"], null, "float16"], {}], "config": {"index": 9, "code_hash": null, "entity": [["tile_k", "sp", [-1, 32]]]}, "result": [[0.060978032640000006], 0, 67.61281132698059, 1670425703.8189533], "version": 0.2, "tvm_version": "0.11.dev0"}
{"input": ["opencl -keys=adreno,opencl,gpu -device=adreno -max_num_threads=256 -texture_spatial_limit=16384 -thread_warp_size=1", "dense_small_batch.gpu", [["TENSOR", [197, 3072], "float16"], ["TENSOR", [768, 3072], "float16"], null, "float16"], {}], "config": {"index": 16, "code_hash": null, "entity": [["tile_k", "sp", [-1, 384]]]}, "result": [[0.08320665088], 0, 50.5556058883667, 1670425686.7546637], "version": 0.2, "tvm_version": "0.11.dev0"}
{"input": ["opencl -keys=adreno,opencl,gpu -device=adreno -max_num_threads=256 -texture_spatial_limit=16384 -thread_warp_size=1", "dense_small_batch.gpu", [["TENSOR", [197, 3072], "float16"], ["TENSOR", [768, 3072], "float16"], null, "float16"], {}], "config": {"index": 13, "code_hash": null, "entity": [["tile_k", "sp", [-1, 128]]]}, "result": [[0.04080205824], 0, 57.44158720970154, 1670425693.63908], "version": 0.2, "tvm_version": "0.11.dev0"}
{"input": ["opencl -keys=adreno,opencl,gpu -device=adreno -max_num_threads=256 -texture_spatial_limit=16384 -thread_warp_size=1", "dense_small_batch.gpu", [["TENSOR", [197, 3072], "float16"], ["TENSOR", [768, 3072], "float16"], null, "float16"], {}], "config": {"index": 17, "code_hash": null, "entity": [["tile_k", "sp", [-1, 512]]]}, "result": [[0.08573290496000001], 0, 40.492701053619385, 1670425744.5729344], "version": 0.2, "tvm_version": "0.11.dev0"}
{"input": ["opencl -keys=adreno,opencl,gpu -device=adreno -max_num_threads=256 -texture_spatial_limit=16384 -thread_warp_size=1", "dense_small_batch.gpu", [["TENSOR", [197, 3072], "float16"], ["TENSOR", [768, 3072], "float16"], null, "float16"], {}], "config": {"index": 14, "code_hash": null, "entity": [["tile_k", "sp", [-1, 192]]]}, "result": [[0.05245402624000001], 0, 45.89786195755005, 1670425749.9636672], "version": 0.2, "tvm_version": "0.11.dev0"}
{"input": ["opencl -keys=adreno,opencl,gpu -device=adreno -max_num_threads=256 -texture_spatial_limit=16384 -thread_warp_size=1", "dense_small_batch.gpu", [["TENSOR", [197, 3072], "float16"], ["TENSOR", [768, 3072], "float16"], null, "float16"], {}], "config": {"index": 12, "code_hash": null, "entity": [["tile_k", "sp", [-1, 96]]]}, "result": [[0.040385259519999994], 0, 26.76437473297119, 1670425730.8161643], "version": 0.2, "tvm_version": "0.11.dev0"}
{"input": ["opencl -keys=adreno,opencl,gpu -device=adreno -max_num_threads=256 -texture_spatial_limit=16384 -thread_warp_size=1", "dense_small_batch.gpu", [["TENSOR", [197, 768], "float16"], ["TENSOR", [3072, 768], "float16"], null, "float16"], {}], "config": {"index": 15, "code_hash": null, "entity": [["tile_k", "sp", [-1, 256]]]}, "result": [[0.06720104959999999], 0, 11.17774748802185, 1670425917.4320974], "version": 0.2, "tvm_version": "0.11.dev0"}
{"input": ["opencl -keys=adreno,opencl,gpu -device=adreno -max_num_threads=256 -texture_spatial_limit=16384 -thread_warp_size=1", "dense_small_batch.gpu", [["TENSOR", [197, 768], "float16"], ["TENSOR", [3072, 768], "float16"], null, "float16"], {}], "config": {"index": 14, "code_hash": null, "entity": [["tile_k", "sp", [-1, 192]]]}, "result": [[0.06913171968], 0, 22.293102741241455, 1670425928.5557625], "version": 0.2, "tvm_version": "0.11.dev0"}
{"input": ["opencl -keys=adreno,opencl,gpu -device=adreno -max_num_threads=256 -texture_spatial_limit=16384 -thread_warp_size=1", "dense_small_batch.gpu", [["TENSOR", [197, 768], "float16"], ["TENSOR", [3072, 768], "float16"], null, "float16"], {}], "config": {"index": 10, "code_hash": null, "entity": [["tile_k", "sp", [-1, 48]]]}, "result": [[0.0520933632], 0, 57.81948256492615, 1670425964.077442], "version": 0.2, "tvm_version": "0.11.dev0"}
{"input": ["opencl -keys=adreno,opencl,gpu -device=adreno -max_num_threads=256 -texture_spatial_limit=16384 -thread_warp_size=1", "dense_small_batch.gpu", [["TENSOR", [197, 768], "float16"], ["TENSOR", [3072, 768], "float16"], null, "float16"], {}], "config": {"index": 8, "code_hash": null, "entity": [["tile_k", "sp", [-1, 24]]]}, "result": [[0.08062343168], 0, 30.669179677963257, 1670426033.8313982], "version": 0.2, "tvm_version": "0.11.dev0"}
{"input": ["opencl -keys=adreno,opencl,gpu -device=adreno -max_num_threads=256 -texture_spatial_limit=16384 -thread_warp_size=1", "dense_small_batch.gpu", [["TENSOR", [197, 768], "float16"], ["TENSOR", [3072, 768], "float16"], null, "float16"], {}], "config": {"index": 16, "code_hash": null, "entity": [["tile_k", "sp", [-1, 384]]]}, "result": [[0.08309656064], 0, 53.1572744846344, 1670426056.3419533], "version": 0.2, "tvm_version": "0.11.dev0"}
{"input": ["opencl -keys=adreno,opencl,gpu -device=adreno -max_num_threads=256 -texture_spatial_limit=16384 -thread_warp_size=1", "dense_small_batch.gpu", [["TENSOR", [197, 768], "float16"], ["TENSOR", [3072, 768], "float16"], null, "float16"], {}], "config": {"index": 12, "code_hash": null, "entity": [["tile_k", "sp", [-1, 96]]]}, "result": [[0.054801208319999996], 0, 39.51770615577698, 1670426042.714737], "version": 0.2, "tvm_version": "0.11.dev0"}
{"input": ["opencl -keys=adreno,opencl,gpu -device=adreno -max_num_threads=256 -texture_spatial_limit=16384 -thread_warp_size=1", "dense_small_batch.gpu", [["TENSOR", [197, 768], "float16"], ["TENSOR", [3072, 768], "float16"], null, "float16"], {}], "config": {"index": 13, "code_hash": null, "entity": [["tile_k", "sp", [-1, 128]]]}, "result": [[0.05640566272], 0, 9.834054708480835, 1670426013.0261846], "version": 0.2, "tvm_version": "0.11.dev0"}
{"input": ["opencl -keys=adreno,opencl,gpu -device=adreno -max_num_threads=256 -texture_spatial_limit=16384 -thread_warp_size=1", "dense_small_batch.gpu", [["TENSOR", [197, 768], "float16"], ["TENSOR", [3072, 768], "float16"], null, "float16"], {}], "config": {"index": 11, "code_hash": null, "entity": [["tile_k", "sp", [-1, 64]]]}, "result": [[0.0503207424], 0, 9.045226812362671, 1670426112.2792764], "version": 0.2, "tvm_version": "0.11.dev0"}
{"input": ["opencl -keys=adreno,opencl,gpu -device=adreno -max_num_threads=256 -texture_spatial_limit=16384 -thread_warp_size=1", "dense_small_batch.gpu", [["TENSOR", [197, 768], "float16"], ["TENSOR", [3072, 768], "float16"], null, "float16"], {}], "config": {"index": 9, "code_hash": null, "entity": [["tile_k", "sp", [-1, 32]]]}, "result": [[0.0684389376], 0, 11.289865255355835, 1670426114.5226932], "version": 0.2, "tvm_version": "0.11.dev0"}
{"input": ["opencl -keys=adreno,opencl,gpu -device=adreno -max_num_threads=256 -texture_spatial_limit=16384 -thread_warp_size=1", "batch_matmul.cuda", [["TENSOR", [12, 197, 197], "float16"], ["TENSOR", [12, 64, 197], "float16"], [12, 197, 64], "float16", 0, 1], {}], "config": {"index": 869, "code_hash": null, "entity": [["tile_y", "sp", [-1, 1, 197]], ["tile_x", "sp", [-1, 4, 2]], ["tile_k", "sp", [-1, 1]], ["auto_unroll_max_step", "ot", 16], ["unroll_explicit", "ot", 1]]}, "result": [[0.03700228096], 0, 18.266521453857422, 1670426133.308319], "version": 0.2, "tvm_version": "0.11.dev0"}
{"input": ["opencl -keys=adreno,opencl,gpu -device=adreno -max_num_threads=256 -texture_spatial_limit=16384 -thread_warp_size=1", "batch_matmul.cuda", [["TENSOR", [12, 197, 197], "float16"], ["TENSOR", [12, 64, 197], "float16"], [12, 197, 64], "float16", 0, 1], {}], "config": {"index": 633, "code_hash": null, "entity": [["tile_y", "sp", [-1, 1, 1]], ["tile_x", "sp", [-1, 4, 4]], ["tile_k", "sp", [-1, 197]], ["auto_unroll_max_step", "ot", 64], ["unroll_explicit", "ot", 0]]}, "result": [[0.07446826496], 0, 12.029716730117798, 1670426127.1012197], "version": 0.2, "tvm_version": "0.11.dev0"}
{"input": ["opencl -keys=adreno,opencl,gpu -device=adreno -max_num_threads=256 -texture_spatial_limit=16384 -thread_warp_size=1", "batch_matmul.cuda", [["TENSOR", [12, 197, 197], "float16"], ["TENSOR", [12, 64, 197], "float16"], [12, 197, 64], "float16", 0, 1], {}], "config": {"index": 882, "code_hash": null, "entity": [["tile_y", "sp", [-1, 1, 1]], ["tile_x", "sp", [-1, 2, 4]], ["tile_k", "sp", [-1, 1]], ["auto_unroll_max_step", "ot", 16], ["unroll_explicit", "ot", 1]]}, "result": [[0.059488962560000004], 0, 15.707887172698975, 1670426152.2452013], "version": 0.2, "tvm_version": "0.11.dev0"}
{"input": ["opencl -keys=adreno,opencl,gpu -device=adreno -max_num_threads=256 -texture_spatial_limit=16384 -thread_warp_size=1", "batch_matmul.cuda", [["TENSOR", [12, 197, 197], "float16"], ["TENSOR", [12, 64, 197], "float16"], [12, 197, 64], "float16", 0, 1], {}], "config": {"index": 227, "code_hash": null, "entity": [["tile_y", "sp", [-1, 1, 197]], ["tile_x", "sp", [-1, 2, 8]], ["tile_k", "sp", [-1, 1]], ["auto_unroll_max_step", "ot", 16], ["unroll_explicit", "ot", 0]]}, "result": [[0.02789079552], 0, 5.836694717407227, 1670426142.4164982], "version": 0.2, "tvm_version": "0.11.dev0"}
{"input": ["opencl -keys=adreno,opencl,gpu -device=adreno -max_num_threads=256 -texture_spatial_limit=16384 -thread_warp_size=1", "batch_matmul.cuda", [["TENSOR", [12, 197, 197], "float16"], ["TENSOR", [12, 64, 197], "float16"], [12, 197, 64], "float16", 0, 1], {}], "config": {"index": 714, "code_hash": null, "entity": [["tile_y", "sp", [-1, 1, 1]], ["tile_x", "sp", [-1, 2, 4]], ["tile_k", "sp", [-1, 1]], ["auto_unroll_max_step", "ot", 8], ["unroll_explicit", "ot", 1]]}, "result": [[0.05947600384], 0, 19.679972171783447, 1670426156.2676885], "version": 0.2, "tvm_version": "0.11.dev0"}
{"input": ["opencl -keys=adreno,opencl,gpu -device=adreno -max_num_threads=256 -texture_spatial_limit=16384 -thread_warp_size=1", "batch_matmul.cuda", [["TENSOR", [12, 197, 197], "float16"], ["TENSOR", [12, 64, 197], "float16"], [12, 197, 64], "float16", 0, 1], {}], "config": {"index": 1305, "code_hash": null, "entity": [["tile_y", "sp", [-1, 1, 1]], ["tile_x", "sp", [-1, 4, 4]], ["tile_k", "sp", [-1, 197]], ["auto_unroll_max_step", "ot", 64], ["unroll_explicit", "ot", 1]]}, "result": [[0.04790646272], 0, 9.559799432754517, 1670426145.7554529], "version": 0.2, "tvm_version": "0.11.dev0"}
{"input": ["opencl -keys=adreno,opencl,gpu -device=adreno -max_num_threads=256 -texture_spatial_limit=16384 -thread_warp_size=1", "batch_matmul.cuda", [["TENSOR", [12, 197, 197], "float16"], ["TENSOR", [12, 64, 197], "float16"], [12, 197, 64], "float16", 0, 1], {}], "config": {"index": 340, "code_hash": null, "entity": [["tile_y", "sp", [-1, 197, 1]], ["tile_x", "sp", [-1, 2, 1]], ["tile_k", "sp", [-1, 1]], ["auto_unroll_max_step", "ot", 32], ["unroll_explicit", "ot", 0]]}, "result": [[0.006992256], 0, 26.278192281723022, 1670426196.1723442], "version": 0.2, "tvm_version": "0.11.dev0"}
{"input": ["opencl -keys=adreno,opencl,gpu -device=adreno -max_num_threads=256 -texture_spatial_limit=16384 -thread_warp_size=1", "batch_matmul.cuda", [["TENSOR", [12, 197, 197], "float16"], ["TENSOR", [12, 64, 197], "float16"], [12, 197, 64], "float16", 0, 1], {}], "config": {"index": 569, "code_hash": null, "entity": [["tile_y", "sp", [-1, 1, 197]], ["tile_x", "sp", [-1, 8, 8]], ["tile_k", "sp", [-1, 1]], ["auto_unroll_max_step", "ot", 64], ["unroll_explicit", "ot", 0]]}, "result": [[0.0282405376], 0, 4.982429265975952, 1670426174.8468423], "version": 0.2, "tvm_version": "0.11.dev0"}
{"input": ["opencl -keys=adreno,opencl,gpu -device=adreno -max_num_threads=256 -texture_spatial_limit=16384 -thread_warp_size=1", "batch_matmul.cuda", [["TENSOR", [12, 197, 197], "float16"], ["TENSOR", [12, 64, 197], "float16"], [12, 197, 64], "float16", 0, 1], {}], "config": {"index": 1050, "code_hash": null, "entity": [["tile_y", "sp", [-1, 1, 1]], ["tile_x", "sp", [-1, 2, 4]], ["tile_k", "sp", [-1, 1]], ["auto_unroll_max_step", "ot", 32], ["unroll_explicit", "ot", 1]]}, "result": [[0.0594827776], 0, 36.01584506034851, 1670426205.8292484], "version": 0.2, "tvm_version": "0.11.dev0"}
{"input": ["opencl -keys=adreno,opencl,gpu -device=adreno -max_num_threads=256 -texture_spatial_limit=16384 -thread_warp_size=1", "batch_matmul.cuda", [["TENSOR", [12, 197, 197], "float16"], ["TENSOR", [12, 64, 197], "float16"], [12, 197, 64], "float16", 0, 1], {}], "config": {"index": 1088, "code_hash": null, "entity": [["tile_y", "sp", [-1, 1, 197]], ["tile_x", "sp", [-1, 2, 32]], ["tile_k", "sp", [-1, 1]], ["auto_unroll_max_step", "ot", 32], ["unroll_explicit", "ot", 1]]}, "result": [[0.055071032320000005], 0, 45.61072015762329, 1670426215.2945416], "version": 0.2, "tvm_version": "0.11.dev0"}
{"input": ["opencl -keys=adreno,opencl,gpu -device=adreno -max_num_threads=256 -texture_spatial_limit=16384 -thread_warp_size=1", "batch_matmul.cuda", [["TENSOR", [12, 197, 197], "float16"], ["TENSOR", [12, 64, 197], "float16"], [12, 197, 64], "float16", 0, 1], {}], "config": {"index": 1107, "code_hash": null, "entity": [["tile_y", "sp", [-1, 1, 1]], ["tile_x", "sp", [-1, 32, 1]], ["tile_k", "sp", [-1, 197]], ["auto_unroll_max_step", "ot", 32], ["unroll_explicit", "ot", 1]]}, "result": [[0.014939335679999999], 0, 7.977176189422607, 1670426177.8100896], "version": 0.2, "tvm_version": "0.11.dev0"}
{"input": ["opencl -keys=adreno,opencl,gpu -device=adreno -max_num_threads=256 -texture_spatial_limit=16384 -thread_warp_size=1", "batch_matmul.cuda", [["TENSOR", [12, 197, 197], "float16"], ["TENSOR", [12, 64, 197], "float16"], [12, 197, 64], "float16", 0, 1], {}], "config": {"index": 1187, "code_hash": null, "entity": [["tile_y", "sp", [-1, 1, 197]], ["tile_x", "sp", [-1, 8, 1]], ["tile_k", "sp", [-1, 1]], ["auto_unroll_max_step", "ot", 64], ["unroll_explicit", "ot", 1]]}, "result": [[0.04241191936], 0, 7.2940497398376465, 1670426231.433333], "version": 0.2, "tvm_version": "0.11.dev0"}
{"input": ["opencl -keys=adreno,opencl,gpu -device=adreno -max_num_threads=256 -texture_spatial_limit=16384 -thread_warp_size=1", "batch_matmul.cuda", [["TENSOR", [12, 197, 197], "float16"], ["TENSOR", [12, 64, 197], "float16"], [12, 197, 64], "float16", 0, 1], {}], "config": {"index": 1302, "code_hash": null, "entity": [["tile_y", "sp", [-1, 1, 1]], ["tile_x", "sp", [-1, 2, 4]], ["tile_k", "sp", [-1, 197]], ["auto_unroll_max_step", "ot", 64], ["unroll_explicit", "ot", 1]]}, "result": [[0.0857732608], 0, 13.890177965164185, 1670426238.0481393], "version": 0.2, "tvm_version": "0.11.dev0"}
{"input": ["opencl -keys=adreno,opencl,gpu -device=adreno -max_num_threads=256 -texture_spatial_limit=16384 -thread_warp_size=1", "batch_matmul.cuda", [["TENSOR", [12, 197, 197], "float16"], ["TENSOR", [12, 64, 197], "float16"], [12, 197, 64], "float16", 0, 1], {}], "config": {"index": 560, "code_hash": null, "entity": [["tile_y", "sp", [-1, 1, 197]], ["tile_x", "sp", [-1, 1, 8]], ["tile_k", "sp", [-1, 1]], ["auto_unroll_max_step", "ot", 64], ["unroll_explicit", "ot", 0]]}, "result": [[0.039506969600000004], 0, 32.42698121070862, 1670426256.5962574], "version": 0.2, "tvm_version": "0.11.dev0"}
{"input": ["opencl -keys=adreno,opencl,gpu -device=adreno -max_num_threads=256 -texture_spatial_limit=16384 -thread_warp_size=1", "batch_matmul.cuda", [["TENSOR", [12, 197, 197], "float16"], ["TENSOR", [12, 64, 197], "float16"], [12, 197, 64], "float16", 0, 1], {}], "config": {"index": 1233, "code_hash": null, "entity": [["tile_y", "sp", [-1, 1, 1]], ["tile_x", "sp", [-1, 2, 8]], ["tile_k", "sp", [-1, 1]], ["auto_unroll_max_step", "ot", 64], ["unroll_explicit", "ot", 1]]}, "result": [[0.06447706624], 0, 10.748590230941772, 1670426281.805248], "version": 0.2, "tvm_version": "0.11.dev0"}
{"input": ["opencl -keys=adreno,opencl,gpu -device=adreno -max_num_threads=256 -texture_spatial_limit=16384 -thread_warp_size=1", "batch_matmul.cuda", [["TENSOR", [12, 197, 197], "float16"], ["TENSOR", [12, 64, 197], "float16"], [12, 197, 64], "float16", 0, 1], {}], "config": {"index": 531, "code_hash": null, "entity": [["tile_y", "sp", [-1, 1, 1]], ["tile_x", "sp", [-1, 4, 2]], ["tile_k", "sp", [-1, 1]], ["auto_unroll_max_step", "ot", 64], ["unroll_explicit", "ot", 0]]}, "result": [[0.061014522880000005], 0, 10.049254655838013, 1670426281.2079363], "version": 0.2, "tvm_version": "0.11.dev0"}
{"input": ["opencl -keys=adreno,opencl,gpu -device=adreno -max_num_threads=256 -texture_spatial_limit=16384 -thread_warp_size=1", "batch_matmul.cuda", [["TENSOR", [12, 197, 197], "float16"], ["TENSOR", [12, 64, 197], "float16"], [12, 197, 64], "float16", 0, 1], {}], "config": {"index": 586, "code_hash": null, "entity": [["tile_y", "sp", [-1, 197, 1]], ["tile_x", "sp", [-1, 1, 64]], ["tile_k", "sp", [-1, 1]], ["auto_unroll_max_step", "ot", 64], ["unroll_explicit", "ot", 0]]}, "result": [[0.08011846144], 0, 22.96149730682373, 1670426294.145307], "version": 0.2, "tvm_version": "0.11.dev0"}
{"input": ["opencl -keys=adreno,opencl,gpu -device=adreno -max_num_threads=256 -texture_spatial_limit=16384 -thread_warp_size=1", "batch_matmul.cuda", [["TENSOR", [12, 197, 197], "float16"], ["TENSOR", [12, 64, 197], "float16"], [12, 197, 64], "float16", 0, 1], {}], "config": {"index": 32, "code_hash": null, "entity": [["tile_y", "sp", [-1, 1, 197]], ["tile_x", "sp", [-1, 8, 2]], ["tile_k", "sp", [-1, 1]], ["auto_unroll_max_step", "ot", 8], ["unroll_explicit", "ot", 0]]}, "result": [[0.02500672512], 0, 7.858368635177612, 1670426302.214697], "version": 0.2, "tvm_version": "0.11.dev0"}
{"input": ["opencl -keys=adreno,opencl,gpu -device=adreno -max_num_threads=256 -texture_spatial_limit=16384 -thread_warp_size=1", "batch_matmul.cuda", [["TENSOR", [12, 197, 197], "float16"], ["TENSOR", [12, 64, 197], "float16"], [12, 197, 64], "float16", 0, 1], {}], "config": {"index": 386, "code_hash": null, "entity": [["tile_y", "sp", [-1, 1, 197]], ["tile_x", "sp", [-1, 8, 4]], ["tile_k", "sp", [-1, 1]], ["auto_unroll_max_step", "ot", 32], ["unroll_explicit", "ot", 0]]}, "result": [[0.023855697919999995], 0, 4.406883239746094, 1670426298.7575748], "version": 0.2, "tvm_version": "0.11.dev0"}
{"input": ["opencl -keys=adreno,opencl,gpu -device=adreno -max_num_threads=256 -texture_spatial_limit=16384 -thread_warp_size=1", "batch_matmul.cuda", [["TENSOR", [12, 197, 197], "float16"], ["TENSOR", [12, 64, 197], "float16"], [12, 197, 64], "float16", 0, 1], {}], "config": {"index": 226, "code_hash": null, "entity": [["tile_y", "sp", [-1, 197, 1]], ["tile_x", "sp", [-1, 2, 8]], ["tile_k", "sp", [-1, 1]], ["auto_unroll_max_step", "ot", 16], ["unroll_explicit", "ot", 0]]}, "result": [[0.017571430399999997], 0, 3.43949031829834, 1670426297.8054576], "version": 0.2, "tvm_version": "0.11.dev0"}
{"input": ["opencl -keys=adreno,opencl,gpu -device=adreno -max_num_threads=256 -texture_spatial_limit=16384 -thread_warp_size=1", "batch_matmul.cuda", [["TENSOR", [12, 197, 197], "float16"], ["TENSOR", [12, 64, 197], "float16"], [12, 197, 64], "float16", 0, 1], {}], "config": {"index": 692, "code_hash": null, "entity": [["tile_y", "sp", [-1, 1, 197]], ["tile_x", "sp", [-1, 64, 1]], ["tile_k", "sp", [-1, 1]], ["auto_unroll_max_step", "ot", 8], ["unroll_explicit", "ot", 1]]}, "result": [[0.049312993279999995], 0, 8.223707675933838, 1670426310.8251152], "version": 0.2, "tvm_version": "0.11.dev0"}
{"input": ["opencl -keys=adreno,opencl,gpu -device=adreno -max_num_threads=256 -texture_spatial_limit=16384 -thread_warp_size=1", "batch_matmul.cuda", [["TENSOR", [12, 197, 197], "float16"], ["TENSOR", [12, 64, 197], "float16"], [12, 197, 64], "float16", 0, 1], {}], "config": {"index": 1155, "code_hash": null, "entity": [["tile_y", "sp", [-1, 1, 1]], ["tile_x", "sp", [-1, 8, 8]], ["tile_k", "sp", [-1, 197]], ["auto_unroll_max_step", "ot", 32], ["unroll_explicit", "ot", 1]]}, "result": [[0.09310793728], 0, 15.106316089630127, 1670426317.5497754], "version": 0.2, "tvm_version": "0.11.dev0"}
{"input": ["opencl -keys=adreno,opencl,gpu -device=adreno -max_num_threads=256 -texture_spatial_limit=16384 -thread_warp_size=1", "batch_matmul.cuda", [["TENSOR", [12, 197, 197], "float16"], ["TENSOR", [12, 64, 197], "float16"], [12, 197, 64], "float16", 0, 1], {}], "config": {"index": 606, "code_hash": null, "entity": [["tile_y", "sp", [-1, 1, 1]], ["tile_x", "sp", [-1, 64, 1]], ["tile_k", "sp", [-1, 197]], ["auto_unroll_max_step", "ot", 64], ["unroll_explicit", "ot", 0]]}, "result": [[0.02905722368], 0, 5.1041834354400635, 1670426335.5779378], "version": 0.2, "tvm_version": "0.11.dev0"}
{"input": ["opencl -keys=adreno,opencl,gpu -device=adreno -max_num_threads=256 -texture_spatial_limit=16384 -thread_warp_size=1", "batch_matmul.cuda", [["TENSOR", [12, 197, 197], "float16"], ["TENSOR", [12, 64, 197], "float16"], [12, 197, 64], "float16", 0, 1], {}], "config": {"index": 1058, "code_hash": null, "entity": [["tile_y", "sp", [-1, 1, 197]], ["tile_x", "sp", [-1, 8, 4]], ["tile_k", "sp", [-1, 1]], ["auto_unroll_max_step", "ot", 32], ["unroll_explicit", "ot", 1]]}, "result": [[0.02363601408], 0, 17.74050235748291, 1670426416.2736912], "version": 0.2, "tvm_version": "0.11.dev0"}
{"input": ["opencl -keys=adreno,opencl,gpu -device=adreno -max_num_threads=256 -texture_spatial_limit=16384 -thread_warp_size=1", "batch_matmul.cuda", [["TENSOR", [12, 197, 197], "float16"], ["TENSOR", [12, 64, 197], "float16"], [12, 197, 64], "float16", 0, 1], {}], "config": {"index": 890, "code_hash": null, "entity": [["tile_y", "sp", [-1, 1, 197]], ["tile_x", "sp", [-1, 8, 4]], ["tile_k", "sp", [-1, 1]], ["auto_unroll_max_step", "ot", 16], ["unroll_explicit", "ot", 1]]}, "result": [[0.023872711680000002], 0, 4.432929754257202, 1670426403.1508148], "version": 0.2, "tvm_version": "0.11.dev0"}
{"input": ["opencl -keys=adreno,opencl,gpu -device=adreno -max_num_threads=256 -texture_spatial_limit=16384 -thread_warp_size=1", "batch_matmul.cuda", [["TENSOR", [12, 197, 197], "float16"], ["TENSOR", [12, 64, 197], "float16"], [12, 197, 64], "float16", 0, 1], {}], "config": {"index": 563, "code_hash": null, "entity": [["tile_y", "sp", [-1, 1, 197]], ["tile_x", "sp", [-1, 2, 8]], ["tile_k", "sp", [-1, 1]], ["auto_unroll_max_step", "ot", 64], ["unroll_explicit", "ot", 0]]}, "result": [[0.02812550144], 0, 13.170813083648682, 1670426411.8764591], "version": 0.2, "tvm_version": "0.11.dev0"}
{"input": ["opencl -keys=adreno,opencl,gpu -device=adreno -max_num_threads=256 -texture_spatial_limit=16384 -thread_warp_size=1", "batch_matmul.cuda", [["TENSOR", [12, 197, 197], "float16"], ["TENSOR", [12, 64, 197], "float16"], [12, 197, 64], "float16", 0, 1], {}], "config": {"index": 722, "code_hash": null, "entity": [["tile_y", "sp", [-1, 1, 197]], ["tile_x", "sp", [-1, 8, 4]], ["tile_k", "sp", [-1, 1]], ["auto_unroll_max_step", "ot", 8], ["unroll_explicit", "ot", 1]]}, "result": [[0.023962787840000003], 0, 4.58085298538208, 1670426403.271439], "version": 0.2, "tvm_version": "0.11.dev0"}
{"input": ["opencl -keys=adreno,opencl,gpu -device=adreno -max_num_threads=256 -texture_spatial_limit=16384 -thread_warp_size=1", "batch_matmul.cuda", [["TENSOR", [12, 197, 197], "float16"], ["TENSOR", [12, 64, 197], "float16"], [12, 197, 64], "float16", 0, 1], {}], "config": {"index": 1226, "code_hash": null, "entity": [["tile_y", "sp", [-1, 1, 197]], ["tile_x", "sp", [-1, 8, 4]], ["tile_k", "sp", [-1, 1]], ["auto_unroll_max_step", "ot", 64], ["unroll_explicit", "ot", 1]]}, "result": [[0.02357621248], 0, 8.773247003555298, 1670426407.3375409], "version": 0.2, "tvm_version": "0.11.dev0"}
{"input": ["opencl -keys=adreno,opencl,gpu -device=adreno -max_num_threads=256 -texture_spatial_limit=16384 -thread_warp_size=1", "batch_matmul.cuda", [["TENSOR", [12, 197, 197], "float16"], ["TENSOR", [12, 64, 197], "float16"], [12, 197, 64], "float16", 0, 1], {}], "config": {"index": 1275, "code_hash": null, "entity": [["tile_y", "sp", [-1, 1, 1]], ["tile_x", "sp", [-1, 32, 1]], ["tile_k", "sp", [-1, 197]], ["auto_unroll_max_step", "ot", 64], ["unroll_explicit", "ot", 1]]}, "result": [[0.0149614848], 0, 7.635610818862915, 1670426406.2956846], "version": 0.2, "tvm_version": "0.11.dev0"}
{"input": ["opencl -keys=adreno,opencl,gpu -device=adreno -max_num_threads=256 -texture_spatial_limit=16384 -thread_warp_size=1", "batch_matmul.cuda", [["TENSOR", [12, 197, 197], "float16"], ["TENSOR", [12, 64, 197], "float16"], [12, 197, 64], "float16", 0, 1], {}], "config": {"index": 562, "code_hash": null, "entity": [["tile_y", "sp", [-1, 197, 1]], ["tile_x", "sp", [-1, 2, 8]], ["tile_k", "sp", [-1, 1]], ["auto_unroll_max_step", "ot", 64], ["unroll_explicit", "ot", 0]]}, "result": [[0.0175857152], 0, 11.897100687026978, 1670426410.6000965], "version": 0.2, "tvm_version": "0.11.dev0"}
{"input": ["opencl -keys=adreno,opencl,gpu -device=adreno -max_num_threads=256 -texture_spatial_limit=16384 -thread_warp_size=1", "batch_matmul.cuda", [["TENSOR", [12, 197, 197], "float16"], ["TENSOR", [12, 64, 197], "float16"], [12, 197, 64], "float16", 0, 1], {}], "config": {"index": 395, "code_hash": null, "entity": [["tile_y", "sp", [-1, 1, 197]], ["tile_x", "sp", [-1, 2, 8]], ["tile_k", "sp", [-1, 1]], ["auto_unroll_max_step", "ot", 32], ["unroll_explicit", "ot", 0]]}, "result": [[0.02799857152], 0, 16.914609909057617, 1670426415.6299453], "version": 0.2, "tvm_version": "0.11.dev0"}
{"input": ["opencl -keys=adreno,opencl,gpu -device=adreno -max_num_threads=256 -texture_spatial_limit=16384 -thread_warp_size=1", "batch_matmul.cuda", [["TENSOR", [12, 197, 197], "float16"], ["TENSOR", [12, 64, 197], "float16"], [12, 197, 64], "float16", 0, 1], {}], "config": {"index": 1055, "code_hash": null, "entity": [["tile_y", "sp", [-1, 1, 197]], ["tile_x", "sp", [-1, 4, 4]], ["tile_k", "sp", [-1, 1]], ["auto_unroll_max_step", "ot", 32], ["unroll_explicit", "ot", 1]]}, "result": [[0.03248931328], 0, 5.69071102142334, 1670426422.2023475], "version": 0.2, "tvm_version": "0.11.dev0"}
{"input": ["opencl -keys=adreno,opencl,gpu -device=adreno -max_num_threads=256 -texture_spatial_limit=16384 -thread_warp_size=1", "batch_matmul.cuda", [["TENSOR", [12, 197, 197], "float16"], ["TENSOR", [12, 64, 197], "float16"], [12, 197, 64], "float16", 0, 1], {}], "config": {"index": 1040, "code_hash": null, "entity": [["tile_y", "sp", [-1, 1, 197]], ["tile_x", "sp", [-1, 8, 2]], ["tile_k", "sp", [-1, 1]], ["auto_unroll_max_step", "ot", 32], ["unroll_explicit", "ot", 1]]}, "result": [[0.03710498816], 0, 12.173278331756592, 1670426428.6839375], "version": 0.2, "tvm_version": "0.11.dev0"}
{"input": ["opencl -keys=adreno,opencl,gpu -device=adreno -max_num_threads=256 -texture_spatial_limit=16384 -thread_warp_size=1", "batch_matmul.cuda", [["TENSOR", [12, 197, 197], "float16"], ["TENSOR", [12, 64, 197], "float16"], [12, 197, 64], "float16", 0, 1], {}], "config": {"index": 218, "code_hash": null, "entity": [["tile_y", "sp", [-1, 1, 197]], ["tile_x", "sp", [-1, 8, 4]], ["tile_k", "sp", [-1, 1]], ["auto_unroll_max_step", "ot", 16], ["unroll_explicit", "ot", 0]]}, "result": [[0.023923742720000002], 0, 4.633695125579834, 1670426421.2005746], "version": 0.2, "tvm_version": "0.11.dev0"}
{"input": ["opencl -keys=adreno,opencl,gpu -device=adreno -max_num_threads=256 -texture_spatial_limit=16384 -thread_warp_size=1", "batch_matmul.cuda", [["TENSOR", [12, 197, 197], "float16"], ["TENSOR", [12, 64, 197], "float16"], [12, 197, 64], "float16", 0, 1], {}], "config": {"index": 1234, "code_hash": null, "entity": [["tile_y", "sp", [-1, 197, 1]], ["tile_x", "sp", [-1, 2, 8]], ["tile_k", "sp", [-1, 1]], ["auto_unroll_max_step", "ot", 64], ["unroll_explicit", "ot", 1]]}, "result": [[0.0023471820800000003], 0, 13.065551280975342, 1670426429.6407096], "version": 0.2, "tvm_version": "0.11.dev0"}
{"input": ["opencl -keys=adreno,opencl,gpu -device=adreno -max_num_threads=256 -texture_spatial_limit=16384 -thread_warp_size=1", "batch_matmul.cuda", [["TENSOR", [12, 197, 197], "float16"], ["TENSOR", [12, 64, 197], "float16"], [12, 197, 64], "float16", 0, 1], {}], "config": {"index": 1219, "code_hash": null, "entity": [["tile_y", "sp", [-1, 197, 1]], ["tile_x", "sp", [-1, 2, 4]], ["tile_k", "sp", [-1, 1]], ["auto_unroll_max_step", "ot", 64], ["unroll_explicit", "ot", 1]]}, "result": [[0.0027574118399999997], 0, 13.817188262939453, 1670426430.4056017], "version": 0.2, "tvm_version": "0.11.dev0"}
{"input": ["opencl -keys=adreno,opencl,gpu -device=adreno -max_num_threads=256 -texture_spatial_limit=16384 -thread_warp_size=1", "batch_matmul.cuda", [["TENSOR", [12, 197, 197], "float16"], ["TENSOR", [12, 64, 197], "float16"], [12, 197, 64], "float16", 0, 1], {}], "config": {"index": 1051, "code_hash": null, "entity": [["tile_y", "sp", [-1, 197, 1]], ["tile_x", "sp", [-1, 2, 4]], ["tile_k", "sp", [-1, 1]], ["auto_unroll_max_step", "ot", 32], ["unroll_explicit", "ot", 1]]}, "result": [[0.0027579084799999997], 0, 5.735395193099976, 1670426422.3206286], "version": 0.2, "tvm_version": "0.11.dev0"}
{"input": ["opencl -keys=adreno,opencl,gpu -device=adreno -max_num_threads=256 -texture_spatial_limit=16384 -thread_warp_size=1", "batch_matmul.cuda", [["TENSOR", [12, 197, 197], "float16"], ["TENSOR", [12, 64, 197], "float16"], [12, 197, 64], "float16", 0, 1], {}], "config": {"index": 1223, "code_hash": null, "entity": [["tile_y", "sp", [-1, 1, 197]], ["tile_x", "sp", [-1, 4, 4]], ["tile_k", "sp", [-1, 1]], ["auto_unroll_max_step", "ot", 64], ["unroll_explicit", "ot", 1]]}, "result": [[0.03251346944], 0, 11.506509065628052, 1670426427.998324], "version": 0.2, "tvm_version": "0.11.dev0"}
{"input": ["opencl -keys=adreno,opencl,gpu -device=adreno -max_num_threads=256 -texture_spatial_limit=16384 -thread_warp_size=1", "batch_matmul.cuda", [["TENSOR", [12, 197, 197], "float16"], ["TENSOR", [12, 64, 197], "float16"], [12, 197, 64], "float16", 0, 1], {}], "config": {"index": 883, "code_hash": null, "entity": [["tile_y", "sp", [-1, 197, 1]], ["tile_x", "sp", [-1, 2, 4]], ["tile_k", "sp", [-1, 1]], ["auto_unroll_max_step", "ot", 16], ["unroll_explicit", "ot", 1]]}, "result": [[0.0027569766399999996], 0, 12.602378606796265, 1670426429.1961613], "version": 0.2, "tvm_version": "0.11.dev0"}
{"input": ["opencl -keys=adreno,opencl,gpu -device=adreno -max_num_threads=256 -texture_spatial_limit=16384 -thread_warp_size=1", "batch_matmul.cuda", [["TENSOR", [12, 197, 197], "float16"], ["TENSOR", [12, 64, 197], "float16"], [12, 197, 64], "float16", 0, 1], {}], "config": {"index": 50, "code_hash": null, "entity": [["tile_y", "sp", [-1, 1, 197]], ["tile_x", "sp", [-1, 8, 4]], ["tile_k", "sp", [-1, 1]], ["auto_unroll_max_step", "ot", 8], ["unroll_explicit", "ot", 0]]}, "result": [[0.02410650112], 0, 10.539210796356201, 1670426441.3083992], "version": 0.2, "tvm_version": "0.11.dev0"}
{"input": ["opencl -keys=adreno,opencl,gpu -device=adreno -max_num_threads=256 -texture_spatial_limit=16384 -thread_warp_size=1", "batch_matmul.cuda", [["TENSOR", [12, 197, 197], "float16"], ["TENSOR", [12, 64, 197], "float16"], [12, 197, 64], "float16", 0, 1], {}], "config": {"index": 394, "code_hash": null, "entity": [["tile_y", "sp", [-1, 197, 1]], ["tile_x", "sp", [-1, 2, 8]], ["tile_k", "sp", [-1, 1]], ["auto_unroll_max_step", "ot", 32], ["unroll_explicit", "ot", 0]]}, "result": [[0.017573780480000002], 0, 18.146246671676636, 1670426448.9290955], "version": 0.2, "tvm_version": "0.11.dev0"}
{"input": ["opencl -keys=adreno,opencl,gpu -device=adreno -max_num_threads=256 -texture_spatial_limit=16384 -thread_warp_size=1", "batch_matmul.cuda", [["TENSOR", [12, 197, 197], "float16"], ["TENSOR", [12, 64, 197], "float16"], [12, 197, 64], "float16", 0, 1], {}], "config": {"index": 554, "code_hash": null, "entity": [["tile_y", "sp", [-1, 1, 197]], ["tile_x", "sp", [-1, 8, 4]], ["tile_k", "sp", [-1, 1]], ["auto_unroll_max_step", "ot", 64], ["unroll_explicit", "ot", 0]]}, "result": [[0.02404327424], 0, 4.700109958648682, 1670426435.4717498], "version": 0.2, "tvm_version": "0.11.dev0"}
{"input": ["opencl -keys=adreno,opencl,gpu -device=adreno -max_num_threads=256 -texture_spatial_limit=16384 -thread_warp_size=1", "batch_matmul.cuda", [["TENSOR", [12, 197, 197], "float16"], ["TENSOR", [12, 64, 197], "float16"], [12, 197, 64], "float16", 0, 1], {}], "config": {"index": 704, "code_hash": null, "entity": [["tile_y", "sp", [-1, 1, 197]], ["tile_x", "sp", [-1, 8, 2]], ["tile_k", "sp", [-1, 1]], ["auto_unroll_max_step", "ot", 8], ["unroll_explicit", "ot", 1]]}, "result": [[0.025316608], 0, 9.529024362564087, 1670426440.2692914], "version": 0.2, "tvm_version": "0.11.dev0"}
{"input": ["opencl -keys=adreno,opencl,gpu -device=adreno -max_num_threads=256 -texture_spatial_limit=16384 -thread_warp_size=1", "batch_matmul.cuda", [["TENSOR", [12, 197, 197], "float16"], ["TENSOR", [12, 64, 197], "float16"], [12, 197, 64], "float16", 0, 1], {}], "config": {"index": 887, "code_hash": null, "entity": [["tile_y", "sp", [-1, 1, 197]], ["tile_x", "sp", [-1, 4, 4]], ["tile_k", "sp", [-1, 1]], ["auto_unroll_max_step", "ot", 16], ["unroll_explicit", "ot", 1]]}, "result": [[0.03247753216], 0, 6.031885862350464, 1670426436.7245634], "version": 0.2, "tvm_version": "0.11.dev0"}
{"input": ["opencl -keys=adreno,opencl,gpu -device=adreno -max_num_threads=256 -texture_spatial_limit=16384 -thread_warp_size=1", "batch_matmul.cuda", [["TENSOR", [12, 197, 197], "float16"], ["TENSOR", [12, 64, 197], "float16"], [12, 197, 64], "float16", 0, 1], {}], "config": {"index": 1278, "code_hash": null, "entity": [["tile_y", "sp", [-1, 1, 1]], ["tile_x", "sp", [-1, 64, 1]], ["tile_k", "sp", [-1, 197]], ["auto_unroll_max_step", "ot", 64], ["unroll_explicit", "ot", 1]]}, "result": [[0.022358958080000005], 0, 13.709022045135498, 1670426444.48431], "version": 0.2, "tvm_version": "0.11.dev0"}
{"input": ["opencl -keys=adreno,opencl,gpu -device=adreno -max_num_threads=256 -texture_spatial_limit=16384 -thread_warp_size=1", "batch_matmul.cuda", [["TENSOR", [12, 197, 197], "float16"], ["TENSOR", [12, 64, 197], "float16"], [12, 197, 64], "float16", 0, 1], {}], "config": {"index": 1066, "code_hash": null, "entity": [["tile_y", "sp", [-1, 197, 1]], ["tile_x", "sp", [-1, 2, 8]], ["tile_k", "sp", [-1, 1]], ["auto_unroll_max_step", "ot", 32], ["unroll_explicit", "ot", 1]]}, "result": [[0.0023490816], 0, 14.72831654548645, 1670426445.4923441], "version": 0.2, "tvm_version": "0.11.dev0"}
{"input": ["opencl -keys=adreno,opencl,gpu -device=adreno -max_num_threads=256 -texture_spatial_limit=16384 -thread_warp_size=1", "batch_matmul.cuda", [["TENSOR", [12, 197, 197], "float16"], ["TENSOR", [12, 64, 197], "float16"], [12, 197, 64], "float16", 0, 1], {}], "config": {"index": 719, "code_hash": null, "entity": [["tile_y", "sp", [-1, 1, 197]], ["tile_x", "sp", [-1, 4, 4]], ["tile_k", "sp", [-1, 1]], ["auto_unroll_max_step", "ot", 8], ["unroll_explicit", "ot", 1]]}, "result": [[0.023188536319999998], 0, 14.813452243804932, 1670426445.5679204], "version": 0.2, "tvm_version": "0.11.dev0"}
{"input": ["opencl -keys=adreno,opencl,gpu -device=adreno -max_num_threads=256 -texture_spatial_limit=16384 -thread_warp_size=1", "batch_matmul.cuda", [["TENSOR", [12, 197, 197], "float16"], ["TENSOR", [12, 64, 197], "float16"], [12, 197, 64], "float16", 0, 1], {}], "config": {"index": 872, "code_hash": null, "entity": [["tile_y", "sp", [-1, 1, 197]], ["tile_x", "sp", [-1, 8, 2]], ["tile_k", "sp", [-1, 1]], ["auto_unroll_max_step", "ot", 16], ["unroll_explicit", "ot", 1]]}, "result": [[0.03717964288], 0, 15.741647243499756, 1670426464.8546362], "version": 0.2, "tvm_version": "0.11.dev0"}
{"input": ["opencl -keys=adreno,opencl,gpu -device=adreno -max_num_threads=256 -texture_spatial_limit=16384 -thread_warp_size=1", "batch_matmul.cuda", [["TENSOR", [12, 197, 197], "float16"], ["TENSOR", [12, 64, 197], "float16"], [12, 197, 64], "float16", 0, 1], {}], "config": {"index": 1208, "code_hash": null, "entity": [["tile_y", "sp", [-1, 1, 197]], ["tile_x", "sp", [-1, 8, 2]], ["tile_k", "sp", [-1, 1]], ["auto_unroll_max_step", "ot", 64], ["unroll_explicit", "ot", 1]]}, "result": [[0.03689450496], 0, 9.364531517028809, 1670426458.4726279], "version": 0.2, "tvm_version": "0.11.dev0"}
{"input": ["opencl -keys=adreno,opencl,gpu -device=adreno -max_num_threads=256 -texture_spatial_limit=16384 -thread_warp_size=1", "batch_matmul.cuda", [["TENSOR", [12, 197, 197], "float16"], ["TENSOR", [12, 64, 197], "float16"], [12, 197, 64], "float16", 0, 1], {}], "config": {"index": 1201, "code_hash": null, "entity": [["tile_y", "sp", [-1, 197, 1]], ["tile_x", "sp", [-1, 2, 2]], ["tile_k", "sp", [-1, 1]], ["auto_unroll_max_step", "ot", 64], ["unroll_explicit", "ot", 1]]}, "result": [[0.004029511679999999], 0, 2.943641185760498, 1670426452.1392848], "version": 0.2, "tvm_version": "0.11.dev0"}
{"input": ["opencl -keys=adreno,opencl,gpu -device=adreno -max_num_threads=256 -texture_spatial_limit=16384 -thread_warp_size=1", "batch_matmul.cuda", [["TENSOR", [12, 197, 197], "float16"], ["TENSOR", [12, 64, 197], "float16"], [12, 197, 64], "float16", 0, 1], {}], "config": {"index": 1033, "code_hash": null, "entity": [["tile_y", "sp", [-1, 197, 1]], ["tile_x", "sp", [-1, 2, 2]], ["tile_k", "sp", [-1, 1]], ["auto_unroll_max_step", "ot", 32], ["unroll_explicit", "ot", 1]]}, "result": [[0.004029020160000001], 0, 1.4523251056671143, 1670426450.6325889], "version": 0.2, "tvm_version": "0.11.dev0"}
{"input": ["opencl -keys=adreno,opencl,gpu -device=adreno -max_num_threads=256 -texture_spatial_limit=16384 -thread_warp_size=1", "batch_matmul.cuda", [["TENSOR", [12, 197, 197], "float16"], ["TENSOR", [12, 64, 197], "float16"], [12, 197, 64], "float16", 0, 1], {}], "config": {"index": 383, "code_hash": null, "entity": [["tile_y", "sp", [-1, 1, 197]], ["tile_x", "sp", [-1, 4, 4]], ["tile_k", "sp", [-1, 1]], ["auto_unroll_max_step", "ot", 32], ["unroll_explicit", "ot", 0]]}, "result": [[0.023360660480000003], 0, 4.43975830078125, 1670426453.6178668], "version": 0.2, "tvm_version": "0.11.dev0"}
{"input": ["opencl -keys=adreno,opencl,gpu -device=adreno -max_num_threads=256 -texture_spatial_limit=16384 -thread_warp_size=1", "batch_matmul.cuda", [["TENSOR", [12, 197, 197], "float16"], ["TENSOR", [12, 64, 197], "float16"], [12, 197, 64], "float16", 0, 1], {}], "config": {"index": 368, "code_hash": null, "entity": [["tile_y", "sp", [-1, 1, 197]], ["tile_x", "sp", [-1, 8, 2]], ["tile_k", "sp", [-1, 1]], ["auto_unroll_max_step", "ot", 32], ["unroll_explicit", "ot", 0]]}, "result": [[0.02518292992], 0, 10.398566007614136, 1670426459.5736423], "version": 0.2, "tvm_version": "0.11.dev0"}
{"input": ["opencl -keys=adreno,opencl,gpu -device=adreno -max_num_threads=256 -texture_spatial_limit=16384 -thread_warp_size=1", "batch_matmul.cuda", [["TENSOR", [12, 197, 197], "float16"], ["TENSOR", [12, 64, 197], "float16"], [12, 197, 64], "float16", 0, 1], {}], "config": {"index": 865, "code_hash": null, "entity": [["tile_y", "sp", [-1, 197, 1]], ["tile_x", "sp", [-1, 2, 2]], ["tile_k", "sp", [-1, 1]], ["auto_unroll_max_step", "ot", 16], ["unroll_explicit", "ot", 1]]}, "result": [[0.00402965504], 0, 5.757110595703125, 1670426454.9531372], "version": 0.2, "tvm_version": "0.11.dev0"}
{"input": ["opencl -keys=adreno,opencl,gpu -device=adreno -max_num_threads=256 -texture_spatial_limit=16384 -thread_warp_size=1", "batch_matmul.cuda", [["TENSOR", [12, 197, 197], "float16"], ["TENSOR", [12, 64, 197], "float16"], [12, 197, 64], "float16", 0, 1], {}], "config": {"index": 898, "code_hash": null, "entity": [["tile_y", "sp", [-1, 197, 1]], ["tile_x", "sp", [-1, 2, 8]], ["tile_k", "sp", [-1, 1]], ["auto_unroll_max_step", "ot", 16], ["unroll_explicit", "ot", 1]]}, "result": [[0.00235145216], 0, 12.223343849182129, 1670426461.3704464], "version": 0.2, "tvm_version": "0.11.dev0"}
{"input": ["opencl -keys=adreno,opencl,gpu -device=adreno -max_num_threads=256 -texture_spatial_limit=16384 -thread_warp_size=1", "batch_matmul.cuda", [["TENSOR", [12, 197, 197], "float16"], ["TENSOR", [12, 64, 197], "float16"], [12, 197, 64], "float16", 0, 1], {}], "config": {"index": 551, "code_hash": null, "entity": [["tile_y", "sp", [-1, 1, 197]], ["tile_x", "sp", [-1, 4, 4]], ["tile_k", "sp", [-1, 1]], ["auto_unroll_max_step", "ot", 64], ["unroll_explicit", "ot", 0]]}, "result": [[0.023342336], 0, 15.19550371170044, 1670426480.3363373], "version": 0.2, "tvm_version": "0.11.dev0"}
{"input": ["opencl -keys=adreno,opencl,gpu -device=adreno -max_num_threads=256 -texture_spatial_limit=16384 -thread_warp_size=1", "batch_matmul.cuda", [["TENSOR", [12, 197, 197], "float16"], ["TENSOR", [12, 64, 197], "float16"], [12, 197, 64], "float16", 0, 1], {}], "config": {"index": 1110, "code_hash": null, "entity": [["tile_y", "sp", [-1, 1, 1]], ["tile_x", "sp", [-1, 64, 1]], ["tile_k", "sp", [-1, 197]], ["auto_unroll_max_step", "ot", 32], ["unroll_explicit", "ot", 1]]}, "result": [[0.022360258560000002], 0, 10.379238367080688, 1670426475.529611], "version": 0.2, "tvm_version": "0.11.dev0"}
{"input": ["opencl -keys=adreno,opencl,gpu -device=adreno -max_num_threads=256 -texture_spatial_limit=16384 -thread_warp_size=1", "batch_matmul.cuda", [["TENSOR", [12, 197, 197], "float16"], ["TENSOR", [12, 64, 197], "float16"], [12, 197, 64], "float16", 0, 1], {}], "config": {"index": 1235, "code_hash": null, "entity": [["tile_y", "sp", [-1, 1, 197]], ["tile_x", "sp", [-1, 2, 8]], ["tile_k", "sp", [-1, 1]], ["auto_unroll_max_step", "ot", 64], ["unroll_explicit", "ot", 1]]}, "result": [[0.03917566464], 0, 6.9236741065979, 1670426471.9529462], "version": 0.2, "tvm_version": "0.11.dev0"}
{"input": ["opencl -keys=adreno,opencl,gpu -device=adreno -max_num_threads=256 -texture_spatial_limit=16384 -thread_warp_size=1", "batch_matmul.cuda", [["TENSOR", [12, 197, 197], "float16"], ["TENSOR", [12, 64, 197], "float16"], [12, 197, 64], "float16", 0, 1], {}], "config": {"index": 398, "code_hash": null, "entity": [["tile_y", "sp", [-1, 1, 197]], ["tile_x", "sp", [-1, 4, 8]], ["tile_k", "sp", [-1, 1]], ["auto_unroll_max_step", "ot", 32], ["unroll_explicit", "ot", 0]]}, "result": [[0.027817062400000002], 0, 15.566514730453491, 1670426480.6897826], "version": 0.2, "tvm_version": "0.11.dev0"}
{"input": ["opencl -keys=adreno,opencl,gpu -device=adreno -max_num_threads=256 -texture_spatial_limit=16384 -thread_warp_size=1", "batch_matmul.cuda", [["TENSOR", [12, 197, 197], "float16"], ["TENSOR", [12, 64, 197], "float16"], [12, 197, 64], "float16", 0, 1], {}], "config": {"index": 566, "code_hash": null, "entity": [["tile_y", "sp", [-1, 1, 197]], ["tile_x", "sp", [-1, 4, 8]], ["tile_k", "sp", [-1, 1]], ["auto_unroll_max_step", "ot", 64], ["unroll_explicit", "ot", 0]]}, "result": [[0.027707187199999997], 0, 5.157283306121826, 1670426470.27494], "version": 0.2, "tvm_version": "0.11.dev0"}
{"input": ["opencl -keys=adreno,opencl,gpu -device=adreno -max_num_threads=256 -texture_spatial_limit=16384 -thread_warp_size=1", "batch_matmul.cuda", [["TENSOR", [12, 197, 197], "float16"], ["TENSOR", [12, 64, 197], "float16"], [12, 197, 64], "float16", 0, 1], {}], "config": {"index": 939, "code_hash": null, "entity": [["tile_y", "sp", [-1, 1, 1]], ["tile_x", "sp", [-1, 32, 1]], ["tile_k", "sp", [-1, 197]], ["auto_unroll_max_step", "ot", 16], ["unroll_explicit", "ot", 1]]}, "result": [[0.01493341696], 0, 18.768860340118408, 1670426483.8664858], "version": 0.2, "tvm_version": "0.11.dev0"}
{"input": ["opencl -keys=adreno,opencl,gpu -device=adreno -max_num_threads=256 -texture_spatial_limit=16384 -thread_warp_size=1", "batch_matmul.cuda", [["TENSOR", [12, 197, 197], "float16"], ["TENSOR", [12, 64, 197], "float16"], [12, 197, 64], "float16", 0, 1], {}], "config": {"index": 1180, "code_hash": null, "entity": [["tile_y", "sp", [-1, 197, 1]], ["tile_x", "sp", [-1, 2, 1]], ["tile_k", "sp", [-1, 1]], ["auto_unroll_max_step", "ot", 64], ["unroll_explicit", "ot", 1]]}, "result": [[0.00699237888], 0, 16.815056562423706, 1670426481.9905066], "version": 0.2, "tvm_version": "0.11.dev0"}
{"input": ["opencl -keys=adreno,opencl,gpu -device=adreno -max_num_threads=256 -texture_spatial_limit=16384 -thread_warp_size=1", "batch_matmul.cuda", [["TENSOR", [12, 197, 197], "float16"], ["TENSOR", [12, 64, 197], "float16"], [12, 197, 64], "float16", 0, 1], {}], "config": {"index": 215, "code_hash": null, "entity": [["tile_y", "sp", [-1, 1, 197]], ["tile_x", "sp", [-1, 4, 4]], ["tile_k", "sp", [-1, 1]], ["auto_unroll_max_step", "ot", 16], ["unroll_explicit", "ot", 0]]}, "result": [[0.023135923200000002], 0, 10.946706771850586, 1670426476.0747833], "version": 0.2, "tvm_version": "0.11.dev0"}
{"input": ["opencl -keys=adreno,opencl,gpu -device=adreno -max_num_threads=256 -texture_spatial_limit=16384 -thread_warp_size=1", "batch_matmul.cuda", [["TENSOR", [12, 197, 197], "float16"], ["TENSOR", [12, 64, 197], "float16"], [12, 197, 64], "float16", 0, 1], {}], "config": {"index": 1012, "code_hash": null, "entity": [["tile_y", "sp", [-1, 197, 1]], ["tile_x", "sp", [-1, 2, 1]], ["tile_k", "sp", [-1, 1]], ["auto_unroll_max_step", "ot", 32], ["unroll_explicit", "ot", 1]]}, "result": [[0.00699172864], 0, 22.62811017036438, 1670426506.9036467], "version": 0.2, "tvm_version": "0.11.dev0"}
{"input": ["opencl -keys=adreno,opencl,gpu -device=adreno -max_num_threads=256 -texture_spatial_limit=16384 -thread_warp_size=1", "batch_matmul.cuda", [["TENSOR", [12, 197, 197], "float16"], ["TENSOR", [12, 64, 197], "float16"], [12, 197, 64], "float16", 0, 1], {}], "config": {"index": 844, "code_hash": null, "entity": [["tile_y", "sp", [-1, 197, 1]], ["tile_x", "sp", [-1, 2, 1]], ["tile_k", "sp", [-1, 1]], ["auto_unroll_max_step", "ot", 16], ["unroll_explicit", "ot", 1]]}, "result": [[0.00699047936], 0, 30.498629808425903, 1670426514.7733974], "version": 0.2, "tvm_version": "0.11.dev0"}
{"input": ["opencl -keys=adreno,opencl,gpu -device=adreno -max_num_threads=256 -texture_spatial_limit=16384 -thread_warp_size=1", "batch_matmul.cuda", [["TENSOR", [12, 197, 197], "float16"], ["TENSOR", [12, 64, 197], "float16"], [12, 197, 64], "float16", 0, 1], {}], "config": {"index": 1070, "code_hash": null, "entity": [["tile_y", "sp", [-1, 1, 197]], ["tile_x", "sp", [-1, 4, 8]], ["tile_k", "sp", [-1, 1]], ["auto_unroll_max_step", "ot", 32], ["unroll_explicit", "ot", 1]]}, "result": [[0.026909056], 0, 35.85803031921387, 1670426519.9580188], "version": 0.2, "tvm_version": "0.11.dev0"}
{"input": ["opencl -keys=adreno,opencl,gpu -device=adreno -max_num_threads=256 -texture_spatial_limit=16384 -thread_warp_size=1", "batch_matmul.cuda", [["TENSOR", [12, 197, 197], "float16"], ["TENSOR", [12, 64, 197], "float16"], [12, 197, 64], "float16", 0, 1], {}], "config": {"index": 47, "code_hash": null, "entity": [["tile_y", "sp", [-1, 1, 197]], ["tile_x", "sp", [-1, 4, 4]], ["tile_k", "sp", [-1, 1]], ["auto_unroll_max_step", "ot", 8], ["unroll_explicit", "ot", 0]]}, "result": [[0.02332031488], 0, 4.345315456390381, 1670426488.5783143], "version": 0.2, "tvm_version": "0.11.dev0"}
{"input": ["opencl -keys=adreno,opencl,gpu -device=adreno -max_num_threads=256 -texture_spatial_limit=16384 -thread_warp_size=1", "batch_matmul.cuda", [["TENSOR", [12, 197, 197], "float16"], ["TENSOR", [12, 64, 197], "float16"], [12, 197, 64], "float16", 0, 1], {}], "config": {"index": 200, "code_hash": null, "entity": [["tile_y", "sp", [-1, 1, 197]], ["tile_x", "sp", [-1, 8, 2]], ["tile_k", "sp", [-1, 1]], ["auto_unroll_max_step", "ot", 16], ["unroll_explicit", "ot", 0]]}, "result": [[0.0251065344], 0, 27.8890540599823, 1670426512.1228642], "version": 0.2, "tvm_version": "0.11.dev0"}
{"input": ["opencl -keys=adreno,opencl,gpu -device=adreno -max_num_threads=256 -texture_spatial_limit=16384 -thread_warp_size=1", "batch_matmul.cuda", [["TENSOR", [12, 197, 197], "float16"], ["TENSOR", [12, 64, 197], "float16"], [12, 197, 64], "float16", 0, 1], {}], "config": {"index": 1238, "code_hash": null, "entity": [["tile_y", "sp", [-1, 1, 197]], ["tile_x", "sp", [-1, 4, 8]], ["tile_k", "sp", [-1, 1]], ["auto_unroll_max_step", "ot", 64], ["unroll_explicit", "ot", 1]]}, "result": [[0.02706952704], 0, 5.1285364627838135, 1670426525.2777672], "version": 0.2, "tvm_version": "0.11.dev0"}
{"input": ["opencl -keys=adreno,opencl,gpu -device=adreno -max_num_threads=256 -texture_spatial_limit=16384 -thread_warp_size=1", "batch_matmul.cuda", [["TENSOR", [12, 197, 197], "float16"], ["TENSOR", [12, 64, 197], "float16"], [12, 197, 64], "float16", 0, 1], {}], "config": {"index": 1296, "code_hash": null, "entity": [["tile_y", "sp", [-1, 1, 1]], ["tile_x", "sp", [-1, 32, 2]], ["tile_k", "sp", [-1, 197]], ["auto_unroll_max_step", "ot", 64], ["unroll_explicit", "ot", 1]]}, "result": [[0.02533097984], 0, 20.087714195251465, 1670426540.3543313], "version": 0.2, "tvm_version": "0.11.dev0"}
{"input": ["opencl -keys=adreno,opencl,gpu -device=adreno -max_num_threads=256 -texture_spatial_limit=16384 -thread_warp_size=1", "batch_matmul.cuda", [["TENSOR", [12, 197, 197], "float16"], ["TENSOR", [12, 64, 197], "float16"], [12, 197, 64], "float16", 0, 1], {}], "config": {"index": 230, "code_hash": null, "entity": [["tile_y", "sp", [-1, 1, 197]], ["tile_x", "sp", [-1, 4, 8]], ["tile_k", "sp", [-1, 1]], ["auto_unroll_max_step", "ot", 16], ["unroll_explicit", "ot", 0]]}, "result": [[0.02763290624], 0, 9.945165395736694, 1670426530.2339761], "version": 0.2, "tvm_version": "0.11.dev0"}
{"input": ["opencl -keys=adreno,opencl,gpu -device=adreno -max_num_threads=256 -texture_spatial_limit=16384 -thread_warp_size=1", "batch_matmul.cuda", [["TENSOR", [12, 197, 197], "float16"], ["TENSOR", [12, 64, 197], "float16"], [12, 197, 64], "float16", 0, 1], {}], "config": {"index": 536, "code_hash": null, "entity": [["tile_y", "sp", [-1, 1, 197]], ["tile_x", "sp", [-1, 8, 2]], ["tile_k", "sp", [-1, 1]], ["auto_unroll_max_step", "ot", 64], ["unroll_explicit", "ot", 0]]}, "result": [[0.025212456959999997], 0, 12.225928544998169, 1670426532.5313375], "version": 0.2, "tvm_version": "0.11.dev0"}
{"input": ["opencl -keys=adreno,opencl,gpu -device=adreno -max_num_threads=256 -texture_spatial_limit=16384 -thread_warp_size=1", "batch_matmul.cuda", [["TENSOR", [12, 197, 197], "float16"], ["TENSOR", [12, 64, 197], "float16"], [12, 197, 64], "float16", 0, 1], {}], "config": {"index": 715, "code_hash": null, "entity": [["tile_y", "sp", [-1, 197, 1]], ["tile_x", "sp", [-1, 2, 4]], ["tile_k", "sp", [-1, 1]], ["auto_unroll_max_step", "ot", 8], ["unroll_explicit", "ot", 1]]}, "result": [[0.00275692544], 0, 7.689512491226196, 1670426528.0075793], "version": 0.2, "tvm_version": "0.11.dev0"}
{"input": ["opencl -keys=adreno,opencl,gpu -device=adreno -max_num_threads=256 -texture_spatial_limit=16384 -thread_warp_size=1", "batch_matmul.cuda", [["TENSOR", [12, 197, 197], "float16"], ["TENSOR", [12, 64, 197], "float16"], [12, 197, 64], "float16", 0, 1], {}], "config": {"index": 1067, "code_hash": null, "entity": [["tile_y", "sp", [-1, 1, 197]], ["tile_x", "sp", [-1, 2, 8]], ["tile_k", "sp", [-1, 1]], ["auto_unroll_max_step", "ot", 32], ["unroll_explicit", "ot", 1]]}, "result": [[0.03893796864], 0, 6.690372467041016, 1670426526.9027727], "version": 0.2, "tvm_version": "0.11.dev0"}
{"input": ["opencl -keys=adreno,opencl,gpu -device=adreno -max_num_threads=256 -texture_spatial_limit=16384 -thread_warp_size=1", "batch_matmul.cuda", [["TENSOR", [12, 197, 197], "float16"], ["TENSOR", [12, 64, 197], "float16"], [12, 197, 64], "float16", 0, 1], {}], "config": {"index": 942, "code_hash": null, "entity": [["tile_y", "sp", [-1, 1, 1]], ["tile_x", "sp", [-1, 64, 1]], ["tile_k", "sp", [-1, 197]], ["auto_unroll_max_step", "ot", 16], ["unroll_explicit", "ot", 1]]}, "result": [[0.02236251648], 0, 16.2873477935791, 1670426536.602115], "version": 0.2, "tvm_version": "0.11.dev0"}
{"input": ["opencl -keys=adreno,opencl,gpu -device=adreno -max_num_threads=256 -texture_spatial_limit=16384 -thread_warp_size=1", "batch_matmul.cuda", [["TENSOR", [12, 197, 197], "float16"], ["TENSOR", [12, 64, 197], "float16"], [12, 197, 64], "float16", 0, 1], {}], "config": {"index": 902, "code_hash": null, "entity": [["tile_y", "sp", [-1, 1, 197]], ["tile_x", "sp", [-1, 4, 8]], ["tile_k", "sp", [-1, 1]], ["auto_unroll_max_step", "ot", 16], ["unroll_explicit", "ot", 1]]}, "result": [[0.027403299840000003], 0, 15.612977266311646, 1670426535.883946], "version": 0.2, "tvm_version": "0.11.dev0"}
{"input": ["opencl -keys=adreno,opencl,gpu -device=adreno -max_num_threads=256 -texture_spatial_limit=16384 -thread_warp_size=1", "batch_matmul.cuda", [["TENSOR", [12, 197, 197], "float16"], ["TENSOR", [12, 64, 197], "float16"], [12, 197, 64], "float16", 0, 1], {}], "config": {"index": 59, "code_hash": null, "entity": [["tile_y", "sp", [-1, 1, 197]], ["tile_x", "sp", [-1, 2, 8]], ["tile_k", "sp", [-1, 1]], ["auto_unroll_max_step", "ot", 8], ["unroll_explicit", "ot", 0]]}, "result": [[0.027944908799999998], 0, 5.867646932601929, 1670426546.690162], "version": 0.2, "tvm_version": "0.11.dev0"}
{"input": ["opencl -keys=adreno,opencl,gpu -device=adreno -max_num_threads=256 -texture_spatial_limit=16384 -thread_warp_size=1", "batch_matmul.cuda", [["TENSOR", [12, 197, 197], "float16"], ["TENSOR", [12, 64, 197], "float16"], [12, 197, 64], "float16", 0, 1], {}], "config": {"index": 603, "code_hash": null, "entity": [["tile_y", "sp", [-1, 1, 1]], ["tile_x", "sp", [-1, 32, 1]], ["tile_k", "sp", [-1, 197]], ["auto_unroll_max_step", "ot", 64], ["unroll_explicit", "ot", 0]]}, "result": [[0.0243387648], 0, 8.76079511642456, 1670426549.6029954], "version": 0.2, "tvm_version": "0.11.dev0"}
{"input": ["opencl -keys=adreno,opencl,gpu -device=adreno -max_num_threads=256 -texture_spatial_limit=16384 -thread_warp_size=1", "batch_matmul.cuda", [["TENSOR", [12, 197, 197], "float16"], ["TENSOR", [12, 64, 197], "float16"], [12, 197, 64], "float16", 0, 1], {}], "config": {"index": 771, "code_hash": null, "entity": [["tile_y", "sp", [-1, 1, 1]], ["tile_x", "sp", [-1, 32, 1]], ["tile_k", "sp", [-1, 197]], ["auto_unroll_max_step", "ot", 8], ["unroll_explicit", "ot", 1]]}, "result": [[0.01492210688], 0, 19.126730918884277, 1670426559.9117277], "version": 0.2, "tvm_version": "0.11.dev0"}
