logs/vit_base_patch16_224.texture.float16.acc16.autotvm.log
{"input": ["opencl -keys=adreno,opencl,gpu -device=adreno -max_num_threads=256 -texture_spatial_limit=16384 -thread_warp_size=1", "dense_small_batch.gpu", [["TENSOR", [1, 768], "float16"], ["TENSOR", [1000, 768], "float16"], null, "float16"], {}], "config": {"index": 11, "code_hash": null, "entity": [["tile_k", "sp", [-1, 64]]]}, "result": [[8.617471999999999e-05], 0, 2.910460948944092, 1670425299.6538436], "version": 0.2, "tvm_version": "0.11.dev0"}
{"input": ["opencl -keys=adreno,opencl,gpu -device=adreno -max_num_threads=256 -texture_spatial_limit=16384 -thread_warp_size=1", "dense_small_batch.gpu", [["TENSOR", [197, 3072], "float16"], ["TENSOR", [768, 3072], "float16"], null, "float16"], {}], "config": {"index": 11, "code_hash": null, "entity": [["tile_k", "sp", [-1, 64]]]}, "result": [[0.03960142848], 0, 39.69706058502197, 1670425606.020887], "version": 0.2, "tvm_version": "0.11.dev0"}
{"input": ["opencl -keys=adreno,opencl,gpu -device=adreno -max_num_threads=256 -texture_spatial_limit=16384 -thread_warp_size=1", "dense_small_batch.gpu", [["TENSOR", [197, 768], "float16"], ["TENSOR", [3072, 768], "float16"], null, "float16"], {}], "config": {"index": 11, "code_hash": null, "entity": [["tile_k", "sp", [-1, 64]]]}, "result": [[0.0503207424], 0, 9.045226812362671, 1670426112.2792764], "version": 0.2, "tvm_version": "0.11.dev0"}
{"input": ["opencl -keys=adreno,opencl,gpu -device=adreno -max_num_threads=256 -texture_spatial_limit=16384 -thread_warp_size=1", "batch_matmul.cuda", [["TENSOR", [12, 197, 197], "float16"], ["TENSOR", [12, 64, 197], "float16"], [12, 197, 64], "float16", 0, 1], {}], "config": {"index": 1075, "code_hash": null, "entity": [["tile_y", "sp", [-1, 197, 1]], ["tile_x", "sp", [-1, 1, 16]], ["tile_k", "sp", [-1, 1]], ["auto_unroll_max_step", "ot", 32], ["unroll_explicit", "ot", 1]]}, "result": [[0.0018331187199999998], 0, 5.121325731277466, 1670426683.4770765], "version": 0.2, "tvm_version": "0.11.dev0"}
{"input": ["opencl -keys=adreno,opencl,gpu -device=adreno -max_num_threads=256 -texture_spatial_limit=16384 -thread_warp_size=1", "batch_matmul.cuda", [["TENSOR", [12, 197, 64], "float16"], ["TENSOR", [12, 197, 64], "float16"], [12, 197, 197], "float16", 0, 1], {}], "config": {"index": 73, "code_hash": null, "entity": [["tile_y", "sp", [-1, 197, 1]], ["tile_x", "sp", [-1, 1, 1]], ["tile_k", "sp", [-1, 2]], ["auto_unroll_max_step", "ot", 16], ["unroll_explicit", "ot", 0]]}, "result": [[0.00961956352], 0, 2.31375789642334, 1670427684.7912414], "version": 0.2, "tvm_version": "0.11.dev0"}
{"input": ["opencl -keys=adreno,opencl,gpu -device=adreno -max_num_threads=256 -texture_spatial_limit=16384 -thread_warp_size=1", "dense_small_batch.gpu", [["TENSOR", [197, 768], "float16"], ["TENSOR", [768, 768], "float16"], null, "float16"], {}], "config": {"index": 11, "code_hash": null, "entity": [["tile_k", "sp", [-1, 64]]]}, "result": [[0.01194344448], 0, 20.42158007621765, 1670429411.3628438], "version": 0.2, "tvm_version": "0.11.dev0"}
{"input": ["opencl -keys=adreno,opencl,gpu -device=adreno -max_num_threads=256 -texture_spatial_limit=16384 -thread_warp_size=1", "conv2d_nchwc.image2d", [["TENSOR", [1, 3, 224, 224], "float16"], ["TENSOR", [768, 3, 16, 16], "float16"], [16, 16], [0, 0, 0, 0], [1, 1], "float16"], {}], "config": {"index": 441173, "code_hash": null, "entity": [["tile_fc", "sp", [-1, 4, 8]], ["tile_y", "sp", [-1, 2, 8]], ["tile_x", "sp", [-1, 2, 1]], ["tile_rcc", "sp", [-1, 1]], ["tile_ry", "sp", [-1, 16]], ["tile_rx", "sp", [-1, 8]], ["auto_unroll_max_step", "ot", 512], ["unroll_explicit", "ot", 0]]}, "result": [[0.001052032], 0, 3.429022789001465, 1670433183.1412926], "version": 0.2, "tvm_version": "0.11.dev0"}
