sd888_log/ww50/conv2d_1_129_129_144x1_1_144_24/my_conv2d_nhwc_cuda.log.tmp
{"input": ["opencl -keys=opencl,gpu -max_num_threads=256", "conv2d_nhwc.cuda", [["TENSOR", [1, 129, 129, 144], "float16"], ["TENSOR", [1, 1, 144, 24], "float16"], [1, 1], [0, 0, 0, 0], [1, 1], "float16"], {}], "config": {"index": 28, "code_hash": null, "entity": [["tile_n", "ot", 4], ["tile_c", "ot", 2], ["num_thread_n", "ot", 4], ["num_thread_c", "ot", 8], ["vthread_n", "ot", 1], ["vthread_c", "ot", 1], ["step", "ot", 16]]}, "result": [[0.02810289686], 0, 6.339536428451538, 1639562855.9370198], "version": 0.2, "tvm_version": "0.8.dev0"}
{"input": ["opencl -keys=opencl,gpu -max_num_threads=256", "conv2d_nhwc.cuda", [["TENSOR", [1, 129, 129, 144], "float16"], ["TENSOR", [1, 1, 144, 24], "float16"], [1, 1], [0, 0, 0, 0], [1, 1], "float16"], {}], "config": {"index": 811, "code_hash": null, "entity": [["tile_n", "ot", 4], ["tile_c", "ot", 2], ["num_thread_n", "ot", 4], ["num_thread_c", "ot", 4], ["vthread_n", "ot", 1], ["vthread_c", "ot", 2], ["step", "ot", 32]]}, "result": [[0.060083768739999995], 0, 36.03800845146179, 1639562912.401376], "version": 0.2, "tvm_version": "0.8.dev0"}
{"input": ["opencl -keys=opencl,gpu -max_num_threads=256", "conv2d_nhwc.cuda", [["TENSOR", [1, 129, 129, 144], "float16"], ["TENSOR", [1, 1, 144, 24], "float16"], [1, 1], [0, 0, 0, 0], [1, 1], "float16"], {}], "config": {"index": 13, "code_hash": null, "entity": [["tile_n", "ot", 4], ["tile_c", "ot", 4], ["num_thread_n", "ot", 8], ["num_thread_c", "ot", 4], ["vthread_n", "ot", 1], ["vthread_c", "ot", 1], ["step", "ot", 16]]}, "result": [[0.04380086456], 0, 9.441336631774902, 1639562922.0597327], "version": 0.2, "tvm_version": "0.8.dev0"}
{"input": ["opencl -keys=opencl,gpu -max_num_threads=256", "conv2d_nhwc.cuda", [["TENSOR", [1, 129, 129, 144], "float16"], ["TENSOR", [1, 1, 144, 24], "float16"], [1, 1], [0, 0, 0, 0], [1, 1], "float16"], {}], "config": {"index": 855, "code_hash": null, "entity": [["tile_n", "ot", 2], ["tile_c", "ot", 2], ["num_thread_n", "ot", 16], ["num_thread_c", "ot", 8], ["vthread_n", "ot", 1], ["vthread_c", "ot", 2], ["step", "ot", 32]]}, "result": [[0.04583825102], 0, 10.100937604904175, 1639562953.7392573], "version": 0.2, "tvm_version": "0.8.dev0"}
{"input": ["opencl -keys=opencl,gpu -max_num_threads=256", "conv2d_nhwc.cuda", [["TENSOR", [1, 129, 129, 144], "float16"], ["TENSOR", [1, 1, 144, 24], "float16"], [1, 1], [0, 0, 0, 0], [1, 1], "float16"], {}], "config": {"index": 494, "code_hash": null, "entity": [["tile_n", "ot", 8], ["tile_c", "ot", 8], ["num_thread_n", "ot", 4], ["num_thread_c", "ot", 4], ["vthread_n", "ot", 1], ["vthread_c", "ot", 2], ["step", "ot", 3]]}, "result": [[0.06904394684], 0, 13.383224248886108, 1639562986.7794442], "version": 0.2, "tvm_version": "0.8.dev0"}
{"input": ["opencl -keys=opencl,gpu -max_num_threads=256", "conv2d_nhwc.cuda", [["TENSOR", [1, 129, 129, 144], "float16"], ["TENSOR", [1, 1, 144, 24], "float16"], [1, 1], [0, 0, 0, 0], [1, 1], "float16"], {}], "config": {"index": 64, "code_hash": null, "entity": [["tile_n", "ot", 4], ["tile_c", "ot", 2], ["num_thread_n", "ot", 8], ["num_thread_c", "ot", 16], ["vthread_n", "ot", 1], ["vthread_c", "ot", 1], ["step", "ot", 16]]}, "result": [[0.02687213646], 0, 19.730557441711426, 1639562993.0952528], "version": 0.2, "tvm_version": "0.8.dev0"}
{"input": ["opencl -keys=opencl,gpu -max_num_threads=256", "conv2d_nhwc.cuda", [["TENSOR", [1, 129, 129, 144], "float16"], ["TENSOR", [1, 1, 144, 24], "float16"], [1, 1], [0, 0, 0, 0], [1, 1], "float16"], {}], "config": {"index": 1152, "code_hash": null, "entity": [["tile_n", "ot", 2], ["tile_c", "ot", 2], ["num_thread_n", "ot", 16], ["num_thread_c", "ot", 4], ["vthread_n", "ot", 1], ["vthread_c", "ot", 2], ["step", "ot", 64]]}, "result": [[0.04553669374], 0, 9.882810592651367, 1639563113.5304923], "version": 0.2, "tvm_version": "0.8.dev0"}
{"input": ["opencl -keys=opencl,gpu -max_num_threads=256", "conv2d_nhwc.cuda", [["TENSOR", [1, 129, 129, 144], "float16"], ["TENSOR", [1, 1, 144, 24], "float16"], [1, 1], [0, 0, 0, 0], [1, 1], "float16"], {}], "config": {"index": 769, "code_hash": null, "entity": [["tile_n", "ot", 4], ["tile_c", "ot", 4], ["num_thread_n", "ot", 8], ["num_thread_c", "ot", 8], ["vthread_n", "ot", 2], ["vthread_c", "ot", 1], ["step", "ot", 32]]}, "result": [[0.03040741458], 0, 35.05391001701355, 1639563188.5960674], "version": 0.2, "tvm_version": "0.8.dev0"}
{"input": ["opencl -keys=opencl,gpu -max_num_threads=256", "conv2d_nhwc.cuda", [["TENSOR", [1, 129, 129, 144], "float16"], ["TENSOR", [1, 1, 144, 24], "float16"], [1, 1], [0, 0, 0, 0], [1, 1], "float16"], {}], "config": {"index": 238, "code_hash": null, "entity": [["tile_n", "ot", 4], ["tile_c", "ot", 4], ["num_thread_n", "ot", 16], ["num_thread_c", "ot", 16], ["vthread_n", "ot", 1], ["vthread_c", "ot", 2], ["step", "ot", 16]]}, "result": [[0.07497385726], 0, 31.66530966758728, 1639563220.4656136], "version": 0.2, "tvm_version": "0.8.dev0"}
{"input": ["opencl -keys=opencl,gpu -max_num_threads=256", "conv2d_nhwc.cuda", [["TENSOR", [1, 129, 129, 144], "float16"], ["TENSOR", [1, 1, 144, 24], "float16"], [1, 1], [0, 0, 0, 0], [1, 1], "float16"], {}], "config": {"index": 1020, "code_hash": null, "entity": [["tile_n", "ot", 2], ["tile_c", "ot", 4], ["num_thread_n", "ot", 16], ["num_thread_c", "ot", 8], ["vthread_n", "ot", 1], ["vthread_c", "ot", 1], ["step", "ot", 64]]}, "result": [[0.05386130518], 0, 11.2966890335083, 1639563232.0337222], "version": 0.2, "tvm_version": "0.8.dev0"}
{"input": ["opencl -keys=opencl,gpu -max_num_threads=256", "conv2d_nhwc.cuda", [["TENSOR", [1, 129, 129, 144], "float16"], ["TENSOR", [1, 1, 144, 24], "float16"], [1, 1], [0, 0, 0, 0], [1, 1], "float16"], {}], "config": {"index": 324, "code_hash": null, "entity": [["tile_n", "ot", 2], ["tile_c", "ot", 2], ["num_thread_n", "ot", 4], ["num_thread_c", "ot", 4], ["vthread_n", "ot", 1], ["vthread_c", "ot", 1], ["step", "ot", 3]]}, "result": [[0.057132512479999994], 0, 21.83492350578308, 1639563242.6093893], "version": 0.2, "tvm_version": "0.8.dev0"}
{"input": ["opencl -keys=opencl,gpu -max_num_threads=256", "conv2d_nhwc.cuda", [["TENSOR", [1, 129, 129, 144], "float16"], ["TENSOR", [1, 1, 144, 24], "float16"], [1, 1], [0, 0, 0, 0], [1, 1], "float16"], {}], "config": {"index": 1148, "code_hash": null, "entity": [["tile_n", "ot", 8], ["tile_c", "ot", 4], ["num_thread_n", "ot", 8], ["num_thread_c", "ot", 4], ["vthread_n", "ot", 1], ["vthread_c", "ot", 2], ["step", "ot", 64]]}, "result": [[0.05914138643999999], 0, 11.119654417037964, 1639563280.5796173], "version": 0.2, "tvm_version": "0.8.dev0"}
{"input": ["opencl -keys=opencl,gpu -max_num_threads=256", "conv2d_nhwc.cuda", [["TENSOR", [1, 129, 129, 144], "float16"], ["TENSOR", [1, 1, 144, 24], "float16"], [1, 1], [0, 0, 0, 0], [1, 1], "float16"], {}], "config": {"index": 1263, "code_hash": null, "entity": [["tile_n", "ot", 2], ["tile_c", "ot", 4], ["num_thread_n", "ot", 16], ["num_thread_c", "ot", 8], ["vthread_n", "ot", 2], ["vthread_c", "ot", 2], ["step", "ot", 64]]}, "result": [[0.0643777833], 0, 22.717698097229004, 1639563292.1203046], "version": 0.2, "tvm_version": "0.8.dev0"}
{"input": ["opencl -keys=opencl,gpu -max_num_threads=256", "conv2d_nhwc.cuda", [["TENSOR", [1, 129, 129, 144], "float16"], ["TENSOR", [1, 1, 144, 24], "float16"], [1, 1], [0, 0, 0, 0], [1, 1], "float16"], {}], "config": {"index": 158, "code_hash": null, "entity": [["tile_n", "ot", 8], ["tile_c", "ot", 4], ["num_thread_n", "ot", 16], ["num_thread_c", "ot", 16], ["vthread_n", "ot", 2], ["vthread_c", "ot", 1], ["step", "ot", 16]]}, "result": [[0.0741436208], 0, 13.265930414199829, 1639563305.6629312], "version": 0.2, "tvm_version": "0.8.dev0"}
{"input": ["opencl -keys=opencl,gpu -max_num_threads=256", "conv2d_nhwc.cuda", [["TENSOR", [1, 129, 129, 144], "float16"], ["TENSOR", [1, 1, 144, 24], "float16"], [1, 1], [0, 0, 0, 0], [1, 1], "float16"], {}], "config": {"index": 38, "code_hash": null, "entity": [["tile_n", "ot", 8], ["tile_c", "ot", 2], ["num_thread_n", "ot", 8], ["num_thread_c", "ot", 8], ["vthread_n", "ot", 1], ["vthread_c", "ot", 1], ["step", "ot", 16]]}, "result": [[0.028453433320000002], 0, 19.524250268936157, 1639563311.9066126], "version": 0.2, "tvm_version": "0.8.dev0"}
{"input": ["opencl -keys=opencl,gpu -max_num_threads=256", "conv2d_nhwc.cuda", [["TENSOR", [1, 129, 129, 144], "float16"], ["TENSOR", [1, 1, 144, 24], "float16"], [1, 1], [0, 0, 0, 0], [1, 1], "float16"], {}], "config": {"index": 331, "code_hash": null, "entity": [["tile_n", "ot", 4], ["tile_c", "ot", 8], ["num_thread_n", "ot", 4], ["num_thread_c", "ot", 4], ["vthread_n", "ot", 1], ["vthread_c", "ot", 1], ["step", "ot", 3]]}, "result": [[0.05743493228], 0, 10.804977178573608, 1639563322.9654968], "version": 0.2, "tvm_version": "0.8.dev0"}
{"input": ["opencl -keys=opencl,gpu -max_num_threads=256", "conv2d_nhwc.cuda", [["TENSOR", [1, 129, 129, 144], "float16"], ["TENSOR", [1, 1, 144, 24], "float16"], [1, 1], [0, 0, 0, 0], [1, 1], "float16"], {}], "config": {"index": 866, "code_hash": null, "entity": [["tile_n", "ot", 8], ["tile_c", "ot", 2], ["num_thread_n", "ot", 4], ["num_thread_c", "ot", 16], ["vthread_n", "ot", 1], ["vthread_c", "ot", 2], ["step", "ot", 32]]}, "result": [[0.029746082280000002], 0, 17.03921127319336, 1639563329.2523477], "version": 0.2, "tvm_version": "0.8.dev0"}
{"input": ["opencl -keys=opencl,gpu -max_num_threads=256", "conv2d_nhwc.cuda", [["TENSOR", [1, 129, 129, 144], "float16"], ["TENSOR", [1, 1, 144, 24], "float16"], [1, 1], [0, 0, 0, 0], [1, 1], "float16"], {}], "config": {"index": 490, "code_hash": null, "entity": [["tile_n", "ot", 4], ["tile_c", "ot", 4], ["num_thread_n", "ot", 4], ["num_thread_c", "ot", 4], ["vthread_n", "ot", 1], ["vthread_c", "ot", 2], ["step", "ot", 3]]}, "result": [[0.04959564268], 0, 9.709580898284912, 1639563339.230904], "version": 0.2, "tvm_version": "0.8.dev0"}
{"input": ["opencl -keys=opencl,gpu -max_num_threads=256", "conv2d_nhwc.cuda", [["TENSOR", [1, 129, 129, 144], "float16"], ["TENSOR", [1, 1, 144, 24], "float16"], [1, 1], [0, 0, 0, 0], [1, 1], "float16"], {}], "config": {"index": 1216, "code_hash": null, "entity": [["tile_n", "ot", 4], ["tile_c", "ot", 2], ["num_thread_n", "ot", 4], ["num_thread_c", "ot", 4], ["vthread_n", "ot", 2], ["vthread_c", "ot", 2], ["step", "ot", 64]]}, "result": [[0.06645699478], 0, 21.644214391708374, 1639563351.1714597], "version": 0.2, "tvm_version": "0.8.dev0"}
{"input": ["opencl -keys=opencl,gpu -max_num_threads=256", "conv2d_nhwc.cuda", [["TENSOR", [1, 129, 129, 144], "float16"], ["TENSOR", [1, 1, 144, 24], "float16"], [1, 1], [0, 0, 0, 0], [1, 1], "float16"], {}], "config": {"index": 1030, "code_hash": null, "entity": [["tile_n", "ot", 4], ["tile_c", "ot", 4], ["num_thread_n", "ot", 4], ["num_thread_c", "ot", 16], ["vthread_n", "ot", 1], ["vthread_c", "ot", 1], ["step", "ot", 64]]}, "result": [[0.07556074788], 0, 13.689026832580566, 1639563365.125833], "version": 0.2, "tvm_version": "0.8.dev0"}
{"input": ["opencl -keys=opencl,gpu -max_num_threads=256", "conv2d_nhwc.cuda", [["TENSOR", [1, 129, 129, 144], "float16"], ["TENSOR", [1, 1, 144, 24], "float16"], [1, 1], [0, 0, 0, 0], [1, 1], "float16"], {}], "config": {"index": 341, "code_hash": null, "entity": [["tile_n", "ot", 8], ["tile_c", "ot", 8], ["num_thread_n", "ot", 8], ["num_thread_c", "ot", 4], ["vthread_n", "ot", 1], ["vthread_c", "ot", 1], ["step", "ot", 3]]}, "result": [[0.04701215206], 0, 10.003124475479126, 1639563395.8489757], "version": 0.2, "tvm_version": "0.8.dev0"}
{"input": ["opencl -keys=opencl,gpu -max_num_threads=256", "conv2d_nhwc.cuda", [["TENSOR", [1, 129, 129, 144], "float16"], ["TENSOR", [1, 1, 144, 24], "float16"], [1, 1], [0, 0, 0, 0], [1, 1], "float16"], {}], "config": {"index": 1038, "code_hash": null, "entity": [["tile_n", "ot", 2], ["tile_c", "ot", 4], ["num_thread_n", "ot", 8], ["num_thread_c", "ot", 16], ["vthread_n", "ot", 1], ["vthread_c", "ot", 1], ["step", "ot", 64]]}, "result": [[0.06270266352], 0, 21.687135219573975, 1639563407.5236382], "version": 0.2, "tvm_version": "0.8.dev0"}
{"input": ["opencl -keys=opencl,gpu -max_num_threads=256", "conv2d_nhwc.cuda", [["TENSOR", [1, 129, 129, 144], "float16"], ["TENSOR", [1, 1, 144, 24], "float16"], [1, 1], [0, 0, 0, 0], [1, 1], "float16"], {}], "config": {"index": 103, "code_hash": null, "entity": [["tile_n", "ot", 4], ["tile_c", "ot", 4], ["num_thread_n", "ot", 16], ["num_thread_c", "ot", 4], ["vthread_n", "ot", 2], ["vthread_c", "ot", 1], ["step", "ot", 16]]}, "result": [[0.04801079582000001], 0, 10.575383186340332, 1639563523.624419], "version": 0.2, "tvm_version": "0.8.dev0"}
{"input": ["opencl -keys=opencl,gpu -max_num_threads=256", "conv2d_nhwc.cuda", [["TENSOR", [1, 129, 129, 144], "float16"], ["TENSOR", [1, 1, 144, 24], "float16"], [1, 1], [0, 0, 0, 0], [1, 1], "float16"], {}], "config": {"index": 430, "code_hash": null, "entity": [["tile_n", "ot", 4], ["tile_c", "ot", 8], ["num_thread_n", "ot", 16], ["num_thread_c", "ot", 4], ["vthread_n", "ot", 2], ["vthread_c", "ot", 1], ["step", "ot", 3]]}, "result": [[0.0730037656], 0, 24.991395235061646, 1639563538.0531976], "version": 0.2, "tvm_version": "0.8.dev0"}
{"input": ["opencl -keys=opencl,gpu -max_num_threads=256", "conv2d_nhwc.cuda", [["TENSOR", [1, 129, 129, 144], "float16"], ["TENSOR", [1, 1, 144, 24], "float16"], [1, 1], [0, 0, 0, 0], [1, 1], "float16"], {}], "config": {"index": 24, "code_hash": null, "entity": [["tile_n", "ot", 2], ["tile_c", "ot", 8], ["num_thread_n", "ot", 16], ["num_thread_c", "ot", 4], ["vthread_n", "ot", 1], ["vthread_c", "ot", 1], ["step", "ot", 16]]}, "result": [[0.06272587498], 0, 12.607032537460327, 1639563551.1971874], "version": 0.2, "tvm_version": "0.8.dev0"}
{"input": ["opencl -keys=opencl,gpu -max_num_threads=256", "conv2d_nhwc.cuda", [["TENSOR", [1, 129, 129, 144], "float16"], ["TENSOR", [1, 1, 144, 24], "float16"], [1, 1], [0, 0, 0, 0], [1, 1], "float16"], {}], "config": {"index": 397, "code_hash": null, "entity": [["tile_n", "ot", 4], ["tile_c", "ot", 2], ["num_thread_n", "ot", 16], ["num_thread_c", "ot", 16], ["vthread_n", "ot", 1], ["vthread_c", "ot", 1], ["step", "ot", 3]]}, "result": [[0.0623879906], 0, 11.804857969284058, 1639563591.4972656], "version": 0.2, "tvm_version": "0.8.dev0"}
{"input": ["opencl -keys=opencl,gpu -max_num_threads=256", "conv2d_nhwc.cuda", [["TENSOR", [1, 129, 129, 144], "float16"], ["TENSOR", [1, 1, 144, 24], "float16"], [1, 1], [0, 0, 0, 0], [1, 1], "float16"], {}], "config": {"index": 32, "code_hash": null, "entity": [["tile_n", "ot", 8], ["tile_c", "ot", 4], ["num_thread_n", "ot", 4], ["num_thread_c", "ot", 8], ["vthread_n", "ot", 1], ["vthread_c", "ot", 1], ["step", "ot", 16]]}, "result": [[0.029184977060000002], 0, 6.821990489959717, 1639563628.027148], "version": 0.2, "tvm_version": "0.8.dev0"}
{"input": ["opencl -keys=opencl,gpu -max_num_threads=256", "conv2d_nhwc.cuda", [["TENSOR", [1, 129, 129, 144], "float16"], ["TENSOR", [1, 1, 144, 24], "float16"], [1, 1], [0, 0, 0, 0], [1, 1], "float16"], {}], "config": {"index": 841, "code_hash": null, "entity": [["tile_n", "ot", 4], ["tile_c", "ot", 4], ["num_thread_n", "ot", 4], ["num_thread_c", "ot", 8], ["vthread_n", "ot", 1], ["vthread_c", "ot", 2], ["step", "ot", 32]]}, "result": [[0.04661427706000001], 0, 9.334618091583252, 1639563665.5284352], "version": 0.2, "tvm_version": "0.8.dev0"}
{"input": ["opencl -keys=opencl,gpu -max_num_threads=256", "conv2d_nhwc.cuda", [["TENSOR", [1, 129, 129, 144], "float16"], ["TENSOR", [1, 1, 144, 24], "float16"], [1, 1], [0, 0, 0, 0], [1, 1], "float16"], {}], "config": {"index": 291, "code_hash": null, "entity": [["tile_n", "ot", 2], ["tile_c", "ot", 4], ["num_thread_n", "ot", 16], ["num_thread_c", "ot", 8], ["vthread_n", "ot", 2], ["vthread_c", "ot", 2], ["step", "ot", 16]]}, "result": [[0.04579118644], 0, 10.394331216812134, 1639563716.3459435], "version": 0.2, "tvm_version": "0.8.dev0"}
{"input": ["opencl -keys=opencl,gpu -max_num_threads=256", "conv2d_nhwc.cuda", [["TENSOR", [1, 129, 129, 144], "float16"], ["TENSOR", [1, 1, 144, 24], "float16"], [1, 1], [0, 0, 0, 0], [1, 1], "float16"], {}], "config": {"index": 1019, "code_hash": null, "entity": [["tile_n", "ot", 8], ["tile_c", "ot", 2], ["num_thread_n", "ot", 16], ["num_thread_c", "ot", 8], ["vthread_n", "ot", 1], ["vthread_c", "ot", 1], ["step", "ot", 64]]}, "result": [[0.05087789164], 0, 19.866342306137085, 1639563725.8593779], "version": 0.2, "tvm_version": "0.8.dev0"}
{"input": ["opencl -keys=opencl,gpu -max_num_threads=256", "conv2d_nhwc.cuda", [["TENSOR", [1, 129, 129, 144], "float16"], ["TENSOR", [1, 1, 144, 24], "float16"], [1, 1], [0, 0, 0, 0], [1, 1], "float16"], {}], "config": {"index": 84, "code_hash": null, "entity": [["tile_n", "ot", 2], ["tile_c", "ot", 4], ["num_thread_n", "ot", 4], ["num_thread_c", "ot", 4], ["vthread_n", "ot", 2], ["vthread_c", "ot", 1], ["step", "ot", 16]]}, "result": [[0.0747318458], 0, 29.114341974258423, 1639563755.2344587], "version": 0.2, "tvm_version": "0.8.dev0"}
{"input": ["opencl -keys=opencl,gpu -max_num_threads=256", "conv2d_nhwc.cuda", [["TENSOR", [1, 129, 129, 144], "float16"], ["TENSOR", [1, 1, 144, 24], "float16"], [1, 1], [0, 0, 0, 0], [1, 1], "float16"], {}], "config": {"index": 788, "code_hash": null, "entity": [["tile_n", "ot", 8], ["tile_c", "ot", 4], ["num_thread_n", "ot", 4], ["num_thread_c", "ot", 16], ["vthread_n", "ot", 2], ["vthread_c", "ot", 1], ["step", "ot", 32]]}, "result": [[0.0352134375], 0, 53.581350326538086, 1639563809.1052306], "version": 0.2, "tvm_version": "0.8.dev0"}
{"input": ["opencl -keys=opencl,gpu -max_num_threads=256", "conv2d_nhwc.cuda", [["TENSOR", [1, 129, 129, 144], "float16"], ["TENSOR", [1, 1, 144, 24], "float16"], [1, 1], [0, 0, 0, 0], [1, 1], "float16"], {}], "config": {"index": 904, "code_hash": null, "entity": [["tile_n", "ot", 4], ["tile_c", "ot", 4], ["num_thread_n", "ot", 8], ["num_thread_c", "ot", 4], ["vthread_n", "ot", 2], ["vthread_c", "ot", 2], ["step", "ot", 32]]}, "result": [[0.0546414156], 0, 10.320447206497192, 1639563819.6552866], "version": 0.2, "tvm_version": "0.8.dev0"}
{"input": ["opencl -keys=opencl,gpu -max_num_threads=256", "conv2d_nhwc.cuda", [["TENSOR", [1, 129, 129, 144], "float16"], ["TENSOR", [1, 1, 144, 24], "float16"], [1, 1], [0, 0, 0, 0], [1, 1], "float16"], {}], "config": {"index": 829, "code_hash": null, "entity": [["tile_n", "ot", 4], ["tile_c", "ot", 2], ["num_thread_n", "ot", 16], ["num_thread_c", "ot", 4], ["vthread_n", "ot", 1], ["vthread_c", "ot", 2], ["step", "ot", 32]]}, "result": [[0.04392801874], 0, 18.741131067276, 1639563828.1169293], "version": 0.2, "tvm_version": "0.8.dev0"}
{"input": ["opencl -keys=opencl,gpu -max_num_threads=256", "conv2d_nhwc.cuda", [["TENSOR", [1, 129, 129, 144], "float16"], ["TENSOR", [1, 1, 144, 24], "float16"], [1, 1], [0, 0, 0, 0], [1, 1], "float16"], {}], "config": {"index": 71, "code_hash": null, "entity": [["tile_n", "ot", 8], ["tile_c", "ot", 8], ["num_thread_n", "ot", 8], ["num_thread_c", "ot", 16], ["vthread_n", "ot", 1], ["vthread_c", "ot", 1], ["step", "ot", 16]]}, "result": [[0.07032588018000001], 0, 59.824899673461914, 1639563888.244664], "version": 0.2, "tvm_version": "0.8.dev0"}
{"input": ["opencl -keys=opencl,gpu -max_num_threads=256", "conv2d_nhwc.cuda", [["TENSOR", [1, 129, 129, 144], "float16"], ["TENSOR", [1, 1, 144, 24], "float16"], [1, 1], [0, 0, 0, 0], [1, 1], "float16"], {}], "config": {"index": 378, "code_hash": null, "entity": [["tile_n", "ot", 2], ["tile_c", "ot", 2], ["num_thread_n", "ot", 4], ["num_thread_c", "ot", 16], ["vthread_n", "ot", 1], ["vthread_c", "ot", 1], ["step", "ot", 3]]}, "result": [[0.023882120819999998], 0, 5.676744699478149, 1639563894.2051826], "version": 0.2, "tvm_version": "0.8.dev0"}
{"input": ["opencl -keys=opencl,gpu -max_num_threads=256", "conv2d_nhwc.cuda", [["TENSOR", [1, 129, 129, 144], "float16"], ["TENSOR", [1, 1, 144, 24], "float16"], [1, 1], [0, 0, 0, 0], [1, 1], "float16"], {}], "config": {"index": 774, "code_hash": null, "entity": [["tile_n", "ot", 2], ["tile_c", "ot", 2], ["num_thread_n", "ot", 16], ["num_thread_c", "ot", 8], ["vthread_n", "ot", 2], ["vthread_c", "ot", 1], ["step", "ot", 32]]}, "result": [[0.0511822052], 0, 15.600889921188354, 1639563904.136297], "version": 0.2, "tvm_version": "0.8.dev0"}
{"input": ["opencl -keys=opencl,gpu -max_num_threads=256", "conv2d_nhwc.cuda", [["TENSOR", [1, 129, 129, 144], "float16"], ["TENSOR", [1, 1, 144, 24], "float16"], [1, 1], [0, 0, 0, 0], [1, 1], "float16"], {}], "config": {"index": 221, "code_hash": null, "entity": [["tile_n", "ot", 8], ["tile_c", "ot", 4], ["num_thread_n", "ot", 4], ["num_thread_c", "ot", 16], ["vthread_n", "ot", 1], ["vthread_c", "ot", 2], ["step", "ot", 16]]}, "result": [[0.02494271146], 0, 6.849903583526611, 1639563911.1867268], "version": 0.2, "tvm_version": "0.8.dev0"}
{"input": ["opencl -keys=opencl,gpu -max_num_threads=256", "conv2d_nhwc.cuda", [["TENSOR", [1, 129, 129, 144], "float16"], ["TENSOR", [1, 1, 144, 24], "float16"], [1, 1], [0, 0, 0, 0], [1, 1], "float16"], {}], "config": {"index": 932, "code_hash": null, "entity": [["tile_n", "ot", 8], ["tile_c", "ot", 4], ["num_thread_n", "ot", 8], ["num_thread_c", "ot", 8], ["vthread_n", "ot", 2], ["vthread_c", "ot", 2], ["step", "ot", 32]]}, "result": [[0.035883051019999994], 0, 14.458698987960815, 1639563918.8268576], "version": 0.2, "tvm_version": "0.8.dev0"}
{"input": ["opencl -keys=opencl,gpu -max_num_threads=256", "conv2d_nhwc.cuda", [["TENSOR", [1, 129, 129, 144], "float16"], ["TENSOR", [1, 1, 144, 24], "float16"], [1, 1], [0, 0, 0, 0], [1, 1], "float16"], {}], "config": {"index": 137, "code_hash": null, "entity": [["tile_n", "ot", 8], ["tile_c", "ot", 2], ["num_thread_n", "ot", 4], ["num_thread_c", "ot", 16], ["vthread_n", "ot", 2], ["vthread_c", "ot", 1], ["step", "ot", 16]]}, "result": [[0.01852823854], 0, 4.717633485794067, 1639563944.8083625], "version": 0.2, "tvm_version": "0.8.dev0"}
{"input": ["opencl -keys=opencl,gpu -max_num_threads=256", "conv2d_nhwc.cuda", [["TENSOR", [1, 129, 129, 144], "float16"], ["TENSOR", [1, 1, 144, 24], "float16"], [1, 1], [0, 0, 0, 0], [1, 1], "float16"], {}], "config": {"index": 218, "code_hash": null, "entity": [["tile_n", "ot", 8], ["tile_c", "ot", 2], ["num_thread_n", "ot", 4], ["num_thread_c", "ot", 16], ["vthread_n", "ot", 1], ["vthread_c", "ot", 2], ["step", "ot", 16]]}, "result": [[0.018445588519999997], 0, 10.53222393989563, 1639563950.6331766], "version": 0.2, "tvm_version": "0.8.dev0"}
{"input": ["opencl -keys=opencl,gpu -max_num_threads=256", "conv2d_nhwc.cuda", [["TENSOR", [1, 129, 129, 144], "float16"], ["TENSOR", [1, 1, 144, 24], "float16"], [1, 1], [0, 0, 0, 0], [1, 1], "float16"], {}], "config": {"index": 136, "code_hash": null, "entity": [["tile_n", "ot", 4], ["tile_c", "ot", 2], ["num_thread_n", "ot", 4], ["num_thread_c", "ot", 16], ["vthread_n", "ot", 2], ["vthread_c", "ot", 1], ["step", "ot", 16]]}, "result": [[0.01851414792], 0, 5.0003626346588135, 1639563955.888485], "version": 0.2, "tvm_version": "0.8.dev0"}
{"input": ["opencl -keys=opencl,gpu -max_num_threads=256", "conv2d_nhwc.cuda", [["TENSOR", [1, 129, 129, 144], "float16"], ["TENSOR", [1, 1, 144, 24], "float16"], [1, 1], [0, 0, 0, 0], [1, 1], "float16"], {}], "config": {"index": 56, "code_hash": null, "entity": [["tile_n", "ot", 8], ["tile_c", "ot", 2], ["num_thread_n", "ot", 4], ["num_thread_c", "ot", 16], ["vthread_n", "ot", 1], ["vthread_c", "ot", 1], ["step", "ot", 16]]}, "result": [[0.01853189062], 0, 10.164756298065186, 1639563961.0433657], "version": 0.2, "tvm_version": "0.8.dev0"}
{"input": ["opencl -keys=opencl,gpu -max_num_threads=256", "conv2d_nhwc.cuda", [["TENSOR", [1, 129, 129, 144], "float16"], ["TENSOR", [1, 1, 144, 24], "float16"], [1, 1], [0, 0, 0, 0], [1, 1], "float16"], {}], "config": {"index": 135, "code_hash": null, "entity": [["tile_n", "ot", 2], ["tile_c", "ot", 2], ["num_thread_n", "ot", 4], ["num_thread_c", "ot", 16], ["vthread_n", "ot", 2], ["vthread_c", "ot", 1], ["step", "ot", 16]]}, "result": [[0.018519725], 0, 5.722506523132324, 1639563967.1187117], "version": 0.2, "tvm_version": "0.8.dev0"}
{"input": ["opencl -keys=opencl,gpu -max_num_threads=256", "conv2d_nhwc.cuda", [["TENSOR", [1, 129, 129, 144], "float16"], ["TENSOR", [1, 1, 144, 24], "float16"], [1, 1], [0, 0, 0, 0], [1, 1], "float16"], {}], "config": {"index": 191, "code_hash": null, "entity": [["tile_n", "ot", 8], ["tile_c", "ot", 2], ["num_thread_n", "ot", 4], ["num_thread_c", "ot", 8], ["vthread_n", "ot", 1], ["vthread_c", "ot", 2], ["step", "ot", 16]]}, "result": [[0.025629491659999996], 0, 11.331823348999023, 1639563972.7293332], "version": 0.2, "tvm_version": "0.8.dev0"}
{"input": ["opencl -keys=opencl,gpu -max_num_threads=256", "conv2d_nhwc.cuda", [["TENSOR", [1, 129, 129, 144], "float16"], ["TENSOR", [1, 1, 144, 24], "float16"], [1, 1], [0, 0, 0, 0], [1, 1], "float16"], {}], "config": {"index": 217, "code_hash": null, "entity": [["tile_n", "ot", 4], ["tile_c", "ot", 2], ["num_thread_n", "ot", 4], ["num_thread_c", "ot", 16], ["vthread_n", "ot", 1], ["vthread_c", "ot", 2], ["step", "ot", 16]]}, "result": [[0.01846650102], 0, 5.12824821472168, 1639563978.1541953], "version": 0.2, "tvm_version": "0.8.dev0"}
{"input": ["opencl -keys=opencl,gpu -max_num_threads=256", "conv2d_nhwc.cuda", [["TENSOR", [1, 129, 129, 144], "float16"], ["TENSOR", [1, 1, 144, 24], "float16"], [1, 1], [0, 0, 0, 0], [1, 1], "float16"], {}], "config": {"index": 55, "code_hash": null, "entity": [["tile_n", "ot", 4], ["tile_c", "ot", 2], ["num_thread_n", "ot", 4], ["num_thread_c", "ot", 16], ["vthread_n", "ot", 1], ["vthread_c", "ot", 1], ["step", "ot", 16]]}, "result": [[0.01851878748], 0, 9.778409242630005, 1639563982.8124151], "version": 0.2, "tvm_version": "0.8.dev0"}
{"input": ["opencl -keys=opencl,gpu -max_num_threads=256", "conv2d_nhwc.cuda", [["TENSOR", [1, 129, 129, 144], "float16"], ["TENSOR", [1, 1, 144, 24], "float16"], [1, 1], [0, 0, 0, 0], [1, 1], "float16"], {}], "config": {"index": 54, "code_hash": null, "entity": [["tile_n", "ot", 2], ["tile_c", "ot", 2], ["num_thread_n", "ot", 4], ["num_thread_c", "ot", 16], ["vthread_n", "ot", 1], ["vthread_c", "ot", 1], ["step", "ot", 16]]}, "result": [[0.01852240312], 0, 4.908966302871704, 1639563987.9553165], "version": 0.2, "tvm_version": "0.8.dev0"}
{"input": ["opencl -keys=opencl,gpu -max_num_threads=256", "conv2d_nhwc.cuda", [["TENSOR", [1, 129, 129, 144], "float16"], ["TENSOR", [1, 1, 144, 24], "float16"], [1, 1], [0, 0, 0, 0], [1, 1], "float16"], {}], "config": {"index": 216, "code_hash": null, "entity": [["tile_n", "ot", 2], ["tile_c", "ot", 2], ["num_thread_n", "ot", 4], ["num_thread_c", "ot", 16], ["vthread_n", "ot", 1], ["vthread_c", "ot", 2], ["step", "ot", 16]]}, "result": [[0.018478367699999998], 0, 9.563375234603882, 1639563992.6207802], "version": 0.2, "tvm_version": "0.8.dev0"}
{"input": ["opencl -keys=opencl,gpu -max_num_threads=256", "conv2d_nhwc.cuda", [["TENSOR", [1, 129, 129, 144], "float16"], ["TENSOR", [1, 1, 144, 24], "float16"], [1, 1], [0, 0, 0, 0], [1, 1], "float16"], {}], "config": {"index": 190, "code_hash": null, "entity": [["tile_n", "ot", 4], ["tile_c", "ot", 2], ["num_thread_n", "ot", 4], ["num_thread_c", "ot", 8], ["vthread_n", "ot", 1], ["vthread_c", "ot", 2], ["step", "ot", 16]]}, "result": [[0.02564016354], 0, 6.892226696014404, 1639563999.8031023], "version": 0.2, "tvm_version": "0.8.dev0"}
{"input": ["opencl -keys=opencl,gpu -max_num_threads=256", "conv2d_nhwc.cuda", [["TENSOR", [1, 129, 129, 144], "float16"], ["TENSOR", [1, 1, 144, 24], "float16"], [1, 1], [0, 0, 0, 0], [1, 1], "float16"], {}], "config": {"index": 29, "code_hash": null, "entity": [["tile_n", "ot", 8], ["tile_c", "ot", 2], ["num_thread_n", "ot", 4], ["num_thread_c", "ot", 8], ["vthread_n", "ot", 1], ["vthread_c", "ot", 1], ["step", "ot", 16]]}, "result": [[0.02806224688], 0, 12.884163618087769, 1639564005.785039], "version": 0.2, "tvm_version": "0.8.dev0"}
{"input": ["opencl -keys=opencl,gpu -max_num_threads=256", "conv2d_nhwc.cuda", [["TENSOR", [1, 129, 129, 144], "float16"], ["TENSOR", [1, 1, 144, 24], "float16"], [1, 1], [0, 0, 0, 0], [1, 1], "float16"], {}], "config": {"index": 189, "code_hash": null, "entity": [["tile_n", "ot", 2], ["tile_c", "ot", 2], ["num_thread_n", "ot", 4], ["num_thread_c", "ot", 8], ["vthread_n", "ot", 1], ["vthread_c", "ot", 2], ["step", "ot", 16]]}, "result": [[0.02563672082], 0, 6.406222343444824, 1639564012.4337351], "version": 0.2, "tvm_version": "0.8.dev0"}
{"input": ["opencl -keys=opencl,gpu -max_num_threads=256", "conv2d_nhwc.cuda", [["TENSOR", [1, 129, 129, 144], "float16"], ["TENSOR", [1, 1, 144, 24], "float16"], [1, 1], [0, 0, 0, 0], [1, 1], "float16"], {}], "config": {"index": 194, "code_hash": null, "entity": [["tile_n", "ot", 8], ["tile_c", "ot", 4], ["num_thread_n", "ot", 4], ["num_thread_c", "ot", 8], ["vthread_n", "ot", 1], ["vthread_c", "ot", 2], ["step", "ot", 16]]}, "result": [[0.02951457914], 0, 12.80309510231018, 1639564018.8536613], "version": 0.2, "tvm_version": "0.8.dev0"}
{"input": ["opencl -keys=opencl,gpu -max_num_threads=256", "conv2d_nhwc.cuda", [["TENSOR", [1, 129, 129, 144], "float16"], ["TENSOR", [1, 1, 144, 24], "float16"], [1, 1], [0, 0, 0, 0], [1, 1], "float16"], {}], "config": {"index": 65, "code_hash": null, "entity": [["tile_n", "ot", 8], ["tile_c", "ot", 2], ["num_thread_n", "ot", 8], ["num_thread_c", "ot", 16], ["vthread_n", "ot", 1], ["vthread_c", "ot", 1], ["step", "ot", 16]]}, "result": [[0.02692868124], 0, 5.977951288223267, 1639564025.8714054], "version": 0.2, "tvm_version": "0.8.dev0"}
{"input": ["opencl -keys=opencl,gpu -max_num_threads=256", "conv2d_nhwc.cuda", [["TENSOR", [1, 129, 129, 144], "float16"], ["TENSOR", [1, 1, 144, 24], "float16"], [1, 1], [0, 0, 0, 0], [1, 1], "float16"], {}], "config": {"index": 200, "code_hash": null, "entity": [["tile_n", "ot", 8], ["tile_c", "ot", 2], ["num_thread_n", "ot", 8], ["num_thread_c", "ot", 8], ["vthread_n", "ot", 1], ["vthread_c", "ot", 2], ["step", "ot", 16]]}, "result": [[0.02565287708], 0, 12.509433507919312, 1639564032.4101903], "version": 0.2, "tvm_version": "0.8.dev0"}
{"input": ["opencl -keys=opencl,gpu -max_num_threads=256", "conv2d_nhwc.cuda", [["TENSOR", [1, 129, 129, 144], "float16"], ["TENSOR", [1, 1, 144, 24], "float16"], [1, 1], [0, 0, 0, 0], [1, 1], "float16"], {}], "config": {"index": 113, "code_hash": null, "entity": [["tile_n", "ot", 8], ["tile_c", "ot", 4], ["num_thread_n", "ot", 4], ["num_thread_c", "ot", 8], ["vthread_n", "ot", 2], ["vthread_c", "ot", 1], ["step", "ot", 16]]}, "result": [[0.029184008339999998], 0, 6.556266784667969, 1639564039.253682], "version": 0.2, "tvm_version": "0.8.dev0"}
{"input": ["opencl -keys=opencl,gpu -max_num_threads=256", "conv2d_nhwc.cuda", [["TENSOR", [1, 129, 129, 144], "float16"], ["TENSOR", [1, 1, 144, 24], "float16"], [1, 1], [0, 0, 0, 0], [1, 1], "float16"], {}], "config": {"index": 785, "code_hash": null, "entity": [["tile_n", "ot", 8], ["tile_c", "ot", 2], ["num_thread_n", "ot", 4], ["num_thread_c", "ot", 16], ["vthread_n", "ot", 2], ["vthread_c", "ot", 1], ["step", "ot", 32]]}, "result": [[0.0237093927], 0, 12.922701120376587, 1639564045.6265607], "version": 0.2, "tvm_version": "0.8.dev0"}
{"input": ["opencl -keys=opencl,gpu -max_num_threads=256", "conv2d_nhwc.cuda", [["TENSOR", [1, 129, 129, 144], "float16"], ["TENSOR", [1, 1, 144, 24], "float16"], [1, 1], [0, 0, 0, 0], [1, 1], "float16"], {}], "config": {"index": 193, "code_hash": null, "entity": [["tile_n", "ot", 4], ["tile_c", "ot", 4], ["num_thread_n", "ot", 4], ["num_thread_c", "ot", 8], ["vthread_n", "ot", 1], ["vthread_c", "ot", 2], ["step", "ot", 16]]}, "result": [[0.029569072919999998], 0, 9.382270812988281, 1639564055.271925], "version": 0.2, "tvm_version": "0.8.dev0"}
{"input": ["opencl -keys=opencl,gpu -max_num_threads=256", "conv2d_nhwc.cuda", [["TENSOR", [1, 129, 129, 144], "float16"], ["TENSOR", [1, 1, 144, 24], "float16"], [1, 1], [0, 0, 0, 0], [1, 1], "float16"], {}], "config": {"index": 27, "code_hash": null, "entity": [["tile_n", "ot", 2], ["tile_c", "ot", 2], ["num_thread_n", "ot", 4], ["num_thread_c", "ot", 8], ["vthread_n", "ot", 1], ["vthread_c", "ot", 1], ["step", "ot", 16]]}, "result": [[0.02809223644], 0, 21.569276332855225, 1639564067.4685237], "version": 0.2, "tvm_version": "0.8.dev0"}
{"input": ["opencl -keys=opencl,gpu -max_num_threads=256", "conv2d_nhwc.cuda", [["TENSOR", [1, 129, 129, 144], "float16"], ["TENSOR", [1, 1, 144, 24], "float16"], [1, 1], [0, 0, 0, 0], [1, 1], "float16"], {}], "config": {"index": 59, "code_hash": null, "entity": [["tile_n", "ot", 8], ["tile_c", "ot", 4], ["num_thread_n", "ot", 4], ["num_thread_c", "ot", 16], ["vthread_n", "ot", 1], ["vthread_c", "ot", 1], ["step", "ot", 16]]}, "result": [[0.024838294780000002], 0, 7.107767820358276, 1639564074.8070016], "version": 0.2, "tvm_version": "0.8.dev0"}
{"input": ["opencl -keys=opencl,gpu -max_num_threads=256", "conv2d_nhwc.cuda", [["TENSOR", [1, 129, 129, 144], "float16"], ["TENSOR", [1, 1, 144, 24], "float16"], [1, 1], [0, 0, 0, 0], [1, 1], "float16"], {}], "config": {"index": 31, "code_hash": null, "entity": [["tile_n", "ot", 4], ["tile_c", "ot", 4], ["num_thread_n", "ot", 4], ["num_thread_c", "ot", 8], ["vthread_n", "ot", 1], ["vthread_c", "ot", 1], ["step", "ot", 16]]}, "result": [[0.02919770206], 0, 14.853916645050049, 1639564082.5609756], "version": 0.2, "tvm_version": "0.8.dev0"}
{"input": ["opencl -keys=opencl,gpu -max_num_threads=256", "conv2d_nhwc.cuda", [["TENSOR", [1, 129, 129, 144], "float16"], ["TENSOR", [1, 1, 144, 24], "float16"], [1, 1], [0, 0, 0, 0], [1, 1], "float16"], {}], "config": {"index": 30, "code_hash": null, "entity": [["tile_n", "ot", 2], ["tile_c", "ot", 4], ["num_thread_n", "ot", 4], ["num_thread_c", "ot", 8], ["vthread_n", "ot", 1], ["vthread_c", "ot", 1], ["step", "ot", 16]]}, "result": [[0.02923496352], 0, 9.06110167503357, 1639564092.0964272], "version": 0.2, "tvm_version": "0.8.dev0"}
{"input": ["opencl -keys=opencl,gpu -max_num_threads=256", "conv2d_nhwc.cuda", [["TENSOR", [1, 129, 129, 144], "float16"], ["TENSOR", [1, 1, 144, 24], "float16"], [1, 1], [0, 0, 0, 0], [1, 1], "float16"], {}], "config": {"index": 112, "code_hash": null, "entity": [["tile_n", "ot", 4], ["tile_c", "ot", 4], ["num_thread_n", "ot", 4], ["num_thread_c", "ot", 8], ["vthread_n", "ot", 2], ["vthread_c", "ot", 1], ["step", "ot", 16]]}, "result": [[0.029190428120000004], 0, 17.19966197013855, 1639564100.2259603], "version": 0.2, "tvm_version": "0.8.dev0"}
{"input": ["opencl -keys=opencl,gpu -max_num_threads=256", "conv2d_nhwc.cuda", [["TENSOR", [1, 129, 129, 144], "float16"], ["TENSOR", [1, 1, 144, 24], "float16"], [1, 1], [0, 0, 0, 0], [1, 1], "float16"], {}], "config": {"index": 199, "code_hash": null, "entity": [["tile_n", "ot", 4], ["tile_c", "ot", 2], ["num_thread_n", "ot", 8], ["num_thread_c", "ot", 8], ["vthread_n", "ot", 1], ["vthread_c", "ot", 2], ["step", "ot", 16]]}, "result": [[0.025667175], 0, 8.00120234489441, 1639564108.429175], "version": 0.2, "tvm_version": "0.8.dev0"}
{"input": ["opencl -keys=opencl,gpu -max_num_threads=256", "conv2d_nhwc.cuda", [["TENSOR", [1, 129, 129, 144], "float16"], ["TENSOR", [1, 1, 144, 24], "float16"], [1, 1], [0, 0, 0, 0], [1, 1], "float16"], {}], "config": {"index": 37, "code_hash": null, "entity": [["tile_n", "ot", 4], ["tile_c", "ot", 2], ["num_thread_n", "ot", 8], ["num_thread_c", "ot", 8], ["vthread_n", "ot", 1], ["vthread_c", "ot", 1], ["step", "ot", 16]]}, "result": [[0.0284905198], 0, 17.511260271072388, 1639564117.9473305], "version": 0.2, "tvm_version": "0.8.dev0"}
{"input": ["opencl -keys=opencl,gpu -max_num_threads=256", "conv2d_nhwc.cuda", [["TENSOR", [1, 129, 129, 144], "float16"], ["TENSOR", [1, 1, 144, 24], "float16"], [1, 1], [0, 0, 0, 0], [1, 1], "float16"], {}], "config": {"index": 784, "code_hash": null, "entity": [["tile_n", "ot", 4], ["tile_c", "ot", 2], ["num_thread_n", "ot", 4], ["num_thread_c", "ot", 16], ["vthread_n", "ot", 2], ["vthread_c", "ot", 1], ["step", "ot", 32]]}, "result": [[0.02377890206], 0, 12.673884153366089, 1639564130.9097202], "version": 0.2, "tvm_version": "0.8.dev0"}
{"input": ["opencl -keys=opencl,gpu -max_num_threads=256", "conv2d_nhwc.cuda", [["TENSOR", [1, 129, 129, 144], "float16"], ["TENSOR", [1, 1, 144, 24], "float16"], [1, 1], [0, 0, 0, 0], [1, 1], "float16"], {}], "config": {"index": 192, "code_hash": null, "entity": [["tile_n", "ot", 2], ["tile_c", "ot", 4], ["num_thread_n", "ot", 4], ["num_thread_c", "ot", 8], ["vthread_n", "ot", 1], ["vthread_c", "ot", 2], ["step", "ot", 16]]}, "result": [[0.02951126354], 0, 20.60759973526001, 1639564138.823352], "version": 0.2, "tvm_version": "0.8.dev0"}
{"input": ["opencl -keys=opencl,gpu -max_num_threads=256", "conv2d_nhwc.cuda", [["TENSOR", [1, 129, 129, 144], "float16"], ["TENSOR", [1, 1, 144, 24], "float16"], [1, 1], [0, 0, 0, 0], [1, 1], "float16"], {}], "config": {"index": 111, "code_hash": null, "entity": [["tile_n", "ot", 2], ["tile_c", "ot", 4], ["num_thread_n", "ot", 4], ["num_thread_c", "ot", 8], ["vthread_n", "ot", 2], ["vthread_c", "ot", 1], ["step", "ot", 16]]}, "result": [[0.029194496880000004], 0, 13.413038969039917, 1639564152.7973547], "version": 0.2, "tvm_version": "0.8.dev0"}
{"input": ["opencl -keys=opencl,gpu -max_num_threads=256", "conv2d_nhwc.cuda", [["TENSOR", [1, 129, 129, 144], "float16"], ["TENSOR", [1, 1, 144, 24], "float16"], [1, 1], [0, 0, 0, 0], [1, 1], "float16"], {}], "config": {"index": 227, "code_hash": null, "entity": [["tile_n", "ot", 8], ["tile_c", "ot", 2], ["num_thread_n", "ot", 8], ["num_thread_c", "ot", 16], ["vthread_n", "ot", 1], ["vthread_c", "ot", 2], ["step", "ot", 16]]}, "result": [[0.02675964582], 0, 22.234801054000854, 1639564161.626647], "version": 0.2, "tvm_version": "0.8.dev0"}
{"input": ["opencl -keys=opencl,gpu -max_num_threads=256", "conv2d_nhwc.cuda", [["TENSOR", [1, 129, 129, 144], "float16"], ["TENSOR", [1, 1, 144, 24], "float16"], [1, 1], [0, 0, 0, 0], [1, 1], "float16"], {}], "config": {"index": 226, "code_hash": null, "entity": [["tile_n", "ot", 4], ["tile_c", "ot", 2], ["num_thread_n", "ot", 8], ["num_thread_c", "ot", 16], ["vthread_n", "ot", 1], ["vthread_c", "ot", 2], ["step", "ot", 16]]}, "result": [[0.02671024584], 0, 7.351704359054565, 1639564169.1820064], "version": 0.2, "tvm_version": "0.8.dev0"}
{"input": ["opencl -keys=opencl,gpu -max_num_threads=256", "conv2d_nhwc.cuda", [["TENSOR", [1, 129, 129, 144], "float16"], ["TENSOR", [1, 1, 144, 24], "float16"], [1, 1], [0, 0, 0, 0], [1, 1], "float16"], {}], "config": {"index": 198, "code_hash": null, "entity": [["tile_n", "ot", 2], ["tile_c", "ot", 2], ["num_thread_n", "ot", 8], ["num_thread_c", "ot", 8], ["vthread_n", "ot", 1], ["vthread_c", "ot", 2], ["step", "ot", 16]]}, "result": [[0.025661930200000002], 0, 15.749629497528076, 1639564177.5876253], "version": 0.2, "tvm_version": "0.8.dev0"}
{"input": ["opencl -keys=opencl,gpu -max_num_threads=256", "conv2d_nhwc.cuda", [["TENSOR", [1, 129, 129, 144], "float16"], ["TENSOR", [1, 1, 144, 24], "float16"], [1, 1], [0, 0, 0, 0], [1, 1], "float16"], {}], "config": {"index": 783, "code_hash": null, "entity": [["tile_n", "ot", 2], ["tile_c", "ot", 2], ["num_thread_n", "ot", 4], ["num_thread_c", "ot", 16], ["vthread_n", "ot", 2], ["vthread_c", "ot", 1], ["step", "ot", 32]]}, "result": [[0.02368361562], 0, 6.999896764755249, 1639564184.7931914], "version": 0.2, "tvm_version": "0.8.dev0"}
{"input": ["opencl -keys=opencl,gpu -max_num_threads=256", "conv2d_nhwc.cuda", [["TENSOR", [1, 129, 129, 144], "float16"], ["TENSOR", [1, 1, 144, 24], "float16"], [1, 1], [0, 0, 0, 0], [1, 1], "float16"], {}], "config": {"index": 63, "code_hash": null, "entity": [["tile_n", "ot", 2], ["tile_c", "ot", 2], ["num_thread_n", "ot", 8], ["num_thread_c", "ot", 16], ["vthread_n", "ot", 1], ["vthread_c", "ot", 1], ["step", "ot", 16]]}, "result": [[0.02689354792], 0, 14.757001399993896, 1639564192.628532], "version": 0.2, "tvm_version": "0.8.dev0"}
{"input": ["opencl -keys=opencl,gpu -max_num_threads=256", "conv2d_nhwc.cuda", [["TENSOR", [1, 129, 129, 144], "float16"], ["TENSOR", [1, 1, 144, 24], "float16"], [1, 1], [0, 0, 0, 0], [1, 1], "float16"], {}], "config": {"index": 794, "code_hash": null, "entity": [["tile_n", "ot", 8], ["tile_c", "ot", 2], ["num_thread_n", "ot", 8], ["num_thread_c", "ot", 16], ["vthread_n", "ot", 2], ["vthread_c", "ot", 1], ["step", "ot", 32]]}, "result": [[0.03586062812], 0, 9.231158256530762, 1639564202.0787873], "version": 0.2, "tvm_version": "0.8.dev0"}
{"input": ["opencl -keys=opencl,gpu -max_num_threads=256", "conv2d_nhwc.cuda", [["TENSOR", [1, 129, 129, 144], "float16"], ["TENSOR", [1, 1, 144, 24], "float16"], [1, 1], [0, 0, 0, 0], [1, 1], "float16"], {}], "config": {"index": 140, "code_hash": null, "entity": [["tile_n", "ot", 8], ["tile_c", "ot", 4], ["num_thread_n", "ot", 4], ["num_thread_c", "ot", 16], ["vthread_n", "ot", 2], ["vthread_c", "ot", 1], ["step", "ot", 16]]}, "result": [[0.024889381239999998], 0, 15.274021625518799, 1639564208.2053256], "version": 0.2, "tvm_version": "0.8.dev0"}
{"input": ["opencl -keys=opencl,gpu -max_num_threads=256", "conv2d_nhwc.cuda", [["TENSOR", [1, 129, 129, 144], "float16"], ["TENSOR", [1, 1, 144, 24], "float16"], [1, 1], [0, 0, 0, 0], [1, 1], "float16"], {}], "config": {"index": 220, "code_hash": null, "entity": [["tile_n", "ot", 4], ["tile_c", "ot", 4], ["num_thread_n", "ot", 4], ["num_thread_c", "ot", 16], ["vthread_n", "ot", 1], ["vthread_c", "ot", 2], ["step", "ot", 16]]}, "result": [[0.024934727079999996], 0, 7.213829040527344, 1639564215.6932125], "version": 0.2, "tvm_version": "0.8.dev0"}
{"input": ["opencl -keys=opencl,gpu -max_num_threads=256", "conv2d_nhwc.cuda", [["TENSOR", [1, 129, 129, 144], "float16"], ["TENSOR", [1, 1, 144, 24], "float16"], [1, 1], [0, 0, 0, 0], [1, 1], "float16"], {}], "config": {"index": 36, "code_hash": null, "entity": [["tile_n", "ot", 2], ["tile_c", "ot", 2], ["num_thread_n", "ot", 8], ["num_thread_c", "ot", 8], ["vthread_n", "ot", 1], ["vthread_c", "ot", 1], ["step", "ot", 16]]}, "result": [[0.02850842708], 0, 13.871531963348389, 1639564222.3633058], "version": 0.2, "tvm_version": "0.8.dev0"}
{"input": ["opencl -keys=opencl,gpu -max_num_threads=256", "conv2d_nhwc.cuda", [["TENSOR", [1, 129, 129, 144], "float16"], ["TENSOR", [1, 1, 144, 24], "float16"], [1, 1], [0, 0, 0, 0], [1, 1], "float16"], {}], "config": {"index": 41, "code_hash": null, "entity": [["tile_n", "ot", 8], ["tile_c", "ot", 4], ["num_thread_n", "ot", 8], ["num_thread_c", "ot", 8], ["vthread_n", "ot", 1], ["vthread_c", "ot", 1], ["step", "ot", 16]]}, "result": [[0.0290986979], 0, 6.918952703475952, 1639564229.5298574], "version": 0.2, "tvm_version": "0.8.dev0"}
{"input": ["opencl -keys=opencl,gpu -max_num_threads=256", "conv2d_nhwc.cuda", [["TENSOR", [1, 129, 129, 144], "float16"], ["TENSOR", [1, 1, 144, 24], "float16"], [1, 1], [0, 0, 0, 0], [1, 1], "float16"], {}], "config": {"index": 58, "code_hash": null, "entity": [["tile_n", "ot", 4], ["tile_c", "ot", 4], ["num_thread_n", "ot", 4], ["num_thread_c", "ot", 16], ["vthread_n", "ot", 1], ["vthread_c", "ot", 1], ["step", "ot", 16]]}, "result": [[0.02482066144], 0, 13.182601690292358, 1639564235.8514712], "version": 0.2, "tvm_version": "0.8.dev0"}
{"input": ["opencl -keys=opencl,gpu -max_num_threads=256", "conv2d_nhwc.cuda", [["TENSOR", [1, 129, 129, 144], "float16"], ["TENSOR", [1, 1, 144, 24], "float16"], [1, 1], [0, 0, 0, 0], [1, 1], "float16"], {}], "config": {"index": 713, "code_hash": null, "entity": [["tile_n", "ot", 8], ["tile_c", "ot", 2], ["num_thread_n", "ot", 8], ["num_thread_c", "ot", 16], ["vthread_n", "ot", 1], ["vthread_c", "ot", 1], ["step", "ot", 32]]}, "result": [[0.03586887708], 0, 7.934116840362549, 1639564244.0905116], "version": 0.2, "tvm_version": "0.8.dev0"}
{"input": ["opencl -keys=opencl,gpu -max_num_threads=256", "conv2d_nhwc.cuda", [["TENSOR", [1, 129, 129, 144], "float16"], ["TENSOR", [1, 1, 144, 24], "float16"], [1, 1], [0, 0, 0, 0], [1, 1], "float16"], {}], "config": {"index": 793, "code_hash": null, "entity": [["tile_n", "ot", 4], ["tile_c", "ot", 2], ["num_thread_n", "ot", 8], ["num_thread_c", "ot", 16], ["vthread_n", "ot", 2], ["vthread_c", "ot", 1], ["step", "ot", 32]]}, "result": [[0.03587020102], 0, 15.586519718170166, 1639564251.761147], "version": 0.2, "tvm_version": "0.8.dev0"}
{"input": ["opencl -keys=opencl,gpu -max_num_threads=256", "conv2d_nhwc.cuda", [["TENSOR", [1, 129, 129, 144], "float16"], ["TENSOR", [1, 1, 144, 24], "float16"], [1, 1], [0, 0, 0, 0], [1, 1], "float16"], {}], "config": {"index": 139, "code_hash": null, "entity": [["tile_n", "ot", 4], ["tile_c", "ot", 4], ["num_thread_n", "ot", 4], ["num_thread_c", "ot", 16], ["vthread_n", "ot", 2], ["vthread_c", "ot", 1], ["step", "ot", 16]]}, "result": [[0.02491519374], 0, 6.8972954750061035, 1639564259.0553966], "version": 0.2, "tvm_version": "0.8.dev0"}
{"input": ["opencl -keys=opencl,gpu -max_num_threads=256", "conv2d_nhwc.cuda", [["TENSOR", [1, 129, 129, 144], "float16"], ["TENSOR", [1, 1, 144, 24], "float16"], [1, 1], [0, 0, 0, 0], [1, 1], "float16"], {}], "config": {"index": 57, "code_hash": null, "entity": [["tile_n", "ot", 2], ["tile_c", "ot", 4], ["num_thread_n", "ot", 4], ["num_thread_c", "ot", 16], ["vthread_n", "ot", 1], ["vthread_c", "ot", 1], ["step", "ot", 16]]}, "result": [[0.024830821860000005], 0, 12.97475266456604, 1639564265.148573], "version": 0.2, "tvm_version": "0.8.dev0"}
{"input": ["opencl -keys=opencl,gpu -max_num_threads=256", "conv2d_nhwc.cuda", [["TENSOR", [1, 129, 129, 144], "float16"], ["TENSOR", [1, 1, 144, 24], "float16"], [1, 1], [0, 0, 0, 0], [1, 1], "float16"], {}], "config": {"index": 225, "code_hash": null, "entity": [["tile_n", "ot", 2], ["tile_c", "ot", 2], ["num_thread_n", "ot", 8], ["num_thread_c", "ot", 16], ["vthread_n", "ot", 1], ["vthread_c", "ot", 2], ["step", "ot", 16]]}, "result": [[0.02670102708], 0, 6.457226514816284, 1639564271.9331763], "version": 0.2, "tvm_version": "0.8.dev0"}
{"input": ["opencl -keys=opencl,gpu -max_num_threads=256", "conv2d_nhwc.cuda", [["TENSOR", [1, 129, 129, 144], "float16"], ["TENSOR", [1, 1, 144, 24], "float16"], [1, 1], [0, 0, 0, 0], [1, 1], "float16"], {}], "config": {"index": 689, "code_hash": null, "entity": [["tile_n", "ot", 8], ["tile_c", "ot", 4], ["num_thread_n", "ot", 8], ["num_thread_c", "ot", 8], ["vthread_n", "ot", 1], ["vthread_c", "ot", 1], ["step", "ot", 32]]}, "result": [[0.030443898940000002], 0, 13.184222221374512, 1639564278.633647], "version": 0.2, "tvm_version": "0.8.dev0"}
{"input": ["opencl -keys=opencl,gpu -max_num_threads=256", "conv2d_nhwc.cuda", [["TENSOR", [1, 129, 129, 144], "float16"], ["TENSOR", [1, 1, 144, 24], "float16"], [1, 1], [0, 0, 0, 0], [1, 1], "float16"], {}], "config": {"index": 1037, "code_hash": null, "entity": [["tile_n", "ot", 8], ["tile_c", "ot", 2], ["num_thread_n", "ot", 8], ["num_thread_c", "ot", 16], ["vthread_n", "ot", 1], ["vthread_c", "ot", 1], ["step", "ot", 64]]}, "result": [[0.03716967812], 0, 14.209338426589966, 1639564293.1629999], "version": 0.2, "tvm_version": "0.8.dev0"}
{"input": ["opencl -keys=opencl,gpu -max_num_threads=256", "conv2d_nhwc.cuda", [["TENSOR", [1, 129, 129, 144], "float16"], ["TENSOR", [1, 1, 144, 24], "float16"], [1, 1], [0, 0, 0, 0], [1, 1], "float16"], {}], "config": {"index": 146, "code_hash": null, "entity": [["tile_n", "ot", 8], ["tile_c", "ot", 2], ["num_thread_n", "ot", 8], ["num_thread_c", "ot", 16], ["vthread_n", "ot", 2], ["vthread_c", "ot", 1], ["step", "ot", 16]]}, "result": [[0.02687495206], 0, 6.558156728744507, 1639564285.4859462], "version": 0.2, "tvm_version": "0.8.dev0"}
{"input": ["opencl -keys=opencl,gpu -max_num_threads=256", "conv2d_nhwc.cuda", [["TENSOR", [1, 129, 129, 144], "float16"], ["TENSOR", [1, 1, 144, 24], "float16"], [1, 1], [0, 0, 0, 0], [1, 1], "float16"], {}], "config": {"index": 145, "code_hash": null, "entity": [["tile_n", "ot", 4], ["tile_c", "ot", 2], ["num_thread_n", "ot", 8], ["num_thread_c", "ot", 16], ["vthread_n", "ot", 2], ["vthread_c", "ot", 1], ["step", "ot", 16]]}, "result": [[0.026959215600000003], 0, 6.439789533615112, 1639564299.890123], "version": 0.2, "tvm_version": "0.8.dev0"}
{"input": ["opencl -keys=opencl,gpu -max_num_threads=256", "conv2d_nhwc.cuda", [["TENSOR", [1, 129, 129, 144], "float16"], ["TENSOR", [1, 1, 144, 24], "float16"], [1, 1], [0, 0, 0, 0], [1, 1], "float16"], {}], "config": {"index": 14, "code_hash": null, "entity": [["tile_n", "ot", 8], ["tile_c", "ot", 4], ["num_thread_n", "ot", 8], ["num_thread_c", "ot", 4], ["vthread_n", "ot", 1], ["vthread_c", "ot", 1], ["step", "ot", 16]]}, "result": [[0.043895393719999995], 0, 15.26559591293335, 1639564308.7338803], "version": 0.2, "tvm_version": "0.8.dev0"}
{"input": ["opencl -keys=opencl,gpu -max_num_threads=256", "conv2d_nhwc.cuda", [["TENSOR", [1, 129, 129, 144], "float16"], ["TENSOR", [1, 1, 144, 24], "float16"], [1, 1], [0, 0, 0, 0], [1, 1], "float16"], {}], "config": {"index": 875, "code_hash": null, "entity": [["tile_n", "ot", 8], ["tile_c", "ot", 2], ["num_thread_n", "ot", 8], ["num_thread_c", "ot", 16], ["vthread_n", "ot", 1], ["vthread_c", "ot", 2], ["step", "ot", 32]]}, "result": [[0.03587300728], 0, 7.815969228744507, 1639564316.770237], "version": 0.2, "tvm_version": "0.8.dev0"}
{"input": ["opencl -keys=opencl,gpu -max_num_threads=256", "conv2d_nhwc.cuda", [["TENSOR", [1, 129, 129, 144], "float16"], ["TENSOR", [1, 1, 144, 24], "float16"], [1, 1], [0, 0, 0, 0], [1, 1], "float16"], {}], "config": {"index": 219, "code_hash": null, "entity": [["tile_n", "ot", 2], ["tile_c", "ot", 4], ["num_thread_n", "ot", 4], ["num_thread_c", "ot", 16], ["vthread_n", "ot", 1], ["vthread_c", "ot", 2], ["step", "ot", 16]]}, "result": [[0.024939142700000003], 0, 13.778769731521606, 1639564322.7664812], "version": 0.2, "tvm_version": "0.8.dev0"}
{"input": ["opencl -keys=opencl,gpu -max_num_threads=256", "conv2d_nhwc.cuda", [["TENSOR", [1, 129, 129, 144], "float16"], ["TENSOR", [1, 1, 144, 24], "float16"], [1, 1], [0, 0, 0, 0], [1, 1], "float16"], {}], "config": {"index": 686, "code_hash": null, "entity": [["tile_n", "ot", 8], ["tile_c", "ot", 2], ["num_thread_n", "ot", 8], ["num_thread_c", "ot", 8], ["vthread_n", "ot", 1], ["vthread_c", "ot", 1], ["step", "ot", 32]]}, "result": [[0.03874948436], 0, 13.966304302215576, 1639564337.0764418], "version": 0.2, "tvm_version": "0.8.dev0"}
{"input": ["opencl -keys=opencl,gpu -max_num_threads=256", "conv2d_nhwc.cuda", [["TENSOR", [1, 129, 129, 144], "float16"], ["TENSOR", [1, 1, 144, 24], "float16"], [1, 1], [0, 0, 0, 0], [1, 1], "float16"], {}], "config": {"index": 138, "code_hash": null, "entity": [["tile_n", "ot", 2], ["tile_c", "ot", 4], ["num_thread_n", "ot", 4], ["num_thread_c", "ot", 16], ["vthread_n", "ot", 2], ["vthread_c", "ot", 1], ["step", "ot", 16]]}, "result": [[0.02486520208], 0, 5.996333599090576, 1639564329.114909], "version": 0.2, "tvm_version": "0.8.dev0"}
{"input": ["opencl -keys=opencl,gpu -max_num_threads=256", "conv2d_nhwc.cuda", [["TENSOR", [1, 129, 129, 144], "float16"], ["TENSOR", [1, 1, 144, 24], "float16"], [1, 1], [0, 0, 0, 0], [1, 1], "float16"], {}], "config": {"index": 176, "code_hash": null, "entity": [["tile_n", "ot", 8], ["tile_c", "ot", 4], ["num_thread_n", "ot", 8], ["num_thread_c", "ot", 4], ["vthread_n", "ot", 1], ["vthread_c", "ot", 2], ["step", "ot", 16]]}, "result": [[0.03236566352], 0, 7.185148239135742, 1639564344.5522945], "version": 0.2, "tvm_version": "0.8.dev0"}
{"input": ["opencl -keys=opencl,gpu -max_num_threads=256", "conv2d_nhwc.cuda", [["TENSOR", [1, 129, 129, 144], "float16"], ["TENSOR", [1, 1, 144, 24], "float16"], [1, 1], [0, 0, 0, 0], [1, 1], "float16"], {}], "config": {"index": 874, "code_hash": null, "entity": [["tile_n", "ot", 4], ["tile_c", "ot", 2], ["num_thread_n", "ot", 8], ["num_thread_c", "ot", 16], ["vthread_n", "ot", 1], ["vthread_c", "ot", 2], ["step", "ot", 32]]}, "result": [[0.0358449531], 0, 16.502937078475952, 1639564353.8701012], "version": 0.2, "tvm_version": "0.8.dev0"}
{"input": ["opencl -keys=opencl,gpu -max_num_threads=256", "conv2d_nhwc.cuda", [["TENSOR", [1, 129, 129, 144], "float16"], ["TENSOR", [1, 1, 144, 24], "float16"], [1, 1], [0, 0, 0, 0], [1, 1], "float16"], {}], "config": {"index": 380, "code_hash": null, "entity": [["tile_n", "ot", 8], ["tile_c", "ot", 2], ["num_thread_n", "ot", 4], ["num_thread_c", "ot", 16], ["vthread_n", "ot", 1], ["vthread_c", "ot", 1], ["step", "ot", 3]]}, "result": [[0.02385018854], 0, 6.243237257003784, 1639564360.3710854], "version": 0.2, "tvm_version": "0.8.dev0"}
{"input": ["opencl -keys=opencl,gpu -max_num_threads=256", "conv2d_nhwc.cuda", [["TENSOR", [1, 129, 129, 144], "float16"], ["TENSOR", [1, 1, 144, 24], "float16"], [1, 1], [0, 0, 0, 0], [1, 1], "float16"], {}], "config": {"index": 955, "code_hash": null, "entity": [["tile_n", "ot", 4], ["tile_c", "ot", 2], ["num_thread_n", "ot", 8], ["num_thread_c", "ot", 16], ["vthread_n", "ot", 2], ["vthread_c", "ot", 2], ["step", "ot", 32]]}, "result": [[0.03587068436], 0, 13.680006980895996, 1639564367.839934], "version": 0.2, "tvm_version": "0.8.dev0"}
{"input": ["opencl -keys=opencl,gpu -max_num_threads=256", "conv2d_nhwc.cuda", [["TENSOR", [1, 129, 129, 144], "float16"], ["TENSOR", [1, 1, 144, 24], "float16"], [1, 1], [0, 0, 0, 0], [1, 1], "float16"], {}], "config": {"index": 848, "code_hash": null, "entity": [["tile_n", "ot", 8], ["tile_c", "ot", 2], ["num_thread_n", "ot", 8], ["num_thread_c", "ot", 8], ["vthread_n", "ot", 1], ["vthread_c", "ot", 2], ["step", "ot", 32]]}, "result": [[0.028372363540000004], 0, 13.310368776321411, 1639564381.443632], "version": 0.2, "tvm_version": "0.8.dev0"}
{"input": ["opencl -keys=opencl,gpu -max_num_threads=256", "conv2d_nhwc.cuda", [["TENSOR", [1, 129, 129, 144], "float16"], ["TENSOR", [1, 1, 144, 24], "float16"], [1, 1], [0, 0, 0, 0], [1, 1], "float16"], {}], "config": {"index": 865, "code_hash": null, "entity": [["tile_n", "ot", 4], ["tile_c", "ot", 2], ["num_thread_n", "ot", 4], ["num_thread_c", "ot", 16], ["vthread_n", "ot", 1], ["vthread_c", "ot", 2], ["step", "ot", 32]]}, "result": [[0.029802515619999997], 0, 6.721244812011719, 1639564374.8352127], "version": 0.2, "tvm_version": "0.8.dev0"}
{"input": ["opencl -keys=opencl,gpu -max_num_threads=256", "conv2d_nhwc.cuda", [["TENSOR", [1, 129, 129, 144], "float16"], ["TENSOR", [1, 1, 144, 24], "float16"], [1, 1], [0, 0, 0, 0], [1, 1], "float16"], {}], "config": {"index": 299, "code_hash": null, "entity": [["tile_n", "ot", 8], ["tile_c", "ot", 2], ["num_thread_n", "ot", 4], ["num_thread_c", "ot", 16], ["vthread_n", "ot", 2], ["vthread_c", "ot", 2], ["step", "ot", 16]]}, "result": [[0.018443281239999998], 0, 6.324825286865234, 1639564388.0549686], "version": 0.2, "tvm_version": "0.8.dev0"}
