sd888_log/ww06/vgg16.texture.float16.acc16.autotvm.log
{"input": ["opencl -keys=adreno,opencl,gpu -device=adreno -max_num_threads=256", "conv2d_nchwc.image2d", [["TENSOR", [1, 3, 224, 224], "float16"], ["TENSOR", [64, 3, 3, 3], "float16"], [1, 1], [1, 1, 1, 1], [1, 1], "float16"], {}], "config": {"index": 65012, "code_hash": null, "entity": [["tile_fc", "sp", [-1, 2, 8]], ["tile_y", "sp", [-1, 7, 8]], ["tile_x", "sp", [-1, 1, 2]], ["tile_rcc", "sp", [-1, 1]], ["tile_ry", "sp", [-1, 1]], ["tile_rx", "sp", [-1, 3]], ["auto_unroll_max_step", "ot", 1500], ["unroll_explicit", "ot", 0]]}, "result": [[0.00071384584], 0, 25.102376222610474, 1644080153.2999785], "version": 0.2, "tvm_version": "0.8.dev0"}
{"input": ["opencl -keys=adreno,opencl,gpu -device=adreno -max_num_threads=256", "conv2d_nchwc.image2d", [["TENSOR", [1, 64, 224, 224], "float16"], ["TENSOR", [64, 64, 3, 3], "float16"], [1, 1], [1, 1, 1, 1], [1, 1], "float16"], {}], "config": {"index": 295540, "code_hash": null, "entity": [["tile_fc", "sp", [-1, 2, 8]], ["tile_y", "sp", [-1, 4, 1]], ["tile_x", "sp", [-1, 2, 16]], ["tile_rcc", "sp", [-1, 1]], ["tile_ry", "sp", [-1, 3]], ["tile_rx", "sp", [-1, 1]], ["auto_unroll_max_step", "ot", 1500], ["unroll_explicit", "ot", 0]]}, "result": [[0.0074501010400000005], 0, 12.534122705459595, 1644085235.7979417], "version": 0.2, "tvm_version": "0.8.dev0"}
{"input": ["opencl -keys=adreno,opencl,gpu -device=adreno -max_num_threads=256", "conv2d_nchwc.image2d", [["TENSOR", [1, 64, 112, 112], "float16"], ["TENSOR", [128, 64, 3, 3], "float16"], [1, 1], [1, 1, 1, 1], [1, 1], "float16"], {}], "config": {"index": 140991, "code_hash": null, "entity": [["tile_fc", "sp", [-1, 2, 16]], ["tile_y", "sp", [-1, 7, 2]], ["tile_x", "sp", [-1, 1, 8]], ["tile_rcc", "sp", [-1, 16]], ["tile_ry", "sp", [-1, 3]], ["tile_rx", "sp", [-1, 3]], ["auto_unroll_max_step", "ot", 0], ["unroll_explicit", "ot", 0]]}, "result": [[0.0032770583399999997], 0, 8.794311761856079, 1644087747.0446074], "version": 0.2, "tvm_version": "0.8.dev0"}
{"input": ["opencl -keys=adreno,opencl,gpu -device=adreno -max_num_threads=256", "conv2d_nchwc.image2d", [["TENSOR", [1, 128, 112, 112], "float16"], ["TENSOR", [128, 128, 3, 3], "float16"], [1, 1], [1, 1, 1, 1], [1, 1], "float16"], {}], "config": {"index": 220506, "code_hash": null, "entity": [["tile_fc", "sp", [-1, 2, 8]], ["tile_y", "sp", [-1, 1, 1]], ["tile_x", "sp", [-1, 7, 8]], ["tile_rcc", "sp", [-1, 1]], ["tile_ry", "sp", [-1, 3]], ["tile_rx", "sp", [-1, 1]], ["auto_unroll_max_step", "ot", 512], ["unroll_explicit", "ot", 0]]}, "result": [[0.00661461666], 0, 7.063018560409546, 1644093643.6625733], "version": 0.2, "tvm_version": "0.8.dev0"}
{"input": ["opencl -keys=adreno,opencl,gpu -device=adreno -max_num_threads=256", "conv2d_nchwc.image2d", [["TENSOR", [1, 128, 56, 56], "float16"], ["TENSOR", [256, 128, 3, 3], "float16"], [1, 1], [1, 1, 1, 1], [1, 1], "float16"], {}], "config": {"index": 37421, "code_hash": null, "entity": [["tile_fc", "sp", [-1, 2, 32]], ["tile_y", "sp", [-1, 2, 1]], ["tile_x", "sp", [-1, 4, 14]], ["tile_rcc", "sp", [-1, 1]], ["tile_ry", "sp", [-1, 3]], ["tile_rx", "sp", [-1, 1]], ["auto_unroll_max_step", "ot", 0], ["unroll_explicit", "ot", 0]]}, "result": [[0.0039901437399999995], 0, 5.56917667388916, 1644100910.1326041], "version": 0.2, "tvm_version": "0.8.dev0"}
{"input": ["opencl -keys=adreno,opencl,gpu -device=adreno -max_num_threads=256", "conv2d_nchwc.image2d", [["TENSOR", [1, 256, 56, 56], "float16"], ["TENSOR", [256, 256, 3, 3], "float16"], [1, 1], [1, 1, 1, 1], [1, 1], "float16"], {}], "config": {"index": 154413, "code_hash": null, "entity": [["tile_fc", "sp", [-1, 1, 32]], ["tile_y", "sp", [-1, 1, 2]], ["tile_x", "sp", [-1, 8, 7]], ["tile_rcc", "sp", [-1, 1]], ["tile_ry", "sp", [-1, 1]], ["tile_rx", "sp", [-1, 1]], ["auto_unroll_max_step", "ot", 512], ["unroll_explicit", "ot", 0]]}, "result": [[0.00851255312], 0, 7.285207986831665, 1644105469.1604853], "version": 0.2, "tvm_version": "0.8.dev0"}
{"input": ["opencl -keys=adreno,opencl,gpu -device=adreno -max_num_threads=256", "conv2d_nchwc.image2d", [["TENSOR", [1, 256, 28, 28], "float16"], ["TENSOR", [512, 256, 3, 3], "float16"], [1, 1], [1, 1, 1, 1], [1, 1], "float16"], {}], "config": {"index": 177556, "code_hash": null, "entity": [["tile_fc", "sp", [-1, 2, 8]], ["tile_y", "sp", [-1, 2, 1]], ["tile_x", "sp", [-1, 4, 7]], ["tile_rcc", "sp", [-1, 1]], ["tile_ry", "sp", [-1, 3]], ["tile_rx", "sp", [-1, 1]], ["auto_unroll_max_step", "ot", 1500], ["unroll_explicit", "ot", 0]]}, "result": [[0.00458030938], 0, 2.521512269973755, 1644110213.564451], "version": 0.2, "tvm_version": "0.8.dev0"}
{"input": ["opencl -keys=adreno,opencl,gpu -device=adreno -max_num_threads=256", "conv2d_nchwc.image2d", [["TENSOR", [1, 512, 28, 28], "float16"], ["TENSOR", [512, 512, 3, 3], "float16"], [1, 1], [1, 1, 1, 1], [1, 1], "float16"], {}], "config": {"index": 111773, "code_hash": null, "entity": [["tile_fc", "sp", [-1, 2, 8]], ["tile_y", "sp", [-1, 2, 7]], ["tile_x", "sp", [-1, 4, 1]], ["tile_rcc", "sp", [-1, 1]], ["tile_ry", "sp", [-1, 3]], ["tile_rx", "sp", [-1, 1]], ["auto_unroll_max_step", "ot", 512], ["unroll_explicit", "ot", 0]]}, "result": [[0.00900522604], 0, 7.532039642333984, 1644113967.1967688], "version": 0.2, "tvm_version": "0.8.dev0"}
{"input": ["opencl -keys=adreno,opencl,gpu -device=adreno -max_num_threads=256", "conv2d_nchwc.image2d", [["TENSOR", [1, 512, 14, 14], "float16"], ["TENSOR", [512, 512, 3, 3], "float16"], [1, 1], [1, 1, 1, 1], [1, 1], "float16"], {}], "config": {"index": 245480, "code_hash": null, "entity": [["tile_fc", "sp", [-1, 2, 2]], ["tile_y", "sp", [-1, 8, 2]], ["tile_x", "sp", [-1, 1, 16]], ["tile_rcc", "sp", [-1, 1]], ["tile_ry", "sp", [-1, 3]], ["tile_rx", "sp", [-1, 3]], ["auto_unroll_max_step", "ot", 1500], ["unroll_explicit", "ot", 0]]}, "result": [[0.00269168228], 0, 2.8148910999298096, 1644117500.8815544], "version": 0.2, "tvm_version": "0.8.dev0"}
{"input": ["opencl -keys=adreno,opencl,gpu -device=adreno -max_num_threads=256", "dense_small_batch.cuda", [["TENSOR", [1, 4096], "float16"], ["TENSOR", [4096, 4096], "float16"], null, "float16"], {}], "config": {"index": 7, "code_hash": null, "entity": [["tile_k", "sp", [-1, 128]]]}, "result": [[0.00162616772], 0, 8.689372301101685, 1644118274.701621], "version": 0.2, "tvm_version": "0.8.dev0"}
{"input": ["opencl -keys=adreno,opencl,gpu -device=adreno -max_num_threads=256", "dense_small_batch.cuda", [["TENSOR", [1, 4096], "float16"], ["TENSOR", [1000, 4096], "float16"], null, "float16"], {}], "config": {"index": 7, "code_hash": null, "entity": [["tile_k", "sp", [-1, 128]]]}, "result": [[0.00046361769999999996], 0, 2.1325013637542725, 1644118343.559113], "version": 0.2, "tvm_version": "0.8.dev0"}
